user,subreddit,post,family,lang
0_0_0,Finland,You are full of it .,Germanic,Finnish
0_0_0,worldnews,"Shoud be *Goodspeak* . Or even better , *Bestspeak* , although it does n't roll off the tongue as weel as the original or *Goodspeak* ...",Germanic,Finnish
0_0_0,worldnews,"Screwdriver is a pretty good shiv , if the user is competent . Relatively cheap , anonymous and infinitely replaceable . And they usually cause internal damage that is more difficult to repair . Useless for slashing though .",Germanic,Finnish
0_0_0,videos,"Yeah , I found a mod that makes potions weigh 0.1 and most ingredients also . Another multiplies certain ingredient gathering results . http : //www.nexusmods.com/skyrim/mods/1036/ ? http : //www.nexusmods.com/skyrim/mods/16553/ ?",Germanic,Finnish
0_0_0,videos,They really should only be used for filtering likely drunk drivers from the population . Any *evidence* should be done by blood test or at least more sophisticated devices .,Germanic,Finnish
0_0_0,videos,The state must be prepared to then take any vehicle that someone lets her drive . After having been informed of her banned status of course . It 's the only way really..,Germanic,Finnish
0_0_0,videos,"Audiences that are not regularily annoyed by the fact that movie police often fail to use their major advantages , namely radio and organisation , are clear proof .",Germanic,Finnish
0_0_0,wikipedia,"It 'll be a long while though , if you define purpose by the meaning the builder gives it .",Germanic,Finnish
0_0_0,pcmasterrace,Stack of $ 1 notes I bet . If there were bigger notes in the stack they would 've been visible on top .,Germanic,Finnish
0_0_0,pcmasterrace,Looks like a commission-incentivized salesperson with was involved . : p,Germanic,Finnish
0_0_0,MilitaryPorn,What 's the other stuff ? Just information ? Are they using somekind of gliding canopy or something if they need navigation ?,Germanic,Finnish
0_0_0,interestingasfuck,"Ca n't say exactly which positions , but each phase of the cycle always happens in the same place where the piston side closes and then retreats from the wall . Pick one `` side '' of the piston to follow and just start following it from middle of either of the vertical walls . The first time the piston retreats from the wall the cavity is expanding and fuel is being taken in . Then the piston side compresses the fuel against the other wall . Then the ignition happens at some convenient position near the wall . The next time the piston side moves away from the wall is actually the work phase . When the work phase is over the piston side again approaches the wall and forces the exhaust out . When the piston side again meets the starting wall , the cycle is over and the next rotation begins with the fuel intake phase again . https : //upload.wikimedia.org/wikipedia/commons/f/fc/Wankel_Cycle_anim_en.gif",Germanic,Finnish
0_0_0,interestingasfuck,"Copy the URL and make a new post in the subreddit ? Very simple , I would 've thought ?",Germanic,Finnish
0_0_0,interestingasfuck,It also says above all that : `` Pain tolerance varies by person ... '' No need to push your anecdotes .,Germanic,Finnish
0_0_0,AskReddit,"The term is *slush-fund* , from [ the naval origin ] ( https : //en.wikipedia.org/wiki/Slush_fund # Etymology ) .",Germanic,Finnish
0_0_0,MilitaryPorn,"http : //i.imgur.com/P1fVN4D.jpg What 's this , then ? Navigation during jump ? GPS and compass etc ?",Germanic,Finnish
0_0_0,Finland,I do n't . For tea it 's honey .,Germanic,Finnish
0_0_0,TankPorn,"IIRC , they are designers/engineers of some relevant part .",Germanic,Finnish
0_0_0,AskReddit,One that ca n't get credit at the service company/provider .,Germanic,Finnish
0_0_0,GameDeals,"This is the second extreme price cut promotion this year , it has brought new players aboard .",Germanic,Finnish
0_0_0,AskReddit,Excuse me ? What the FUCK are you doing GROUP READING exercises in high school for ? That 's third grade stuff .,Germanic,Finnish
0_0_0,AskReddit,"I 'm confused , what skills are we talking about ?",Germanic,Finnish
0_0_0,AskReddit,"I do n't understand , the teacher did n't like you having two different styles of handwriting or what ?",Germanic,Finnish
0_0_0,AskReddit,"Ah . Well other languages I could understand , but native language in fricking high school ...",Germanic,Finnish
0_0_0,HistoryPorn,No idea . Am not a laywer . https : //en.wikipedia.org/wiki/Right_to_be_forgotten,Germanic,Finnish
0_0_0,AskReddit,But not aloud one at a time in class surely ?,Germanic,Finnish
0_0_0,MilitaryPorn,"Wool is not really hot per se , provided you do n't wrap it in a non-breathing layer . It 's also warm when wet .",Germanic,Finnish
0_0_0,AskReddit,"Read and discuss is all fine and dandy , but read aloud ?",Germanic,Finnish
0_0_0,AskReddit,Feelsmlike a serious waste of class time TBH .,Germanic,Finnish
0_0_0,skyrim,"If I have a 40+ mods in via NMM , can I switch to MO without too much pain ? How about switching back ?",Germanic,Finnish
0_0_0,Futurology,He covered that . ( Might 've been an edit ),Germanic,Finnish
0_0_0,Futurology,"Like he said the credits work like anti-tax . Credits + tax & lt ; tax , possibly zero .",Germanic,Finnish
0_0_0,bestof,"It 's not tax payer money , it 's consumer money , via the ICE car industry . California is not losing revenue , it 's designed to put a price on producing polluting cars , thereby making clean ( er ) cars a cheaper option for the producers . California wins here , they have bad air pollution problems .",Germanic,Finnish
0_0_0,bestof,Pleading usually does n't go down very well in arguments . : ),Germanic,Finnish
0_0_0,JusticePorn,Maybe someone should start funding being-a-decent-human-being-schools in these countries ?,Germanic,Finnish
0_0_0,Futurology,"No one is saying any single EV is THE CAR that changes everything , Tesla absolutely included . Nor is the supercharging network going to cover everywhere anytime soon . But then hardly anything about society changes very fast . But that is not the point . Electric cars are very very nice for the majority of the people who typically commute - note **commute** - less than about half the range of the battery in one direction every day . This is because the charging happens when the vehicle is NOT BEING USED . No time wasted on the users ' part . Why is this distinction so hard to understand ? Furthermore , the electrical grid is one of the most basic infrastructure anywhere in the world where significant amount of people live . And that is the key here , **significant amounts of people** . Not *Backwater Northen Alaska* , population 1500 OR the most underdeveloped world where personal motor vehicle penetration percentage is in the low single digits . If you really need a car to make near-daily 300+ miles *one-way* trips completed at absolute minimum time , then no , Tesla or it 's competition probably are not be able to deliver that TODAY . EDIT : I 'm not qualified to comment on the environmental impact comparison to internal combustion .",Germanic,Finnish
0_0_0,JusticePorn,So none of them had procreated ? Phew .,Germanic,Finnish
0_0_0,Finland,"Realistic major risks for healthy individuals are : * Sudden short term dificulty to breath if not used to it , not really dangerous though * Accelerated heat loss via head leading to hypotermia = BAD * Big muscle fatigue due to the cold , may have trouble getting out = BAD For people with heart issues : * Especially combined with sauna , the temperature change may stress the heart unduly and drop in blood pressure . * A physician should be consulted before starting dipping . http : //www.tukes.fi/fi/kuluttajille/vapaa-aika/avantouinti/ Brain damage is a myth or a shock tactic to keep unknown people in line .",Germanic,Finnish
0_0_0,TopGear,"Yes , Hammond fell off a horse in ~~Bangladesh~~ Myanmar last special .",Germanic,Finnish
0_0_0,technology,"& gt ; The satellite TV company where I am has an IVR that even says something like `` we can see you 've been calling in a lot recently , so we will put you through to **someone who can help** '' . `` As opposed to the standard customer experience where we just belittle you and ignore your complaints . ''",Germanic,Finnish
0_0_0,politics,Only need to be a *useful* idiot . Useful to someone that can make the campaign ...,Germanic,Finnish
0_0_0,skyrim,I 've never seen it ingame : ) I waited 12 months with the game DVD on my bookshelf and then installed it and added about 30 mods .,Germanic,Finnish
0_0_0,technology,Clearly the poster you reponded to has forgotten that [ xkcd is always relevant . ] ( http : //xkcd.com/1053/ ),Germanic,Finnish
0_0_0,Suomi,"[ Sabaton , varsinkin uusin ] ( https : //www.youtube.com/watch ? v=MsXmtjLMH18 ) [ Arjen Anthony Lucassen / Ayreon ] ( https : //www.youtube.com/watch ? v=TQFmfZCcrYw ) [ Raubtier ] ( https : //www.youtube.com/watch ? v=ogLwHEPyXBE ) [ Hudson Mohawke ] ( https : //www.youtube.com/watch ? v=k_MWuP2Qj7U ) [ Týr ] ( https : //www.youtube.com/watch ? v=PlJHzQ_dxdQ ) [ Amorphis ] ( https : //www.youtube.com/watch ? v=KY0bUjF0YQ8 )",Germanic,Finnish
0_0_0,TopGear,"Well hard to show on TV without crew . And it was probably quite boring , inconspicuous car to closest airport and chartered plane to an international airport .",Germanic,Finnish
0_0_0,WorldofTanks,"You can also set the client to save every battle as a replay file . The files need a compatible version of the game client to run perfectly , but sometimes at least the ext version works adequately .",Germanic,Finnish
0_0_0,CombatFootage,"No explosion , just violent burning .",Germanic,Finnish
0_0_0,Finland,The Finnish one has `` funny '' word choices . One of them is kinda wrong even .,Germanic,Finnish
0_0_0,pcmasterrace,That corsair PSU seems to be popular in these posts . Is it the go to solution now ?,Germanic,Finnish
0_0_0,gifs,It 's a question of the ratio of surface area to mass . Steel burns when it gets hot enough . A solid block will conduct the heat evenly and require a shitload of heat energy to ignite and you can only supply it at the surface . In steel wool each strand heats up very quickly and the reaction itself can sustain the burning .,Germanic,Finnish
0_0_0,Nexus5,"Google hates you specifically , that 's why .",Germanic,Finnish
0_0_0,skyrim,You know Skyrim arrows home into center mass ? Seriously . Look it up . With vanilla settings being `` good with a bow '' is pretty hollow .,Germanic,Finnish
0_0_0,gifs,"Cat 's still an asshole in # 2 , hitting the raccoon that brought it food .",Germanic,Finnish
0_0_0,Steam,He appears to understand that as he has provided both measures in the text ?,Germanic,Finnish
0_0_0,Military,"I think he understood head injuries existed , but scale and severity are not immediately obvious . Like the article points out , they do a lot to amputees and burns , because those kinds of injuries are obvious . He looks to be a very focused and driven man . The issue was not on his radar as a combatant commander , because he was under the impression the appropriate wing of the Army was taking care of it .",Germanic,Finnish
0_0_0,MilitaryPorn,CCT is really just *Combat Controller* or a Combat Control Team .,Germanic,Finnish
0_0_0,worldnews,Protestors will burn the embassy of the country at the antipode of his homeland .,Germanic,Finnish
0_0_0,dataisbeautiful,Gim me a hard copy right there .,Germanic,Finnish
0_0_0,MilitaryPorn,Balsa encased in carbon fiber composite I think .,Germanic,Finnish
0_0_0,MilitaryPorn,Is n't it a *amazing* that a cylindrical object designed to be held in the human hand fits perfectly into a slot designed to hold another cylindrical object designed to be held in the human hand .,Germanic,Finnish
0_0_0,MilitaryPorn,Smoke grenades = & gt ; cupholders . cf . linked video .,Germanic,Finnish
0_0_0,GameDeals,So this is now the only way to get Dragonfall ?,Germanic,Finnish
0_0_0,todayilearned,Driving license ? What does drinking have to do with renewing a license ?,Germanic,Finnish
0_0_0,TopGear,As soon as they rip all the music out of it and cut the runtime down by about 15 minutes .,Germanic,Finnish
0_0_0,gifs,I think safety engineers would be able to mitigate that . Stop train and open emergency exits in the sidewalls or something of that type .,Germanic,Finnish
0_0_0,gifs,"Easy , make shorter trains . There would be plenty of time in the timetables if this was implemented , I 'm sure",Germanic,Finnish
0_0_0,gifs,"& gt ; I think the computer system also controls where the passengers who want to get off at a specific station sit That 's pretty smart ! I wish our national operator implemented that . I hate long walks from/to the station access , especially in lousy weather .",Germanic,Finnish
0_0_0,gifs,Actual [ Science ] ( http : //www.sciencemag.org/ ) .,Germanic,Finnish
0_0_0,gifs,A bus is a totally different use case .,Germanic,Finnish
0_0_0,Nexus5,What is xposed ?,Germanic,Finnish
0_0_0,history,I do n't see a party membership card ? Wehrmacht equipment they are .,Germanic,Finnish
0_0_0,Finland,"That case was very likely due to ( congenital ) heart disease or something equivalent , unless he was in so long that his core temp dropped A LOT .",Germanic,Finnish
0_0_0,Finland,Lend-lease and cold war are not contemporary though .,Germanic,Finnish
0_0_0,HistoryPorn,There 's a comment somewhere here that mentioned they ( or perhaps their relatives ) might 've taken advantage of the recent `` right to be forgotten by search engines '' legislation .,Germanic,Finnish
0_0_0,bestof,"That does n't really work , reddit does n't allow such directed downvoting .",Germanic,Finnish
0_0_0,MilitaryPorn,`` Higher '' `` resolution '' [ here ] ( http : //i.imgur.com/MNOHwBY.jpg ) Must be a different scan in fact .,Germanic,Finnish
0_0_0,science,"`` Medical Knowledge '' ? WTF , are the lay patients **rating** the doctors ' professional knowledge ?",Germanic,Finnish
0_0_0,science,The doctors should just throw the regulatory agencies under the bus . `` Would lose my license etc . '' : ),Germanic,Finnish
0_0_0,science,"How exactly would you explain the thought process `` it 's a virus , no medicine for that '' in any more detail without breaking into microbiology ? The fools forget what thy are paying for : It 's the expertise to make a diagnosis , not the signature on the prescription .",Germanic,Finnish
0_0_0,science,"What is so bad about `` I do n't know '' ? That 's basic scientific method . And really , doctors say `` I do n't know '' all the time , it 's just pronounced `` Here 's a referral to the specialist . '' No doctor can hope to be a generalist of EVERYTHING in medicine . Misdiagnosis happens all the time . Anecdotal evidence is useless there . A patient that thinks that is scandalous , would probably get a brain aneurysm if he saw a Morbidity and Mortality conference ... '' Behind the times '' is tricky , should one issue color the whole rating ? A comment woud suffice I 'd think ?",Germanic,Finnish
0_0_0,MilitaryPorn,What is the device on top of the helmet ?,Germanic,Finnish
0_0_0,MilitaryPorn,"You 'll have to specify `` you guys '' . I 'm not from US . Pathfinder in US army seems to be a general title , looks like the specific pathfinder course is only 3 weeks . JTAC are specialists , although probably fully capable of doing the pathfinder mission , whereas `` plain '' pathfinders are not going to be doing terminal attack control , for example .",Germanic,Finnish
0_0_0,TopGear,"Europlug is low power and no grounding , so it 's nearly useless for things other than lighting and small consumer electronics .",Germanic,Finnish
0_0_0,TopGear,We need to forcefeed Carl Sagan 's Cosmos into everyone 's mind .,Germanic,Finnish
0_0_0,Military,Hurt Locker was Army . And sucked IMO .,Germanic,Finnish
0_0_0,Steam,Make it easily moddable . Like `` just copy over textures and audio from the world release '' easy .,Germanic,Finnish
0_0_0,TrueAskReddit,"Unless you define a modem as `` that box the phone company sent me to plug mah computer to '' , most people still do n't know what a modem is .",Germanic,Finnish
0_0_0,Deusex,"Yeeeeah ... about that . [ Let 's not give them claws ] ( https : //www.youtube.com/watch ? v=3d4XMUYj-9k ) , k ?",Germanic,Finnish
0_0_0,worldnews,Now to appoint a major Democratic donor as ambassador . Never mind foreign policy experience and work in the State department . Bundling is where it 's at bitches !,Germanic,Finnish
0_0_0,TopGear,His favourite place is South of France . I think he 's even said on a Top Gear insert .,Germanic,Finnish
0_0_0,MilitaryPorn,[ Coastal defence ship *Väinämöinen* ] ( https : //en.wikipedia.org/wiki/Finnish_coastal_defence_ship_V % C3 % A4in % C3 % A4m % C3 % B6inen ) 1944.07.29,Germanic,Finnish
0_0_0,MilitaryPorn,"Pathfinders are the vanguard of an airborne drop , they set up drop zones and landing sites . Not really intelligence gathering .",Germanic,Finnish
0_0_0,dataisbeautiful,Minnesota - The Cryogenic State !,Germanic,Finnish
0_0_0,wikipedia,Easy choice Muslim = As many wives as you like . Catholic = As much wine as you like .,Germanic,Finnish
0_0_0,MilitaryPorn,https : //en.wikipedia.org/wiki/Women_Airforce_Service_Pilots # mediaviewer/File : Group_of_Women_Airforce_Service_Pilots_and_B-17_Flying_Fortress.jpg http : //www.302aw.afrc.af.mil/news/story.asp ? id=123117795,Germanic,Finnish
0_0_0,AskReddit,"Also there is a type of game where one plays against many , very suitable for a person that has the capacity . For example these two where the team hunts a villain , I enjoy being the villain a lot : [ Fury of Dracula ] ( http : //boardgamegeek.com/boardgame/20963/fury-dracula ) [ Letters from Whitechapel ] ( http : //boardgamegeek.com/boardgame/59959/letters-whitechapel ) Then , especially if you are into the respective themes , there are these fine more or less co-operative games : [ Battlestar galactica boardgame ] ( http : //boardgamegeek.com/boardgame/37111/battlestar-galactica ) where no one knows for sure on which team the rest of the players are when the game starts . [ Arkham Horror ] ( http : //boardgamegeek.com/boardgame/15987/arkham-horror ) and its many expansions are of course based on Call of Cthulhu . As is [ Mansions of Madness ] ( http : //boardgamegeek.com/boardgame/83330/mansions-madness ) ; uses a a game ( dungeon ) master role .",Germanic,Finnish
0_0_0,WTF,[ Climb Dance remastered ] ( https : //www.youtube.com/watch ? v=-PZ5J3GLSYI ),Germanic,Finnish
0_0_0,politics,I ail to see how EPA ( not ) discussing the research vould ( in ) validate research ? It 's science FFS .,Germanic,Finnish
0_0_0,videos,What do you mean ?,Germanic,Finnish
0_0_0,WorldofTanks,Just do n't forget that you parked a trained tier 8 crew in a tier 1 and pay again to get such a crew when you actually purchase the tank ...,Germanic,Finnish
0_0_0,TopGear,"Yeah I 'm having hard time believing this . My bank wo n't do shit unless I authenticate using a one time passcode . EDIT : I dunno what a routing number is , but everything there is to know about me and my bank account is useless .",Germanic,Finnish
0_0_0,WorldofTanks,& gt ; ... when you **actually purchase the tank** ...,Germanic,Finnish
0_0_0,TopGear,"[ Nordea ] ( http : //en.wikipedia.org/wiki/Nordea ) in Finland . They also operate in various other countries , but I can not speak to their authentication elsewhere . I do n't understand what you mean by service ? It 's just the internet banking system they have for all clients . The only alternative to the passcode is face to face with a proper ID . EDIT : SSN/personal identity number and any manner of `` secret '' information about me in any amount is worth nil . And the system is not CAP . ( Yet . )",Germanic,Finnish
0_0_0,Finland,Rather *voice* .,Germanic,Finnish
0_0_0,Military,"Fort Drum , duh .",Germanic,Finnish
0_0_0,Military,Clear all cookies set by nytimes.com,Germanic,Finnish
0_0_0,Military,Most social media links are not subject to the monthly limit .,Germanic,Finnish
0_0_0,Finland,"Key word is `` suspected '' , as in years after the fact . If there were prisoners aborad , the US misrepresented the status of the flights to the aviation authorities and the ministry at the time .",Germanic,Finnish
0_0_0,skyrim,Do you mean 100 % vanilla ? No SkyUI even ? Why would you inflict that on anyone ?,Germanic,Finnish
0_0_0,bestof,"`` Good news , we removed all of the nasty dihydrogenmonoxide from water ! **Water 2.0** - the smart , natural choice ! Coming soon to a organic food store near you ! ''",Germanic,Finnish
0_0_0,Steam,"Not only [ something something ] , but [ what ] as well ? I do n't think you know how that idiom works .",Germanic,Finnish
0_0_0,skyrim,You poor bastard ... My statement stands .,Germanic,Finnish
0_0_0,AskReddit,Icy brine was easy to reproduce for calibration of thermometers .,Germanic,Finnish
0_0_0,AskReddit,Too bunched up ? Use decimals . They are awesome .,Germanic,Finnish
0_0_0,AskReddit,"Well , it 's just as easy to say 1720 mm .",Germanic,Finnish
0_0_0,AskReddit,It 's a good thing people are always good with what they are used to . Would n't want to get any of that `` progress '' on them ...,Germanic,Finnish
0_0_0,OSHA,So why do they install the top step in the first place if it 's not to be used ? : O,Germanic,Finnish
0_0_0,MapPorn,Same bloody `` arguments '' were ( and are ) heard in Finland .,Germanic,Finnish
0_0_0,AskReddit,90 C for a sort-of-sauna . ( Maybe for kids etc . ) Around 100 C for a proper sauna .,Germanic,Finnish
0_0_0,Futurology,There was also talk of just paying money for the difference in battery condition and keeping the battery . That did n't make it to production ?,Germanic,Finnish
0_0_0,Futurology,"The major infrastructure is the electric grid . It 's there . The charging apparatus are a minuscule investment compared to that , supercharger stations included . Electric charging need not be centralised in the same way as liquid fuel retail . The model is charging points in the home and workplace for everyday use , with free superchargers ( and battery swaps for money ) for trips that exceed the battery capacity within the day . You understand that the Model S is a luxury sedan equivalent ? High end BMWs , Mercedes S-class and such are also out of most people 's reach . The price of following models will come down with economies of scale .",Germanic,Finnish
0_0_0,Futurology,It 's just the launch for gauging interest . Not the final experience .,Germanic,Finnish
0_0_0,Futurology,The battery swap is not intended for everyday use by everybody* and certainly not for intra-city traffic . The model is charge at home and workplace when the vehicle is not in use . Only trips which exceed the range within a day need fast or `` near-instant '' charging . \*Some will use it `` wrong '' but that 's a question of pricing .,Germanic,Finnish
0_0_0,AskReddit,"Oh I agree , but the error was n't due to conversions at all . Someone 's downvote finger is on a hair trigger ...",Germanic,Finnish
0_0_0,HistoryPorn,"Most people were not members of the NSDAP in the first place . The top value was 12 % of the population in 1945 or ~8 million out of 66 million . Now , Hitler Youth was compulsory from 1936 , but was not really a force in the society .",Germanic,Finnish
0_0_0,HistoryPorn,"N.B . Hitler Youth membership was compulsory from 1936 onwards . They had never knew known a time where kids were n't in the system . Membership penetration is estimated to have been 80-90 % of teens , per Wikipedia .",Germanic,Finnish
0_0_0,Futurology,Maybe he 's expressing his distress that there is not battery swapping technology available for the majority of phones ~~yet~~ anymore ? FTFY,Germanic,Finnish
0_0_0,AskReddit,So what 's so wrong about using decimal degrees with celsius ?,Germanic,Finnish
0_0_0,AskReddit,"& gt ; That equation contains absolutely no constants . Constants are just as messy in metric as the are in Imperial . The gravitational constant ? 6.67384 × 10-11 m3 kg-1 s-2 . Hardly 10 or 1000 . Heck , here is a list of physical constants , not one 10 or 1000 among them I think he misused *constants* and meant *conversion factors* .",Germanic,Finnish
0_0_0,AskReddit,"Bullshit that was n't due to error from conversions , they used a completely wrong number due to assumin a different unit was used .",Germanic,Finnish
0_0_0,worldnews,"And if they make it in the doors of the Role 3 hospital in Kandahar for example , it 's even better . That place has over 98 % survival rate .",Germanic,Finnish
0_0_0,pcmasterrace,F,Germanic,Finnish
0_0_0,skyrim,The daedra do n't know Akatosh has dibs ...,Germanic,Finnish
0_0_0,gifs,I think Norman Borlaug has him beat .,Germanic,Finnish
0_0_0,gifs,It 's all about minimum air resistance . If they compromise on aerodynamics the car has worse fuel efficiency ( for the same technology under the hood of course ) than the competition .,Germanic,Finnish
0_0_0,skyrim,Shock also shuts down spellcasters like nobody 's business .,Germanic,Finnish
0_0_0,Finland,There is a reason the field patrols use overalls as uniforms . You 've found the reason .,Germanic,Finnish
0_0_0,Finland,Destroying injured animals also count in this I believe .,Germanic,Finnish
0_0_0,Military,"I aleays thought the two charge arrangement was to defeat ERA ? Or is that only for TOW-2A with shaped charges ? Edit : nvm , I forgot 2A is not top attack ...",Germanic,Finnish
0_0_0,Military,Finnish rifles really . LMG is russian because debt repayments .,Germanic,Finnish
0_0_0,Military,"Plausible , there were four marines over in January , but why would they be playing OPFOR ? Might just be a foreign camo pattern for visual clue . Unless someone can actually read the patch on the sleeve , it 's hard to tell .",Germanic,Finnish
0_0_0,interestingasfuck,Wheat and Roots/tubers are also confusingly close in color .,Germanic,Finnish
0_0_0,MilitaryStories,"This then ? http : //www.amc.af.mil/news/story.asp ? id=123269640 Acronyms and stuff , ya know .",Germanic,Finnish
