user,subreddit,post,family,lang
0_0_0,Nordiccountries,"Some notable crime and justice journalists from Finland : Jarkko Sipilä , MTV3 - @ sipilamtv3 on Twitter . Pekka Lehtinen , MTV3 - @ LehtinenPekka Susanna Reinboth , Helsingin Sanomat newspaper ( also vice chair of justice reporters association ) - @ ReinbothSusanna Minna Passi , Helsingin Sanomat newspaper - @ MinnaPassi Ari Mölsä , YLE national broadcaster - @ AriMolsa Mikko Niskasaari , freelancer - mikko.niskasaari @ kolumbus.fi Also worth a mention : Harri Nykänen , crime author , previously reporter for Helsingin Sanomat Päivi Happonen , YLE National broadcaster - @ PaiviHapponen Nina Räty",Germanic,Finnish
0_0_0,dataisbeautiful,Is n't the reason they have specifically military vehicles as opposed to purpose built armored vehicles that the DOD is selling off cheap / donating the surplus vehicles they ordered during the 2000 's ? You can build a lot of trucks in 10 years ...,Germanic,Finnish
0_0_0,dataisbeautiful,Surplus means too many to use . They ordered a shitload of stuff when things were hot and now the situation is different and they are cutting down on manpower as well .,Germanic,Finnish
0_0_0,Firearms,"Does n't matter , machine gun is a machine gun . Also [ this ] ( http : //en.wikipedia.org/wiki/Shocker_ % 28hand_gesture % 29 )",Germanic,Finnish
0_0_0,HistoryPorn,"He was fond of sweet things , especially Coca-Cola . The company produced a colorless version of Coke for Zhukov so he could be seen drinking `` vodka '' and not an imperialist / capitalist soft drink . https : //en.wikipedia.org/wiki/White_Coke",Germanic,Finnish
0_0_0,CombatFootage,"It 's quite likely they are shooting PGU-13 HEI rounds only . Pentagon has stated they are not using and and have not used DU against ISIS in Iraq and Syria , so I do n't see much reason for them to fire DU rounds in Afghanistan these days either . The normal combat load would be 5 API to 1 HEI .",Germanic,Finnish
0_0_0,gifs,& gt ; ... to use a hard sided case with a non-TSA lock that only you have access to . It 's nice to know TSA knows they ca n't trust their own people either .,Germanic,Finnish
0_0_0,AskReddit,Culture is a funny thing .,Germanic,Finnish
0_0_0,AskReddit,How do you know I was n't commenting on the previous commenter 's incredulity ? ; ),Germanic,Finnish
0_0_0,AskReddit,"Culture . Simple as that . For example : http : //en.wikipedia.org/wiki/Day_of_the_Dead A more extreme example from wiki : & gt ; Dia de los ñatitas ( `` Day of the Skulls '' ) is a festival celebrated in La Paz , Bolivia , on May 5 . In pre-Columbian times indigenous Andeans had a tradition of sharing a day with the bones of their ancestors on the third year after burial . **Today families keep only the skulls for such rituals . ** Traditionally , the skulls of family members are kept at home to watch over the family and protect them during the year . On November 9 , the family crowns the skulls with fresh flowers , sometimes also dressing them in various garments , and making offerings of cigarettes , coca leaves , alcohol , and various other items in thanks for the year 's protection . **The skulls are also sometimes taken to the central cemetery in La Paz for a special Mass and blessing . ** [ emphasis mine ]",Germanic,Finnish
0_0_0,gifs,White goats ca n't jump .,Germanic,Finnish
0_0_0,Firearms,"Noooo , ca n't be ... . Whatever gave you that idea ? : p It 's AOW .",Germanic,Finnish
0_0_0,Military,Entrenching tool AKA shovel . Roman legions were famous diggers .,Germanic,Finnish
0_0_0,gifs,"The big gears ( blue ) are not connected to the output shaft ( yellow ) , however the synchronizers ( purple ) are , so they rotate with the shaft while sliding along it . The synchronizers can be connected to a gear , in effect connecting the gear to the output shaft .",Germanic,Finnish
0_0_0,CombatFootage,"TOW 2B has a laser and magnetic fuze and two downward firing EFP warheads . It flies somewhat above the aiming line , unlike previous versions that fly along the line . The missile in the video is a 2A ( 71E-1B on the yellow band on the launch tube ) with a forward firing HEAT warhead . I 'm not convinced the hit was effective at all ...",Germanic,Finnish
0_0_0,CombatFootage,It 's a really sketchy hit though . Ca n't call it with this video material .,Germanic,Finnish
0_0_0,CombatFootage,"Yes , but this one was n't one of them . ( 71E-1B on the launch tube tells us the model is 2A . )",Germanic,Finnish
0_0_0,CombatFootage,Was n't a top attack warhead . 71E-1B on the launch tube tells us the model is 2A . ),Germanic,Finnish
0_0_0,CombatFootage,It is possible that 's the tank generating the smoke by injecting fuel oil into the exhaust . If it was ammo cook-off I would expect a much more vertical smoke movement due to the pressure .,Germanic,Finnish
0_0_0,CombatFootage,"Oh it 's certainly possible that something was damaged or that there was even a fire somewhere on the vehicle . The point is that with a HEAT charge you want to strike armor completely perpendicular ( i.e . as close as possible to 90 degrees ) , that hit did n't look it hit like that at all . The exhaust smoking is a system for producing obscuring smoke that some tanks have . It 's not really a thing these days though since such `` basic '' smoke does n't defeat IR sensors . One of the reasons modern tanks have separate launchers that use special smoke compounds . One has to remember these are propaganda videos . Someone made a decision to cut the video at that point , perhaps because the following material does not support the story of a tank kill anymore ...",Germanic,Finnish
0_0_0,CombatFootage,They are apparently provided from Saudi Arabia with the silent blessing of the USA .,Germanic,Finnish
0_0_0,CombatFootage,"The red dot is not a rocket motor , it 's the heat source the launcher uses to track the missile with a thermal sensor , which is not equipped in these videos . The launcher is using only the IR band source that 's also on the back of the missile . Neither is visible from front . The flight motor only burns for about 1.5 seconds . After that the missile is just coasting . At the top end of the range the velocity is down to about 110m/s",Germanic,Finnish
0_0_0,AskReddit,Why do you think the kid has no arms . These sort of jokes have to be handled with kid gloves .,Germanic,Finnish
0_0_0,videos,"Hm , I thought outward opening doors were common in Nordics ? Almost every door in Finland opens out .",Germanic,Finnish
0_0_0,boardgames,"I clicked through to the Caylus review . Spot on , I say !",Germanic,Finnish
0_0_0,interestingasfuck,F1 allows maximum of 100 kg of fuel currently . It 's about 100 liters .,Germanic,Finnish
0_0_0,Steam,Would be nice if they explained these suspicious behaviours so we know to avoid such activities . Or maybe they could formulate a response that does n't involve **permanently** fucking the false positives ?,Germanic,Finnish
0_0_0,Games,Indeed . Investors like steady and predictable returns that reflect what the management has previously forecasted . Like you say it may very well be that concerns about future production dictated the launch year .,Germanic,Finnish
0_0_0,wikipedia,And the reason was basically bookkeeping for the purposes of tax collection,Germanic,Finnish
0_0_0,WorldofTanks,It 's your bank ( and by extension much of the US consumer facing financial sector ) stuck in the 1900 's .,Germanic,Finnish
0_0_0,WorldofTanks,Oh it 's also possibly the card network charging it and the card issuer not being necessarily forthright about the practice .,Germanic,Finnish
0_0_0,astrophotography,The big comment up top says jettisoned solar panel covers .,Germanic,Finnish
0_0_0,Games,"So , in my first and only game of the original I 'm just back to Detroit from the second visit to the Hengsha , should I just restart with directors cut ? I LIKE ghosting . Edit : Oh the DC is fucked up with bugs ? Forget it then .",Germanic,Finnish
0_0_0,WarshipPorn,The captain of the Japanese submarine concerned was a witness for the ~~defence~~ prosecution in the ensuing court martial of captain of Indianapolis . The point was that the Indianapolis was not doing a zig-zag maneuvering and the submarine captain said it would not have made any difference . A decorated US submariner said the same . All in all the court martial was somewhat strange . http : //www.ussindianapolis.org/mcvay.htm,Germanic,Finnish
0_0_0,WarshipPorn,"O right , mybad .",Germanic,Finnish
0_0_0,bestof,"A fit person can run farther and longer than the horse , just have to keep avoiding contact with the rider 's truncheon ...",Germanic,Finnish
0_0_0,JusticePorn,"& gt ; Once you 're stopped , they do n't injure you further . In both cases the injury comes from the stop , not what happens after . Yo , some guy Rodney call , He say you full of shit , man .",Germanic,Finnish
0_0_0,videos,Ya need a speed cocker and this thing for shooting down police helicopters . Eventually .,Germanic,Finnish
0_0_0,interestingasfuck,"Formula 1 tyres sacrifice a lot of durability for grip , they would n't last long at normal road speeds either . E : added `` a lot of ''",Germanic,Finnish
0_0_0,interestingasfuck,a ) What 's with the crank handle the fuel guy places in the roof ? b ) Is gravity feed the only allowed way to fuel ?,Germanic,Finnish
0_0_0,interestingasfuck,Did you tip each guy or do they pool ?,Germanic,Finnish
0_0_0,IAmA,Because lulz .,Germanic,Finnish
0_0_0,videos,"Soo , who 's paying ? Twitch ?",Germanic,Finnish
0_0_0,news,"That 's not what it means . Using deadly force to stop a threat is preventing the person from continuing to be a threat . The method in this case is kinetic force induced tissue damage . The **result** might very well be killing in the process of neutralization , but it 's not the end **objective** . It 's not semantics either . If *killing* was the legally allowed objective from the get go , there is no longer a reason to stop the application of deadly force , even when the subject is no longer a threat . `` Just saunter over and put a coupla rounds into his noggin for good measure , hey ? ''",Germanic,Finnish
0_0_0,news,"Stop the threat , to be exact . The applicable definition of `` threat '' may be complex , though .",Germanic,Finnish
0_0_0,Terraria,Get a depth meter/gps and plot the height where wyverns start to spawn in your world . Then build accordingly .,Germanic,Finnish
0_0_0,hockey,The rule says `` more than two '' .,Germanic,Finnish
0_0_0,history,"Very nice , but a bit small resolution . Do you know the source ? A book etc . ?",Germanic,Finnish
0_0_0,dataisbeautiful,Average results .,Germanic,Finnish
0_0_0,JusticePorn,"The thinking goes , `` If you help you must be guilty , because why would you help otherwise ? '' . Fucked up mentality .",Germanic,Finnish
0_0_0,hockey,"Finnish head coach commented that IIHF has usually sent some kind of plaque , expects same this year .",Germanic,Finnish
0_0_0,MapPorn,It 's a good thing those press photographers and the media outlets are not making money out of those photographs ...,Germanic,Finnish
0_0_0,Firearms,You mean clearances .,Germanic,Finnish
0_0_0,videos,"That opponent happens to be [ Aleksandr Karelin ] ( http : //en.wikipedia.org/wiki/Aleksandr_Karelin ) , who is pictured here having very surprisingly lost to Gardner at the Sydney Olympics gold medal match after having been **13 years undefeated in international competition** and having gone **6 years without giving a point . ** He 's the exception to everything in wrestling . You need to compare Gardner to the rest of the field to get an idea .",Germanic,Finnish
0_0_0,worldnews,Can you say ... Corrupt practices in public acquisitions ?,Germanic,Finnish
0_0_0,Terraria,I do n't . Explain please .,Germanic,Finnish
0_0_0,MapPorn,Or perhaps Europe just has more notable things than sub-Saharan Africa .,Germanic,Finnish
0_0_0,AskReddit,French fries and cheese curds drowned in gravy .,Germanic,Finnish
0_0_0,WorldofTanks,"Victory does n't affect credit earnings per se , other than in the sense that the victorious team usually gets to do more damage which lead to the victory in the first place . Winning the match only slightly raises the ~~small~~ joining battle credit bonus . EDIT : OK , so the bonus is not `` small '' after all .",Germanic,Finnish
0_0_0,Terraria,Random corruption from smashing demon altars can spread there . And you are susceptible to meteors in the outer thirds .,Germanic,Finnish
0_0_0,AskReddit,Not a very well trained dog then . Or a bad handler .,Germanic,Finnish
0_0_0,history,That article has a fair bit of wonky language .,Germanic,Finnish
0_0_0,skyrim,"Ca n't stand the sight of a strong Nord woman , huh ?",Germanic,Finnish
0_0_0,TrueReddit,"Well they realized when the teacher mentioned their child 's performance *in comparison* to the other students in the class . glaring difference The teachers have a good idea of the performance they can expect of a first grader , not so for the parents necessarily .",Germanic,Finnish
0_0_0,TrueReddit,"The teachers are required to report , but are given little ( or no ? ) standards as to what constitutes a fact to be reported . Great plan , sure to work ...",Germanic,Finnish
0_0_0,TrueReddit,"Was it negative ? If not , its all faked .",Germanic,Finnish
0_0_0,TrueReddit,People can hold multiple qualifications .,Germanic,Finnish
0_0_0,politics,It 's `` works '' as in a factory/shop .,Germanic,Finnish
0_0_0,MilitaryPorn,"I read about a US convoy gunner in Iraq that carved a pistol shape out of styrofoam and painted it black . He then used the `` pistol '' to intimidate drivers/standers by to keep their distance , because pointing the .50 cal machine gun at them did n't have much effect .",Germanic,Finnish
0_0_0,AskReddit,That 's some good TV .,Germanic,Finnish
0_0_0,pics,This actually is [ the very tank he drove in the Austrian Army ] ( http : //movies.yahoo.com/blogs/movie-talk/arnold-schwarzenegger-takes-own-personal-tank-spin-000359471.html ) .,Germanic,Finnish
0_0_0,MilitaryPorn,The tomb guards walk the route continuously .,Germanic,Finnish
0_0_0,MilitaryPorn,They walk the beat constantly .,Germanic,Finnish
0_0_0,GameDeals,The game is a mess . Not recommended .,Germanic,Finnish
0_0_0,Terraria,Brown and gray as found in the world only trigger for player .,Germanic,Finnish
0_0_0,AskReddit,I 'm intrigued by your use of `` yet '' ; it 's as if you expected it to happen pretty soon after the rise of civilization or something ...,Germanic,Finnish
0_0_0,Terraria,"Mobs will approach from below and cross up to the lava , taking damage . Shortest route to player .",Germanic,Finnish
0_0_0,TrueAskReddit,"The data recorders have comparatively small storage capacities , due to the ruggedness needed . Tens of megabytes currently .",Germanic,Finnish
0_0_0,TopGear,"The music is changed specifically because the licensing fees for use in the US would cost too much . Top Gear often uses hits , e.g . The Who .",Germanic,Finnish
0_0_0,TrueReddit,The work of good and useful teachers is not limited to the hours the students are in the classroom . Or even the time the school happens around the year . Professional development is also needed . You ca n't just bring lessons to exist from thin air when the school bell goes .,Germanic,Finnish
0_0_0,WorldofTanks,"I believe my comment considered credits , not XP . This discussion was about economicality , which I took to exlude XP . Pardon if I 'm mistaken . I 'm not clear what everybody thinks is incorrect in my statement . It 's straight from the wiki . If you have another source , please provide a link .",Germanic,Finnish
0_0_0,Houseporn,& gt ; Indoor shooting range & gt ; world class Sporting Clay Course Looks like it 's geared towards a certain type of buyer .,Germanic,Finnish
0_0_0,videos,"From the customs point of view importing such an item likely needs to be declared . Or if it is returning , some proof that it did in fact leave the country earlier .",Germanic,Finnish
0_0_0,videos,Your laptop was n't merchandise and not staying there presumably .,Germanic,Finnish
0_0_0,videos,"Ah , I was assuming the server got installed etc . Still they may have different rules for PCs .",Germanic,Finnish
0_0_0,gifs,Twist ( your ankle ) : The door opens out .,Germanic,Finnish
0_0_0,gifs,Depends on the lock really .,Germanic,Finnish
0_0_0,gifs,"Bump only works on pin tumblers ( like shown here ) . There are MUCH better designs out the , e.g . disc tumblers .",Germanic,Finnish
0_0_0,Finland,It won the blind taste test of Helsingin Sanomat a few years ago .,Germanic,Finnish
0_0_0,pics,How can that be fixed ?,Germanic,Finnish
0_0_0,pics,I 'm sure they can communicate with the restaurant ... .,Germanic,Finnish
0_0_0,pics,There 's no need to click the button rapidly . The cameras can do continuous shooting automatically .,Germanic,Finnish
0_0_0,pics,And bad kerning too .,Germanic,Finnish
0_0_0,Military,Sgt Staff needs remedial training in the differences between 'right ' and 'left ' .,Germanic,Finnish
0_0_0,mountandblade,And the nobles still have the suffixes even when starting the game.. Uh-huh .,Germanic,Finnish
0_0_0,MilitaryPorn,So what 's war torn about these ?,Germanic,Finnish
0_0_0,pics,Why ? To the customer there is no apparent change and the work is performed more efficiently .,Germanic,Finnish
0_0_0,Terraria,"How much distance are you giving the trench between checking ? [ Monsters can not spawn less than 62 tiles away left or right , or 35 tiles up or down . ] ( http : //terraria.gamepedia.com/NPC_Spawning # Choosing_a_spot_to_spawn_the_monster ) ( from player ) Also : The maximum distance from the player [ mobs will spawn ] is 84 tiles to the left or right , and 47 tiles up or down . ''",Germanic,Finnish
0_0_0,Military,[ Reddit Enhancement Suite ] ( http : //redditenhancementsuite.com/ ) saves comments .,Germanic,Finnish
0_0_0,Military,Because different PR thinking . And you have to remember these demonstrations are always for domestic consumption first .,Germanic,Finnish
0_0_0,Finland,"Strictly officially ajokortti is not a form of ID , but they seem to accept it .",Germanic,Finnish
0_0_0,WorldofTanks,"And wtf is that about ? Stop being mysterious and explain the issue , please .",Germanic,Finnish
0_0_0,WorldofTanks,"In all seriousness , can you source that ?",Germanic,Finnish
0_0_0,WorldofTanks,"If you read the relevant cell on the table again , you 'll notice the multiplier ONLY applies to the `` joining a battle '' -credit ( listed separately at the top of the whole table ) . NOT to any other credit awards .",Germanic,Finnish
0_0_0,askscience,"[ The hollow cylinder was the projectile , the target was the plug . ] ( http : //en.wikipedia.org/wiki/Little_Boy # Counter-intuitive_design )",Germanic,Finnish
0_0_0,askscience,Correct . And the pit ( spherical core ) is usually hollow to help with the compression ( among other reasons ) .,Germanic,Finnish
0_0_0,AskReddit,"Not likely , that would not be a ) hard to explain b ) identifiable , because so many people were involved .",Germanic,Finnish
0_0_0,pics,cough ... GI life insurance..,Germanic,Finnish
0_0_0,AskReddit,"And the price of parking also acts to limit demand , which is one big reason public parking spaces are metered .",Germanic,Finnish
0_0_0,Military,"And those soldiers would also be conscripts . Although the only place I have knowledge of such an exercise is in the conscript combat diver course which is a special volunteer assignment in the FDF ... Would n't put it past the Navy though , sounds very reasonable for their circumstances .",Germanic,Finnish
0_0_0,AskReddit,"Fun fact No.2 : Thomas Paine was scheduled for execution by guillotine in Paris , but a gaoler fucked up when marking his cell door ( it was open and the mark was made on the inside ) , thus he did n't get collected for execution in the morning .",Germanic,Finnish
0_0_0,AskReddit,But it was largely negotiated and written by a group of people involved in the foundational documents .,Germanic,Finnish
0_0_0,AskReddit,His calculations coincide with the actual value within 15 percent . ~~And the error stems mainly from the non-perfect sphericality ( flattened ) of Earth.~~ EDIT : Apparently I wrote a bunch of BS ... it 's 15 % and `` flattened '' not mentioned ... .,Germanic,Finnish
0_0_0,HistoryPorn,"It does n't mean they built the planes especially fast , it means they had lot of them under construction simultaneously , with staggered schedules .",Germanic,Finnish
0_0_0,pics,"I think they meant that some moves about outside collecting the order as noted above , but some chains actually use off-site drive through operators . The mic and speaker connect to a call center somewhere and the order gets posted for the restaurant staff over the net .",Germanic,Finnish
0_0_0,videos,"Ah I read your comment bit fast . IMO , Gardner got his absolute peak form on for the olympics AND he got lucky . He did apparently have a decent plan on countering Karelin 's technique . And then there is the new rule that got him the point .",Germanic,Finnish
0_0_0,IAmA,Um.. perhaps *more dysfuntional '' ?,Germanic,Finnish
0_0_0,politics,The workers [ have seats on the governing board ] ( https : //en.wikipedia.org/wiki/Co-determination ) . http : //www.reuters.com/article/2014/02/19/us-vw-usplant-idUSBREA1I0S820140219,Germanic,Finnish
0_0_0,politics,"And perhaps the good senator was put up to it by business interests who wished that the works council approach or similar methods should have no opportunity to demonstrate its potential benefits , in order to prevent the idea from spreading in US .",Germanic,Finnish
0_0_0,guns,It 'll be a solid piece . The bulge is a [ bore evacuator ] ( http : //en.wikipedia.org/wiki/Bore_evacuator ) .,Germanic,Finnish
0_0_0,AskReddit,With a secondary motive of just making them leg it out of the catholic states .,Germanic,Finnish
0_0_0,AskReddit,"Seeing as we are in a `` technically correct '' thread I must point out the CP-1 was built **under the stands of a disused football field** , University of Chicago having disbanded their football program in 1939 in favour of concentrating on scholarly pursuits . The bricks were the graphite for neutron inhibition .",Germanic,Finnish
0_0_0,guns,Different tanks have different cannons .,Germanic,Finnish
0_0_0,AskReddit,Who says they used paper ?,Germanic,Finnish
0_0_0,AskReddit,"They also do not realise that the LLN makes the game work *for the casino , not the gambler* .",Germanic,Finnish
0_0_0,guns,Oh . I imagined the foam based cleaning systems to be widely used nowadays . Perhaps it 's not needed for smoothbores .,Germanic,Finnish
0_0_0,guns,"It 's just the way the paint abrades off the metal combined with reflections off the beveled edge . Look at high right , you can see paint ovelap the shiny part .",Germanic,Finnish
0_0_0,Finland,And then find a job as a police officer . There are no guaranteed posts for all graduates .,Germanic,Finnish
0_0_0,Terraria,"N.B . All six points of contact on these three latter statues can be activated independently every ten seconds , by use of all three clolours of wire .",Germanic,Finnish
0_0_0,CombatFootage,Not all missile strikes are perfectly critical .,Germanic,Finnish
0_0_0,Finland,Perhapshe means a wet sauna as in a turkish sauna ? All fogged up like .,Germanic,Finnish
0_0_0,Finland,"Do you mean `` wet sauna '' as in a Turkish hammam type with very high humidity , thick fog and all ?",Germanic,Finnish
0_0_0,WorldofTanks,"It is n't . You can substitute credits for gold , no matter what the exchange rate is in the other direction .",Germanic,Finnish
0_0_0,AskReddit,Read the relevant statutes before driving ? Someone may even have condensed the relevant points to a handy document !,Germanic,Finnish
0_0_0,Military,"The vote numbers are fake , the score is true . Do n't sweat it .",Germanic,Finnish
0_0_0,worldnews,But there was very little **proof** . Now it 's documented .,Germanic,Finnish
0_0_0,worldnews,"The Taliban are Pakistan 's unconventional warfare tool , have been since the 80 's .",Germanic,Finnish
0_0_0,TopGear,"A lot of the music during the segment was very bondescue already , I got the same vibes . Especially the bit with the brass , when Hammond was enjoing his ride while Claarkson was stuck .",Germanic,Finnish
0_0_0,MilitaryPorn,7.62x39mm kicks like a mule ? Bullshit .,Germanic,Finnish
0_0_0,MilitaryPorn,"I guess it 's a question of what you are used to . Unless it 's 7.62x51mm ( /54mm ) or something like that , it just does n't connect to my experience . It 's an intermediate rifle cartridge and quite usable in an assault rifle . 5.56 *does* feel like easymode , though .",Germanic,Finnish
0_0_0,MilitaryPorn,Should indeed be the Honourable Artillery Company .,Germanic,Finnish
0_0_0,ProtectAndServe,Very badly trained and way unrepared police officers .,Germanic,Finnish
0_0_0,gifs,"Conservation of angular momentum . Start wide , tuck in .",Germanic,Finnish
0_0_0,xkcd,He links to `` a wonderful chart '' that uses decimal inches AND **fractional mm** to describe grain size . Who the hell thought it was a good idea to mix those ...,Germanic,Finnish
0_0_0,skyrim,I made this .,Germanic,Finnish
0_0_0,politics,"I guess subtle indoctrination , keeping up the `` normal state of things '' and so forth ?",Germanic,Finnish
0_0_0,Games,So spelunker no longer maps ores ? And no way to farm waterleaf inside ?,Germanic,Finnish
0_0_0,Terraria,So it is NOT fixed despite the patch notes saying so ?,Germanic,Finnish
0_0_0,worldnews,"Perhaps it 's me , but most all of those tweets seem sarcastic/tongue in cheek . Especially the one with * # dotheyknowwhoweare* .",Germanic,Finnish
0_0_0,worldnews,Are you sure those tweets are serious ? They feel very sarcastic to me .,Germanic,Finnish
