user,subreddit,post,family,lang
0_0_0,MilitaryPorn,"Now that I think of it , the photos in Flickr look somewhat like a shooting range , so the canvas is perhaps just simulating a proper murder hole ( a small hole knocked into a structure ) . It 's just that peacetime training regulations and the shooting range policy probably require the `` structure '' can not be solid , ricochets beingy nasty etc .",Germanic,Finnish
0_0_0,MilitaryPorn,Note the Taliban recon on background left .,Germanic,Finnish
0_0_0,videos,Of course he was .,Germanic,Finnish
0_0_0,videos,"In my jurisdiction ( Finland ) the law includes a method for calculating BAC at the time of apprehension if there is a delay in getting a blood sample . Rural parts can have looong distances to medical sites , especially after hours . Basically the police detain the suspect for several hours and get a series of blood samples over time . From that the lab can define the suspect 's particular rate of alcohol metabolism and extrapolate back to the original BAC .",Germanic,Finnish
0_0_0,videos,I 'm amazed they havent implemented the technique the Finnish law uses . Get several samples over time and extrapolate back to time of apprehension .,Germanic,Finnish
0_0_0,WTF,Dat sugar tax .,Germanic,Finnish
0_0_0,Firearms,"Another person could employ rubber hose cryptanalysis to gain the password , then fire the gun .",Germanic,Finnish
0_0_0,videos,"93 C is not particularly hot for a sauna , at least if the air humidity is kept in check .",Germanic,Finnish
0_0_0,videos,"Blood alcohol content is one of the most objective facts you can get in an investigation . The mobile unit merely saves time . If you are going to argue you have a some sort of right to drive under the influence and be subject to `` fair play '' , then nvm ...",Germanic,Finnish
0_0_0,gifs,"Gopro does n't post to Facebook , which is what he was doing .",Germanic,Finnish
0_0_0,MilitaryPorn,"Usually a king is the head of the various orders of chivalry . Therefore he carries the top tier of decorations . Some of these top decorations may not even be awarded to anyone else , in some cases possibly only foreign heads of state . It 's just tradition . In military orders it reflects the `` in service of the monarch '' aspect .",Germanic,Finnish
0_0_0,MilitaryPorn,"It 's concealment , probably against thermal sights too . EDIT : OR it 's just for simulation of a murder hole in a shooting range environment ...",Germanic,Finnish
0_0_0,WorldofTanks,What do you mean `` tendency to high roll '' ?,Germanic,Finnish
0_0_0,WorldofTanks,"Thought so . Considered there was a possibility he meant *he* was a `` high roller '' , ergo spending on APCR . Dolla dolla bills etc .",Germanic,Finnish
0_0_0,worldnews,Motor vehicle ~~accidents~~ collisions are good at producing brain death .,Germanic,Finnish
0_0_0,CombatFootage,It 's *tattle* anyway ...,Germanic,Finnish
0_0_0,worldnews,"Granted , fixed .",Germanic,Finnish
0_0_0,WorldofTanks,"How many exactly ? Unless you have data , there is nothing to discuss .",Germanic,Finnish
0_0_0,MilitaryPorn,Clearly they have markings . Just what markings is another thing .,Germanic,Finnish
0_0_0,WTF,It also does n't concern weapons . That would be one of the Hague conventions ...,Germanic,Finnish
0_0_0,WTF,Well damn !,Germanic,Finnish
0_0_0,Military,`` Why do you want to know ? Do you have a problem ? Do you want to talk about it ? '' : D,Germanic,Finnish
0_0_0,helsinki,I would go for something local that is not internationally known .,Germanic,Finnish
0_0_0,WorldofTanks,"Also [ Locastans minimap ] ( http : //www.locastan.com ) , which can be installed on top of XVM .",Germanic,Finnish
0_0_0,WorldofTanks,Really ? Source ?,Germanic,Finnish
0_0_0,AskReddit,A gym membership that you actually USE .,Germanic,Finnish
0_0_0,MilitaryPorn,Some psychopats are essentially PTSD proof .,Germanic,Finnish
0_0_0,MapPorn,"Not only that , but there was , and is , a right to live for a year in another Nordic country without any residence permits . Even after that year is up you only have to declare your residence to the population register .",Germanic,Finnish
0_0_0,worldnews,"There is only acceleration , the sign depends purely on the frame of reference . The acceleration in this case is normally such that it tends to reduce the magnitude of the velocity of the vehicle . ( Velocity is a vector . ) And *technically* the device signals the activation/deactivation of the system that retards the rotation of the wheels . Any acceleleration due to this depends on friction and other factors , such as the operating state of the machinery that increases the rotation of some or all of the wheels . One should also notice the indication is purely digital , so the mere fact of activation alone is insufficient proof of any significant change in velocity . It is prudent to make the assumption that such a change is imminent , however . : D",Germanic,Finnish
0_0_0,WarshipPorn,It 's a mortar in the sense that it fires at low velocity and at high trajectories . How do you define a `` true '' mortar ?,Germanic,Finnish
0_0_0,MapPorn,"Get to the [ interactive map ] ( http : //middle-earth.thehobbit.com/map ) , select heros and their paths are drawn on the map .",Germanic,Finnish
0_0_0,CombatFootage,"It 's pretty obvious if you know the German hardware . World of Tanks helps : ) And it 's not really a `` tank '' . It 's a tank destroyer , open top armor and all that jazz . Basically an antitank gun installed on top of a tracked chassis and surrounded by some pretty thin armour plating .",Germanic,Finnish
0_0_0,CombatFootage,It is .,Germanic,Finnish
0_0_0,CombatFootage,Well they are basically painted cast iron shells that are rolled around . If you can read the markings it 's pretty enough for dropping on the enemy .,Germanic,Finnish
0_0_0,CombatFootage,"Explosives are a pretty inefficient way to move a tank wreck out of the way , unless they needed to break it apart of course .",Germanic,Finnish
0_0_0,Metric,Why the hell do they need a *Milk Act* to regulate container sizes in the first place ?,Germanic,Finnish
0_0_0,CombatFootage,"Well there 's bound to have been significant shipping and storage involved before they were loaded on to a bomber . If they were made in the US , a trip across the Atlantic for example .",Germanic,Finnish
0_0_0,Economics,That 's not really relevant to the graph . It 's a comparison of two snapshots of the income distribution and the purpose is to gauge changes in income inequality .,Germanic,Finnish
0_0_0,Metric,This is exactly what I presupposed .,Germanic,Finnish
0_0_0,news,"To be fair , the police has little to do with the bail amount . Now , the assistant DA , on the other hand ...",Germanic,Finnish
0_0_0,news,It 's the DA that requests it ...,Germanic,Finnish
0_0_0,news,See [ McVeigh et . al . 1995 ] ( http : //en.m.wikipedia.org/wiki/Timothy_McVeigh ) for more information .,Germanic,Finnish
0_0_0,news,"He already covered it . The law uses the word `` certain '' , which obviously means not all , or it would say `` all '' . And if it is not universal , I find it difficult to believe that it 's constitutional to enforce without clearly being communicated at the site .",Germanic,Finnish
0_0_0,MapPorn,& gt ; a large and increasingly aggressive neighbor up north You mean Canada ?,Germanic,Finnish
0_0_0,worldnews,"Everything gets an equal sized ribbon , but the awards can be anything . Campaign participation , service in a certain part of the DOD etc . ad infinitum . Here 's the list of what he currently has : https : //en.wikipedia.org/wiki/Marshall_B._Webb # Awards_and_decorations",Germanic,Finnish
0_0_0,news,"Detain to check facts , perhaps . Arrest and charge , no way .",Germanic,Finnish
0_0_0,MilitaryStories,"`` The First Strike Ration , or FSR , is a compact , eat-on-the-move assault ration designed for use during initial periods of highly intense , highly mobile combat operations . The FSR is substantially reduced in weight and size and enhances soldier consumption , nutritional intake , and mobility . '' `` As designed , all the components of an FSR can be eaten with little or no preparation . '' http : //www.mreinfo.com/us/fsr/first-strike-ration.html",Germanic,Finnish
0_0_0,Battlefield,"I had it yesterday , repeated trying let me log on to Battlelog , but then there were connectivity issues and there was no way to connect to a server so I just gave up .",Germanic,Finnish
0_0_0,MilitaryPorn,"They have yellow `` cockades '' in their knit caps , meaning they are training OPFOR or `` A2 Yellow '' as the generic enemy* are know in FDF wargames . They use the old camo pattern because it further separates them visually from blue forces . *It 's funny how the OPFOR always comes from the east and uses remarkably Russia-like organisation . : )",Germanic,Finnish
0_0_0,WarshipPorn,The two-pipe AMOS can actually do 16 rounds MRSI ( 2 x 8 rounds ) .,Germanic,Finnish
0_0_0,WarshipPorn,It 's built to go very fast through almost any sea state .,Germanic,Finnish
0_0_0,MilitaryPorn,It looks a lot like an air traffic control tower .,Germanic,Finnish
0_0_0,TrueReddit,"*Qui bono ? * Who likes the status quo of the Pentagon unable to do basic bookkeeping with it 's property ? And the fact that there are loads of rules in place designed to keep a better picture of the situation and many are being routinely ignored ? I mean , looking at the small shit people in the military seem to get shit for - up to and including general officers - who the hell is just `` too big to punish '' ? Civilians ?",Germanic,Finnish
0_0_0,MilitaryPorn,"The missile is not wire guided , it 's self guided if a target is locked . However , the seeker head feeds a picture back to the operator if he wishes to observe it : & gt ; The medium , long and extended range versions of the Spike also have the capability of `` Fire , Observe and Update '' operating mode . The missile is connected by a fiber-optical wire that is spooled out between the launch position and the missile . With this the operator can obtain a target if it is not in the line of sight of the operator at launch , switch targets in flight , or compensate for the movement of the target if the missile is not tracking the target for some reason . Hence , the missile can be fired speculatively for a target of opportunity , or to provide observation on the other side of an obstacle . So , either *lock , then fire* OR *fire , then lock* .",Germanic,Finnish
0_0_0,MilitaryPorn,Negative ghostrider . Read your article .,Germanic,Finnish
0_0_0,AskReddit,"And they tend to follow the collected opinions of certain persons . By that I mean once they accept *one position* held by an authority , they have trouble disagreeing with the person on *other unconnected matters* .",Germanic,Finnish
0_0_0,MilitaryPorn,"It is not wire *guidance* , it 's target update via wire , if you will . The missile seeker works independently of the launcher unit .",Germanic,Finnish
0_0_0,Military,I would imagine that the game does n't really connect with the real thing .,Germanic,Finnish
0_0_0,Finland,The title is fucked up . It 's religion studies - theology lite if you will - not government sunday school .,Germanic,Finnish
0_0_0,gifs,"Goddammit , how did I never spot him in *Desolation of Smaug* ...",Germanic,Finnish
0_0_0,Military,A platoon of infantry vets playing together with comms applying their expertise on RL combat techniques and whatnot on a BF game ? Probably would look and sound good . Also probably would get ganked by attack helo or a C4 VBIED jeep . : ),Germanic,Finnish
0_0_0,MilitaryPorn,"Certainly it comes from the tube , it is the only possibility . : )",Germanic,Finnish
0_0_0,Military,Paintballs are not bullets . About 30 meters out it starts become useless .,Germanic,Finnish
0_0_0,WorldofTanks,"Needs snow packed on the tree branches , to look really cold . And it should fall off when guns go off in vicinity .",Germanic,Finnish
0_0_0,MapPorn,"Well it 's quite well in keeping with the LOTR movies , where everything is always conveniently close for nice visuals .",Germanic,Finnish
0_0_0,worldnews,Grand committee does n't MATTER . The issue will always end up in the full chamber .,Germanic,Finnish
0_0_0,worldnews,"A ) Grand committee is a technicalty , it will always return to full chamber . B ) What exactly makes you think the MPs are going to change their stance the second time around in the full chamber ? The true test is after the elections in the spring . The next government CAN fuck this up .",Germanic,Finnish
0_0_0,worldnews,"We are called Finns , actually .",Germanic,Finnish
0_0_0,Finland,Can you debunk any of their facts ?,Germanic,Finnish
0_0_0,Finland,"The civil servants are not making the rules . They are following the law as written , they are hired for that express purpose . If they do n't follow the law , they get fired / charged . Very simple . You should blame the parliament and , by proxy , their voters .",Germanic,Finnish
0_0_0,WorldofTanks,It 's very realistic in fact . http : //en.wikipedia.org/wiki/Marching_fire,Germanic,Finnish
0_0_0,TankPorn,The big triangle thing looks very like a hydraulic arm with a log handling ( or equivalent ) tool attached ...,Germanic,Finnish
0_0_0,AskReddit,Inside the studio rather .,Germanic,Finnish
0_0_0,MilitaryPorn,"Nevermind the parade , there 's this curious thing most militaries have perfected called `` getting ready for doing shit ridiculously early '' .",Germanic,Finnish
0_0_0,Finland,It 's to have the only source be in a controlled environment . Namely a restaurant that is regulated and incentivized to exercise contol .,Germanic,Finnish
0_0_0,MilitaryPorn,New thang . [ M320 ] ( http : //en.m.wikipedia.org/wiki/M320_Grenade_Launcher_Module ),Germanic,Finnish
0_0_0,guns,The volatile chemicals are specifically added in manufacturing for the express purpose of detection both before and after detonation . https : //en.wikipedia.org/wiki/Taggant # Explosive_taggants,Germanic,Finnish
0_0_0,AskReddit,Make it a black baby ... : p,Germanic,Finnish
0_0_0,worldnews,"Weather is short term , a climate is ~30 years average of weather .",Germanic,Finnish
0_0_0,worldnews,Government subsidies ?,Germanic,Finnish
0_0_0,worldnews,"If you consult an authority on number theory , you may understand how 18 =/= 30 .",Germanic,Finnish
0_0_0,AskReddit,Training department that resists change ... Wow .,Germanic,Finnish
0_0_0,Games,You do n't understand how much hard disk capacity I have . Or how fast my broadband is .,Germanic,Finnish
0_0_0,Finland,There is a story that some Finnish bars would have a single sandwich ( or something like it ) that would get `` served '' to each patron in turn .,Germanic,Finnish
0_0_0,gifs,From the description one would think the emergency stop is achieved by detonating some explosives in the engines . So it 's extremely dangerous to have it be tripped by accident . The escalator could STOP !,Germanic,Finnish
0_0_0,TrueReddit,Fifth paragraph from the top .,Germanic,Finnish
0_0_0,Justrolledintotheshop,[ Press gang ] ( https : //en.wikipedia.org/wiki/Impressment # The_Impress_Service_and_impressment_at_sea ) [ Queen 's shilling ] ( https : //en.wikipedia.org/wiki/King % 27s_shilling ),Germanic,Finnish
0_0_0,worldnews,The point is they refused to state something there was no scientific basis for . Unless the warning is delimited with dates it 's pretty much what I stated above . The area was already designated as hazardous . What happens when the earthquake does n't happen within the estimated dates ? Or when the estimate is `` in the next several months '' ? Are they going to evacuate the town for as long as the scientists say ? Hardly .,Germanic,Finnish
0_0_0,worldnews,"Can you give me a source to a reputable news source saying a credible scientist has said a quake WILL CERTAINLY happen within certain dates ? `` yeah it COULD mean that but also might not . '' is not `` downplaying '' , it 's the best the seismic science community can say ! Also , what exactly were they supposed to say ? You dodged my point about dates . Edit : I hereby predict an earthquake in 2015 ! Lem me know when I can pick up my physics Nobel ...",Germanic,Finnish
0_0_0,helsinki,"http : //www.botta.fi/en/manala/frontpage/ Manala is a proper restaurant where the kitchen operates until 04 , Monday to Saturday . Never been there , but it has been often recommended . Menu seems to include Finnish dishes . It 's located very close to the Parliament building .",Germanic,Finnish
0_0_0,technology,Thay would have to prove damages if I understand this correctly . Winning a lawsuit is not an automatic payday ...,Germanic,Finnish
0_0_0,HistoryPorn,"Well one should think . 116 is top living age now , I do n't think they had younger recruits in WWI ?",Germanic,Finnish
0_0_0,HistoryPorn,Well damn me . So the limit is `` only '' 110 ...,Germanic,Finnish
0_0_0,Firearms,They mean a three-volley salute . 21 guns relates to cannon salutes .,Germanic,Finnish
0_0_0,Firearms,A very quick source : http : //www.honorguard.af.mil/library/,Germanic,Finnish
0_0_0,Firearms,Too bad . http : //www.mdmildep.org/funeralprogram/faq.html # d19 Also since protocol is the very embodiment of technicalities and tradition ; rifle =/= gun .,Germanic,Finnish
0_0_0,Firearms,"Did you reply to the wrong person , perhaps ? Or are you referring to the fact they reserve it for funerals only ? E : The document does state the same position as I have said . Unless the veterans are shooting actual artillery instead of rifles ...",Germanic,Finnish
0_0_0,Military,"& gt ; Shitty Intel lead American forces to falsely detain allied troops , Turkish citizens still butthurt about incident . You do n't say ... https : //en.wikipedia.org/wiki/Valley_of_the_Wolves : _Iraq",Germanic,Finnish
0_0_0,MapPorn,They would typically sail along the coasts . This kind of map gives you a sequence of the major landforms on the coast you can expect to pass during the trip . You can just `` tick '' off each cape and inlet as it appears and you know roughly how far you 've travelled .,Germanic,Finnish
0_0_0,TrueReddit,"In Pasteur 's defence , he was searching for ways to make better BEER . Milk is an afterthought .",Germanic,Finnish
0_0_0,TrueReddit,The salads cost $ 7 . The one dollar salads are day old donations at a test site ...,Germanic,Finnish
0_0_0,AskReddit,Is `` marketing '' also doublespeak ?,Germanic,Finnish
0_0_0,Games,"False , in EVE you keep score by the KILLMAILS ! ( And carebear tears . )",Germanic,Finnish
0_0_0,Games,Titans and gates ? Sounds like some serious retconning in the story department . : ),Germanic,Finnish
0_0_0,CombatFootage,Afghan National Airsoft league .,Germanic,Finnish
0_0_0,MilitaryPorn,By `` early '' I meant the beginning of training . Probably they switch once the skills are such they are n't going to fall off too much .,Germanic,Finnish
0_0_0,worldnews,"She did n't vote against , rather didi n't show up for the vote . That way she could only take a stance once , instead of being politically slow roasted over the autumn until today .",Germanic,Finnish
0_0_0,worldnews,"The change has to do with the allocation of dual language status to municipalities . The status is normally determined every ten years based on the language data in the population register . ( Minimum 8 % or 3000 residents minority language speakers . ) This status is set by government decree for ten years . There was a change in the law that directs extra government funds to dual language muncipalities . Basically some municipalities that are designated single language suffered in the change . However , the determination of language status is next made in 2023 and the government was not allowed to make special determinations . The new form of the law allows the government ( i.e . cabinet ) to assign a municipality dual language status **during** the ten-year period it had been determined to have a single language , if the municipal council asks for the change . This apparently fixes the income loss . ( I 'm fuzzy on the details ) [ The approved government proposal in Finnish , Swedish available . ] ( http : //217.71.145.20/TRIPviewer/show.asp ? tunniste=HE+206/2014 & amp ; base=erhe & amp ; palvelin=www.eduskunta.fi & amp ; f=WORD )",Germanic,Finnish
0_0_0,worldnews,Woman in fact .,Germanic,Finnish
0_0_0,worldnews,A Sleeping Voters ' Apathy Party would be a pretty major party in Finland .,Germanic,Finnish
0_0_0,worldnews,Incorrect . A registered partner widow is equal to a married widow in `` inheritance '' * . Children inherit in same manner if the deceased was a legal parent . ( \* It 's not technically inheritance . ),Germanic,Finnish
0_0_0,worldnews,Incorrect . See above .,Germanic,Finnish
0_0_0,worldnews,Additional brake light is the word you are looking for .,Germanic,Finnish
0_0_0,worldnews,"And it 's called Ad TV because it originally broadcast in the same channel , but between the public brodcasts .",Germanic,Finnish
0_0_0,worldnews,Equal conscription ( or none ) too will come to pass .,Germanic,Finnish
0_0_0,worldnews,"The possible problem is in the other acts that now need to be tweaked . The next parliament & amp ; government can *in theory* do much to hinder those changes . However , it 's pretty unlikely that they will try to go against this decision .",Germanic,Finnish
0_0_0,worldnews,"For this particular change to fail , the MPs would have to change their votes . Extremely unlikely that there will be such a swing . I 'd be very surprised if anyone switches . The truly possible , but still quite unlikely , roadblocks are in the next parliament and the government it forms . They will have to tweak all the relevant laws .",Germanic,Finnish
0_0_0,worldnews,"The grand committee is a mere technicality , the matter will return to the full house in all cases . The result of the final vote will not differ significantly from today .",Germanic,Finnish
0_0_0,worldnews,Because the issues are **purely legal and/or bureucratic** . * Adoption i.e . who is and is not an official parent * Surname without separate application to the registry * Legal recognition of gender Most of what the law says about marriage has to with the persons ' relationship **to the state** .,Germanic,Finnish
0_0_0,worldnews,"Well , we are n't . The word is `` a Finn ( pl . Finns ) '' .",Germanic,Finnish
0_0_0,MilitaryPorn,Perhaps to cut down on damaged rifles during early cross country riding training ?,Germanic,Finnish
0_0_0,MilitaryPorn,Also paint on back of first and the facemask of fourth . Perhaps even the pouch on the chest of fifth .,Germanic,Finnish
0_0_0,politics,`` Regular '' as in `` not specialist duties '' and `` line officer '' as in `` an officer with no leadership responsibilities '' . A bit of tautology there perhaps .,Germanic,Finnish
0_0_0,MilitaryStories,He was so much into supervising grooming in people who could not oppose him : http : //www.marinecorpstimes.com/story/military/crime/2014/11/19/sgt-maj-sixta-generation-kill-child-molestation-sentencing/19298495/,Germanic,Finnish
0_0_0,worldnews,Well he DID order it only last frid ... I mean Freitag !,Germanic,Finnish
0_0_0,JusticePorn,Should be a store on the strip mall in every town !,Germanic,Finnish
0_0_0,WTF,Wrong answer ...,Germanic,Finnish
0_0_0,WTF,You 'll remember prop wash .,Germanic,Finnish
0_0_0,AskReddit,"TBH , sounds like your game dev wanted develop professionally in a manner his previous position did n't allow for ...",Germanic,Finnish
0_0_0,AskReddit,I see my pun was a ) not as good as I thought b ) too complicated ...,Germanic,Finnish
0_0_0,AskReddit,A reasonable nation would get rid of nickels too and use Swedish rounding ...,Germanic,Finnish
0_0_0,AskReddit,"Oh , just browsing around with many tabs , new threads and old threads .",Germanic,Finnish
0_0_0,helsinki,"Have n't tried , but I intended to go until I read reviews that did n't really recommend them ... Not interested anymore .",Germanic,Finnish
0_0_0,helsinki,Does your experience include saunas where the water input is not regulated ? : p ( There is this stereotype in Finland that Central European saunas do not allow patrons to throw water on the rocks ... ),Germanic,Finnish
0_0_0,HistoryPorn,"Assuming it is only used when resting on the landing gear on the ground , why is the door set at an angle relative to vertical ?",Germanic,Finnish
0_0_0,Enhancement,"Filter **\*.ft.com** ? Or if wildcards are not allowed , just **.ft.com**",Germanic,Finnish
0_0_0,bestof,I was looking at the original comments just now and saw discussion about the Green men in Toronto Maple Leafs audience . Someone mentioned they did an AMA and when I clicked for more comments I did find a link to said AMA . I had posted the link myself . I have no recollection of the thread ...,Germanic,Finnish
0_0_0,WTF,"Begging your pardon m'lord , what 's a `` fly-tipper '' ?",Germanic,Finnish
0_0_0,Battlefield,Yeah . `` Wargaming needs to be fair ! '' Bleh .,Germanic,Finnish
0_0_0,politics,What is the typical length of training for regular line officers now ?,Germanic,Finnish
0_0_0,news,"I very much recognize the above , but I 'm talking about the ( legally ) intended end state , not the actual result . Neutralized *vs* all the way dead . It 's tricky separating these . As I understand it , self defence can not be an overt attempt at killing , just stopping the threat . E.g . I 've read that stating you acted to kill after being involved in a defensive shooting tends to end badly for the ( otherwise ) justified shooter .",Germanic,Finnish
0_0_0,helsinki,"The maintenance - or anybody else apart from the tenant for that matter - should n't have a key to the `` safety lock '' ( turvalukko ) . This is the opinion of the insurance companies . The owner of the apartment should surrender all copies when letting the apartment . If it is an emergency , like water leakage , they can break the door/defeat the lock and insurance will cover the damage .",Germanic,Finnish
