user,subreddit,post,family,lang
0_0_0,gifs,"Eyes right is the salute for the rank and file in formation , because if they were armed , they would carry the rifle at shoulder arms . That occupies the right ( saluting ) hand , so they could n't salute . So one form of salute covers all situations .",Germanic,Finnish
0_0_0,patientgamers,"Oh , it recovers just fine .",Germanic,Finnish
0_0_0,MilitaryPorn,If it was any longer it would interfere with magazine changes . AK pattern magazines rotate forward when extracting . So the vert grip would need to be moved forward to be longer .,Germanic,Finnish
0_0_0,MilitaryPorn,"~~Incorrect.~~ Irrelevant for the current situation . Russia hardly uses 7.62x39mm in any kind of common front line application . 7.62x54R yes , but not the intermediate round . *Edited for clarity . *",Germanic,Finnish
0_0_0,MilitaryPorn,"Because money . The current models are projected to stay competitive until 2035 . Now if the parliament actually gave the FDF enough money to totally replace the ca . 300,000 assault rifles , then yes , perhaps they would choose another model / caliber . And it would have to be an awful lot of money since there are much better defence investments ahead of a total assault rifle conversion .",Germanic,Finnish
0_0_0,MilitaryPorn,"Russia changed to 5.45 with the AK-74 family becoming standard issue in 1974 . Spetsnaz are not relevant to this issue and likely use the same caliber anyway , apart from pehaps some special purpose applications . The point is that the **mass amounts** of Russian ammunition to be found in the battlespace are going to be 5.45 . Anything else is irrelevant .",Germanic,Finnish
0_0_0,MilitaryPorn,"Yes , all true , but that 50 year old choice is not an argument for not switching the rifles now . The real reason is of course the cost involved .",Germanic,Finnish
0_0_0,MilitaryPorn,"Not much of a joke , since it was an official and documented exercise enemy .",Germanic,Finnish
0_0_0,MilitaryPorn,"The official name of the unit includes the word , parentheses and all .",Germanic,Finnish
0_0_0,AskReddit,Whatever gave you the impression they want people with proven critical thinking skills on juries ?,Germanic,Finnish
0_0_0,patientgamers,I did and thank you .,Germanic,Finnish
0_0_0,AskReddit,You are describing robbery ( mugging ) i.e . demanding things be surrendered on threat of violence . Thievery means stealing i.e . just taking things . Thief =/= robber .,Germanic,Finnish
0_0_0,patientgamers,Do Far cry 3 outposts respawn a la Far Cry 2 ? That made me drop the game ...,Germanic,Finnish
0_0_0,tanks,Floor plates .,Germanic,Finnish
0_0_0,WorldofTanks,That is also true for chances of tomato salad ...,Germanic,Finnish
0_0_0,askscience,10000 m/s² is still 1000 G .,Germanic,Finnish
0_0_0,WorldofTanks,"Are n't the tomatoes and purples are picked from the same pool ? If not , what 's the difference ?",Germanic,Finnish
0_0_0,WorldofTanks,"Indeed . And vice versa for purps , would n't those balance to neutral ?",Germanic,Finnish
0_0_0,wikipedia,"Oh , it 's YOU .",Germanic,Finnish
0_0_0,Military,"Because , like the Taliban , they do n't give a fuck . They just wan na get high ( and paid , if at all possible ) .",Germanic,Finnish
0_0_0,Futurology,"`` Rods from God '' , actually .",Germanic,Finnish
0_0_0,MilitaryPorn,OS : https : //scontent-ams3-1.xx.fbcdn.net/hphotos-xta1/t31.0-8/12087173_937047446367580_9071428647688262422_o.jpg,Germanic,Finnish
0_0_0,TopGear,"*'All stations , `` JUDY '' , I repeat , `` JUDY '' . '*",Germanic,Finnish
0_0_0,Firearms,"That 's for both participants armed , I believe .",Germanic,Finnish
0_0_0,worldnews,GPS do n't work like that . The vehicles would need to broadcast the location somehow .,Germanic,Finnish
0_0_0,CombatFootage,The Russian statement said they negotiated the overflight with the governments and made sure 'the flight path was only over desolate areas and did n't endanger any civilians ',Germanic,Finnish
0_0_0,MilitaryPorn,Video of older exercise : https : //www.youtube.com/watch ? v=bNuVCvIGKxE,Germanic,Finnish
0_0_0,helsinki,"For airport = & gt ; city always take P , it 's faster . And vice versa .",Germanic,Finnish
0_0_0,boardgames,"Would have to deal the hands also , to be comparable .",Germanic,Finnish
0_0_0,patientgamers,"Also : When the benefactor stock has reached the maximum value post-mission and you have cashed out the pre-mission investment , remember to re-invest in the stock that took a dive , it will recover to previous values after a while providing another sure bet .",Germanic,Finnish
0_0_0,helsinki,"What is the benefit over a keyed lock ? The usual disc tumbler locks are already extremely hard to pick . If you have a *turvalukko* on your door , you should have ALL the keys to it anyway .",Germanic,Finnish
0_0_0,videos,My front door opens out .,Germanic,Finnish
0_0_0,videos,Dry ice loads must be a bitch to inspect ...,Germanic,Finnish
0_0_0,Finland,But the hand with the knife he has noticed is not implemented .,Germanic,Finnish
0_0_0,Finland,If only they 'd implemented the disembodied hand with the knife . Puukko would fit very well .,Germanic,Finnish
0_0_0,Military,"Indeed , 30 kilograms . Which is probably why they are hauling the 18 kilogram Mk 47 ...",Germanic,Finnish
0_0_0,Military,"Activate closed captioning , they are properly translated .",Germanic,Finnish
0_0_0,MilitaryPorn,"You are describing the modern version , the SACLOS method is a bit different .",Germanic,Finnish
0_0_0,MilitaryPorn,"True , but typically the fiber optic fire-and-observe method is only used to engage targets known to be behind terrain or other obstacles . Fire-and-forget is much more useful for targets where the seeker head has LOS before launch . And technically they are n't wire-guided , since the guidance is on board . The operator only provides targeting updates , not steering commands to the missile .",Germanic,Finnish
0_0_0,dataisbeautiful,"Make a fist in your non-dominant hand with knuckles up . With your dominant index finger point to the index finger knuckle and think `` January '' . Proceed to point to the `` valley '' between kncuckles and think `` February '' Continue alternating between knuckles and `` valleys '' while going throught the list of months . Knuckle is 31 days , `` valley '' is 30 days . After fourth knuckle and `` July '' start back , again from a knuckle , making a second 31 for August . Repeating the fourth knuckle is equivalent to the double 31s at July/August . February is the odd one out , but you 'll remember to make the exception there . For advanced method stop using the dominant hand .",Germanic,Finnish
0_0_0,gifs,"Psst , you can make your code display as codeblock by putting four spaces in the beginning of the line . # abcd",Germanic,Finnish
0_0_0,Firearms,Obscures the sights ?,Germanic,Finnish
0_0_0,MilitaryPorn,"Usually by digging somewhere . In this case it looks like they were digging a hole for building foundations . [ Wiki says ] ( https : //en.wikipedia.org/wiki/Unexploded_ordnance # United_Kingdom ) : `` ... from 2006 to 2009 , over 15,000 items of ordnance were found in construction sites in the UK . '' c.f the Belgian [ Iron harvest ] ( https : //en.wikipedia.org/wiki/Iron_harvest # Unexploded_munitions ) : & gt ; During World War I an estimated one tonne of explosives was fired for every square metre of territory on the Western front . As many as one in every three shells fired did not detonate . In the Ypres Salient , an estimated 300 million projectiles that the British and the Germans forces fired at each other during World War I were duds , and most of them have not been recovered . In 2013 , 160 tonnes of munitions , from bullets to 15 inch naval gun shells , were unearthed from the areas around Ypres .",Germanic,Finnish
0_0_0,MilitaryPorn,"As much as I hate linking the Fail , they do have a nice collection of images in this case : http : //www.dailymail.co.uk/news/article-3008117/Thousands-evacuated-homes-roads-closed-400m-radius-huge-1-000Ib-unexploded-WWII-bomb-building-site-south-London.html",Germanic,Finnish
0_0_0,skyrim,You are aware that vanilla Skyrim arrows curve into targets at range ? Bit like auto-aim .,Germanic,Finnish
0_0_0,WorldofTanks,BDR G1 B. I . Just . Can not . Figure it out . It 's so bad .,Germanic,Finnish
0_0_0,WorldofTanks,It 's more the high profile and low speeds .,Germanic,Finnish
0_0_0,Firearms,It 's to point out that you can master sniping from bushes with such an AR .,Germanic,Finnish
0_0_0,MilitaryStories,& gt ; plenty of pictures for the officers to look at I like how this implies no one actually reads your reports . : D,Germanic,Finnish
0_0_0,HistoryPorn,"Ya got the wrong picture from the series , this is *Boarding the School Bus* . Common mistake , see it all the time ...",Germanic,Finnish
0_0_0,Metric,"OK so it was n't decimal , but how on earth was it easier ?",Germanic,Finnish
0_0_0,WorldofTanks,HE is also useful for resetting cap on hard targets via module damage .,Germanic,Finnish
0_0_0,talesfromtechsupport,"It just means a recurring payment is made automatically on a schedule , based on an agreement between the bank and the customer .",Germanic,Finnish
0_0_0,talesfromtechsupport,"Direct transaction is between account holding banks , no credit processor involved .",Germanic,Finnish
0_0_0,talesfromtechsupport,Surely the bank can lift the limit for a day while the payment is made ? Or does it come from some state regulation instead of security ?,Germanic,Finnish
0_0_0,talesfromtechsupport,What 's wrong with just sending money to their account ?,Germanic,Finnish
0_0_0,talesfromtechsupport,"Ah yes , if you ca n't get a bank account it would be hard to do .",Germanic,Finnish
0_0_0,TrueReddit,If he was on the docket there was a charge .,Germanic,Finnish
0_0_0,TrueReddit,He said `` unless you think *you* are going to die . '' So no call .,Germanic,Finnish
0_0_0,TrueReddit,Not gon na be me though .,Germanic,Finnish
0_0_0,TrueReddit,"Life 's hard , bad things happen to good people all the time , just look out for number one .",Germanic,Finnish
0_0_0,gifs,Plastic costumes are essentially solid fuel .,Germanic,Finnish
0_0_0,Firearms,Only thing one could really ask for is not always immediately falling down when shot . Effective central nervous system hits excluded naturally . But then again the main reason many people fall down when shot is they 've lear n't from the movies it 's the done thing ...,Germanic,Finnish
0_0_0,Metric,"I do n't get this : & gt ; The imperial system made it easier for Murray to calculate progress in his and Graeme ’ s pay though . & gt ; “ Our wages have gone up 11,100 percent since we started 54 years ago , ” he says . Surely percentage amounts of decimal currency do not depend on the measurement system ?",Germanic,Finnish
0_0_0,Firearms,"I 'm not saying it 's not possible , not at all . Just very very steretotypical in the realm of movie shooting . And the second guy does start falling before the headshot .",Germanic,Finnish
0_0_0,MilitaryPorn,And you put the tallest soldiers you have on the honor guard ...,Germanic,Finnish
0_0_0,TopGear,That 's a separate 2014 film . DVD material basically . E : Part 2 you said ... http : //www.imdb.com/title/tt4217172/ https : //en.wikipedia.org/wiki/Top_Gear_DVDs,Germanic,Finnish
0_0_0,MilitaryPorn,I can only see the flash hider ?,Germanic,Finnish
0_0_0,TopGear,DVD special in fact . https : //en.wikipedia.org/wiki/Top_Gear_DVDs,Germanic,Finnish
0_0_0,netsec,Verification of accounts is purely an internal decision by Twitter . There 's no `` you '' or `` having your account verified '' in it . They verify what they see fit and the methods are not disclosed AFAIK . [ source ] ( https : //support.twitter.com/groups/31-twitter-basics/topics/111-features/articles/119135-about-verified-accounts # ),Germanic,Finnish
0_0_0,Military,"Social democrats are a proper political party , because some of the voting public thinks it 's a fair idea , so some of the goverment is composed of politicians from such a party . The `` power '' comes indirectly from the people . It 's not like they can just get their demands by blackmail like stevedores stopping exports in harbours , but when they make noise , the media and the people care and it 's embarrasing to the government . The representatives are also not necessarily in the service anymore , perhaps they 've never been . Also there may be legislation that gives unions certain status . Ca n't discriminate between unions then . EDIT : I 'm baffled , what in this is wrong or annoying ?",Germanic,Finnish
0_0_0,Military,"Yeah damn surface ships , they do n't have to care about rocks and torpedoes ...",Germanic,Finnish
0_0_0,Military,"The guy that IS getting kickbacks from milk producers , but is NOT getting anything from the egg marketers ...",Germanic,Finnish
0_0_0,TankPorn,I think that 's an agricultural plow underneath the front of the tank ...,Germanic,Finnish
0_0_0,AskReddit,"No , the New London Bridge is in Arizona . The Brits foiled their marketing plan though , by building a new London Bridge .",Germanic,Finnish
0_0_0,AskReddit,B U C K E T,Germanic,Finnish
0_0_0,videos,I think the big charge is a simulated terrorist device . The bursting on the back of the bus seems to come from floor level .,Germanic,Finnish
0_0_0,AskReddit,"Some tax authorities assume a certain level of tips , though .",Germanic,Finnish
0_0_0,videos,"Do n't forget the powder charged practice grenade . Works just like the real deal , but the shell is different .",Germanic,Finnish
0_0_0,videos,I guess I expected a bit more competence from the boot . My bad .,Germanic,Finnish
0_0_0,videos,"Well yes , but I did n't expect anyone would be able to hit THAT wall with a throw .",Germanic,Finnish
0_0_0,Steam,Because that 's the image in the article .,Germanic,Finnish
0_0_0,TopGear,"If it does n't work well enough , they 'll just do what Finland did and make it a tax on everyone , not only license holders .",Germanic,Finnish
0_0_0,videos,Yes I get that TYVM .,Germanic,Finnish
0_0_0,videos,"Why would you have a wall in the throwing direction ? E : Right , I expected some OTHER wall..",Germanic,Finnish
0_0_0,skyrim,"Like Finland , sans the colonial history .",Germanic,Finnish
0_0_0,MilitaryStories,"& gt ; His uncle brought him to our FOB because , like many Afghans , he had an outsized belief in the power of our medicine . We can fix anything . A person that worked in a medical role in an ISAF base mentioned that they also got pretty weird stuff , including physical trauma obviously from maltreatment of children , like intentional burns for discipline and so forth . Most interestingly , at least in that location **no local that was brought in to the base ever died in their care** , they always expired after having been turned over to the local ambulance that took them away . Up to and including very visible CPR and all the trappings of working a code during loading the body . No matter the condition they were originally brought in .",Germanic,Finnish
0_0_0,pcmasterrace,"How much money do they make ? Well , Supercell , of Hay Day and Clash of Clans fame , had 1.5 billion euros in revenues in 2014 , with EBITDA of 515 million euros . That 's ~ 33 % . They spent 400 million euros on advertising ( c.f . AngryNeeson52 ) . Their profit per employee was about 3 million euros .",Germanic,Finnish
0_0_0,netsec,"Meh , figures they wo n't mention that .",Germanic,Finnish
0_0_0,MilitaryStories,"Paragraphs , excellent . The stream of consciousness -effect is still a bit jarring though . A bit of editing before publishing might make a world of difference . Also if you are not in the habit of writing long texts in browsers , a word of advice : Type the text in a word processing program , then copy to the submit window . They lose your text a lot less than websites/browsers . Even plain Notepad is better than a browser .",Germanic,Finnish
0_0_0,videos,"`` Do you have a crossflag ? You have to have a crossflag to partake ... according to the rules I just made up . '' FFS , it 's a modification of an Eddie Izzard sketch . Guess I need to put quotations on it ...",Germanic,Finnish
0_0_0,MilitaryStories,Well I tried to imply that in a friendly manner by `` a bit of editing '' . : ) No one 's a second Kipling on their first few pages ...,Germanic,Finnish
0_0_0,history,"OP is asking about Wehrmacht members that returned to Germany after having been captured , not persons captured BY Germany ...",Germanic,Finnish
0_0_0,worldnews,"Video is easily completely defeated though . Light does n't go through most matter , sound does . It 's much harder to block microphones from detecting sound . Secondarily , video takes sooo much more bytes to store . We are talking only tens of megabytes of storage in the flight recorders , because they have to be extremely rugged .",Germanic,Finnish
0_0_0,worldnews,The protocol for a replacement person for a pilot out of the cockpit is not in mandatory in Europe . So far .,Germanic,Finnish
0_0_0,worldnews,The reason he did n't make a nosedive right away is that the Airbus computers do not allow it . Nor do they allow aileron rolls .,Germanic,Finnish
0_0_0,worldnews,"Well , I have our local public broadcaster reporting that Norwegian just implemented it today . They quote the COO saying it 's not required currently . I 'd expect him to be up on the current EU aviation regulations ... edit : [ Norwegian press release ] ( http : //www.mynewsdesk.com/uk/norwegian/pressreleases/norwegian-changes-cockpit-procedures-1135685 ? utm_campaign=send_list & amp ; utm_medium=email & amp ; utm_source=sendgrid )",Germanic,Finnish
0_0_0,worldnews,1 . So you get a `` Yeah someone obscured the camera '' . End of information . 2 . `` Extremely rugged '' . Consumer electronics are totally beside the point .,Germanic,Finnish
0_0_0,MapPorn,How is the data presented here ? What is the meaning of the internal borders ? Surely these dots are n't accurate to geographic location ?,Germanic,Finnish
0_0_0,worldnews,AFAIK the latest have modern solid-state memory .,Germanic,Finnish
0_0_0,worldnews,"Well I do n't design them , I just read what 's said about the recorders .",Germanic,Finnish
0_0_0,MapPorn,So the dot cloud is just a shitty way of representing a color . I 'm disappointed .,Germanic,Finnish
0_0_0,TankPorn,Vice versa ? The Pz . III is trying to sink the Pz . II ?,Germanic,Finnish
0_0_0,TopGear,"The date is correct for the Polar-challenge-Hilux-up-an-Icelandic-volcano in S15E01 , so the video editor probably mixed up the sources for different bits of Hilux-footage .",Germanic,Finnish
0_0_0,TankPorn,Ah of course .,Germanic,Finnish
0_0_0,witcher,"Yeah , so comfortable in your jeans pocket ... : p",Germanic,Finnish
0_0_0,Enhancement,"It was falsified anyway , so good riddance .",Germanic,Finnish
0_0_0,WTF,"It is . Earth , wind , fire , water , upvote .",Germanic,Finnish
0_0_0,wikipedia,"If they are making money , a significant amount of someone 's care enough to pay..",Germanic,Finnish
0_0_0,interestingasfuck,No zoom lens needed when this rock face is only 5 meters off the ground ...,Germanic,Finnish
0_0_0,MilitaryPorn,"The armed forces get priority with the food and pretty much anything else too . Especially ca n't have starving-looking guards at the DMZ . Kinda like US sends all tall soldiers in Korea to the DMZ , to mess with the North .",Germanic,Finnish
0_0_0,Finland,"Is the point about paying with the credit card simply financing the purchase or are you looking to take advantage of some extra features such as insurance ? If former , are the cash fees on your credit card huge ? You could draw cash and either deposit yourself or have a trustworthy person depoit and pay the bill . I also find it very curious that an online store would send product unpaid to a consumer . Have you tried negotiating with the merchant concerning the payment methods ?",Germanic,Finnish
0_0_0,MilitaryPorn,Being extracted . Or is the gunner and the extractee is in his seat . I believe the latter procedure is done for certain wounded extractees .,Germanic,Finnish
0_0_0,Finland,"5 ) Kinda taboo in southern Finland : In public spaces , to include public transport , there is an unspoken rule to not sit ( or stand ) next to strangers if you can avoid it by choosing another seat ( /spot ) . Personal space measures about one meter . Once above is no longer possible , do what 's most convenient .",Germanic,Finnish
0_0_0,MilitaryPorn,Navy has admirals ...,Germanic,Finnish
0_0_0,MilitaryStories,Ai n't that the truth .,Germanic,Finnish
0_0_0,MilitaryStories,Personal space is removed as contraband at induction and re-issued at EAS .,Germanic,Finnish
0_0_0,Nexus5,Upvoted from my reddit Sync Pro .,Germanic,Finnish
0_0_0,MilitaryStories,I think he would 've written `` ex-wife '' if that was the case ?,Germanic,Finnish
0_0_0,gifs,Like the tales of old school police officers picking up casings after reloading a revolver in an actual gnfight . Because that was what they did on the marksmanship range and they only practiced marksmanship with their weapons ...,Germanic,Finnish
0_0_0,AskReddit,This too shall pass .,Germanic,Finnish
0_0_0,MapPorn,"The data is per [ census tract ] ( https : //en.wikipedia.org/wiki/Census_tract # United_States ) , which are artificial divisions of the area . The color borders are the limits of these census tracts . So the big `` empty '' tracts are somewhat regularly shaped at this level , while smaller tracts create more `` resolution '' in the data . Or there are a lot of tracts that are very empty next to each other . Hard to tell without looking at the tract breakdown on map ... . E : Well , I checked , and yeah , some of the tracts are tiny and others are huge . And the logic is not exactly obvious . Example : http : //i.imgur.com/4AB213T.jpg Solid colors A and B are single tracts , while box C contains about 50 tracts . And you can see it in the resolution of the data .",Germanic,Finnish
0_0_0,MapPorn,"Oh , they get across , but the Finnish Sami like having live^1 reindeers in their herds ... Compare OP map to the official [ Reindeer Herding area map ] ( https : //ilmasto-opas.fi/ilocms-portlet/article/85bdb195-39c4-4633-a2c9-f26c23e07022/r/96d3f217-03b6-441b-bf86-18750b1f9474/poronhoitoalue.jpg ) ^1 The exception is during the military 's artillery exercises in Lapland , remarkable number of reindeer seem to find their way to the target areas . : p",Germanic,Finnish
0_0_0,european,"I have no preference to offer , I just find it an interesting way to put it . Feels a bit archaic to be honest , looking from ESL point of view .",Germanic,Finnish
0_0_0,Finland,Also widely available at bars . Just do n't touch the stuff that 's sold in grocery stores .,Germanic,Finnish
0_0_0,pcmasterrace,"Damn , this makes me annoyed that my 240GB Extreme Pro will take a week to arrive ... Ca n't wait to get moving programs .",Germanic,Finnish
0_0_0,sabaton,Artsy-fartsy ? I saw them in Berlin . Not impressed .,Germanic,Finnish
0_0_0,AskReddit,[ `` You like Huey Lewis and the News ? `` ] ( https : //www.youtube.com/watch ? v=LB5YkmjalDg ),Germanic,Finnish
0_0_0,WorldofTanks,What is spirit week ?,Germanic,Finnish
0_0_0,InternetIsBeautiful,I do n't understad the need to put pills in a bottle and count again and again . Blister packs are a thing these days ...,Germanic,Finnish
0_0_0,interestingasfuck,One would think a suitable ground clearance and SOP of `` stay the fuck down if you fall '' would cut down on incidence of no 2 ?,Germanic,Finnish
0_0_0,interestingasfuck,"Hardly equivalent . The usage here is bridging the two concepts , the the proper Estonian name of the activity and the word swing , into a single concept of `` a particular type of swing used in this activity '' . After noting that the text uses just `` swing '' to refer to the contraption . Your example is about acronyms becoming word-like within a single language .",Germanic,Finnish
0_0_0,interestingasfuck,"Come on , I got [ this ] ( http : //www.physicsinsights.org/up_in_a_swing.html ) in 3 seconds off Google .",Germanic,Finnish
0_0_0,interestingasfuck,"Ehm , ground clearance as in the distance between the ground and the swing at rest ? I fail to see how it can get smaller ?",Germanic,Finnish
0_0_0,gifs,Because the use was started by the arriving Europeans .,Germanic,Finnish
0_0_0,gifs,Elk is properly *kanadanhirvi* or *vapiti* .,Germanic,Finnish
0_0_0,gifs,"Nah dude , `` vapiti and `` kanadanhrvi '' are the proper species names for *Cervus canadensis* in Finnish , it 's not an expression and it translates exactly to the proper English species name of `` elk '' .",Germanic,Finnish
0_0_0,interestingasfuck,"OK , so did n't really look at your picture that well and assumed they are all like the the OP GIF ... But why should it have to be only 10 cm off at rest ?",Germanic,Finnish
0_0_0,Finland,One major difference is much more responsive and easier to use tram line selection . And the HSL version does n't draw the route ( s ) of the selected line ( s ) .,Germanic,Finnish
0_0_0,european,That is an interesting idiom . Why do British papers quite often refer to the court hearing something ? Is it to clearly separate reporting of testimony from reporting the finding ?,Germanic,Finnish
0_0_0,videos,"There are LHD markets that are adequately served by English speaking ads . Like the whole of Nordics for example . Lingua franca and all that jazz , ya know ? Limited availability at time of production is another possibility .",Germanic,Finnish
0_0_0,pcmasterrace,You can make separate user accounts in Netflix .,Germanic,Finnish
0_0_0,gifs,They do . Your doc ( /medical organisation ) is just behind the times .,Germanic,Finnish
0_0_0,MilitaryPorn,What is the white pipe structure in the foreground ?,Germanic,Finnish
0_0_0,MilitaryPorn,Scouts and officers .,Germanic,Finnish
