Drama_poli,europe,implying that there is any room for negotiations left . And with Macron there is really no hope for anything but WTO exit .,Germanic,English
Drama_poli,europe,It might cost more but will keep the conservatives United .,Germanic,English
Drama_poli,europe,which why the next 2 years will be waste time and result in no deal been reached,Germanic,English
Drama_poli,europe,"All EU issues will magically solve themselves , now that the UK left . All countries like Poland and Hungary will happily share the refugee burden with Germany , Sweden . Countries will reform and be fiscally responsible and not blame the Euro and Germany for their internal problems ever again .",Germanic,English
Drama_poli,europe,that should be interesting,Germanic,English
Drama_poli,europe,at least they will not be part of it . meanwhile Italy ... ..,Germanic,English
Drama_poli,europe,The economy is hardly a priority for the government . They are looking for a quick exit and would tolerate some economic swings . I am still not convinced that Theresa wants to get \ '' best possible deal\ '' that leaves Britain close to Europe.\\nBrexit is geopolitical and the EU is no longer a Pilar of British foreign policy . May recognizes that .,Germanic,English
Drama_poli,europe,"I actually always liked to Browse Wikipedia to look at the GDP standing of EU.\\nNot European , but I root for EU against US and china . I also like British politics : /",Germanic,English
Drama_poli,europe,I can understand why they hate England but not the obsession with England .,Germanic,English
Drama_poli,europe,I do feel bad for the Greek people not their government .,Germanic,English
Drama_poli,europe,That is not fair most of the time the public is hard to read and have unrealistic demands that politicians have to meet . I sympathize with the politicians more than the public in most situations .,Germanic,English
Drama_poli,europe,It seems useless ?,Germanic,English
Drama_poli,europe,You are not fun : p,Germanic,English
Drama_poli,europe,The is a limit on what governments can do . There will always be some who fall through these cracks .,Germanic,English
Drama_poli,europe,"But norway has a huge reserve , which invests across Europe that is a powerful levrage . And I expect Norway is not as vilified as the UK so they might get a deal .",Germanic,English
Drama_poli,europe,"Our politics is so boring , he will not fit in .",Germanic,English
Drama_poli,europe,But all the legal stuff is taking ages and they were not planning for the possibility of brexit .,Germanic,English
Drama_poli,europe,Woah does Spain has a king and president ?,Germanic,English
Drama_poli,europe,British media is very lacking of standards .,Germanic,English
Drama_poli,europe,"no they are just like all other countries with pricks , good people , horrible people and every thing in between . I guess it is German people who will choose the direction they want their country to take . So cheer up .",Germanic,English
Drama_poli,europe,Empathy for other white people only in Poland .,Germanic,English
Drama_poli,europe,He is a Barlin based columnist and mostly focuses on foreign affairs and German politics .,Germanic,English
Drama_poli,europe,the map and the table are not on same scale,Germanic,English
Drama_poli,europe,Poles are west slavic .,Germanic,English
Drama_poli,europe,It could be more effective than you realise,Germanic,English
Drama_poli,europe,"Switzerland , Paris , and south England too .",Germanic,English
Drama_poli,europe,People need to feel the EU is indeed in control to defeat populists .,Germanic,English
Drama_poli,europe,"Well there is alot of political uncertainty , at least enough to disrupt that relation though .",Germanic,English
Drama_poli,europe,Drop out and he thinks school is useless,Germanic,English
Drama_poli,europe,Theresa has to chose between short to medium term economic hardship with no strings attached or good economy with many strings attached to EU which you are no longer able to influence .,Germanic,English
Drama_poli,europe,To be fair to him maybe he is referring to huge economic impact that would have .,Germanic,English
Drama_poli,europe,This is Chicago level violence has to stop . Gun control now,Germanic,English
Drama_poli,europe,"Glorious , you are welcome to invade New Zealand .",Germanic,English
Drama_poli,europe,It is time for debt forgiveness .,Germanic,English
Drama_poli,europe,What if Greece joins Germany as a state .,Germanic,English
Drama_poli,europe,But the blond hair : /,Germanic,English
Drama_poli,europe,Financial industry accounts 10 % of the gdp and 70 % of financial services are domestic so maybe do some research before commenting .,Germanic,English
Drama_poli,europe,"Many people in the west unfortunately believe they have nothing to lose . Stability , at least some functioning government , and even rule of law are been taken for granted",Germanic,English
Drama_poli,europe,That should upto Scotland to decide .,Germanic,English
Drama_poli,europe,I love Sweden so much . The rest of the world should be ashamed .,Germanic,English
Drama_poli,europe,"Transphobes are out in force it seems , reddit is very transphopic . Sweden rocks . Transphopia is disgusting .",Germanic,English
Drama_poli,europe,/r/Europe is full of transphobes then,Germanic,English
Drama_poli,europe,Lack of compassion like Sweden .,Germanic,English
Drama_poli,europe,What did trans people do in Sweden that caused harm ?,Germanic,English
Drama_poli,europe,They were vile earlier . /r/uk and /r/europe are transphopic but still not as disgusting as/r/news and /r/ukpolitics ( when trans people are mentioned ) at least,Germanic,English
Drama_poli,europe,I afraid mods are our only saviors . Tell me it is going to be ok .,Germanic,English
Drama_poli,europe,It irritates me that you have a Swedish flag flair . I take back tiny bit of my love to Swedes earlier,Germanic,English
Drama_poli,europe,Wow,Germanic,English
Drama_poli,europe,That sounds worse,Germanic,English
Drama_poli,europe,I am a naughty boy Finland . ^pls ^notice^me,Germanic,English
Drama_poli,europe,That is what they want you to think .,Germanic,English
Drama_poli,europe,Haha I have been saying this in /r/eu for long time . America is actually nice and has problems like all other countries .,Germanic,English
Drama_poli,europe,This is perfect .,Germanic,English
Drama_poli,europe,Southern Europe best Europe .,Germanic,English
Drama_poli,europe,Not for long,Germanic,English
Drama_poli,europe,I think it would sound better in Russian .,Germanic,English
Drama_poli,europe,Poverty relative to American income which is the highest in the world . I would rether be poor than in most of the world .,Germanic,English
Drama_poli,europe,No vote before brexit .,Germanic,English
Drama_poli,europe,Irishtimes is british ?,Germanic,English
Drama_poli,europe,"There is no \ '' free world\ '' . Freedom is subject and hard to measure . most people in the world are free , this is western centric ( I don\\'t have any problem with it ) . If there is one it is Donny . The US and Germany are not comparable . Germany as we know it now only exists because of the US . An incompetent useless US president is still not comparable to a regional power .",Germanic,English
Drama_poli,europe,There is nothing called \ '' freedom\ '' countries put necessary limits on all kind of stuff to make society . For Germany those laws are important to keep it functioning . and not repeat the past .,Germanic,English
Drama_poli,europe,No shit is all right most people have a comfortable life \ '' freedom\ '' never existed anywhere will never exist adults should not have childish believes . And clearly it is not that important .,Germanic,English
Drama_poli,europe,Tony looking shady cunt as always . Man I love that guy .,Germanic,English
Drama_poli,europe,The US is not dragging anyone . the rest of the world is doing nothing other than lame talk .,Germanic,English
Drama_poli,europe,Maybe not white enough to some people,Germanic,English
Drama_poli,europe,Glad my country is not strong enough to fuck the whole planet .,Germanic,English
Drama_poli,europe,We will still be irrelevant so no change .,Germanic,English
Drama_poli,europe,lol your fantasies are cute .,Germanic,English
Drama_poli,europe,Anti-Americanism is cool here,Germanic,English
Drama_poli,europe,Yeah the government is no longer subsidizing rich families not paying into the grid how terrible . The UK has small carbon footprint for developed [ country ] ( https : //en.wikipedia.org/wiki/List_of_countries_by_carbon_dioxide_emissions_per_capita ) . Solar is also stupid in a cloudy UK,Germanic,English
Drama_poli,europe,It a threat to hard farming families .,Germanic,English
Drama_poli,europe,Fuck you Merkel is a respectable leader . And world treasure .,Germanic,English
Drama_poli,europe,It just angery kids regular school shooting calm your tits,Germanic,English
Drama_poli,europe,I think it will be better for rUK if Scotland goes . Less deficit to deal with less uncertainty .,Germanic,English
Drama_poli,europe,I hope she out lives you .,Germanic,English
Drama_poli,europe,And some powerful people in the tory party and EU leaders who had enough of the UK want it to fail .,Germanic,English
Drama_poli,europe,The uk have to make it clear it will defend its territory .,Germanic,English
Drama_poli,europe,It will not go and Spain needs to stop interfering and mind its own business .,Germanic,English
Drama_poli,europe,It would net positive if they were dead considering the age .,Germanic,English
Drama_poli,europe,They would if Barlin threatens to take Essex .,Germanic,English
Drama_poli,europe,By saying populist stuff that are popular in Germany .,Germanic,English
Drama_poli,europe,WTO is the only way this will go I can smell it .,Germanic,English
Drama_poli,europe,Cheers mate . The world loves Germans,Germanic,English
Drama_poli,europe,"Why is Estonia low , it is odd .",Germanic,English
Drama_poli,europe,Yeah it totally fine to call black people niggers just like calling Roma people a labal that was used to degrade and dehumanise them . Europe should just treat Roma people just like the old days by putting them in ovens/s,Germanic,English
Drama_poli,europe,10 % of ( insert country ) is bat shut insane,Germanic,English
Drama_poli,europe,I am tired of all these resignations they are not cool any more,Germanic,English
Drama_poli,europe,Poland is so cool,Germanic,English
Drama_poli,europe,love it,Germanic,English
Drama_poli,europe,Bigotry comes in all sexuality it seems .,Germanic,English
Drama_poli,europe,No surprise,Germanic,English
Drama_poli,europe,Most are privileged hetros of course .,Germanic,English
Drama_poli,europe,Nah it will cause Scotland to leave that must be worth it,Germanic,English
Drama_poli,europe,"I guess it is the mentality , Germany is position in the heart/centre of Europe while Britain is the opposite and is on the edges like Turkey . They also overestimate how wide the English channel .",Germanic,English
Drama_poli,europe,Germany real Europe \\n\\nthe UK like Turkey= Europe ?,Germanic,English
Drama_poli,europe,The EU already decided it out for blood anyway,Germanic,English
Drama_poli,europe,The UK should not waste resources on hostile countries . Exiting without a deal is the best.\\n\\n\\n,Germanic,English
Drama_poli,europe,"The EU is not weak , they are just entitled . They want the US to protect them . The EU funds kurds while expecting Turkey to keep all refugees etc .",Germanic,English
Drama_poli,europe,The media is making it hard for Theresa to compromise .,Germanic,English
Drama_poli,europe,There is nothing more important than not treating part of society as second class . If hetros marry other people should be allowed too . And Germany has unfair adoption low for lgtb+ people .,Germanic,English
Drama_poli,europe,I am not smart I am just enjoying the shit show and shitposting my opinions .,Germanic,English
Drama_poli,europe,Yeah like the UK he is a threat,Germanic,English
Drama_poli,europe,Controled by the US the uk would be turned into uninhabitable muddy little island if you try .,Germanic,English
Drama_poli,europe,The the uk is a reliable partner for the US . I really hate the knees comparison because it more complex then that . countries maintain relationships that are useful to them and it is not a zero sum game .,Germanic,English
Drama_poli,europe,That is not how foreign relations work . Cameron failing to get the parliament to back him on syria derailed Obama objectives on Syrian war the whole dynamics of it . Obama was dovish in syria in after that which is very is important because it would have turned very differently .,Germanic,English
Drama_poli,europe,"It is not about trade . It is about politics , culture and everything else .",Germanic,English
Drama_poli,europe,But muh rebate,Germanic,English
Drama_poli,europe,European politics is providing me all the exitement I want .,Germanic,English
Drama_poli,europe,Classic bit no plans for Brexit nice\\n,Germanic,English
Drama_poli,europe,that is false the UK is not popular in Germany . Germany is not well liked in the UK .,Germanic,English
Drama_poli,europe,It about time we had war in Europe anyway .,Germanic,English
Drama_poli,europe,Especially the Americans with 1/658 Irish ancestry .,Germanic,English
Drama_poli,europe,"Of course they have a different perspective on Europe . Europeans , Canadians , Ausies and us NZers are also very ignorant about the US . The people have strong sense of superiority fueled by jealousy when it comes to US that is not based on reality and adorably delusional .",Germanic,English
Drama_poli,europe,They were terrorist . The word is not just for muslims IRA were Catholic terorists ISIS are a sunni terrorist group .,Germanic,English
Drama_poli,europe,And now the US is bigger even before the UK leaves .,Germanic,English
Drama_poli,europe,The endicators and what really happens are totally different the drop is hard data wait for the reading of first quarter GDP . It could definitely be one month noise or not .,Germanic,English
Drama_poli,europe,Europe should be making friends the Chinese century is upon us .,Germanic,English
Drama_poli,europe,Delusional much . Euro zone economy is strengthening and if Macron wins is very positive . Remember a strong Eurozone economy is good for Britain even if there is no deal on Brexit .,Germanic,English
Drama_poli,europe,It is still a better situation than paying up and still havig the \ '' cliff edge\ '' .,Germanic,English
Drama_poli,europe,Isis also does try not to cause huge damages in sunni communities .,Germanic,English
Drama_poli,europe,Are we part of north hemisphere .,Germanic,English
Drama_poli,europe,But the UK has culture based more on class than other countries which talked about in the media more .,Germanic,English
Drama_poli,europe,I would the same as Paris atacks by ISIS .,Germanic,English
Drama_poli,europe,The north sea might dissappear with few more years of duch assult .,Germanic,English
Drama_poli,europe,Jealousy is never good his country is very competitive good at what they do .,Germanic,English
Drama_poli,europe,And then how will you deal daily mail and the sun . They will bring Theresa down she has no choice .,Germanic,English
Drama_poli,europe,Not to the victims of IRA . Tell me the historical context of Paris attacks or the Nice truck . There is non because both of them are senseless act of violence against large group of people .,Germanic,English
Drama_poli,europe,Hahah good idea .,Germanic,English
Drama_poli,europe,What do you mean ?,Germanic,English
Drama_poli,europe,Poor south sea is ded north sea should be afraid . : /,Germanic,English
Drama_poli,europe,They are very good,Germanic,English
Drama_poli,europe,At this point it only them pricing out each other .,Germanic,English
Drama_poli,europe,wtf are you comparing Brexit and the Wars and the suffering of tje past.\\n,Germanic,English
Drama_poli,europe,"Considering Trump and Russia I thought EU and China would be natural allies . At least they tolerate us NZers , we sell them non contaminated milk and provide rich Chinese refuge.\\nEdit : The EU is a geopolitical ( at least trade ) supper power so it is different of course .",Germanic,English
Drama_poli,europe,It is the EU which is demanding payment with nothing in return .,Germanic,English
Drama_poli,europe,Hahaha,Germanic,English
Drama_poli,europe,The thing is their news is in English so you hear pretty much everything that is going on there even the embarrassing stuff more than others and their media is on another level crazy .,Germanic,English
Drama_poli,europe,Plenty of countries have nukes doof .,Germanic,English
Drama_poli,europe,"The UK is going for WTO rules anyway , why bother paying large sum of maney to an EU that is hostile and out for revenge .",Germanic,English
Drama_poli,europe,He is still hot though .,Germanic,English
Drama_poli,europe,Golden boy is surging . Soon France will have president that is enjoyable to look at ; ),Germanic,English
Drama_poli,europe,The way the EU operates has many advantages that improve the quality of life for people . But it is useless because it makes people feel excluded and threatens its existence . People who like the EU only see the upsides of how the EU works because they are invested in it . But most people are not and would happily vote for populist who can point to problems and promise fictional future .,Germanic,English
Drama_poli,europe,Andrea whatever her last name was . Theresa will go the day she pisses of the europhopes in her party .,Germanic,English
Drama_poli,europe,But we also want the world to burn .,Germanic,English
Drama_poli,europe,What has UK ever done to Ireland apart from 800 years of oppression and famine ?,Germanic,English
Drama_poli,europe,Reality is the enemy of demagogues .,Germanic,English
Drama_poli,europe,Auckland is in the same price range of Vancouver anyway .,Germanic,English
Drama_poli,europe,Her marmalade Brexit strategy was nice . Shut you r mouth,Germanic,English
Drama_poli,europe,Never underestimate the greatness of small dose fiscal conservatism .,Germanic,English
Drama_poli,europe,It is the most likely outcome.\\n,Germanic,English
Drama_poli,europe,"My English teacher is Polish , with a beautiful accent I sometimes wonder what she thinks of Donald tusk , it would be weird to .",Germanic,English
Drama_poli,europe,The difference between the IRA and ISIS is the skin colour,Germanic,English
Drama_poli,europe,Classical liberal values on personal freedoms and openness .,Germanic,English
GRowmAGn,europe,A death is never nothing .,Germanic,English
GatorNavy,europe,Which one is Kimi Raikkonen on ? You Fins know how to have a great time !,Germanic,English
Ghastlygherkin,europe,Yes we are !,Germanic,English
Greckit,europe,Less Polish plumbers or something ...,Germanic,English
GrouseGrouse,europe,"No , unless you could obesity as an STD .",Germanic,English
GrouseGrouse,europe,"If your parents have the ability to force you to leave a masters program , you need to rethink your life",Germanic,English
GrouseGrouse,europe,Obviously their convictions come from the spirit too .,Germanic,English
Gyn_Nag,europe,"I was pretty surprised to learn today that Cape Reinga , the northernmost tip of NZ , has an antipode in Morocco .",Germanic,English
Gyn_Nag,europe,The Marine Nationale sounds more fun than a weekend in Tignes .,Germanic,English
Gyn_Nag,europe,Spaniards are so damn chill .,Germanic,English
Gyn_Nag,europe,Core shots . Core shots everywhere ...,Germanic,English
Gyn_Nag,europe,"& gt ; in Swiss\\n\\nAre Swiss people surprised when they get to the border and find other countries , instead of empty ocean and Lichtenstein ?",Germanic,English
Gyn_Nag,europe,Finns must be so sick of this joke.\\n\\nAt least people usually remember to put Finland on the fucking world map .,Germanic,English
Gyn_Nag,europe,"https : //en.wikipedia.org/wiki/Military_intervention_against_ISIL\\n & gt ; Islamic State of Iraq and the Levant : 60,000+ killed in Iraq and Syria , 1,500\u20132,500 killed in Libya.\\n\\nYes . We are overwhelmingly winning .",Germanic,English
Gyn_Nag,europe,Give a Swiss a bike and a pair of skis and he has access to all of Eurasia .,Germanic,English
Gyn_Nag,europe,"As an external person , the Euro is pretty great , and countries without it are irritating to travel in .",Germanic,English
Gyn_Nag,europe,And Macron is smoothly unhated .,Germanic,English
Gyn_Nag,europe,[ Swiss Navy ] ( https : //www.alinghi.com/sites/default/files/large_image_2_32nd.jpg ) ( crewed by New Zealanders ) .,Germanic,English
Gyn_Nag,europe,Or just Britain minus 80 years ...,Germanic,English
Gyn_Nag,europe,Smarter people go to Paris .,Germanic,English
Gyn_Nag,europe,"I concur . That shit is fucking incredible , and Spain has the Alhambra and all sorts of of other stuff in the wings too .",Germanic,English
Gyn_Nag,europe,There is no \ '' Museum of New Zealand\ '' ...,Germanic,English
Gyn_Nag,europe,Come to NZ then ... please ? Our cities are almost as car-obsessed as American ones .,Germanic,English
Gyn_Nag,europe,The report mentions it in the preamble . It\\ 's not clear why it\\ 's not categorised as a non-separatist attack . I would have thought it would come under \ '' single-issue\ '' .,Germanic,English
Gyn_Nag,europe,"Your spelling may be American , but that dry sarcasm is as British as meat pie , HP Sauce , and a pint of ale.\\n\\n",Germanic,English
Gyn_Nag,europe,"To be fair , whoever initiated and approved it should have seen jail time . Not sure if it was Hernu , Lacoste , or someone down the chain of command .",Germanic,English
Gyn_Nag,europe,[ Fred Whakaaturanga . ] ( https : //upload.wikimedia.org/wikipedia/commons/e/e3/New_Zealand_Diplomatic_Passport_Biodata_Page.png ) \\n\\n,Germanic,English
Gyn_Nag,europe,At least the Swedes are willing to live in apartments and build them to a decent quality . Kiwis will rather live in a piece of crap house provided it comes with a drab garden and quarter-acre . And so we have a housing crisis .,Germanic,English
Gyn_Nag,europe,You\\ 're in a \ '' Soft Brexit\ '' situation .,Germanic,English
Gyn_Nag,europe,\ '' Wiremu\ '' and \ '' Whakaaturanga\ '' are definitely Maori names . Fred might be a subtle reference to [ Fred Dagg ] ( https : //www.youtube.com/watch ? v=AYvMeT2GC14 ) .,Germanic,English
Gyn_Nag,europe,I like the florapunk last one . Kinda like the University Library in Warsaw .,Germanic,English
Gyn_Nag,europe,"Nah , an F-14 Tomcat maybe . Or just a subtle , dark silhouette of a B-2 .",Germanic,English
Gyn_Nag,europe,Attach Eddie the Eagle to a steam catapult and fire him at the French .,Germanic,English
Gyn_Nag,europe,They perceive them as \ '' Christians\ '' .,Germanic,English
Gyn_Nag,europe,"This is really the right direction to take . Greater fiscal policy harmonisation makes the euro more viable . It also gives tax-avoiders fewer places to hide , permitting cuts in corporate tax across the board for a level playing field .",Germanic,English
Gyn_Nag,europe,Breivik is English European .,Germanic,English
Gyn_Nag,europe,Stay safe Schweiz mates .,Germanic,English
HG2321,europe,"Exactly , and in a lot of countries voters rejected EU treaties but the governments went through with them via the back door . The EU has a facade of democracy , but nothing more .",Germanic,English
J4kal,europe,"& gt ; At a certain moment , in response to the sabotage in Russia and bloody actions of the nationalists and the repressive apparatus of Kiev against civilians and the east of Ukraine , Russia sends its troops into the east . *The West threatens nuclear war*.\\n\\nThis is fanciful . Even if Russia sends troops into Ukraine , the West is not going to threaten nuclear war .",Germanic,English
J4kal,europe,Asking the important questions I see .,Germanic,English
J4kal,europe,Only valid ballot . *,Germanic,English
J4kal,europe,Of course a Dutch newspaper votes a Walloon city the ugliest in Europe . \\n\\nThat city is a paradise compared to a lot of Eastern Europe .,Germanic,English
J4kal,europe,"Yep , random internet commentators are your problem . Not the people actually killing you .",Germanic,English
J4kal,europe,"I wonder how long it will take , and how many more people will die , before Europe realises it has a problem .",Germanic,English
KiwiThunda,europe,Test site in French Polynesia . Would have been 0 issue boarding the boat at the test site . France govt committed state-sponsored terrorism on a civilian boat in an allied country and some people are fine with that .,Germanic,English
KiwiThunda,europe,\ '' Freedom fighters disable dangerous terrorist frigate in hostile country\ '',Germanic,English
KiwiThunda,europe,Yes you have made that abundantly clear . Im sorry Le Pen lost .,Germanic,English
Kondottiero,europe,Yet here you are defending conservatives against a different bunch of conservatives.\\n\\nDo you only hate western conservatives ?,Germanic,English
Kondottiero,europe,Why are you referring to them as \ '' brown people\ '' ? Are you trying to make this about racism ?,Germanic,English
Kondottiero,europe,Sure thing general,Germanic,English
Kondottiero,europe,How does \ '' Auckland\ '' sound funny ? Was she pronouncing it \ '' Ackland\ '' or something ?,Germanic,English
Kondottiero,europe,What a Nazi ! \\n\\nWait a minute ...,Germanic,English
Kondottiero,europe,Is it really that bad at refugee centres in Sweden ? \\n,Germanic,English
Kondottiero,europe,"\ '' It\\ 's racism and I\\ 'm ashamed . There was always a bit of racism in this country , but today it\\ 's serious , it has to stop , \ '' she said.\ '' \\n\\nI\\ 'm at a loss for words . Somehow this is the fault of Dutch society ?",Germanic,English
Kondottiero,europe,Is this even a question at this point ?,Germanic,English
