Abrovinch,europe,"Sweden has a high percentage from nuclear , generally between 40 and 45 % of the total . 98 % is fossil free and Sweden is a net exporter of electricity .",Germanic,Swedish
Abrovinch,AskEurope,"Respect for personal space , and quietness .",Germanic,Swedish
Abrovinch,AskEurope,"As other\\ 's stated : No insurance = no refund.\\n\\nHowever I do wonder about this : \\n\\n & gt ; We did not have any private insurance that would cover the theft of such electronic devices\\n\\nI don\\'t know where you live , but at least in Sweden a regular household insurance ( Which everyone is pretty much \ '' forced\ '' to have ) do cover theft of your stuff when travelling .",Germanic,Swedish
Abrovinch,AskEurope,& gt ; Kamel\u00e5s\u00e5.\\n\\nYou are now an honorary Swedish citizen .,Germanic,Swedish
Abrovinch,AskEurope,"Seriously , no.\\n\\nOnly people who have no idea what they are talking about think that it would be better without Systembolaget .",Germanic,Swedish
Abrovinch,AskEurope,"[ Sarek ] ( https : //lauragoesworld.files.wordpress.com/2014/04/sarek-national-park-sweden.jpg ) Beautiful , but quite inaccessible . \\n\\n [ On map ] ( https : //www.google.se/maps/place/Sarek+nationalpark/ @ 65.830979,22.6724666,6.46z/data= ! 4m5 ! 3m4 ! 1s0x45d9ade52d3eca69:0x45ddeec80ae72ae6 ! 8m2 ! 3d67.2833333 ! 4d17.7 )",Germanic,Swedish
Abrovinch,AskEurope,"100 Mbit/s , SEK 89 ( \u20ac9,40 ) \\n\\nShould be added that I only pay for the actual service , the connection is included in my rent .",Germanic,Swedish
Abrovinch,AskEurope,"Seriously , no . Only people who have no idea what they are talking about think it would be better without Systembolaget .",Germanic,Swedish
Abrovinch,AskEurope,"+1 For the maritime museum , loads of interesting things to see there !",Germanic,Swedish
Abrovinch,AskEurope,Like [ this ] ( https : //www.youtube.com/watch ? v=29tZAqJKtxs ) \\n\\n\\n,Germanic,Swedish
Abrovinch,AskEurope,Whenever the subject of compound words comes up ( Swedish have them as well ) I like to mention this gem : *Nord\u00f6stersj\u00f6kustartilleriflygspaningssimulatoranl\u00e4ggningsmaterielunderh\u00e5llsuppf\u00f6ljningssystemdiskussionsinl\u00e4ggsf\u00f6rberedelsearbeten*,Germanic,Swedish
Abrovinch,AskEurope,"It\\ 's really just what you can do with compounds . The beauty of it is that you could just \ '' make up\ '' a fitting word.\\n\\nA literal translation would be something like : \ '' North east sea coastal artillery air reconnaissance simulator facility material maintenance monitoring system discussion posts preparatory work.\ '' Technically possible ( and legend has it it\\ 's in Guinness book of records for the longest Swedish wordas well ) , but pretty useless . You won\\'t find it in a dictionary..",Germanic,Swedish
Abrovinch,AskEurope,"You can use the same car , but the lights needs to be reconfigured . This is because the headlights on a car lights up the road asymmetrical , meaning you get more light on the right side if you drive on the right and vice versa . For a short visit this can be done by adding som stickers to the side with the \ '' longer light\ '' .",Germanic,Swedish
Abrovinch,AskEurope,"I might be misunderstanding your point here . But Sweden has only had minority governments since 1971 , except on three occasions . 1976-1978 , 1979-1981 and 2006-2010 . The current left-right divide among the parties has stayed pretty much the same as well , except that the Center party was supporting the Social democrats in the middle of the -90s .",Germanic,Swedish
Abrovinch,europe,"Well , both Finland and Norway also have state-owned liquor stores . Beer is taxed lower in Sweden than in Finland though .",Germanic,Swedish
Abrovinch,AskEurope,"This one is quite recent ( 1981 ) , but is interesting , and could have led to a war with the Soviet Union.\\n\\nI\\ 'm talking about [ Whiskey on the rocks ] ( https : //en.wikipedia.org/wiki/Soviet_submarine_S-363 ) .\\n\\nOne late Tuesday evening in October of 1981 a Soviet submarine , armed with nuclear wapons , went aground in the archipelago near Karlskrona naval base . The submarine was discovered by two local fishermen in the morning after . \\n\\nThey contacted the Swedish navy , which didn\\'t believe the reports , but went to investigate anyway . The patrol ship *HMS Smyge* was first to arrive and laid anchor next to the submarine . The commander of HMS Smyge climbed aboard the submarine and managed to make contact with the commander ( they had to communicate in german ) . \\n\\nAccording to the Soviet commander the navigation equipment on board was \ '' Kaputt\ '' and that Soviet tugs would come and pull it afloat . However , the swedes naturally said \ '' no way\ '' , the ball was rolling.\\n\\nTwo recon fighters from Sweden did indeed spot Soviet ships on their way to the stricken sub . Among the ships were modern frigates . Later that evening the Soviets asked for permission to send four ships to rescue the sub , again the swedes said \ '' Nope\ '' .\\n\\nThe Swedish prime minister told the Swedish command to keep te Soviets away with what they got . The problem was that at the time they really didn\\'t have that much in that specific area . The coastal battery , which was the main defence weapon was missing its fire control system due to maintenance ! Luckily they did manage to get a new fire control system , one which was very modern and mobile , in place by the evening . \\n\\nThe personell at the battery followed the Soviet ships advance towards the border . \ '' *1000 meters , three minutes ! *\ '' Was called out and the mood was tense in the control room.\\n\\nThe next call out was \ '' *700 meters , two minutes ! \ '' , and at about that time the Major in charge thought \ '' *We are probably at war now*\ '' . The decision was made to put the battery into war-mode , which included changing the radio operations into frequency-hopping , a feature that at the time wasn\\'t allowed to be used in peacetime in Sweden . \\n\\nWithin a minute after that the Soviet ships had stopped , just outside the border . Apparently they sent out a transmission saying that something wasn\\'t right and that they were waiting for new orders . \\n\\nThe Soviets did try to make a dash with a tug the day after , but it was stopped by the Swedish sub *HMS Neptun* . Swedish *J\u00e4gare* , basically Swedish commandos/rangers , were guarding the sub at all times as well . They also had the commander , who liked to stand on the tower of the sub , in a sniper sight at all times . If anything were to happen they would board the ship.\\n\\nMore Soviet ships were arriving at the border , and they planned to take the sub by force at 03.00 the next night . However the attack was called off at 02.30 the same night . The reason is supposed to be that Sweden has had the time to mobilize a much larger force at the site at that time . \\n\\nIn the end Swedish tugs got the Soviet sub afloat again and it was escorted to the border.\\n\\nWiki article : https : //en.wikipedia.org/wiki/Soviet_submarine_S-363\\n\\nA short film made by the Swedish Military shows how it looked at the site : https : //vimeo.com/11072021",Germanic,Swedish
Abrovinch,AskEurope,"That would actually be a pretty good salary here . Average salary would be around $ 38,000 , in which case you would have a total income tax rate of about 23 % .\\n\\nThere are however a lot of things to take into consideration when comparing taxes , and salaries . Are couples taxed different ? ( Here everyone is taxed as an individual ) . Is it common to be a \ '' stay at home mom\ '' . What is the actual cost of living.\\n\\nAnd most important , what do you get for your taxes ?",Germanic,Swedish
Abrovinch,AskEurope,"Yes , it is not that uncommon for engineering students to have a linear algebra or something along those lines \ '' saved\ '' until year 4 or 5 , when you originally had the course in year 1 or 2.\\n\\nYou must pass 75 % of your courses over a year to keep the student aid , except the first year when it\\ 's 62.5 %",Germanic,Swedish
Abrovinch,AskEurope,"Infinite tries here , except for some courses ( I had one course whuch was limited to five tries , after that you had to redo the course ) . \\n\\nSome fields of study , such as medicine and law have courses you must pass in order to continue with your degree .",Germanic,Swedish
Abrovinch,europe,"There\\ 's something fishy with this ... \\n\\nThe average wage before taxes in Sweden is SEK 32 000/month ( according to statistics Sweden ) , the average income tax on that is 24,3 % . The tax will vary a bit since it\\ 's paid on a municipal level , but that\\ 's the average.\\n\\nHowever , this doesn\\'t include the \ '' arbetsgivaravgift\ '' ( payroll tax ) , which is paid by the employer on top of your salary . The arbetsgivaravgift is a flat rate of 31.42 % , so your cost for the employer is 32 000 + ( 0,3142*32000 ) = SEK 42 054.4\\n\\nHowever , you have nothing to do with the payroll tax , it\\ 's not visible on any documents and not included when discussing wages.\\n\\nAlso , keep in mind that Swedish income tax is very progressive . \\n\\nIf you earn SEK 24 000/month you pay 22.5 % tax \\n\\nIf you earn SEK 42 000 you pay 28.6 % \\n\\nAt SEK 55 000 you pay 34.5 % \\n\\nAnd the final example SEK 100 000/month 45,2 % \\n",Germanic,Swedish
Abrovinch,AskEurope,"Major breweries , foreign as well make beer with 3.5 % ( or 2.8 % , which have no alcohol tax ) specially for the Swedish market . Some grocery stores have 200 different beers . Swedish microbreweries are making 3.5 % beer as well.\\n\\nFor ciders the ones you find in the grocery stores have an ABV of 2.25 % , due to tax reasons .",Germanic,Swedish
Abrovinch,AskEurope,"Probably the [ ICA ] ( https : //www.youtube.com/watch ? v=CZNPlONyyHw ) series , first episode aired in 2001 and new episodes are still coming . ICA is the biggest chain of grocery stores in Sweden.\\n\\nA fun classic is [ Ful\u00f6l ] ( https : //www.youtube.com/watch ? v=DnL5b9dzecY ) , obviously a beer commercial . The synopsis is that real beer is brewed on only malt , hops and water . The other guy calls bullshit and is of the opinion that you can filter out any unwanted ingredients.\\n\\nFinally [ Volvos ] ( https : //www.youtube.com/watch ? v=3KquHpO2VWI ) commercials lately have been highly praised .",Germanic,Swedish
Abrovinch,AskEurope,"Just so you know , around 2.1 is replacement rate , i.e no population growth .",Germanic,Swedish
Abrovinch,AskEurope,What dialect is that ?,Germanic,Swedish
Abrovinch,AskEurope,"I have some bad news for you , the mosquitoes are already here.. \\n\\nWe even have government funded \ '' air raids\ '' against mosquitoes in part of the country .",Germanic,Swedish
Abrovinch,europe,"Simplistic , light , and yet not boring . Well done !",Germanic,Swedish
Abrovinch,AskEurope,"& gt ; E : also , how do you make an artificial lake ? \\n\\n1 . Dig a hole\\n\\n2 . Fill with water",Germanic,Swedish
Abrovinch,AskEurope,"Norwegian bankcards have ID on the back side , see [ pic ] ( https : //ya.no/popup/_image/307.png ? _encoded=2f66666666666678302f35382f & amp ; _ts=14a503c16f8 )",Germanic,Swedish
Abrovinch,AskEurope,"Not really , good enough implies that more would be better , which isn\\'t the case with *lagom*.\\n\\nIt\\ 's more that sweetspot where it\\ 's not to little and not to much . It can be used in so many different settings as well . The \ '' easiest\ '' is of course how much food you want on your plate , *lagom* of course . But you could also argue about what is a *lagom* salary for a specific job , what is a *lagom* time for a child to go to bed ? \\n\\nIt\\ 's a very versatile word that is also very individual , thus it\\ 's also a very bad answer to a question . \\n\\n\ '' How many pancakes do you want ? \ '' FFS ...",Germanic,Swedish
Abrovinch,AskEurope,"Right now : [ Creamy Taco ] ( http : //www.olw.se/produkter/creamy-taco ) \\n\\nOne of the most common flavours , [ Dill & amp ; Chives ] ( http : //www.olw.se/produkter/dill-graslok-chips ) is apparently pretty uncommon elsewhere . Which is a shame really-",Germanic,Swedish
Abrovinch,AskEurope,"Ah , yes the \ '' Let me tell you about your country\ '' mentality.. Although it should be said that they are fuelled by certain elements inside Sweden as well..",Germanic,Swedish
Abrovinch,AskEurope,"9 % of the population between 16 and 74 smokes daily , 11 % use snus daily.\\n\\nThere is a big argument on how harmful snus is , but it\\ 's generally seen as a better alterEnglish to smoking , even for the user . I don\\'t use tobacco at all , but I prefer snusers over smokers by far.\\n\\nLastly , snus and snuff is not the same thing . Snuff is dry and sniffed , snus is moist and placed under your upper lip . Snus is also different from American \ '' dip\ '' , even though they look pretty alike .",Germanic,Swedish
Abrovinch,AskEurope,Are we ?,Germanic,Swedish
Abrovinch,AskEurope,A reasonable 12 degrees outside right now .,Germanic,Swedish
Abrovinch,AskEurope,"No , we have lay judges ( N\u00e4mndem\u00e4n ) instead . Practically any Swedish citizen under the age of 70 can apply , however some limitations apply . The lay judge works aprox . 15 days per year and get paid along with pensions etc . The lay judges vote carry equal weight to the normal judges .",Germanic,Swedish
Abrovinch,AskEurope,"35 year olds was born in 1982 , just saying",Germanic,Swedish
Abrovinch,AskEurope,"6 June , it celebrate two things . Instrument of government from 1809 and when Gustav Vasa was elected king in 1523.\\n\\nIt was officially dubbed national day in 1983 , before that it was known as *Svenska flaggans dag* , \ '' The flag of Sweden\\ 's day\ '' \\n\\n",Germanic,Swedish
Abrovinch,europe,"Money.\\n\\nMany young Swedes go to Norway and work a year or two , then they come back . Nordic citizens have a right to live in any Nordic country they see fit . The laws are more lax than for other EU citizens .",Germanic,Swedish
Abrovinch,AskEurope,"So , like a government funded Tinder ?",Germanic,Swedish
Abrovinch,AskEurope,Relevant [ SATW ] ( https : //satwcomic.com/LANGUAGE BARRIER ),Germanic,Swedish
Abrovinch,AskEurope,"Yes , but not for Denmark in football , Norway in skiing or Finland in ice hockey .",Germanic,Swedish
Abrovinch,AskEurope,"& gt ; Why some weirdos put the mashed potatoes on top the sausage and not beside it like normal , I do not know.\\n\\nIt\\ 's a thing in Gothenburg , Hel or Halv special . The one in the picture is a \ '' halv special\ '' since it\\ 's only got one sausage in the bun . \ '' Hel special\ '' is two sausages and mashed potatoes in a bun .",Germanic,Swedish
Abrovinch,AskEurope,Many public toilets here are now paid for by card only .,Germanic,Swedish
Abrovinch,AskEurope,"[ Here ] ( http : //www.motorwallin.se/bilder/artiklar/zoom/2711-0907_1.jpg ) you go , a folding 2m ruler..",Germanic,Swedish
Abrovinch,AskEurope,"Well , except our current PM of course . Started out as a welder and then worked for a union .",Germanic,Swedish
Abrovinch,AskEurope,"The name historically comes from the different tax levels , known as *Klass I , II , IIb and III* . \\n\\nKlass I is the *l\u00e4tt\u00f6l* , up to 2,25 % ABV and can be sold to anyone.\\n\\nKlass II is *folk\u00f6l* \ '' Peoples beer\ '' between 2,25 % and 3,5 % and can be sold in regular stores.\\n\\nKlass IIb was called *mellan\u00f6l* \ '' Middle ( strong ) beer\ '' , and was between 3,5 and 4,5 % and could also be sold in regular stores , albeit not after 20.00 and on sundays . This class was discontinued in 1977.\\n\\nFinally Klass III is everything above 3,5 % ( used to be over 4,5 % ) and must be sold at a Systembolag.\\n\\nNowadays the taxation on beer works a bit different . Beer over 2,8 % ABV is taxed by SEK 1,66 per litre and % ABV . This means that *Folk\u00f6l* with 2,8 % ABV is dirt cheap and *folk\u00f6l* with 3,5 % ABV is not really worth it.\\n\\nMany of the most common international brands are available as 3,5 % ABV beers as well , including Heiniken , Starobpramen , Corona , Guiness etc . Of course domestic brands are the most common ones .",Germanic,Swedish
Abrovinch,AskEurope,"Yeah , sorry we let the U.S ( among others ) build the Bofors 40 mm AA gun .",Germanic,Swedish
Abrovinch,AskEurope,"Not really , more Scandinavian/Nordic .",Germanic,Swedish
Abrovinch,AskEurope,"Thing is , we already reached peak child . Population growth nowadays is due to people living longer .",Germanic,Swedish
Abrovinch,AskEurope,"Why not ? We have a handful US citizens applying for asylum every year , of course almost none are accepted , but still .",Germanic,Swedish
Abrovinch,AskEurope,Central heating from waste and biomass ( peat ) .,Germanic,Swedish
Abrovinch,AskEurope,"In recent years it was the storm *Gudrun* , which hit hard on southern and western Sweden in 2005 . Around 20 people lost their life as a result of the storm . 700 000 households lost their electricity , phones also went down . 250 million tress were knocked over , leading to [ this ] ( http : //hds.imgix.net/_YCWk8atwCy4VKef5aqL6sMMznc.jpg ? fit=crop & amp ; crop=faces % 2Centropy & amp ; w=980 & amp ; h=588 & amp ; auto=format & amp ; q=60 ) huge pile of timber , it took 7 years to get rid of it all.\\n\\nThe ( at least recent ) natural disaster that took the life of most Swedes was the [ 2004 earthquake in the Indian Ocean ] ( https : //en.wikipedia.org/wiki/Countries_affected_by_the_2004_Indian_Ocean_earthquake_and_tsunami # Countries_that_lost_citizens_while_abroad ) were 543 ( +17 missing ) Swedes lost their life .",Germanic,Swedish
Abrovinch,AskEurope,[ Obligatory ] ( https : //www.youtube.com/watch ? v=aMgW54HBOS0 ) \\n\\nEurovision ( And Melodifestivalen earlier during the year ) are huge events in Sweden .,Germanic,Swedish
Abrovinch,AskEurope,Finland,Germanic,Swedish
Abrovinch,AskEurope,Just do a search on hitta.se or any other site and you will se your number .,Germanic,Swedish
Abrovinch,AskEurope,"[ Liseberg ] ( http : //liseberg.com/en/home/ ) actually had something called [ Lillk\u00f6ping ] ( http : //www.lisepedia.se/Lillk\u00f6ping ) , which was a miniature city inhabited by German dwarfs as an attraction in 1923 ...",Germanic,Swedish
Abrovinch,AskEurope,I guess [ Lagom ] ( https : //en.wikipedia.org/wiki/Lagom ) could fall into that category ?,Germanic,Swedish
Abrovinch,europe,It is one of the \ '' weirder\ '' Swedish dialects..,Germanic,Swedish
Abrovinch,AskEurope,"The bank check your income , if you have other loans , if you have defaulted etc . and make a decision .",Germanic,Swedish
Abrovinch,AskEurope,"The freedom of expression is defined in one of the fundamental laws . It\\ 's a rather long document but basically it says that every Swede has the right to express their thoughts and views freely.\\n\\nThe government can not preview any material that is to be printed or transmitted over radio , tv , internet etc . You also have the right to remain anonymous . \\n\\nNow , I guess you actually were more interested about \ '' hate-speech\ '' , right ? \\n\\nWell that law is defined as follows : \\n\\n*Den som i uttalande eller i annat meddelande som sprids\\nhotar eller uttrycker missaktning f\u00f6r folkgrupp eller annan\\ns\u00e5dan grupp av personer med anspelning p\u00e5 ras , hudf\u00e4rg , \\nnationellt eller etniskt ursprung , trosbek\u00e4nnelse eller sexuell\\nl\u00e4ggning , d\u00f6ms f\u00f6r hets mot folkgrupp till f\u00e4ngelse i h\u00f6gst tv\u00e5\\n\u00e5r eller om brottet \u00e4r ringa , till b\u00f6ter . *\\n\\n Short translation : \\n\\nHe who in a statement or in another statement that is spread , threatens or expresses contempt against ethnic group , or other constellation of people based on race , colour of skin , national or ethical origin , faith or sexual orientation , is to be sentenced for *Hets mot folkgrupp* to prison up to two years , or if the crime is trifling , to fines.\\n\\nWhat it means is that in order for you to get in trouble you must make statements that incite violence , and are made for a public audience . \\n\\nI think it\\ 's good , and very reasonable .",Germanic,Swedish
Abrovinch,AskEurope,lol,Germanic,Swedish
Abrovinch,AskEurope,"The norm is 40h/week , though some places have 38h , or even 36h/week . Of course workplaces where you work in shifts are different.\\n\\nThe key thing here are the five weeks of paid vacation granted by law .",Germanic,Swedish
Abrovinch,AskEurope,[ Answer ] ( https : //youtu.be/v8_7yPocGPg ? t=164 ) ( From 2:44 ),Germanic,Swedish
Abrovinch,AskEurope,"Luckily ( ? ) , that was caught on tape as SVT was there , [ link ] ( https : //youtu.be/mQakZce3GhQ ? t=90 ) \\n\\nIt was in Rinkeby , in 1992 . Some things never change..",Germanic,Swedish
Abrovinch,AskEurope,"Ines Uusman was the politician . \\n\\nShe didn\\'t really say \ '' internet is just a fad\ '' , that was a newspaper headline , but in a recent interview she agrees that it isn\\'t really a misquote either.\\n\\nWhat she actually said was : \ '' *Jag v\u00e5gar inte ha n\u00e5gon alldeles best\u00e4md uppfattning men jag tror inte att folk i l\u00e4ngden kommer att vilja \u00e4gna s\u00e5 mycket tid , som det faktiskt tar , \u00e5t att surfa p\u00e5 n\u00e4tet . [ ... ] Att sitta och surfa p\u00e5 n\u00e4tet tar en himla massa tid . Vad \u00e4r det bra f\u00f6r ? [ ... ] Det kanske \u00e4r s\u00e5 att det \u00e4r n\u00e5got som vuxit upp nu . Alla pratar om internet men kanske \u00e4r det \u00f6verg\u00e5ende och sedan blir inriktningen mer specificerad . *\ '' \\n\\nWhich translated would be something along the lines of : \\n\\n \ '' I don\\'t want to have a determined perception but I don\\'t think people in time actually want to spend as much time , as it actually takes , surfing the internet . [ .. ] Surfing the internet takes a lot of time , what is it good for ? [ .. ] Maybe it\\ 's something that has grown now . Everyone is talking about the internet , but maybe it\\ 's transient , and then the focus will be more specified.\ '' \\n\\nEdit : She also have another fantastic qoute : \\n\\n*Om man kan \u00e5ka till m\u00e5nen fram och tillbaka , s\u00e5 kan man ocks\u00e5 tycka att det \u00e4r rimligt att tycka att man ska kunna bygga den h\u00e4r tunneln och andra stora tunnlar milj\u00f6s\u00e4kert . * \\n\\nMeaning : \\n\\n\ '' If you can travel to the moon and back , it would be reasonable to think that you could build this tunnel and other big tunnels in an environmentally sound way\ '' . -1997\\n\\nThe tunnel she was talking about is the Hallands\u00e5s-tunnel . One of the biggest scandals in modern Swedish history . Construction started in 1992 , and the issues began only 13 meters in ( the tunnel is actually two tunnels 8.7 km long ) when te tunnelling bore machine got stuck . They changed the method to blasting after that , but got massive groundwater problems , and the sealant they used didn\\'t work due to the high inflow of water . That\\ 's when they also learnt that the sealant was poisonous . Construction was halted in 1997 , and not restarted until 2005 with a new tunnelling bore machine.\\n\\nThe tunnels was finally inaugurated in December 2015 . The total cost for the project is estimated to 10.5 billion SEK , far above the 1 billion SEK budget..",Germanic,Swedish
Abrovinch,AskEurope,"Yes , we had pretty much the same policy regarding forced sterilization as you it seems : https : //en.wikipedia.org/wiki/Compulsory_sterilisation_in_Sweden\\n\\nWe also had a state funded institute for \ '' race biology\ '' : https : //en.wikipedia.org/wiki/Statens_institut_f\u00f6r_rasbiologi",Germanic,Swedish
Abrovinch,AskEurope,"R\u00f6vhatt is one of my favourites , right up there with kioskmongo .",Germanic,Swedish
Abrovinch,AskEurope,& gt ; lifestyle philosophy\\n\\n & gt ; kalsarik\u00e4nnit\\n\\nlol,Germanic,Swedish
Abrovinch,AskEurope,I share it with 54 579 others .,Germanic,Swedish
Abrovinch,AskEurope,"Pernilla Karlsson is actually Finnish , but her mother tongue is Swedish . She sings in [ \ '' Finland Swedish\ '' ] ( https : //en.wikipedia.org/wiki/Finland_Swedish ) , a special dialect of Swedish.\\n\\nEdit : But I agree , it\\ 's a nice song !",Germanic,Swedish
Abrovinch,AskEurope,"Isn\\'t the odd thing about French that they use multiples of 20 , and add tens/whatever instead ? \ '' quattre-vingt-dix-huit\ '' = 4x20+10+8 = 98\\n\\nSame in Swedish would be \ '' Nittio\u00e5tta\ '' = Nio x tio + \u00e5tta = 9x10+8 = 98",Germanic,Swedish
Abrovinch,AskEurope,"Now we\\ 're really navigating a minefield here..\\n\\nBut I suppose it\\ 's AIK from northern Stockholm . Keep in min that European supporter culture is a complete different animal compared to American supporter culture . [ AIK ] ( https : //www.youtube.com/watch ? v=QXD6Fh1SlHg ) supporters , so called \ '' ultras\ '' .\\n\\nBut as I said , this is a very delicate question..",Germanic,Swedish
