22boutons,europe,"In Romania most people who vote left are quite conservative , people from the lower classes who are very religious . If the mainstrean leftist party would suddenly turn \ '' progressive\ '' , being anti-religion , pro-lgbt and against the values of their voters it would create room for the nationalistic \ '' far right\ '' parties . These sort of parties don\\'t get many votes in Romania because there\\ 's no need for them , mainstream parties are already conservative enough . \\n\\nIt\\ 's sort of what happened in the west , lower-class people don\\'t feel represented by the values of the mainstream left so they turned to voting far-right .",Romance,Romanian
22boutons,europe,"\ '' Droite des valeurs , gauche du travail.\ '' That\\ 's the slogan of a french far-right group . Not really a great exemple but what I mean is you can be for taxing the rich , social benefits , more social equality , and be conservative in other ways . And it\\ 's quite logical actually , considering that\\ 's the way most of their voting pool is .",Romance,Romanian
22boutons,europe,Which organisation ? Ddo you have a source ?,Romance,Romanian
22boutons,europe,"Exactly , would they do the same but with Israel or even Turkey ?",Romance,Romanian
22boutons,europe,I thought the sarcasm was obvious . After seeing some other comments I can see why not .,Romance,Romanian
22boutons,europe,"Yeah , and deportantions/killings because you were from the wrong social class were ok ? How convenient to forget that .",Romance,Romanian
22boutons,europe,Modernisation as in westernisation of their religion ? Because modern = western = good ?,Romance,Romanian
22boutons,europe,Why proof do you have that the russian government represents popular opinion in their country any less than western governments ?,Romance,Romanian
22boutons,europe,This is horrible . The exportation of live animals should be forbidden .,Romance,Romanian
22boutons,europe,Is there any proof the Munich gunman had right wing motivations ?,Romance,Romanian
22boutons,europe,Where did the article say they were ethnically Swedish ?,Romance,Romanian
22boutons,europe,"Ah , \ '' Father Frost\ '' , we also used that during the communist regime in Romania but completely gave it up in order to use \ '' Father Christmas\ '' afterwards . Just curious , was Father Frost a soviet invention and did you have a Father Christmas before ? \\nEdit : And Merry Christmas !",Romance,Romanian
22boutons,europe,"Well , the mainstream press should have covered it more . We only heard rumours of it the day it happened but no real coverage from \ '' reputable\ '' sources . If they avoid sensitive topics it\\ 's normal that people become paranoid .",Romance,Romanian
22boutons,europe,"Not for local buses ( as in those going around the city ) but in long distance buses ( or coaches , not sure what the right term is ) , sure .",Romance,Romanian
22boutons,europe,"That way of thinking is exactly what makes people vote far right . If the mainstream media is so biased as to avoid certain topics because it will benefit the far right , people become paranoid and vote them even more . They get the aura of being the only ones telling the truth .",Romance,Romanian
22boutons,europe,\ '' Accepted\ '' LOL really ? What you call \ '' acceptance\ '' is the result of centuries of wars and turmoil . You\\ 're talking as if Bulgaria\\ 's history was a long peaceful series of \ '' acceptance\ '' .,Romance,Romanian
22boutons,europe,In places with lots of tourists airbn is as expensive as hotels .,Romance,Romanian
22boutons,europe,"Just as you want to enforce \ '' diversity\ '' on those who don\\'t want it . You\\ 'd like enforce your views on others just as much , you\\ 're just an hypocrite about it .",Romance,Romanian
22vin,europe,"A reflective jacket is also required in Romania.\\n\\nSpeed limits:130km/h on motorways , 100 outside cities/villages , 50 in cities/villages ( 60 on your speedo )",Romance,Romanian
22vin,europe,Romania cut the VAT on food to 9 % as of 1st of June 2015 .,Romance,Romanian
22vin,europe,Goddamnit I had money on Sweden,Romance,Romanian
22vin,europe,"Yes , you can see it from the motorway , I drove past it three months ago . But everything was fairly quiet , no immigrants on the road , just some police vans stationed on the hard shoulder .",Romance,Romanian
22vin,europe,"Ahh yes , the flying coffin . We have about 36 of these but ours are cooler , they\\ 're called \ '' LanceR\ '' .\\n\\nThey\\ 're actually fast plances which haul ass at Mach 2.0 when they don\\'t crash or explode in midair .",Romance,Romanian
22vin,europe,"& amp ; gt ; autonomous rights\\n\\nHahahaha , great bants mate .",Romance,Romanian
22vin,europe,"Please list some of the things you heard so I can tell if they are true or not : ) \\n\\nAnd if you decide to travel to RO , feel free to visit /r/romania and ask for tips , advices , etc",Romance,Romanian
22vin,europe,Sadly there are too many cars for parallel parking .,Romance,Romanian
560cool,europe,/r/romania has over 2200 ... why not just add all of them ?,Romance,Romanian
5ama,europe,"Can you actually visit it ? If yes , can you stay there overnight ? Or are turists not allowed ?",Romance,Romanian
5ama,europe,Tats purple ramen !,Romance,Romanian
5ama,europe,"Ohh ffs . Ok , ok. \\n\\nBut apart from arhitecture , urban planning and the railways , what has Austria-Hungary ever done for US ! ?",Romance,Romanian
5ama,europe,"And the people working without being registered , to avoid taxes .",Romance,Romanian
5ama,europe,"Why , who called themselves the 4th ?",Romance,Romanian
5ama,europe,You must be cheating somehow ...,Romance,Romanian
5ama,europe,"Hih , we say the same - salta , but more often we use \ '' sari\ '' . Pula on the other hand ... has a different meaning .",Romance,Romanian
5ama,europe,"Well fuck you too Poland , we never liked you either , anyways ...",Romance,Romanian
5ama,europe,Thank you !,Romance,Romanian
5ama,europe,Best for confusing little kids .,Romance,Romanian
5ama,europe,"Nobody is supporting PSD actions except their propaganda TV station and their party members . There are scarce comments from \ '' citizens\ '' on social media supporting them and condemning the protests but we all agree that the vast majority of them are fake accounts part of their propaganda machine . Right now we had the 4th consecutive day with 200.000+ people out in the streets ( while there were also 2 days of protests before the adoption of the law ) . Its worthy to mention that the first day of protests was tuesday night starting at 22:30 a clock , when all went into the news . Tens of thousands got out , with Cluj , a city with a population of about 350k having 20k+ in the streets untill 04:00 in the morning . \\nExcept their propaganda TV station all the mass media is on them , the journalists are extremely clear in their position and have \ '' aggresive\ '' stance when asking questions , most of the public figures are openly criticizing it and supporting the protesters , some private companies told employees thei are free to make their own schedule in order to be able to participate , people are going with tea and cookies to share with the protesters , people are singing happy birthday to a member of the security staff , people are giving flowers to the security staff , people are gathering to clean up all the mess left behind in the previous night , people are coming with children and dogs . In the only instance when things got violent ( because paid football ultras came with firecrakers and torches ) the whole crowd was shouting \ '' NOT LIKE THIS ! ! ! \ '' Everybody is talking how this is the biggest wake up call of our entire history as a nation , because never has seen this country such massive protests ( the revolution is not considered a protest for obvious reasons ) . Members of the party are forwarding their resignations , condemning the actions of their leaders . People are talking how this is something that will make us stronger , it shows we still have a core of people with vision , with principles , wanting to make this country better , people who demand respect and justice , who are willing to get out and ask for them , walking 20 km ( thats the distance the 30.000 people in Cluj walked trough the city in 2 of the nights ) . This is the young generation telling everybody we are different than our parents who didnt know how to manage democracy . This is our generation , the people who go out to support justice and democracy . We are ROMANIA ! ! ! \\n\\n",Romance,Romanian
5ama,europe,If I were in your position I would have went all Sobieski mode and kicked her out of Europe ! ! !,Romance,Romanian
5ama,europe,"Seriously , I tend to believe all this trolls are russians . I mean , there are less cultural differences between romanians and moldavians than there are between northern and southern italians .",Romance,Romanian
5ama,europe,"Im not sure the price is significantly different tho . Not an expert , but those chocolate bars , like Mars , Bounty or Snickers are at the same price in Romania as they are in the west . I have no idea if they are of different quality tho .",Romance,Romanian
5ama,europe,Why ? What has Romania to do with this story ?,Romance,Romanian
5ama,europe,"Its \ '' less stagnant\\'\\ ' because you get immigrants from those in the east , includin us . You just pick the side you want to see by saying there is nothing for normal people in it . As I said , in every country the big companies are the main engines of the economy . The more profit they make - the more they pay in taxes towards the state . Having a powerfull , rich state is very beneficial for the citizens , as the state can build more infrastructure , subsidize stuff , increase pensions , increase medical expenses , educational expenses , etc ...",Romance,Romanian
5ama,europe,"I\\ 'm from Bistrita , never been to Craiova , but I still find it hard to believe it\\ 's that hard to distinguish between romanians and gypsies over there . I mean , people from that area can\\'t have a darker skin tone than , say , south italians or greeks , can they ? And it\\ 's not only the skin , the facial looks are different too ... I mean , ther\\ 's a kind of looks that are pretty british , german , russian , etc . I agree romanians are quite a mixed lot , and it\\ 's hard to pinpoint the average romanian \ '' look\\'\\ ' , but the gypsies do have a particular \ '' look\ '' , on average . Trying to be objective here , no racism intended .",Romance,Romanian
5ama,europe,"You sneaky bastards , just when I was about to open a glass of champagne ! Oh well ...",Romance,Romanian
5ama,europe,Which one is the largest then ?,Romance,Romanian
5ama,europe,Nice one ! : ),Romance,Romanian
5ama,europe,Exactly my thoughts !,Romance,Romanian
5ama,europe,"\ '' There is the distinct possibility that I am a bit mad.\ '' - Hah , that was a good one.\\n\\nIt\\ 's nice what you\\ 're doing . Some people watch movies , some browse more reddit , some use that time to cook . I think it\\ 's one of the most important thnigs to get good at . After all we do have to eat every single day , and being capable to make that experience as good as you can is definitely something worthwhile .",Romance,Romanian
5ama,europe,But there is no free will ...,Romance,Romanian
5ama,europe,"And we pay about 1.5 - 1.7 Euro for 1L , while the farmers get around 22c per L .",Romance,Romanian
5ama,europe,"What ? You might have gotten it all wrong . It is the serbs and the coratians fighting over Tesla , and romanians vs. hungarians over Hunyadi .",Romance,Romanian
5ama,europe,"Piata Victoriei in Bucharest , tonight , after all the 150.000 people got home , just to prove my previous statements - civilized protests 101 : \\n\\nBefore - https : //www.reddit.com/r/Romania/comments/5rwyq9/a_4a_zi/\\n\\nAfter -https : //www.reddit.com/r/Romania/comments/5rx6kg/pia\u021ba_victoriei_dup\u0103_150000_de_protestatari/\\n\\nEdit : Added the before image for comparison .",Romance,Romanian
5ama,europe,"This ! Sadly not many would understand it , and they keep on bragging on how they are net contributors without understanding how the economy works .",Romance,Romanian
5ama,europe,Spot on !,Romance,Romanian
5ama,europe,"It\\ 's roma , not roman . Roman is the guy that lived during the Roman Empire . Romanian is the citizen of Romania . Roma is the term you are looking for . And that means \ '' man\ '' or \ '' people\ '' in gypsi language .",Romance,Romanian
5ama,europe,"FFS you are not even realising the difference between roman and roma , but you get all apeish on how racist someone is ... just let it go , you don ; t seem like someone who really knows shit on the matter .",Romance,Romanian
5ama,europe,\ '' big cultural gaps\\'\\ ' - like what ?,Romance,Romanian
5ama,europe,"Are you from around there OP ? How much would it cost to stay there at a cheep motel ? Or are there any camping spots in croatia where you can stay with your tent but get some access to toilets , showers and stuff ?",Romance,Romanian
5ama,europe,"\ '' second only to the Germans.\ '' Dude , what ? \\n\\nI thought we had our share of bad rep to stop us bashing others . Call albanians poor and criminals and then cry when they call you a gippo ...",Romance,Romanian
5ama,europe,Actually in my area it goes just like that : \ '' You can\\'t have a dick up your arse an be a virgin too.\ '',Romance,Romanian
5ama,europe,"Hah , Holy Romanian Empire sounds better than I would have thought . We should start working on that . We are the Fourth Rome !",Romance,Romanian
5ama,europe,So how on earth would that change when the judges are appointed by the parliament ?,Romance,Romanian
5ama,europe,I first thought the title reads Mircea Badea ... .ughhh ...,Romance,Romanian
5ama,europe,"Looks nice , sounds nice . Vis = Dream in romanian .",Romance,Romanian
5ama,europe,Funny how the picture is from an anti gay marriage march .,Romance,Romanian
5ama,europe,How is that ?,Romance,Romanian
5ama,europe,"& gt ; o ano\\n\\nIt was World War I that was a shock for Europe , after which war everybody thought the world would never make such a massive mistake . It took 20 years for Europe to get back at it .",Romance,Romanian
5ama,europe,Thats a nice idea to make a map like this !,Romance,Romanian
5ama,europe,"I don\\'t really believe it , but I like to think it\\ 's a possibility : Some 200 years ago the Royal Norwegian Society of Sciences asked if there really is free will . The only one who answered then in the form of an essay was Scopenhauer , presenting \ '' On the freedom of the will\ '' . In that essay he explains why we , humans , have no free will . The best line in that book that sums everything up is : \ '' Man can do what he wills but can not will what he wills\ '' . If we accept there is no free will then the only way of dealing with prisoners is the Norway\\ 's way . I\\ 'm a determinist and I think Norway is doing the right thing . For other countries it would be hard from an economical point of view , but I think we\\ 'll all get there eventually .",Romance,Romanian
5ama,europe,That lighthouse resembles Pula so much ...,Romance,Romanian
5ama,europe,"There are no leaders of the protesters here . It may be hard to believe , but its true . The night they passed the law some friends of mine texted me saying that they had enough and they are going out to protest . That night at 23:00 local time , when it went on the news that the law was passed 1 hour earlier tens of thousands went out . You cant possibly organize that shit with all the logistics in the world . In Cluj , a city with a population of 300.000+ about 30.000 were out protesting minutes after the law was passed , staying as late as 04:00 in the morning . They marched trough the city streets where others were joining the group . The length they covered is about 13km that night . \\n\\nThis is the path they took : https : //gyazo.com/49ad1e233f9effd89da11709e31dc011\\n\\nLE : Oh , and its worth mentioning that after more than 20 days of protesting , with the highest number of protesters being reached on the 5th of february - 600.000 people , not a single violent incident took place in the entire country , with that one exception when football hooligans were paid , ironically by the party in power , to join the protests and cause some violence by fighting with the police , with the intention to cause panic trough the peaceful protesters and hopefully make them go home .",Romance,Romanian
5ama,europe,"Mind your own business , will ya ?",Romance,Romanian
5ama,europe,Ask them .,Romance,Romanian
5ama,europe,"Never saw those numbers untill now . Even tho I realise there are more roma than the official census data , because some of them would say they are ethnic romanian instead , 2.4 milions seems too much . Sources vary from a few hundred thousands to over 2 million . Anyway , judjing by their natality they will become an even bigger % in the population in every balkan country.\\n\\nhttps : //en.wikipedia.org/wiki/Romani_people_in_Romania",Romance,Romanian
5ama,europe,"Well , first of all it was well known that football hooligans were brought to \ '' give the tone\ '' for previous protests . When all of a sudden protests that were peaceful and civilized descended into small scale fights with the police it was obvious that they were there with an agenda . While those crooks were trowing flares at the gendarmery the whole crowd were shouting \ '' Not like this ! \ '' . This is only the context . The next day the ex wife of Dinamo Bucharest\\ 's owner declared that it was her ex-husband who sent those idiots with buses , boarding them in front of a hotel he owns . Of course there will be an official investigation that would clear all up , as both Negoita , Dinamo owner and the head of the Dinamo ultras denied it all .",Romance,Romanian
5ama,europe,"Yeah , Bulgaria seems to be our new best buddy , but in general the whole idea that Romania and Serbia were never at war in their entire history made romanians view Serbia as their best neighbour .",Romance,Romanian
5ama,europe,"Ukraine is neutral but Hungary ... everybody knows about Romania and Hungary , Im sure you do too .",Romance,Romanian
5ama,europe,"Wouldnt be surprised ? The resignation of the government should be a nobrainer in any democracy . I sure as hell hope this was their plan and they knew they had to run away afterwards . They cant possible think they can do this shit and keep on going with their plans . They have to leave and Im sure they knew it , but we have to press them to do it , they wont do it all by themselves . They got their corupt fucks back , we now have to take our country back !",Romance,Romanian
5ama,europe,"It actually means , as the picture suggests , \ '' Ox cart\ '' .",Romance,Romanian
5ama,europe,And we still have to get the \ '' you are sucking money from EU\ '' from the idiots in the west ...,Romance,Romanian
5ama,europe,"He cant be the PM anymore . Well technically he could , but the whole country would explode in anger and violence if that fuck has the nerve to even think of something like that . He is already a past figure in politics , I guarantee it !",Romance,Romanian
5ama,europe,Tell me the country which managed to educate their gypsies .,Romance,Romanian
5ama,europe,"Just accept it , man .",Romance,Romanian
5ama,europe,"But you made it sound that way though.\\n\\nYou were trying to explain how this kind of protests tend to block streets and how someone could die because the ambulance didnt arive in time . I explained to you how thats a very wrong point of view since the corruption , against which all this people protest , is doing much much more damage to us than a couple of blocked streets . As I said , people die in hospitals because the lack of resources ( Hexipharma case where a bunch of corrupt f*ks bought diluted disinfectants for the hospitals which is now attributed for a ton of infections that led , in some cases , to death ) , more than 60 people died in a fire in a nightclub , and the tie with corruption is again surfacing in that the club didn\\'t met the safety standards but was allowed to open nonetheless . I told you about our deplorable roads and lack of highways . There\\ 's more to it but I only mentioned the topics that contradict your stance . \\n\\nSo you accuse people for blocking 2 streets when the government is \ '' blocking\ '' the entire country by not investing in the roads and highways . Renault even threatened they\\ 'll move the Dacia factory to Maroco if we\\ 'll not manage to finally build a god damn highway to link us to the west . Whom do you think romanians blame when they have to travel in bad conditions , the protesters who block 2 streets for a few hours or the politicians who can\\'t and won\\'t do their jobs properly ? \\n\\nYour argument was way off .",Romance,Romanian
5ama,europe,"Yeah , one of the worst insults for serbs probably",Romance,Romanian
5ama,europe,Vampires without teeths ...,Romance,Romanian
5ama,europe,This would look much better with a picture taken during spring .,Romance,Romanian
5ama,europe,"\ '' It\\ 's also about the sheer number of Roma who are from Romania / live in Romania / declare themselves to be from Romania.\ '' \\n\\nThat\\ 's also a stupid assumption . Yes , westerners seem to be pretty ignorant ( I could use a harsher word ) not realising the difference between roma and romanian . They don\\'t sound the same , how on earth do they sound the same ? If anything roma sounds exactly the same as Roma - the capital of italy , pronounced in italian . But romanian or romania has a few extra letters ffs . Also , yes , people , in they ignorance , based on the name simillarity , automaticly assume a gypsi is from Romania . So it\\ 's not that most of the gypsies you see are from Romania , it\\ 's the stupid assumption most people make . The thread is a living proof to that - gypsies involved - must be romanian . That\\ 's the problem - a few slovak gypsies in Paris and people will call them romanians , a few serbian gypsies in London and people will cal them romanian . A few hungarian gypsies in Rome and people will call them romanian . An article on croatian gypsies and people are calling them romanian ffs ! ! ! It\\ 's too much already . \\n\\n\\nRant off.\\n\\nHave a nice evening.\\n\\n",Romance,Romanian
6.36561757365736E+017,europe,And for 2089 !,Romance,Romanian
6.36561757365736E+017,europe,"& gt ; A report by the Bonger Instituut , a criminology think-tank named after a professor at the University of Amsterdam , is **blunt**.\\n\\nYep , they really went for it .",Romance,Romanian
6CaiFumosi,europe,"Peak Mosii ( The old men ) , to equilibrate the Babele ( old women ) we have in Romania",Romance,Romanian
6CaiFumosi,europe,"This is a dish from Nice , right ?",Romance,Romanian
7018_is_king,europe,"i experienced the same shit . instead of teaching understanding and good will , teaching us to become \ '' good Christians\ '' they only thought us to hate gays , atheists and anyone who wasn\\'t Christian .",Romance,Romanian
7018_is_king,europe,yep . life is a lot better since Kovesi stepped into the scene,Romance,Romanian
7018_is_king,europe,"Romanian from Cluj-Napoca , can confirm , I have a lot of Hungarian friends , and I speak Hungarian fluently",Romance,Romanian
7077x,europe,No m\u0103m\u0103lig\u0103 jokes ?,Romance,Romanian
7077x,europe,[ How about this Russian one ? ] ( https : //www.youtube.com/watch ? v=QPd7kAy15kw ),Romance,Romanian
7077x,europe,He is so full of himself . *smh*,Romance,Romanian
7077x,europe,"& gt ; Europe was never Islamised\\n\\nTry Albania , Kosovo and Bosnia\\n\\nThere are some Muslim Tatars in Romania but they are cool people .",Romance,Romanian
7077x,europe,Russia only fights the small countries ...,Romance,Romanian
7077x,europe,"[ Da , mam\u0103 ] ( https : //www.youtube.com/watch ? v=_PYSqcyUIYQ ) \\n\\n [ Asear\u0103 \u021bi-am luat basma ] ( https : //www.youtube.com/watch ? v=jx2WAMePR1c ) \\n\\n [ Cum ne noi ] ( https : //www.youtube.com/watch ? v=D8-g8CpXdO8 ) \\n\\n [ Oarecare ] ( https : //www.youtube.com/watch ? v=gnwlRoFoLXs ) \\n\\n [ M\u0103 ucide ea ] ( https : //www.youtube.com/watch ? v=wqRuvmFfyag ) \\n\\n [ Fete din Balcani ] ( https : //www.youtube.com/watch ? v=BpCVIkrhpiU ) \\n\\n [ Bop Bop ] ( https : //www.youtube.com/watch ? v=-eu-cQbPkNI ) \\n\\n ... ... .",Romance,Romanian
7077x,europe,"I always wondered , why you guys try to insult us with \u043c\u0430\u043c\u0430\u043b\u0438\u0433\u0430 ? \\n\\n\u0421\u0435\u0432\u0435\u0440\u043d\u0430 \u0414\u043e\u0431\u0440\u0443\u0434\u0436\u0430 represent !",Romance,Romanian
7077x,europe,Hurry up guys ! \\n /r/CraiovaGroup stronk,Romance,Romanian
7077x,europe,"Welcome to the western democracy , we got Euros .",Romance,Romanian
7077x,europe,"The ex-communist countries don\\'t buy his \ '' new\ '' attitude , that\\ 's for sure .",Romance,Romanian
7077x,europe,"Well done , good neighbor Bulgaria .",Romance,Romanian
7077x,europe,What a surprise !,Romance,Romanian
7077x,europe,That wall should have been on the border with Turkey not in the center of Europe .,Romance,Romanian
7077x,europe,"Why did they kill him ? He was more useful alive , for getting information and such .",Romance,Romanian
7077x,europe,"In Romania people smoke a lot in such places and because of this , there are no fire protection systems ( except fire extinguishers ) .",Romance,Romanian
7077x,europe,"Moldova always was run in the shadow by Putin . He has people in politic to do the job for him , just like it was in Ukraine.\\nLook what happened to Ukraine when EU came in help , Russia started a war in east of Ukraine , stole Crimea etc.\\nAnd now it started in Moldova with those protest where russian people are brought into the country to protest against EU .",Romance,Romanian
