user,subreddit,post,family,lang
3801,europe,yeah . who should be in the team and what not .,Germanic,English
3801,europe,because they occupy part of a member nation ?,Germanic,English
3801,europe,"i wouldn\\'t know , don\\'t own a mac so i haven\\'t had much experience with it . but i guess i could shorten my original explanation to \ '' that\\ 's because safari sucks balls\ '' . but then again so does IE , but people use it because of the windows market share .",Germanic,English
3801,europe,"wikipedia lists your minimum wage as 93,000 HUF per month\\nhttp : //en.wikipedia.org/wiki/List_of_minimum_wages_by_country",Germanic,English
3801,europe,"safari is only going to be the choice browser for a subset of Mac users , who make up & lt ; 10 % of the market share . Safari is rubbish on windows , and of those running OS X many would be running firefox and chrome anyway .",Germanic,English
0xr,europe,"When a portion of any population is disenfranchised or under represented , it tends to lash out . I say good on them , mobilization and protesting is the only way to get a message to the political class . As for the violence part ? Unfortunate",Germanic,English
1337Bolshevik,europe,Desperate times call for Desperate measures . I wonder how many American settlers died on the way to the new world .,Germanic,English
1337Bolshevik,europe,Erdogan used to do a lot to make membership more acceptable until the EU rebuffed Turkey . Hence a change to a more eastern policy . Turkey abandoning the EU is a great idea .,Germanic,English
1337Bolshevik,europe,I feel the aboriginals of Australia better suit the label genocide than the boars or Irish . At least now that you say the Germans were better at it . Which is what I doubted . I know of the boar concentration camps but what else went on ?,Germanic,English
1Darkest_Knight1,AskEurope,But OP wants us all to stroke his average American dick and tell him how good he is ...,Germanic,English
1Darkest_Knight1,AskEurope,"Why would Americans care about any history outside their own country ? Like OP said , It was the first successful revolution ... /s\\n\\nOP has no idea about world history obviously .",Germanic,English
1Darkest_Knight1,AskEurope,I feel like OP is banging his American chest and wants to know that we all think it was such a big deal . Your comment brings him down a peg . I like it .,Germanic,English
1Darkest_Knight1,AskEurope,If its not in America did it ever happen ?,Germanic,English
9outof10experts,europe,I think Merkel will become the new word for cunt .,Germanic,English
ADizzy7,europe,"Your points on the refugee convention are interesting and I thank you for that info . I would like to point out that throughout my comments I have not suggested that Australia simply opens its borders . I believe we do need to have a tough immigration policy because , yes , people do die at sea trying to come to Australia , and also , lets be honest , if we did let everyone in , many many many people would come because Australia is amazing ( most of the time ) . \\n\\nHowever , I think we can agree that the current conditions refugees are kept in are unacceptable , and the political language and policy used against refugees by BOTH major Australian parties is deplorable . For example , they are not referred to as \ '' asylum seekers\ '' or \ '' refugees\ '' , but as \ '' illegal maritime arrivals\ '' ... . My opinion is , we can do better . We can deter refugees while still allowing open and honest journalism , without major human rights organisations accusing the govt . of torture , without keeping children locked up and witness to and victims of abuse . \\n\\nThis situation goes back a long way , I don\\'t know if you know about the Children Overboard scandal , where the government lied and said refugees threw their own children into the ocean so that they would be rescued by the navy , and then used that lie to their own political gain.\\nhttps : //en.wikipedia.org/wiki/Children_Overboard_affair\\nSo you\\ 'll have to excuse me if I don\\'t trust our government to treat these people with decency.\\n\\nThis is a very nuanced situation , and one that 100 % needs changing . \\nI\\ 've said it already , but its not black and white . It\\ 's not no refugees or all refugees , there is a middle ground that needs to be sought.\\n\\nI think at this point we will probably just keep going in circles , we obviously disagree , which is fine . Thanks for the interesting debate .",Germanic,English
ADizzy7,europe,"But you\\ 've still failed to provide a reason as to what benefit they would have from reporting torture . Not a hypothetical situation , any sources ? Anyone else suggesting the UN is telling lies ? I\\ 've given you a link in which the Prime Minister ( whose policy this is ) has even admitted to bad conditions . Now he hasn\\'t called it torture for obvious reasons , but if you can look at reports from the UN , Amnesty International etc and think \ '' oh it\\ 's just all politics\ '' then I don\\'t know what else to say .",Germanic,English
ADizzy7,europe,"Again , the report of torture comes from\\nthe UN . Not some Australian guy with family in Afghanistan who he wants to come and join him . THE UNITED NATIONS .",Germanic,English
ADizzy7,europe,"At what point did I say we should let the refugees who \ '' skip the queue\ '' in ? I didn\\'t . I simply said the way they are treated now is insane . Priority should be given to refugees in camps , and those who come by legal means ( but that\\ 's not to say those coming by boat may not be legitimate refugees ) . \\n\\nThe world is not black and white . It\\ 's not either- let them all in OR lock them up indefinitely . There is a middle ground , and that\\ 's where Australia\\ 's policy needs some serious changes . \\n\\nEDIT- I should also point out that out current system costs SO much money . More money is spent on asylum seekers held in offshore detention than it would cost to house them in Australia . Here are some articles : \\n\\nhttp : //www.abc.net.au/news/2015-07-14/cost-of-offshore-processing-united-nations-fact-check/6609764\\n\\nhttp : //www.abc.net.au/news/2015-09-09/dunlop-accepting-refugees-makes-the-most-economic-sense/6761770\\n\\n ( an older article but interesting all the same ) http : //oppenheimer.mcgill.ca/A-Price-Too-High-the-cost-of ? lang=fr\\n\\nhttp : //www.amnesty.org.au/resources/activist/Handling_Objections_About_Asylum_Seekers.pdf\\n\\n^^^ this article in particular is a good read . \\n & gt ; But isn\u2019t offshore processing cost effective ? \\nThe Commission of Audit found that it costs more than $ 430,000 to detain an asylum seeker in offshore detention for a year ( or about $ 1200 per day ) . It is estimated to cost less than $ 100,000 a year to hold an asylum seeker in community detention and less than $ 50,000 to host them on a bridging visa . This means **offshore detention is more than eight times more expensive than onshore alterEnglishs** , and asylum seeker policy costs , including offshore detention , are forecast to exceed $ 10bn over the course of the current government.\\n\\n",Germanic,English
ADizzy7,europe,"Again , my qualm with the policy is not that it doesn\\'t \ '' work\ '' ( debatable considering the cost etc ) but I suppose it comes down to whether or not you think breaking the UN convention on human rights is okay because it \ '' works\ '' . \\n\\nEdit to include a source : \\nhttp : //hrlc.org.au/un-finds-australias-treatment-of-asylum-seekers-violates-the-convention-against-torture/",Germanic,English
ADizzy7,europe,"They\\ 're not just on a lovely tropical island somewhere . Journalists are almost never allowed on the island . The government does not give any information on \ '' illegal maritime arrivals\ '' . \\n\\nWith all due respect , I don\\'t think you can just be of the opinion that they\\ 're not that bad . \\n\\nhttp : //www.bbc.com/news/world-australia-31827074\\n\\nPeople who work there are forbidden by law from talking about what they see there.\\n\\nhttp : //mobile.abc.net.au/news/2015-05-28/barns-newhouse-detention-centre-secrecy-just-got-even-worse/6501086\\n\\n\\nThe Prime Minister himself has said he is concerned with conditions . \\n\\nhttp : //mobile.abc.net.au/news/2015-09-23/turnbull-says-changes-to-asylum-seeker-policy-will-be-considered/6799162\\n\\nhttp : //www.amnesty.org.au/refugees/comments/33587\\n\\n & gt ; COMMON ASYLUM SEEKER COMPLAINTS ON MANUS\\n\\n1 . Enduring a terrifying and humiliating journey.\\n\\n2 . Overcrowded conditions with little or no privacy.\\n\\n3 . Little relief from the stifling heat and humidity.\\n\\n4 . Sometimes less than 500ml of water per person.\\n\\n5 . Insufficient health services.\\n\\n6 . Queuing for hours for food in stifling heat and no shade.\\n\\n7 . Not enough toilets or showers.\\n\\n8 . No shoes.\\n\\n9 . Little or no contact with family loved ones.\\n\\n10 . Gay men persecuted for their sexuality.\\n\\n",Germanic,English
Abstract_Fart,europe,rekt,Germanic,English
Abstract_Fart,europe,"The fuck did you think this thread was , its just left wing memes against right wing memes .",Germanic,English
Abstract_Fart,europe,Holy shit that was ruthless .,Germanic,English
Ajeh,europe,not really,Germanic,English
Ajeh,europe,"Got my dates upside down , happens sometimes over here",Germanic,English
Alecaz,europe,"Look , not that I want to get involved in this , since the person you\\ 're responding to brought up the topic out of no where but ... \\n\\n & gt ; Well , you don\\'t know the big bang happened\\n\\nWe\\ 're reasonably certain given all the evidence uncovered . No we don\\'t have it on video though.\\n\\n & gt ; You don\\'t know where life came from\\n\\nYou mean how life and stuff formed ? Many theories but no certainty I am aware of.\\n\\nBut here\\ 's the main difference . I say \ '' I don\\'t know\ '' . That\\ 's perfectly fine.\\n\\nBut when people say \ '' Benevolent sky daddy did it all\ '' that\\ 's when things become stupid . Saying \ '' Well you don\\'t KNOW it\\ 's wrong\ '' , is not a justification for jack shit . The burden of proof isn\\'t on me . That\\ 's why people made the \ '' flying spaghetti monster\ '' , because it\\ 's just as plausible , and can be justified using all the exact same faulty logic.\\n\\n & gt ; You take it on faith that men much smarter than you have worked out these things and you take it on faith they are true . Is that so different to religion ? \\n\\nIt\\ 's not faith . The research is all there . If I wanted to , I could simply look it up for myself , do the studies , and if I had access to the right equipment , perform the tests . That\\ 's not faith . It\\ 's all there for scrutiny , and scientific research DEMANDS scrutiny to maintain it\\ 's integrity . It welcomes being PROVED wrong.\\n\\nReligious beliefs don\\'t hold up to scrutiny however . They demand faith , belief . The second you start picking at it , it all falls apart .",Germanic,English
Alecaz,europe,"Was this before or after the pro Ukranian people were killed , jailed , and driven out ?",Germanic,English
Alecaz,europe,"Like Hitler , but on a slow burn .",Germanic,English
Alecaz,europe,By where I meant to what country ( s ) .,Germanic,English
Alecaz,europe,"& gt ; That\\ 's an unfounded allegation , also , it\\ 's called \ '' bookkeeping\ '' , and is what virtually everyone does.\\n\\nMate you already alluded to it yourself.\\n\\n & gt ; They make money in Australia , then they pay their offices in China and California for consulting services , advertisement , actual production items ... and in the end , they get out with very little to no profit in their Australia branch - just like they wanted.\\n\\nAnd my add-on which you skipped : \\n\\n & gt ; and Millions of dollars in \\'licensing\\ ' fees to Apple Ireland.\\n\\nThey\\ 're paying themselves bullshit like \ '' consulting\ '' and \ '' licensing\ '' to falsify their costs . And so what if many people do it ? They\\ 're arseholes too , and should also be forced to pay their taxes properly.\\n\\n & gt ; So why do you keep buying ? Obviously , the discomfort of not owning their stuff is larger than the discomfort about your so-called government not having racketeered more money out off them.\\n\\nThey like the product , and they\\ 're pissed that Apple paid zero dollars in taxes , but not pissed enough to start a nationwide boycott . Corporations paying nothing is but one of the many issues in the Australian Election.\\n\\n & gt ; racketeered **more** money out off them.\\n\\nTHEY PAID NOTHING . ZEEEERRROOOOO . How on earth are you okay with this ? I want to know more about your viewpoint , because at the moment it either infers that you\\ 're rich and greedy , or not , and stupid",Germanic,English
Alecaz,europe,"Why would he be released in the first place , he tried to kill someone .",Germanic,English
Alecaz,europe,"Paid zero in Australia , and they sure as shit made profit .",Germanic,English
Alecaz,europe,Pays tax where ?,Germanic,English
Alecaz,europe,"& gt ; the suspect fled , fleeing first to Sweden then further all the way to Turkey , where he was arrested , **and released to ISIS a few years later . **\\n\\nUmm , what ?",Germanic,English
Alecaz,europe,"& gt ; So what would a \ '' fair\ '' share be , and why should a company ( or literally everyone ) be forced to go into the red to appease some slavemasters in the respective country\\ 's capital ? \\n\\nThey\\ 're not going into the red . They\\ 're taking measures to falsify what their true costs are , thereby dishonestly and artificially driving down their reported profits.\\n\\n & gt ; If Apple\\ 's payment of Australian taxes was so extremely important to the Australian customer , he would stop buying Apple products in protest . Sales figures tell us that is not the case.\\n\\nThere\\ 's more than one issue in Australia , so of course the entire public isn\\'t talking about it 24/7 . People elect governments to deal with shit like this , and you\\ 're truly daft if you think Apple paying less in tax than someone on minimum wage is perfectly fine with Australians , or the vast majority of any country\\ 's people , even if they do own Apple\\ 's products .",Germanic,English
Alecaz,europe,"& gt ; because concepts like consulting and licensing is too difficult to understand , thus it is a fraud . \\n\\nIt is when they\\ 're paying themselves.\\n\\n & gt ; Yeah . Everyone should pay for killing innocent people in the middle east . How dare they not support the military-industrial complex ? MORE DEAD BROWN CHILDREN ! \\n\\n & gt ; but I also prefer not having to pay protection money to thugs , \\n\\nDepends on your country . Mine usually pays for stuff like healthcare , roads , electricity , police , courts , research , ambulances , doctors , education , infrastructure , etc , etc , \\n\\n & gt ; The rest.\\n\\nYou\\ 've just given up haven\\'t you ? Not that i blame you , in fact a large part of me agrees with you . So much of the human race has become apathetic , pathetic , or developed a \ '' fuck you , got mine\ '' , attitude that they project on to everyone and themselves . I don\\'t want to fall into the latter , but I\\ 'm afraid you might have.\\n\\nThing is , if this happens , the greedy win . Maybe it\\ 's greed for power , maybe it\\ 's greed for status , maybe ( usually ) it\\ 's greedy for wealth . Thing is , I don\\'t like that , so I won\\'t quit.\\n\\nNot that I\\ 'm gon na become a hero or politician fighting for a better tommorrow , in fact that\\ 's unlikely with all my personal flaws and lack of drive . But I\\ 'm not raising the white flag , and I sure as shit ain\\'t adopting their attitude .",Germanic,English
Aljn,europe,"Same thing happens in Australia ... except on the trendy lefty public networks . I think good subtitles are fine , though .",Germanic,English
AnxiousSprout,europe,"Yeah - allowing women to wear what they want is pretty backwards , I agree .",Germanic,English
ArchangBelle,europe,"This is ridiculous . The usage of the word \ '' man\ '' in \ '' mankind\ '' comes from the fact that in the Germanic languages\ '' , \ '' man\ '' used to be just a human and there were different words for men and women . Not sexism , at all.\\n\\nSide note : that\\ 's why \ '' he\ '' is used as a neutral subject pronoun . For example , \ '' if a person jumps into shark-infested waters , **he** could would find himself in severe pain\ '' . That\\ 's because \ '' he\ '' doesn\\'t mean \ '' a man\ '' , but \ '' a person\ '' .",Germanic,English
ArchangBelle,europe,"I was wondering how many countries in Europe which still have conscription only conscript males ? How do the contries justify this , especially those like Finland that offer civil service as an alterEnglish ? Do people in your contry find it sexist that only males must be conscripted ?",Germanic,English
ArchdukeOfWalesland,europe,Something something unrecognisable amirite ?,Germanic,English
Arkunnaula,europe,Communism is a temporary setback on the road to freedom .,Germanic,English
Arkunnaula,europe,"\ '' Emmanuel Macron is a Silicon Valley-loving , union-hating , Third Way centrist . He\u2019s no bulwark against the far right.\ '' \\n\\nI love it when articles have a tldr as a sub heading .",Germanic,English
Arkunnaula,europe,\ '' It\\ 's not our first time naked swimming . We have been training hard all spring\ '' . Legendary .,Germanic,English
Arkunnaula,europe,Reminds me of this : https : //www.youtube.com/watch ? v=sk_fRzxJrPo ( NSFW Language ),Germanic,English
Arkunnaula,europe,Sure was . : ),Germanic,English
Arkunnaula,europe,Greece is always razing standards .,Germanic,English
Arkunnaula,europe,Good bot .,Germanic,English
Arkunnaula,europe,Australia five,Germanic,English
Arkunnaula,europe,~~Beats~~ spanks the hell out of \ '' Meme Street\ '',Germanic,English
Arkunnaula,europe,Misjudged that one then .,Germanic,English
Arkunnaula,europe,"I like Joe , but srsly , fuck Johan .",Germanic,English
Arkunnaula,europe,Good place for a picnic ? \\n\\nhttps : //www.youtube.com/watch ? v=cwyMXG79sTs,Germanic,English
Arkunnaula,europe,"Yeah , until it needs some minor servicing .",Germanic,English
Arkunnaula,europe,"Cool , I thought \ '' bitterballen\ '' meant \ '' please balls\ '' .",Germanic,English
Arkunnaula,europe,Three countries separated by the same language .,Germanic,English
Arkunnaula,europe,"Polish scientist , married to a French scientist .",Germanic,English
Arkunnaula,europe,And the lesson here is never take Orban at his word .,Germanic,English
Arkunnaula,europe,"For a minute there , I thought you were talking about Australia . ; )",Germanic,English
Arkunnaula,europe,"Scottish , English , Irish ? Russian ? Turkish ?",Germanic,English
Arkunnaula,europe,"Wow , you guys really got around .",Germanic,English
Arkunnaula,europe,"Sorry , should\\ 've been more clear . The prisoner was judged \ '' unlikely to escape\ '' and then escaped , which I found amusing.\\n\\nAlthough it\\ 's pretty interesting that , during war , entire governments can escape and from a \ '' government in exile\ '' .",Germanic,English
Arwic,europe,\ '' It\\ 'll be different this time\ '',Germanic,English
Arwic,europe,Definitive proof that driving on he left side the the road is superior ; ),Germanic,English
Arwic,europe,misery loves company,Germanic,English
Arwic,europe,"Leave your leftist media bubble and look into why people support him . All media is biased , not just fox news etc .",Germanic,English
Arwic,europe,So you are suggesting that the west must submit to Islam or else . It seems like you and ISIS have a common goal .,Germanic,English
Ausmosys,europe,"Am Australian , was genuinely confused why it only when up to slightly orange until I realised it was Finland.\\n\\nPlease take me into your wonderfully cold embrace .",Germanic,English
Ausmosys,europe,"The youtuber I mentioned did exactly that , and did it quite well I think\\nhttps : //www.youtube.com/watch ? v=F-qP_CIZJus",Germanic,English
Ax_Dk,europe,Looks like a very typical Danish church that someone has later stuck a spire on ... \\n\\nWonder if this was built while Estonia was in Nordic ( well as part of Denmark or Sweden ),Germanic,English
Ax_Dk,europe,Yeah I totally understood that . I just work better and find it easier to compare across countries in percentage tax rates rather than defined required net salary levels .,Germanic,English
Ax_Dk,europe,You should feel half proud and half deeply deeply ashamed,Germanic,English
Ax_Dk,europe,"News Alert ! Poland predicted to become major power by 2040 , eclipsing Germany . \\n\\nhttps : //geopoliticalfutures.com/the-road-to-2040-a-summary-of-the-forecast/\\n\\nI read the full document a while ago , and this whole article reminded me of this white paper . It predicts that Poland will lead its neighbours into a regional bloc , and here we have something that seems to be working towards that goal . \\n\\nIt seems a bit far fetched because of the demographic changes happening in Eastern Europe , but you never know what the future holds !",Germanic,English
Ax_Dk,europe,The paper which I linked to does overlook this . \\n\\nIt comes at it from a geopolitical and military sense.. It says that the EU loses most of its relevance and that Turkey and Poland lead their neighbours following the vacuum ...,Germanic,English
Ax_Dk,europe,Still looks good to the 58 % tax ( tax and university loan repayments ) i have to pay in Australia !,Germanic,English
Ax_Dk,europe,What is the current tax rate that you are paying ?,Germanic,English
Ax_Dk,europe,"I may have been reading some of that \ '' fake news\ '' we\\ 've heard so much about , but I\\ 've read in a number of articles that while English and Irish are the official languages of the Irish Republic , on the ascension documentation to the EU only Irish was listed ... As it was a given that English was an official language of the EU ... \\n\\nI also read that because of this fact , that a number of MEPs have requested that European union documentation no longer be written in English post brexit ... \\n\\nAs I said , I\\ 'm not expert but after reading it from a number of sources I thought it made sense",Germanic,English
Ax_Dk,europe,Those feelings when you realise the minimum size apartment in Australia is 37 square metres ... .\\n\\nHow do you fit in a 25 square metre apartment ?,Germanic,English
Ax_Dk,europe,But your official language in the EU is Irish Celtic ... Not English,Germanic,English
Ax_Dk,europe,"45 million too low ? He is saying European Superpower , not world superpower ... \\n\\nPeople have more children when they think the future is bright , if they could turn their country and economy around and hit double digit growth , their birth and migration levels should decrease ... You may actually experience a mini baby boom..",Germanic,English
Ax_Dk,europe,net 1k a week or month ? My knowledge of average wages in Slovenia is very limited sorry..,Germanic,English
Ax_Dk,europe,Save some time and money right now and make sure he is wearing a crown though ... It would be pretty costly to have to reprint all the money in a few months time when he makes it a reality .,Germanic,English
Ax_Dk,europe,"I don\\'t understand you equating Superpower with population ... \\n\\nYou don\\'t need the largest population to be a \ '' Superpower\ '' . The Soviet union was a world superpower while it had a population of around 300 mill , meanwhile China had 1.2 billion and was nothing . \\n\\nPoland could be a top level European country in the coming decade etc especially as growth in places like Italy stalls and they have looking at a lost decade . Poland could become a leader , a force for change , a force that exerts its influences outside of its borders . This is a superpower within Europe ...",Germanic,English
Ax_Dk,europe,What does your link have to do with Finns ?,Germanic,English
Ax_Dk,europe,"The current government of Turkey \ '' hates\ '' Europe - but realises that it could gain a great deal by allowing European Trade through its borders . \\n\\nThe turkish government talks a big game , but it knows that really it still needs Europe on its side .",Germanic,English
Ax_Dk,europe,So low taxes for businesses and user pay systems aka Capitalist model ?,Germanic,English
Ax_Dk,europe,Australia has got your back for coal Russia ! \\n\\nPity Abbott shirtfronted Putin so bad ... Think of the money you could have made otherwise !,Germanic,English
Ax_Dk,europe,"When reading the geography of Caithness : \\n\\nCaithness is a land of open , rolling farmland , moorland and scattered settlements . The area is fringed to the north and east by dramatic coastal scenery and is home to large , internationally important colonies of seabirds . - Sounds like Home !",Germanic,English
Ax_Dk,europe,"Gosh everyone can into Nordic ... I was reading an article somewhere in the Australian press that was saying that Tasmania should change their government model and adopt the Nordic Model as it would change a backward area of Australia into a more successful state ... \\n\\nI know Tasmania gave us Crown Princess Mary , but still ... \\n\\nThat would really be a kick in the guts to Estonia ...",Germanic,English
Ax_Dk,europe,Danish numberplates on that car ... .,Germanic,English
Ax_Dk,europe,"Is estonia working towards this model though ? \\n\\nI love the idea of Estonia joining us , hear that they are doing relatively well economy wise but never actually hear how if they are transitioning towards the Nordic model .",Germanic,English
Ax_Dk,europe,"What a glorious day for Australians ... After years in Eurovision , they have now received their official invitation into Europe ! One less country for Britain to propose a free trade agreement with post Brexit !",Germanic,English
