Ashihna,europe,hehe,Turkic,Turkish
Clit_Commander,europe,"Sandra Bullock was born in Germany.\\n\\nDieter Zetsche , CEO of Mercedes , was born in Turkey .",Turkic,Turkish
Clit_Commander,europe,Come to /r/germanhumor for more quality lulz !,Turkic,Turkish
Clit_Commander,europe,"IMHO it wasn\\'t a real apology , it was more like \ '' I apologize BUUUUUUT I was misquoted blablabla\ '' \\n\\nPeople should be extra careful when writing about sensible issues and a professor should know that she represents her university .",Turkic,Turkish
Clit_Commander,europe,"Exactly , everbody is suprised by the Paris attacks but they forget that France started attacking ISIS in September ( or October ? ) .\\n\\n [ \u201cNever argue with an idiot . They will only bring you down to their level and beat you with experience.\u201d ] ( http : //www.goodreads.com/quotes/445589-never-argue-with-an-idiot-they-will-only-bring-you ) \\n\\nThe same goes for terrorism ... just stay out of this steaming pile of shit .",Turkic,Turkish
Clit_Commander,europe,You can\\'t stop the Cavaliere ! \\n\\nEdit : \\n\\nCan someone make up a rhyme like \ '' Can\\'t simmer the Zimmer\ '' or \ '' Can\\'t corner the Dorner\ '' ?,Turkic,Turkish
Clit_Commander,europe,Where is Klitschko when you need him ? ?,Turkic,Turkish
Clit_Commander,europe,Wow great . Please stop begging at my mall,Turkic,Turkish
Clit_Commander,europe,"Fuck yeah , yankee go home ! \\n\\nI hope they will abandon european and asian soil ASAP",Turkic,Turkish
Clit_Commander,europe,Say \ '' Please\ '',Turkic,Turkish
Clit_Commander,europe,"This negotiations will take an eternity and they will end in a most unsatisfying way for the turkish people . In the meantime Afghans , Iraqis , Iranians , Syrians , Africans etc will strand in Turkey and cause trouble . Who would\\ 've accepted such deal , it\\ 's like \ '' Let me eat the cake and I promise that we can talk about the price years later\ '' .\\n\\nAnd besides ... nothing will take Turkey closer to the EU , maybe if someone would find oil and gas , lots of oil and gas .",Turkic,Turkish
Clit_Commander,europe,Do you know where Montana or Dakota is ? ? Stop being \ '' that guy\ '',Turkic,Turkish
Clit_Commander,europe,"Its called B\u00f6rek , your welcome dear Balkans",Turkic,Turkish
Coastoflolrsk8s,europe,"GREEK DOG , U DARE PIRATE TURKISH FILM ?",Turkic,Turkish
Coastoflolrsk8s,europe,"you are viewing Islam through an anti-Islam lens , Askari views it through a Muslim\\ 's lens . Obviously he would disagree with you when you say that Islam demands penalty of death for \ '' countless harmless behaviors.\ '' The only thing the Qur\\'an says the death penalty is allowed for is murder or spreading corruption/tribulations in the land .",Turkic,Turkish
Coastoflolrsk8s,europe,"U.S. has a lot of recent immigrants , too , though . We take in the most immigrants in the world every year .",Turkic,Turkish
Coastoflolrsk8s,europe,lol,Turkic,Turkish
Coastoflolrsk8s,europe,"Many people before you have been fed up with this religion . They are all gone now , and Islam roll onwards . Try stopping Islam , I dare you .",Turkic,Turkish
Coastoflolrsk8s,europe,"come to Istanbul and say that to my face , plz",Turkic,Turkish
Coastoflolrsk8s,europe,\ '' Moderate Muslim\ '' doesn\\'t mean I\\ 'll let you fucking walk all over me .,Turkic,Turkish
Coastoflolrsk8s,europe,"& gt ; Do we have slaves work in our farms or what ? \\n\\nNot yet , but you might soon if the fascist parties get their way .",Turkic,Turkish
Coastoflolrsk8s,europe,"& gt ; Paris is a violent and chaotic ethnic soup . I have never felt such a tense and intimidating society.\\n\\nI live in Los Angeles , and this is the most ethnically diverse city in the world , yet it doesn\\'t feel \ '' tense and intimidating.\ '' Maybe it\\ 's a European cultural problem ? Why do Europeans make such a big deal out of ethnicities ? It\\ 's amazing to watch this as an American because it feels like Europe is 200 years behind us when it comes to racial progression .",Turkic,Turkish
Coastoflolrsk8s,europe,As are you,Turkic,Turkish
Coastoflolrsk8s,europe,"No one gives a shit about your shitty racial nationalism , gtfo .",Turkic,Turkish
Coastoflolrsk8s,europe,"The current leader of Chechnya is a sell-out to Chechnyans ( and their revolutionary cause ) , and an all-out Putin shill . He even has a basement torture chamber/dungeon in his own home that he has used on political prisoners before.\\n\\nFuck Kadyrov .",Turkic,Turkish
Coastoflolrsk8s,europe,Ask the Chechens,Turkic,Turkish
Coastoflolrsk8s,europe,Not drinking/not eating pork/etc are only relatively minor parts of Islam . And Israel is in the title because Israel is rated as being more Muslim than all other Muslim countries lol ( even Turkey somehow ? idk ) .,Turkic,Turkish
Comrade_Beard,europe,They can work together . They supported same candidate in last years presidental elections,Turkic,Turkish
Comrade_Beard,europe,Just voted for HDP . I hope they pass the treshold,Turkic,Turkish
Comrade_Beard,europe,I have a feeling that your French is little bit rusty,Turkic,Turkish
Comrade_Beard,europe,It looks like we won guys ! !,Turkic,Turkish
Comrade_Beard,europe,I am Turk but I am cheering for HDP .,Turkic,Turkish
Comrade_Beard,europe,& gt ; better food \\n\\nYou just made an enemy for life,Turkic,Turkish
Curiouslyafraidguy,AskEurope,"By normal , not neo-Nazi or far right , moderate people who happen to be patriotic/nationalist I mean . Because it seems like apart from that extreme groups who make 2-5 % and maybe very old people , nationalism is gone in Europe , is it true ?",Turkic,Turkish
Curiouslyafraidguy,europe,When it said \ '' Declaration of Christmas Peace\ '' I thought of something [ like this ] ( https : //en.m.wikipedia.org/wiki/Christmas_truce ) .,Turkic,Turkish
Curiouslyafraidguy,europe,"Genetically engineer everybody to look like white Nordics , problem solved",Turkic,Turkish
Curiouslyafraidguy,AskEurope,"If it ever happened . Sometimes there are some stuff said by some Evangelical Protestant American political/media figure up voted to front page by Reddit , and European commentators be like \ '' wtf America , we\\ 've none of these people in Europe\ '' . Is it really the case though ? When did this shift happen ? Was it forced by state ( Eastern Bloc ) or did people give up religion themselves ?",Turkic,Turkish
Curiouslyafraidguy,europe,US and UK have too much of uneducated non-white people that skew the statistics though . I mean why would a cholo or a hood rat vote Trump,Turkic,Turkish
Curiouslyafraidguy,AskEurope,"To not to offend your current friends that you used to fight with . For example , Brits planned a great celebration for 100th anniversary of the [ Trafalgar ] ( https : //en.wikipedia.org/wiki/Battle_of_Trafalgar ) in 1905 but then they cancelled it to not to offend the French they were allied with . Now everyone in Europe seems to be allied ( not sure about Belarus though ) , would a Frenchman saying \ '' We kicked German asses in Verdun great , vive la France , we made great sacrifices otherwise we would all be speaking Feldgrauen\\ 's language instead of glorious Fran\u00e7ais\ '' seen as something gross ? Since France and Germany are very close partners today . But that\\ 's just an example , insert any 2 European countries . And I don\\'t mean current sentiments , I mean the memorial of historical events , so don\\'t get it wrong.\\n\\n",Turkic,Turkish
Curiouslyafraidguy,AskEurope,The similarity comes more from religion and less from language and mutual history ( in the case of Slavs ) though .,Turkic,Turkish
Curiouslyafraidguy,AskEurope,"Southeast is not ethnically Turkish except the state employees who are stationed in there . Not trying to turn this into a \ '' we\\ 're good others are the problem\ '' circlejerk , just stating a fact . \u0130stanbul has both Iraq-like and Europe like parts , \u0130zmir is good but used to be much better when I was a kid in 90s .",Turkic,Turkish
Curiouslyafraidguy,AskEurope,"I think left of the West and the right of the Turkey is similar ( both love Allah lol ) in the way they demonize the opposition . One of the interesting things is , Erdo\u011fan and his ultra-right supporters think with the presumption that Europe is a still nationalist , religious Christian , militarist and a patriarchal place like it was in the 1900 , which is the biggest straw man argument to have in the age of information of 2010s , but people are that stupid.\\n\\nWell maybe that old school kind of thinking exists in Russia , Poland , Serbia etc ( albeit not even close to being majority ) , people here assume that Germany is still like Heil Hitler and Britain is still like let\\ 's invade the arse of brown wankers , while in reality they\\ 're mostly pacifist , atheist and non-nationalist people . \ '' Cucks\ '' , as the alt-right say .",Turkic,Turkish
Curiouslyafraidguy,AskEurope,Most ? More like all . Even Englishs used the ice land bridge in Bering 10.000BC to cross from Asia to North America .,Turkic,Turkish
Curiouslyafraidguy,europe,"That and tinercis , Arabs , aggressive feral dogs",Turkic,Turkish
Curiouslyafraidguy,europe,Tayyib is ethnically Georgian too . I think Georgian material is just ideal for dictator production,Turkic,Turkish
Curiouslyafraidguy,AskEurope,Does Poland get shit from Western European countries because of this ? Because it seems like primary reason Russia is disliked is Putin is a traditional man,Turkic,Turkish
Curiouslyafraidguy,AskEurope,Which accent does [ Thomas Hickey ] ( https : //youtu.be/vHIkHO8FxAY ) speak with ?,Turkic,Turkish
Curiouslyafraidguy,AskEurope,To be not branded as racist fascist etc .,Turkic,Turkish
Curiouslyafraidguy,europe,"USA , UK ?",Turkic,Turkish
Curiouslyafraidguy,AskEurope,"Replace black people with the \ '' dissenters\ '' and the Southern Baptism with Sunni Islam , I think it\\ 'd be 1910 Alabama . But I don\\'t think anywhere in 2017 comes close",Turkic,Turkish
Curiouslyafraidguy,AskEurope,Same here,Turkic,Turkish
Curiouslyafraidguy,AskEurope,"So what ? You are Slavs . Just like Poles are Slavs , Russians are slavs etc ...",Turkic,Turkish
Curiouslyafraidguy,AskEurope,Allahu akbar . Lol\\n\\nWhy do you assume I support that \ '' certain president\ '' ?,Turkic,Turkish
Curiouslyafraidguy,AskEurope,"1.Nobody can differentiate most people\\ 's nationalities by looks if you mean that , unless they\\ 've their passports strapped to their foreheads.\\n\\n2.It would be true in terms of countries and states , but ethnically , linguistically , culturally and religiously Germans and French are two distant people . Of course you can mistake a German for a Serbian , a Russian for an Englishman or whatever based solely on looks , but saying \ '' Russians and English are practically the same , both are Christians with fairskin\ '' would be a dumb thing to say . However it\\ 's okay to say \ '' Turks and Arabs are practically the same , both are Muslims with brown skin ( not me or nobody in my family does look different from a \ '' white\ '' but whatever , let\\ 's say we are unusual ) , because of Eurocentric world view which led to slapdash generalizations of non-Europeans especially by British and French colonial rulers , creating artificial countries in Africa and Middle East that\\ 's problems still affecting today . Blame the Middle East problems on Yanks ( but I blame it on Sykes and Picot , but they\\ 're Europeans too , seriously how am I supposed to tell apart a white dude that goes to Church and speaks a European language from an actual European , right ?",Turkic,Turkish
Curiouslyafraidguy,europe,Found the time traveller,Turkic,Turkish
Curiouslyafraidguy,AskEurope,"& gt ; Wait is \ '' the holy book\ '' now in turkish ? \\n\\nYes it is.\\n\\n & gt ; Why would west need to show its power ? It\\ 's undisputed king of the world and USA is the leader of the pack . Turks know it as do other muslims.\\n\\nI loled at this , did you went into coma in the year 1900 and just woke up now ? All major USA cities are now crowded with blacks , Mexicans and Indians , nations like China and India can make their own rockets etc , European powers lost all their colonies and countries like Pakistan now have more military might than Germany . \\n\\n & gt ; Also lol Nazis were not supported more then commies or democrats , it just that people often used the war for personal battles ( including countries see croatia , ukraine , baltics , finland ... ) \\n\\nGovernments were allied with them and populace usually supported them . Civilian resistance against Nazis were so weak that it was a joke . Only the parts of Yugoslavia stood up to Hitler because he saw them as subhumans to be exterminated , it was out of necessity . And they still didn\\'t do much damage to Nazis . \ '' The Axis\ '' was practically whole Europe except UK and Russia , it wasn\\'t Nazi Germany , it was all of the continent.\\n\\nAnd none of my ancestors were raped by Arabic soldiers , but when same can not be said for you when it comes to German/Austrian soldiers . Do you speak German ? \\n\\n",Turkic,Turkish
Curiouslyafraidguy,AskEurope,"Last time I answered here , I was roasted by a Danish gentleman for not being a European , but I\\ 'm still going to answer anyway , to shed some insight , knowledge isn\\'t bad.\\n\\nThe Great World War I is taught in a positive , patriotic manner here . \ '' We were good guys and evil imperialistic Britain , France and Russia wanted to partition and colonize our lands and kill our people , we fended them off heroically.\ '' I know people are going to ask , the Armenian Genocide isn\\'t taught , and majority of the population think it\\ 's a hoax . Also European theater of war isn\\'t taught a lot , most people don\\'t know about Verdun or Somme or Tannenberg .",Turkic,Turkish
Curiouslyafraidguy,AskEurope,"They didn\\'t migrate . They conquered and either decimated or enslaved the English population , and their soldiers landed , not immigrants . If Moroccoan Army invaded Netherlands tomorrow , killed as many Dutch they could , then placed their own people , it would be maybe a similar situation . Geez , that\\ 's why we call Medieval Period \ '' Dark Ages\ '' . The World War II and Nazism ended just a lifetime ago , and memories of Soviet Empire are still fresh , barely 25 years has passed , do you really believe that people were all for equality , peaceful co-existing , progressivism etc . goddamn a thousand years ago ?",Turkic,Turkish
Curiouslyafraidguy,AskEurope,"But they\\ 're a subculture , especially the way they talk . I didn\\'t necessarily ask about cunts , I asked about \ '' that guys\ '' .",Turkic,Turkish
Curiouslyafraidguy,AskEurope,"Such as by Turkey or Russia . They say nationalism is dead , but fight survival is different from nationalism . Would you take arms yourself ? Also please no lectures on how it can\\'t/won\\'t happen , I\\ 'm not asking about \ '' can/will it happen\ '' , but rather \ '' what if it happens\ '' .",Turkic,Turkish
Curiouslyafraidguy,AskEurope,What about Ukraine and Russia ?,Turkic,Turkish
Curiouslyafraidguy,AskEurope,"If it wasn\\'t for \ '' low religion\ '' , we\\ 'd be a developed country dammit",Turkic,Turkish
Curiouslyafraidguy,AskEurope,[ There you go . ] ( https : //m.reddit.com/r/PropagandaPosters/comments/4psl8b/our_mother_europe_vichy_postcard_1942/ ? ref=search_posts ),Turkic,Turkish
Curiouslyafraidguy,AskEurope,He went using a [ time machine ] ( https : //en.m.wikipedia.org/wiki/Umayyad_invasion_of_Gaul ),Turkic,Turkish
Curiouslyafraidguy,AskEurope,I think immediately available ( battleworthy ) nuke arsenal of US surpasses those of Russia .,Turkic,Turkish
Curiouslyafraidguy,AskEurope,And which part,Turkic,Turkish
Curiouslyafraidguy,AskEurope,Did you visit Zimbabwe or something instead of Turkey ?,Turkic,Turkish
Curiouslyafraidguy,AskEurope,"& gt ; Btw you been to Izmir ? City seemed quite liberal.\\n\\nYes , why ? \\n\\n & gt ; As for the West , outright display of power is seen as dumb and only a insecure person would display it in a \ '' meathead\ '' way.\\n\\nWhy does this sub legitly assume that Western history starts at 1970 ? Even if you don\\'t count Nazis as usual Westerners ( and I don\\'t know why people assume this , most people in Europe supported them more than they did the Soviets or Anglo Allies until defeat seemed inevitable in circa 1944 ) , display of power has quite a history in the West , especially Habsburgs were globally renowned for it . \\n\\n & gt ; It\\ 's posturing like call for peace while you further support either shia or sunni leaders agressivenes toward eachother , you are killing two birds with one stone ... .\\n\\nIt\\ 's not exclusively a Tayyib/Gulf States thing , United States , and to a lesser extent UK and France are also notorious for \ '' support either shia or sunni leaders agressivenes toward eachother , you are killing two birds with one stone ... .\ '' \\n\\n & gt ; You get what i am saying habibi ? \\n\\nYou realize Arabic isn\\'t spoken here right ? It was your country that had been occupied by another empire that spoke another language for centuries .",Turkic,Turkish
Curiouslyafraidguy,AskEurope,"[ Last people that were hanged for sodomy ] ( https : //en.wikipedia.org/wiki/James_Pratt_and_John_Smith ) were back in 1835 though . It\\ 's said that death penalty was overused in England\\n\\n & gt ; Sir Samuel Romilly , speaking to the House of Commons on capital punishment in 1810 , declared that \ '' [ there is ] no country on the face of the earth in which there [ have ] been so many different offences according to law to be punished with death as in England.\ '' \\n\\nThe fact it remained as a punishable offense-just not mortally until the 60s was probably due to laws being more based on culture heritage back then as opposed to \ '' do whatever you want without harming anyone/anything\ '' attitude today . Politicians might have feared that , if traditional order of society was to be broken , it would have gradually evolved into a state of anarchy , revolt and mutinies . They were not exactly wrong though , people in 2017 Britain no longer attend the Anglican Church , have 11 kids before age 30 , work at factories for 80 hours a week for a slave wage , protect the colonial interests around the world by suppressing the savages and the fact that London is not even majority English anymore . If you showed the situation in 2017 Britain to 1917 House of Lords , they\\ 'd view it as a dystopia worse than the defeat by Germans , and do everything they could to change the future . Making homosexuality illegal or barring women from voting or having an independent legal status from her husband , was probably enforced to prevent the society to turn into exactly what it is today .",Turkic,Turkish
Curiouslyafraidguy,AskEurope,"Yeah . They are called \u00e7omars here . They probably make up to around 60 % of the population , but 40 % is no small percentage .",Turkic,Turkish
Curiouslyafraidguy,AskEurope,"Such as France vs Spain.\\n\\nEdit : Goddamn , I typed nations twice .",Turkic,Turkish
Curiouslyafraidguy,AskEurope,"Whatever that means , it\\ 's a common meme here ( reddit ) . [ Like this ] ( http : //www.dailystormer.com/wp-content/uploads/2016/05/e12.png ) . People usually compare today\\ 's Europeans to WWII era Europeans and say 21st century is \ '' pussified\ '' , they allow refugees to grope their women and don\\'t even try to put up a fight etc . How true is this ? I can\\'t relate , because 1945 Turkey and 2017 Turkey is culturally ~90 % same , and it\\ 's applicable to pretty much every non-Western nation .",Turkic,Turkish
Curiouslyafraidguy,AskEurope,"It was just a link with a meme . I didn\\'t link an article or a political view from that website , nor I did check it\\ 's name . I googled \ '' Swedish guy meme\ '' and posted the first link here without checking if they were Nazi or not . Not that I agree with the meme too , I just saw it being used too much on various social media platforms.\\n\\n & gt ; And to your question , I have to ask a counterquestion . Does supporting war make you a man ? Why ? \\n\\nNo but I gave it as an example that supporting a war ( or hard action ) and being an enlightened intellectual is not mutually exclusive . Max Liebermann , Max Planck , Wilhelm Wien , Emil von Behring were far from ravaging alcoholic lumberjacks , but the did support the war . Not because they enjoyed the idea of killing or destroying , but rather because they thought protection of their own kin was more important than the global wellbeing . That idea is seen as selfish today , but it\\ 's what made the West prosperous .",Turkic,Turkish
Curiouslyafraidguy,AskEurope,"I don\\'t know the context behind \ '' dailystormer\ '' , I just googled this meme . I don\\'t think enlightened necessarily means pussy , didn\\'t most German intellectuals support the World War I in 1914 ?",Turkic,Turkish
Curiouslyafraidguy,AskEurope,Is there a black in top 10 active footballers ?,Turkic,Turkish
Curiouslyafraidguy,AskEurope,"Oh okay , I thought it was suspended in 2000 .",Turkic,Turkish
Curiouslyafraidguy,AskEurope,"Not to break the circle jerk , but most KKK members were descendants of rural Puritan English settlers of early-mid 1600s , not Finns arriving after WWII .",Turkic,Turkish
Curiouslyafraidguy,AskEurope,"Turks definitely say it , and Brits too , judging from The LAD Bible comments section",Turkic,Turkish
Curiouslyafraidguy,AskEurope,"I think demographic transition and economic restructuring played the biggest part . Back in 1910s when average Frenchman or a German was either a farmer or an industrial worker , it would be unlikely for him to ever travel to France/Germany to meet the \ '' enemies\ '' and cultural exchanges etc . Today most people in Europe don\\'t suffer from poverty , are college educated , travel a lot and also educational system promotes critical thinking while back then it probably pushed nationalistic agendas .",Turkic,Turkish
Curiouslyafraidguy,AskEurope,Some of the Syrians are \ '' fairer\ '' looking too . But I suppose Turkey is the fairest Muslim country after Albania .,Turkic,Turkish
Curiouslyafraidguy,europe,"They willfully migrated to the British colonies ( or States , after revolution ) , it was not like German government sent them to German colonies to settle , which probably r/RedWashing was referring to . Look up [ this ] ( https : //en.m.wikipedia.org/wiki/Forty-Eighters ) .",Turkic,Turkish
Curiouslyafraidguy,AskEurope,What was the age for it ? 35+ or 37+ seems more likely given the date,Turkic,Turkish
CyberDiablo,europe,"Those are adjuncts . Even with rye and wheat beers , malted barley is still present .",Turkic,Turkish
CyberDiablo,europe,I prefer \ '' s\u00f6zc\u00fck da\u011farc\u0131\u011f\u0131.\ '' ( English word for \ '' word\ '' + now fossilised word for \ '' sack\ '' with a diminutive suffix ) \\n\\n\ '' S\u00f6zc\u00fck da\u011farc\u0131\u011f\u0131\ '' n\u0131 ye\u011flerim .,Turkic,Turkish
CyberDiablo,europe,This is gon na be fun.\\n\\nBu i\u015f e\u011flenceli olacak.\\n\\n\u697d\u3057\u304f\u306a\u308b\u305c\u3002,Turkic,Turkish
CyberDiablo,europe,"Actually ; \ '' Gagauz Yeri\ '' is just the autonym of Gagauzia , not the name of the law .",Turkic,Turkish
CyberDiablo,europe,Or in the rest of the world .,Turkic,Turkish
CyberDiablo,europe,& gt ; African as a language\\n\\nhnghghn,Turkic,Turkish
CyberDiablo,europe,German in most high schools . French or Italian in few select high schools .,Turkic,Turkish
CyberDiablo,europe,pls no,Turkic,Turkish
CyberDiablo,europe,imgur is blocked in Turkey .,Turkic,Turkish
CyberDiablo,europe,"In Turkish , in the same order : \\n\\nAsteriks \\nOburiks or Hopdediks \\n\u0130defiks \\nB\u00fcy\u00fcfiks \\nToptoriks \\nTamotomatiks \\nPalamutiks \\nEskitopraks \\nKakafoniks",Turkic,Turkish
CyberDiablo,europe,"Yes , especially around Konya . But beer is made from barley , if you mean that .",Turkic,Turkish
CyberDiablo,europe,It has a mystical aura around it .,Turkic,Turkish
Daario1,europe,Turkey is in there .,Turkic,Turkish
Daario1,europe,Looks like my English teacher finally got her way .,Turkic,Turkish
Daario1,europe,"Call him by his middle name , Tayyip . He hates being called Tayyip .",Turkic,Turkish
Daario1,europe,"You know Putin and Erdo are homedogs right ? I think Tayyip is in Moscow right now to talk about buying a Russian missile defense system , and the lifting of sanctions .",Turkic,Turkish
Daario1,europe,I think around 30-60 % of Turkish women wear some type of headscarf . https : //en.wikipedia.org/wiki/Women_in_Turkey # Islam.2C_nationalism_and_the_nation-state,Turkic,Turkish
Daario1,europe,This is what I should have ready whenever someone says \ '' TURKEY MUST OUT OF NATO ! \\ ',Turkic,Turkish
Daario1,europe,Do you understand what sovereignty means .,Turkic,Turkish
Daario1,europe,"This cartoon is retarded . How do you lump the Kurdish nation , one of the most politically divided and tribalistic nations into one placard ? Especially when KRG Barzani is helping Turkey against the PKK . Especially when the Kurdish Hizbollah has repeatedly attacked PKK and HDP fighters and supporters . This sentiment that Turkey is attacking the entire Kurdish nation is pretty annoying , and more so when you see it on the Daily Show .",Turkic,Turkish
Daario1,europe,This is most likely [ Dev Sol ] ( https : //en.wikipedia.org/wiki/Revolutionary_People % 27s_Liberation_Party % E2 % 80 % 93Front ) up to their usual antics .,Turkic,Turkish
Daario1,europe,Left image looks like Saudi tourists in Turkey .,Turkic,Turkish
Daario1,europe,"Eskisehir , while technically not in Europe is a great college town .",Turkic,Turkish
Daario1,europe,They always do shit like this . Look at their track record .,Turkic,Turkish
