AlbaIulian,europe,"* Slavic folk\\n\\n* Intersting history and culture\\n\\n* Pushkin and Dostoevsky , among other literature greats . Shame that I prefer non-fiction.\\n\\n* Gigantic ; 11 timezones.\\n\\n* Home of the Transsiberian Railway , from the West to Vladivostok in 7 days.\\n\\n* Faberg\u00e9 eggs.\\n\\n* Vodka , borscht and pelmeni.\\n\\n* Lively , strong , but over-confident . Brazen and proud like a bear . Have womanizing tendencies.\\n\\n* The Novy God song.\\n\\n* Road menaces.\\n\\n* Treasury still held over from WWI , and they did very bad stuff here after WWII . And they still prevent the union with Moldova through Transnistria.\\n\\n* Eh- government , cool people.\\n\\n* They\\ 're everywhere in CS : GO and Dota . \ '' Rush B\ '' \ '' Cyka blyat\ '' \ '' Pidar suka idi nakhuy blyat\ '' \\n\\nReally , a lot . A bit too much .",Romance,Romanian
AlbaIulian,europe,"Aww , and they even had Putulukeeso going along .",Romance,Romanian
AlbaIulian,europe,"Well , fairly young , so yeah .",Romance,Romanian
AlbaIulian,europe,"I\\ 've heard the form \ '' Huniad/Huniazi\ '' used here as well , as in \ '' Castelul Huniazilor\ '' .",Romance,Romanian
AlbaIulian,europe,I fucking hate the colder season ...,Romance,Romanian
AlbaIulian,europe,Bloody hell ... When will we finally stamp out the hydra ?,Romance,Romanian
AlbaIulian,AskEurope,"Eh , too cold . Otherwise , neutral .",Romance,Romanian
AlbaIulian,europe,"Romania can not into Welsh awesome name , it seems .",Romance,Romanian
AlbaIulian,europe,"# FREECOW\\n\\nWell , back to the old grouchy r/Europe I always knew , I guess .",Romance,Romanian
AlbaIulian,europe,We could use Hertza and Bugeac back as well . The Greater Romania dream lives on .,Romance,Romanian
AlbaIulian,europe,Modern architecture never did it for me . Just looks ... uninspiring .,Romance,Romanian
AlbaIulian,europe,"Yes . Even after better PR and everything , people just say \ '' Naah , we still don\\'t want this\ '' . What then ?",Romance,Romanian
AlbaIulian,europe,"& gt ; neerlandezi Never heard that , even in official sources . Plm calls them that .",Romance,Romanian
AlbaIulian,europe,Everywhere except Spain it seems . It is popular over.here .,Romance,Romanian
AlbaIulian,europe,Glorious to see that the \ '' circus\ '' era of politics isn\\'t over here yet . Wonderful entertainment .,Romance,Romanian
AlbaIulian,europe,"A referendum to change the definition of \ '' family\ '' in the constitution . More specifically , the wording . From \ '' The family consists of the freely-consented union of two bridegrooms\ '' -note the ambigious wording here , loosely translated from the \ '' doi soti\ '' original- to \ '' The family consists of the freely-consented union of man and woman\ '' .",Romance,Romanian
AlbaIulian,europe,"Yes and no.\\n\\nWe\\ 're \ '' fine with gays\ '' in the sense that we begrudgingly tolerate them , but we as a people aren\\'t too OK with the idea . And some folks at the \ '' Coalition for Family\ '' made a petition to change the wording in the constitution around the time a gay marriage case is debated in the Constitutional Court . It passed the threshold to be discussed in Parliament , and AFAIK it was tacitly allowed to pass.\\n\\nA relatively small fish to fry considering that the PSD is giving out electoral gifts paid through gutting the investition funds , and in general tries to undo the effects of the DNA surge of the decade , and free the already-jailed crooks .",Romance,Romanian
AlbaIulian,AskEurope,"And , as a question , what would you like the EU to be .",Romance,Romanian
AlbaIulian,europe,Now that is a name that screams \ '' 2000s\ '',Romance,Romanian
AlbaIulian,europe,"Well , Carol II and Mihai were born in Romania . Perhaps he meant one of these .",Romance,Romanian
AlbaIulian,europe,"Well , there was Common Brittonic , which eventually gave way to Cumbric ( which is extinct now , thanks Anglo-Saxons ) , Welsh , Breton and Cornish .",Romance,Romanian
AlbaIulian,europe,Or just tree in general .,Romance,Romanian
AlbaIulian,AskEurope,Only greeting the teacher as a group over here sometimes . Altough I kind of like the idea of a Pledge of Allegiance .,Romance,Romanian
AlbaIulian,europe,"Andrei Anti , a 30 years old young man from the village of Butea , Iasi County , was indicted by anti-corruption prosecutors , accused of changing the destination of european funds . More precisely , out of the 24,000 euro EU funding taken for his cattle farm , a third has been used to pay his debts to an acquaintance . The rest was gambled away on the slots and , with what was left , he made a stable - which was not mentioned in the documentation submitted.\\n\\n7est newspaper reporters contacted the young man , who did not want to comment , saying only that \ '' there is another situation over there.\ '' \\n\\nDNA release : \\n\\nThe prosecutors within the National Anticorruption Directorate - Territorial Service Iasi have sent to trial in custody , the defendant\\nANTI ANDREI for the offense of changing , without observing the legal provisions , the destination of funds.\\n\\nIn the indictment prepared by the prosecutors the following facts were stated : \\n\\nIn the period February to May 2014 , the defendant Anti Andrei , as a representative of a private company , changed the destination of the amount of 107.304 lei ( the equivalent of 24,000 euro ) disbursed by the Agency for Financing Rural Investment , as an advance under contract financing the \ '' young farmers\ '' .\\nThat amount has not been spent on carrying out the actions foreseen in the business plan of individual enterprise they represent , but has been used for personal defendant Anti Andrei , who repaid a loan in the amount of approximately \u20ac 8,000 , spent part of the amount of 107.304 lei on electronic games and performed construction works in an annex to the farm ( stable ) , works unmentioned in the business plan.\\n \\nThe seizure of movable and immovable property of the defendant Anti Andrei , up to the amount of damage caused , respectively 107 304 lei , was approved.\\n\\nThe case was sent for trial to the Iasi Court , with the proposal to maintain the precautionary measures ordered in the case.\\n\\nPost-scriptum from me : Guy registered the funds on a relative\\ 's name and did this while he got the land from his neighbors . What\\ 's not to love about Romania .",Romance,Romanian
AlbaIulian,europe,"[ Kettles of Europe : The Most Romanian Kettle ever ] ( https : //metro.scene7.com/is/image/metro/RO_PIM_686880001002_01 ? wid=230 & amp ; hei=230 & amp ; fmt=jpeg & amp ; qlt=80,1 & amp ; op_sharpen=0 & amp ; resMode=sharp2 & amp ; op_usm=1,1,6,0 & amp ; iccEmbed=0 & amp ; printRes=72 )",Romance,Romanian
AlbaIulian,europe,"No idea , tbh .",Romance,Romanian
AlbaIulian,europe,"Croatia so strong , it kept using the Glagolitsa until the 19th century in liturgy . Screw inferior Cyrillic and Latin , Glagolitsa strong !",Romance,Romanian
AlbaIulian,europe,"Well , shit . Get your act together , right !",Romance,Romanian
AlbaIulian,AskEurope,"Usually the elderly , poor and some rural youth vote social-democratic ( read : Mafia ) , the young do not really vote , the middle-class vote national-liberal most of the time , the politically active youth and those seeking an alterEnglish vote USR . Hungarians vote their own party , and the wealthy ... not sure . But generally the trend is political apathy . \ '' No matter how I vote it\\ 's the same guys always coming to power\ ''",Romance,Romanian
AlbaIulian,europe,"Off-topic , that thumbnail is hilarious .",Romance,Romanian
AlbaIulian,europe,Greatest Finlandia best Finlandia .,Romance,Romanian
AlbaIulian,europe,[ This one of course ] ( https : //www.youtube.com/watch ? v=1Xn5p6fVzWI ),Romance,Romanian
AlbaIulian,AskEurope,"No , but there is a degree of euroscepticism in my circles . Which I am glad exists .",Romance,Romanian
AlbaIulian,Eurosceptics,"Good . Let the Union tremble . Scepticism is growing at a steady pace , Melenchon/Le Pen or not .",Romance,Romanian
AlbaIulian,europe,"\ '' OK\ '' , said Japan .",Romance,Romanian
AlbaIulian,AskEurope,"Die Wacht am Rhein , Panzer rollen in Afrika vor , Stefan Hrusca and some national anthems . With other stuff like Sabaton or Nightwish on the side .",Romance,Romanian
AlbaIulian,AskEurope,Good one . Even better .,Romance,Romanian
AlbaIulian,europe,"RIP . Thanks for your creation , man . I genuinely like it .",Romance,Romanian
AlbaIulian,AskEurope,Kaunas by far .,Romance,Romanian
AlbaIulian,europe,"Hey , appreciate it . Also , the \ '' totus\ '' ... Omnes and Totus just merged in Romanian somehow , into \ '' tot\ '' , meaning \ '' all , whole , every part of it\ '' . So , I kinda mixed them up . Eh , shit happens .",Romance,Romanian
AlbaIulian,europe,"And sounds similar to macrou , which means \ '' mackerel\ '' in Romanian .",Romance,Romanian
AlbaIulian,europe,Excellent . : ),Romance,Romanian
AlbaIulian,europe,"My life is relatively boring , nothing people would like to see : P",Romance,Romanian
AlbaIulian,AskEurope,George Washington .,Romance,Romanian
AlbaIulian,europe,How did this happen that quick .,Romance,Romanian
AlbaIulian,europe,They got Hungarian right .,Romance,Romanian
AlbaIulian,AskEurope,"[ \ '' OK , one last time . These are small . But the ones out there are far away . Small ... . far away.\ '' ] ( https : //www.youtube.com/watch ? v=dS12p0Zqlt0 )",Romance,Romanian
AlbaIulian,europe,"Shit . I wanted warmer weather , not fucking cold again . Well , time to flee to Virginia , I guess..",Romance,Romanian
AlbaIulian,europe,"Plenty , not even going to bother anymore to list .",Romance,Romanian
AlbaIulian,europe,No plz,Romance,Romanian
AlbaIulian,europe,"Yeah , but my home\\ 's very near the Russian Winter zone . So , yeah , if it cools down any further than this year ( hated this year\\ 's return of old-time winter ) , I would have to find a way to do what I have to do whilist \ '' hibernating\ '' .",Romance,Romanian
AlbaIulian,AskEurope,"Not really . On a personal level , yes . On the national level , no .",Romance,Romanian
AlbaIulian,europe,"Yes , but am I not entitled to form an opinion on anything ?",Romance,Romanian
AlbaIulian,europe,"Non merci , France . \\n\\n ( Non parlez fran\u00e7ais , only un petite amount . )",Romance,Romanian
AlbaIulian,europe,The FAMAS will live on in CS : GO .,Romance,Romanian
AlbaIulian,AskEurope,"Doubt it . Only the highest-performing students get to do it for free , others have to pay a tax .",Romance,Romanian
AlbaIulian,AskEurope,"* Former premier Victor Ponta ended up with the nickname \ '' Mickey Mouse\ '' due to [ this photo ] ( https : //media.dcnews.ro/image/201411/w670/victor_ponta_1_68886200.jpg ) \\n\\n* Former justice minister Florin Iordache got stuck with the \ '' Alta intrebare\ '' ( Another question/Next question ) meme after he used that phrase about 24 times within a press conference during the OUG 13 brouhaha.\\n\\n* Former nationalist politician Corneliu Vadim Tudor became a goldmine due to his very angry outbursts of rage . RIP in peace , Tribune : ( \\n\\n* Other times it\\ 's stuff like exaggeration of politicians themselves ( Basescu being a drunk sailor or Mazare a womanizing costume afficionado ) or reminiscing of stupid statements , like \ '' Summer\\ 's not like winter\ ''",Romance,Romanian
AlbaIulian,AskEurope,"Comments on the other ones ? Also , if you are Polish , can we into Visegrad ?",Romance,Romanian
AlbaIulian,europe,"Romanians celebrate Christmas on the 25th of December . ( altough the gifts and most stuff associated with Christmas happens on Christmas Eve , on the 24th . )",Romance,Romanian
AlbaIulian,europe,Totae linguae servi Latinam sunt . ( or however actual latin would have it ),Romance,Romanian
AlbaIulian,europe,"No real problems , considering we practically got Putin on our doorsteps .",Romance,Romanian
AlbaIulian,europe,I like having our own currency tbh .,Romance,Romanian
AlbaIulian,AskEurope,"Practically never . Only once , and I guess he was a tourist .",Romance,Romanian
AlbaIulian,europe,I still see older non-EU plates sometimes . White with the coat of arms . ( Now there is that blue stripe on the left ),Romance,Romanian
AlbaIulian,AskEurope,*MARE NOSTRUM INTENSIFIES*,Romance,Romanian
AlbaIulian,AskEurope,Adidas tracksuits .,Romance,Romanian
AlbaIulian,europe,So ? What I said was there are none \ '' respectable and ethical resposponsible\ '' countries . We got no real replacement .,Romance,Romanian
AlbaIulian,europe,"[ Excuse the shoddy lighting , but here it is in its glory . ] ( http : //i.imgur.com/LO9fs55.jpg )",Romance,Romanian
AlbaIulian,AskEurope,[ 1940 ] ( https : //upload.wikimedia.org/wikipedia/commons/thumb/c/c6/P % C3 % A9rdidasTerritorialesRumanas1940-ro.svg/1280px-P % C3 % A9rdidasTerritorialesRumanas1940-ro.svg.png ) : The year when [ Greater Romania ] ( https : //upload.wikimedia.org/wikipedia/commons/e/eb/GreaterRomaniaHistoricRegions.png ) got ripped from us and we could not to anything .,Romance,Romanian
AlbaIulian,europe,Let it fall and start from scratch .,Romance,Romanian
AlbaIulian,europe,I believe in you Franci !,Romance,Romanian
AlbaIulian,AskEurope,"Worst-case scenario might be either the creation of the Romanian SSR or a partition : Ivan takes Moldova and merges it into the Moldovan SSR , leaves Dobruja to the Bulgarians , Transylvania to the Hungarians and Wallachia becomes a puppet rump state .",Romance,Romanian
AlbaIulian,europe,"Just get rid of it at this point , or confine it to the countries that could handle it ( aka the Benelux states , France and Germany ) .",Romance,Romanian
AlbaIulian,europe,"RIP . Thanks for your creation , man . I genuinely like it .",Romance,Romanian
AlbaIulian,europe,"Good call . Hopefully the rest of the world can follow suit as soon as possible , and not just regarding smoking .",Romance,Romanian
AlbaIulian,AskEurope,They got one as well . [ These guys are the ones I referred to ] ( https : //en.wikipedia.org/wiki/Transsylvania_Phoenix ),Romance,Romanian
AlbaIulian,AskEurope,"Well , round this time the priest comes by to bless the house . ( can happen earlier the bigger the town ) . \\n\\nHe comes by , sings along with some assistants the epiphany troparion , sprinkles the rooms of the house with holy water using a basil sprig , and then the people in the house kiss the cross . Afterwards , the hosts may offer the priest some food or drink , the tithe is paid , and then the priest moves on .",Romance,Romanian
AlbaIulian,AskEurope,Whatever was on Cartoon Network at the time.\\n\\n* Tom and Jerry\\n\\n*Ed Edd n Eddy\\n\\n* The Cramp Twins\\n\\n* KND : Kids Next Door\\n\\n* Courage the Cowardly Dog\\n\\nHow much time has passed ... still glad I got the dubs instead of the subtitles .,Romance,Romanian
AlbaIulian,AskEurope,Very negative IMO .,Romance,Romanian
AlbaIulian,europe,"Rather hard , considering : \\n\\n1 ) I do not want to work in IT ( Interested in majoring in History , actually ) \\n\\n2 ) My dream \ '' project\ '' would require me holding public office and having a majority to actually enforce it\\n\\n3 ) \ '' Motivate your friends\ '' Not gon na work , such \ '' inspirational\ '' quotes are seen in a rather cynical way . Guilty of that myself .",Romance,Romanian
AlbaIulian,europe,Romanian version : \\n\\nAustria : \ '' Why is Australia at the Eurovision\ '' \ '' Why is Australia called the continent of contrasts\ '' \ '' Why is Australia the most arid of continets\ '' \\n\\nBelgia : \ '' Why is Belgium a francophone country\ '' \ '' Why is Belgium a confederacy\ '' \ '' Why are Belgium and Germany federal states\ '' Honorable mentions : \ '' Why do Belgian rabbits die\ '' and \ '' T\u00fcrkiye\\'de ce belgesi veren kurulu\u015flar\ '' ( ? ? ? ) \\n\\nBulgaria : \ '' Why Bulgaria\ '' \ '' What religion do the Bulgarians practice\ '' \ '' What is the Bulgarians\\ ' origin\ '' \\n\\nCyprus : \ '' What continent does Cyprus belong to\ '' \\n\\nCzechia : \ '' Why was Czechoslovakia invaded\ '' \ '' Why did Czechoslovakia split up\ '' \\n\\nDenmark : \ '' Why Denmark\ '' \ '' Why are Danes the happiest\ '' \ '' Why is Denmark famous\ '' \\n\\nEstonia : ... \\n\\nFinland : ... \\n\\nFrance : \ '' Why does France have more climate types\ '' \ '' Why France\ '' \ '' Why is France attacked by terrorists\ '' \ '' Why did France and Britain sacrifice Czechoslovakia at Munich\ '' \\n\\nGermany : \ '' Why is Germany the motor of European industry\ '' \ '' Why does Germany not have an army\ '' \ '' Why is Germany the most developed country\ '' \\n\\nGreece : \ '' Why was Ancient Greece not an unitary state\ '' \ '' Why Greece\ '' \ '' Why weren\\'t Greece and Egypt romanized\ '' \ '' Why is Greece in a crisis\ '' \ '' Why does Greece play without spectators\ '' \\n\\nItaly : \ '' Why Italian\ '' \ '' Why does Italy have a developed metalworking industry\ '' \ '' Why Italy is an open-air museum\ '' \ '' Why is Italy\\ 's petrochemical industry in harbors\ '' and more\\n\\nIreland : \ '' Why is Ireland specialized in animal breeding\ '' \ '' Why does Ireland raise animals\ '' \\n\\nLatvia : ... \\n\\nLithuania : ... \\n\\nGreat Britain : \ '' Why does Great Britain wan na leave the EU\ '' and so forth.\\n\\nNorway : \ '' Why does Norway have less forests than Finland\ '' \ '' Why isn\\'t Norway in the EU\ '' \ '' Why does the Norwegian crown shrink\ '' \\n\\nNetherlands : \ '' Why is Holland named the tulip country\ '' \ '' Why isn\\'t Holland at the Euro 2016\ '' \ '' Why does Holland have 2 capitals\ '' \\n\\nLuxemburg ( cuz forgot ) : \ '' Why does Luxemburg have the highest GDP\ '' \ '' What country does Luxemburg belong to\ '' \\n\\nRomania : \ '' Why is Romania poor\ '' \ '' Why doesn\\'t Romania have a gymnastics team at Rio\ '' \ '' Why is Romania a Carpathian country\ '' \ '' Why is the country named Romania and not Dacia\ '' \\n\\nPoland : \ '' Why isn\\'t Poland a great cereal producer\ '' \ '' Why didn\\'t Poland enter recession\ '' \ '' Why doesn\\'t Poland produce cereal\ '' \\n\\nPortugal : \ '' Why Portugal\ '' \ '' Why visit Portugal\ '' \ '' Why is Portugal famous\ '' \\n\\nSpain : \ '' Why is Spain a tourist country\ '' \ '' Why Spain\ '' \ '' Why Spanish\ '' \ '' Why did Spain lose\ '' \ '' Why visit Spain\ '' \\n\\nSlovakia : ... \\n\\nSlovenia : ... \\n\\nCroatia : \ '' Why visit Croatia\ '' \\n\\nSweden : \ '' Why Sweden\ '' \ '' Why study in Sweden\ '' \\n\\nHungary : \ '' Why do Hungarians want Transylvania\ '' \ '' Why are Hungarians called Magyars\ '' \\n\\nSwitzerland : \ '' Why is Switzerland neutral\ '' \ '' Why is Switzerland not in the EU\ '' \ '' Why does Switzerland have CH\ '' \\n\\nGot questions ? Would like to answer them .,Romance,Romanian
AlbaIulian,AskEurope,"Oh yes , curentul/promaja . And I who thought it was mostly a Balkan thing.\\n\\nAnd God forbid you leave a window and a door open at the same time .",Romance,Romanian
AlbaIulian,AskEurope,"*attempts to greet Chinese tourists while raising right hand and speaking from behind a window , a perfectly square-shaped piece of dirt under my nose*",Romance,Romanian
AlbaIulian,AskEurope,"1.82/1.83 . Been a while since I last measured , but I generally have no problem with my height .",Romance,Romanian
AlbaIulian,AskEurope,"We are formal over here : For teachers , it is Domnule profesor , commonly shortened to Dom . profesor ( Mr. Teacher/Professor or Teacher ) , Doamna profesoar\u0103 , usually shortened to Doamna ( Mrs. Teacher/Professor or Mrs. ) .",Romance,Romanian
AlbaIulian,europe,"[ Denarii , ] ( https : //en.wikipedia.org/wiki/Denarius ) my friend .",Romance,Romanian
AlbaIulian,AskEurope,"I , personally , not much aside from history and language and some values .",Romance,Romanian
AlbaIulian,europe,Hope somebody bloody vetoes it .,Romance,Romanian
AlbaIulian,europe,*process_cq* The world is yours .,Romance,Romanian
AlbaIulian,europe,"At the time I\\ 'd have either proposed to put mix the [ Bourbon ] ( https : //upload.wikimedia.org/wikipedia/commons/thumb/0/0f/Pavillon_royal_de_France.svg/1500px-Pavillon_royal_de_France.svg.png ) and [ Tricolore ] ( https : //upload.wikimedia.org/wikipedia/en/thumb/c/c3/Flag_of_France.svg/900px-Flag_of_France.svg.png ) or just ask the guy\\ 's \ '' heir\ '' in the first place who was more than willing to take the throne.\\n\\nUnfortunately , support for the Restoration is low ATM ... even if the president has powers similar to a Monarch . Perhaps one lucky day , the Crown of France will have a head to sit on once more ( that preferrably isn\\'t guillotined , of course ) .\\n\\nIt\\ 's obvious I am very much in favor of kings and emperors by now , isn\\'t it ?",Romance,Romanian
AlbaIulian,AskEurope,Agreed on the hivemind part .,Romance,Romanian
AlbaIulian,AskEurope,"Yeah , and nobody over here really cares about that , and we got no autonomous industry . So , yeah , old answer stands .",Romance,Romanian
AlbaIulian,europe,Please no .,Romance,Romanian
AlbaIulian,AskEurope,Pizza and chicken schnitzel ( any other meat is heresy ) .\\n\\nNot a fan of greens .,Romance,Romanian
AlbinaViespeStup,europe,This is wrong . Romanian public television ( TVR ) gets its majority funding directly from the government ( ~ \u20ac40.5M per year ) and a very very small piece from advertisements and licensing .,Romance,Romanian
AlbinaViespeStup,europe,The K\u00fcrt\u0151skal\u00e1cs master is starting to be really fucking pathetic .,Romance,Romanian
Alcohol-Livercide,europe,"It basically amounts to nothing but abandoning ethnic identity anyway , which is exactly what civic nationalism is about .",Romance,Romanian
Alcohol-Livercide,europe,"No , but people will complain on the internet . The scouts are already here .",Romance,Romanian
AlexBlana,europe,how is this an insult ? Macron has always been pro-EU .,Romance,Romanian
AlexBlana,europe,they should bomb the parliament . No one would stand in their way,Romance,Romanian
AlexBlana,europe,"I\\ 'm just curious , who does serbia has a beef with ? \\n\\nwe have a \ '' beef\ '' with Hungary and Bulgaria , but none with Ukraine and Serbia .",Romance,Romanian
Alexander0810,europe,& gt ; Wonder if you say that often enough it becomes true.\\n\\nAnd Norway is in Africa ?,Romance,Romanian
Alexander0810,europe,Pretty much and it costs 10 euros/mo,Romance,Romanian
Alexander0810,europe,You either follow it or get stoned to death . I guess it is a choice : - ? ?,Romance,Romanian
Alexander0810,europe,"Estonia , beautifull country+culture and enough economic power for a comfortable life",Romance,Romanian
Alexander0810,europe,Way easier to learn than most european languages,Romance,Romanian
Alexvheerden,europe,Hey our eagle has a crown ...,Romance,Romanian
Alretidead,europe,"woosh , shiite is a faction of muslims",Romance,Romanian
Alretidead,AskEurope,You get triggered by the word Reich ?,Romance,Romanian
Alretidead,europe,Moldova can unite with Romania now . Is fine .,Romance,Romanian
Alretidead,europe,Aww poor UKIP . /s . \\n\\nShoutout to my boys doing the Romanian squat over there,Romance,Romanian
AndreiS98,europe,"Putting a huge chunk of the Antiterror & amp ; Organized Crime unit on high alert and spending many resources in finding those individuals as fast as possible , while leaving the rest of the country more vulnerable for absolutely nothing is as clear a threat to national security as it gets , in my opinion.\\n\\nHe\\ 'll be charged , tried , given one year suspended sentence ( maybe even 2 ) and probably a healthy fine . He won\\'t spend a night in jail . It\\ 's pretty much standard procedure around here . Nobody really spends a day in jail on their first offenses if they\\ 're \ '' minor\ '' penal ones like this and it\\ 's not an aggravated case . Plus nobody wants to go through the hurdles of getting such an asshole here for jail time , I\\ 'd be more afraid he\\ 'd like it here and stay . \\n\\nStill , it\\ 'll probably end his career and even if it doesn\\'t , make him think thrice before spewing BS again , so it\\ 's fine by me .",Romance,Romanian
AndreiS98,europe,"Actually I\\ 'm inclined to believe they\\ 're putting all their bets on something else . They stand by the story even though they know it\\ 's fake by know , hoping and praying that Romania will just give up and let it slide . They keep their credibility intact , avoid all backfire and life goes on . Literally their plan is \ '' Ha , Romanians , they\\ 're stupid anyway , can\\'t touch us\ '' .\\n\\n Except it won\\'t happen . The whole Country is really , really pissed . This won\\'t go away without a serious investigation , charges and some punishment . And when this happens the backfire will be so much bigger than if they\\ 'd just admit now.\\n\\nIt\\ 's kind of stupid of Skynews to do this . But I read somewhere here that \ '' British arrogance know no bounds\ '' . And while I believe the vast majority of brits aren\\'t like this in the least , I must say there are a few individuals with some world-leading arrogance towards other nations on that small island of theirs , so I can\\'t say it surprises me . Just look at how this \ '' journalist\ '' treats the accusations against him with jokes , arrogance , and generally not giving a damn .",Romance,Romanian
Andrei_TV,europe,In one of them you can see how the economy has grown via the new buildings in the background : \\n [ 2009 ] ( http : //i.imgur.com/SERzcEZ.png ) to [ 2015 ] ( http : //i.imgur.com/jxlSFJi.jpg ),Romance,Romanian
Andrei_TV,europe,"\ '' Ah lads , why didn\\'t you ask ! ? Here\\ 's 20 billion if you do it tomorrow.\ ''",Romance,Romanian
Andrei_TV,europe,The BBC is working in strides to getting to that Daily Mail level of journalism . Very poorly researched article .,Romance,Romanian
Andrei_TV,europe,The lowest debt to GDP ratio Greece had in the past 25 years was 94 % in 1999 . Its debt stood at 129 % of GDP in 2009 . This is only for government debt .,Romance,Romanian
