AtheosWrath,europe,maybe I just like good teams ; ),Germanic,Norwegian
AtheosWrath,europe,To bad !,Germanic,Norwegian
AtheosWrath,europe,L\u00e6rdalstunnelen is the longest road tunnel in the world . 24.51 km\\n\\nSt . Gotthard was the longest at 16.918 km between 1980 and 2000.\\n\\nOf course the Gotthard rail tunnel is the longest tunnel in the world . But there are no cars going through that .,Germanic,Norwegian
AtheosWrath,europe,That lake looks like a balloon ...,Germanic,Norwegian
AtheosWrath,europe,And we are more rigorous with our tooth health /s,Germanic,Norwegian
AtheosWrath,europe,What did you give us in 2005 when it was our 100 year anniversary ?,Germanic,Norwegian
AtheosWrath,europe,"Democracy should never stand above corporations . Nations with governments elected by their people can\\'t stand behind a practice that will lead to corporativistic technocracy ! Vattenfall got back what they have invested plus ALL POTENTIAL PROFIT from their settlement with the German government . And what mechanism are there to stop exploiting this ? If I knew that all coal powerplants in the EU where to be closed down by the European Parliament and I invested alot of money days before , what mechanism would there be to stop me from suing all of the memberstates for 10x my investment because that is what I expected in return ? I\\ 'll tell you , there is non . And how come that most European countries that stayes outside the EU have less problem with a jobless workforce than the EU ? Because they don\\'t lay on their stomach with their asscheaks spread waiting to receive the \ '' big jobcreating corporations\ '' instead of trying to make an environment for independent startups . And the \ '' big jobcreating corporations\ '' don\\'t create jobs . They make more profit so they can pay out more in dividends , so they can attract more investors , so they have more money to take on an easy marked/country/trade agreement area .",Germanic,Norwegian
AtheosWrath,europe,Can you present proof that this agreement will boost the economy for most people ?,Germanic,Norwegian
AtheosWrath,AskEurope,like Jewish ?,Germanic,Norwegian
AtheosWrath,AskEurope,How is the Teutonic Order period viewed/taught in Estonian history ?,Germanic,Norwegian
AtheosWrath,europe,"Yes , There are some north swedish dialects that is supposedly easier for me to understand than it is for a person from Stockholm .",Germanic,Norwegian
AtheosWrath,europe,My attempt at humour only humoured me ... as usual.\\n\\nI had a professor once who said that the economy is like a wild animal and It needed rules AND freedom . Too much freedom and noone would know what was going on . Too many rules and the \ '' economy\ '' ( wild animal ) will go mad in frustration .,Germanic,Norwegian
AtheosWrath,europe,Not so in norther Europe .,Germanic,Norwegian
AtheosWrath,europe,As a northern norwegian myself ... tape up your fingers ! ( its the same as \ '' shut your mouth ! \ '',Germanic,Norwegian
AtheosWrath,europe,"Population density of US is 32,98 p. pr . sq.km.\\n\\nPopulation density of Norway is 15,6 p. pr . sq.km.\\n\\nPopulation density of Sweden is 22 p. pr . sq.km.\\n\\n [ saus ] ( https : //en.wikipedia.org/wiki/List_of_countries_and_territories_by_population_density )",Germanic,Norwegian
AtheosWrath,europe,& gt ; eating out abroad\\n\\nOr eating out [ a broad ] ( http : //www.urbandictionary.com/define.php ? term=broad ),Germanic,Norwegian
AtheosWrath,europe,Being Norwegian : Scotland\\n\\nEdit : moved a letter .,Germanic,Norwegian
AtheosWrath,europe,"What I mean is that she could not be on the party ballots , per party rules , and therefor the municipal election committee could set aside her nomination when both the party and herself requested it .",Germanic,Norwegian
AtheosWrath,europe,I was sure that Rimi was Norwegian .,Germanic,Norwegian
AtheosWrath,europe,Nationen is almost a purely agricultural paper .,Germanic,Norwegian
AtheosWrath,europe,National unions . We have only been our own country since 1905,Germanic,Norwegian
AtheosWrath,europe,If I remember correctly it was build by engineering students as a part of some exam or competition.\\n\\n,Germanic,Norwegian
AtheosWrath,europe,"Actually the tourism industry in Norway is heavily subsidized . We would have been better off without any tourism , and rather focusing the workforce on profitable production .",Germanic,Norwegian
AtheosWrath,europe,and money !,Germanic,Norwegian
AtheosWrath,europe,Time for some old fashion raids ...,Germanic,Norwegian
AtheosWrath,europe,Norwegian right wing ... Left side of the world and supporters Norwegian membership in the \ '' social-democratic project\ '' EU,Germanic,Norwegian
AtheosWrath,europe,He demanded a PS3 instead of a PS2,Germanic,Norwegian
AtheosWrath,europe,funfact : Nordland have the largest amount ( volume and area ) of planted trees in Norway .,Germanic,Norwegian
AtheosWrath,europe,Or 102 . Depends on how you look at it .,Germanic,Norwegian
AtheosWrath,europe,That is awesome !,Germanic,Norwegian
AtheosWrath,europe,The marked needs to be tied down instead of running wild .,Germanic,Norwegian
AtheosWrath,europe,Yeah . how much has the Portuguese borders actually moved through out history ?,Germanic,Norwegian
AtheosWrath,europe,Germany IS the HRE ...,Germanic,Norwegian
AtheosWrath,europe,Not even farms in Denmark was big enough .,Germanic,Norwegian
AtheosWrath,europe,Also Norway only adopt about 1/4 of legislation from EU .,Germanic,Norwegian
AtheosWrath,europe,How does 1/3019 Chinese work with you being Hungarian/Romanian/Late/Vampire ?,Germanic,Norwegian
AtheosWrath,europe,some federalist said something . Ingen her h\u00f8rer etter ! /s,Germanic,Norwegian
AtheosWrath,europe,Not given ! It was fair . split in the middle .,Germanic,Norwegian
AtheosWrath,europe,norway will certainly never join the european union .,Germanic,Norwegian
AtheosWrath,europe,N\u00e5ja ... Its an attempt to have the most trade-liberal tradelaws universal .,Germanic,Norwegian
AtheosWrath,europe,I sense an error in the conversion and a lack of /s,Germanic,Norwegian
AtheosWrath,europe,"the all time heat record in Norway is 35,6 ; but the same place has registered temperatures as low as -38 degrees.\\n\\nThe coldest place in Norway have registered -51,4 degrees .",Germanic,Norwegian
AtheosWrath,europe,"You mean Bohemia , right ?",Germanic,Norwegian
AtheosWrath,europe,"yes , you do get used to it . then you start to curse it !",Germanic,Norwegian
AtheosWrath,europe,Still they ( the netherlands ) have the higher \ '' peak\ '' : D,Germanic,Norwegian
AtheosWrath,europe,I think Alaska is 1/3 of US total area .,Germanic,Norwegian
AtheosWrath,europe,Actually we just discovered Vinland ! : D,Germanic,Norwegian
AtheosWrath,europe,"& gt ; \ '' deport everybody to their \\'original homeland\\'\ '' ? \\n\\nWell , he moved to France ...",Germanic,Norwegian
AtheosWrath,europe,It was directed at you EU citizen !,Germanic,Norwegian
AtheosWrath,europe,Yeah ... Walloon and Flanders should just split up already .,Germanic,Norwegian
AtheosWrath,europe,yeah ... some of us is Scandinavian ... \\n\\n\\nand unemployed .,Germanic,Norwegian
AtheosWrath,europe,"Well , If you have murdered abroad , or a broad .",Germanic,Norwegian
AtheosWrath,europe,Seems like it was the opposite in Norway at the time though .,Germanic,Norwegian
AtheosWrath,europe,"That took me three seconds longer than what is socially acceptable , to understand that joke .",Germanic,Norwegian
AtheosWrath,europe,Did you just include Switzerland in the EU ? they are not a member you know !,Germanic,Norwegian
AtheosWrath,europe,check out the homefield for [ Henningsv\u00e6r IL ] ( https : //i.ytimg.com/vi/EGRB8Zcw7SI/sddefault.jpg ),Germanic,Norwegian
AtheosWrath,europe,my view of WW2 ? fuck sweden .,Germanic,Norwegian
AtheosWrath,europe,yeah ... you are hillier,Germanic,Norwegian
AtheosWrath,AskEurope,"that is in america , right ?",Germanic,Norwegian
AtheosWrath,AskEurope,witch is in america .,Germanic,Norwegian
AtheosWrath,europe,more likely he had a G3 .,Germanic,Norwegian
AtheosWrath,europe,it will probably lead to more bureaucracy . and less government employees will mean that connection between people and the bureaucracy worsens .,Germanic,Norwegian
AtheosWrath,europe,it used to,Germanic,Norwegian
AtheosWrath,europe,"An actual FTFY because I was lazy , and my comment was filled with inaccuracies .",Germanic,Norwegian
AtheosWrath,europe,I think you could just claim it . No need for any military .,Germanic,Norwegian
AtheosWrath,europe,that is actually a shooting sport .,Germanic,Norwegian
AtheosWrath,europe,& gt ; These are statements by two people who are nationalist and anti-globalist\\n\\nwhat kind of fucking bullshit is that ! ?,Germanic,Norwegian
AtheosWrath,europe,It was a duchy under Russia .,Germanic,Norwegian
AtheosWrath,europe,From the flair I am guessing that you are either Swedish or Finnish .,Germanic,Norwegian
AtheosWrath,europe,"fish is now worth more than oil , and we have fish ...",Germanic,Norwegian
AtheosWrath,europe,A lot less .,Germanic,Norwegian
AtheosWrath,europe,Low currency and relatively cheaply produced export goods is a boost for the region .,Germanic,Norwegian
AtheosWrath,europe,Cross country skiing ? Colour me surprised !,Germanic,Norwegian
AtheosWrath,europe,As some one who lived in Oslo ... Oslo is a garbage city . even more so now .,Germanic,Norwegian
AtheosWrath,europe,It would be deserved .,Germanic,Norwegian
AtheosWrath,europe,The hometeam gets murdered every Sunday .,Germanic,Norwegian
AtheosWrath,europe,those poles on this road are like ten meters tall,Germanic,Norwegian
AtheosWrath,europe,so under that definition any county could be a country .,Germanic,Norwegian
AtheosWrath,europe,You would find more Sami flags in Oslo than in any other part of Norway .,Germanic,Norwegian
AtheosWrath,europe,"Erna , PM in Norway , wants Norway to join EU .",Germanic,Norwegian
AtheosWrath,europe,poles,Germanic,Norwegian
AverageHumanMan,europe,"Which is why you kill your wife as soon as she have produced an heir , and keep a couple of young maidens in backup at court .",Germanic,Norwegian
AxelTheViking,europe,The map recognises Crimea as russian ?,Germanic,Norwegian
AxelTheViking,europe,"Unlike us , you can comfort yourselves with actually not being cold .",Germanic,Norwegian
AxelTheViking,europe,"Maybe he is a pologist named Trum ? You know , the kind that specializes in the study of poles .",Germanic,Norwegian
AxelTheViking,europe,"Norway misunderstood the concept of \ '' special units\ '' , but they were damn close !",Germanic,Norwegian
AxelTheViking,europe,All the unhappy ones commited suicide,Germanic,Norwegian
AxelTheViking,europe,Just me who noticed \ '' nervous sheep\ '' in wales ? Shat myself a bit there,Germanic,Norwegian
AxelTheViking,europe,Get rid of state media they said . State media is propaganda they said ...,Germanic,Norwegian
AxelTheViking,europe,Where did sweden go ?,Germanic,Norwegian
AxelTheViking,europe,Did the grand piano say \ '' estonia\ '' ?,Germanic,Norwegian
AxelTheViking,europe,"As a norwegian , i would refer too denmark as a brother , sweden as a close cousin/kinda brother , and Finland as swedens cousin",Germanic,Norwegian
BJHanssen,europe,"London has bloody pop-up urinals installed in the pavement all over the place , ffs ...",Germanic,Norwegian
BJHanssen,europe,"Fun fact about troll stories : They are ( often/usually ) maps ! \\n\\nAlmost universally , the old stories about trolls that turn to stone are told/written such that they outline the relative locations of important landmarks ( especially mountains and fjords ) , particularly along the coastline . This was useful for sailors back in the day , who would know based on the stories ( approximately ) where they were .",Germanic,Norwegian
BJHanssen,europe,"& gt ; If one is Norwegian living in London , like me\\n\\nOh hey , another one ! \\n\\n & gt ; Oh , and our pension fund keeps buying up half of London.\\n\\n ... not like the rest of us can afford it .",Germanic,Norwegian
Bagatell,europe,"Interesting . Do most people in Poland know about every one of these \ '' figures\ '' ? If you posted something like that on an international page , a lot of people would probably choose \ '' star-man\ '' or \ '' Grandfather Frost\ '' just for prank .",Germanic,Norwegian
Balabaristas,AskEurope,"I\\ 'm not sure what you mean by \ '' dating\ '' , so it might help to clarify that.\\n\\nI met my long term boyfriend through a friend , who was his best friend . We exchanged contact details . Then we mostly texted and messaged awhile , before meeting up in a movie theatre/pub , getting a bit sloshed , and going home together . That\\ 's a date , right ? \\n\\nWe did other fun things that could be considered dates , both going out with friends and alone , on a regular basis . Eventually we decided to move countries together with just a backpack for a little adventure , and here we are 9 years later .",Germanic,Norwegian
Balabaristas,AskEurope,"It\\ 's apparently not totally weird in Korea , according to my childhood friend . But that\\ 's the only \ '' kinda normal\ '' vote so far .",Germanic,Norwegian
Balabaristas,AskEurope,"I think I\\ 've actually heard someone say this ( to an American ) before . It was based on the impression given by movies , that Americans regularly meet people they don\\'t know well for something like dinner and go through a somewhat formal process of dating with rules about what happens when and who pays for what . Maybe even do this with several people at a time , for the purpose of finding a romantic partner.\\n\\nIf that is \ '' dating\ '' , then no it doesn\\'t really happen here . Maybe more frequently since more people use online dating , but most I know use that for hookups and sometimes it turns into something more . But I\\ 'm guessing it\\ 's not really accurate for the US either .",Germanic,Norwegian
Balabaristas,AskEurope,"I lived in Troms\u00f8 for some years , where there is a fairly large Sami population . I\\ 'm far from an expert , I just have a little personal experience.\\n\\nSome still live kinda traditionally ( but often modernized , like using snowmobiles to herd reindeer ) . Many if not most are totally integrated . \\n\\nI had a party once and quite a few Sami were there ( classmates of my flatmate , it was her birthday ) . A Norwegian guy made the mistake of asking a girl if she was \ '' real\ '' Sami . He meant to ask if she lived a more traditional lifestyle or in the cities . But it\\ 's a very sensitive issue because Sami were forcefully assimilated in the past . Many lost parts of their culture and even the ability to speak the language.\\n\\nIt turned into the worst party ever , with lots of angry shouting and crying and throwing things . \\n\\nOther than that incident , I usually didn\\'t know someone was Sami ( like my doctor ) until it came up incidentally.\\n\\nI did my bachelor\\ 's there in the medical faculty at the university , and we had some traditional Sami medicine integrated with a few classes . It was really interesting.\\n\\nAs far as drinking goes , it\\ 's a place with 8 months shitty weather and 2 months without sun . Everyone drinks a little too much .",Germanic,Norwegian
Balabaristas,AskEurope,"I have red and black currant bushes and raspberries and wild strawberries growing in my garden . I also plant lots of vegetables and herbs in pots , and have various chilies growing inside.\\n\\nI grew everything mostly indoors when I lived in the Arctic , and it actually worked pretty well.\\n\\nBut lots of people I know in the US grow their own vegetables too .",Germanic,Norwegian
Balabaristas,AskEurope,I took five years of Latin and apparently recite The Aeneid in my sleep . It used to scare one of my flatmates.\\n\\nI am nowhere near \ '' fluent\ '' ( whatever that means for Latin ) and require a dictionary to do serious translation . It has however helped with other languages and my biomed background .,Germanic,Norwegian
Balabaristas,AskEurope,"I was waiting at a bus stop , but the woman was a complete stranger . I live in a city of 100k+ . I thought it was very strange , but I was mostly surprised and confused .",Germanic,Norwegian
Balder666,europe,Feet is the standard when it comes to aviation . China and Russia usually use meters instead .,Germanic,Norwegian
BananaQwop,europe,You sure sounds like a pleasant person to be around .,Germanic,Norwegian
Batbuckleyourpants,europe,No wonder the Russians turned around and went home O_o,Germanic,Norwegian
Batbuckleyourpants,europe,[ Turns out turtles are real fucking fast when they want to be . ] ( https : //www.youtube.com/watch ? v=hyUmGHdK9e8 ),Germanic,Norwegian
Batbuckleyourpants,europe,French Guiana was never colonized or controlled by Europe ? what ? \\n,Germanic,Norwegian
Batbuckleyourpants,europe,My bad .,Germanic,Norwegian
Batbuckleyourpants,europe,They will probably blame the poor again .,Germanic,Norwegian
Batbuckleyourpants,europe,"Conquering Finland would be one thing , but how the fuck would you hold it ?",Germanic,Norwegian
Batbuckleyourpants,europe,Throw cinnamon on the ground and force them to sweep it up .,Germanic,Norwegian
Batbuckleyourpants,europe,And you dont pay toll .,Germanic,Norwegian
Batbuckleyourpants,europe,Make Neptun pay for it !,Germanic,Norwegian
Batbuckleyourpants,europe,even they dont work for free .,Germanic,Norwegian
Batbuckleyourpants,europe,"As a Norwegian who visits Denmark frequently , i get the same feeling . Denmark is literally made up from what the ice ages scraped off our mountains.\\n\\nHad never even seen a sand beach before visiting Denmark , Denmark is pretty much all sand . with their highest \ '' mountain\ '' , half the height of my Sunday walks .",Germanic,Norwegian
Batbuckleyourpants,europe,"Exactly , we cant risk tigers crossing our borders freely !",Germanic,Norwegian
Batbuckleyourpants,europe,"Speaking as a Norwegian . despite being \ '' connected\ '' , apart from Meth it has gotten harder to get anything good . most of my friends ( me included ) gave up on even trying to score decent Ecstasy , and went over to the WAY easier to get Meth , fucked up in all kinds of ways.\\n\\nAnd while Meth is cheaper , everything else is more expensive than it was 10 years ago . fuck if i know why .",Germanic,Norwegian
Batbuckleyourpants,europe,We have a history of banning movies for stupid reasons . We banned E.T because it portrayed adults as the bad guys .,Germanic,Norwegian
Batbuckleyourpants,europe,"Im a gay dude , with a Brazilian half-sister . so get out of your sad little echo chamber , and stop listening to what CNN tell you Trump supporters looks like . \\n\\nInstead of arguing my point , or refuting the article i linked you to , you went into my comment history , desperately looking for some way to attack my character instead.\\n\\nPeople like **YOU** are the cancer of this sub .",Germanic,Norwegian
Batbuckleyourpants,europe,"Sure . got a few favorites . \\n\\nhow do you sink a Swedish submarine ? swim down and knock on the hatch.\\nHow do you sink a Norwegian Submarine ? use a Swedish crew.\\n\\nwhy did the swede carry a car door through the desert ? if he got hot , he could just roll down a window.\\n\\nA popular Swedish party game : One Swede enter a box , while the rest take turns guessing which one of them it is.\\n\\nWhat is the difference between Swedes and Norwegians ? The Swedes have great neighbors.\\n\\nWhy do Swedes never play hide and seek ? Nobody ever bother looking for them.\\n\\nWhat is the Swedish word for genius ? Tourist",Germanic,Norwegian
Batbuckleyourpants,europe,"Obviously the hacker used a massive keyboard , so that even more people could use it at the same time .",Germanic,Norwegian
Batbuckleyourpants,europe,[ You really cant . ] ( http : //storage.ubertor.com/caulfeildgalleryca.myubertor.com/content/image/421.jpg ),Germanic,Norwegian
Batbuckleyourpants,europe,using what money ? !,Germanic,Norwegian
Batbuckleyourpants,europe,"A man with an axe could simply be a lumberjack . but when he puts on a trillion dollar suit of armor , get more and more axes , and starts pacing right outside your door while staring at you through the window , that is enough to make anyone do stupid thing",Germanic,Norwegian
Batbuckleyourpants,europe,*The swiss be like* . \ '' What the fuck are you guys doing ? \ '',Germanic,Norwegian
Batbuckleyourpants,europe,"They are more worried that the ban would be anti-Semitic , than that circumcision itself is anti-child .",Germanic,Norwegian
Batbuckleyourpants,europe,"I live in Bergen . i used to do tours for tourists a few years ago , every sommer i had at least one pair of Chineese/Japaneese tourists asking where the Polar bears were .",Germanic,Norwegian
Batbuckleyourpants,europe,"In my experience , If you are within earshot of a finn , you are already annoying him .",Germanic,Norwegian
Batbuckleyourpants,europe,Nobody want to cross the ocean during storm season or during the winter .,Germanic,Norwegian
Batbuckleyourpants,europe,Yeah ... no way this will be abused .,Germanic,Norwegian
Batbuckleyourpants,europe,"So is Abdul Qadeer Khan . who studied in Europe , then stole European nuclear secrets , and helped Pakistan get nukes .",Germanic,Norwegian
Batbuckleyourpants,europe,"*\ '' Last year , 850,000 migrants arrived in Greece . Under the Dublin accords it is Greece that should have taken them in , \ '' *\\t\\n\\nthe fact that that would leave Greece with only 50 % of its population Greek in 10 years should set off all kinds of red flags ... \\n\\n",Germanic,Norwegian
Batbuckleyourpants,europe,"They are using the German army as the framework for an integrated EU army , They are calling it the \ '' Framework Nations Concept\ '' \\n\\nJust read the link .",Germanic,Norwegian
Batbuckleyourpants,europe,"If the end result is the entire EU joining the German army , or starting an EU army from scratch.. the end result is the same . a unified EU army , regardless how how they got it . \\n\\nJust last month the EU voted yes on a [ European Union Joint military headquarters . ] ( http : //www.dw.com/en/eu-approves-joint-military-headquarters/a-37830963 ) \\n\\nSaying the EU is not building an army is just ignoring the facts .",Germanic,Norwegian
Batbuckleyourpants,europe,I know a million Swedish jokes . \\n\\n\ '' How do you sink a Swedish ship ? you [ Put it on water ] ( https : //viewfromanopenrectorywindow.files.wordpress.com/2015/08/vasa-sinking-howat.jpg ) \ '',Germanic,Norwegian
Batbuckleyourpants,europe,"[ The whole method is deeply flawed , and make a huge number of assumptions . ] ( http : //www.chronicle.com/article/Can-We-Really-Measure-Implicit/238807 ) \\n\\nAnd considering the researchers work as paid consultants in legal cases involving discrimination and implicit bias , they are not impartial observers.\\n\\nThe study also makes assumptions that they cant back up . for instance , is it really racism ? or just a reaction to the fact that Black faces due to an optical illusion appear to be far more angular than they really are , features associated with aggressiveness , even in white people.\\n\\nThey did not do a control sample with white men with faces that would have been perceived as having very angular features .",Germanic,Norwegian
Batbuckleyourpants,europe,"Im saying they are setting up an European Army , i never said anyone was forcing anything . \\n\\nThe powers that be in the EU parlament , very much want a unified Army , and they are getting one .",Germanic,Norwegian
Batbuckleyourpants,europe,Italy should be available to both sides .,Germanic,Norwegian
Batbuckleyourpants,europe,"And Norway , that half hour is almost certainly the moment all year NRK has the highest viewer ratings . \\n\\nChristmas would not be the same without gathering in front of the TV and watching it . Every Christmas for almost 30 years now . i guess you could say it is the same procedure as every year .",Germanic,Norwegian
Batbuckleyourpants,europe,And ~~USA~~ Non-EU nations already surpassed EU as the largest trade partners to GB a few years ago.\\n\\nEdit : correction .,Germanic,Norwegian
Batbuckleyourpants,europe,"Agreed , the Danes are lovely people . \\n\\ni do have questions about Crimea though ...",Germanic,Norwegian
Batbuckleyourpants,europe,Russia 1 % ? something about that number seems off .,Germanic,Norwegian
Batbuckleyourpants,europe,Crimea seems to have made a pretty sweet trade too .,Germanic,Norwegian
Batbuckleyourpants,europe,"They did , but turns out muslims do it , so now a ban is racist and defended by people on both sides",Germanic,Norwegian
Batbuckleyourpants,europe,Female privilege beats racism .,Germanic,Norwegian
Batbuckleyourpants,europe,Beating children was an important tenant in most christian branches too .,Germanic,Norwegian
Batbuckleyourpants,europe,"i mean , yeah ... the romani are leaving the country .",Germanic,Norwegian
Bilboburger,europe,The only time we will be high is when pootin blows us way up high in the air with his bombs .,Germanic,Norwegian
Bilboburger,europe,A gram is usually 0.1 where i live . Too bad that when the pootin famine comes a gram will just be 0.01 ! ! ! ! Educate yourself,Germanic,Norwegian
Bilboburger,europe,You are circlejerking too hard for me brother .,Germanic,Norwegian
Bilboburger,europe,"haha , well said : )",Germanic,Norwegian
Bilboburger,europe,You freak,Germanic,Norwegian
Bilboburger,europe,i rarely see that guy get downvotes . its a lot more common to see surrender jokes being made than seeing people make fun of the people making surrender jokes ...,Germanic,Norwegian
