dmanww,europe,"After looking at those , open platforms look downright 19th century . Would probably keep the stations much cleaner",Germanic,English
dmanww,europe,Will be easier once there is more external pressure . By then it will be a tougher fight .,Germanic,English
dmanww,europe,No the other one . The one with the theses and a hammer,Germanic,English
dmanww,europe,USE ! USE !,Germanic,English
dmanww,europe,Sweden says just the tip,Germanic,English
dmanww,europe,An economic threat would probably mean it happens slower and more orderly . Maybe it will end up something like Switzerland with fairly independent regions .,Germanic,English
dmanww,europe,my questions is how did they expect a monetary union to work without fiscal controls .,Germanic,English
dmanww,europe,Now compare this with English language skills,Germanic,English
dmanww,europe,It is in ca,Germanic,English
dmanww,europe,Russians and useful idiots,Germanic,English
dmanww,europe,"Yes it is different and I hope people have learned some lessons . For example , during the Cuban missile crisis Kennedy was specifically concerned about mobilization being seen as an aggressive rather than cautionary action . \\n\\nThat being said , I would still worry about things running out of control by accident .",Germanic,English
dmanww,europe,"Besides , the Olympics are over",Germanic,English
dmanww,europe,They said that before WW1 too . \\n\\nWill provide a source when I get home .,Germanic,English
dmanww,europe,"& gt ; That means people could live in one and commute into other for work daily , if necessary\\n\\nSo like the \u00d8resund Bridge ?",Germanic,English
dmanww,europe,They look like little piles of poop,Germanic,English
dmanww,europe,so which of these things did these women not follow ?,Germanic,English
dmanww,europe,I was thinking of the [ LA prison ] ( http : //media.npr.org/assets/img/2013/09/15/twin_towers_wide-628b60a6d9d215b28bc7111613ad9431d0db601b-s900-c85.jpg ),Germanic,English
dmanww,europe,An opportunity to test the weapons and tactics used in WW2,Germanic,English
dmanww,europe,Didn\\'t Erdogan himself say he was going to \ '' cleanse\ '' the military\\n\\n,Germanic,English
dmanww,europe,I should do one for me too . We even have an aldi here .,Germanic,English
dmanww,europe,Looks like a prison,Germanic,English
dmanww,europe,"I see a lot of theories that the US was behind this . But why not Putin , would make much more sense .",Germanic,English
dmanww,europe,It was worse than poorly planned . They misread public opinion.\\n\\nBut it sounded like there were going to be more purges of the military so they probably figured it was now or never .,Germanic,English
dmanww,europe,Tanks shooting at parliament building in Ankara ? \\n\\nhttps : //twitter.com/RikarHussein/status/754083561351815168\\n,Germanic,English
dmanww,europe,Fighting teeth,Germanic,English
dmanww,europe,Are you guys OK with it touching the ground ?,Germanic,English
dmanww,europe,Can someone remind me which country was trying to liberate Germany in 44 rather than trying to stop a government from continuing military action . \\n\\n,Germanic,English
dmanww,europe,"You bet , they stink",Germanic,English
dmanww,europe,"( I am not sure ) = \\n\\nGood that you remembered . \\nI ironed the Kitel ( uniform jacket ) , medals are with me\\n\\n",Germanic,English
dmanww,europe,Those have had a slightly more strained relationship with Russia in the last couple years,Germanic,English
dmanww,europe,Now there was an [ explosion near Stockholm ] ( http : //m.theage.com.au/world/blast-hits-turkish-building-in-sweden-20160217-gmx1dp.html ) next to a Turkish social centre,Germanic,English
dmanww,europe,The one about \ '' Maultaschen\ '' is my favorite story . I\\ 'm also craving some right now and I\\ 'm nowhere near Germany . Damn .,Germanic,English
dmanww,europe,Thanks . That explains it much better,Germanic,English
dmanww,europe,In the US the president is Commander in Chief . This is to keep the military subservient to the civilian government .,Germanic,English
dmanww,europe,Anyone in addition to the armed security guard ?,Germanic,English
dmanww,europe,but they did pay off all their foreign loans,Germanic,English
dmanww,europe,cakes in assortment ?,Germanic,English
dmanww,europe,I saw that photoset . Did the fifth ring never open ?,Germanic,English
dmanww,europe,The autopilot was set to 30m,Germanic,English
dmanww,europe,No but the options were basically independence from ukr or joining with rus,Germanic,English
dmanww,europe,Sounds like the current situation,Germanic,English
dmanww,europe,added to wishlist . Thanks\\n\\n,Germanic,English
dmanww,europe,"You joke , but there is a region of Estiona in the north east that is majority Russian . It think there were also some citizenship issues there .",Germanic,English
dmanww,europe,Repost to /r/autos ?,Germanic,English
dmanww,europe,"[ US House of Representatives ] ( http : //historycms.house.gov/assets/15032423351.asset ) \\n\\nI think they were added in 1951 , but someone could correct me .",Germanic,English
dmanww,europe,[ Eastern European Man School ] ( http : //www.youtube.com/watch ? v=5Uzu58N-Sso ),Germanic,English
dmanww,europe,no swamp germans ?,Germanic,English
dmanww,europe,G\u00f6tze ripped it wide open,Germanic,English
dmanww,europe,[ here you go ] ( http : //thumbs.dreamstime.com/z/crayon-sun-burst-light-airy-fun-hand-drawn-star-characteristics-30748734.jpg ),Germanic,English
dmanww,europe,Swords into plowshares and back .,Germanic,English
dmanww,europe,Interesting . Thanks .,Germanic,English
dmanww,europe,Done and done .,Germanic,English
dmanww,europe,"Getting rid of your citizenship is indeed quite difficult . [ A ] ( http : //www.zerohedge.com/news/2014-01-10/guest-post-how-i-renounced-my-us-citizenship-and-why-part-1 ) [ B ] ( http : //www.emirates247.com/news/i-accidentally-became-a-us-citizen-and- can not -get-rid-of-the-passport-2013-11-23-1.528931 ) \\n\\nUS does not recognize dual-citizenship . If you get US citizenship , you have to renounce all other citizenships . You can get them back if the other country allows it . \\n\\nAll US citizens need to file a tax return , you may not need to pay anything , but you still have to file.\\n\\nSome countries have double-taxation agreements , which credit the tax paid in your country of residence.\\n",Germanic,English
dmanww,europe,The Germans are obviously still watching the game .,Germanic,English
dmanww,europe,"I was born in Russia and came to the US as a kid in the 80s . I now have US citizenship but this is one of the reasons I\\ 'm hesitant to go back.\\n\\n\ '' Hi there , congratulations you now have your Russian citizenship back , aren\\'t you glad . Did we mention we have conscription . Good luck\ ''",Germanic,English
dmanww,europe,Will the oil info affect the independence voting ?,Germanic,English
dmanww,europe,This just reminded me of [ Funk Overload ] ( https : //www.youtube.com/watch ? v=13sxFHM6Mjg & amp ; feature=kp ),Germanic,English
dmanww,europe,"Because the implication is that they were run by the Polish , rather than calling them Nazi death camps ( in Poland ) . \\n\\n",Germanic,English
dmanww,europe,Been done before,Germanic,English
dmanww,europe,Interesting . My grandfather fought there .,Germanic,English
dmanww,europe,Are you Finnish ?,Germanic,English
dmanww,europe,I just realized if Hillary gets elected the puns will be unending,Germanic,English
dmanww,europe,yep . Total population of NZ is about 4.5M ( about half of London ) . Land area about 10 % more than UK .,Germanic,English
dmanww,europe,"Some of these can get you a mean look , and some will start a war .",Germanic,English
dmanww,europe,I got Australia in the pool at work . Oh well still get $ 10 if they come in dead last .,Germanic,English
dmanww,europe,"You kid , but Georgia happened during the Olympics opening ceremony .",Germanic,English
dmanww,europe,Have you seen Melinda Gates ?,Germanic,English
dmanww,europe,Wellington to Blenheim . avrerage abuot 130m deep,Germanic,English
dmanww,europe,Every time something like this comes out I wonder how much they believe their own talking points .,Germanic,English
dmanww,europe,"There is also a matter of scale\\n\\nFrance is aprox 65mil people , Netherlands is 17mil\\n\\n [ map of where they came from ] ( https : //twitter.com/JustHovensGreve/status/491280878036078593/photo/1 )",Germanic,English
dmanww,europe,Make way ! Science coming though .,Germanic,English
dmanww,europe,Was that the missing one ?,Germanic,English
dmanww,europe,So it has to be an Italian Peter ?,Germanic,English
dmanww,europe,You would need to spend about 18 % of your GDP to match Russian spending . Which would be the second highest percentage in the world .,Germanic,English
dmanww,europe,"You could say the same thing about Australia or any country that has been settled by immigrants relatively recently . \\n\\nDefining nations is a touchy subject . But I wanted to make the point that a nation =/= country . \\n\\nIn general , a nation-state would encompass a majority population , but you will likely still have pockets of other identities . In the end , you might need a conflict to unify a country into a single identity . \\n\\nUS had it with the US Revolutionary War and War of 1812 to separate from the UK . Even then , after the British withdrew following the revolution , there were many loyalists who moved to Canada , which was still British .",Germanic,English
dmanww,europe,This is being stage managed by Russia . I see these kind of statements as a sign that Putin might ease off the pressure and will try to find another way to get control of UKR without outright invasion .,Germanic,English
dmanww,europe,I wonder if people can id most of them . The pistol with the stock is a [ VP70 ] ( https : //en.wikipedia.org/wiki/Heckler_ % 26_Koch_VP70 ) . The first polymer-framed pistol,Germanic,English
dmanww,europe,I wonder if it\\ 's something about foreign rules . I think US companies had something similar . Under \ '' camel rental\ '',Germanic,English
dmanww,europe,Damn this guy is pretty interesting,Germanic,English
dmanww,europe,"But hey , he played off the national debt .",Germanic,English
dmanww,europe,I guess it makes it easier to interpret in 100 years .,Germanic,English
dmanww,europe,This should be in /r/trainporn,Germanic,English
dmanww,europe,How is this so far down,Germanic,English
dmanww,europe,If he stops at crime people will forget in about 2 years and more or less go back to normal .,Germanic,English
dmanww,europe,More like computer science,Germanic,English
dmanww,europe,Do you think it was wrong that they joined the euro ?,Germanic,English
dmanww,europe,"[ here you go then ] ( http : //www.youtube.com/watch ? v=JnUaUXZrYb0 ) \\n\\nbtw , that video was better .",Germanic,English
dmanww,europe,NZ checking in . French spies are idiots,Germanic,English
dmanww,europe,where else would the casualties from ~~Kuwait~~ ~~Iraq~~ Afghanistan go through ?,Germanic,English
dmanww,europe,Was there something about canceling the Poland celebration in Russia ? Is it a big deal ?,Germanic,English
dmanww,europe,This would look quite nice printed,Germanic,English
dmanww,europe,Thugs just need some form of authority to hide behind .,Germanic,English
dmanww,europe,Some tools are themselves bad ( flechettes ) or are prone to being abused ( mines ),Germanic,English
dmanww,europe,also the amount of money it would cost to property care for nuclear weapons .,Germanic,English
dmanww,europe,Uncle Adolf would [ disagree ] ( http : //en.m.wikipedia.org/wiki/Big_lie ),Germanic,English
dmanww,europe,Every time I thing federal Europe might work I remember that even Belgium can barely keep itself together .,Germanic,English
dmanww,europe,Damn you lactose tolerant freak,Germanic,English
dmanww,europe,"& gt ; its differentiating features amplified to the max ( because America ) \\n\\nIt\\ 's say this is more of a feature of large expat communities , not necessarily that they are in the US.\\n\\nThey tend to idealize the \ '' old country\ '' and resist anything that diverges from the ideal . Meanwhile , their country of origin continues to change naturally .",Germanic,English
dmanww,europe,Well obviously . But it seems to show the calculus has changed .,Germanic,English
dmanww,europe,Same kind of people are attracted to it .,Germanic,English
dmanww,europe,And neo-soviet too,Germanic,English
enZedd,europe,I was reading these all the way down in little old New Zealand .,Germanic,English
freethenip,europe,"when my sister went on a student exchange to germany , her host family tried to show her the national anthem on youtube upon her arrival.\\n\\nthey accidentally clicked on the nazi one and just sat there watching it in horrified silence .",Germanic,English
freethenip,AskEurope,"i will ! thank you : ^ ) germany is pretty tight on dual citizenship and iirc only allows you to have the one passport , but otherwise i totally would !",Germanic,English
freethenip,AskEurope,tbh i only really spoke it before starting school so i have the vocabulary of a five year old and only ever speak a horrendous english-polish hybrid with my mum ahah : \ '' - ) \\n\\nthank you ! i will keep it in mind next time some kurwa is getting on my ( gay ) nerves .,Germanic,English
freethenip,AskEurope,"i find this hilarious tbh\\n\\nis it based off birth , or currently held passport ?",Germanic,English
freethenip,AskEurope,i met an american here on the tram ! he was loudly telling his entire life story and political views to some old woman who obviously had no idea what he was saying . it was great entertainment .,Germanic,English
freethenip,AskEurope,[ this is my dog i love her ] ( http : //imgur.com/TDOeQoe ),Germanic,English
freethenip,AskEurope,"polish was my first language , but german tbh ' } \n ''",Germanic,English
freethenip,europe,i mean ok but it did lmao,Germanic,English
freethenip,AskEurope,"my pal is a 10 minute walk away from denmark , and another the same distance to the netherlands !",Germanic,English
freethenip,AskEurope,"i\\ 've always dreamt of going to austria ! i finally got to go the other week and pretty much cried -- i\\ 'm planning on doing my masters in wien in the future , if not volunteer work.\\n\\nlots of people compare it to germany but i find it\\ 's a lot more beautiful/less industrial , and that the people are kinder and more relaxed . i was surprised at how unique and *weird* it was , but in a good way . i thought it would just feel like an extension of bavaria tbh but it\\ 's not like anywhere i\\ 've ever been before . i\\ 'd actually compare it more to southern poland , where it\\ 's more religious/old fashioned/traditional with weird as fuck folklore ( but that\\ 's also why i liked it so much ; it felt homely ) .\\n\\nimo it\\ 's kind of like the canada to the usa , or new zealand to australia . they even have the same stereotypes of being the \ '' nice\ '' version , with friendlier people and amazing nature . tl ; dr it was way less german and more individual than i expected ( even got a little culture shock there tbh ) i love it sm",Germanic,English
freethenip,AskEurope,"pretty much all we\\ 've done in school for the last few days ( germany ) is talk about the pros/cons of both hillary and trump . but we\\ 've always talked about how dumb americans are so i don\\'t know if it\\ 's that big of a change , more like \ '' crikey dick the mad lads actually did it\ ''",Germanic,English
freethenip,AskEurope,& gt ; and history is in the past,Germanic,English
freethenip,AskEurope,this is in poland too ! ! ! although nowadays my family just wake each other up at absurd hours in the morning by throwing cold water at one another,Germanic,English
freethenip,europe,"this is what came to my mind too , despite desperately trying to repress all flashbacks to the weaboo days.\\n\\n*MARUKAITE CHIKYUU INTENSIFIES*",Germanic,English
freethenip,europe,what the fuck this is amazing \\n\\ni suddenly love being european,Germanic,English
freethenip,AskEurope,"lots of americans also utilise it as a kind of fashion accessory , which can piss some people off when they hear that their entire beautiful cultural traditions/language has been compressed into little more than a label . i don\\'t really care tbh but i know many people who think being european makes them \ '' quirky\ '' or more interesting , while it really doesn\\'t . like , how boring do you have to find yourself to do that ?",Germanic,English
freethenip,europe,"i was there last christmas and witnessed a sweet old babcia pick one out from a huge tarpaulin tank in the middle of the supermarket , grab a knife from the counter , and whallop its writhing head off right there and then",Germanic,English
freethenip,europe,"i was in zakopane last year , staying in a little traditional wooden house in the snow ! it honestly felt like narnia ( only more magical ) .",Germanic,English
insangu,europe,Wrong on all accounts .,Germanic,English
insangu,europe,You guys sound a lot like Serbia . The whole political landscape is dominated by foreign embassies and political scandals . Not to mention corruption.\\n\\n,Germanic,English
insangu,europe,Came where ? What is that ?,Germanic,English
insangu,europe,Thanks for the info !,Germanic,English
insangu,europe,"Serbia has 78,000 registered so far , all waiting in line for some Kebab removal.\\n\\nBut seriously , these people should be shipped to Murica , and western Europe , as it is they who caused them to flee their countries . At the very least , they should provide all logistical/monetary assistance to transit countries who are already poor as fuck.\\n",Germanic,English
insangu,europe,"My point is that without western ( US/NATO ) intervention in Afghanistan , Iraq , Libya , Syria , and general US foreign policy , poor Balkan countries ( and Europe ) wouldn\\'t be in this predicament . And you can keep your \ '' staunch Franco-German opposition\ '' , as if a bunch of twats acting all moral is an argument .",Germanic,English
kagepro,europe,Hesse just fucked up my EU4 game it gets a 0/10 reputation from me .,Germanic,English
kingcropercake,europe,Not always,Germanic,English
mitrepl,AskEurope,humans are animals,Germanic,English
mmminogue,europe,"It\\ 's really only the Golden Dawn in Greece that any of those parties can point to and say , \ '' well we aren\\'t THAT bad\ '' . Like , y\\'know , the explicitly Neo-Nazi one .",Germanic,English
mmminogue,europe,Your methodology is flawed anyway because it ignores the large numbers of undecided voters in all of those polls ( sometimes around 10-20 % ) that should have made it clear to everyone that neither Leave nor Remain was a sealed deal .,Germanic,English
mmminogue,europe,Does this speak highly of Kenny or just lowly of Irish Taoisigh in general ?,Germanic,English
mmminogue,europe,Ednalloh even looks Hebrew . He could so get away with it .,Germanic,English
mmminogue,europe,"A vote for the Conservatives is a vote to strengthen her hand , remember .",Germanic,English
mmminogue,europe,"As said above , the only real serious polling error in recent history was the UK election in 2015 that predicted a hung parliament . Neither Brexit nor Trump polls were wrong , people just don\\'t know how to interpret them , or they were sticking their fingers in their ears and going \ '' la la la , historical precedent\ '' .",Germanic,English
mmminogue,europe,"You could pretty comfortably add New Zealand and maybe Ireland to that , I think",Germanic,English
mmminogue,europe,The old setup used to have loveseats . http : //www.radionz.co.nz/assets/news/105512/eight_col_9_august_1989_retiring_pm_lange_credit-Nat-Lib.jpg ? 1491447782,Germanic,English
mmminogue,europe,"Idk , is the Golden Dawn still popular in Greece ? I remember they were one of the most overtly Nazi-esque far-right parties in Europe .",Germanic,English
moffattron9000,europe,"No , they still make those in China/Vietnam/Bangladesh .",Germanic,English
moffattron9000,europe,You would hate New Zealand .,Germanic,English
moffattron9000,europe,"Well to be fair , better transit links are one of the best things that nations can do to improve an economy , as it makes transporting goods far easier . This in turn allows for more remote areas to better contribute to the overall economy .",Germanic,English
moffattron9000,europe,You assume that he can pass a piece of legislation in the first place .,Germanic,English
moffattron9000,europe,"Knowing how John Podesta made rice risotto was critical information , thank you very much . So was him talking with the guy from Blink 182 about aliens .",Germanic,English
monoptiex,europe,"For me , Luxembourg was my favourite and then Poland .",Germanic,English
movienevermade,europe,"You guys , I think we just figured out how to bring peace to the Middle East !",Germanic,English
movienevermade,europe,"When do we get in on the action ? We could be antipodean bros and show those upside-downers a thing or two about how to be middle of the road . We could even bring Lorde and Stan Walker , and then *never let them back in* .",Germanic,English
movienevermade,europe,"The main exception to all this is Wellington \u2013 the weather is really crazy there because all of the wind from the South ( i.e . Antarctica ) gets funnelled through the straight between the two main islands , as most of the rest of the country is basically just one big mountain range . \\n\\nIn midsummer , it\\ 's like a temperate version of Hawaii with natural air conditioning . In the depths of winter , it doesn\\'t snow but the gale-force wind chill often turns it into a frosty hellscape . \\n\\nGuess which version ends up in all of the tourist photos ... \\n\\nOh and btw for all you Europeans out there thinking of moving to NZ , central heating is considered a rare luxury here and most of the houses are wooden and ancient . Not an ideal combo in winter.\\n\\nedit : It\\ 's been very amusing watching people in the comments who\\ 've never been here tell me that I don\\'t know what the climate is like in my own country . If you think that Auckland is as cold as London , or that New Zealand is a \ '' tropical\ '' country like Fiji ... just , no . You do not know enough about NZ to be lecturing me about the weather .",Germanic,English
movienevermade,europe,"Lolno . [ You know we have glaciers , right ] ( https : //www.google.co.nz/search ? q=franz+josef+glaciers & amp ; rlz=1C5CHFA_enNZ744NZ744 & amp ; source=lnms & amp ; tbm=isch & amp ; sa=X & amp ; ved=0ahUKEwiPh5mYkOvUAhVEgrwKHZ9JBdYQ_AUIBigB & amp ; biw=1680 & amp ; bih=949 # tbm=isch & amp ; q=franz+josef+glacier ) ? The climate ranges from subtropical at best in the north to cold oceanic in the south . Even in Wellington [ the average low temperature in winter is well below 10C ] ( https : //en.wikipedia.org/wiki/Wellington # Climate ) and , combined with wind chill , can go below zero .",Germanic,English
movienevermade,europe,"Bear in mind that there are basically no European-style buildings in New Zealand that were built prior to the 1830s . Context is everything.\\n\\nIn this context , \ '' ancient\ '' is clearly a bit hyperbolic , but essentially refers to wooden colonial houses built in the late 19th/early 20th century that would horrify a lot of Europeans who are used to central heating , due to the fact that they often lack basic insulation , may have plants growing through the walls , and generally rely on old fireplaces or shitty little electric oil heaters that can only realistically heat one room of a house and , especially in the case of young people , are only rarely turned on due to high electricity bills .",Germanic,English
movienevermade,europe,"New Zealand\\ 's postal service suffers from the low population density relative to Europe and it has not coped well with privatisation ( like most things that the state used to run before we decided to go down the path of Rogernomics AKA \ '' Thatcherism on crack\ '' ) and declining use due to the internet . Still , eat your heart out Slovenia !",Germanic,English
movienevermade,europe,"I disagree . Most of my family originally migrated from the UK and France many generations ago , and even the far South of England is pretty freezing compared to most of New Zealand north of about Kaikoura . The temperate subtropical climate of most of South Polynesia is hardly comparable to the UK .",Germanic,English
movienevermade,europe,"Yeah but Auckland and most of the North Island is way closer climate- and temperature-wise to say , Provence than it is to pretty much anywhere in the UK .",Germanic,English
movienevermade,europe,"& gt ; On the Plus side , you can now do the cross bridge challenge which was impossible before\\n\\n [ TIL ] ( https : //en.wikipedia.org/wiki/Seven_Bridges_of_K % C3 % B6nigsberg ) .",Germanic,English
mrzacharyjensen,europe,"Ah so now you pesky Aussies are trying to claim Nikora Tehekoa as your own , as well as everything else from New Zealand ?",Germanic,English
my_home,europe,"You need to differentiate between Spiegel online ( SPON ) and der Spiegel . They are both sitting in the same building , but only few articles from der Spiegel magazine are being published on SPON . They are two different offices with a different audience . And that is totally fine .",Germanic,English
my_home,AskEurope,Probably an old VW Golf,Germanic,English
my_home,europe,"No . It was a thing in southern Germany to differ the gender while using the word two . \ '' zwo\ '' was for the feminine usage . Later on it was used for better understanding , which obviously ceased now due to better devices , but it is still in use in southern German dialect ( but generally )",Germanic,English
my_home,europe,Wrong millenium mate,Germanic,English
my_home,europe,"true true , but we also say \ '' fuffzehn\ '' ( 15 ) instead of \ '' f\u00fcnfzehn\ ''",Germanic,English
