BastiWM,europe,True ! One of my favourite sayings .,Romance,Romanian
BastiWM,europe,"And because Romanian muslims are more sensible , they just dug up the pigs and re-sanctified the ground .",Romance,Romanian
BastiWM,europe,Romania day in the EU Parliament . Sarmale for everyone !,Romance,Romanian
BastiWM,europe,How dare he have that portrait behind him ?,Romance,Romanian
BastiWM,europe,The lengths they went to in order to save some crummy blocks of flats ... whilst demolishing the old city centre of Bucharest ( and other cities ) .\\n\\nBoggles the mind .,Romance,Romanian
BastiWM,europe,He finally says something sensible . Took him a while .,Romance,Romanian
BastiWM,europe,"USR is torn between left-wingers and neo-liberals . Not cohesive enough . In order for them to actually **do things** instead of reacting , they need to split .",Romance,Romanian
BastiWM,europe,I bet our numbers went down since train travel became free of charge for students .,Romance,Romanian
BastiWM,europe,The person that downvoted me should look up contemporary Romanian Orthodox Churches . They are **not** a pretty sight .,Romance,Romanian
BastiWM,europe,Sure . The rules are there to be ~~broken~~ bent.\\n\\nSee Hagia Sophia\\nhttps : //en.wikipedia.org/wiki/Hagia_Sophia,Romance,Romanian
BastiWM,europe,Au contraire . Cultural Europe is **the only thing** that exists . There is no clear geographical border between Europe and Asia . Our shared cultural environment is the only thing that makes us European.\\n\\nAnd I contend that is also the thing that matters the most .,Romance,Romanian
BastiWM,europe,I did eat Burek Pizza . Never again .,Romance,Romanian
BastiWM,europe,"This is why I never sleep with the heating on . Either wood , gas or electric .",Romance,Romanian
BastiWM,europe,False equivalence .,Romance,Romanian
BastiWM,europe,"We Romanians have a tendency to really shit on ourselves . The amnesty bill is a disgrace , but Poland is in much greater shit than us . I would gladly have any of our main parties ( PSD , PNL , USR ) than Law and Justice .",Romance,Romanian
BastiWM,europe,"There are many , many things worse than communism . But it depends on the flavour . Maoism , though ? Talk about being out of touch .",Romance,Romanian
BastiWM,europe,"Unfortunate as it may seem , the origin of the Romanian people lies in the southern part of the peninsula . The currently accepted ethnogenesis theory is quite weak when confronted by facts .",Romance,Romanian
BastiWM,europe,"They get promptly downvoted . When a subreddit becomes biased , those comments are at the top of the page.\\n\\nr/europe is safe .",Romance,Romanian
BastiWM,europe,"Veil apologists ITT : \\n\\n1 ) B-but these women are wearing the veil voluntarily ! \\n\\n & gt ; 5 minutes later ... \\n\\n2 ) By banning the veil , their husbands/families will keep them confined to their homes !",Romance,Romanian
BastiWM,europe,This is an arbitrarily-chosen border . It was only chosen because it more or less separates countries with a European culture from countries with different cultures.\\n\\nWhich goes back to what I said earlier . The only thing that defines Europe is the culture .,Romance,Romanian
BastiWM,europe,Americans have an obsession with straight borders .,Romance,Romanian
BastiWM,europe,Beautiful Torygraph article in the vein of\\n\\n\ '' In 50 years there will be no more gingers ! \ '' \\n\\n\ '' In 100 years there will be no more whites ! \ '',Romance,Romanian
BastiWM,europe,"Hey people , I have an idea that will fix this issue : slashing government spending ! ^^/s",Romance,Romanian
BastiWM,europe,"Question : if a behaviour or object is banned for secular reasons , but allowed in religious settings , is this fair ? \\n\\nIn other words , if a comparable act of dominance and oppression ( covering their hair , face and body ) was enacted by European men against European women , should the government not intervene ? \\n\\nThanks .",Romance,Romanian
BastiWM,europe,"I usually am against leftist knee-jerking ( as a leftist myself ) , but Columbus was a disgrace of a human being and his statues need not adorn European streets . This goes doubly so with Leopold II .",Romance,Romanian
BastiWM,europe,"It is demonstrably not . What we call modernity has been obtained by the sweat of secularists fighting against religious mores.\\nThe freedom that we have now is in spite of Christianity , not due to it .",Romance,Romanian
BastiWM,europe,"From my time in Ljubliana , I can say that Slovenia feels like a Balkan Italy . Or a central-European Balkan country . Interesting .",Romance,Romanian
BastiWM,europe,"It depends . There are plenty alt-right Christians - read about [ Christian zionism ] ( https : //en.wikipedia.org/wiki/Christian_Zionism ) . They hate Jews , but want Jews to control Israel for the second coming of Christ.\\n\\nOh , and they also hate Muslims . Obviously .",Romance,Romanian
BastiWM,europe,Typical anti-Romanian sentiments from Hungary ! \\n\\n/s,Romance,Romanian
BastiWM,europe,& gt ; Are you ~~a journalist~~ an enemy of the people ? \\n\\nFTFY,Romance,Romanian
BastiWM,europe,Sure . In a museum .,Romance,Romanian
BastiWM,europe,Because badmouthing your own country is an Eastern European thing .,Romance,Romanian
BastiWM,europe,The similarity is coincidental . *Fa\u021ba* comes from latin *facia* .,Romance,Romanian
BastiWM,europe,My reaction to this : \\n\\nhttps : //www.youtube.com/watch ? v=-UFmVO5LU58,Romance,Romanian
BastiWM,europe,"Are you defending the Sturmabteilung ? \\n\\nAlso , you should check up on your history . The SA **also** defended Nazi rallies , but they were founded in order to disrupt opposing political actions and intimidate minorities and unionists .",Romance,Romanian
BastiWM,europe,Was fighting the Nazis who started a genocide that killed millions wrong ? \\n\\nAre you claiming Nazi violence is the fault of anti-fascists ?,Romance,Romanian
BastiWM,europe,This is a plan I can get behind .,Romance,Romanian
BastiWM,europe,That would be somewhere below reason 9.167.324 when it comes to things that affected the economy .,Romance,Romanian
BastiWM,europe,"Building the European Army would only mean increased funding and efficiency.\\n\\nThink about it . Even if the funding would stay the same on aggregate , removing 27 redundant hierarchies and departments would greatly increase our strength.\\n\\nThe only valid contention point is future involvement in conflicts outside of Europe and the structure of the decision-making process .",Romance,Romanian
BastiWM,europe,Paging ECHR ...,Romance,Romanian
BastiWM,europe,A spectacular Romanian website that deals with this concept : \\n\\nhttp : //www.costingheorghe.ro/thenow/,Romance,Romanian
BastiWM,europe,"If the only alterEnglish to the social-democrats is privatisations , frozen minimum wage and austerity , then PSD will continue to win elections in a landslide .",Romance,Romanian
BastiWM,europe,Most accurate .,Romance,Romanian
BastiWM,europe,Hah . It looks like a modded Simcity 4 map .,Romance,Romanian
BastiWM,europe,"& gt ; The guy established the most successful colony and eventually country in all of Africa.\\n\\nSuccessful for whom ? \\n\\n & gt ; The population flourished much more under him and his successors than it does today.\\n\\nLife under colonialism can not be deemed \ '' flourishing\ '' .\\n\\nDo you believe current day Africa would have been a better place without past colonialism , or not ?",Romance,Romanian
BastiWM,europe,"Countries like China and India have never held a holier-than-thou attitude towards climate change . Criticism against Germany is much more justified , since their poisoning of the environment comes after ridding their country of \ '' those evil nuclear power plants\ '' .",Romance,Romanian
BastiWM,europe,The other countries ahead of them are outside of Europe . This is the Europe subreddit .,Romance,Romanian
BastiWM,europe,"Not surprising , since Scandinavians seem to have a huge boner for American culture.\\n\\nU-S-A ! ! ! U-S-A ! ! ! ^/s",Romance,Romanian
BastiWM,europe,Stop using this argument . Canada does not have access to the single market.\\n\\nFree-ish trade \u2260 single market,Romance,Romanian
BastiWM,europe,"That resignation was just political tactics in action . The prime minister and the cabinet at the time had no direct fault in the events that triggered the protests.\\n\\nThe PM most likely resigned because of internal strife , and easily gave up power as a fuck you to the opposing PSD faction . The faction controlled by ... you guessed it , the current leader of PSD .",Romance,Romanian
BastiWM,europe,His fivehead is really noticeable .,Romance,Romanian
BastiWM,europe,Too soon .,Romance,Romanian
BastiWM,europe,"Personally , I agree with complete cultural autonomy , just not political autonomy . I have a gripe with the laws differing based on the ethnicity of the regional population.\\n\\nEdit : Is this statement triggering to both sides ?",Romance,Romanian
BastiWM,europe,That is absolutely true . It boggles the mind that someone can willingly defend **selectively** publishing information . Accurate but incomplete data is sometimes identical to lying and falsifying .,Romance,Romanian
BastiWM,europe,Such a shame . You need some of that juicy Balkan eternal-regret-for-past-glories-that-never-were . Perhaps it would help in resurrecting the language .,Romance,Romanian
BastiWM,europe,It was a [ joke ] ( https : //www.reddit.com/r/OutOfTheLoop/comments/3ml1qm/whats_with_the_association_between_kazakhstan_and/ ) .,Romance,Romanian
BastiWM,europe,"Basically every American administration took this stance , be it Democrat or Republican . But Obama was vilified to no end for doing it as well.\\n\\nNot to mention the sentient cheeto built his entire campaign on doing the opposite .",Romance,Romanian
BastiWM,europe,"No matter the outcome , things will never go back to normal .",Romance,Romanian
BastiWM,europe,It **just** happened . Chill . Tusk is still in his pajamas .,Romance,Romanian
BastiWM,europe,He meant that the self-determination of the indigenous population is more important than ownership won by conquest .,Romance,Romanian
BastiWM,europe,"I hope we can see an Irish-speaking \u00c9ire in our lifetimes . Whenever we have the rare chance of undoing some kind of cultural vandalism , we must act .",Romance,Romanian
BastiWM,europe,The world is becoming a scarier place by the day . I now apparently agree with Sarkozy . Damn ...,Romance,Romanian
BastiWM,europe,*Fun* fact : a future patriarch of the Romanian Orthodox Church participated in the Bucharest pogrom .,Romance,Romanian
BastiWM,europe,"So many downvotes , but no explanation . Made me even more curious .",Romance,Romanian
BastiWM,europe,This shows that half of Europe is rightful Romanian clay .,Romance,Romanian
BastiWM,europe,"This thread is getting brigaded , it seems to me . At arms , push back the invaders !",Romance,Romanian
BastiWM,europe,"Well , we went back to the old system , relatively recently , after the 1989 Revolution . So you can always push for this.\\n\\nBeing the birthplace of such a widely-used alphabet is quite the honour , so start a movement , undo cultural vandalism .",Romance,Romanian
BastiWM,europe,Why not go to the pre-communist system ? We did .,Romance,Romanian
BastiWM,europe,"When you target *all of them* , it is arbitrary .",Romance,Romanian
BastiWM,europe,They can defeat racism through the power of limericks .,Romance,Romanian
BastiWM,europe,"& gt ; In the middle ages , Christianity managed to imprint upon a violent and highly tribal set of warrior societies that the killing of ~~women , children and~~ the clergy ~~where~~ was not acceptable.\\n\\nFTFY",Romance,Romanian
BastiWM,europe,Somehow I doubt you were a Remainer .,Romance,Romanian
BastiWM,europe,A private healthcare lobby group places private healthcare systems at the top of the list.\\n\\nNothing sketchy here !,Romance,Romanian
BastiWM,europe,No one suggested banning it for adults . Only for children who can not consent by definition .,Romance,Romanian
BastiWM,europe,"This language and attitude isn\\'t helping . How can one point to the Hungarian government\\ 's irresponsible attitude and then go \ '' Fuck you , we won\ '' ?",Romance,Romanian
BastiWM,europe,False . Liberals do not tolerate intolerance . We do not accept bigotry based on some fabricated absolutist moral law .,Romance,Romanian
BastiWM,europe,The coup was certainly in place before the referendum . But now their coup is justified .,Romance,Romanian
BastiWM,europe,"[ Something similar ] ( https : //translate.google.com/translate ? sl=ro & amp ; tl=en & amp ; js=y & amp ; prev=_t & amp ; hl=ro & amp ; ie=UTF-8 & amp ; u=http % 3A % 2F % 2Feconomie.hotnews.ro % 2Fstiri-it-21664849-expert-gasit-vulnerabilitate-cartelele-hartie-ratb-putand-calatori-gratuit-nelimitat.htm & amp ; edit-text= ) happened in Bucharest and there was no arrest.\\n\\nThis is [ official response ] ( https : //translate.google.com/translate ? sl=ro & amp ; tl=en & amp ; js=y & amp ; prev=_t & amp ; hl=ro & amp ; ie=UTF-8 & amp ; u=https % 3A % 2F % 2Fwww.agerpres.ro % 2Fcomunicate % 2F2017 % 2F03 % 2F16 % 2Fcomunicat-de-presa-ratb-20-17-15 & amp ; edit-text= ) : \\n\\n & gt ; IT Specialist Gabriel C\u00eerlig has discovered the vulnerability for multiple cards to the Automated Taxation System managed by UTI , and RATB has announced this in December 2016 , and RATB has now removed this vulnerability.\\n\\n & gt ; Currently , the automatic toll system is secure and does not have vulnerabilities.\\n\\n & gt ; RATB thanks the IT specialist for good faith and the civic spirit he has proven.\\n\\n ( Google Translate )",Romance,Romanian
BastiWM,europe,I was thinking about the last event in which a bridge failed under a lorry . I think there was a death as well .,Romance,Romanian
BastiWM,europe,Your complaints are founded . You could have the same quality or better for a lower price in a single-payer system .,Romance,Romanian
BastiWM,europe,"You could have not elected them , but then the other side was just as bad , you know ? \\n\\n^^^/s",Romance,Romanian
BastiWM,europe,"As far as I know , there have been zero convictions . Is anything palpable happening ?",Romance,Romanian
BastiWM,europe,"I despise Geert Wilders , but I think I can agree with you .",Romance,Romanian
BastiWM,europe,Wrong . Czechia has a firearm-related death rate ( per 100.000 ) of 2.01 . Romania has a rate of 0.14.\\n\\nDING DING DING,Romance,Romanian
BastiWM,europe,How kind of you . Thanks !,Romance,Romanian
BastiWM,AskEurope,"Moldovan speakers from Republic of Moldova ( as opposed to speakers from the Romanian region of Moldova ) have a much thicker Russian accent , along with Russian loanwords and idioms.\\n\\nIn my opinion this can be explained by the political and cultural ... influence the Russian Empire and Soviet Union had on the country in the last hundreds of years .",Romance,Romanian
BastiWM,europe,Again ? ! Italian infrastructure is in a dire state .,Romance,Romanian
user,subreddit,post,family,lang
2stepsfromglory,europe,Since [ Salvador ] ( https : //twitter.com/Eurolazaro/status/852217081747689473 ) can sing in spanish we could have sendt him too . Just add him a mask . That would have been hilarious .,Romance,Spanish
2stepsfromglory,europe,"Wine is common in all the center of the country and some places of the mediterranean along with beer , but not in the north coast ( sidra and liquors ) or in some places of the south ( beer ) .",Romance,Spanish
2stepsfromglory,europe,To be fair the difference is that they actually conquered all these places while the spanish empire ( at least in Europe ) was buildt thanks to arranged marriages and the portuguese one because you guys were smart enough to be the first ones to circunnavegate Africa and reach Asia .,Romance,Spanish
2stepsfromglory,europe,"Fun fact , New Zealand was in fact discovered by spanish navigators at the end of the XVI century . They even sendt a letter to the king Philip III asking if they could colonize it ( along with the north of Australia ) in his name , but it seems like the king said something along the lines of \ '' fuck it , I have enough lands so if you guys are not sure if this place has gold I don\\'t really care about it\ '' .\\n\\nNew Guinea was also discovered by spanish navigators but even when they took possession of the land and in fact they builded a couple of forts there , they abandoned it pretty soon . Things could have changed if they knew about the huge amount of gold and copper that the island had .",Romance,Spanish
2stepsfromglory,europe,"[ Juan Fernandez ] ( https : //en.wikipedia.org/wiki/Juan_Fern % C3 % A1ndez_ ( explorer ) and [ Juan Jufr\u00e9 ] ( https : //en.wikipedia.org/wiki/Juan_Jufr % C3 % A9 ) arrived there before , tho their discovery was not significant at the time .",Romance,Spanish
3G6A5W338E,europe,"& gt ; And how does that correlate with the pro-independence movement ? \\n\\nMy point exactly . It bears no weight . \ '' They\\ 're just being manipulated ! \ '' is a convenient wildcard . Catalan voters are adults , responsible for themselves and should be treated as such . Hold a vote , figure out what people want.\\n\\nThat\\ 's all we\\ 're asking . Just posing a question to the Catalan people and getting their opinion . It\\ 's not even a referendum , it\\ 's just an official poll to know the people\\ 's actual opinion . ( OP title is all wrong , it\\ 's 4 parties covering 2/3 of the seats in parliament , not just the government , and it\\ 's a non-vinculant question , not a referendum . On top of that , there\\ 's 2 questions , not one. ) . Should independence happen to be the preferred option , what would happen wouldn\\'t be an unilateral declaration of independence . What would happen is that negotiations on how to do it would start.\\n\\nAnd for some reason , the Spanish government has a problem with that . They\\ 're saying they won\\'t allow the Catalan people to be polled on it no matter what . Just how antidemocratic can they be ? And that attitude runs counter to convincing anyone that independence is not the way .",Romance,Spanish
3G6A5W338E,europe,I hope we both get there .,Romance,Spanish
3G6A5W338E,europe,It reminds me of Bankia ... horror .,Romance,Spanish
3G6A5W338E,europe,"& gt ; Good luck I don\\'t think that will give you enough popularity to get a change in the constitution.\\n\\nThe constitution has never been the problem . It provides the necessary flexibility for competencies to be transferred.\\n\\nWhat Catalonia asked for this time was for the competency to ask the population questions ( in order to know the population\\ 's position on issues ) to be transferred to Catalonia , in order to ask the populace whether they want to be independent or not , and finally know what their opinion in the matter is , beyond guessing from the results of polls and the attendance of demonstrations.\\n\\nAnd this proposal , which came from a wide majority of the Catalan parliament , in their responsibility to their electoral promise of holding an independence vote and the people that elected them to carry it out , has been insultingly rejected straight when made , thus not allowing for it to be processed , which would have meant discussion and negotiation.\\n\\nIn short , that\\ 's what the \ '' dialogue\ '' the Spanish government is supposedly offering amounts to.\\n\\nNevertheless , we\\ 're not surprised with this ; this sort of thing is one example in thousands why we find it hopeless for things to continue as they have been up to now.\\n\\nThe process continues . We will exhaust every legal recourse for the vote to be held and the position of the Catalan people on this issue known . Should the unthinkable happen and the 9th November vote not be held , elections will be , and pro-independence parties will position themselves in such manner that they\\ 'll effectively substitute for such a poll . If the popular support for Independence is confirmed in the urns , we will start negotiations for independence.\\n\\nUltimately , sovereignty of a land belongs to its people ... and the way Spanish institutions are acting isn\\'t exactly convincing these people that there\\ 's any worth to being Spanish .",Romance,Spanish
3G6A5W338E,europe,"Sure , but I expect an absolute majority for ERC ( with my support ) and some 80 % parliament for independence , which will be enough for an unilateral declaration when the alterEnglishs are exhausted .",Romance,Spanish
3G6A5W338E,europe,"Oh , *La Vanguardia* . Expected that somewhat.\\n\\nI do consider the recent election results a better poll , of course .",Romance,Spanish
3G6A5W338E,europe,"& gt ; any Catalan law that they do not like.\\n\\nThat is , most Catalan laws .",Romance,Spanish
3G6A5W338E,europe,"& gt ; Christian parents \ '' brainwash\ '' their kids every day at home.\\n\\nBut they don\\'t do it using the state schools paid with tax money . It\\ 's also less effective when they\\ 're not being brainwashed in schools too.\\n\\n & gt ; I almost feel like a broken record , but I don\\'t consider religious classes in school brainwashing , at least not in a harmful way.\\n\\nYou\\ 're saying indoctrination in some choice of religion is a good thing ? I think even a \ '' self-study period\ '' is a better use of the kids time .",Romance,Spanish
3G6A5W338E,europe,& gt ; just get the fuck out or shut up they would say.\\n\\nRead : Conform or run away.\\n\\nSo very nice .,Romance,Spanish
3G6A5W338E,europe,"No , but we at Catalonia have a plan ( to solve this and so many other things ) : An independence vote : ) .",Romance,Spanish
3G6A5W338E,europe,"& gt ; , as long as it\\ 's not forced upon them in a \ '' preachy\ '' way and presented as the one true guideline for their lifes . \\n\\nYou\\ 've just described what religion class is.\\n\\n & gt ; Classes on religion don\\'t equal indoctrination , although I think teachers should not be chosen by the state.\\n\\nThey\\ 're by the church , and the church chooses the priests they send to play teacher . State simply funds it and ensures it happens in each and every school . It\\ 's nasty.\\n\\n & gt ; I think it\\ 's valuable that our children learn about religion , seeing how much it has influenced our lifestyle.\\n\\nAgreed . I think the background and influence of many religions should be taught by proper teachers in subjects such as philosophy or history when appropriate .",Romance,Spanish
3G6A5W338E,europe,"& gt ; Fervent nationalism , or in your case *regionalism* , has never led to anything good . \\n\\n & gt ; When it comes to your province\\ 's name\\n\\nCatalonia isn\\'t a province . Catalonia is an autonomous community of Spain , and a nationality by its [ Statute of Autonomy ] ( https : //en.wikipedia.org/wiki/Catalan_Statute_of_Autonomy ) . Calling us \ '' a province\ '' is outright rude and very offensive.\\n\\n & gt ; Also , if I say Catalu\u00f1a , as it\\ 's called in Spanish , the language **spoken** by everyone in Spain , *it\\ 's because I want to . *\\n\\nI never had any doubt about it . And it\\ 's not **spoken** but known . I\\ 'm fluent in a few languages , but I speak Catalan , so do millions.\\n\\n & gt ; You\\ 're asking for consultation **after having being riled up by** opportunist leaders taking advantage of the crisis.\\n\\nWay to put another unrelated opinion into my mouth , derail the discussion , and insult the Catalan people while at it . But I\\ 'll humor you , since you insist so much.\\n\\n & gt ; **You\\ 're being fooled** by leaders who want Catalu\u00f1a for themselves and their corrupt businesses.\\n\\nYou\\ 're basically saying the Catalan are idiots , easy to manipulate and that\\ 's why they voted a parliament of 2/3rd for consultation which presented themselves as such in their electoral campaigns.\\n\\nYou might as well say we must not be allowed to vote at all and must be ruled 100 % from central Spanish government , elected exclusively by the rest of the Spanish populace , who unlike us are intelligent enough to be entitled to their own opinions on how Catalonia should be run.\\n\\n & gt ; It\\ 's no wonder that before the crisis Catalan will for independence was around 30 % .\\n\\nIkus13 , you\\ 've expressed your opinion , but for the rest of you : \\n\\nSome events : \\n\\n* https : //en.wikipedia.org/wiki/Catalan_Statute_of_Autonomy # 2005_Draft\\n* https : //en.wikipedia.org/wiki/Catalan_Statute_of_Autonomy # Legal_challenge_.26_the_Catalans.27_response\\n* https : //en.wikipedia.org/wiki/2010_Catalan_autonomy_protest\\n* https : //en.wikipedia.org/wiki/2012_Catalan_independence_demonstration\\n* https : //en.wikipedia.org/wiki/Catalan_Way\\n\\nAnd some polls on independence over time to line up with the events : \\n\\n* https : //en.wikipedia.org/wiki/Catalan_independence # Studies_on_public_opinion\\n\\nAnd while at it , some background by the grassroots organization that has had a major role in the process to bring support for independence where it is now from the 15 % or so it used to be before the whole deal with the new Statute of Autonomy : \\n\\nhttp : //catalanassembly.org/resources/\\n\\nhttp : //catalanassembly.org/road-map/\\n\\nAnd there\\ 's also this [ excellent post ] ( http : //www.reddit.com/r/europe/comments/2b47ae/angela_merkel_spoke_out_against_the_independence/cj25qu9 ) by /u/viktorbir .",Romance,Spanish
3G6A5W338E,europe,"& gt ; So easy way out , they press charges . They know the best he gets is a shitty attorney.\\n\\nAnd the daughter gets un-fucked back into purity : )",Romance,Spanish
