Arthur-Guinness,europe,"It\\ 's not politics , it\\ 's money - and the bags of it that were used to bribe the officials.\\n\\nFeel better about that ? I don\\'t have to worry as Northern Ireland won\\'t be going anywhere near it anyway ... so I\\ 'm \ '' boycotting\ '' I guess.\\n",Germanic,English
Arthur-Guinness,europe,No bribing ... Russia - you are joking right . Of course FIFA were paid off just as they were for Qatar .,Germanic,English
Arthur-Guinness,europe,& gt ; Are people unaware of the gerrymandering that ~~was~~ is going on ? \\n\\nFTFY\\n,Germanic,English
Arthur-Guinness,europe,And all the athletes compete naked too ?,Germanic,English
Arthur-Guinness,europe,"[ Fried Soda and Potato Farls ] ( http : //1.bp.blogspot.com/-pbKkEExm4yM/TbBCKGIhhTI/AAAAAAAAAGw/PE6bTkv4OOE/s1600/ULSTER+FRY.jpg ) , are like having toast with your breakfast but not , and thrice as bad for your heart .",Germanic,English
Arthur-Guinness,europe,"You are using that Ukrainian apologist website Al-Jazeera ? ? ? Good grief , that is a bastion of pro-western propaganda !",Germanic,English
Arthur-Guinness,europe,"Good luck getting agreement from everyone to do anything at all , ever .",Germanic,English
Arthur-Guinness,europe,Flatulence & amp ; gunpowder ? No matches please around this guy.\\n\\n,Germanic,English
Arthur-Guinness,europe,/u/JebusGobson is just pissed that the Belgian Commonwealth games suck .,Germanic,English
Arthur-Guinness,europe,It\\ 's amazing people still believe when the Russians sign papers . How\\ 's that \ '' cease fire\ '' going ? \\n,Germanic,English
Arthur-Guinness,europe,My intuitive reaction is that Russell Brand is a cunt.\\n,Germanic,English
AsTheCoolKidsSay,europe,These guys welcome the refugees too ... to go back home.\\n\\n About that..,Germanic,English
AsTheCoolKidsSay,europe,Bigly if true,Germanic,English
AsTheCoolKidsSay,europe,speaking of good at it..hello,Germanic,English
AshFair,europe,I would give the Spanish armada a weather warning .,Germanic,English
Ashtherogue,europe,Being from Derry but having gone to uni at Queens in Belfast I can say this is very true\\n,Germanic,English
Ashtherogue,europe,"I only know one Lithuanian woman and I have to say she is very attractive so you may be right , even if my sample size is ever so slightly on the small size . \\n\\nPersonally I gave it to the Czechs .",Germanic,English
Ashtherogue,europe,& gt ; Nothing else significant this week\\n\\nA welcome change,Germanic,English
Asimodega,AskEurope,"No it doesn\\'t , liberalism in Europe includes placing an onus on government to alleviate social issues and provide a social safety net . They generally advocate for maintaining existing social structures through which change can be implemented , the \ '' third way\ '' that grew popular here in the 90s and is comparable to mainstream libertarian ideas runs counter to traditional liberalism . \\n\\nLeft wing movements people like to call liberal are actually radical in that they call for complete structural overhall , rather than change within structures . These are closer to Marxists than american liberals .",Germanic,English
Asimodega,AskEurope,"In primary school ( 4-12 ) world history and geography meshed a bit , we did projects on different countries , we would have learned the relevant pages from the Encyclopedia Britannica and I remember writing to the Indian embassy in Dublin for more information on the country ( this is very obviously pre internet ! ) .\\n\\n My partner would have been in a different kind of primary school to me and says they also did religious and cultural studies which included India . I went to a Christian school so Christianity would have been the totality of my religious education then , this is very common here.\\n\\n From 12 we learned about colonisation and independence , those being topics of contextual interest in Ireland . A bit about culture , social hierarchy and religion . I did an essay on Gandhi in my state exams aged 15 , not hugely in depth mind you ! \\n\\nI did agricultural science ( an optional subject ) after this and we learned about the green revolution . We also would have looked at how colonisers push their farming practices in colonies and the affect that can have on a local agriculture industry , this is all really specific looking back and probably wouldn\\'t have been something everyone experienced.\\n\\nThe hope foundation is a charity that does development education with secondary school students ( 12+ ) here and works with street children in Kolkata , we learned about the children they work with through extracurriculars . \\n\\nMake of that what you will , it\\ 's a bit of a mixed bag . The Irish curriculum allows for a lot of sway in what precisely people learn , so some would have learned more than myself , others less . Certainly the obvious interest in colonialism wouldn\\'t be replicated everywhere , and the impact of charitable organisations will be something which reflects the \ '' ethos\ '' of your particular school .",Germanic,English
Asimodega,AskEurope,"This is \ '' egg in a cup\ '' , we do that in Ireland too .",Germanic,English
Asimodega,AskEurope,"In Ireland we actually speak hiberno-english , a set of english dialects with pronunciation , syntax and some words borrowed from Irish . Our \ '' accent\ '' in general can largely be attributed to this . In English speakers the effect is heightened , I find , especially around pronunciation .",Germanic,English
Asraelite,europe,Interesting . What are the straight lines ?,Germanic,English
Asraelite,europe,"[ \ '' \u00f6\ '' ] ( https : //upload.wikimedia.org/wikipedia/commons/5/53/Close-mid_front_rounded_vowel.ogg ) and [ \ '' eu\ '' ] ( https : //upload.wikimedia.org/wikipedia/commons/e/e8/Close_back_unrounded_vowel.ogg ) . Even if it doesn\\'t feel like it , you are always rounding your lips to an extent when pronouncing it , otherwise it would be [ \ '' e\ '' ] ( https : //upload.wikimedia.org/wikipedia/commons/6/6c/Close-mid_front_unrounded_vowel.ogg ) .",Germanic,English
Asraelite,europe,"[ This ] ( https : //easypronunciation.com/en/chinese-pinyin-phonetic-transcription-converter ) lets you see Chinese characters as IPA . Poland ( \u6ce2\u862d ) , for example , is pu\u032f\u0254^1 lan^2 .",Germanic,English
Asraelite,europe,Therefore we can conclude that it is 182m .,Germanic,English
Asraelite,europe,I concurringly agree .,Germanic,English
Asraelite,europe,"It may sound similar , but the way it\\ 's produced is completely different . The sound represented by \ '' \u00f6\ '' is /\u00f8/ or /\u0153/ ( depending on the word ) , while the sound of eu is /\u026f/ . If you look at where these are on a [ vowel chart ] ( http : //i.imgur.com/MawbDLl.png ) , they\\ 're pretty far apart.\\n\\n\ '' eu\ '' is produced with the lips unrounded and the tongue fully raised at the back of the mouth , while \ '' \u00f6\ '' is produced with rounded lips and the tongue slightly lower at the front of the mouth .",Germanic,English
AstroAgama,europe,And then complain their jobs were taken .,Germanic,English
AstroAgama,europe,Roscommon no . Leitrim on the other hand ...,Germanic,English
AstroAgama,europe,I feel redeemed as somebody literally told yesterday on this sub Ireland earns its high numbers of cystic fibrosis for being so inbred .,Germanic,English
AstroAgama,europe,"To be fair , that would require them to see women as anything more than sexual objects .",Germanic,English
AstroAgama,europe,Maybe because most of the people in a European subreddit are in the EU ?,Germanic,English
AstroAgama,europe,Another election would result in the same outcome . Maybe Sinn Fein and DUP do better and the smaller parties do worse . Thats not going to fix anything . Politically its a partisan stalemate .,Germanic,English
AstroAgama,europe,Whats the overlap betweeb Lib Dems and Tories ?,Germanic,English
AstroAgama,europe,"Britains difficulty , Irelands opportunity .",Germanic,English
AstroAgama,europe,Or we have to do them again .,Germanic,English
AstroAgama,europe,Both have talked more about TTIP than Brexit .,Germanic,English
AstroAgama,europe,"Guys , you can\\'t act like this wasn\\'t a deliberate choice . The whole point of this is for that handshake.\\n\\nBet he\\ 'll shake Putin\\ 's hand as well . This is an insult to us all . \\n\\nEdit : A lot of people have said \ '' I guess Ireland\\ 's Germany now\ '' . Everyone can draw their own line but for me the EU is more than a legal agreement it\\ 's a way of increasing of our position , our common beliefs , and each other . It would be wrong of me not to be disappointed by this after the US and Trump spent the whole week applauding my government . \\n\\nWe are stronger united , I stand with Europe against Turkey\\ 's threats , with Eastern Europe against Russian aggressions , and with Germany/France/Sweden against Trumps attempts to hurt their political process .",Germanic,English
AstroAgama,europe,Actually something very similar to that was asked and it still had a majority.\\n\\n http : //www.rte.ie/amp/857226/,Germanic,English
AstroAgama,europe,https : //www.reddit.com/r/europe/comments/5zz7kr/donald_trump_refuses_to_shake_angela_merkels_hand/df2d4ia\\n\\nLiterally right here .,Germanic,English
AstroAgama,europe,"Is sorta the same in Ireland , except with a little condensation . You can be atheist but are you a Catholic Atheist or a Protestant Atheist .",Germanic,English
AstroAgama,europe,"**Ireland**\\n\\nIrish Premier , Taoiseach Enda Kenny went to the White House as the first European leader to meet Trump and gave him some [ grass and a lecture . ] ( https : //mobile.nytimes.com/2017/03/16/us/politics/irish-st-patricks-enda-kenny-trump.html ? _r=0 & amp ; referer=http : //www.google.ie/ ) .\\n\\n [ His speech ] ( http : //m.independent.ie/irish-news/watch-st-patrick-is-the-patron-of-immigrants-enda-kenny-lectures-president-trump-on-immigration-35541759.html ) is certainly worth watching especially from a \ '' Ireland\\ 's in the EU don\\'t you start Donny \ '' way . Probably the best of his career and seeing how he\\ 'll retire in a few weeks so now he\\ 'll get to go into the sunset . \\n\\nAlso it\\ 's weird to have Americans praise your government for a week once a year .",Germanic,English
AstroAgama,europe,"In fairness , Ireland isnt energy dependant on Russia .",Germanic,English
AstroAgama,europe,Ireland should be green,Germanic,English
AstroAgama,europe,"Honestly , Crimea kinda feels like Tibet all over again .",Germanic,English
AstroAgama,europe,Macaroni Macaroni hope he gets the voteroni .,Germanic,English
AstroAgama,europe,"Never trust exit polls . The scientific methodology is applied in reverse and weighted once the full results are known , without that they are terrible predictors and borderline unscientific .",Germanic,English
AstroAgama,europe,"Never trust exit polls . The scientific methodology is applied in reverse and weighted once the full results are known , without that they are terrible predictors and borderline unscientific .",Germanic,English
AstroAgama,europe,"Eh ; I said nobody wants direct rule . Either you make up what I say and pretend to understand , or we present my words accurately . Your choice .",Germanic,English
AstroAgama,europe,"Yep , campaign poster will be far worse though .",Germanic,English
AstroAgama,europe,You think so ? From what I read it was pretty expected for Cameron to resign if he failed .,Germanic,English
AstroAgama,europe,In the grand scheme of things we are lucky the provision is rooted in democracy . Could have easily been parliament or something behind bureaucracy .,Germanic,English
AstroAgama,europe,That makes no sense .,Germanic,English
AstroAgama,europe,Oh somebodys got their knickers in a bunch .,Germanic,English
AstroAgama,europe,But are they are unified movement in the same way Labour was . I mean Ireland only got a Social Democrats party a year ago .,Germanic,English
AstroAgama,europe,The Irish national anthem mentions English people if that counts.\\n\\n**See in the east a silv\u2019ry glow**\\n\\n**Out yonder waits the Saxon foe**,Germanic,English
AstroAgama,europe,"Paywall , text : \\n\\n & gt ; European leaders are preparing to recognise the potential for a united Ireland\u201d within the EU , confirming that Northern Ireland would seamlessly rejoin the bloc after Brexit in the event of a vote for Irish reunification . In a step that may stoke concerns in Britain that Brexit could hasten the fragmentation of the UK , diplomats are planning to ask leaders of the EU\u2019s 27 post-Brexit member countries to endorse the idea in a summit on Saturday . It would allow the province to follow the example of German reunification in 1990 and reflect the terms of the 1998 Good Friday Agreement , which ended decades of sectarian violence in Northern Ireland . The agreement allows a referendum on reuniting Ireland where there is reason to believe a majority in the province is in favour.\\n\\n\\n\\n & gt ; Britain and Ireland are committed to upholding the Good Friday Agreement as co-guarantors . But the increased talk of Irish reunification will reinforce the fears of those in Britain who believe & gt ; Brexit will bolster those championing a UK break-up . Nicola Sturgeon , Scotland\u2019s first minister , has already called for a Scottish independence referendum within two years , as Britain\u2019s departure from the union is finalised . Saturday\u2019s gathering in Brussels will mark the formal adoption of EU guidelines for Brexit talks with the UK , staking out a tough opening stance with a common front on issues such as Gibraltar , ? & gt ; Northern Ireland and the rights of EU migrants.\\n\\n\\n\\n & gt ; German Chancellor Angela Merkel warned Britain on Thursday not to harbour illusions about the bloc\u2019s resolve . \u201cI have to put it in such clear terms because unfortunately I have the feeling that some in Britain still have illusions , \u201d Ms Merkel told the Bundestag . \u201cBut that would be a waste of time.\u201d No final decision has been taken on a specific text on Irish unity . It would be part of accompanying documents to the guidelines for Saturday\u2019s summit , because it is seen as a clarification of law rather than something to be negotiated in Europe\u2019s talks with Britain.\\n\\n\\n\\n & gt ; Officials warned that a reference to the idea could still be excluded because of the acute sensitivity around independence questions in Scotland and Catalonia in Spain . EU27 ambassadors were first told of the plan at a meeting on Wednesday but Donald Tusk , European Council president , has yet to share a text , which was suggested by Dublin . Enda Kenny has pushed for a \u201cunited Ireland\u201d reference in the final Brexit treaty that will confirm the UK\u2019s exit , but an EU statement at the outset of talks would be seen as a diplomatic coup as he prepares to step down as taoiseach \u2014 prime minister \u2014 after six years . Advocates of the reference to Northern Ireland and reunification say the reference simply reflects the Good Friday pact , signed long before Brexit was anticipated . But it would still send a powerful signal at a sensitive moment in the politics of the island.\\n\\n\\n\\n & gt ; Under pressure to hand power to a younger generation , Mr Kenny has said he will make his intentions for his political future clear once the \u201cground rules for Brexit\u201d are set . This has fuelled expectations that he will step down within weeks , setting in motion a contest for the leadership of his centre-right Fine Gael party . Ireland is the most exposed of the EU\u2019s remaining member states to Brexit . Dublin is desperate to avoid a clean break between the UK and the EU , which could severely damage Irish-British trade that runs to \u20ac1.2bn a week . But it also wants to be seen to play a full part in the negotiations on the EU side . \u201cWe will not be a proxy for the British in the exit negotiations , \u201d Irish foreign minister Charlie Flanagan told the Financial Times in an interview .",Germanic,English
AstroAgama,europe,Whats attractive to the individual today to this though ? They look like pawns and have given up their own identity .,Germanic,English
AstroAgama,europe,You left out the quote where she said this is a direct result of Trumps visit .,Germanic,English
AstroAgama,europe,Or the DUP/Sinn Fein in Northern Ireland .,Germanic,English
AstroAgama,europe,"Eh , i dont know . Lesbian porn is nothing close to how a woman would pleasure herself .",Germanic,English
AstroAgama,europe,But there have been tons of generation born by the easy going into bad shit .,Germanic,English
AstroAgama,europe,The epicentre of the EU is western ?,Germanic,English
AstroAgama,europe,Once every week is regular ?,Germanic,English
AstroAgama,europe,Considering where it is geographically thats better than it sounds . Now if only it could be more free .,Germanic,English
AstroAgama,europe,"He worked in the financial sector , and is likeable . Anything else ?",Germanic,English
AstroAgama,europe,I meant matter in terms of hurting their support .,Germanic,English
AstroAgama,europe,Home of the green stuff !,Germanic,English
AstroAgama,europe,"There was one in Ireland too , but it was tiny.\\n\\nhttps : //en.m.wikipedia.org/wiki/Young_Irelander_Rebellion_of_1848",Germanic,English
AstroAgama,europe,Including his own .,Germanic,English
AstroAgama,europe,I agree there needs to be more distinction but there has to be a certain degree of responsibility on the people .,Germanic,English
AstroAgama,europe,Load* ( Up to 800 ),Germanic,English
AstroAgama,europe,We like owning land .,Germanic,English
AstroAgama,europe,And why is Turkey included ?,Germanic,English
AstroAgama,europe,"Oh boy , that one that put England on the mainland .",Germanic,English
AstroAgama,europe,Right okay but that has little to do with what I said .,Germanic,English
AstroAgama,europe,Pretty sure nobody is arguing to give aid to refugees for the sake of diversity .,Germanic,English
AstroAgama,europe,Concentration camps plus getting family members to kill each other ?,Germanic,English
AstroAgama,europe,"Aw , I really liked the Bulgarian kid . The Portugal guy just seemed arrogant .",Germanic,English
AstroAgama,europe,Does that count though ? What actual interaction did she have with the faith ? Did she even read a Quran ? Feels more she given an excuse to do what she wanted .,Germanic,English
AstroAgama,europe,If *we* live to 2020 .,Germanic,English
AstroAgama,europe,Its up there .,Germanic,English
AstroAgama,europe,That makes no sense .,Germanic,English
AstroAgama,europe,I was just using your flawed logic against you .,Germanic,English
AstroAgama,europe,She left as leader to focus on her bid . Fine .,Germanic,English
AstroAgama,europe,Is this translator bad or does Le Pen have no idea what her next word is going to be at any given time ?,Germanic,English
AstroAgama,europe,This map is confusing . Is it only including the red part from Germany to Italy ? I thought it was bigger than that . Or is it including everything ?,Germanic,English
AstroAgama,europe,Is this a Black Adam teaser ? Man the Rock is a beast .,Germanic,English
AstroAgama,europe,When I say Ireland I mean the Republic .,Germanic,English
AstroAgama,europe,"This is false . Nobody is deciding what is true or not , the truth just is . This project simply points out what is and is not .",Germanic,English
AstroAgama,europe,My immediete response is just to register this as meaningless and ignore it .,Germanic,English
AstroAgama,europe,Reports only indicate assailant had a knife . No gun confirmed .,Germanic,English
AstroAgama,europe,So can people stop saying young people love Le Pen know ?,Germanic,English
AstroAgama,europe,"Oh , I would never put it past us giving a chance to have a moan about Britain but still I think what I said is still true .",Germanic,English
AstroAgama,europe,If that was real they would be the worst lobby in history .,Germanic,English
AstroAgama,europe,IVF is a thing .,Germanic,English
AstroAgama,europe,So it seems Le Pen mumbles her way through for 90 % and then spends the last 10 % on a prepared attack on Macron .,Germanic,English
AstroAgama,europe,The NYT is pretty awful when it comes to politics though .,Germanic,English
Astrobomb,europe,There are benefits to thinking for yourself .,Germanic,English
Ataraxia2320,europe,"Agreed , but our highly educated English speaking workforce also helps .",Germanic,English
Ataraxia2320,europe,Coming from Ireland the notion of left wing nationalism seems pretty normal to me .,Germanic,English
Ataraxia2320,europe,"First of all , Scotland is in the UK ; why are you separating the two ? \\n\\nSecond , why would you assume that companies would rather have their European headquarters in the UK ?",Germanic,English
Ataraxia2320,europe,"They are to an extent , but they are still as nationalist as it gets - hell the name even means we ourselves . \\n",Germanic,English
Ataraxia2320,europe,No love for Ireland ?,Germanic,English
Ataraxia2320,europe,There has to be less than a handful in the entire country .,Germanic,English
Ataraxia2320,europe,We already have one as far as I know .,Germanic,English
Ataraxia2320,europe,The German army has enough of a problem with it to spend millions in replacing it though . \\n\\n,Germanic,English
Ataraxia2320,europe,You get treatment and then when if you get better you can look forward to your life of debt .,Germanic,English
Ataraxia2320,europe,"Low corporation tax , mixed with the double Irish tax loop hole you mean .",Germanic,English
Ataraxia2320,europe,I mistakenly recalled that Merkel declared that refugees would not be taken from these countries . \\n\\nI would still make the case that Iran is safe though .,Germanic,English
Ataraxia2320,europe,You do realise that Germany also benefited hugely from both the EU and the euro right ?,Germanic,English
Ataraxia2320,europe,"Ottakring , Favoriten and Floridsdorf are often considered to be the the three \ '' ghettos\ '' of Vienna . What are ya on about ? \\n\\n",Germanic,English
Ataraxia2320,europe,"To be fair there are a lot of people to whom nationality and history means jack shit , and who would see the advantages to joining the UK . \\n\\nI am not one of them , but there are plenty of people out there .",Germanic,English
Ataraxia2320,europe,The whole city is super safe . You can feel that there was a bit more surface level drug dealing around margareteng\u00fcrtel/Thalia/Prater recently buy overall crime numbers are coming down I believe .,Germanic,English
Ataraxia2320,europe,Well excuse me for not having visited Paris by plane in the last year . I obviously must be part of some Reddit conspiracy .,Germanic,English
Ataraxia2320,europe,I cant say this has ever happened to me before and I have used a lot of public wifi . It beats roaming .,Germanic,English
Ataraxia2320,europe,SOON THE WORLD WILL BE OURS !,Germanic,English
Ataraxia2320,europe,South Korea and Japan getting absolutely devastated is also up there .,Germanic,English
Ataraxia2320,europe,Russia more prolific than China or the USA ? Sure ...,Germanic,English
Ataraxia2320,europe,"Foreign Policy magazine puts the size of China\\ 's \ '' hacker army\ '' at anywhere from 50,000 to 100,000 individuals . \\n\\nThe US has managed to turn every cell phone or computer in the world into a bug via the NSA . \\n\\nSaying that Russia has the edge on either country is disingenuous .",Germanic,English
Ataraxia2320,europe,Well southern Ireland was the name given to Ireland during home rule before the war of independence for one thing.\\n\\nFor another it just sounds ridiculous to any Irish person . Why not just call it Ireland ? Last time I checked this is what we are rendered to as by pretty much everyone except a few people from the uk .,Germanic,English
Ataraxia2320,europe,This is exactly how I see it too .,Germanic,English
Ataraxia2320,europe,"Better than people had anticipated , but very comparable to the uk ( if not worse ) .\\n\\nAt least they have the NHS there .",Germanic,English
Ataraxia2320,europe,I thought there was one standard minimum wage in Germany now ?,Germanic,English
Ataraxia2320,europe,"I wholeheartedly disagree . \\n\\nPeople from other cities bitch and complain , the majority of Vienese people are just arseholes pure and simple .",Germanic,English
Ataraxia2320,europe,It varies hugely from country to country .,Germanic,English
Ataraxia2320,europe,"Well the Republic of Ireland is a thing now so yes . \\n\\nDisclaimer : The IRA of today is not representative of the IRA from the troubles , just like that IRA is not representative of the IRA during the revolution and so on . \\n\\nhttps : //en.wikipedia.org/wiki/Irish_Republican_Army\\n\\nThere is a nice enough summary at the top of the page .",Germanic,English
Ataraxia2320,europe,Can you give me a source in regards to 85 % of asylum seekers committing crime in the first year ?,Germanic,English
Ataraxia2320,europe,"I\\ 'm in my late 20ies . \\n\\nI didn\\'t grow up here , and coming from a rough part of Ireland , I scrutinised Vienna when I arrived as it seemed like a paradise too safe to be true . I always asked people to show me the ghettos , the rough neighbourhoods , but never really found one . \\n\\nI also lived in one of the \ '' bad\ '' neighbourhoods ( 10th ) for 2 years with never seeing any trouble . It\\ 's still not bad on the grand scheme of things but there has been a noticeable difference , at least appearances wise ( I believe overall , crime statistics are on the decrease ) .",Germanic,English
