Ashihna,europe,hehe,Turkic,Turkish
Ashihna,europe,genius,Turkic,Turkish
Ashihna,europe,It was never great to begin with,Turkic,Turkish
Ashihna,europe,Better than yours,Turkic,Turkish
Ashihna,europe,"lmfao , nice source/website",Turkic,Turkish
Ashihna,europe,"& gt ; first of all the dhkp-c took responsible for the attack.\\n\\nThis is not true , you are straight up lying . Care to provide a source for your obviously bullshit claim ?",Turkic,Turkish
Ashihna,europe,It\\ 's not about having \ '' balls\ '' . It\\ 's about being not backwarded and irrational,Turkic,Turkish
Ashihna,europe,gypsy pls,Turkic,Turkish
Ashihna,europe,wan na dance ?,Turkic,Turkish
Ashihna,europe,"Western Leftists in a nutshell ( I know , not all of them are like that ) . \\n\\nThey tend to support every single minority/underdog organization that exists , because \ '' muh oppression\ '' , \ '' fuck the State\ '' \ '' they are just fighting for freddom\ '' , but actually have no fucking idea how fucked up these organizations in reality are . They support Hamas , they support PKK , they support FARC , they support IRA . These groups are listed as terrorist organizations for a fucking reason",Turkic,Turkish
Ashihna,europe,Good for you .,Turkic,Turkish
Ashihna,europe,shitty economy,Turkic,Turkish
Ashihna,europe,"You said yourself that civilians are a legit target in one of your past comments , so get the fuck off your moral high horse",Turkic,Turkish
Ashihna,europe,He looks like Gandi\\n\\nEDIT : Gandhi,Turkic,Turkish
Ashihna,europe,Atleast we have potato,Turkic,Turkish
Ashihna,europe,"And maybe also resurrect Atilla Khan while we are at it . World Domination , here we coooome !",Turkic,Turkish
Ashihna,europe,"Greece or Georgia\\n\\nEDIT : Oh shit , totally forgot Azerbaijan lol . Azerbaijan number one neighbour",Turkic,Turkish
Ashihna,europe,As if we want to ...,Turkic,Turkish
Ashihna,europe,"Sorry , but this will never happen .",Turkic,Turkish
Ashihna,europe,Come and get it,Turkic,Turkish
Ashihna,europe,"Erdogan is a wannabe Autocrat , while Putin already is a full blown Autocrat",Turkic,Turkish
Ashihna,europe,Russia going full retard,Turkic,Turkish
Ashihna,europe,me,Turkic,Turkish
Ashihna,europe,"Yea , because Afghanistan is so safe and peaceful .",Turkic,Turkish
Ashihna,europe,"Holy fucking shit , are you seriously saying Afghanistan and Iraq are now democracies ?",Turkic,Turkish
Ashihna,europe,"So what ? Just kill random people with full beards , because they may be collaborating with ISIS ? What the fuck ?",Turkic,Turkish
Ashihna,europe,lol k,Turkic,Turkish
Ashihna,europe,Iraq and Afghanistan are democracies now ?,Turkic,Turkish
Ashihna,europe,Then you guys did pretty fucking well ! The Iraqis and Afghanis are so damn free now . Congrats,Turkic,Turkish
Ashihna,europe,"Bahceli is one of the most pathetic politicians of Turkey , along with Erdogan . Fuck this country",Turkic,Turkish
Ashihna,europe,"Holy shit , that Vikings vs Mongols looks fucking awesome . Is this only in russian ?",Turkic,Turkish
Ashihna,europe,"People will probably chose the nation they hate the most . But sacrificing the country with the smallest population would be the right answer.\\n\\nSo , Vatican",Turkic,Turkish
Ashihna,europe,"A decision completely based on your emotions instead of rationalism . Well done , you just killed over 75 Million Humans .",Turkic,Turkish
Ashihna,europe,They are Islamists .,Turkic,Turkish
Ashihna,europe,& gt ; they send thousands of migrants illegaly on boats to Italy\\n\\nHave fun with them ( : I wish we would send more tho .,Turkic,Turkish
Ashihna,europe,"& gt ; Go back to dreaming about Erdogan you filthy turk\\n\\nNot sure why you think I like Erdogan , since all of my comments regarding him are against him . Looks like you have issues with reading comprehension . \\n\\nInstead of wasting your time on reddit go and work you lazy greek or mama merkel will punish you , you parasidic worm .",Turkic,Turkish
Ashihna,europe,Not everyone who is a nationalist is a fucking nazi .,Turkic,Turkish
Ashihna,europe,"I actually first wrote Ghandi , but then made it to Gandi lol",Turkic,Turkish
Ashihna,europe,Europe being Europe,Turkic,Turkish
Ashihna,europe,"sory no engrish only t\u00fcrk , no understanding gavurca",Turkic,Turkish
Ashihna,europe,Good for you .,Turkic,Turkish
Ashihna,europe,"Me too . Especially the fact that they still practise FGM , child marriages & amp ; honour killings . Very impressing indeed .",Turkic,Turkish
Ashihna,europe,How different is Afrikaan from Dutch ?,Turkic,Turkish
Ashihna,europe,"oh my god , \ '' gayreek\ '' lmfao , I totally remember those comments.\\n\\nBut the most hilarious thing was , when everytime there was a cringeworthy music video from Turkey , Turks on youtube and facebook used to make it seem like the song was greek , by writing comments like \ '' Nice greek song\ '' or \ '' Amazing song from greece\ '' etc . \\n\\nThose were the times haha\\n",Turkic,Turkish
Ashihna,europe,"& gt ; How is the Dutch accent silly ? \\n\\nIf you speak German , Dutch really can sound silly .",Turkic,Turkish
Ashihna,europe,"Yes , it is .",Turkic,Turkish
Ashihna,europe,"I don\\'t get it either . \\n\\nSome Arabic and Central Asian countries already said they are ready to increase the trade with Turkey , and would gladly take those goods if Russia doesn\\'t want them . Azerbaijan even said that as long as they have gas/oil , Turkey doesn\\'t need to worry . \\n\\nThese \ '' sanctions\ '' are going to hurt Russia much more than Turkey .",Turkic,Turkish
Ashihna,europe,I wish they were indeed that progressive ... \\n\\nEver been to the Kurdish areas in East Turkey ?,Turkic,Turkish
Ashihna,europe,"& gt ; Do you have any numbers on the distribution of Syrian refugees throughout Turkey ? \\n\\nhttp : //www.migrationpolicycentre.eu/docs/MPC-RR-2013-05.pdf\\n\\nPage 7 : \\n\\n & gt ; Meanwhile , the\\nnumber of Syrian refugees living outside the camps has increased , and now \\npossibly stands at more than 100,000 according to local estimates.\\n\\nThis report is from 2013 . The numbers today are much higher . \\n\\n",Turkic,Turkish
Ashihna,europe,"& gt ; Since Islamists seem to never get punished despite being surveilled.\\n\\nWhat the fuck are you talking about ? When Islamists break the rules , they go to jail . \\n\\n",Turkic,Turkish
Ashihna,europe,"What I also realized , is that there are lots of accounts posting here which were newly created . \\n\\nI think this sub needs a new rule that your account has to be atleast 2 months old and have a certain amount of upvotes to be able to post here . I think /r/SyrianCivilWar and a few other subreddits did that , in order to maintain the quality of the sub and to make it harder for alt-accounts .",Turkic,Turkish
Ashihna,europe,"And then Turkey decides to send 3 million refugees to Europe . Have fun with that , you genius",Turkic,Turkish
Ashihna,europe,"Yea , and ?",Turkic,Turkish
Ashihna,europe,True that . But **we** also have our own vision for Turkey . Erdogan just needs to fuck off first,Turkic,Turkish
Ashihna,europe,"We tried , we failed . We will raise again though .",Turkic,Turkish
Ashihna,europe,lmfao I actually had this rap song on my phone,Turkic,Turkish
Ashihna,europe,"& gt ; Because when the Ottoman Empire controlled the Mid east things were so much better right ? \\n\\nActually , yes . The ME under Ottoman Rule was indeed much better",Turkic,Turkish
Ashihna,europe,"Actually , yes . Not sure about free housing , but they do get free education and healthcare . They also get [ work permits ] ( http : //www.hurriyetdailynews.com/turkeys-granting-work-permits-to-syrian-refugees-published-officially.aspx ? pageID=238 & amp ; nID=93905 & amp ; NewsCatID=345 ) .\\n",Turkic,Turkish
Ashihna,europe,Russia will still keep denying though . \\n\\nRemember how they lied that there were no Russian Soldiers in Crimea and Ukraine . Or how they denied the downing of MH17,Turkic,Turkish
Ashihna,europe,And the lefts will steal from you ?,Turkic,Turkish
Ashihna,europe,"Lol , as if we care",Turkic,Turkish
Ashihna,europe,"So , thanks Turkey ?",Turkic,Turkish
Ashihna,europe,Then have fun with the refugees ! ( :,Turkic,Turkish
Ashihna,europe,"lol , the US and secular . Compared to Europe , you guys are still backwarded",Turkic,Turkish
Ashihna,europe,"nah , his vodka",Turkic,Turkish
Ashihna,europe,"lol , no .",Turkic,Turkish
Ashihna,europe,China is a very interesting place .,Turkic,Turkish
Ashihna,europe,Why does everything Russia touches turn into shit ?,Turkic,Turkish
Ashihna,europe,lol at the black eye hahaha,Turkic,Turkish
Ashihna,europe,U got a problem ?,Turkic,Turkish
Ashihna,europe,"Ukraine , the Baltics , Finland , the US , UK , NATO in general , and even Bulgaria said that Turkey did the right thing.\\n\\nThe only countries that showed support towards Russia were Serbia , Belarus , Iran and Syria .",Turkic,Turkish
Ashihna,europe,not really,Turkic,Turkish
Ashihna,europe,Can we join ? ?,Turkic,Turkish
Ashihna,europe,And you sound sooo educated,Turkic,Turkish
Ashihna,europe,"Classic ISIS supporting Turkey ^^/s\\n\\nFirst they warned France twice about the Paris attackers , and now this .",Turkic,Turkish
Ashihna,europe,"Thanks for your input , Slavic_Emperor . \\n\\n",Turkic,Turkish
Ashihna,europe,"So , hitler was a leftist ?",Turkic,Turkish
Ashihna,europe,it will be da bomb,Turkic,Turkish
Ashihna,europe,"& gt ; So your saying that killing children with shotguns is considered normal in Turkey ? \\n\\nyea , it\\ 's actually one of my favourite activities . \\n\\nlol no , what I meant with \ '' normal\ '' was that fucked up things happen on daily basis here ( like police/soldiers/etc getting killed ) . If something happens everyday , it\\ 's kind of normal , or not ? Like Suicide Bombings in Irak for example . Suicide bombings are wrong and not normal , but in Irak , it\\ 's normal , it happens on daily basis , and everyone is used to it . It happens every day . So it\\ 's considered normal for Irak ( but that doesn\\'t mean that this would also be considered normal for a different country ) . You know what I mean ?",Turkic,Turkish
Ashihna,europe,"Seeing how the top comments here are all straight up racist and coming from white Neo Nazi scums ( if you check their comment histories ) , yes , shit like this does rustle my jimmies . \\n",Turkic,Turkish
Ashihna,europe,"When Istanbul burns , Moscow burns too . \\n\\nYou have no fucking idea what you are talking about",Turkic,Turkish
Ashihna,europe,/r/europe is seriously going full retard sometimes,Turkic,Turkish
Ashihna,europe,"I couldn\\'t give a shit wether I am a European , a Turk or whatever ethnicity else . The entire concept of being proud of your heritage/\ '' race\ '' /nation is just absurd and extremely backwarded . And there are a shit ton of people here in this subreddit who still think like that . But the most absurd part of all this is , that many of these people consider themselves as \ '' progressive\ '' and \ '' liberal\ '' .",Turkic,Turkish
Ashihna,europe,How exactly is all this relevant to this thread ? ?,Turkic,Turkish
Ashihna,europe,Not sure if sarcasm or serious,Turkic,Turkish
Ashihna,europe,Because Turks,Turkic,Turkish
Ashihna,europe,I already did .,Turkic,Turkish
Ashihna,europe,You need some Love ?,Turkic,Turkish
Ashihna,europe,lol,Turkic,Turkish
Ashihna,europe,The border just has been opened . Stay classy /r/europe,Turkic,Turkish
Ashihna,europe,"Heey , my goat is pretty dope \\n",Turkic,Turkish
Ashihna,europe,"Here , have another one",Turkic,Turkish
Ashihna,europe,He asked first tho .,Turkic,Turkish
Ashihna,europe,"Sorry , but those Kurds who wanted to create a caliphate had the same ideology as the rest of the Jihadists . The only progressive Caliphate that existed was the Ottoman Empire , and that was because it was rather a Turkish Empire than Islamic .",Turkic,Turkish
Ashihna,europe,"& gt ; while I am a nationalist myself I don\\'t understand the phenomenon of having nationalism for a country you left.\\n\\nGenerally , immigrants tend to be more nationalistic and idiotic than the people in the countries they left . It\\ 's a phenomenon which can be easily explained , but I\\ 'm too lazy for that right now . I\\ 'm sure you can find a good article about that if you google it.\\n\\n & gt ; Keep that at home\\n\\nI agree . I\\ 'm not a fan myself of those immigrants , or \ '' Kanaken\ '' as you probably call them sometimes .",Turkic,Turkish
Ashihna,europe,Just like MH17 !,Turkic,Turkish
Ashihna,europe,"lol , i asked myself this too pretty often .",Turkic,Turkish
Ashihna,europe,& gt ; Turks in Space\\n\\nlmfao,Turkic,Turkish
Ashihna,europe,Never ever trust Russia,Turkic,Turkish
Ashihna,europe,Their population is already doing that . Look at their fucked up economy .,Turkic,Turkish
Ashihna,europe,& gt ; The UN predicts Sweden to be a third world country in 15 years\\n\\nlmfao,Turkic,Turkish
Ashihna,europe,If you watch the full video you will see that those \ '' peaceful\ '' Kurds were attacking random cars only because Turks were in it . You can even see them lynching an old Turkish guy on the street . The car who drove over them was just trying to protect himself and his family . \\n\\nYou can watch the full video here [ https : //np.reddit.com/r/Turkey/comments/3krqkp/more_proof_kurdish_fascist_pkk_terrorist_attack/ ] ( https : //np.reddit.com/r/Turkey/comments/3krqkp/more_proof_kurdish_fascist_pkk_terrorist_attack/ ),Turkic,Turkish
Ashihna,europe,Sure buddy,Turkic,Turkish
Ashihna,europe,Deport them to where they came from .,Turkic,Turkish
Ashihna,europe,"& gt ; a car deliberately drove into groups of Kurdish protesters in the Swiss city of Bern\\n\\nThe video is not showing the entire video . If you watch the entire video you will see that those \ '' peaceful\ '' Kurds were attacking random cars only because Turks were in it , while chanting \ '' Kill them kill them ! \ '' You can even see them lynching an old Turkish guy on the street . The car who drove over them was just trying to protect himself and his family . \\n\\nYou can watch the full video here [ https : //np.reddit.com/r/Turkey/comments/3krqkp/more_proof_kurdish_fascist_pkk_terrorist_attack/ ] ( https : //np.reddit.com/r/Turkey/comments/3krqkp/more_proof_kurdish_fascist_pkk_terrorist_attack/ )",Turkic,Turkish
Ashihna,europe,Russians or Persians,Turkic,Turkish
Ashihna,europe,"Damn , the Russians are butthurt . Poor poor Putin\\n\\n\\n",Turkic,Turkish
Ashihna,europe,Imagine the butthurtness of the Europeans when Turkey starts flooding the EU with hundreds of thousands of refugees . That would have been beautiful,Turkic,Turkish
Ashihna,europe,"I swear , some people are just straight up retarded",Turkic,Turkish
Ashihna,europe,lol sry,Turkic,Turkish
Ashihna,europe,"Imagine if Erdogan arms the Ukrainians , Chechens , Dagestanis etc . That would also be cool .",Turkic,Turkish
Ashihna,europe,"Nah , the other Europe",Turkic,Turkish
Ashihna,europe,NPD is still by far more stupid .,Turkic,Turkish
Ashihna,europe,"Maybe we should go back to Mongolia , resurrect Genghis Khan and then come back to Anatolia again .",Turkic,Turkish
Ashihna,europe,Where did he say such a thing ? ?,Turkic,Turkish
Ashihna,europe,Which local parties ?,Turkic,Turkish
Ashihna,europe,Entire sky is russian airspace,Turkic,Turkish
Ashihna,europe,More like Kurdish refugees .,Turkic,Turkish
Ashihna,europe,Yea buddy . Turkey is the sole reason for this clusterfuck . You fucking genius you,Turkic,Turkish
Ashihna,europe,Are you implying that Hitler was a Leftist ?,Turkic,Turkish
Ashihna,europe,"& gt ; There haven\\'t been any polls done by neither side.\\n\\nPKK doesn\\'t want polls , because it would most likely result in a \ '' Against Independece\ '' Majority , and they know that . \\n\\n",Turkic,Turkish
Ashihna,europe,Access to sea,Turkic,Turkish
Ashihna,europe,Russia is trying to destabilize entire Europe .,Turkic,Turkish
Ashihna,europe,It makes my dick hard . \\n\\n,Turkic,Turkish
Ashihna,europe,"& gt ; Russia sells weapons to both countries . \\n\\n & gt ; Russia is not just looking for peace , but is rather looking for some arrangement that maximizes their regional influence over both countries.\\n\\nClassic Russia",Turkic,Turkish
Ashihna,europe,Are you being serious ?,Turkic,Turkish
Ashihna,europe,Sure buddy : *,Turkic,Turkish
Ashihna,europe,Better than shooting down civilian aircrafts ; ),Turkic,Turkish
Ashihna,europe,"Yea , shooting down civilian aircrafts and annexing foreign land , what a leveled head !",Turkic,Turkish
Ashihna,europe,lmfao indeed my scottish friend so funny im dying right now wow i cant even u such a funny scott,Turkic,Turkish
Ashihna,europe,& gt ; If you read so many books you probably know that Hitler ideology has more in common with left ideology . \\n\\nlmfao . You just proved my point . Thanks,Turkic,Turkish
Ashihna,europe,A war between Turkey & amp ; Russia would cause a World War . \\n\\nUse your fucking brain before you spew such bullshit,Turkic,Turkish
Ashihna,europe,"lmfao , our navy alone is more powerful than the entire dutch military .",Turkic,Turkish
Ashihna,europe,& gt ; having an opinion = ignorance ? \\n\\nIgnorant opinions are ignorant . \\n,Turkic,Turkish
Ashihna,europe,"Hmmmm dead people , makes me feel warm and fuzzy .",Turkic,Turkish
Ashihna,europe,"Yea , because Germany is slowly becoming like Turkey . Every D\u00f6ner you eat turns you slowly into a Turk . Germany will be Turkey 2.0 in about 50 years .",Turkic,Turkish
Ashihna,europe,\ '' That will show em ! \ '',Turkic,Turkish
Ashihna,europe,"Except Turkey already warned Russia multiple times that they better stop with violating our Airspace or there will be consequences . A few weeks ago Turkey had even made a complaint to the UN that Russia keeps violating our Airspace . Turkey even sent the Russian ambassador back because of that . Russia still continued to behave like a retard , and finally got their jet shot down . And now Russia is whining . \\n\\n [ https : //i.imgur.com/Qllk7k1.png ] ( https : //i.imgur.com/Qllk7k1.png )",Turkic,Turkish
Ashihna,europe,& gt ; Turkish side Fenerbahce won 2-0.\\n\\n : D\\n,Turkic,Turkish
Ashihna,europe,It was just a factory accident ...,Turkic,Turkish
Ashihna,europe,Turkey is bombing PKK . Saying Turkey bombs Kurds is like saying the Anti-IS Coalition is bombing Arabs.\\n\\nPKK =/= Kurds,Turkic,Turkish
Ashihna,europe,And the Russians wonder why all the ex-soviet States hate Russia so much .,Turkic,Turkish
Ashihna,europe,I will bring raki . Then we can get really warm and drunk too : D,Turkic,Turkish
Ashihna,europe,The Armenian \ '' Genocide\ '' also happened during war .,Turkic,Turkish
Ashihna,europe,"Turkey bombs PKK positions in Northern Iraq , with the support of Iraqi Kurdistan Government .",Turkic,Turkish
Ashihna,europe,"We all are the same , including you ! ( :",Turkic,Turkish
Ashihna,europe,sure buddy .,Turkic,Turkish
Ashihna,europe,He was a Kurd with a Turkish citizenship .,Turkic,Turkish
Ashihna,europe,"Yeah , let the Neo Nazis freely roam here but fuck me , right ? This subreddit is seriously a fucking joke sometimes .",Turkic,Turkish
Ashihna,europe,"Assad too buys oil from ISIS , just sayin",Turkic,Turkish
Ashihna,europe,For what ? For not letting Russia freely abuse smaller nations ?,Turkic,Turkish
Ashihna,europe,Armenia has a Military ?,Turkic,Turkish
Ashihna,europe,"I agree . Their behaviour is just embarassing , but there is not much I can do .",Turkic,Turkish
Ashihna,europe,"& gt ; The Third World War began in earnest on November 23rd , 2050 with the Japanese coordinated assault on America\\ 's Battle Star Network and domestic air bases . The attack crippled the Alliance\\ 's space systems and allowed for Turkey to begin a wider assault on the Polish Bloc . and India.\\n\\n & gt ; Using what little air power remained , and bolstering their diminished space forces with secretly stockpiled satellite systems he US launched a series of strikes on Japanese air and naval bases on the home islands . For the next year Southern Europe would be invaded by the Turks who would eventually spread as far as southern Russia and Poland itself.\\n\\n & gt ; Desperate for aid , Poland begs the US to launch an attack directly on Turkey , but the US can not abide with its diminished forces . Working with the British , the US eventually is able to launch a devastating strike on Turkey , though taking heavy losses on their own side.\\n\\n & gt ; By 2052 Germany is approached by the Turks , promising them control over Eastern Europe while they promise to not spread farther than the Balkans . German enters the war with France and launches a western front against Poland . Attacked from all sides , the US is forced to send direct ground forces to the Poles via St. Petersburg meeting the Germans and the Turks to stop their advancement toward Warsaw . Scorched Earth Tactics by the Poles buy the Americans and British forces time to set up forward operations.\\n\\n & gt ; By 2053 the US has launched a new Battle Star network ( for now consisting of only a single next gen Battle Star ) , and a next-gen fleet of hypersonic UCAVs that level Coalition military forces . The Germans and French are pushed out of Poland , while the Turks are pushed back over the Carpathians and into the Balkans , while China and Korea expel the Japanese from mainland Asia . A hasty treaty is pushed through in Geneva ending the conflict , but granting Japan and Turkey their sovereignty , and Turkey a sphere of influence in the Islamic World . Poland is furious at the American refusal to destroy the Turks once and for all , but they are left with an empire close of their 17th century holdings . Britain now dominates a thoroughly stagnated Atlantic Europe . The most controversial section of the treaty is the article providing that only America will have access to militarize space , while other countries will only be able to have commercial activity.\ '' \\n\\nlolwat",Turkic,Turkish
Ashihna,europe,"Lol , you can\\'t compare EU with UDSSR . EU membership is on a voluntary basis , whereas Soviet Union was an imperialistic empire that forced other nations to \ '' join\ '' . EU is about democracy , free trade and peaceful co-existance . Soviet Union was none of those .",Turkic,Turkish
Ashihna,europe,"What are you talking about ? Turkey , Lebanon and Jordan have been dealing with a refugee problem for decades . Turkey alone has more refugees than entire Europe combined . European countries are the ones who are unwilling ( except Germany and Sweden ) .",Turkic,Turkish
Ashihna,europe,"& gt ; This policy is what will break the European Union.\\n\\nIt won\\'t . Everytime EU faced a crisis , people used to say this shit . For decades people have been saying \ '' EU will fail , EU will break , this will be EU\\ 's end etc.\ '' but what happened was that the EU even came out stronger out of these crises . \\n\\nEU won\\'t break because of a few million migrants .",Turkic,Turkish
Ashihna,europe,Assad used chemical weapons on his own people . Assad is not any better than ISIS .,Turkic,Turkish
Ashihna,europe,& gt ; Hurriyet AKA Erdogans PR newspaper\\n\\nlmfao . You have no fucking idea what you are talking about,Turkic,Turkish
Ashihna,europe,"me too . Sometimes , when I\\ 'm in the Metro , I wonder what would happen if I suddenly screamed \ '' Allahu Akbar ! \ '' while riding the metro . lol , I\\ 'd probably get beaten up",Turkic,Turkish
Ashihna,europe,& gt ; One turk drove his car through a group of kurds.\\n\\nAfter Kurds were attacking his car with metal bars .,Turkic,Turkish
Ashihna,europe,You are being absurd,Turkic,Turkish
Ashihna,europe,Lmfao . Most of those countries would never support Russia in case of a full scale war between NATO and Russia . You seriously think they would risk getting annihilated by the most powerful military alliance that ever existed ( NATO ) ? Why the hell would they choose to be on the weaker side ?,Turkic,Turkish
Ashihna,europe,Why are you shocked ? Never heard of Turkish Jews ? There has been even a Turkic-Jewish Empire/Khaganate in the past ( Khazar Khaganate ) .,Turkic,Turkish
Ashihna,europe,"& gt ; \ '' I and that other guy ( probably ) have been living in Europe for several years now but now i\\ 'm gon na go fuck him up because of his nationality , i.e . because of his place of birth.\ '' \\nDid i get this right ? \\n\\nNo , you didn\\'t get it right . \\n\\nThey are fighting because of this : \\n\\n [ https : //en.wikipedia.org/wiki/Turkey % E2 % 80 % 93PKK_conflict ] ( https : //en.wikipedia.org/wiki/Turkey % E2 % 80 % 93PKK_conflict )",Turkic,Turkish
Ashihna,europe,So ? You got a problem with that ?,Turkic,Turkish
Ashihna,europe,Why those statistics are utter bullshit : \\n\\n [ http : //www.theguardian.com/commentisfree/belief/2011/feb/11/islam-population ] ( http : //www.theguardian.com/commentisfree/belief/2011/feb/11/islam-population ) \\n\\n [ http : //blogs.reuters.com/faithworld/2011/01/27/will-pew-muslim-birth-rate-study-finally-silence-the-eurabia-claim/ ] ( http : //blogs.reuters.com/faithworld/2011/01/27/will-pew-muslim-birth-rate-study-finally-silence-the-eurabia-claim/ ),Turkic,Turkish
Ashihna,europe,"Why would you want to see your own country go to shit ? \\n\\nYou are no better than those immigrants you dislike so much , if not even worse .",Turkic,Turkish
Ashihna,europe,Can I have a link to that video ? Because no single newspaper ever mentioned a beheading .,Turkic,Turkish
Ashihna,europe,"It was PKK who broke the ceasefire , not Turkey .",Turkic,Turkish
Ashihna,europe,"Misleading title.\\n\\n\ '' Turkish\ '' in the sense that he was born in Turkey . Ethnically , he was a Kurd . He was born in Van ( South East Turkey ) , went to Kobane , and then came back from Kobane with a fake ID.\\n\\n",Turkic,Turkish
Ashihna,europe,I think you may have reading comprehension problems,Turkic,Turkish
