AJaume_2,europe,& gt ; Can the multikulti agenda please stop ? \\n\\nThere is no such agenda outside the fevered minds of the failed people .,Romance,Spanish
AJaume_2,europe,& gt ; I was under the impression\\n\\nthe powerful wanted you to be .,Romance,Spanish
AJaume_2,europe,"But the juridically linked Europe that has to assume taking refugees is the EU . Russia , Ukraine and Belarus have a total 200 millions inhabitants , but I doubt refugees are going there and are not for now legally linked to the EU to have to accept refugees .",Romance,Spanish
AJaume_2,europe,& gt ; In case you have not noticed far fewer people have died in Iraq since Saddam & amp ; sons have been taken out than died while they were in power.\\n\\nSource ? Note that while Saddam & amp ; sons were in power many Iraquians were killed by the USA and their allies .,Romance,Spanish
AJaume_2,europe,It is a possibility .,Romance,Spanish
AJaume_2,europe,"An ICBM , full spelling InterContinental Ballistic Missile , is too massive for the amour to matter , and an extremely expensive and unwieldy weapon against a ground vehicle .",Romance,Spanish
AJaume_2,europe,"& gt ; there should be a zero-tolerance policy to illegal immigration like most other countries on Earth.\\n\\nI thought you were a right winger , you confirm that . Then do not expect the people that you are indebted with to be any better . You , as an individual , lost your humanity .",Romance,Spanish
AJaume_2,europe,& gt ; there is a difference between illegal and legal migration correct\\n\\nMoney .,Romance,Spanish
AJaume_2,europe,"No , it is a very ordinary claim . Have you never seen the claims that France is at the end of her tethers ? I do , for some 50 years . All that TINA business . When people say that a country is in bad shape it is first and foremost that the wealthy are not getting as much as they desire . \\n\\nedit s/the desire/they desire/",Romance,Spanish
AJaume_2,europe,"& gt ; What consequences do you see today , still , in Greek society , from the junta.\\n\\nNot Greek but Spanish , so not exactly the same but a lot in common . The consequences are the whole economy disaster , as the political is far from what is needed to solve the present problems . The dictatorship destroyed the legitimacy of the state in the perception of the Greeks , the people that were in the upper rungs of the economy ladder are still there . They paid little in taxes , and they pay little in taxes , the lower rungs are those that have almost no possibility to avoid them , and see what they pay used to the profit of those on top .",Romance,Spanish
AJaume_2,europe,"& gt ; Fiscal union is essentially a legalized and formalized means to impose austerity on over-spending , deep-in-debts governments.\\n\\nI do not understand how you can write that . Probably because you do not understand the meaning . In a fiscal union transfers can be automatic , which s what is needed now .",Romance,Spanish
AJaume_2,europe,"& gt ; sending money away via imports and deficits.\\n\\nOnly via imports . Deficits are irrelevant here , what would relevant is *external borrowing* no matter how in surplus is the budget . Because external loans are imports .",Romance,Spanish
AJaume_2,europe,makes more sense .,Romance,Spanish
AJaume_2,europe,"Please , try to die and then tell me how much money is worth to you in that state .",Romance,Spanish
AJaume_2,europe,& gt ; go against the proscribed orthodoxy \\n\\nmay not mean what you thought . Or did you intend to say \ '' go against the forbidden orthodoxy\ '' ?,Romance,Spanish
AJaume_2,europe,"& gt ; I thought that NATO is about defence capabilities of its members , not appeasing Russia ? \\n\\nNATO is essentially about Russia .",Romance,Spanish
AJaume_2,europe,Like prostitution is really willful ...,Romance,Spanish
AJaume_2,europe,Like sexual abuse never happens in Western Europe by people that have no ancestor from outside ... Note also that prostitution is legal in some Western countries . My impression from other posts is that quite a few redditors are fine with it .,Romance,Spanish
AJaume_2,europe,& gt ; I wonder what happens when we have to keep bailing out countries in EU\\n\\nlike Finland ? \\n,Romance,Spanish
AJaume_2,europe,"& gt ; Why can not the grandfather/grandmothers in pension help raising the child ? \\n\\nBecause the grandparents live in another city , or country , and so are too far away ? or maybe they are still working themselves ( they might have had their offsprings when 20 something and if the offsprings have their own kids circa 30 , then 20+30=50 , less than the 65 years age at which one is more or less supposed to retire ) .",Romance,Spanish
AJaume_2,europe,"The first reference to business people is to Spanish ones . Imagine that D\u00edaz Ferr\u00e1n was the president of the CEOE , the business main association , and he has been implicated in a lot of mismanagements that make it hard to understand that he was kept in place for a long time .",Romance,Spanish
AJaume_2,europe,"& gt ; a military dispute \\n\\nis not the question , what matters here is that the US warship is a property of the USA . Like in /u/SavanaJeff example : \\n\\n & gt ; An Argentine warship was seized under this in Ghana a few years back\\n\\nAFAICT Argentine is in no military dispute .",Romance,Spanish
AJaume_2,europe,"what /u/23PowerZ says with Fukushima . A lot of voters were already against nuclear , and Fukushima made it a tsunami so Merkel changed her tune .",Romance,Spanish
AJaume_2,europe,"& gt ; But Germany has a balanced trade with the EU countries.\\n\\nNo so sure , as not all countries are equivalent .",Romance,Spanish
AJaume_2,europe,"A treaty is rather hard to get . You need another part , as you do not a treaty with yourself , and its approbation is not easy .",Romance,Spanish
AJaume_2,europe,The current situation is the fault of business people that are intrinsically incompetent . Now some aspects of the governance of the eurozone were designed by business people and too the economic policy . Join the dots .,Romance,Spanish
AJaume_2,europe,"Well , while there hardship for many in Spain , it is far from the situation in Romania , and , as for myself , I do not think the disappearance of the EU would be good neither for me nor for Spain .",Romance,Spanish
AJaume_2,europe,Is there something hard to fathom in the meaning of \ '' easiest clients\ '' ?,Romance,Spanish
AJaume_2,europe,A tsunami of votes . A joke on the fact that Fukushima was FUBAR because of a real tsunami in Japan . Germany sismicity is not very intense.\\n\\nhttps : //en.wikipedia.org/wiki/List_of_earthquakes_in_Germany # /media/File : Erdbebenzonen.png\\n,Romance,Spanish
AJaume_2,europe,You are aware that to vote in the USA one has to be a citizen and that is something illegal immigrants are not ? Are you aware that many of those \ '' illegal immigrants\ '' were living in there lands before there were USA and so are not in fact immigrant ? Are you aware that the Hispanic/Latino population in the USA is in its main part born in the country ?,Romance,Spanish
AJaume_2,europe,& gt ; Because in most cities with the medallion system \\n\\nIs that the case in Germany ? \\n,Romance,Spanish
AJaume_2,europe,"& gt ; I dont see why I , as an individual , should not be allowed to take people with me and charge for that , \\n\\nand who will assume the responsibility in case of accident ?",Romance,Spanish
AJaume_2,europe,Is that satire ?,Romance,Spanish
AJaume_2,europe,& gt ; No country needs immigrants.\\n\\nNo country ever needed English people outside of England .,Romance,Spanish
AJaume_2,europe,Only for cosmetic purposes .,Romance,Spanish
AJaume_2,europe,& gt ; a filter system to cease the censorship.\\n\\nTo most of the people here filtering is censoring .,Romance,Spanish
AJaume_2,europe,"To be sure , this is the main context in which we can make measurable samples .",Romance,Spanish
AJaume_2,europe,"& gt ; How do you wind up in European parliament and not know English like it is your first language.\\n\\nI suspect that most MEP do not handle English like their first language , English is not that useful as some make it .",Romance,Spanish
AJaume_2,europe,Probably too hot.\\n,Romance,Spanish
AJaume_2,europe,& gt ; Laws are able to che changed . \\n\\nI\\ 've often seen that law change is done mostly in benefit of the wealthiest.\\n\\n & gt ; Standards can be implemented for Uber and similar services.\\n\\nWhat makes it certain that the new standard will be better for workers ? The neoliberal \ '' deregulation is good\ '' mantra does not fill me with optimism.\\n,Romance,Spanish
AJaume_2,europe,"When I entered Reddit , /r/Europe was a nice place to learn and discuss , but the present circumstances have brought to the surface the evil present in many .",Romance,Spanish
AJaume_2,europe,"& gt ; \ '' Well , by definition half of the population has an IQ under 100.\ '' \\n\\nYes.\\n\\n & gt ; \ '' Proof immigrants has low iq\ '' \\n\\nNo , as the fact that IQ extrapolated , not directly measured , for a country is not directly related to the IQ of emigrants from those countries.\\n\\n & gt ; \ '' IQ doesn\\'t matter\ '' \\n\\nFalse and distorted , it says little if any about the goodness of people . I have no reason to doubt of the high IQ of the British doctor that murdered over 200 people in the UK.\\n\\nSo in fact no matter how high \ '' is\ '' the IQ of your country , it is not your own IQ , and given what you\\ 've written there is reason to think you are not a good individual .",Romance,Spanish
AJaume_2,europe,"& gt ; what does Ireland have in common with Chechnya but not New Zealand ? \\n\\nWhy care ? There the UK , France , Germany , Netherlands , Spain , Denmark , Portugal , Sweden , Italy , ... Chechnya is no more relevant than the Spanish part of the Basque country , which is both wealthier and nearer .",Romance,Spanish
AJaume_2,europe,"Say that to the other guy , which is not /u/doctorheredoctor .",Romance,Spanish
AJaume_2,europe,Half of it taking the USA as reference . Healthcare spending in the USA is about double European one in GDP terms.\\n,Romance,Spanish
AJaume_2,europe,"& gt ; running colonies where famines killed millions more.\\n\\nthe UK is known for that , who else to you have in mind ?",Romance,Spanish
AJaume_2,europe,"& gt ; how bad the current emission test procedures are.\\n\\nWell , the test were not designed with the idea that there would be an intent to deceive them from the car producers . It is standard procedure to claim that criticizing management is \ '' socialism\ '' and so uncouth.\\n",Romance,Spanish
AJaume_2,europe,"If a passenger is hurt , you will have a very big problem.\\n",Romance,Spanish
AJaume_2,europe,"In fact Greece had a higher rate of interest , as she was considered a risky investment , and while entry in the Euro might have meant a reduction in those rates , the knowledge should have been there . The lender were acting recklessly .",Romance,Spanish
AJaume_2,europe,"Well , you say salary , which I understand mean someone in the roll of a business , the example is for a free-lancer or autonomous worker .",Romance,Spanish
AJaume_2,europe,"& gt ; Before Muslim fundamentalism , it was Arab nationalism.\\n\\nAnd since it clashed with the interest of the western powers , these did try to squash Arab nationalism , and like Israel against the PLO helped Hamas because they were \ '' religious\ '' , they helped the most backwards of Arab states , like Saudi Arabia . Etc .",Romance,Spanish
AJaume_2,europe,& gt ; but can you please stop calling us racist for not wanting to deal with this shit when we still have that choice ? \\n\\nNo .,Romance,Spanish
AJaume_2,europe,"They could get better things of these you list , that does not make them unable to keep going .",Romance,Spanish
AJaume_2,europe,"Fact is , yes . The bosses want high unemployment to contain wages .",Romance,Spanish
AJaume_2,europe,Were they in a plane at 7000+ feet and shooting from a military rifle ?,Romance,Spanish
AJaume_2,europe,"If that is your reading comprehension , you must have some serious brain lesion . I rather side with the idea that you are the typical right wing lowlife or some crook .",Romance,Spanish
AJaume_2,europe,"Of these you list , two are not like the rest.\\n",Romance,Spanish
AJaume_2,europe,& gt ; Companies and private organizations have spontaneously created currencies before.\\n\\nThey were not managing a country economy . Printing is the easy part .,Romance,Spanish
AJaume_2,europe,"The underrating is causal to the experience . If you were to go in the interior of Majorca you could get a similar experience ( well not those related to the coast , unless in the North-West coast as it is rather inaccessible for now ) .\\n",Romance,Spanish
AJaume_2,europe,"And the Austerians have only been wrong . Well , if they were honest , which is honestly not something I can be sure .",Romance,Spanish
AJaume_2,europe,"Well , the roads to get there are pretty poor , and it is not populated .",Romance,Spanish
AJaume_2,europe,Simply it is the original sense of the word . So you can have a king presiding a reunion .,Romance,Spanish
AJaume_2,europe,"& gt ; While the first one showed growth , we can easily relate it to tourism\\n\\nNot that much , as the last data are for 2Q , tourism season is mostly 3Q .",Romance,Spanish
AJaume_2,europe,to share the profits . Where do you think the smugglers want to sell ? Gibraltar ? Not enough people for that to be profitable .,Romance,Spanish
AJaume_2,europe,"& gt ; lot of people would not be to happy about this post\\n\\nSince when happiness of readers mattered ? There are a lot of hive post that are very annoying , never seen you protest them .",Romance,Spanish
AJaume_2,europe,& gt ; The boys would be in their early eighties\\n\\nCould be late seventies,Romance,Spanish
AJaume_2,europe,The best way to decentralise is to make sure nobody has more than a million at thirty years old .,Romance,Spanish
AJaume_2,europe,The UK is one of the creators of HR . That others agreed to them does not makes it a foreign policy.\\n\\n,Romance,Spanish
AJaume_2,europe,The law is for the little people . The rulers are exempt of it.\\n,Romance,Spanish
AJaume_2,europe,"Being that HR are not established by EU , it is clear that UK voters are ignorant of what they vote .",Romance,Spanish
AJaume_2,europe,"Influence might be useful , but I fail to see it as a need .",Romance,Spanish
AJaume_2,europe,"Of course , your own is more than enough .",Romance,Spanish
AJaume_2,europe,"According to OECD^ ( 1 ) Poland has more homicide than UK , Germany , France or Sweden . Belgium is another matter.\\n\\n^ ( 1 ) http : //www.oecdbetterlifeindex.org/topics/safety/",Romance,Spanish
AJaume_2,europe,"& gt ; Greek and Albanian being linguistic brothers.\\n\\nSource ? I think that now Albanian is considered to be Indo-European , like Greek , but not a close parent .",Romance,Spanish
AJaume_2,europe,"& gt ; In one of these classes , he basically taught kids that playing or listening to music would transform them into pigs.\\n\\nWhich is strange since Islamic countries have all music and songs .",Romance,Spanish
AJaume_2,europe,"Facial veil can have a protection value where there is sand and wind^ ( 1 ) . And if you have got an exotic fairskinned wife it may be convenient to avoid sunburns . Remember that until recently , in Europe paleness was very valued , as it was a proof of pertaining to nobility , or accommodated class , that had not to work in the sun.\\n\\n^ ( 1 ) See a Touareg , a man in this case : https : //blogmuchomasqueunviaje.files.wordpress.com/2014/11/tuareg.jpg",Romance,Spanish
AJaume_2,europe,Kind of Kosher culture : One of the major dietary laws that observant Jews keep of Kashruth is that dairy and meat may not be eaten at the same meal . Pretty problematic in a school setting .,Romance,Spanish
AJaume_2,europe,"While I enjoy the fantasy of SW , my favorite , if utopic , is ST. As for the present politics , I find B5 to be more on point .",Romance,Spanish
AJaume_2,europe,AFAIK Daesh has not stringent criteria of admission of the kind any military has .,Romance,Spanish
AJaume_2,europe,"& gt ; When European depositors opened accounts they were told they were insured . \\n\\nIn the country where the branch operated , as the bank pays the state to operate there . So branches in the UK were to be bailed by the UK , etc . Of course that does not cover risky operations , but these are never covered . Deutsche Bank operates in Spain , so is I put money in an ordinary account , I will be covered by the Spanish state , not by the German state .",Romance,Spanish
AJaume_2,europe,Giving assurance to drug traffickers that they are welcome ?,Romance,Spanish
AJaume_2,europe,Just like if you buy shares .,Romance,Spanish
AJaume_2,europe,"Then nationalise the banks . And put the management in prison . Banking might be necessary , the individual bankers are not .",Romance,Spanish
AJaume_2,europe,"At present , and 2016 is not that far away in time , the disparity in income and wealth make that rather dubious . Too high for some , and possibly less than local rate in other , and then , who would collect it ? States depend in a significant part on VAT collected in their territory , allowing another entity to get that money would not be welcome . Since the EU gets a cut on VAT , it might be the one to collect , but would that collected amount be reduced from which state apportation ?",Romance,Spanish
AJaume_2,europe,What does Russia **need** from out of her territory ?,Romance,Spanish
AJaume_2,europe,"The incompetence of you government is no such a thing , but an expression of the fact that you , as a people , lack understanding of real life . You are slowly transitioning into a neo feudal order .",Romance,Spanish
AJaume_2,europe,For real ?,Romance,Spanish
AJaume_2,europe,"That\\ 's why I wrote \ '' **if they were honest**\ '' . Anyways , the economy do not rise because of austerity .",Romance,Spanish
AJaume_2,europe,"So what you claim would only apply to them . And it seems that this right to vote is limited to local elections , not to country parliament elections . In that case they do not affect the government .",Romance,Spanish
AJaume_2,europe,"& gt ; It would be a great idea if we had a similar standard of living in all countries.\\n\\nIf it was , then we would get the same same standard all over the world . That is , for dimwitted individuals , when places from where people get away get empty enough , then local standards raise.\\n",Romance,Spanish
AJaume_2,europe,Complete democracy does not equal to referenda . The world of Popper is not the world where we live .,Romance,Spanish
AJaume_2,europe,"& gt ; The genocide only ended when USSR supported Vietnam invaded.\\n\\nPeople tend to forget that . And what you said before , that the Khmer rouge only got power because of the USA .",Romance,Spanish
AJaume_2,europe,"These people should try to live outside their air conditioned offices , and look at the real life where people seek the highest return on investment , and that means that an awful lot will send their money where , in the past , returns were solid . So an Italian will rarely invest in Spain or Portugal , but UK and Germany . Etc .",Romance,Spanish
AJaume_2,europe,"& gt ; why is his wife a redhead ? \\n\\nNorthern Africa was invaded by Vandals^1 and other German tribes at the end of the western Roman empire . Then during the Muslim period of Spain there might easily have been redheads and blonds individuals going from al-Andalus to al-Maghrib ( both men and women , it is said that Abderrahman III was a blond blue eyed individual , and to play the part of a Moor he tinted black his hair or beard ) , then there were the expulsion of the Moriscos in 1609 . Add slaves from Eastern Europe , and the probability of redhairs and blonds is quite high . Then there are tints.\\n\\n^1 Andalusia is supposed derived from Vandal , as Vandals came from there .",Romance,Spanish
AJaume_2,europe,In Spain we have a similar situation .,Romance,Spanish
AJaume_2,europe,& gt ; Blacks in USA going crazy ... \\n\\nBlacks killed by police without justification ...,Romance,Spanish
AJaume_2,europe,"& gt ; And then you wont have missed vat payments or tax avoidance.\\n\\nMissing them is a feature , not a bug . : ) \\n\\nMore seriously , if the account is empty and with no perspective of filling it , it is irrelevant that there is any e-banking ( note that to most people that would be an additional expense ) .",Romance,Spanish
AJaume_2,europe,"& gt ; s one man and one woman dead , another man taken to hospital in critical condition , incident apparently happened in the house-wares section\\n\\nmight easily be a crime of jealousy .",Romance,Spanish
AJaume_2,europe,So you do not understand sarcasm . Nice .,Romance,Spanish
AJaume_2,europe,Invoking Godwin rule does not equate knowing its meaning .,Romance,Spanish
AJaume_2,europe,"As far I am concerned the guy **is dr Strangelove** , as he is as deeply crazy even if in a different way . The world is a worse place because of him .",Romance,Spanish
AJaume_2,europe,& gt ; prevents the operation of rival browsers\\n\\nNote that most people are not able to do these things by themselves .,Romance,Spanish
AJaume_2,europe,Because many of these problems were thown on them ?,Romance,Spanish
AJaume_2,europe,"& gt ; Economic realities \\n\\nPolitical realities , or power relations as that is basically the same .",Romance,Spanish
AJaume_2,europe,& gt ; I doubt Americans just shoot any policeman who turns up at their door.\\n\\nRather USA citizens are shoot by their police .,Romance,Spanish
AJaume_2,europe,So you are OK with the people that join Daesh .,Romance,Spanish
AJaume_2,europe,"& gt ; Then I realise I am reading the Telegraph and it all makes sense.\\n\\nThat . To be sure that is an ad hominem , but I concord with you .",Romance,Spanish
AJaume_2,europe,Says a pawn .,Romance,Spanish
AJaume_2,europe,So you can not do math .,Romance,Spanish
AJaume_2,europe,"& gt ; then is it the fault of the loaners for giving the money they asked for ? \\n\\nFact is , yes . The term moral hazard refers to lenders no less tan borrowers . AFAICT , Greece paid a premium on her loans , that premium can rationally be considered an insurance against default , so banks calling to be paid in full are being dishonest .",Romance,Spanish
AJaume_2,europe,"& gt ; the local population wants independence but it is still part of Spain.\\n\\nWell , the people of England do not want independence but they are still part of the UK . And OP has used England and not UK . And what with Switzerland and Netherlands cities , as they might be in different cantons/provinces or whatever they call them .",Romance,Spanish
AJaume_2,europe,But that is what your boss want . So better comply or be fired .,Romance,Spanish
AJaume_2,europe,I\\ 've always wondered about the \ '' naranjo\ '' part of the name .,Romance,Spanish
AJaume_2,europe,Lucky you . What if it was take one more coffee ? Do another hour of work ? etc .,Romance,Spanish
AJaume_2,europe,"For those that are not aware , Iglesias gave a \ '' Game of Thrones\ '' set to the King in a previous meeting.\\n",Romance,Spanish
AJaume_2,europe,With the rest of the PP .,Romance,Spanish
AJaume_2,europe,Did the politicians said they intended to get the country into unpayable debts ?,Romance,Spanish
AJaume_2,europe,"No , because it would be like writing \ '' London , Wales\ '' . Now OP should have wrote \ '' Santiago , Galicia\ '' and \ '' Valencia , Valencia\ '' to keep symmetry .",Romance,Spanish
AJaume_2,europe,"& gt ; If people vote for politicians who choose borrowing over taxation to fund public services and benefits\\n\\nis a fallacy , they borrowed to finance big projects , most of them useful to the business class . Public services and benefits are already paid by the people .",Romance,Spanish
AJaume_2,europe,"Oh , boy ! Let me say I disagree .",Romance,Spanish
AJaume_2,europe,How multicultural was Nazi Germany ?,Romance,Spanish
AJaume_2,europe,So you need to be assaulted by \ '' white\ '' people . And put in prison if you survive and complain .,Romance,Spanish
AJaume_2,europe,Many Europeans are goose-steppers .,Romance,Spanish
AJaume_2,europe,& gt ; Remember vacuum cleaner ban over 1600W ? \\n\\nSo you are a dumb individual that lack understanding .,Romance,Spanish
AJaume_2,europe,Every intervention since the end of the dictatorship has been in the direction of suppressing workers rights . I would say that that is real political bias .,Romance,Spanish
AJaume_2,europe,I would concede it if people decided that the structural part to change is the part of employers . But I doubt it very much . So no .,Romance,Spanish
AJaume_2,europe,"No . They may be often called ignorant of geography , but that confusion is found outside the USA too .",Romance,Spanish
AJaume_2,europe,"& gt ; when antifa was more or less created by the labour party , i\\n\\nSource ? \\n",Romance,Spanish
AJaume_2,europe,"In 2013 , according to Eurostat , over 1.5 millions people came from outside the EU.\\n\\nsource : http : //appsso.eurostat.ec.europa.eu/nui/submitViewTableAction.do",Romance,Spanish
AJaume_2,europe,"Of course , you have to live within your means./s",Romance,Spanish
AJaume_2,europe,to get a perspective on the priors of /u/Heraker .,Romance,Spanish
AJaume_2,europe,Rather public debt equals private savings .,Romance,Spanish
AJaume_2,europe,\ '' You\ '' is not about the individual that post under /u/Ownage4you .,Romance,Spanish
AJaume_2,europe,-1 reform by itself is an empty word . As postulated by people like you it really is a run to the bottom for workers .,Romance,Spanish
AJaume_2,europe,& gt ; \ '' full employment\ '' -- it means the economy is stagnating.\\n\\nonly in the sense that you can not go over 100 % of use of resources .,Romance,Spanish
