Ashihna,europe,hehe,Turkic,Turkish
BloodForTheSkyGod,europe,"That is a silly argument . That\\ 's like saying Turkey never existed before 1923 , because there was Ottomans before . Spain should cede back it\\ 's territories off the coast of Morocco and GB should give back Gibraltar . And none of this has much to do with \ '' having it first\ '' , but more to do with countries national security .",Turkic,Turkish
BloodForTheSkyGod,europe,"Sevda was imported from Turkish into Greek and other Balkan languages . It originally comes from Arabic \ '' swd\ '' root . Which means melancholy and black bile . Which is funny , because Melancholy comes from Greek Melas+Khole , which literally means black bile . It seems that black bile was associated with melancholy/romance in these cultures . Portuguese also have a word and a music genre centered around it , \ '' soudade\ '' . I think it means longing for someone which is close to sevda\\ 's meaning . I do not know , however , if the two are related somehow .",Turkic,Turkish
BloodForTheSkyGod,europe,"Thank you for your kind words , I really appreciate it .",Turkic,Turkish
BloodForTheSkyGod,europe,"This is the best explanation , sadly for my country .",Turkic,Turkish
BloodForTheSkyGod,europe,"Not really , they don\\'t speak Albanian because their most recent Albanian ancestors lived 100+ years ago . They\\ 're not recent immigrants , most of them probably emigrated before the Republic was founded . Kind of like how Italian Americans speak English rather than Italian.\\n\\nAlso , recently , government gave the option to families to choose their English language as a second foreign language to be taught to their children , provided that at least three families opts for that option . However , I don\\'t think many families chooses Albanian to be taught to their children . \\n\\nThe reason is simple , Albanians aren\\'t concentrated in one area , which means there are often not many Albanians in one classrom . Also , even if some of them want to learn Albanian , it won\\'t be helpful to them since they will rarely see any Albanian speaker in their hometown.\\n\\nIt is sad , I really dislike people who just don\\'t bother to learn their ethnic language , but it\\ 's not entirely the state\\ 's fault . Turkey should have done much more to preserve local languages , but many ethnic minorities didn\\'t push for it either . \\n\\nThe saddest case is the Circassians . Many languages from that area face imminent extinction , and the younger generations don\\'t bother learning them . \\n\\nAbout the schools part , I couldn\\'t disagree more . Turkey passed the \ '' Tevhidi Tedrisat Kanunu\ '' , which could be translated as \ '' Unity in Education Law\ '' , early on in 1924 . Before that , there were religious schools , secular schools , schools of non Muslims , schools funded by Western countries . This made the whole education system a mess , every school system having a different curriculum and an agenda . Schools of non Muslims left a bitter memory in the minds of Turks , when they celebrated the occupation of Anatolia before our War of Liberation , and the religious schools too , when they tried to suppress the Liberation War in favor of the Sultan . Atat\u00fcrk closed the religious schools and brought every school under one secular education system . This law is still present today , which means nobody is getting a school for his own . This isn\\'t the problem though , as I said , the problem is not providing them with proper education of their English languages , and the younger generation\\ 's simply lack of interest .",Turkic,Turkish
BloodForTheSkyGod,europe,These German warplanes fly out of Incirlik base though .,Turkic,Turkish
BloodForTheSkyGod,europe,They were on vacation just like the Russian soldiers in Donbass .,Turkic,Turkish
BrokenStool,europe,im down for this make a sub so we can post there after we add to the chain,Turkic,Turkish
BrokenStool,AskEurope,yet ( \u0361\u00b0 \u035c\u0296 \u0361\u00b0 ),Turkic,Turkish
BrokenStool,europe,Do you copy paste these or write them 1 by 1 ? \\nooh shit kurds are indepent strong warriors who dont need no fascist turks you have changed my opinion \\ndont you have something better to do ?,Turkic,Turkish
BrokenStool,europe,wuut you cray its invented in the ottoman empire,Turkic,Turkish
BrokenStool,europe,then bend over i will give it a shot ( \u0361\u00b0 \u035c\u0296 \u0361\u00b0 ),Turkic,Turkish
BrokenStool,europe,please,Turkic,Turkish
BrokenStool,europe,i thought this was a parody but its not i guess why would a greek support the pkk so fanatically anyway lol,Turkic,Turkish
BrtGP,europe,Norway is between Netherlands and \u0130stanbul,Turkic,Turkish
BrtGP,europe,Turkish army was involved in Korean war . After the war Turkey got their NATO membership .,Turkic,Turkish
BrtGP,europe,Russia probably does,Turkic,Turkish
Bulezau,europe,Muslims be creative and shit,Turkic,Turkish
Bulezau,europe,Turk in Poland . Not exactly true .,Turkic,Turkish
Bulezau,europe,"There is this 24 hour kebab stand called \ '' U SZWAGRA\ '' on Zwierzyniecka street I think . They don\\'t only make kebabs . They make the best Zapiekanka as well as bunch of other things.\\n\\n [ This ? ] ( https : //www.google.pl/maps/ @ 50.0563485,19.9291594,3a,75y,303.61h,67.87t/data= ! 3m4 ! 1e1 ! 3m2 ! 1s64BFUGbOhhEM54a18NcKfg ! 2e0 )",Turkic,Turkish
Bulezau,EuropeanFederalists,You could join the Young European Federalists or a similar group .,Turkic,Turkish
Bunny_Killer,europe,"Yay , I get to see how much you guys hate me .",Turkic,Turkish
Bunny_Killer,europe,No they are not .,Turkic,Turkish
Bunny_Killer,europe,I was thinking the same exact thing . Lets fix it .,Turkic,Turkish
Bunny_Killer,europe,History is really repeating itself .,Turkic,Turkish
Bunny_Killer,europe,But seriously how come you not part of Spain ?,Turkic,Turkish
Bunny_Killer,AskEurope,I\u015fkembe . Chopped cow stomach pieces in a soup with vinegar and garlic . It smells so bad . I hate it.\\n\\nWe also have Kokore\u00e7 which is seasoned lamb intestines chopped up to be served with bread . ' } \n '',Turkic,Turkish
CInk_Ibrahim,europe,"& gt ; Russia , Turkey , and Spain have close to no representation , \\n\\nHmm , if we had 2 in a thousand which is close to middle , we would have 150000 users . Wow , it sounds awful . When so many Turks gather in one place , it quickly becomes a miniature of youtube comment section.\\n\\n\\n",Turkic,Turkish
CInk_Ibrahim,europe,"& gt ; Having it as a museum is by no means disrespectful to you . If anything it\\ 's a compliment and that\\ 's the kind of thing people respected Kemal for . How is it disrespecting to you by having it as a museum exactly ? Because you pass on a great opportunity to flaunt your dominance over a great monument ? \\n\\nWhen Istanbul was occupied after the WW1 , christians ( both local and foreigners ) flocked to Hagia Sophia , trying to pray inside . Again and again they got permissions and support from British and pressured Ottoman Administration . They did this despite it being clear that it was a mosque and the Imperial Mosque at that . They came to our lands and spit on our face ( figuratively ) . Yes , giving respect and forgiving those that disrespected you is a virtuous action and deserves respect . BUT doing it at the expense of your ancestors and people is anything but virtuous . I consider the situation of Atat\u00fcrk making it a museum suspect and do not believe he did it with full knowledge . If he actually did it then he should be ashamed and I would consider such an action as unbefitting for someone like him.\\n\\n & gt ; As far as i know mosques in Greece or Bulgaria aren\\'t turned into churches.\\n\\nThey were simply destroyed outright or left to disrepair ( for much of Ottoman heritage in Balkans , leaving it is same as destroying them ) .\\n\\n & gt ; On the other hand , Turkey is not only trying to turn Hagia Sophia into a mosque , it has already done this with other churches but we\\ 're not talking about that . \\n\\nIt is already a mosque.\\n\\n & gt ; We\\ 're talking about Hagia Sophia because it\\ 's a huge monument that you could preserve as a museum unlike what you\\ 're doing with other churches.\\n\\nWe can also preserve it as a mosque and my people can go and feel the same things as their ancestors did . I fail to see how using it as a museum is preserving anything . Taking it and turning it into a zoo ( not much different ) only preserves building and nothing else . Culture is something that lives , and continuing traditions for centuries while keeping to their original meaning is the thing we should do . There are traditions around Hagia Sophia that we still know and can save before it is too late.\\n\\n & gt ; That\\ 's gold considering the Ottoman Empire used the Parthenon as a gunpowder storage and was half responsible for the single greatest of our monuments getting blown the fuck up.\\n\\nI won\\'t say we cared about your heritage , we didn\\'t . For us it was same as any building . And that explosion also caused deaths of hundreds of people but I guess it was our fault for using \ '' gunpowder storage\ '' . I can understand that it was negligence but it was certainly not on purpose . Many many sites made by Greeks still exists and slowly restored . We don\\'t destroy them because \ '' muh evil Greeks\ '' . \\n\\n & gt ; Name one Ottoman mosque of the scale of Hagia Sophia in the balkans for me please . Don\\'t tell me about random irrelevant mosques cause we\\ 're not telling you about random irrelevant churches in Turkey either . We\\ 're talking about something the size and importance of Hagia Sophia.\\n\\nI thought it was about history and culture but as you clearly show it is about symbolism . Those \ '' random irrelevant\ '' mosques are part of our history and they are the \ '' history and culture\ '' of Turkish people . Funny how you disregard them because of their size . And yes , I realize you don\\'t give a shit about neither your own \ '' history and culture\ '' or ours , it is all about \ '' size and importance\ '' aka its symbolic value . Had you actually cared about it , you would have spoken about hundreds of Greek historical sites that are actually in danger unlike Hagia Sophia . But no , not even 1/1000th care is given to them . And that is exactly my point about you people being hypocrites . We are honest about what we are , we will continue to be so.\\n\\n & gt ; Honestly it\\ 's pointless to debate with someone that sees the Hagia Sophia as a spoil of war and as a \ '' trophy\ '' of conquering another civilization\\ 's city . You have zero respect for the building , for you it\\ 's only something to fuel your warmongery . \ '' Look what we took from you ! It\\ 's ours now and it\\ 's a mosque ! Suck it ! \ '' It fully shows what i meant about the kind of message you\\ 'd be sending out . It\\ 's sad really.\\n\\nYes , I am completely open about it . We will continue to remind those who claim what is ours , that they will never have them.\\n\\nI actually respect many Greeks because they are wary of us for correct reasons , unlike other europeans who do so because of racism.\\n\\n -- -- -- -- -\\n\\nTBH we can continue this back and forth forever . Result will be this ; if you want to be respected , first deserve it by actions . You can start by giving us an equal \ '' goodwill\ '' action instead of demands and shit . Considering the \ '' size and importance\ '' of Hagia Sophia , you should start with restoring at least a hundred Ottoman sites ( mosques , shrines , tombs , etc . You know \ '' random\ '' , \ '' irrelevant\ '' , etc . Should be easy . ) . Then we can talk about respect.\\n",Turkic,Turkish
CInk_Ibrahim,europe,"Cahil : uneducated , without knowledge\\nAnadolu : anatolia\\n\u00c7omar : someone who is rude , aggressive and without manners . ( Also herding dog ) \\n\\nResult : Anatolian redneck",Turkic,Turkish
CInk_Ibrahim,europe,& gt ; \u201cKazakh Yeli\u201d\\n\\nThat sound cool . I wish we could change ours to T\u00fcrkeli or O\u011fuzeli .,Turkic,Turkish
CInk_Ibrahim,europe,"& gt ; can become a mosque if the owner ( which I guess it\\ 's the Turk State ) decides to do so.\\n\\nActually the state doesn\\'t have the ownership of Hagia Sophia . It is still owned by the waqf ( fund ) created Mehmet II the Conqueror . He put Hagia Sophia under his private ownership after the conquest instead of the state ownership . State barely have any right to manage Hagia Sophia and its estates and can only do so because all wakfs were put under collective management . Technically all those wakfs are still required to keep to the will of the person that created the wakf . And AFAIK it specifically states Hagia Sophia is to be used as a mosque.\\n\\nIn addition , the order from the council of ministers which decided change to museum is also suspect . The signature wrote \ '' K.Atat\u00fcrk\ '' but was signed before Mustafa Kemal\\ 's got the Atat\u00fcrk surname legally . ( Something like that . [ Here is a discussion about it if you know Turkish ] ( https : //www.youtube.com/watch ? v=KvR9q_Bbssk ) . Warning : It is long ) \\n\\nSo Hagia Sophia is still legally a mosque but people are \ '' illegally\ '' prevented from prayers . Though it being used as a museum is not actually exclusive of it being used as a mosque.\\n\\nTo add to this no one other than Turks has any right to speak against our decision . Orthodox Christians could have some justification to ask for a goodwill but they lost it after what they have done to mosques/masjids/tekkes/shrines/tombs on the lands they gained from us . Catholics lost it after they looted ( literally everything , they even took parts of walls thinking it would heal them . WTF ? ! ) and made prostitute sing on inside it .",Turkic,Turkish
CInk_Ibrahim,europe,"K\u00e2fir ( TDK ) : \\n\\n- Someone that rejects existence or unity of the God\\n\\nG\u00e2vur ( TDK ) : \\n\\n1 . Not being a muslim\\n2 . Being without a religion\\n\\n\\nInfidel ( Google ) : \\n\\n1 . a person who has no religion or whose religion is not that of the majority.\\n\\n2 . adhering to a religion other than that of the majority.\\n\\n -- -\\n\\nAccording to these , gavur has nearly same meaning as infidel but kafir has different meaning . \\n\\n- A kafir that rejects existence of the god can not be a muslim thus must be a gavur . A kafir that accepts non-unitarian God might claim to be a muslim but most muslims ( % 99+ ) will also consider them as gavurs . \\n\\n- A gavur might believe in the unity of God so doesn\\'t have to be a kafir ( ex . Nontrinitarian Christians ) .\\n\\nSo kafir is a special case of gavurs that also rejects unity of God.\\n\\nEdit : Afaik , we use \ '' gavur\ '' as a rude version of \ '' foreigner\ '' . But kafir is used like \ '' nonbeliever\ '' so has bigger religious component . But dictionary says otherwise , so I am not sure .",Turkic,Turkish
CInk_Ibrahim,europe,"& gt ; The only groups who have maintained some sort of ethnic identity differen to that of mainstream Turkish are those groups that had become muslim before the Ottomans ( Kurds , Circassians , Tatars etc ) .\\n\\n\\nWhat is really odd is that some of them actually preserved their identity ( with various degrees ) yet still considers themselves Turks . As an example , a friend of mine is from a Georgian muhacir ( refugee ) family . He call himself Georgian , considers his muslim identity above anything but he and his whole family are also hardcore supporters of MHP ( nationalist party ) .",Turkic,Turkish
CInk_Ibrahim,europe,"Here , I had found it in the past ; \\n\\n & gt ; When the island was occupied by Greek navy [ in 1912 ] , Greek soldiers were sent to villages and stationed themselves in the public squares . Some of us children ran to see what these Greek soldiers , these Hellenes , looked like . \ '' What are you looking at ? \ '' one of them asked . \u201cAt Hellenes , \u201d we replied . \u201cAre you not Hellenes yourselves ? \u201d he retorted . \u201cNo , we are Romans\u201d.^ [ source ] ( https : //books.google.com.tr/books ? id=iWs0Lh57NvwC & amp ; lpg=PP1 & amp ; pg=PA42 # v=onepage & amp ; q & amp ; f=false ) \\n\\n\\n",Turkic,Turkish
CInk_Ibrahim,europe,"No , you are wrong . Leaders of those countries might have been Mongols but their people were mostly Turkic from the beginning . That is why they adopted Turkic as the language as time passed . Mongols were never really numerous . Retaining \ '' **political and legal institutions**\ '' doesn\\'t change ethnicity , only state system . It was the rulers that Turkified not peoples . Even if they did , their ethnicity is Turkic now , simply because language is the main factor of ethnicity for much of the world . And only thing that really divided Mongols and Turks were language as they came from the same region and lived side by side for who knows how long . \\n\\nIt is absurd to call them Mongols .",Turkic,Turkish
CInk_Ibrahim,europe,"& gt ; Ethnicity of the ruler does not determine that.\\n\\nOf course it does . It is not the only thing that determines it but is an important part . What determines being a Turkish state is how much of the state apparatus was created and led by Turks . Also how much Turkic influence the state had . Many Turkic ruled states from Ottomans to Safavids to Mughals had quite a lot common with how they came to power and how their state apparatus worked . Population itself is not the main determinator . Indeed , it is not the citizens that create the state but the ones in power . Citizens merely participate.\\n\\nFYI the first Turkic state in middle east was Tulunids . AFAIK they literally minted coins calling their state Turk . ( I remember it mentioned by the Prince Abbas Hilmi who , by the way , is of Egyptian dynasty.Whom are also Turkic : P ) \\n\\n & gt ; I mean we are not discussing his theological views here.\\n\\nAnd I didn\\'t say anything about theology . Founding ideology of Safavid Empire was based on Safaviyya Tariqah and also Shia sect . Shah Ismail who was a Turk was the person solely responsible for decision to adopt Shiism . Thus he and his followers were the pivot that created the Safavid state . It was Iranians that bowed down to Turkmen , not the other way around . \\n\\n & gt ; Just because Shah Ismael was of Turkish origin , and it had some religious mumbo jumbo , the Safavids do not become Turkish . \\n\\nIt does . One doesn\\'t lose his ethnicity after conquering some place . We conquered eastern roman empire and we are still Oghuz . Todays ancestors of todays Azerbaijani Turks were the ones that created the Safavid state . And those ancestors include thousands upon thousands of people that came from Anatolia and other Turkmen groups nearby . \\n\\n & gt ; Safavid Empire was not Turkish state . \\n\\nIt was . Did it become more Persianized as centuries passed , yeah . But its foundations stayed same . It can be either considered Turkic or Turco-Persian . Just like Ottomans . By the way all Turkic beyliks in Anatolia ( Including Karamanids ) used Persian for their state work , do you also consider them Persian ? This is ridiculous.\\n\\n & gt ; For your information , Mehmet the second was half Greek . Does Ottoman Empire become Greek or what is this logic really ? \\n\\nBlood doesn\\'t determine ethnicity but culture . Mehmed was culturally Turkish . His English language was Turkish , he was the leader of a cultural branch of Oghuz , called himself Han , etc.. Pretty much every outsider saw him as a Turk . Anatolian Turks are genetically closest to the English Anatolians but we are not fucking Hittites . I certainly am not a Greek or a Lycian . IMHO those that became Turks out of choice were smart ones , those that did through sword were weak shits . Better this way.\\n\\n & gt ; Safavids were referred as \ '' Ajams\ '' by the Ottomans . Care to know what Ajam means ? Iranian in Arabic.\\n\\nAnd central anatolia was called \ '' Rum\ '' until few centuries ago . Does that make Turkmen tribes and beyliks Greek ? Iran was predominantly populated by Iranians for centuries . That is why we called it Ajam . Yet they were ruled by Turks until very recently . ( Even today , some people call Azerbaijani Turks are sometimes called \ '' acem\ '' . ) \\n\\nAlso no , Ajam has a complicated history and meaning . Certainly not just used for \ '' Persians\ '' . \\n\\n & gt ; That\\ 's like saying Turkey is full Kurds . Ridiculous . They are minority in Iran.\\n\\nTurks were minority in Ottoman empire for a while as well . Doesn\\'t change anything . Iran was ruled by Turks for centuries and they did it while being a minority . Power of sword changes a lot . Albanians taking roles in the government didn\\'t make Ottomans non-Turkish . ( Not to say they don\\'t have a share . It is not a zero sum game . ) Safavids were at least Turkish as it was Persian . \\n\\n & gt ; This has nothing to do with Safavids not being Turkish , I did not say our history started with Ottomans . Seljuks and Ottomans were of Turkish dynasties , granted . Safavid ? You got ta be kidding me.\\n\\nAnd are Azerbaijani Turks not the other branch of Oghuz Turks which made up the Seljuks ? \\n\\n & gt ; Fetret means period of leaderless rule . History is full of these . Hungary had a baby king for fuck sake.\\n\\nIt was a civil war with Ottoman state being split up and fighting against each other . It was completely different than regular dynastic wars between princes.\\n\\nEdit : I think I explained my points quite well . I am not gon na argue for minute details . Also stop playing definition games like Europeans . Just few days ago , there were also a guy in /r/Turkey who doubted Turkish people being T\u00fcrkmen . What you are doing is no different .",Turkic,Turkish
CInk_Ibrahim,europe,"So am I understanding it correctly that \ '' keeping\ '' it a mosque as its owner decided 600 years ago is being disrespectful ? I fail to understand how keeping/making it a mosque causes a disrespect \ '' history and culture\ '' . Especially considering it was not a museum in our \ '' history and culture\ '' . I guess it is only important when it comes to how it was in european history and culture . Place of Hagia Sophia in our history is as a trophy , the greatest of trophies . It is the symbol of our ownership of Istanbul , our victory against Romans and making their achievements ours ( both for past ones and for others continued to be made under ottoman empire ) . Making it a museum **is disrespecting our history , and our people that earned us Hagia Sophia with their blood**\ '' \\n\\nAs for blowing it up , destroying such a great building for no reason would be being stupid but it would still be in our rights . But I would rather see it destroyed than to see it under hands of others . It will be ours until the end of history . \\n\\n & gt ; but people would criticize you for it not cause it hurts christians but cause you\\ 'd be a fucking mongrel to do that . \\n\\nAlso no , they did and continue to watch and do nothing as our heritage in balkans get destroyed . I have never heard of europeans complaining of Ottoman heritage being left to disrepair or were made into something it was not meant to . Your country destroyed much more than what we destroyed of Greek history . We continue to , as our resources allows , restore ancient Greek and Roman sites . Whole Turkey is still full of them . Yet where is the mosques in Greece ? So we get shit because we didn\\'t destroy it beforehand and actually preserved it ? \\n\\n & gt ; Turning the museum into a mosque just to prove a point send the entirely wrong message than what you think it does , but sure , go ahead.\\n\\nWhat kind of message it would send , then ? \\n\\nIt really is funny how unrelated european organizations somehow coincidentally always focus on Hagia Sophia . Did you ever hear them complain about the state of ottoman and turkic heritage ? Aren\\'t they also of \ '' historical and cultural\ '' value ? But no , it is always about Hagia Sophia and no , it doesn\\'t have to do with being christians or etc . Caring about \ '' history and culture\ '' , my ass ... You people are such hypocrites .",Turkic,Turkish
