Abrovinch,AskEurope,"& gt ; Not true , only in the case where it fences off an important recreation area may the authorities order you to put in a gate . Not very common.\\n\\nI stand corrected , misread that bit of the phrase when I read it myself . \\n\\nAs for horse riding , one could say it all comes down to the \ '' Don\\'t disturb - don\\'t destroy\ '' part .",Germanic,Swedish
Abrovinch,AskEurope,"About 35 SEK ( 3.50\u20ac ) .\\n\\nI very rarely use an ATM , instead I pay for everything by card , even small things such a can of soda . When sharing a bill among friends we settle the debts with [ Swish ] ( http : //www.ccsinsight.com/blog/swedish-swish ) .\\n\\nSweden is very quickly becoming a \ '' Sorry , no cash\ '' country . 3/4 major banks don\\'t handle any cash at most of their branches , you can\\'t pay with cash on the bus etc .",Germanic,Swedish
Abrovinch,europe,"The Swedish constitution explicitly forbids ministerial rule . So in this case the government makes the laws , but the agencies interpret the laws on their own , and operate from this interpretation . Sometimes the laws are not clear enough and the agencies do things that wasn\\'t really expected , nor the plan . But the minister in charge can not \ '' just fix it\ '' , they need to change the law first.\\n\\nOnly Sweden and Finland has this split of agencies and government , and it roots back to the 1600s",Germanic,Swedish
Abrovinch,AskEurope,"Some agencies are worse than other , and I\\ 'm sure people can point to examples where everything has gone to shit . But I have to say I\\ 've never really had any problems ( nor have my cases been anything out of the ordinary ) . I do everything on the internet , all I need is my personal number and a \ '' BankID\ '' ( Swedish E-id ) .\\n\\nAgency with the best service ? The tax agency , hands down .",Germanic,Swedish
Abrovinch,europe,"And you just don\\'t want to see the whole picture . The full answer to your question is that there\\ 's no easy answer to it , there\\ 's no law stating specifically \ '' You can\\'t pick someone up and carry them somewhere and not do anything else\ '' . I might be a case of \ '' egenm\u00e4ktigt f\u00f6rfarande\ '' ( arbitrary decision ) , but that\\ 's something that has to be decided in court and case to case . This could probably apply for a child as well , but it hasn\\'t been tested in court . Remember that we don\\'t use common law here.\\n\\nInstead , try to focus on the more important things . Corporal punishment is barbaric and inefficient .",Germanic,Swedish
Abrovinch,AskEurope,"It does indeed , Norway is super expensive ! \\n\\nIn the mean time , we go to Germany for cheap booze !",Germanic,Swedish
Abrovinch,europe,"Kiruna is still bigger , 20 551.42 km^2",Germanic,Swedish
Abrovinch,AskEurope,Is your dads name \ '' Gustav Svensson\ '' ? ; ),Germanic,Swedish
Abrovinch,AskEurope,"I see , must be tougher competition here I guess since everyone has 30 days cancelation time and no subscription time .",Germanic,Swedish
Abrovinch,AskEurope,"Same in Swedish , *slida* .",Germanic,Swedish
Abrovinch,AskEurope,"\ '' Lilla landet lagom\ '' - \ '' Small country *lagom*\ '' A country on the edge of Europe without any real extremes.\\n\\n\ '' I detta avl\u00e5nga land\ '' - \ '' In this elongated country\ '' The differences in nature , culture and weather between the south and the north are pretty substantial .",Germanic,Swedish
Abrovinch,AskEurope,"Don\\'t know about Norway , but for Sweden it works like this : \\n\\nCars that emits low amounts of CO2 ( the value is dependent against the cars weight ) will be exempt from road tax the first 5 years . In addition persons who buy an all electric car will get the price of the car subsidized with 40 000 SEK ( about \u20ac4000 ) . Buyers of hybrid cars with a combined CO2 emission of 50g/km will get subsidized with 20 000 SEK .\\n\\nMany new cars are so called \ '' tj\u00e4nstebil\ '' , which means that the company you work for buys the car and service etc . But for you it\\ 's practically the same as owning a car . In return you will get a net pay reduction and pay tax on the \ '' f\u00f6rm\u00e5nsv\u00e4rde\ '' , directly translated \ '' benefit value\ '' . For electric cars and plug in hybrid this value is reduced by 40 % , making it a much cheaper option .",Germanic,Swedish
Abrovinch,AskEurope,"Older American/British cars often have measurements in both inches and metric , but an old Volvo ( for example ) is just metric.\\n\\nFunny thing is rim sizes are in inches , but tires are mostly in metric..",Germanic,Swedish
Abrovinch,europe,Sweden can not into Germanic world..,Germanic,Swedish
Abrovinch,europe,"Remember when I lived in Lule\u00e5 where , in december , the sunrise was at 10 and sunset at 13 . Fun times .",Germanic,Swedish
Abrovinch,AskEurope,"\ '' Kvarting\ '' is actually referring to a quarter of a \ '' stop\ '' , which is 1,308 litres . S\u00e5 a \ '' kvarting\ '' is actually 0,327 litres , close enough to 37,5 cl I guess .",Germanic,Swedish
Abrovinch,europe,"\ '' In politics and history , a colony is a territory under the immediate political control of a state , distinct from the home territory of the sovereign.\ '' \\n\\nSweden had colonies mainly on the gold coast and in the Delaware area.\\n\\nWe forced Norway into a personal union under the Swedish king , Norway was still pretty much a country with it\\ 's own laws , parliament etc . Only the king was Swedish and foreign affairs were done through Stockholm . It all was a compromise between Sweden , Denmark and Norway . The Danish king basically gave away Norway in exchange for Swedish Pommerania and some money , Sweden wanted Norway to become an integral part of Sweden , while Norway wanted to be independent.\\n\\nFinland was an integral part of Sweden from the 1500s , we had the same laws , same everything really . Turku was the second largest city in Sweden . Some finns apparently hate Sweden today due to the Swedish heritage , most of the Swedish speaking population lived near the coast and was richer than the Finnish speaking . But a Finnish speaking farmer had the exact same rights as a Swedish speaking farmer.\\n\\nI\\ 'm all for Nordic banter , it\\ 's fun and all . But don\\'t spread complete bullshit lies .",Germanic,Swedish
Abrovinch,AskEurope,"Lol , you could always try . In 2016 25 Americans applied for asylum in Sweden..",Germanic,Swedish
Abrovinch,AskEurope,"Yes , but Sweden has a tradition of using professional degrees , we have over 40 of them . While these programmes were altered in 2007 ( mostly in length ) according to the Bologna process there are some differences .",Germanic,Swedish
Abrovinch,AskEurope,"In cooking we use \ '' matsked\ '' ( tablespoon = 15ml ) , \ '' tesked\ '' ( teaspoon = 5ml ) and \ '' kryddm\u00e5tt\ '' ( spice measurement = 1ml ) , all of these are used together with deciliter , just for added confusion.\\n\\nScreen sizes are all in \ '' tum\ '' ( inch ) .\\n\\nOther than that I can\\'t really think of any \ '' special\ '' units . Maybe the \ '' mil\ '' ( mile ) , but that\\ 's just 10km .",Germanic,Swedish
Abrovinch,AskEurope,"Some average salaries ( per month in SEK ) : \\n\\nNurses : 33 700\\n\\nWaiter : 24 400\\n\\nCashier : 24 300\\n\\nCar mechanic : 28 600\\n\\nDoctor : 62 900\\n\\nFinancial analyst : 45 000\\n\\nEngineers ( with 5 years at uni ) : 50 740\\n\\nThese are very broad averages , salaries are set on an individual level.\\n\\nWe must also take into account the taxes , which varies a lot from pretty low-ish to high . And depending on your situation you can also have other sources of income . By \ '' just\ '' having a child you will automatically receive child allowances every month until the child is 16 . \\n\\nSome salaries are on the low end I feel , especially for teachers , nurses and police officers . But engineers also make less than abroad in some cases , which is a problem since we of course want to keep the engineers in Sweden.\\n\\nEdit : total average is 32 000 SEK , and the median ( which really is a better way to measure salaries ) is 28 000 SEK",Germanic,Swedish
Abrovinch,AskEurope,"[ H\u00e5kan Hellstr\u00f6m ] ( https : //www.youtube.com/watch ? v=LkFT1TabQOQ ) this summer in Gothenburg . 70 000 attended on both June 4 and 5.\\n\\nBesides Hellstr\u00f6m , Springsteen also draws large crowds up to 65 000 .",Germanic,Swedish
Abrovinch,europe,"In other news , the number of asylum seekers in Sweden went down over 80 % in 2016 .",Germanic,Swedish
Abrovinch,europe,"Of course not , can you lock anyone in against their will in the US ? A Swedish dad this this and he was sentenced with fines . \\n\\nYou can pick your child up and carry him/her to their room , but not lock the door .",Germanic,Swedish
Abrovinch,AskEurope,"According to official statistic 9 % of people between the age of 16 and 84 smokes daily , the total amount of smokers is 14 % in 2016 , down from 25 % in 2006.\\n\\nIt should be noted that 11 % use [ snus ] ( https : //en.wikipedia.org/wiki/Snus ) daily instead . The amount of people that use snus has stayed on the same level for the last decade.\\n\\nOne interesting thing that can be noted from the statistics ( provided by The Public Health Agency ) is that there is a higher percentage of smokers in the groups of lower income , lower degree of education etc . While the amount of \ '' snusers\ '' are pretty evenly spread out throughout society .",Germanic,Swedish
Abrovinch,AskEurope,AnsaldoBreda also deluvered trams to Gothenburg . Deliveries were late and after just a few years ( with technical problems ) they now have problems with corrosion . \\n\\nThe next order for trams went to Bombardier..,Germanic,Swedish
Abrovinch,europe,"I\\ 've \ '' only\ '' experienced -35 , but it really is something special.\\n\\nFirst off , it\\ 's completely calm outside , no sound and no wind . Secondly , the light . The Nordic winter light is amazing , the sun is very low on the sky and the way it reflects on the snow is beautiful , when the sun is up that is..\\n\\nThen there\\ 's the sensation , you will feel the hair in your nose freeze , your eyelashes will do the same . It will feel cold , but since there\\ 's no wind it\\ 's actually not to bad , the air is very dry as well.\\n\\nAnd lastly , when you walk , the sound the snow makes when you walk on it , memories.\\n",Germanic,Swedish
Abrovinch,AskEurope,"Just first name or nickname , all the way from 1st grade to a university degree .",Germanic,Swedish
Abrovinch,AskEurope,"[ Nu t\u00e4ndas tusen juleljus ] ( https : //www.youtube.com/watch ? v=NDwIa4e4JJE ) \\n\\nAlso , no Christmas without [ Triad ] ( https : //www.youtube.com/watch ? v=4Q7cIyWadUg ) \\n\\nBonus , [ O Helga Natt ] ( https : //www.youtube.com/watch ? v=t4wlQmIORuo ) Which is \ '' Cantique de No\u00ebl\ '' in Swedish .",Germanic,Swedish
Abrovinch,AskEurope,"I took some basic law courses while at Uni . and the law texts are extremely easy to come by . \\n\\nThe normal swede will recognize the majority of the law names ( as long as they read the news.. ) . They will also have a basic understanding of what should be right and wrong in many cases , though I think that comes by instinct .",Germanic,Swedish
Abrovinch,AskEurope,"For Sweden I think trials usually are 6 months , which are automatically transformed into a \ '' normal\ '' contract unless the employer has given you a notice .",Germanic,Swedish
Abrovinch,europe,"& gt ; Alcoholics also save money by dying young , which means the state won\\'t need to pay them pensions or take care of them in old age . I\\ 'd bet the net effect is therefore zero.\\n\\nUhm , no ... Adults tend to work , people who work pay income taxes , they also have money to buy stuff , which generate taxes etc . Alcohol on the other hand causes violence , diseases , people staying home from work etc . I personally do like to drink a few beers , a whisky or a glass of wine time to time , but I know that it really isn\\'t good for mer or society.\\n\\n & gt ; But Systembolaget doesn\\'t really stop it . All it does is make it more expensive and creates a cash cow for the government . You can still use tricks like importing alcohol from other EU countries or getting drunk on the cheapest vodka.\\n\\nIf something is more expensive , less people will buy it . Systembolagets objective isn\\'t to stop consumption , but to lower the risks . That\\ 's why they have a very wide selection , very good costumer service and arrange wine tastings etc.\\n\\nSure , you can import from other countries . The most common thing is to go to Denmark or Germany , but that\\ 's only viable so many times a year and not at all for all the people who live far away from those borders.\\n\\nAlso , \ '' everyone\ '' knows that the cheapest vodka is just bad value in Sweden . If you just want to get as much alcohol for as little money possible it\\ 's wine you\\ 're supposed to buy..",Germanic,Swedish
Abrovinch,AskEurope,It is now illegal to have your personal car painted to look like a police car . And dental care is now free for everyone up to 21 years of age .,Germanic,Swedish
Abrovinch,AskEurope,"I use a credit card , without any credit on it . I know many that does the same , as it gives you more benefits than a regular debit card would . Others may just use a debit card.\\n\\nWhen transferring cash between friends , or sometimes also paying for stuff at a market/yard sale we use [ Swish ] ( https : //en.wikipedia.org/wiki/Swish_ ( payment ) )",Germanic,Swedish
Abrovinch,AskEurope,"Indeed , this is actually a typical left-right divide in Swedish politics.\\n\\nBoth sides agree on that youths and other long-time unemployed ( mostly immigrants ) are a problem . \\n\\nThe right wants to create more \ '' simple jobs\ '' and a new form of employment for those who have a hard time getting employment . This new form of employment would be more flexible for the employer.\\n\\nThe left has talked about a guarantee that would offer youths either work , specialised education or internships within 90 days . They have also talked about having \ '' extra jobs\ '' in the welfare ( such as the elderly care ) .",Germanic,Swedish
Abrovinch,europe,It was snowing today..\\n,Germanic,Swedish
Abrovinch,europe,"You\\ 've got to be trolling me , but in case you\\ 're not.\\n\\nHere\\ 's what the article says about the Lithuanian law : \\n\\n\ '' The amendments define all types of violence against children , including physical , psychological , sexual and negligence.\ '' and \ '' According to the law , \ '' all forms of violence against children , including corporal punishments , are banned\ '' , and parents and other legal guardians of a child , as well as the state , must ensure the protection of children.\ '' \\n\\nAnd the lets see the Swedish law : \\n\\n\ '' Children are entitled to care , security and a good upbringing . Children are to be treated with respect for their person and individuality and may not be subjected to corporal punishment or any other humiliating treatment.\ '' \\n\\nAlso , these laws are not for putting parents in jail . It\\ 's about public opinion and clearly stating what is right , and what\\ 's not .",Germanic,Swedish
Abrovinch,europe,"And you are conveniently not understanding what the article says . \\n\\nThe article says that they expect about 300k APPLICATIONS for relatives . This of course mean a heavy work load for Migrationsverket , but while they are working with the application the relatives are still in their respective countries.\\n\\nAlso , 70 % of all granted asylums 2016 were for subsidiary protection , these will only receive residency for 13 months at a time ( unless they find a job and a place of their own ) . These people does not have the right to bring ANY relative to Sweden , unless they applied for asylum before 24 november 2015 . \\n\\nOf course , even I know a lot of people did just that . For those that applied before 24 of november 2015 , their relatives may also be granted asylum , but still only 13 months at a time .",Germanic,Swedish
Abrovinch,AskEurope,Of the bigger universities I would say [ Uppsala Universitet ] ( http : //uu.se/en/ ) and [ Lunds Universitet ] ( http : //www.lunduniversity.lu.se ) \\n\\nFor engineering [ Kungliga Tekniska H\u00f6gskolan ] ( https : //www.kth.se/en ) and [ Chalmers ] ( http : //www.chalmers.se/en/Pages/default.aspx ) \\n\\nBut I would say there are good and bad programs at all universities here . Some specific programmes/masters may only exist at a single university .,Germanic,Swedish
Abrovinch,europe,A better translation would be \ '' For Sweden - With the times\ '',Germanic,Swedish
Abrovinch,AskEurope,"Once ordered fries in Brazil , they were covered in easy cheese . It was , as you can imagine , disgusting .",Germanic,Swedish
Abrovinch,europe,[ This ] ( https : //www.numbeo.com/cost-of-living/country_result.jsp ? country=Sweden & amp ; displayCurrency=EUR ) is fairly accurate I would say .,Germanic,Swedish
Abrovinch,AskEurope,"Prices : 45 : - , if there are decimals they are raised a bit , like 11^90 Typical [ pricetag ] ( http : //www.krav.se/sites/default/files/null/9.jpg ) note the comparison price in yellow.\\n\\nLarge numbers : 10 000 000 \\n\\nDecimal places : 1,35\\n\\nQutation marks : \u201dLike this\u201d ( note that they are at an angle )",Germanic,Swedish
Abrovinch,AskEurope,"Lol , Fria Tider ... \\n\\nYou do realise that those who had to move had a temporary contract that had come to an end ? The owner probably got paid more by having refugees living there instead . He has no obligation to sign a new contract with those who lived there before.\\n\\nMy guess is that you are a pretty young guy that want to blame your failures on someone else..",Germanic,Swedish
Abrovinch,AskEurope,"It\\ 's a big industry with a lot of start ups . Famous ones include Spotify , Majong ( Minecraft ) , Dice ( Battlefield-series ) , Skype ( collaboration with Estonia and Denmark , I think ) , Piratebay etc..\\n\\nThe big international companies are here as well . In Lule\u00e5 , which is in northern Sweden , Facebook built it\\ 's first data-center outside the U.S.\\n\\nYoutube clip about \ '' Sweden\\ 's Silicone Valley\ '' : https : //www.youtube.com/watch ? v=d915p1aXlkE",Germanic,Swedish
Abrovinch,AskEurope,& gt ; In a world where it takes three months to cancel a phone plan\\n\\nIs it still like that in Germany ?,Germanic,Swedish
Abrovinch,AskEurope,"& gt ; I follow an account on Instagram that posted this image , which suggest that Northern Europe and the UK are the easiest places to do business with and it gets harder as you go south , so maybe the Italians are right after all ? \\n\\nBut Scandinavia is so socialist and bad for companies ! /s",Germanic,Swedish
Abrovinch,AskEurope,Pretty much since the 60s-70s . [ link to Wikipedia ] ( https : //en.wikipedia.org/wiki/Du-reformen ) ( English ),Germanic,Swedish
Abrovinch,europe,"If anyone is interested : \\n\\nMinimum wage for a restaurant worker with no experience and a member of the restaurant workers union working for a company that has signed a collective agreement is \u20ac12.56/h or \u20ac2173/month , + extra for uncomfortable hours.\\n\\nThis would apply to someone 20 years or older without any experience starting at McDonalds . If you are younger than 20 years you get paid less.\\n\\nThis is the base level agreement ( and just for restaurant workers ) , there may be extras on top of this .",Germanic,Swedish
Abrovinch,AskEurope,My cousins had a dog named Rocky that looked exactly like that many years ago while I was about 4 . I remember being terrified of that dog .,Germanic,Swedish
Abrovinch,AskEurope,"I can just answer , based on the information given in your post , that the probable sentence in Sweden would be \ '' Life in prison\ '' . I use citation marks since it , in practice , isn\\'t for life . \\n\\nLife in prison here means that time you will spend hasn\\'t been set . After 10 years you can apply to court and have your sentence set . The minimum time is 18 years ( which is the longest sentence outside life ) . \\n\\nMore information on the Swedish prison system ( if you are interested ) : https : //www.kriminalvarden.se/swedish-prison-and-probation-service/",Germanic,Swedish
Abrovinch,AskEurope,That was a lot of bullshit in one post..,Germanic,Swedish
Abrovinch,AskEurope,Some of the fakes were really well done . [ This ] ( http : //www.svtstatic.se/image-cms/svtse/1453716991/svts/article6072399.svt/alternates/extralarge/polisbil-jpg ) is a fake police car .,Germanic,Swedish
Abrovinch,AskEurope,"\ '' J\u00e4nkare\ '' is very often used for American cars from the 50s and 60s , which are a huge thing over here .",Germanic,Swedish
Abrovinch,AskEurope,"Working part time as a cashier is quite popular among university students here , especially during the summer when you don\\'t receive your student allowance and student loan . You are allowed to make about 86 000 SEK ( $ 9,600 ) per half-year without affecting your allowance ( $ 318 per 4-week period ) and loan ( $ 800 per 4-week period ) .\\n\\nAll my figures are pre-tax ( student allowance and loan are tax-free though ) . A full time cashier ( 24 300 SEK/month ) would pay about 22-23 % income tax , depending on where in Sweden he/she lives . \\n\\nEdit : If the company has signed a collective agreement with the union ( which they mostly have ) the minimum wage for a cashier , without any experience is $ 13.40/h for an 18 year old and $ 13.61/h for anyone 19 or older . To this comes overtime and extra pay for working \ '' uncomfortable hours\ '' . ' } \n ''",Germanic,Swedish
Abrovinch,europe,& gt ; Sweden : does not know how to take care of children properly.\\n\\nHeh . [ Context ] ( http : //www.telegraph.co.uk/news/worldnews/europe/sweden/10592799/Muslim-couple-arrested-in-Sweden-for-smacking-son-when-he-refused-to-pray.html ) \\n\\nEdit : The father got 10 months in prison and the mother 14 months .,Germanic,Swedish
Abrovinch,europe,"The motto changes with each monarch . \ '' *i tiden*\ '' refers to being current , up to date . We usually say something \ '' ligger i tiden\ '' when it\\ 's something that is expected in current times . For example , a company being on social media \ '' ligger i tiden\ '' .\\n\\nHopefully that could clear it up a bit .",Germanic,Swedish
Abrovinch,AskEurope,"Oh , I forgot about that . \ '' Fr\u00f6ken\ '' is quite funny when you think about it , used to mean \ '' miss\ '' , but now used by small children as a substitute of \ '' teacher\ '' , even for male teachers..",Germanic,Swedish
Abrovinch,AskEurope,"The law only regulates how the flag looks , that is colour , aspect ratio etc . The only thing that is strictly forbidden is to put markings , letters etc . on the flag.\\n\\nIn the olden days you were supposed to burn the flag when it was decommissioned . Nowadays there are no laws stating what to do with an old flag . However it is seen as a nice gesture to cut it into pieces before throwing it away , burning is not recommended any more due to environmental reasons.\\n\\n",Germanic,Swedish
Abrovinch,AskEurope,"Since Sweden is very elongated flying is really the only way to travel between the south and the north.\\n\\nThe only direct train service between Stockholm and Lule\u00e5 , which is the main focus city up north and has about 75000 inhabitants , is a 13 hour overnight service . On the other hand there are 10-12 daily Boeing 737 operated by SAS and Norwegian flying the route . \\n\\nFlying domestic is really convenient here , you are air-side within 3 minuits after arriving at the airport . Almost every city/town has an airport with flights to Stockholm . Longest domestic flights are Stockholm-Kiruna and Gothenburg-Lule\u00e5 , both taking 1 hour and 40 minuits.\\n \\nPrices start at about 250 SEK one way with Norwegian and about 600 SEK with SAS .",Germanic,Swedish
Abrovinch,AskEurope,"There\\ 's always this classic : \\n\\n\ '' Skvallerbytta bing b\u00e5ng , \\ng\u00e5r i alla g\u00e5rdar , \\nslickar alla sk\u00e5lar\ '' \\n\\nSkvallerbytta is a tattletale , and this chant is sung among small children when someone is going around telling secrets . The chant can easily be lengthened by adding mor rhymes.\\n\\nThe oldest written variant of the chant is apparently from 1677 , and the word \ '' skvallerbytta\ '' has been in use since the 1500s .",Germanic,Swedish
Abrovinch,AskEurope,"Foreign citizens residing in Sweden can change their name according to Swedish name laws ( which are pretty ok ) , however it is not certain that the country in which you have citizenship will accept the new name , which will cause problems.\\n\\nCitizens of Nordic countries ( Denmark , Norway and Finland ) who are residing in Sweden change their name according to Swedish law , and it is automatically accepted in the country which they have citizenship . This also works the other way around .",Germanic,Swedish
Abrovinch,AskEurope,"Handelsbanken accept cash for deposit at all of their branches . Still agree with you though , the other \ '' banks\ '' are useless in this regard .",Germanic,Swedish
Abrovinch,AskEurope,& gt ; Our many wars with Sweden ? No . Because it was with Sweden.\\n\\nIs it at this time I should point out that you lost most of the wars as well ? ; ),Germanic,Swedish
