Ashihna,europe,hehe,Turkic,Turkish
ChipAyten,europe,\ '' Turkey extends it\\ 's beach shore to drown children\ '',Turkic,Turkish
ChipAyten,europe,"America wont be Europe\\ 's sword and shield anymore . Americans are quite war-weary , the states will need a decade or two to \ '' recharge\ '' so to say , or just a year who knows .",Turkic,Turkish
ChipAyten,europe,"Is there one country who\\ 's \ '' green\ '' party has more than just a token , protest voice in government ? A country where the green party actually has real governing control or influence ?",Turkic,Turkish
ChipAyten,europe,On to Macedonia,Turkic,Turkish
ChipAyten,europe,This is foreplay,Turkic,Turkish
ChipAyten,europe,A few more reports of brown peopleat benefits offices or demeaning local women and UK will surely leave,Turkic,Turkish
ChipAyten,europe,Vote no . When the plan inevitably goes to shit use your stance to run for President . Profit .,Turkic,Turkish
ChipAyten,europe,"Its as if party B agrees to nothing with A , all proposals and accords are dismissed . B then cries out that A is being non negotiable .",Turkic,Turkish
ChipAyten,europe,Greece was always unique in that while being Schengen it was effectively an island from the rest of the EU . All illegal migrants would have to use air ports or cross through non-schengen areas to get to central europe making the trip not worth it . Now migrants have an EU land path to get from Greece to Germany .,Turkic,Turkish
ChipAyten,europe,"Why is Italy so high ? Bribery , corruption , mafia ? The typical Italian stereotypes or is it something else",Turkic,Turkish
ChipAyten,europe,Driving is not a human right .,Turkic,Turkish
ChipAyten,europe,Uhhh\\n\\nGuess stupid it is then,Turkic,Turkish
ChipAyten,europe,"Merkel & amp ; Cameron , two corporate puppets . Populist leaders are becoming increasingly rare",Turkic,Turkish
ChipAyten,europe,Not happening,Turkic,Turkish
ChipAyten,europe,sorry \ '' rome\ '' you\\ 're not getting your capital back . suck it,Turkic,Turkish
ChipAyten,europe,haha the graphic maker even included east thrace in \ '' middle east\ '' \\n\\nagenda confirmed . cunt,Turkic,Turkish
ChipAyten,europe,While not Japan or California in terms of seismic activity the Mediterranean region does get quakes . Survivng almost 2000 years of that is the most impressive .,Turkic,Turkish
ChipAyten,europe,Some speak American,Turkic,Turkish
ChipAyten,europe,feigning ignorance to not raise suspicion to a larger plan ?,Turkic,Turkish
ChipAyten,europe,most russians would do him/her anyway,Turkic,Turkish
ChipAyten,europe,Probably an Atletico fan,Turkic,Turkish
ChipAyten,europe,Esti is still culturally an eastern european country . This whole capitalism thing is a bit new .,Turkic,Turkish
ChipAyten,europe,US politics *is* Europe politics,Turkic,Turkish
ChipAyten,europe,Would be 20 deaths in America,Turkic,Turkish
ChipAyten,europe,"Thats why nationalism is silly , especially in the Balkans - the doorway in to and out of Europe , where everyone is a little bit of everything .",Turkic,Turkish
ChipAyten,europe,The communist principles that promise to equalize the playing field lead to these sort of pictures.\\n\\nThe capitalist principles that promise freedom and opportunity lead to these sort of pictures.\\n\\nThe problem is human nature .,Turkic,Turkish
ChipAyten,europe,"Looking at your flair I\\ 'm thinking is that your wet dream ? To think we don\\'t want in the EU ? I assure you , at least among the Kemalists ( real turks ) we\\ 'd still very much love to be brought into the fold . Your precious union has been stringing us along for a generation . A carrot on a fishing line gag . You want and need our cooperation but not entirely comfortable with letting us in so you give us this \ '' separate but equal\ '' treatment .",Turkic,Turkish
ChipAyten,europe,Hows this public info so fast ? This is the kind of info spies were killed over in the not so distant past .,Turkic,Turkish
ChipAyten,europe,"It could indeed turn into an Egypt/Morsi situation well before the election . The military is populated generally by uber nationalist-kemalists , their patience with Erdogan grows thinner with each incident .",Turkic,Turkish
ChipAyten,europe,lol,Turkic,Turkish
ChipAyten,europe,Impressive results website,Turkic,Turkish
ChipAyten,europe,Or people will drink it anyway to seem cool,Turkic,Turkish
ChipAyten,europe,IRA is still a thing ? Get a life people,Turkic,Turkish
ChipAyten,europe,Nutjobs,Turkic,Turkish
ChipAyten,europe,Can Turkiye join ?,Turkic,Turkish
ChipAyten,europe,this goes against the commonly accepted hive mind thought process so it must be false .,Turkic,Turkish
ChipAyten,europe,"Remove the labels and just leave the colors and the maps can be correlated to many different things . Income , temperature , life expectancy , infant mortality rate etc . Remember people causation \u2260 correlation .",Turkic,Turkish
ChipAyten,europe,Electric cars have the ranges of average petrol cars these days . Its not uncommon for some models to go over 300 miles per charge .,Turkic,Turkish
ChipAyten,europe,I cant trust elections with no paper ballot,Turkic,Turkish
ChipAyten,europe,"TIL /r/vexillology , /r/europe & amp ; /r/polandball are different things",Turkic,Turkish
ChipAyten,europe,Midnight strolls through Siberia ?,Turkic,Turkish
ChipAyten,europe,In the big picture Turkey still has more to gain in membership than Europe does . It seems the opposite right now because Europe is so fearful of migrants,Turkic,Turkish
ChipAyten,europe,"\ '' phobic\ '' implies a fear , I wouldn\\'t say they\\ 're afraid of the Irish necessarily",Turkic,Turkish
ChipAyten,europe,Removing the smallest cog in even the biggest machine will shut it all down .,Turkic,Turkish
ChipAyten,europe,"Corruption can happen in a day . elected today , prick tomorrow . Trust me I know ...",Turkic,Turkish
ChipAyten,europe,\ '' Dont buy the sun\ '',Turkic,Turkish
ChipAyten,europe,Such is the nature of conquest . The inhabitants of the newly taken over land must decide wether to leave or make concessions and join the new ruling power . The names and rules have changed some but the game remains the same .,Turkic,Turkish
ChipAyten,europe,Most underrated anthem .,Turkic,Turkish
ChipAyten,europe,Do what the American courts were too scared to ! The right thing .,Turkic,Turkish
ChipAyten,europe,If you dont like bacon how can you be trusted,Turkic,Turkish
ChipAyten,europe,Lol,Turkic,Turkish
ChipAyten,europe,Not everyone is in the politically conscious bubble,Turkic,Turkish
ChipAyten,europe,\ '' Turkey is not in Europe\ '',Turkic,Turkish
ChipAyten,europe,If they can\\'t \ '' legally\ '' identify themselves using the document while it\\ 's their only document they then are *effectively* stateless .,Turkic,Turkish
ChipAyten,europe,"Isn\\'t that to be expected in the EU\\ 's most capitalistic country ? The America of Europe if you will . The 1 % make it so the rest of the populous has no social mobility , there\\ 's nothing they fear more than an empowered lower class , all in the guise of \ '' freedom\ '' .",Turkic,Turkish
ChipAyten,europe,One would have to join the other . Its like the Koreas or Chinas . Each claims to be the true representative government of it all .,Turkic,Turkish
ChipAyten,europe,The assisination attemps usually start soon,Turkic,Turkish
ChipAyten,europe,America is that you ?,Turkic,Turkish
ChipAyten,europe,Just saying he turns off people his side needs most,Turkic,Turkish
ChipAyten,europe,They all should have been arrested including Erdogan,Turkic,Turkish
ChipAyten,europe,The UK is to the EU what Texas is the the US . Just perhaps a little too stubborn in regards to autonomy .,Turkic,Turkish
ChipAyten,europe,Ask your economist if nuclear weapons are right for you,Turkic,Turkish
ChipAyten,europe,Just as Labour starts to gain steam in the polls ... hmmm,Turkic,Turkish
ChipAyten,europe,American Turks are overwhelmingly in favor of CHP though,Turkic,Turkish
ChipAyten,europe,Chocoboru,Turkic,Turkish
ChipAyten,europe,It really is . It solves all woes,Turkic,Turkish
ChipAyten,europe,"Hobbes vs locke , \\nCastro vs Nixon , \\nSanders vs Clinton",Turkic,Turkish
ChipAyten,europe,Still can not into,Turkic,Turkish
ChipAyten,europe,"The same principle could be applied to America , Brazil , China or any other large country .",Turkic,Turkish
ChipAyten,europe,Never said anything about genocide or cleansing .,Turkic,Turkish
ChipAyten,europe,Terror attack handed the government to the blues right when it got competitive .,Turkic,Turkish
ChipAyten,europe,Hi friend,Turkic,Turkish
ChipAyten,europe,There is no official designation as to what makes up the balkans . What you find on wiki is just one of many interpretations of a loose border,Turkic,Turkish
ChipAyten,europe,You can take the Slav out of balkan ...,Turkic,Turkish
ChipAyten,europe,backyard,Turkic,Turkish
ChipAyten,europe,"Send Erdogan-kenobi packing and our happiness will go up , at least in western Turkey ^the ^Turkey ^that ^matters",Turkic,Turkish
ChipAyten,europe,"They can check that attitude at the airport gate or get on the first plane back . This is why the vetting process must go beyond \ '' hes not a baddie\ '' it has to delve deep in to the mind and bring to the surface the core beliefs of the migrants . Once let in , the seed of true intolerance is very hard to weed out . Because as you said it\\ 's generational , it\\ 's taught from parent to child over and over . Any attempts at breaking that cycle by the western world - even whilst in a western country will be seen as an act of aggression against their culture by the family and reinforce their insular fundamentalist narrative .",Turkic,Turkish
ChipAyten,europe,Well freedoms are not absolute so i dont know what to tell you .,Turkic,Turkish
ChipAyten,europe,Everyone with a heating bill,Turkic,Turkish
ChipAyten,europe,More center-righters would vote liberal/democrat/labour if standard bearers like Oliver would lose the pomposity and righteous smug attitude,Turkic,Turkish
ChipAyten,europe,"Muslims in Europe , or European Muslims ? Ie : Pakistani teenage boy in the UK who beats his sister for going out at night or a Bosnian Muslim who leads any other normal western-centric life",Turkic,Turkish
ChipAyten,europe,"Problem is those who are in control of the heart of Islam and as a result those who are in control of the sympathies and minds of Muslims kill potential enlighteners . It\\ 's so very easy for a Muslim in NY to say \ '' look at me as your example of how good Islam can be , I\\ 'm a *real* muslim.\ '' but that\\ 's a fallacy . Nothing changes as long as the powers that be continue to be throughout arabia . When Mecca has a gay pride parade only then will the west know it can be tolerant once again .",Turkic,Turkish
ChipAyten,europe,"No . But if thats the case hide yo jobs , hide yo daughters ! 8D",Turkic,Turkish
ChipAyten,europe,It all hinges on 2015 . Crossroads is often misused when describing elections but for Turkey this upcoming one truly is a crossroads . a reaffirmation of the AKP spells doom for the republic .,Turkic,Turkish
ChipAyten,europe,and a correlation between happiness and faith,Turkic,Turkish
ChipAyten,europe,do you want more ?,Turkic,Turkish
ChipAyten,europe,hey hey oh oh Erdogan has got to go !,Turkic,Turkish
ChipAyten,europe,"Why hasnt Corbyn and Labour taken the stance of having a second vote , pair it with the inevitable second round general election in a few months",Turkic,Turkish
ChipAyten,europe,B.. b.. but Americans are exceptional !,Turkic,Turkish
ChipAyten,europe,The intellectual gap widens,Turkic,Turkish
ChipAyten,europe,What if it were akin to a tag you have on your windshield for toll road readers ? Literally a second and go .,Turkic,Turkish
ChipAyten,europe,A two second scan from the electronics in the passport is that big of an inconvenience ?,Turkic,Turkish
ChipAyten,europe,Theres nothing wrong with a quick passport or ID scan when crossing a border until the potential day when EU federalization is complete,Turkic,Turkish
ChipAyten,europe,You say that as if its a problemeow,Turkic,Turkish
ChipAyten,europe,"Why have the color gradient change at .15 , graph maker must want to make a point here ...",Turkic,Turkish
ChipAyten,europe,The mod of each red is ordained by the reddit gods themselves and their word mustnt be questioned . What do you have to do to gain such status ? Be the first one to make a sub,Turkic,Turkish
ChipAyten,europe,Maybe theyre working behind the scenes to control the med . sea from both ends,Turkic,Turkish
ChipAyten,europe,slowly but surely the effects of climate change are becoming more and more frequent and more intense,Turkic,Turkish
ChipAyten,europe,Thought this was a sexual reference for a second heh,Turkic,Turkish
ChipAyten,europe,How does kebap fit in this equation ? Do we sit this one out ?,Turkic,Turkish
ChipAyten,europe,Aint no party like a balkan party,Turkic,Turkish
ChipAyten,europe,Turkey is similar to America in that both countries have about the same percentage of religious crazies ( ~25-30 % ) of the population that hold the country back in every department,Turkic,Turkish
ChipAyten,europe,Schengen is great for the employed educated whites of Europe - the ones the policy was intended for .,Turkic,Turkish
ChipAyten,europe,Just what ISIS needs to recruit more .,Turkic,Turkish
ChipAyten,europe,I applaud those who stand up to the PC police .,Turkic,Turkish
ChipAyten,europe,This is a mere lip service plan . They can use the \ '' hey we\\ 're trying\ '' argument,Turkic,Turkish
ChipAyten,europe,"The UK taking after the US model of banana republic , regime pushing , sphere of influeincing and sabotage",Turkic,Turkish
ChipAyten,europe,Brussels thinks it can usurp and take the place of national legislatures,Turkic,Turkish
ChipAyten,europe,"If this were 75AD one would argue Christianity was never part of Europe , it came to us .",Turkic,Turkish
ChipAyten,europe,Then the Jews messed everything up,Turkic,Turkish
ChipAyten,europe,I want to apply for Asylum in Australia because winter is close,Turkic,Turkish
ChipAyten,europe,Alevi Turks still maintain many pagan Turkic traditions from the pre-islamic steppe days,Turkic,Turkish
ChipAyten,europe,The battery would have to be the size of the cargo itself to fuel the journey,Turkic,Turkish
ChipAyten,europe,"When a mouthy muslim tumblr-warrior girl , ( always likely from a western country ) who doesn\\'t know any real oppression , talks about how it\\ 's the \ '' woman\\ 's choice\ '' to dress in that manner I cringe . Even if wearing the burqa wasn\\'t forced on her by her husband or father its still a vestiage of 1400+ years of subjugation . Your wearing it validates the violations countless women before you had to endure . Stupid fuckin self righteous kids these days .",Turkic,Turkish
ChipAyten,europe,The Dutch government has state control over all the coal plants ?,Turkic,Turkish
ChipAyten,europe,A lot can happen in 5 years,Turkic,Turkish
ChipAyten,europe,Gib islands,Turkic,Turkish
ChipAyten,europe,Because the court has said that Parliament must make this ruling there needs to be a snap election to guarantee with this new knowledge that it is indeed the will of the people .,Turkic,Turkish
ChipAyten,europe,My girlfriend is from Sofia so I am by association !,Turkic,Turkish
ChipAyten,europe,ffs,Turkic,Turkish
ChipAyten,europe,Within a tolerant country homogenous islamic communities behave like they would if they were in the middle of the desert they came from .,Turkic,Turkish
ChipAyten,europe,Im asking the questions here buddy,Turkic,Turkish
ChipAyten,europe,Who cares if it was 1 meter for one second . Turkey will not receive the Ukraine treatment from Russia . Your tune would surely change if Russian planes were inching their way in to your country .,Turkic,Turkish
ChipAyten,europe,Or Turko-Russian hybrids,Turkic,Turkish
ChipAyten,europe,Ill trade 6 doner and 14 stray cats,Turkic,Turkish
ChipAyten,europe,Its a land of freedom for those who can accept those freedoms for everyone else and not just their self .,Turkic,Turkish
ChipAyten,europe,Coming back !,Turkic,Turkish
ChipAyten,europe,"Not this again . Here , have some more immigrants",Turkic,Turkish
ChipAyten,europe,can you shank a dude ?,Turkic,Turkish
ChipAyten,europe,Or that Republicans will cut off their nose just to spite their face because of the scary black man in the white house .,Turkic,Turkish
ChipAyten,europe,Who is this fortran ?,Turkic,Turkish
ChipAyten,europe,Who knew,Turkic,Turkish
ChipAyten,europe,People can do incredible things when brown people are at the door,Turkic,Turkish
ChipAyten,europe,"If you believe the UK wil actually leave the EU I have a bridge to sell you . The referrendum , if you can even call it that , was a taxpayer funded opinion poll .",Turkic,Turkish
ChipAyten,europe,Le Pen is cersei,Turkic,Turkish
ChipAyten,europe,Berniebros across the world unite !,Turkic,Turkish
ChipAyten,europe,Those sites were parts of the empire at a time .,Turkic,Turkish
ChipAyten,europe,Cant wait for the western dollars to get pulled out of Turkey,Turkic,Turkish
ChipAyten,europe,I guess that makes Brazil and Russia quite similar too !,Turkic,Turkish
ChipAyten,europe,Very,Turkic,Turkish
ChipAyten,europe,Haha you mad,Turkic,Turkish
ChipAyten,europe,Dissent the guise of conservatism to sell to the idiot masses,Turkic,Turkish
ChipAyten,europe,How do you reattach nerves ?,Turkic,Turkish
ChipAyten,europe,Its up to the people to attain the facts . The people must be responsible for their choices . Think of it as electoral laissez faire . Turkey is going to shit because it has dumb citizens and deserves to . Finland prospers because the people are generally more learned and measured . The arrow of time only ever moves in one direction and darwinism can not be denied .,Turkic,Turkish
ChipAyten,europe,Ankara really left Northern Cyprus out to dry . Wanting to mend relations with the EU they cut the umbilical cord leaving an infant baby nation stranded naked in the cold with no safety in sight .,Turkic,Turkish
ChipAyten,europe,And Russian colors,Turkic,Turkish
ChipAyten,europe,Haha might as well ban the whole internet,Turkic,Turkish
ChipAyten,europe,The Caribbean says \ '' you\\ 're welcome\ '',Turkic,Turkish
ChipAyten,europe,[ it is known ] ( http : //thumbs.dreamstime.com/z/turkish-doner-kebab-5422023.jpg ),Turkic,Turkish
ChipAyten,europe,Same,Turkic,Turkish
ChipAyten,europe,Mine too ! Its beautiful and right next to the tripoint,Turkic,Turkish
ChipAyten,europe,We are legion,Turkic,Turkish
ChipAyten,europe,When Israel encompasses more arab land and people their share goes down .,Turkic,Turkish
ChipAyten,europe,Sour Grapes syndrome is all,Turkic,Turkish
ChipAyten,europe,May I please ?,Turkic,Turkish
ChipAyten,europe,Turkiye can into snow ; Turkiye can into EU,Turkic,Turkish
ChipAyten,europe,Italy is America,Turkic,Turkish
ChipAyten,europe,brothels and beaches,Turkic,Turkish
ChipAyten,europe,Chances are you have a Turkish ancestor,Turkic,Turkish
ChipAyten,europe,Trump will bring erdogan and putin together . World peace . Nobel prize for Trump,Turkic,Turkish
ChipAyten,europe,Erdogan is undoing 100 years of progress in mere months . He wishes to raise the Ottoman Empire from the dead and establish a pan arab Islamist state . This clown needs to go before my country gets \ '' liberated\ '' by America .,Turkic,Turkish
ChipAyten,europe,"the closeted racism , it oozes from your words .",Turkic,Turkish
ChipAyten,europe,Why ? do 70million muslims in the schengen give you nightmares ?,Turkic,Turkish
ChipAyten,europe,Haha a Saudi woman telling a man what to do . Goes to show how deep the irony runs . Religious rules only apply to the poor . Ask your doctor if oil is right for you .,Turkic,Turkish
ChipAyten,europe,thousands of miles of coastline,Turkic,Turkish
ChipAyten,europe,Got ta respect the hustle . He played Belgian authorities like a pimp . Utopian pussies,Turkic,Turkish
ChipAyten,europe,"Yourself perhaps . Most Altaic central Asian/Siberian folk , Turkic peoples , those who we share common ancestors with are rather pale .",Turkic,Turkish
ChipAyten,europe,"In regards to net neutrality , why does America get to unilaterally make decisions about the rules of the internet ? The internet belongs to the whole of humanity ?",Turkic,Turkish
ChipAyten,europe,25 % think Obama is the anti christ\\n\\n25 % think Erdogan should be sultan,Turkic,Turkish
ChipAyten,europe,"College educated , literate with technical skills and immigration prospects are shit.\\n\\nHorny ideological twenty-something male with no education and a high potential for trouble making ? Come right in .",Turkic,Turkish
ChipAyten,europe,Jesus the polling does exist and its easily obtained . Asking questions like you dont have google access .,Turkic,Turkish
ChipAyten,europe,Armenia would have the backing of the western world .,Turkic,Turkish
ChipAyten,europe,Lovely to see Twitter joining in on the corruption .,Turkic,Turkish
ChipAyten,europe,America the free bitches ^^oops ^^wrong ^^flair,Turkic,Turkish
ChipAyten,europe,Fuck us right,Turkic,Turkish
ChipAyten,europe,The hammer and sickle rises once more,Turkic,Turkish
ChipAyten,europe,This may lead to a no confidence stance taken among EU nations,Turkic,Turkish
ChipAyten,europe,"Was the flag modeled after the trees , or did the trees model themselves off of the flag ?",Turkic,Turkish
ChipAyten,europe,"The refferendeum passed , most Swiss . The majority rules and therefore represents the whole , thus \ '' the Swiss\ '' .",Turkic,Turkish
ChipAyten,europe,In Italy the prosecutor can appeal if they lose ? How interesting,Turkic,Turkish
ChipAyten,europe,A secular/republican Ottoman empire ?,Turkic,Turkish
ChipAyten,europe,Or I could spin it differently and say that such actions have prevented attacks that we will never know about .,Turkic,Turkish
ChipAyten,europe,"Exactly , theyre just as corrupt",Turkic,Turkish
ChipAyten,europe,Britain rules the waves ?,Turkic,Turkish
ChipAyten,europe,ionno.. everything,Turkic,Turkish
ChipAyten,europe,The reckoning will come,Turkic,Turkish
ChipAyten,europe,Aw Carry on lil Lietuva,Turkic,Turkish
ChipAyten,europe,Like the good ole days,Turkic,Turkish
ChipAyten,europe,What a gaudy monstrous building . No tact . From a religion that forbids idolatry too .,Turkic,Turkish
ChipAyten,europe,first-past-the-post voting is such a sham,Turkic,Turkish
ChipAyten,europe,One of the few polls where Turkey out-liberals most of Europe . Got ta love Edirne,Turkic,Turkish
ChipAyten,europe,What goes up must come down . The peaks and throughs average out over time and the two big parties always eventually gobble up the smaller ones in a FTPT model .,Turkic,Turkish
ChipAyten,europe,Relax mr. Yuro . Greece is claiming a doubly large maritime border than what the world recognizes . As a result if you use those larger borders there is no path a Turkish warship can take to reach the Mediterranean from the Black sea .,Turkic,Turkish
ChipAyten,europe,Should let us in the EU since we have such a useful sabre then,Turkic,Turkish
ChipAyten,europe,Been saying this since it first came out,Turkic,Turkish
ChipAyten,europe,"Now we\\ 're treading close to blatant racism . What gives any peoples the right to be the decider in chief of what makes anybody anything ? My ancestors made their way into Europe by way of the sword this is true , but so did yours . Does it give you the right to call my ethnicity and culture \ '' non european\ '' because your ancestors conquered deeper into Europe earlier than mine ? English are not indigenous to Europe or Britannia either , nobody is , we\\ 're all African . It was thanks to the efforts of many muslim Turks and Arabs during Europe\\ 's dark ages who chose to preserve so much of what know about \ '' European culture\ '' that you even know of to use as ammunition against me while on your pedestal .",Turkic,Turkish
ChipAyten,europe,"& gt ; \u201cThey were stopped while traveling on NATO travel orders through Vienna , \u201d\\n\\n [ Austria ] ( http : //januaryharshe.com/wp-content/uploads/2015/06/you-have-no-power-here.jpg.png )",Turkic,Turkish
ChipAyten,europe,No one has a bad thing to say about Turkiye !,Turkic,Turkish
ChipAyten,europe,Id ace that shit so hard,Turkic,Turkish
ChipAyten,europe,Whoooo wants more refugees ! ! !,Turkic,Turkish
ChipAyten,europe,"Diamond and gold hold so many valuable uses in the fields of science , technology , and manufacturing it\\ 's a shame that they\\ 're almost entirely reserved for frivolous usage as \ '' precious\ '' minerals . They\\ 're just atoms .",Turkic,Turkish
ChipAyten,europe,Europe \u2260 EU,Turkic,Turkish
ChipAyten,europe,Because opinions can change over time and unlike America the UK isn\\'t a gang with a \ '' once you\\ 're in you can never leave\ '' policy .,Turkic,Turkish
ChipAyten,europe,But our 70million is just too scary eh . Not into ottoman time i swear,Turkic,Turkish
ChipAyten,europe,An electric anything only gets a fraction of its power from fossil fuels . An internal combustion engine gets 100 % of its energy from fossil fuels .,Turkic,Turkish
ChipAyten,europe,The muslim take over is nearly complete,Turkic,Turkish
ChipAyten,europe,At this point I just think comments in this realm are meant to farm karma points,Turkic,Turkish
ChipAyten,europe,They become more violator-y by continuing to isolate,Turkic,Turkish
ChipAyten,europe,Not Malmo ? at least for basically being Denmark,Turkic,Turkish
ChipAyten,europe,Where else would you find a car stereo for \u00a35 ?,Turkic,Turkish
ChipAyten,europe,Only 23 % down ? Not as bad as I thought,Turkic,Turkish
ChipAyten,europe,"No , bls stay",Turkic,Turkish
ChipAyten,europe,is this because of ... . You know,Turkic,Turkish
ChipAyten,europe,But \ '' not geographically european\ '' is a commonly used non-ascension argument against us,Turkic,Turkish
ChipAyten,europe,Uhh I meant in reference to Turkey protecting Tatars in Crimea,Turkic,Turkish
