user,subreddit,post,family,lang
Dial_A_Dragon,europe,Non-EU immigrants make up [ 7.7 % of the British population ] ( http : //ec.europa.eu/eurostat/documents/3433488/5579176/KS-SF-11-034-EN.PDF/63cebff3-f7ac-4ca6-ab33-4e8792c5f30c ) but take 20.3 % of the welfare ? Is that supposed to be a good figure ?,Germanic,English
Dial_A_Dragon,europe,"If Canada is anything like the US or Australia , then you already have an assimilationist/melting pot model .",Germanic,English
Dial_A_Dragon,europe,\u2018I am firmly convinced that Spain is the strongest country of the world . Century after century trying to destroy herself and still no success.\u2019\\n\\nt . Bismark,Germanic,English
Dial_A_Dragon,europe,"I was half taking the piss , but your assumption that 100 % of all deaths in Africa and India can be attributed to capitalism is even more laughable , honestly .",Germanic,English
Dial_A_Dragon,europe,t. Alberto Barbosa,Germanic,English
Dial_A_Dragon,europe,"[ We do too ] ( http : //smartraveller.gov.au/Countries/europe/western/Pages/default.aspx ) , Belgium and France in particular . Dunno why people are getting butthurt about this ... \\n\\nEDIT : for the US crime rate\\n\\n & gt ; The United States has more violent crime than Australia , although it rarely involves tourists . Mass shootings continue to occur in public places . See Safety and security .",Germanic,English
Dial_A_Dragon,europe,DRINK THIS POISON !,Germanic,English
Dial_A_Dragon,europe,I like how he immediately got destroyed .,Germanic,English
Dial_A_Dragon,europe,"Yeah , either both are protected free political speech or neither are .",Germanic,English
Dial_A_Dragon,europe,Well this is a quality thread.\\n\\nHey /u/blackjack_bot Deal me in .,Germanic,English
Dial_A_Dragon,europe,lol,Germanic,English
Dial_A_Dragon,europe,& gt ; Free speech is cancer\\n\\nFuck right off with that .,Germanic,English
Dial_A_Dragon,europe,Sitting with your legs too far apart on the bus.\\n\\n*Real* injustice .,Germanic,English
Dial_A_Dragon,europe,"& gt ; 1994\\n\\nMaking up for [ lost time ] ( https : //en.wikipedia.org/wiki/Polish_anti-religious_campaign ) , I see .",Germanic,English
Dial_A_Dragon,europe,"Spying is like wanking . Every country does it , but none of them want to be caught doing it .",Germanic,English
Dial_A_Dragon,europe,French rust belt . Right ?,Germanic,English
Dial_A_Dragon,europe,"& gt ; Globalisation has so far primarily benefited the rich industrialized world.\\n\\nWhile this is true , [ most of those benefits have just floated to the top ] ( http : //www.pewresearch.org/files/2014/01/FT_COTW124.png ) of the industrialised countries .",Germanic,English
Dial_A_Dragon,europe,"*\ '' You may have no job any more , no future , the union has abandoned you and you lost your son to heroin addiction , buuut you\\ 're white and therefore privileged , now excuse me while I blow tens of millions of dollars in a state I have no chance of winning ! \ '' *\\n\\nThe Democrats treated the white working class with utter disdain and got the comeuppance they deserved , at least the GOP paid lip service .",Germanic,English
Dial_A_Dragon,europe,t. Dracula,Germanic,English
Dial_A_Dragon,europe,"Tally all those dead up , triple the body count of you want , it still comes in less than the Orlando Shooting . A single event .",Germanic,English
Dial_A_Dragon,europe,Or the Crimean Tatars . Or the Ukrainians . Or the Kazakhs . Or the Cossacks . Or the Volga Germans . Or the Balts . Or ...,Germanic,English
Dial_A_Dragon,europe,"& gt ; Remember the Crusades ? \\n\\nThe Christian defensive wars against centuries of Islamic aggression and conquest ? No , not personally , they happened 1,000 years ago after all .",Germanic,English
Dial_A_Dragon,europe,Manufacturing is a long term investment .,Germanic,English
Dial_A_Dragon,europe,Cultural Christians .,Germanic,English
Dial_A_Dragon,europe,"Fucking hell . Get a life , Jesus.\\n\\nEDIT : seiously , mate . Writing this long , rambling dossier about some nobody on Reddit is profoundly autistic .",Germanic,English
Dial_A_Dragon,europe,"Well , his face is all over their money .",Germanic,English
Dial_A_Dragon,europe,"The person he is responding to is talking about all of Europe , though .",Germanic,English
Dial_A_Dragon,europe,"& gt ; Defeat of Germany : USSR , **Italy**\\n\\nOuch .",Germanic,English
Dial_A_Dragon,europe,"Brits should come down here for a hunting trip , outside of Tasmania foxes are a major pest .",Germanic,English
Dial_A_Dragon,europe,"Labour parties seem to be getting crushed all across the world right now , except here .",Germanic,English
Dial_A_Dragon,europe,"You get the idea . Murdoch is Australian ( US citizenship ) , and a lot of people here hate his influence in our politics too .",Germanic,English
Dial_A_Dragon,europe,"Politicians , presumably .",Germanic,English
Dial_A_Dragon,europe,"A lot of this seems pretty reasonable . Good luck , Britain .",Germanic,English
Dial_A_Dragon,europe,"Poland is experiencing an increase in birth rates , too.\\n\\nMass immigration is just kicking the can down the road .",Germanic,English
Dial_A_Dragon,europe,Who ? Remainers ?,Germanic,English
Dial_A_Dragon,europe,Why is ... whatever that thing is eating Christians ?,Germanic,English
Dial_A_Dragon,europe,"[ Theyre right , though ] ( https : //en.m.wikipedia.org/wiki/History_of_the_Jews_in_France # Antisemitism_and_Jewish_emigration ) \\n\\n & gt ; Immigration from France is on the rise : in the first half of 2015 , approximately 5,100 French Jews made aliyah to Israel marking 25 % more than in the same period during the previous year .",Germanic,English
Dial_A_Dragon,europe,"& gt ; What kind of support do you propose ? \\n\\nFinancial support for children , incentives for having a larger family , pro-natalist propaganda , etc .",Germanic,English
Dial_A_Dragon,europe,"I think he was taking the piss : \\n\\n & gt ; commander , Gerhard von Kamptz , refused to surrender to the Soviets , as his orders were to surrender to the Western Allies . The Germans sent several telegrams to Copenhagen requesting that at least one British soldier should be transferred to Bornholm , so that the Germans could surrender to the western allied forces instead of the Soviets . When von Kamptz failed to provide a written capitulation as demanded by the Soviet commanders , Soviet aircraft relentlessly bombed and destroyed more than 800 civilian houses in R\u00f8nne and Nex\u00f8 and seriously damaged roughly 3,000 more on 7\u20138 May 1945 .",Germanic,English
Dial_A_Dragon,europe,At least Latinos are Christian/secular and Western .,Germanic,English
Dial_A_Dragon,europe,What happened from 1340-1350 ? Plague ? \\n\\nEDIT : yep https : //en.wikipedia.org/wiki/Black_Death never knew it was *that* devastating .,Germanic,English
DisdainForPlebs,europe,"Basically the value of individual shares on the day of the referendum were \ '' artificially\ '' high because they presumed that the uk would vote to remain . When the vote went the other way , people ( particularly people who had bought shares with a loan secured / backed on the market value of their stake ) had suddenly found themselves in a position where , rather than the share they bought for $ 1 being worth $ 1.10 after the uncertainty was over was worth 90c due to the referendum result . To clear their losses they sold . This had the effect of reducing the price of the shares . \\n\\nAs a result the value of the market ( all the shares on the market x their price ) went down . But the intrinsic value of the businesses represented by those shares didn\\'t necessarily change .",Germanic,English
DisdainForPlebs,europe,"I was more dismissing the argument that there is nothing you can do if countries don\\'t want to take people back . There is stuff you can do , though it\\ 's unlikely to pass a cost benefit analysis . \\n\\nand precedent doesn\\'t matter in international matters . Big counties do what they want , no one respects a \ '' well you did it so I should be able to\ '' argument . The US could let France slide but come down hard on Russian aggression and no one would bat an eye .",Germanic,English
DisdainForPlebs,europe,"I would love for you guys to join a freedom of movement agreement . Literally the biggest difference between us all is geography , on every other level we are far more aligned than say Germany , France and the U.K. \\n\\nThe ability to freely work across the anglosphere would be amazing .",Germanic,English
DisdainForPlebs,europe,No wonder alcohol is haram .,Germanic,English
DisdainForPlebs,europe,"Those very same Palestinians ancestors tried to violently put down Jews trying to exercise that same right . Force of arms saw to that.\\n\\nThe general rule is that self determination comes from the barrel of a gun , or the threat of one . No one gives up land and treasure willingly .",Germanic,English
DisdainForPlebs,europe,"Well if we reform the Roman Empire we get claims on its old territories , right ?",Germanic,English
DisdainForPlebs,europe,"Well , you can . You roll up to the border of the country in question armed to the teeth and say \ '' have them back or I\\ 'll turn your country to rubble\ '' . It may not be cost effective and may ruffle a few feathers , but one of the privileges of being a nuclear armed member of the UN security council is that you can do whatever the fuck you like as long as you don\\'t mess with the other big dogs .",Germanic,English
DisdainForPlebs,europe,Honestly whoever comes out and says they will definitely not execute article 50 and ignore the referendum will get the push from party bosses . \\n\\nThe reality is everyone is shitscared of dissolving the UK and the economic impact of trying to leave the EU . \\n\\nHunt should go balls in .,Germanic,English
DisdainForPlebs,europe,But ... Do we remove kebab ? In CK2 and EU4 I always remove kebab .,Germanic,English
DisdainForPlebs,europe,"I expect this will piss off a lot of Jewish , Roma , communist etc survivors and their descendents , and rightfully so . There is no comparison that is valid except that trains feature prominently .",Germanic,English
DisdainForPlebs,europe,"Err , yeah it is . Le Pen is way fucking worse . Trump is an idiot , they are just evil .",Germanic,English
DisdainForPlebs,europe,He did say \ '' or imprison\ '' so he\\ 's got you covered on those that can\\'t be deported .,Germanic,English
DisdainForPlebs,europe,"Honestly a better option for the UK than the euro . Imagine a free trade zone and freedom of movement between the US , UK , Canada , Australia and New Zealand ? Tasty . Very compatible societies from a values perspective and a fucking MASSIVE economic zone to boot .",Germanic,English
DisdainForPlebs,europe,Widely rejected by whom ? It seems to be a norm globally . You try marching yourself over a border in Asia without documentation .,Germanic,English
DisdainForPlebs,europe,"Prisoners dilemma sits at the core of this . The optimal strategy is for people to play a \ '' win win\ '' hand where everyone benefits but no one gets everything they want . \\n\\nWith an absence of trust though , people will play to win , and those playing a self interested hand will always win long term against those that play win-win hands . \\n\\nYou may want to believe that we have somehow evolved past self interested behaviour but a cursory examination of how the world works shows that\\ 's not the case . In that scenario you take care of your own and let the chips fall where they may for everyone else . If you don\\'t you\\ 're the dodo that the world snacks on .",Germanic,English
DisdainForPlebs,europe,[ Greece has that covered ] ( https : //encrypted-tbn2.gstatic.com/images ? q=tbn : ANd9GcRXuz-x15V_RIbqzWFWxDjlvqYdKNzq5YXWEabdX_oRloivAIDGsk1EEA-2 ),Germanic,English
DisdainForPlebs,europe,"Yep , visited friends over there and it was as if everyone was a rally driver . Mental .",Germanic,English
DisdainForPlebs,europe,Either way it means that right now putting your neck on the line with the expectation that no one will let the blade fall is foolish .,Germanic,English
DisdainForPlebs,europe,This pleases me greatly .,Germanic,English
DisdainForPlebs,europe,Nah spiting Europe is really fun at this point .,Germanic,English
DisdainForPlebs,europe,Proper northerners . Well done .,Germanic,English
DisdainForPlebs,europe,Filthy eurotrash can not understand the nature of an Australian style shitpost . It is beyond their ken .,Germanic,English
DisdainForPlebs,europe,Definitely liberation of your Teuton brethren : ),Germanic,English
DisdainForPlebs,europe,Honestly if it is just going to b uniting Europe under the banner of house Lancaster I can get behind the project .,Germanic,English
DisdainForPlebs,europe,Basically it confirmed that Xabi was the only one in the squad that reads .,Germanic,English
DisdainForPlebs,europe,"When have conquered peoples ever expected anything other than subjugation ? Over time those people got some benefits ( i.e . better security , albeit a bit soft in the commitment to it ) but I agree the constant depression of being tax harvested and looted is a pretty massive downside .",Germanic,English
DisdainForPlebs,europe,This is a proper nimble navigator .,Germanic,English
DisdainForPlebs,europe,I hope the players use it . Would hate to see another repeat of Spain 2010 / Thyssen-Bornemisza Museum where only Xabi Alonso turned up . : (,Germanic,English
DisdainForPlebs,europe,"Last king to win his crown on the field , recovered his country from civil war and led to a peaceful succession , maintained control of a rebellious nobility through fines and penalties rather than violence ... Definitely a contender . I would want him as an espionage type alterEnglish ruler to Elizabeth .",Germanic,English
DisdainForPlebs,europe,"This comment has been overwritten by an open source script to protect this user & amp ; apos ; s privacy . It was created to help protect users from doxing , stalking , and harassment . \\n\\n If you would also like to protect yourself , add the Chrome extension [ TamperMonkey ] ( https : //chrome.google.com/webstore/detail/tampermonkey/dhdgffkkebhmkfjojejmpbldmpobfkfo ) , or the Firefox extension [ GreaseMonkey ] ( https : //addons.mozilla.org/en-us/firefox/addon/greasemonkey/ ) and add [ this open source script ] ( https : //greasyfork.org/en/scripts/10380-reddit-overwrite ) . \\n\\n Then simply click on your username on Reddit , go to the comments tab , scroll down as far as possibe ( hint : use [ RES ] ( http : //www.redditenhancementsuite.com/ ) ) , and hit the new OVERWRITE button at the top .",Germanic,English
DisdainForPlebs,europe,Christ Farage is to the left of Obama on a lot of issues . If Nigel Farage is the face of British fascism I can sleep easy . He looks like my uncle who sells dodgy used cars .,Germanic,English
DisdainForPlebs,europe,"First world powers . We do whatever the fuck we want , Kind of the point of NATO hegemony .",Germanic,English
DisdainForPlebs,europe,Also outmanoeuvred by a centre-right woman . If the shoe fits ...,Germanic,English
DisdainForPlebs,europe,"Or the huge number of Australians , Americans , Canadians and New Zealanders that world love to live and work in Europe but are largely denied because reasons .",Germanic,English
DisdainForPlebs,europe,"Yeah bro . Come to south London . Carrib culture alive and well , for the most part working fine .",Germanic,English
DisdainForPlebs,europe,"I could rent it from you , for a fee ...",Germanic,English
DisdainForPlebs,europe,Flock of entrepreneurs who will drive them 50kn away then rob them blind . FTFY .,Germanic,English
DisdainForPlebs,europe,We would love it . Banter aside you guys are always welcome .,Germanic,English
DisdainForPlebs,europe,Dat decline in real wages ...,Germanic,English
DisdainForPlebs,europe,"Christ these people piss me off . They look at US immigration and say big numbers , big startups , correlation ! Not noticing that the vast majority of immigrants are skilled workers sponsored under visas rather than the lucky fuckers coming in on the green card lottery .",Germanic,English
DisdainForPlebs,europe,Australia does the same . Funnily illegal immigration is way down since we started clamping down on all their bullshit and put them in shitty tropical island camps .,Germanic,English
DisdainForPlebs,europe,"Yep . You Germans are the only competent people in the world , I forgot . Those damnable brown people are completely useless , my mistake .",Germanic,English
DisdainForPlebs,europe,"Morocco promises terror , Australia promises \ '' happy camps\ '' . : )",Germanic,English
DisdainForPlebs,europe,Relevant flair .,Germanic,English
DisdainForPlebs,europe,"Cut and pasted from a previous reply : \\n\\n -- -- -- -- -- -- -- -- -- -- -- -- -\\n\\nFirst of all , the literacy level in Syria , defined as \ '' the percentage of the population age 15 and above who can , with understanding , read and write a short , simple statement on their everyday life . Generally , \u2018literacy\u2019 also encompasses \u2018numeracy\u2019 , the ability to make simple arithmetic calculations.\ '' , Syria only has a literacy rate of 86 % in their own language , let alone useful foreign ones . Countries in the developed world don\\'t even bother tracking this statistic , but note countries like Azerbaijan have that at 100 % .\\nSecondly , their tertiary education level , defined as ISCED 5 and 6 ( for reference , this standard includes both short cycle , practical focused education as well as Bachelor level courses ( see p. 48-54 ) , is at around 33 % . Note that this is enrollment , not completion . Compare the stats for OECD countries , it is night and day.\\nAs noted in this EU report at page 15 , the infrastructure for education is not great ( and I\\ 'm being generous ) and a large number of the enrolled students are totally unprepared for studies and drop out , which is an indicator that the graduation rate is substantially lower . It also notes that only c.4000 students are educated overseas each year , so it\\ 's not like there is a large cadre of Harvard grads slumming it in Damascus waiting to get out.\\nStatistically are Syrian migrants likely to be better educated than Afghanis , Pakistanis and those from Africa ? The stats from the world bank say yes . But they\\ 're miles away from migrants coming to the EU from OECD countries , East Asia and even migrants from conflict zones in former Soviet bloc countries like Ukraine . Most of these migrants simply are not set up to succeed in Europe.\\nNote all the sources are from the World Bank , UNESCO or the EU - I\\ 'm not citing fringe sources .",Germanic,English
DisdainForPlebs,europe,Commonwealth workers seem to do fine and have done since they were booted from the right to reside in 73 . Amazingly people will still want to go to the UK even once its outside the EU .,Germanic,English
DisdainForPlebs,europe,"Agreed , but outside of Europe it still has a massive hold over public consciousness , rivalled only by Paris in Europe.\\n\\nCome to Asia or Africa . The only city in Europe that most care to visit is London .",Germanic,English
DisdainForPlebs,europe,10 years ago,Germanic,English
DisdainForPlebs,europe,"Well it lasted the better part of 1500 years , and for a lot of it securely . Was it perfect ? Of course not and a lot of people got proper fucked by barbarians . But within its borders there was rule of law and security of a form . Large swathes of the world were completely lawless at the time .",Germanic,English
DisdainForPlebs,europe,Rome went the same way and turned out great . Bring on a God Emperor for Europe .,Germanic,English
DisdainForPlebs,europe,Preach dude . We need about two thirds of us to voluntarily walk into the sea .,Germanic,English
DisdainForPlebs,europe,Lil Jon - Get Low . English speaking master race : ),Germanic,English
DisdainForPlebs,europe,We also have swamp Germans,Germanic,English
DisdainForPlebs,europe,The security of the civilian population of Europe is more important than the PR impact of drastic measures .,Germanic,English
DisdainForPlebs,europe,"This comment has been overwritten by an open source script to protect this user & amp ; apos ; s privacy . It was created to help protect users from doxing , stalking , and harassment . \\n\\n If you would also like to protect yourself , add the Chrome extension [ TamperMonkey ] ( https : //chrome.google.com/webstore/detail/tampermonkey/dhdgffkkebhmkfjojejmpbldmpobfkfo ) , or the Firefox extension [ GreaseMonkey ] ( https : //addons.mozilla.org/en-us/firefox/addon/greasemonkey/ ) and add [ this open source script ] ( https : //greasyfork.org/en/scripts/10380-reddit-overwrite ) . \\n\\n Then simply click on your username on Reddit , go to the comments tab , scroll down as far as possibe ( hint : use [ RES ] ( http : //www.redditenhancementsuite.com/ ) ) , and hit the new OVERWRITE button at the top .",Germanic,English
DisdainForPlebs,europe,I got ta say if the EU was reformed in such a way I would have been much happier remaining .,Germanic,English
DisdainForPlebs,europe,"This comment has been overwritten by an open source script to protect this user & amp ; apos ; s privacy . It was created to help protect users from doxing , stalking , and harassment . \\n\\n If you would also like to protect yourself , add the Chrome extension [ TamperMonkey ] ( https : //chrome.google.com/webstore/detail/tampermonkey/dhdgffkkebhmkfjojejmpbldmpobfkfo ) , or the Firefox extension [ GreaseMonkey ] ( https : //addons.mozilla.org/en-us/firefox/addon/greasemonkey/ ) and add [ this open source script ] ( https : //greasyfork.org/en/scripts/10380-reddit-overwrite ) . \\n\\n Then simply click on your username on Reddit , go to the comments tab , scroll down as far as possibe ( hint : use [ RES ] ( http : //www.redditenhancementsuite.com/ ) ) , and hit the new OVERWRITE button at the top .",Germanic,English
DisdainForPlebs,europe,Agreed . Joe average has a lot more to worry about than terrorism .,Germanic,English
DisdainForPlebs,europe,"This comment has been overwritten by an open source script to protect this user & amp ; apos ; s privacy . It was created to help protect users from doxing , stalking , and harassment . \\n\\n If you would also like to protect yourself , add the Chrome extension [ TamperMonkey ] ( https : //chrome.google.com/webstore/detail/tampermonkey/dhdgffkkebhmkfjojejmpbldmpobfkfo ) , or the Firefox extension [ GreaseMonkey ] ( https : //addons.mozilla.org/en-us/firefox/addon/greasemonkey/ ) and add [ this open source script ] ( https : //greasyfork.org/en/scripts/10380-reddit-overwrite ) . \\n\\n Then simply click on your username on Reddit , go to the comments tab , scroll down as far as possibe ( hint : use [ RES ] ( http : //www.redditenhancementsuite.com/ ) ) , and hit the new OVERWRITE button at the top .",Germanic,English
DisdainForPlebs,europe,There are 250m of them . Some actually do have skills that are marketable .,Germanic,English
DisdainForPlebs,europe,"And back with sources . First of all , the literacy level in Syria , defined as \ '' *the percentage of the population age 15 and above who can , with understanding , read and write a short , simple statement on their everyday life . Generally , \u2018literacy\u2019 also encompasses \u2018numeracy\u2019 , the ability to make simple arithmetic calculations . *\ '' , [ Syria only has a literacy rate of 86 % in their own language ] ( http : //data.worldbank.org/indicator/SE.ADT.LITR.ZS ) , let alone useful foreign ones . Countries in the developed world don\\'t even bother tracking this statistic , but note countries like Azerbaijan have that at 100 % .\\n\\nSecondly , their tertiary education level , defined as ISCED 5 and 6 ( for reference , this standard includes [ both short cycle , practical focused education as well as Bachelor level courses ] ( http : //www.uis.unesco.org/Education/Documents/isced-2011-en.pdf ) ( see p. 48-54 ) , [ is at around 33 % ] ( http : //data.worldbank.org/indicator/SE.TER.ENRR ) . Note that this is enrollment , not completion . Compare the stats for OECD countries , it is night and day.\\n\\nAs noted in [ this EU report ] ( http : //eacea.ec.europa.eu/tempus/participating_countries/higher/syria.pdf ) at page 15 , the infrastructure for education is not great ( and I\\ 'm being generous ) and a large number of the enrolled students are totally unprepared for studies and drop out , which is an indicator that the graduation rate is substantially lower . It also notes that only c.4000 students are educated overseas each year , so it\\ 's not like there is a large cadre of Harvard grads slumming it in Damascus waiting to get out.\\n\\nStatistically are Syrian migrants likely to be better educated than Afghanis , Pakistanis and those from Africa ? The stats from the world bank say yes . But they\\ 're miles away from migrants coming to the EU from OECD countries , East Asia and even migrants from conflict zones in former Soviet bloc countries like Ukraine . Most of these migrants simply are not set up to succeed in Europe.\\n\\nNote all the sources are from the World Bank , UNESCO or the EU - I\\ 'm not citing fringe sources .",Germanic,English
DisdainForPlebs,europe,"But despite all the bullshit it was still your preference , right ?",Germanic,English
DisdainForPlebs,europe,"Oh you sweet summer child . Come to the colonies , shit is fucked !",Germanic,English
DisdainForPlebs,europe,Of happenings ! !,Germanic,English
DisdainForPlebs,europe,Good luck with the mass migration stuff mate . Let us know how it works out when your welfare states collapse .,Germanic,English
DisdainForPlebs,europe,Agreed,Germanic,English
DisdainForPlebs,europe,Mountains and Albanians I expect .,Germanic,English
DisdainForPlebs,europe,"You\\ 're bang on . I my position can basically be summed up as \ '' I want *a* European Union , just not *this* European Union\ '' .",Germanic,English
