DaPorter,europe,"I apologize for the inflammatory remarks , but I believe using an argument such as \ '' we don\\'t owe shit\ '' represents a way of thinking that will harm the Scandinavian welfarestates far more than a failing immigration policy . \\n\\nYou should remeber that these policies have been in place since the 70ies , a period of time where the Scandinavian welfare-states have expanded quite a bit . So you could easily argue that to a certain point these policies have been very successful.\\n\\nI think you misunderstand the concept of solidarity , and underestimate how powerful an idea it has been in building Scandinavian society .",Germanic,Norwegian
DaPorter,europe,"Sweden , Ireland .",Germanic,Norwegian
DaPorter,europe,"You are correctly quoting me , and then deliberately misrepresenting my statement in the next sentence . Great argument . Good night .",Germanic,Norwegian
DaPorter,europe,"Yes , the world is a cold and hard place where only the strong survive . Holistic view points are for pussies !",Germanic,Norwegian
DaPorter,europe,"They are here . It is home.\\n\\nI don\u2019t think its correct that the welfare states of Scandinavia has been declining since the 90ies . Rather we are constantly the top 3 in all kinds of statistics trying to show what countries are the best to live in.\\n\\nThe problem is accepting more people to come here , when we are currently unable to offer them the opportunity to partake in this society . It becomes a 2nd segment of society where the general opportunity and prosperity offered to the rest is not available . That is the problem.\\n\\nWe need to stop now , while we are ahead ( in most ways ) . Fix the problems we have already before we can think about expanding our populations further.\\n\\nOur societies are built on the idea of solidarity , sending people out of the country that they ( and we ) have made their home , would be more damaging to our societal model than continued immigration .",Germanic,Norwegian
DaPorter,europe,"This is in a suburb to the city of Harstad , and as a suburb/small town at least in Northern Norway this is extremely typical.\\n\\n [ This type of house ] ( https : //www.google.se/maps/ @ 68.7450461,16.5445267,3a,75y,291h,81.06t/data= ! 3m6 ! 1e1 ! 3m4 ! 1sBNjlBT1u1w9KdTK6Xv34CA ! 2e0 ! 7i13312 ! 8i6656 ) that you see here is called a \ '' Husbank hus\ '' and they where built in droves in the 70ies and 80ies . \\n \\nBasically it\\ 's a form of subsidized mortgage from the [ Norwegian Housing bank ] ( https : //en.wikipedia.org/wiki/Norwegian_State_Housing_Bank ) , and you pick the house you want to build from a catalog with some variety in size and shape , but the basic design is unmistakable.\\n\\nEarlier more traditional type of farm or village houses [ looks like this ] ( https : //www.google.se/maps/ @ 69.0383813,17.4781476,3a,75y,113.73h,79.55t/data= ! 3m6 ! 1e1 ! 3m4 ! 1svGKsBwO7BBLRCy2NQnSfUQ ! 2e0 ! 7i13312 ! 8i6656 ) \\n\\nI don\\'t know if all this holds true for all of Norway , but drive through the Northern Norwegian countryside these two will be an extremely common sight.\\n",Germanic,Norwegian
DaPorter,europe,\ '' You have some space here on your back ? \ '' \\n\\n\ '' Nah I want it on my forehead.\ '' \\n\\n\ '' Are you really sure you want to ... \ '' \\n\\n\ '' I said fuck my shit up fam ! \ '' \\n,Germanic,Norwegian
DaPorter,europe,My ( admittedly poor ) attempt at a direct translation . Svartvanns might be better .,Germanic,Norwegian
DaPorter,europe,"I think you are right . Its not responsible to keep doing it . And I agree that its absurd to uphold a policy that was created under vastly different circumstances than what Sweden are facing today . \\n\\nedit : The point is I don\u2019t think its the immigration or immigrants in themselves that are the problem , but rather despite being a generally affluent society , we don\u2019t really have anything to offer these people once they come here , and in the end , that is what is creating the problem .",Germanic,Norwegian
DaPorter,europe,You need to read some evolutionary psychology . Cheap analogies are far from sufficient to explain the complexity of human evolution and and human society .,Germanic,Norwegian
DaPorter,europe,& gt ; \ '' He\\ 's not sneaking it in . It\\ 's clear as day . He means arabs and other forms of junk from the middle east pouring in to Europe.\ '' \\n\\nYou are a fucking racist .,Germanic,Norwegian
DaPorter,europe,Having lived in Ireland for a few years I\\ 'm not surprised . They are very much a people that adopt a \ '' live and let live\ '' policy .,Germanic,Norwegian
DaPorter,europe,"It has everything to do with the new global economy . Pray tell where the low-skill entry-level Swedish industrial jobs went off to ? \\n\\nEdit : the article also points out that the conditions present in Sweden when this policy was put in to motion was vastly different from what they are today . Its not really a matter if it was the right thing to do then , but if it is responsible to keep doing it under current conditions .",Germanic,Norwegian
DaPorter,europe,Using the power of your singular focus and flawed logic no doubt . Empircal method ? hah ! Hippie talk .,Germanic,Norwegian
DaPorter,europe,I have said plenty of other things . But I am met with misrepresentation of my statements and gross oversimplification of complex issues . I thought the fact that you where an irrational racist was actually an important thing to point out .,Germanic,Norwegian
DaPorter,europe,Translation : \\n\\nChildren : Moose ! Look the moose ! \\n\\nDriver : Yes there he was ! \\n\\nChildren : And there too ! \\n\\n*crash*\\n\\nDriver : Devils roasted hell ! ! Fuck !,Germanic,Norwegian
DaPorter,europe,Data from 2014 . Swedish meteorological institute .,Germanic,Norwegian
DaPorter,europe,"Being skeptical of foreign cultural influence and religious \ '' cults\ '' , might earn you the label \ '' cautious\ '' . Calling them \ '' Arabs and other junk\ '' earns you the distinction of being a racist fucking idiot .",Germanic,Norwegian
DaPorter,europe,"You are assuming that these problems are caused by cultural friction alone . And yes , you are adding your own idiotic interpretations to what I\\ 'm saying.\\n\\nSuch as , Social democratic ideas are the basis of most political parties in Scandinavia . \ '' we are all Social Democrats\ '' . That\\ 's misrepresentations , and oversimplification . \\n\\n\\nTypical Hippie talk ? Are you 12 years old ? At least we are not resorting to cheap domination tactics in this discussion . I\\ 'm anything but a stereotypical hippie , but you my friend are the fucking blueprint of lowbrow right wing xenophobic asshole .",Germanic,Norwegian
DaPorter,europe,"If that seems appropriate to you , by all means , cry your eyes out .",Germanic,Norwegian
DaPorter,europe,"I would think someone with half a brain would have trouble reading this article , let alone for themselves decipher and understand complex socio-economical problems arising in a new global economy .",Germanic,Norwegian
DaPorter,europe,"Social solidarity requires widespread opportunities . Cultural homogeneity in my opinion has fuck all to do with it , and if you read the article , that\u2019s not what is argued either .",Germanic,Norwegian
DaPorter,europe,"Read RamlinRambos post history . He is a racist rightwing extremist . He is delusional and irrational , no way to have a reasonable debate with him .",Germanic,Norwegian
DaPorter,europe,"If only there was some sort of national defense you join and be a part of , to organize against the coming cultural war . Some organization with clear easy to understand ideas , simple and effective organizational structure , and with awesome logos .",Germanic,Norwegian
DaPorter,europe,"Cameltoed birch is the finest of materials , and in the land of Norway , only the best will do .",Germanic,Norwegian
DaPorter,europe,"If you are going to make claims on who survives and or not , survival of the fittest , you might want to research what actually constitutes fit in human evolution . Hint : an underdeveloped frontal cortex and poor sense of empathy is not it .",Germanic,Norwegian
DaPorter,europe,Lovely side effect of untreated ADD .,Germanic,Norwegian
DaPorter,europe,"& gt ; A lot of these forests are wild growth , though . \\n\\nI see hear a lot of swedes saying similar things , but the fact of the matter is that natural forest is less than [ 3 percent of the total forested area . ] ( https : //sv.wikipedia.org/wiki/Naturskog ) \\n",Germanic,Norwegian
DaPorter,europe,"Northern Norwegians are pretty friendly and welcoming , the pints are till triple tho , but then again the wages are double , so not all bad .",Germanic,Norwegian
DaPorter,europe,"Haha . But not really quite that simple , traditional dress or better described as folk costume are garments worn ceremoniously , usual in some sort of national or regional celebration . In large they are romanticized version of peasant clothing of the previous decades .",Germanic,Norwegian
DaPorter,europe,All good Subs will sit down and discuss the meta at times . Its how community moderating works best .,Germanic,Norwegian
DaPorter,europe,Why do you consider him \ '' less than credible ? \ '' \\n,Germanic,Norwegian
DaPorter,europe,"I think we should be more concerned about your bias than Tim Pools . Just to add I think mods like you that moderate this sub according to obvious political and moral bias has ruined this sub and made sure that there are no longer any real or interesting discussions taking place here , only page up and page down with meaningless fluff .",Germanic,Norwegian
DaPorter,europe,97 percent of forest is Sweden is cultured . What remains of old growth is mostly mountain birch and natural forest is extremely limited . There are forest that looks like \ '' wild growth\ '' with mixed pine and birch and aspen but it\\ 's all part of managed landscape .,Germanic,Norwegian
DaPorter,europe,You can\\'t give a conclusion based on admittedly wrongful assumptions backed by calculation of irrelevant numbers and claim that your argument still stands.\\n\\nNobody was suggestion the level of production you \ '' proved\ '' can\\'t be done .,Germanic,Norwegian
DaPorter,europe,Your copy paste function seems to be malfunctioning .,Germanic,Norwegian
DaPorter,europe,[ English translation ] ( https : //translate.google.no/translate ? sl=sv & amp ; tl=en & amp ; js=y & amp ; prev=_t & amp ; hl=sv & amp ; ie=UTF-8 & amp ; u=http % 3A % 2F % 2Fwww.svd.se % 2Fregeringen-presenterar-atgarder-mot-bilbrander % 2Fom % 2Fbilbranderna & amp ; edit-text= & amp ; act=url ) \\n\\n [ National police to divert drones and motorcycle police to Malm\u00f6 ] ( https : //translate.google.no/translate ? hl=sv & amp ; sl=sv & amp ; tl=en & amp ; u=http % 3A % 2F % 2Fwww.svd.se % 2Fdronare-och-fler-mc-poliser-mot-bilbranderna % 2Fom % 2Fbilbranderna ),Germanic,Norwegian
DaPorter,europe,Again you have manged to extract my exact meaning from what I have written .,Germanic,Norwegian
DaPorter,europe,"http : //www.reddit.com/r/conspiracy/comments/265i1k/florida_man_cooked_to_death_in_scalding_shower_as/chnyyfy\\n\\nThank you for coming in and volunteering more good examples.\\n\\n\\nedit : the post in questions has been deleted , likely by the subs moderators.\\n\\n/u/RacoonH8 wrote this : \ '' Hadn\\'t you still realised pattern , that absolute majority of fucked ups in Florida are related with .. niggers ? \ ''",Germanic,Norwegian
DaPorter,europe,"Hey bru u prolly no taht better than me\\n\\nSubmission removed cuz local news.\\n\\nAnd adding again , two mods participate in this thread and both seem to be going out of their way to be as arrogant and condescending as possible . You even purposely expand me saying \ '' mods like you\ '' to envelop \ '' all mods of /r/europe\ '' . And I\\ 'm not saying he is pushing an ideology , I\\ 'm saying he is doing a piss poor job at being an objective moderator .",Germanic,Norwegian
DaPorter,europe,& gt ; I don\\'t suppose you have any evidence of that from the past year ? \\n\\nShow me the mod logs and lets look at how \ '' local news\ '' is applied and I\\ 'll be perfectly happy to point out which stories I think are moderated incorrectly.\\n,Germanic,Norwegian
DaPorter,europe,"The racist remark is for other people , the irrational idiot is for you .",Germanic,Norwegian
DaPorter,europe,When was it removed ?,Germanic,Norwegian
DaPorter,europe,"Sure , so am I. I also enjoy objecting the objectionable instead of simply passing it by .",Germanic,Norwegian
DaPorter,europe,And yet that is exactly what you are doing .,Germanic,Norwegian
DaPorter,europe,This exactly . I believe we can discuss these things and voice our opinions without resorting to pseudo-scientific claims on genetics .,Germanic,Norwegian
DaPorter,europe,"You know what I stopped posting and reading this sub when \ '' must warn others\ '' removed a post I made about national phenomenon of car burnings last year , under the local news guideline . It was first removed for being an undependable source ( despite being aftonbladet , swedens largest newspaper ) and then when reposted it was taken of applying the local news guideline.\\n\\nI have a really hard time accepting that was not due to moral and political bias.\\n\\n\\nSaying that Tim Pool should have been removed because he is not an accredited journalist is just to strange . He is marketing himself as an independent reporter and what he offers is interviews with different people and leaves the judgment up to the viewers . Subscribers should be able to judge this content on its own merits using votes and posts.\\nRemoving low effort blog-spam , yes please , but removing this under the same pretense is bizarre.\\n\\n\\n\\n\\nAnd again , adding : Saying he is inherently unreliable because he took money from inforwars would certainly justify closer vetting of the funding of other news publications as well .",Germanic,Norwegian
DaPorter,europe,/r/european is leaking .,Germanic,Norwegian
DaPorter,europe,Good job Norway . I predict this will have close to zero effect on the rate of deforestation .,Germanic,Norwegian
DaPorter,europe,"If you read my post you will see that I am not calling for censorship , I am asking people to object to your hateful opinions rather than simply ignoring them .",Germanic,Norwegian
DaPorter,europe,Because one is dangerous pseudo-science that can easily lead to some very frightening conclusions with often horrific solutions . \\n\\nThe other one is a subjective opinion that suggests that whatever is wrong with said culture is possible for an individual to overcome .,Germanic,Norwegian
DaPorter,europe,You suggested that by adopting a \ '' gypsy\ '' and thus removing nurture from the equation you would still be unable to turn him/her from begging and pissing in the corners . Your views are disgusting .,Germanic,Norwegian
DaPorter,europe,"It is in a way , like paying these countries to not develop .",Germanic,Norwegian
DaPorter,europe,"And if you keep being happy ignoring it , you can be guaranteed nothing will change .",Germanic,Norwegian
DaPorter,europe,Nord.link is the single biggest power infrastructure project currently being undertaken in Norway . Huge contracts being awarded to Norwegian and European contractors to in order to complete it.\\n\\nI have a conference call with a project leader for one of the contractors for the land based installation in Noway later today actually . This contract alone is valued at close to 1 billion NOK . \\n\\nI think this is the first time my idle Reddit browsing is actually work related.\\n\\n,Germanic,Norwegian
DaPorter,europe,Oh he will come . Just wait .,Germanic,Norwegian
DaPorter,europe,In before /u/RamblinRambo starts spouting his Nazi stormfront garbage.\\n\\nhttp : //www.reddit.com/r/europe/comments/267mmq/reurope_what_does_an_average_family_home_look/chontsu\\n,Germanic,Norwegian
DaPorter,europe,"And yet in Norway this field of law is called \ '' strafferett\ '' ( penalty law ) , and the specific laws of penalty are called \ '' straffeloven\ '' ( the penalty law ) , and the sentence is called \ '' straff\ '' ( penalty ) .\\n\\n I guess the big cultural difference between Scandinavia and the US , is the prison system it self , which interestingly is called \ '' kriminalomsorgen\ '' ( criminal care ) .\\n\\nKriminalomsorgen is tasked with exacting punishment , but also to rehabilitate . Punishment is an essential part of our justice system .",Germanic,Norwegian
DaPorter,europe,I think we eat more . [ \ '' Spagetti og kj\u00f8ttdeig\ '' ] ( http : //www.superkokken.no/wp-content/uploads/2012/01/DSC_0846-i-blogg-Spaghetti-al-rag % C3 % BA.jpg ) is basically our national dish . It\\ 's kinda like a shitty take on Spaghetti Bolognese .,Germanic,Norwegian
DaPorter,europe,"& gt ; \ '' The decision by STOXX , which manages Europe\\ 's top benchmark stock indexes , was announced on Tuesday after Deutsche Bank had lost almost 90 percent of the stock value it had during its 2007 peak\ '' \\n\\nI thought Germany\\ 's banking sector was pretty healthy ?",Germanic,Norwegian
DaPorter,europe,English translation : https : //translate.google.no/translate ? hl=sv & amp ; sl=no & amp ; tl=en & amp ; u=http % 3A % 2F % 2Fwww.vg.no % 2Fnyheter % 2Fis % 2Fto-menn-fra-oestfold-doemt-for-is-deltakelse-og-terrorforbund % 2Fa % 2F23754936 % 2F,Germanic,Norwegian
DaPorter,europe,You mean the immigrant funnel ? BLOW IT UP 2016 !,Germanic,Norwegian
DaPorter,europe,You share a lot with the Nordic nations . Like enjoying taste of salty licorice .,Germanic,Norwegian
DaPorter,europe,Your post is literally the opposite of right wing persecution complex .,Germanic,Norwegian
DaPorter,europe,"Coming from a swede that means a lot . We call him Tugen , for short .",Germanic,Norwegian
DaPorter,europe,Yeah I thought it was cool to .,Germanic,Norwegian
DaPorter,europe,"\\nLike the others said Italian citizenship means you can work anywhere in the EU , including the [ EFTA ] ( http : //en.wikipedia.org/wiki/European_Free_Trade_Association # Membership_history ) countries\\n\\nhttp : //www.toplanguagejobs.co.uk/\\n\\nMainly call center and other types of language jobs . Might be a good place to start .",Germanic,Norwegian
DaPorter,europe,Intuitively you would want to punish criminals .,Germanic,Norwegian
DaPorter,europe,Hey John . Fuck you ! Why ? Please ask why .,Germanic,Norwegian
DaPorter,europe,"Finnland is by far the most backwards country in Northern europe . Alcoholics , homophobics , racists , sexists , all still accepted in Finnland . The shining beacon .",Germanic,Norwegian
DaPorter,europe,"Only that Sweden and Norway utilizes all the letters in our alphabets , while Danish is pronounced using just the vowels .",Germanic,Norwegian
DahlsPils,europe,Second place : \ '' Trainwreck\ '',Germanic,Norwegian
Dakario,europe,[ No words ] ( http : //www.reactiongifs.com/wp-content/uploads/2013/10/tom-delonge-wtf1.gif ),Germanic,Norwegian
Dakario,europe,Iirc he has dyslexia and \ '' Kungen\ '' is swedish for king,Germanic,Norwegian
DameHumbug,AskEurope,"Just a woosh , happens to the best of us .",Germanic,Norwegian
DameHumbug,AskEurope,How is vaping in Turkey though ?,Germanic,Norwegian
DameHumbug,AskEurope,The EU crisis .,Germanic,Norwegian
DameHumbug,europe,We are not signatories on the ban so we are not bound by it unlike Japan .,Germanic,Norwegian
DameHumbug,AskEurope,"As a subtopic of major topics if relevant.\\n\\nExample\\u200b : WW2 , you would be part of that major topics . \\n\\nAmerica in itself is not a historical topic we learned about .",Germanic,Norwegian
DameHumbug,AskEurope,E-numbers\\xa0identify food additives that have been shown to be safe and officially approved for use in food across the EU .,Germanic,Norwegian
DameHumbug,AskEurope,"Some good , some knows words not the language do there is a lot of pointing and guessing.\\n\\n\\nI like accents so I notice new ones easily and feel I got a decent grasp on English and non English accents.\\n\\nWord genders . There is no reason pizza should be male or a door is female but it is and you just have to learn by using .",Germanic,Norwegian
DameHumbug,AskEurope,R\u00e5nnere . They tend to be younger people that enjoy cars and driving around aimlessly . Shitty car mods are not unusual neither is loud music of the house genre .,Germanic,Norwegian
DameHumbug,AskEurope,Try making one thread including all three questions next time .,Germanic,Norwegian
DameHumbug,AskEurope,"I agree to some degree , natural growth is the best .",Germanic,Norwegian
DameHumbug,AskEurope,"Yeah , i scratch my allergy hives until they bleed sometimes . Makes my legs look great . Luckily the tape seems to have worked though so i hope you find something that works for you too.\\n",Germanic,Norwegian
DameHumbug,AskEurope,"Part of science , everything from general puberty hygiene , puberty changesyou , how to masturbate , sex and babies . \\n\\n12-13 ish for me . I think earlier now and there is a show on YouTube now done by the Norwegian broadcasting company for even younger kids . Remember it causing a stir fro other countries on how it was to early to teach kids etc . The NRK responded by adding English subtitles.\\n\\nAsk whatever , get answers was the name of the game .",Germanic,Norwegian
DameHumbug,AskEurope,"Hehehehe , brownie points .",Germanic,Norwegian
DameHumbug,AskEurope,Big selection but not without proper gun laws .,Germanic,Norwegian
DameHumbug,AskEurope,"Hehe , why ?",Germanic,Norwegian
DameHumbug,AskEurope,I tried to google some before i answered to make sure i got the island names right but had to use phone so it was halfassed answer but at least not a wrong one .,Germanic,Norwegian
DameHumbug,AskEurope,Why do so many poles travel abroad to work then ? Is it just the money ?,Germanic,Norwegian
DameHumbug,AskEurope,Vikings on Orkney is the only one i can think of,Germanic,Norwegian
DameHumbug,AskEurope,Just sort of happened,Germanic,Norwegian
DameHumbug,AskEurope,"Not far but a fair distance for me and I would take train , buss or plane instead if there was no need for me to drive .",Germanic,Norwegian
DameHumbug,AskEurope,"Should include where they answer from then ( so should people with non explaining flairs like the EU one ) . If so then it\\ 's a totally legit reason to answer as they bring relevant info and not some r/askreddit style \ '' not x , but ... \ '' to the table .",Germanic,Norwegian
DameHumbug,AskEurope,This has been asked before just\\u200b days ago .,Germanic,Norwegian
DameHumbug,AskEurope,It comes in a tube and in boxes . Tubes is not weirder for us than Americans getting mayo in jars or Canadians milk in bags .,Germanic,Norwegian
DameHumbug,AskEurope,"We voted no , while saying we would vote yes if done differently.\\n\\nhttp : //www.icanw.org/campaign-news/results/\\n\\n\ '' In our view , a legally binding framework should be based on the balanced , \\rmutual , irreversible and verifiable elimination of nuclear weapons . This resolution , however , calls for the legal measures to be put in place first . For this sequence to be effective , all possessor states need to participate , as they \\r\\ndid in the process leading to the conclusion of the Chemical Weapons Convention . We need to recognize that in the present circumstances nuclear-\\r\\nweapon states are not ready to engage in negotiations on a prohibition of\\rnuclear weapons . Negotiations in which nuclear-weapon states do not take \\r\\npart will not have any real impact.\ ''",Germanic,Norwegian
DameHumbug,AskEurope,"No , I want to understand you not have some fake pride in you saying my country name in my horrid language . Call it the \ '' the not Finland bread part of the Sweden sandwich\ '' , long as I understand you all is good .",Germanic,Norwegian
DameHumbug,AskEurope,I tried to look for rules regarding it ( not super well though so might have missed something ) and i could only find the rule \ '' If it hasn\\'t been ten years since last time you did it\ '' but even that rule has exceptions . I know there are laws against what you can change it to which is what i thought the question was about .,Germanic,Norwegian
DameHumbug,AskEurope,Last time i \ '' tipped\ '' was when i just didn\\'t want stupid coin change back .,Germanic,Norwegian
DameHumbug,AskEurope,Driveby skiing is my preferred term for this .,Germanic,Norwegian
DameHumbug,AskEurope,"You forgot , \ '' pick one country to live in other than your own/what\\ 's your favourite country except your own\ ''",Germanic,Norwegian
DameHumbug,AskEurope,Serves you right . Give back Greenland and Faroe . 1814 never forget .,Germanic,Norwegian
DameHumbug,AskEurope,Two and a half months .,Germanic,Norwegian
DameHumbug,AskEurope,Not really,Germanic,Norwegian
DameHumbug,AskEurope,Just as much as the rest of us .,Germanic,Norwegian
DameHumbug,AskEurope,Thai and Philippines women has a \ '' marries men from small towns that can\\'t find wife for some reason so they can get to Norway\ '' . A mail order bride ish like rep I guess .,Germanic,Norwegian
DameHumbug,AskEurope,A tourist agency . If you are already here they know about these things and can tell you everything and even got free literature about the local area .,Germanic,Norwegian
DameHumbug,AskEurope,Well ok then,Germanic,Norwegian
DameHumbug,AskEurope,"No , I feel dirty going in just to fetch something I forgot when wearing shoes .",Germanic,Norwegian
