user,subreddit,post,family,lang
LazyNecGermanicr,europe,"& gt ; You\\ 're an Aussie so of course it\\ 's easy to judge . \\n\\nThe exact same debate is happening over here and has been for the last five years and I\\ 've heard all these talking points a million times before . It\\ 's the same climate of hysteria where like 200 people making landfall on a boat is somehow worthy of being front page news across dozens of newspapers ( that\\ 's like half a planeload of people by the way ) . The Media don\\'t care they only want to sell papers and ad space . Then the Politicians get a hold of it \ '' Will the government THINK OF THE CHILDREN\ '' , \ '' The opposition wants the migrants to come and TAKE OUR JOBS AND RAPE OUR WOMEN\ '' They don\\'t fucking care either , they\\ 're smart enough to know it doesn\\'t fucking matter they only want something easily digestible to use to pander to their respective demographics . And people fucking eat it up , and the media gives the people what they want and it\\ 's all this self-perpetuating cycle and I\\ 'm fucking sick of it . And Reddit is the fucking worst , at least on an actual news site you actually have to scroll past the article to start commenting , here so many just don\\'t even bother . And then you\\ 've got that French OP there , trying to pretend he cares about the life of some Syrian child when he has a long post history of almost exclusively \ '' Fuck the filthy Muslims coming to this country fucking immigrants\ '' yeah mate , sure thing . \\n\\n & gt ; You feel very strongly about this for not being affected by it . For talking about whiners , this : \\n\\nPot kettle etc . And for the record , I\\ 'm British.\\n\\n & gt ; Also , you should be aware that the downvote button is not a disagree button.\\n\\nI know right , tell that to the guy who had me at -1 between when I posted that first comment and when I refreshed the page like a second later .",Germanic,English
LazyNecGermanicr,europe,La Marseillaise loop 10 hours,Germanic,English
LazyNecGermanicr,europe,"Australians , like the passenger pigeon , migrate to colder climes during the hot summer months",Germanic,English
LazyNecGermanicr,europe,Well there is the Australian TV series \ '' Go back to where you came from\ '' which takes people on the kind of journey that asylum seekers take .,Germanic,English
LazyNecGermanicr,europe,Downvotes = literally Stalinism,Germanic,English
LazyNecGermanicr,europe,I meant in terms of inequality adjusted HDI,Germanic,English
LazyNecGermanicr,europe,"Most likely : Macron V Le Pen \\n\\nSecond : Macron V Melenchon \\n\\nThird : Fillion V Le Pen \\n\\nFourth : Fillion V Melenchon \\n\\nUnlikely : Fillion V Macron , Le Pen V Melenchon",Germanic,English
LazyNecGermanicr,europe,The brightest timeline ...,Germanic,English
LazyNecGermanicr,europe,Really tight is a very distinct possibility given the polling,Germanic,English
LazyNecGermanicr,europe,"& gt ; general stupidity of making a plane\\n\\nIt\\ 's not \ '' a\ '' plane , it\\ 's three planes . The USN needed a stealth fighter to operate off of its carriers . The US Marines , British , Spanish and Italian navies needed a STOVL to replace their antique Harriers and operate off of their smaller aircraft carriers . And like a million different air forces wanted a single-engine stealth aircraft to replace their F-16s . As expensive as developing theF-35 has been , developing a Harrier replacement , an F-16 replacement and an F-18 replacement as three separate projects would have been more expensive .",Germanic,English
LazyNecGermanicr,europe,"If you already speak a Latin language , you could probably read esperanto without too much trouble",Germanic,English
LazyNecGermanicr,europe,[ \ '' We are going to build a wall . You\u2019re going to pay for the wall\ '' ] ( https : //www.reddit.com/r/europe/comments/3m1cos/today_refugees_tomorrow_terrorists_eastern/cvb6bcf ),Germanic,English
LazyNecGermanicr,europe,"& gt ; or a no-go after a certain threshold - say , 1.5x that of the English population.\\n\\nIronically that criteria would actually restrict a lot of inter-european migration whilst also still allowing middle eastern migrants access to many countries because of the large variance in crime rates between different European countries . \\n\\nOn an unrelated note that guy is also some kind of [ next level weeaboo ] ( https : //www.reddit.com/r/IAmA/comments/myq4v/iama_diehard_anime_fan_who_has_raised_his_8yr_old/ )",Germanic,English
LazyNecGermanicr,europe,"& gt ; he thinks a system like worldnews have where you can only post up to three threads about the same story would maybe be a good idea\\n\\nSo almost like an limit on immigration threads ? an immigration quota , if you will ?",Germanic,English
LegsideLarry,europe,& gt ; people in these countries who are 35 or older are entitled to automatic British citizenship.\\n\\nThis is not true .,Germanic,English
LegsideLarry,europe,I believe it was apart of a deal to provide defence for Nauru since they have no military .,Germanic,English
LegsideLarry,europe,"Australian here , no one wants this to happen in the slightest , nor is there a push for it to happen whatsoever . This is a joke article .",Germanic,English
Lewon_S,europe,Earns them more money and makes people poorer giving them more power,Germanic,English
Lewon_S,europe,Back then ?,Germanic,English
Lewon_S,europe,thanks,Germanic,English
Lewon_S,europe,Especially considering she is only 18 and he 25 .,Germanic,English
Lewon_S,europe,"I actually loved it in a non cringy way . Part of the appeal was the novelty sure , but it definitely worked and sounded great . It exceeded my expectations .",Germanic,English
Lewon_S,europe,Europe is in the decline . You can only survive united . V,Germanic,English
Lewon_S,europe,No one likes Brussel sprouts !,Germanic,English
Lewon_S,europe,Anything bellow 25 C is uncomfortable for me haha .,Germanic,English
Lewon_S,europe,Cows kill more people the sharks do annually,Germanic,English
Lewon_S,europe,Lots of irish people have faces like Luigi too haha,Germanic,English
Lewon_S,europe,"Yeah , I just meant the long face , brown hair , blue eyes . I mean if you look at the guys in the picture they have that look . I meant no offence . Sorry",Germanic,English
Lewon_S,europe,"Nah , all over",Germanic,English
Lewon_S,europe,Yes and we can rename Australia emu so everyone will stay confused,Germanic,English
Lewon_S,europe,Not exactly relevant but I remember in school learning about how someone asked an Anzac why he enrolled in the military and he replied that he thought it be like just a big rugby match . So na\u00efve : ( .,Germanic,English
Lewon_S,europe,In Finland I think it would also be the long periods of darkness and daylight that mess with the head,Germanic,English
Lewon_S,europe,Belgium is a beautiful city : https : //youtu.be/n2iEes9bzbg\\n\\nDunno about the rest,Germanic,English
Lewon_S,europe,When I was learning dutch when ever I spoke about it to a English they basically always told me to stop because it was an ugly and useless language . Or that could be because they just dislike the idea of forigners speaking it .,Germanic,English
Lewon_S,europe,What about anaesthetic ?,Germanic,English
Lewon_S,europe,Well they should do so,Germanic,English
Lone_Grohiik,europe,Wait what ? Really ? The only cancer in \ '' Western\ '' culture is white guilt ? You realise that Western culture is a misnomer right ? You\\ 're bunching up whole large group of countries and just labelling it \ '' Western\ '' . It\\ 's like saying that the in China is the same as the culture in Thailand is the same because they\\ 're in Asia . There\\ 's whole lot more problems in my country than just \ '' white guilt.\ '',Germanic,English
Lone_Grohiik,europe,Fair enough .,Germanic,English
Lone_Grohiik,AskEurope,"Yep , grew up with a great view of the Glasshouse mountains in the background . I live just a bit further south of Nambour near Caloundra area .",Germanic,English
Lone_Grohiik,europe,We use it sometimes in Australia . Not often though .,Germanic,English
Lone_Grohiik,europe,Talk about 0 to 100 .,Germanic,English
Lone_Grohiik,europe,Is there something wrong with Kent ?,Germanic,English
Lone_Grohiik,europe,There are long words in the English language that is actually one word and not combinations of words .,Germanic,English
Lone_Grohiik,europe,"Huh , reminds of the ballot that New South Wales got for voting on representatives in the Senate in the federal elections in Australia last year .",Germanic,English
Lone_Grohiik,europe,"Huh , no cops at polling booths in Australia .",Germanic,English
Lone_Grohiik,AskEurope,This is what we call a dumbcunt .,Germanic,English
Lone_Grohiik,europe,Oh you mean correct maps then .,Germanic,English
Lone_Grohiik,europe,This makes me feel sad : (,Germanic,English
Lone_Grohiik,europe,Pot meet kettle .,Germanic,English
Lone_Grohiik,europe,He passed our citizenship test though . Extra points if he dacked himself to Eagle Rock .,Germanic,English
Lone_Grohiik,europe,"As someone who grew up and still lives in the same climate as you , I preferred humid summers , because humid winters are worse then dry ones . It fucking rains in a humid winter . Rains . The overcast alone cuts out like 2 hours of daylight to .",Germanic,English
LostaThong,europe,"Queenie and her sprogs like to pop round here for a wave every now and then , which can not be understated .",Germanic,English
LostaThong,europe,"& gt ; Not part of Spain\\n\\nOh man , the attacks are relentless and from every direction . \\nOur Portuguese friends can not catch a break",Germanic,English
LostaThong,europe,"Perhaps , but in more relatable terms , would you rather people asking \ '' why are you not rich ? \ '' or \ '' why on earth are you still alive ? ? ? ? \ ''",Germanic,English
LostaThong,europe,"Not very often , though .",Germanic,English
LostaThong,europe,"It\\ 's short for \ '' Cha Ching\ '' which as we all know is the international sound of money , and which the Swiss have always been fascinated by .",Germanic,English
LostaThong,europe,"& gt ; The same England who once had a company so big , it was actually worth more than the entire country , because it was a giant pyramid scheme ? \\n\\n\\nWhat are you referring to here ? East India Trading Company ? Sounds interesting",Germanic,English
LostaThong,europe,They can indeed try ; ^ ),Germanic,English
LostaThong,europe,life is suffering,Germanic,English
LostaThong,europe,That story of the Russian on the plane chatting to the American is just brilliant .,Germanic,English
LostaThong,europe,"UK is too relevant to be \ '' Northern Europe\ '' , tbh.\\n",Germanic,English
LostaThong,europe,This sort of bravado talk over an internet commenting site in the comfort of your own home in relative peace is fucken cheap mate . \\n\\nReally cheap . \\n,Germanic,English
LostaThong,europe,banter,Germanic,English
LostaThong,europe,Thank you lad\\n\\nedit : nice to be appreciated .,Germanic,English
LostaThong,europe,Is he the chap who stole that pen on camera ?,Germanic,English
LostaThong,europe,"Density of bears depends on proximity to Russia , apparently , haha",Germanic,English
LostaThong,europe,"Nah mate , just do it ! Average life in London would be interesting",Germanic,English
LostaThong,europe,"Very unfair on Chamberlain there . He made the best decision with the information he had at the time with the aim of staying out of the sort of war seen 20 years prior , and was the one who declared war in the end . \\n\\nEven Churchill thought so , \ '' \\n\ '' Whatever else history may or may not say about these terrible , tremendous years , we can be sure that Neville Chamberlain acted with perfect sincerity according to his lights and strove to the utmost of his capacity and authority , which were powerful , to save the world from the awful , devastating struggle in which we are now engaged\u2026.\ ''",Germanic,English
LostaThong,europe,Bird extermination .,Germanic,English
LostaThong,europe,"Really cool work , mate.\\n\\nThe Moroccan one somehow makes me feel like I should be searching for [ Wally ] ( http : //cdn.newsapi.com.au/image/v1/7c4bba5b55eb8555de525211b9da7a8e ) .",Germanic,English
LostaThong,europe,[ Commemoration of the football streaker ] ( http : //www.heatheronhertravels.com/wp-content/uploads/2010/08/At-Memento-Park-near-Budapest.jpg ),Germanic,English
LostaThong,europe,"oi watch it , Gr\u00fcber",Germanic,English
LostaThong,europe,"I agree , it shows a disappointing amount of moral apathy .",Germanic,English
LostaThong,europe,"Just in time for the negotiations , too !",Germanic,English
LostaThong,europe,Pretty sure they built our high quality [ helicopter carriers ] ( https : //en.wikipedia.org/wiki/Canberra-class_landing_helicopter_dock ) m80,Germanic,English
LostaThong,europe,Note that the Indonesian navy has been expanding recently\\n\\nCoincidence ? ?,Germanic,English
LostaThong,europe,"These days , anything less than a declaration of total war could be perceived as weakness .",Germanic,English
LostaThong,europe,the sarcastic fat one with the beard\\n\\n,Germanic,English
LostaThong,europe,"Well when it comes to sick political bants in Australian politics , you can not beat Paul Keating , PM . [ Link . ] ( https : //www.youtube.com/watch ? v=cpgFlsceKNQ ) \\n\\nWhen asked why he would not call an early election , he responded that \ '' because mate , I want to do you ( the opposition ) slowly ... There\\ 's got to be a bit of sport in this for all of us.\ ''",Germanic,English
LostaThong,europe,But we Eastern Imperialist now !,Germanic,English
LostaThong,europe,"You are mad my highly educated friend , just look how beautifully geometric that rectangle is.\\n [ Only in the New World can you find borders more pleasing to the eye ! ] ( https : //upload.wikimedia.org/wikipedia/commons/thumb/5/5b/Wyoming_in_United_States.svg/2000px-Wyoming_in_United_States.svg.png ) \\n",Germanic,English
LostaThong,europe,"& gt ; Australia\\n\\n & gt ; Some minuscule island\\n\\n [ Biggest island , you mean ! ] ( http : //imgur.com/4cFrHGb ) \\n\\n",Germanic,English
LostaThong,europe,I like it when cartoonists try not to litter their cartoons with obvious tags and labels . \\n\\nIt looks like a tacky Ben Garrison comic when they go over the top tbh,Germanic,English
LostaThong,europe,oi watch it,Germanic,English
LostaThong,europe,"And the rest are thin , bearded and sarcastic \\n\\n",Germanic,English
LostaThong,europe,"Seems like a lot of overly cynical , inaccurate garbage from everyone there . Reads like a pravda.ru comment section to be honest .",Germanic,English
LostaThong,europe,Us pls ladm8\\n,Germanic,English
LostaThong,europe,christ on a bike ...,Germanic,English
LostaThong,europe,"The whole country now operates on a 1:2 scale , as in everything is half the size , and the clocks are now running in metric.\\n\\n\\n\\n\\n",Germanic,English
LostaThong,europe,"This is correct , you lads forced our hand when you said that only Europeans can join.\\n\\nSo we did this\\n",Germanic,English
LostaThong,europe,Or even Australian Federation !,Germanic,English
MagniSiguror,europe,"If you guys ever get a chance , watch the CGI version of \ '' Asterix and the Mansions of the Gods\ '' - first adaption I\\ 've seen that perfectly captures the spirit of the comics . Wonderful , and easily worth the time .",Germanic,English
MagniSiguror,europe,No clue what you guys are talking about . Diggers armed with machine guns being humiliated by a few birds ? How ridiculous !,Germanic,English
MajesticAsFook,europe,"What are you even on about mate ? If they can fit on a 21 km^2 island they can definitely fit onto a 7,692,024 km^2 island without much problem mate .",Germanic,English
Mann_Aus_Sydney,europe,Siegfried the Dragon killer is fucking awesome ! \\n\\nBrb going to court to change my name .,Germanic,English
Mann_Aus_Sydney,europe,"Guy on the lower right.\\n\\nDmitri , paint me like french girl Tovarisch",Germanic,English
Mann_Aus_Sydney,europe,I did not realize that planet pizza was a real place .,Germanic,English
Mann_Aus_Sydney,AskEurope,"I realize that Australia is over 16732.56 kilometres away from the continent . But i think it could be viable . Hell . We are even in Euro-vision . And we are like the British , but are not a bunch of gronks , and we excel in the sports that they have invented .",Germanic,English
Mann_Aus_Sydney,europe,Because Polen STRONK,Germanic,English
Mann_Aus_Sydney,AskEurope,Apparently it is pretty expensive in Australia .,Germanic,English
Mann_Aus_Sydney,AskEurope,Too many to name .,Germanic,English
Mann_Aus_Sydney,AskEurope,Pretty much every Aussie goes up to the Asian islands once in their life because of how cheap/close it is .,Germanic,English
Mann_Aus_Sydney,AskEurope,You can do it in Australia ... But it would probably stigmatise one from society .,Germanic,English
Mann_Aus_Sydney,AskEurope,"Wow , that was amazingly easy to read .",Germanic,English
Mann_Aus_Sydney,AskEurope,We came pretty close,Germanic,English
Mann_Aus_Sydney,AskEurope,Neither.. Australia could always do with another Blue Mountains..,Germanic,English
Mann_Aus_Sydney,AskEurope,I think a Big Mac meal is around 9 dollars here . So probably 13 or something for a large . But our larges are probably like a medium in The US,Germanic,English
Mann_Aus_Sydney,AskEurope,Inspector Rex was my childhood .,Germanic,English
Mann_Aus_Sydney,AskEurope,I ... I play counterstrike ...,Germanic,English
Mann_Aus_Sydney,AskEurope,Huh ... TIL,Germanic,English
Mann_Aus_Sydney,AskEurope,Yeah i can understand that . But i think what you said about visas and trade agreements is spot on .,Germanic,English
Mann_Aus_Sydney,AskEurope,"15\u20ac is about 21 $ here , which isn\\'t too bad . A pizza and bottle of coke from Dominos around is 24 Aud . So food doesn\\'t seem to bad . And it cost 40 dollars to get a coach from Canberra to Sydney \ '' around a four hour drive\ '' so I guess prices are fairly similar .",Germanic,English
Mann_Aus_Sydney,AskEurope,"I could see us opening the border for incentives that the Union would probably offer . Because to be fair , It is only really the coasts of Australia that are inhabited . The rest is barren land , and Queensland is pretty shit as well .",Germanic,English
Mann_Aus_Sydney,AskEurope,I get umlauts and pronouncing Ch . But i do tend to mess up words starting with R,Germanic,English
Mann_Aus_Sydney,AskEurope,I think Australia has more chance of Getting in than Turkey .,Germanic,English
Mann_Aus_Sydney,AskEurope,We have more to offer,Germanic,English
Mann_Aus_Sydney,AskEurope,A bribe of quality beef and VB will be sufficient .,Germanic,English
Mann_Aus_Sydney,AskEurope,"I feel like Australia and NZ would fit in fairly easy , compared to the United States . Australia in particular has fairly similar views with those in the EU .",Germanic,English
Mann_Aus_Sydney,AskEurope,We might have to build a wall,Germanic,English
Mann_Aus_Sydney,AskEurope,Like Guy Sebastian stole Australian idol 2003 from nolsy,Germanic,English
Mann_Aus_Sydney,AskEurope,"As an Australian . I believe it\\ 's a large part of our nations ethos . When the ANZACS stormed the cliffs of Gallipoli and fought the defending Turkish soldiers . A legend was born . The actions undertaken by ANZAC and Canadian troops on the western front were amazing feats of courage . While I believe most , not all people see ANZAC day as a day to get pissed and say \ '' we bloodi\\ ' beat them Turk bastards\ '' i believe those who truly know ours and the European history know better . \\n\\nA quote by Kemal Atat\u00fcrk on the ANZACS . \\n\\n\ '' Those heroes that shed their blood and lost their lives ... You are now lying in the soil of a friendly country . Therefore rest in peace . There is no difference between the Johnnies and the Mehmets to us where they lie side by side here in this country of ours ... You , the mothers who sent their sons from faraway countries , wipe away your tears ; your sons are now lying in our bosom and are in peace . After having lost their lives on this land they have become our sons as well.\ '' \\n",Germanic,English
MathewPerth,europe,India as a whole is undoubtedly richer though . The country is *massive* .,Germanic,English
MathewPerth,europe,"Thats because of their corrupt government and shitty social security , not population .",Germanic,English
MathewPerth,europe,Is there preferential voting included in that ?,Germanic,English
MathewPerth,europe,It seems quite obvious though ?,Germanic,English
MathewPerth,europe,Free movement is already ending for the UK,Germanic,English
MathewPerth,europe,Obligatory blame western countries for what was done decades ago because you cant attack for how they are in the present .,Germanic,English
MathewPerth,europe,Didnt the movement start in the UK ? I am not surprised at all,Germanic,English
MathewPerth,europe,Not at all . Democracy provides a better pathway for equal rights than any dictatorship/oligarchic government .,Germanic,English
MathewPerth,europe,That is a very ignorant assumption to make . Spain has championed LGBT rights for a while now .,Germanic,English
MathewPerth,europe,"I wouldnt consider a legal union to be a basic human right , but it is obviously a problem that straight people have access to priviliges that gay people dont .",Germanic,English
MathewPerth,europe,I think thats fair though . Its kind of the purpose of democracy .,Germanic,English
MathewPerth,europe,To keep the english out !,Germanic,English
MathewPerth,europe,"Pretty much . Fiscal economics never works . Just look at conservative states in the USA , or the current downfall of the Australian economy : )",Germanic,English
MathewPerth,europe,Its not like they outsourced development to poland - the company is literally polish . What is your point ?,Germanic,English
MathewPerth,europe,Give us your stats then,Germanic,English
MathewPerth,europe,I feel like I cant say czech republic anymore its wierd haha . Like the english language just suddenly changed .,Germanic,English
MathewPerth,europe,Oh my god a federal EU will be the end of european cultures as we know it !,Germanic,English
MathewPerth,europe,"Of course theyre bitter , the UK just helped to ruin european unity .",Germanic,English
MathewPerth,europe,"Dont forget Italia , Spania , Francia",Germanic,English
MathewPerth,europe,Not when youre a romanian speaking english im guessing .,Germanic,English
MathewPerth,europe,land of the czechs,Germanic,English
MathewPerth,europe,Naturally . It is reality .,Germanic,English
MathewPerth,europe,Labelling in order to trigger a knee-jerk response . Classy .,Germanic,English
MathewPerth,europe,Voter turnout is increasing everywhere .,Germanic,English
MathewPerth,europe,Did he not just say no exceptions ?,Germanic,English
MathewPerth,europe,I think thats classified as northern Europe .,Germanic,English
MathewPerth,europe,European geography is definitely the most interesting imo,Germanic,English
MathewPerth,europe,Reddit is great isnt it ?,Germanic,English
MathewPerth,europe,"But , your ruling party practically is fundamentalist christian . So he might not be technically correct , but hes not wrong either .",Germanic,English
MathewPerth,europe,Your statement to back that up ?,Germanic,English
MathewPerth,europe,Living in your country sounds like it would be a nightmare .,Germanic,English
MathewPerth,europe,How can a populace vote for a government so against their best interests ?,Germanic,English
MathewPerth,europe,Have you ever watched a republican debate ?,Germanic,English
MathewPerth,europe,If that is the extent of your argument then who are you trying to pursuade ? There is obviously more nuance to it than that .,Germanic,English
MathewPerth,europe,What wealth class are you referring to ? It differs massively between them .,Germanic,English
MathewPerth,europe,Yeh.. as an independent student I dont consider myself to be lower middle class . I would be on the street if it werent for government help .,Germanic,English
MathewPerth,europe,Its the best thing to see when inconsistent people assume everyone else is inconsistent aswell,Germanic,English
MathewPerth,europe,"You guys would be a lot better off for it , then republicans wouldnt have a reason to exist !",Germanic,English
Mattster00,europe,Separation of church and state is my fetish,Germanic,English
McSwaggotron,europe,ayyyy lmao gentleman and a scholar . new copypasta ?,Germanic,English
McSwaggotron,europe,ofc,Germanic,English
McSwaggotron,europe,"What would you advocate , forcibly instating politicians more to your liking ? Not going to lie tho , old mate Tony is an upper echelon dick for sure",Germanic,English
Mcpom,europe,"Yeah , two new [ Queen Elizabeth class ] ( http : //en.wikipedia.org/wiki/Queen_Elizabeth-class_aircraft_carrier ) carriers . The largest class of STOVL cariers in the world I beleive .",Germanic,English
Mcpom,europe,Then have a market without free movement of people ? Simple .,Germanic,English
Mcpom,europe,Nearly as much as NI but not quite .,Germanic,English
Mcpom,europe,"Yeah , more like thoroughly against it .",Germanic,English
Melbourne-And-Bred,europe,"Refugees per 1,000 inhabitants\\n\\nNorway 9.14\\n\\nSwitzerland 8.45\\n\\nNetherlands 4.89\\n\\nCanada 4.19\\n\\nFrance 4.13\\n\\nGermany 3.10\\n\\nUnited States 0.84 ( 267k in total ) .\\n\\n",Germanic,English
