user,subreddit,post,family,lang
101101100001,europe,"stage : yet another meeting of world leaders sitting around a table\\n\\nopening act : Putin takes a giant dump in the middle of table\\n\\nObama - \ '' Hey hey you just done a giant poo in front of us , whats wrong with you man\ '' \\n\\nPutin - \ '' What poo i see no poo\ '' \\n\\nCameron - \ '' Uhm that big giant steaming pile of excrement in the middle of that table\ '' \\n\\nPutin - waves hand in Jedi mind trick fashion \ '' There is no excrement on the table\ '' \\n\\nMerkel - \ '' Dear Vlad , that shit only works in movies , your shit is real ! damn what you eat ! \ '' \\n\\nPutin - \ '' Oh that shit , it was put the by the Ukrainian 5th column\ '' \\n\\nObama - \ '' Please we just all seen you take a dump in front of us\ '' \\n\\nPutin - \ '' Great nations have no asshole , you asshole ! \ ''",Germanic,English
101101100001,europe,Next they will be made wear a white/red crescent,Germanic,English
101101100001,europe,Well Turkey is certainly causing headaches for the Russia which thinks of itself as a \ '' world power\ '' so there is that,Germanic,English
101101100001,europe,"Russia is lucky that Obama is so timid on foreign policy , we could endup with a president this year who would have no qualms of Ukraine an Afghanistan 2.0 for Russians\\n\\nOperating unmarked troops works both ways ...",Germanic,English
101101100001,europe,Have you been out of country for last month or more ? large parts of the country ( Ireland ) are under water as storm after storm bring record rainfall ( in Ireland thats achievement in itself lol ) \\n\\nMost of the flooding is relatively un-needed if they dredged rivers and properly engineered solutions to manage water . Something the Dutch are very good at while leaving below sea level,Germanic,English
101101100001,europe,"Isnt Ukraine suing Russia in international courts for billions for the war and annexation of its land ? \\n\\nAnd then Russia made a law making international rulings invalid\\n\\nSo yeh , gets the popcorn out",Germanic,English
101101100001,europe,What is to stop them from travelling back to Germany and doing it all again ?,Germanic,English
101101100001,europe,"There is a saying if the Dutch had the land the Irish have they would feed the world , if Irish had the land Dutch have they would drown\\n\\nAnd we are drowning due to bad floods this winter ...",Germanic,English
101101100001,europe,* Eat Pork ? \\n* Drink booze ?,Germanic,English
101101100001,europe,& gt ; What if i dont want to be poisoned ? \\n\\nAsk Volkswagen for ideas ...,Germanic,English
101101100001,europe,Also a much more diversified economy than Russia\\n\\nhttps : //upload.wikimedia.org/wikipedia/commons/f/fe/Mexico_Product_Export_Treemap.jpg\\n\\nvs\\n\\nhttps : //upload.wikimedia.org/wikipedia/commons/c/c3/2012_Russia_Products_Export_Treemap.png\\n\\nRussia is a modern day petro-banana \ '' republic\ '',Germanic,English
101101100001,europe,The refugee crisis is distracting Europe and Europeans from the annexation of Crimea and war in East Ukraine waged by Putin.\\n\\nBy getting involved in Syria he is accomplishing several goals in one go .,Germanic,English
101101100001,europe,What if their crime is robbing people/businesses and makes more than enough profit to cover the cost of transport ?,Germanic,English
101101100001,europe,Yeh here in Ireland were at what 110 % ( probably more since a lot of debt was hidden in government accounting trickery ) thanks to bank \ '' bailouts\ '' \\n\\nUkraine has hit rock bottom the only way is up for them,Germanic,English
101101100001,europe,They went around killing people based on their religion ?,Germanic,English
101101100001,europe,Not in such numbers\\n\\nBTW & gt ; http : //www.ibtimes.co.uk/paris-attacks-man-arrested-germany-smuggling-firearms-explosives-linked-french-attacks-1528726,Germanic,English
101101100001,europe,"\ '' The German authorities expect 920,000 new asylum-seekers to arrive in the country between October and December alone\ '' \\n\\nThats over 10K arriving per day , you just wrote \ '' we had 10k arriving since beginning of August\ '' thats quite a big difference",Germanic,English
101101100001,europe,The burden of proof lies with posters ranting away with wild conspiracies ( see your post above ),Germanic,English
101101100001,europe,Well if they have to import drugs from abroad then doubling the amount paid in Rubles still not good enough seeing how that currency gone down the shitter,Germanic,English
101101100001,europe,"You lost me at \ '' modern\ '' , \ '' secular\ '' and \ '' democratic\ '' \\n\\nrofl",Germanic,English
101101100001,europe,Pros : Everyone ( almost ) is friendly and relaxed\\n\\nCons : Perpetual rain,Germanic,English
101101100001,europe,Have you not seen the videos on the news of them using iphones and latest android phones ? Some of these are anything but cheap ...,Germanic,English
101101100001,europe,& gt ; Somebody could have saved him from trying by informing him we\\ 're not Charlie and the chocolate factory here.\\n\\n\ '' Je suis Charlie\ '' quite literally means \ '' I am Charlie\ '' and videos were widely televised last years across the world.\\n\\nSo you can excuse them for getting confused ...,Germanic,English
101101100001,europe,Except they have basically withdrawn from the Middle east and in last 8 years Obama went out of his way not to be drawn back into that quaqmire .,Germanic,English
101101100001,europe,Then how do you explain West of Ireland,Germanic,English
101101100001,europe,"People do not realize how big the Californian economy is , its larger than Russia ! \\nand has quite a diverse geography and population .",Germanic,English
101101100001,europe,Yep its incredible that he is doing EVERYTHING possible to isolate and hurt Russian and its people and ... ... is praised by the same\\n\\nIts like the whole country is inside a reality distortion field,Germanic,English
101101100001,europe,"A brighter future in Russia ? right promising a socialist utopia for 70 years worked out great before right ? same shit different name under new strongman , sigh ...",Germanic,English
101101100001,europe,Oh please with the \ '' but but but the US\ '' argument which is at the top of Kremlin Disinformation 101 booklet\\n\\nOne set of bad policies does not justify a set of another .,Germanic,English
101101100001,europe,I just came across this article & gt ; http : //www.atlanticcouncil.org/blogs/new-atlanticist/russia-is-a-troll-state-not-a-rogue-state\\n\\nBasically Russia is trolling everyone in order to distract the populace at home from the raping and pillaging of the country by their own guys .,Germanic,English
101101100001,europe,Russian people do NOT\\n\\nPutin and his neonazi/neotsarist/neokgb mix of policies does\\n\\n\\nedit : Tho ; Unfortunately a sizable chunk of the former have been brainwashed by the propaganda machine of the later .,Germanic,English
101101100001,europe,"Considering as to what happened to Poland in WW2 with Germans on one side and Russians on the other , I do not blame them .",Germanic,English
101101100001,europe,That clay is having sleepless nights now,Germanic,English
101101100001,europe,EUROPEAN COUNTRIES : we should all work to fix the financial/euro issues together ! \\n\\nGERMANY ( especially Bavaria ) : no ! ! \\n\\nYou reap what you sow ...,Germanic,English
101101100001,europe,Most Europeans forgot about it since the news cycle moved on\\n\\nPutin had no issues helping it move along by bombing civilians and hence resulting in even more refugees reaching Europe.\\n\\nedit : I should post my replies later in day when the resident putinbots are asleep,Germanic,English
101101100001,europe,Great thanks to reddit I now have something to watch : ),Germanic,English
101101100001,europe,"Also they shoot down airplanes for the twitter bragging rights , sigh",Germanic,English
101101100001,europe,"& gt ; First is a four-year bar on benefits , including in-work benefits , being claimed by migrants from the rest of the EU , to stop \u201cbenefits tourism\u201d.\\n\\nSo how can we in Ireland stop scumbags from UK coming here and living of our MORE generous welfare system ?",Germanic,English
101101100001,europe,Anyone who wants to help refugees should then put their wallet where their mouth is and give HALF their after tax income to any charity that can help refugees.\\n\\nWhat no ? why not ?,Germanic,English
101101100001,europe,"This , Putin would love nothing better than to seed enough doubt and discord in NATO members for them to think the alliance is worthless and hence create a self fulfilling prophecy.\\n\\nAt the end of day he is nothing more than a criminal who managed to rise to power and control over the remains of the Soviet empire by rebuilding on a model of an authoritarian petrostate , except lately things are not going to plan at home so the media ( the media he controls and brainwashes people with ) needs and external boogeyman ...",Germanic,English
102091101,europe,"Its just something the irish tend not to do , most weddings would be cash bars . ( if there was a residents bar after midnight , the couple likely paid 500 euro for that ) \\n\\nOpen bars are risky , overindulgence would happen and a wedding is a family affair - younger kids/ teetotallers might feel uncomfortable.\\n",Germanic,English
102091101,europe,"you made me chuckle , I needed a chuckle .",Germanic,English
102091101,europe,Any one know why Ireland is so much quicker resolving insolvency ?,Germanic,English
1024KBforLife,europe,"I think you have that backwards , if anything the fact the UK needs goods is the leverage . The financial sector is a segment the UK needs to find a market for .",Germanic,English
1024KBforLife,europe,Looks ok to me .,Germanic,English
1024KBforLife,europe,all those polish muslims stealling their tea,Germanic,English
1024KBforLife,europe,the Somalian government has been completely ignoring them and totally silent on the issue .,Germanic,English
1024KBforLife,europe,"\ '' rats leaving a sinking ship\ '' come on , you\\ 've heard the phrase and you know perfectly well that phrase applies to the people resigning their positions . It\\ 's not like the British people are fleeing .",Germanic,English
1024KBforLife,europe,you should see our guy,Germanic,English
1024KBforLife,europe,you\\ 're pretending you\\ 've never heard of the phrase \ '' rats fleeing a sinking ship\ '' because it\\ 's convenient . Have you ever considered that if you need to feign stupidity to \ '' win\ '' arguments that you\\ 're on the wrong side .,Germanic,English
1024KBforLife,europe,my cats breith smells like cat food but it has nothing to do with the question .,Germanic,English
1024KBforLife,europe,what is gun ?,Germanic,English
1024KBforLife,europe,"they not , they talk is all , think good plan",Germanic,English
1024KBforLife,europe,\ '' There are reason out there someone told me to believe but I can\\'t remember now\ '',Germanic,English
1024KBforLife,europe,the whole damn book is about the UKs abusive relationship with Ireland .,Germanic,English
1024KBforLife,europe,I thought you only listened to non-experts .,Germanic,English
1024KBforLife,europe,unprecedented prosperity . even the recession was pretty nice compared to ireland of the seventies or eighties .,Germanic,English
1024KBforLife,europe,and a \ '' terrorist dictatorship\ '',Germanic,English
1024KBforLife,europe,they did agree,Germanic,English
1024KBforLife,europe,its amazing that you expect the whole world to just serve you .,Germanic,English
1024KBforLife,europe,all those boobs,Germanic,English
1024KBforLife,europe,Yeah when I was doing civics it was just how PR/STV voting works over and over again .,Germanic,English
1024KBforLife,europe,There seems to be a lot going on . I would have thought the whole of the EU would be spending the week just understanding brexit .,Germanic,English
1024KBforLife,europe,and the vampires,Germanic,English
1024KBforLife,europe,For 10 % you can rent my box room .,Germanic,English
1024KBforLife,europe,Still better than ISIS .,Germanic,English
1024KBforLife,europe,Because it annoys the UK . Because the EU doesn\\'t have a president in that sense . its closer to \ '' the speaker\ '' in US politics . Plus we elect the people who elect them like a prime minister .,Germanic,English
1024KBforLife,europe,The first sentence was the joke . The rest of the comment was the real answer .,Germanic,English
1024KBforLife,europe,I never used that but it looks pretty cool .,Germanic,English
1024KBforLife,europe,"If I have two aches of land how much land do I have , or a gallon of something how much to I have ? Or a pint . They vary from country to country and the only reason a lot of the measures are kind of standardised is because dutch and french pounds for example are no longer used.\\n\\nThe point of these measures is for communication otherwise I could just make up my own measures like \ '' my dogs tail\ '' but no one will know how much that is . When you have to look up what gallon is being used in order to have a conversation the measure is not as good as a litre . There is a reason most of the word switched to one system .",Germanic,English
1024KBforLife,europe,The EU and the Eurozone are different,Germanic,English
1024KBforLife,europe,"The speak English , American , Canadian and Australian .",Germanic,English
1024KBforLife,europe,The long game,Germanic,English
1024KBforLife,europe,too wet,Germanic,English
1024KBforLife,europe,"I think earth in star trek is a good model . No one really needs to work but people still have cafes , resteraunts , grow wine but more for the love of it than needing a pay cheque.\\n\\nThey way I think of it is its like everyone getting a pension at 20 . Your needs are covered but what do you do then , travel , open a cafe , go back to college . I think people will do jobs they want to do because its a whole world full of people with fuck-you money .",Germanic,English
1024KBforLife,europe,concedes huh ? All of these titles take a normal startment and try to turn it into something more loaded .,Germanic,English
1024KBforLife,europe,Sadam is looking pretty good right now .,Germanic,English
1024KBforLife,europe,emotion over maths,Germanic,English
1024KBforLife,europe,"its viral marketing for a berlin nightclub , the dresscode is punk from the waist up , golfer from the waist down",Germanic,English
1024KBforLife,europe,at least they let him out of that weird stable door,Germanic,English
1024KBforLife,europe,And movie production was taking off in NI .,Germanic,English
1024KBforLife,europe,I think an alliance with putin is part of this .,Germanic,English
1024KBforLife,europe,"there will be a recession which people like yourself will trivialize but exaggerating the prediction ridiculously . \ '' yeah there\\ 's high unemployment but there isn\\'t blood raining from the sky like you all said\ '' . Its a lazy , ugly , emotional way to argue .",Germanic,English
1024KBforLife,europe,"The term \ '' eletes\ '' when used that way annoys me , its just a slightly more veiled version of \ '' we\\ 're sick of experts\ '' . I want the people in charge to be elete .",Germanic,English
1024KBforLife,europe,But he put his towel on it,Germanic,English
1024KBforLife,europe,You played yourself Boris .,Germanic,English
1024KBforLife,europe,Did you see Farage partying with Murdock after brexit .,Germanic,English
1024KBforLife,europe,can we have your tunnel ?,Germanic,English
1024KBforLife,europe,and us,Germanic,English
1024KBforLife,europe,and can make cool spaceships,Germanic,English
1024KBforLife,europe,"I think we needed a bit of diversity . We were just a bunch of miserable , catholic , pale , potato eating , alcoholic builders before the poles came over .",Germanic,English
1024KBforLife,europe,I would like to take personal credit,Germanic,English
1024KBforLife,europe,We got them cheap second hand,Germanic,English
1024KBforLife,europe,"eight thousand , two hundred and forthy five percent , fuck !",Germanic,English
1024KBforLife,europe,the hat means their getting the death penalty right ?,Germanic,English
1024KBforLife,europe,not soon enough,Germanic,English
1024KBforLife,europe,"Its all connected , no one intests , fewer buisness start and grow . plus it makes finacial buisnesses scared to do buisness there .",Germanic,English
1024KBforLife,europe,Ditto here,Germanic,English
1024KBforLife,europe,Unless trump gets in .,Germanic,English
1024KBforLife,europe,I know a guy .,Germanic,English
1024KBforLife,europe,thats what we did,Germanic,English
1024KBforLife,europe,"coming over here saut\u00e9ing thing , spreading there garlic everywhere . I like my food tasteless and boiled to death , thank you very much .",Germanic,English
1024KBforLife,europe,"chips , like poker chips",Germanic,English
1024KBforLife,europe,"As my first action , the word Kibibyte is banned .",Germanic,English
1024KBforLife,europe,"This reads like a collection of random unfinished thoughts . Actually it reads like /r/subredditsimulator . I think the argument is that because the 25 % growth was bullshit that there is no growth . The idea that if a fact is false the opposite is true . The 25 % is bullshit , it\\ 's an accounting quirk and no one in the Irish government is trying to pass it off as real growth but that doesn\\'t mean there isn\\'t real growth but it\\ 's closer to 5 % . Unemployment is around 10 % , if you\\ 're a programmer companies are throwing themselves at you.\\n\\nMaybe I\\ 'm missing the point . I probably am but I put that down to the writing because I did read it but it was disjointed and just weird to read . Take this \ '' The folks at Irish Economy\ '' , who are folks at Irish Economy ?",Germanic,English
1024KBforLife,europe,That seems reasonable .,Germanic,English
1024KBforLife,europe,because you need experts to do that . and experts are bad,Germanic,English
1024KBforLife,europe,because you need experts to do that .,Germanic,English
1024KBforLife,europe,i often send emails before people get into work,Germanic,English
1024KBforLife,europe,was working in a mine really that mich better than the dole ? i think it has been romantisised a bit .,Germanic,English
1024KBforLife,europe,"its not an ultimatum its litterally just the definition of the word \ '' single market\ '' . if you don\\'t want movement you don\\'t want the single market , you want a free trade deal .",Germanic,English
1024KBforLife,europe,its not just lately,Germanic,English
1024KBforLife,europe,This \ '' punishment\ '' narrative is now so strong the EU could given the UK everything it wants and a backrub and people will still think the EU \ '' punished\ '' them.\\n\\nAdd to that there is going to be huge self inflicted economic fallout no matter what deal the UK gets and people looking for scapegoats .,Germanic,English
1024KBforLife,europe,You just did it,Germanic,English
1024KBforLife,europe,yep,Germanic,English
1024KBforLife,europe,Seconded ! I want to see them turn red when they find out .,Germanic,English
1024KBforLife,europe,its sad but required . the UK should just join schengen so we can .,Germanic,English
1024KBforLife,europe,If we had our shit together but Dublin has a housing shortage and some weird unwillingness to build up .,Germanic,English
1024KBforLife,europe,retractions should get the same size and placement as the original . if the story took the whole first page . so should the retraction .,Germanic,English
1024KBforLife,europe,a lot of countries have free education,Germanic,English
1024KBforLife,europe,They should agree that whatever people are in the EU or the UK now can stay but the UK has to start the negotiation .,Germanic,English
1024KBforLife,europe,it would stop a country economically collapsing on or borders .,Germanic,English
1024KBforLife,europe,Get your Irish passports here .,Germanic,English
1024KBforLife,europe,thats so weird . the uk would allow free movement to part of its county but no the rest and have an internal ( sea ) border where you would have to prove citizenship . is there anything like this anywhere else ?,Germanic,English
1024KBforLife,europe,explain northern ireland,Germanic,English
1024KBforLife,europe,like the middle east after bush went,Germanic,English
1024KBforLife,europe,no,Germanic,English
1024KBforLife,europe,the only logical answer is Irish .,Germanic,English
1024KBforLife,europe,What\\ 's a \ '' Leftist\ '' . I\\ 've only been hearing this word the last few months . I\\ 've heard of people on the left or socialists but left**ist**s seem to be new . Are there right**ist**s ?,Germanic,English
1024KBforLife,europe,Are you new to planet earth ? where do you think all those refugees came from .,Germanic,English
1024KBforLife,europe,"emotionally lashing out doesn\\'t change anything . The living should make the decisions , it\\ 's the same thing with Americans constantly examining what their \ '' founding fathers\ '' wanted for their country , smart guys but they\\ 're dead , they don\\'t get a say .",Germanic,English
1024KBforLife,europe,"You know the phonetic alphabet , Alpha , Bravo , Charlie etc . They obviously exist because shouting bee or cee over a battlefield would lead to problems.\\nThe German numbers sound very very similar to my ear , is there anything like the phonetic alphabet for numbers in german ?",Germanic,English
1024KBforLife,europe,humider,Germanic,English
1024KBforLife,europe,not only that but why let them off the hook if they are jihadis . lock them up . ots unfair to the innocent and lenient on the guilty .,Germanic,English
1024KBforLife,europe,sean the sound,Germanic,English
1024KBforLife,europe,I\\ 'm all for a fair deal but the frustrating think is even if we gave them an amazing deal they\\ 'd be complaining that we\\ 're \ '' punishing\ '' them by not giving them back massages . Their expectations are off the charts .,Germanic,English
1024KBforLife,europe,The only thing is the people ten years from now that will still blame the eu for punishing them by not giving them a ridiculously one sided deal\\n,Germanic,English
1024KBforLife,europe,& gt ; Germany\\ 's \ '' Energie Wende\ '' is fucking expensive\\n\\nNo it\\ 's not . Power is really cheap even at it\\ 's most expensive . We\\ 're just spoiled .,Germanic,English
1024KBforLife,europe,So you want free movement with the eu ?,Germanic,English
1024KBforLife,europe,Pass a bill banning meat pies,Germanic,English
1024KBforLife,europe,its not hypocrisy if two different people say those things .,Germanic,English
1024KBforLife,europe,That would make more sense .,Germanic,English
1024KBforLife,europe,"well assuming the scots eventually left the eu it could go like this . uk has a rocky few years coming up to leaving , the leave and have a rocky few years adjusting , scotland leaves and has a rocky couple of years while they pattition to join the eu.\\n\\nor they leave the uk asap and patition ( I know its wrong but I gave up fighting with my tablet ) while bexit is happening as a separate county minimising the rocky years",Germanic,English
1024KBforLife,europe,only if you lower the bar,Germanic,English
1024KBforLife,europe,I want them to stop being dicks,Germanic,English
1024KBforLife,europe,"Ironically one of the better things the British did in Ireland was give us our voting system , although it was a failed attempt at gerrymandering PR/STV is a good system .",Germanic,English
1024KBforLife,europe,"whats going on in estonia ? lads you need to buy a couple of investment houses , house prices can only go up .",Germanic,English
1024KBforLife,europe,"with a hard on watching deathwish on a loop , praying real hard for the moment when you can legaly kill some one .",Germanic,English
1024KBforLife,europe,"Change their feelings , hmm . Maybe we can shoot Rupert Murdock .",Germanic,English
1024KBforLife,europe,"As one French guy told me \ '' I didn\\'t learn English to speak to the English , I learned English to speak to other people who leaned English [ as a second language ] \ ''",Germanic,English
1024KBforLife,europe,Nah . Irish all the way .,Germanic,English
1024KBforLife,europe,goodthink,Germanic,English
1024KBforLife,europe,He was the biggest mainstream bexiter . Others were either more fringe or more sheepish .,Germanic,English
1024KBforLife,europe,WHY IS EUROPE PUNISHING US ! ?,Germanic,English
1024KBforLife,europe,"How is Junker legitimate ? Which queen appointed him , huh ?",Germanic,English
1024KBforLife,europe,"6 is why farage got out . He\\ 'll come back in about 3 years and say \ '' aw , you guys fucked it all up , I wouldn\\'t have done it that way , anyway I\\ 'm back now , vote for me\ ''",Germanic,English
1024KBforLife,europe,And wanting special deals .,Germanic,English
1024KBforLife,europe,You need the ministers/senior party members but you only really need the \ '' backbenchers\ '' ( unimportant MPs ) for votes .,Germanic,English
1024KBforLife,europe,A naked Junker is flying over on his dragon at the moment .,Germanic,English
1024KBforLife,europe,I heard another British outlet say her \ '' coronation\ '' today . I think they\\ 're confused with the terminology .,Germanic,English
1024KBforLife,europe,"It\\ 's awful to say but true none the less . A poor person in a rich country is still one of the richest people on earth . All this \ '' it can\\'t get any worse\ '' because you\\ 're unemployed is so wrong , it can get much much worse . Speaking as someone why grew up in similar conditions .",Germanic,English
1024KBforLife,europe,by now ? no one said that.next couple of years .,Germanic,English
1024KBforLife,europe,"Too far , man , too far .",Germanic,English
1024KBforLife,europe,We should let sealand into the EU,Germanic,English
