AnExplosiveMonkey,europe,"If anybody else is wondering about that pin just hanging out in the ocean off the coast of Africa , let me introduce you to [ Null Island ] ( https : //www.youtube.com/watch ? v=bjvIpI-1w84 ) !",Germanic,English
AnExplosiveMonkey,europe,"As in low taxes , little regulation , little government welfare , pro-business , pro privatisation .",Germanic,English
AnExplosiveMonkey,europe,( radiation ) Burn !,Germanic,English
AnExplosiveMonkey,europe,"Are you aware that Albania , a European country , is majority Muslim ( and not just from immigrants it should go without saying ) ? \\n\\nDo only Christians qualify as Europeans in your mind ?",Germanic,English
AnExplosiveMonkey,europe,Oh cool ! Credit to them for not losing track of it .,Germanic,English
AnExplosiveMonkey,europe,"Roughly \ '' Tahw , kin-cha\ '' \\n\\nAlso now that I read someone else pointing out that French leave a space before question marks , I\\ 'm noticing it everywhere .",Germanic,English
AnExplosiveMonkey,europe,What did you expect ?,Germanic,English
AnExplosiveMonkey,europe,It takes some attention off of them .,Germanic,English
AnExplosiveMonkey,europe,Obligatory /r/BlueMidterm2018,Germanic,English
AnExplosiveMonkey,europe,[ From the man himself . ] ( https : //www.youtube.com/watch ? v=xOEkRXIJzXk ),Germanic,English
AnExplosiveMonkey,europe,Did we just read the same comment ?,Germanic,English
AnExplosiveMonkey,europe,[ Perfect Summary Here ] ( https : //www.youtube.com/watch ? v=3IaYhG11ckA ),Germanic,English
AnExplosiveMonkey,europe,[ On the other hand ... ] ( https : //satwcomic.com/art/wealth-is-such-a-burden.png ),Germanic,English
AnExplosiveMonkey,europe,"& gt ; Last year was r/robin , \\n\\n [ Not exactly ... ] ( https : //www.reddit.com/r/Robin/comments/4cx152/this_is_not_where_to_go_to_discuss_whatever_weird/ )",Germanic,English
AnExplosiveMonkey,europe,"Sometimes the middle ground *is* the best solution though . The fallacy is saying that [ it *must* be ] ( https : //en.wikipedia.org/wiki/Argument_to_moderation ) , but perhaps in this case it just is . \\n\\n\\nI don\\'t think I\\ 'm reading too much into this , but I imagine that there\\ 's an implied \ '' I believe that ... \ '' in the original comment that might ease your concerns.\\n\\nFunnily enough , [ you\\ 're the only one who committed a fallacy here ] ( https : //en.wikipedia.org/wiki/Argument_from_fallacy ) .",Germanic,English
AnExplosiveMonkey,europe,I take it /r/swarje is the Swedish equivalent of /r/MURICA ? \\n\\nAnd if so what does the word mean ?,Germanic,English
AnExplosiveMonkey,europe,To *whom*\\n\\nHAH ! \\n\\n ( sorry ),Germanic,English
AnExplosiveMonkey,europe,& gt ; Even Merkel is already way to the left of the CDU.\\n\\nHow much longer do you think that might be ? \\n\\nAnd would her replacement be just as left ?,Germanic,English
AnExplosiveMonkey,europe,"I got into an argument before with someone else on reddit about how much wasted effort is put into Irish such as having duplicates of government documents and road signs in Irish and they insisted that there are actually some English speakers left on the islands off the west coast such as the Arans , at least until they grow up and go to school on the mainland , so since then I\\ 've just stuck to \ '' negligible\ '' or \ '' practically zero\ '' .",Germanic,English
AnExplosiveMonkey,europe,"You now for once I\\ 'd be grateful for a drama-free period , like from that Lenin quote\\n\\n & gt ; \u201cThere are decades where nothing happens ; and there are weeks where decades happen.\u201d\\n\\n\ '' Nothing\ '' is starting to sound better and better.\\n\\n",Germanic,English
AnExplosiveMonkey,europe,I wonder is there a French equivalent ?,Germanic,English
AnExplosiveMonkey,europe,"He didn\\'t say they were racist . That was you.\\n\\nTell me , do you think \\'nationalistic/anti-immigration\\ ' is an unfair characterisation of \\'Leave\\ ' sentiment ? \\n\\nBecause I thought \ '' taking back power from Brussels\ '' and \ '' being able to control our own borders\ '' were essentially the two biggest points of the campaign ?",Germanic,English
AnExplosiveMonkey,europe,It almost is though .,Germanic,English
AnExplosiveMonkey,europe,"[ This ] ( http : //www.independent.co.uk/life-style/gadgets-and-tech/porn-sex-acts-banned-government-restrictions-full-list-fisting-periods-urine-public-a7433931.html ) , I guess ?",Germanic,English
AnExplosiveMonkey,europe,"Yeah , [ 538 actually just did a good piece on exactly that : \ '' Donald Trump Is Making Europe Liberal Again\ '' ] ( https : //fivethirtyeight.com/features/donald-trump-is-making-europe-liberal-again/ ) ( liberal mostly meaning left-wing ) . Finally something good comes of this .",Germanic,English
AnExplosiveMonkey,europe,How does that explain it ?,Germanic,English
AnExplosiveMonkey,europe,Is there any other ?,Germanic,English
AnExplosiveMonkey,europe,"Basically whether the deal in which Ireland got 26 out of the 32 counties on the island was good enough for the time being , or if we should have refused and fight for them all .",Germanic,English
AnExplosiveMonkey,europe,Somebody has to .,Germanic,English
AnExplosiveMonkey,europe,"Hey , you chose to be isolated . Appropriate , I guess ; )",Germanic,English
AnExplosiveMonkey,europe,"Someone had to do it . Besides , [ those pixels were just resting in our account . ] ( http : //craic-it.com/wp-content/uploads/Father-Ted-e1435659696111.jpg ) \\n\\n",Germanic,English
AnExplosiveMonkey,europe,Beaten at their own game .,Germanic,English
AnExplosiveMonkey,europe,& gt ; eats apple\\n\\nHah ! Outsmarted .,Germanic,English
AnExplosiveMonkey,europe,/r/wholesomememes Europe style !,Germanic,English
AnExplosiveMonkey,europe,"Ah , that would explain the sour taste .",Germanic,English
AnExplosiveMonkey,europe,What changes were these ?,Germanic,English
AnExplosiveMonkey,europe,"So like he said , nothing.\\n\\njk",Germanic,English
AnExplosiveMonkey,europe,I was thinking more along the lines of declaring war on Iceland ... but I guess that works too .,Germanic,English
AnExplosiveMonkey,europe,Which is why many people choose not to stop and think .,Germanic,English
AnExplosiveMonkey,europe,Over half a year beforehand ? Do you have any examples of that ?,Germanic,English
AnExplosiveMonkey,europe,Sounds good to me .,Germanic,English
AnExplosiveMonkey,europe,It never seemed to occur to him why the odds were so good ...,Germanic,English
AnExplosiveMonkey,europe,"\u201cWe\\ 're not retreating , we\\ 're advancing in reverse.\ '' \\n\\n\u2015 Derek Landy , Skullduggery Pleasant\\n",Germanic,English
AnExplosiveMonkey,europe,As in actual Irish or \ '' An bhfuil cead agam dul go dt\u00ed an leithreas\ '' Irish ?,Germanic,English
AnExplosiveMonkey,europe,[ Let me put it this way ] ( https : //www.youtube.com/watch ? v=tiIspoQnPEA & amp ; t=2m31s ) .,Germanic,English
AnExplosiveMonkey,europe,What are you going to do about it ? ; ),Germanic,English
AnExplosiveMonkey,europe,Ireland number one exporter of peat . All other countries have inferior peat !,Germanic,English
AnExplosiveMonkey,europe,Based on anything ?,Germanic,English
AnExplosiveMonkey,europe,I was more wondering why there was some before she even started . I guess people must have known about it in advance and were expecting it .,Germanic,English
AnExplosiveMonkey,europe,Does that mean some people pronounce \ '' the\ '' as \ '' fe\ '' ? \\n\\nI just can\\'t hear that in my mind .,Germanic,English
AnExplosiveMonkey,europe,"Personally , the ones who openly want to destroy it , through action or inaction are the pretty scary ones .",Germanic,English
AnExplosiveMonkey,europe,They make such a [ great ] ( https : //satwcomic.com/art/more-difficult-love.jpg ) [ couple ] ( https : //satwcomic.com/art/ungodly-surprise.jpg ) .,Germanic,English
AnExplosiveMonkey,europe,Perhaps something like \ '' The left multiplies by dividing\ '' ?,Germanic,English
AnExplosiveMonkey,europe,[ Relevant xkcd ] ( https : //xkcd.com/927/ ),Germanic,English
AnExplosiveMonkey,europe,Same . It was a nice weekly tradition until I went through all of them in the local branch . After that it unfortunately meant going to Urlingford or wherever else to find some new ones .,Germanic,English
AnExplosiveMonkey,europe,"Eh , same thing , right ? \\n\\n/s",Germanic,English
AnExplosiveMonkey,europe,[ \\\\*cough\\\\* ] ( https : //www.youtube.com/watch ? v=8QSgNM9yNjo ) \\n\\nGood God that was seven years ago .,Germanic,English
AnExplosiveMonkey,europe,"Free , you could even say .",Germanic,English
AnExplosiveMonkey,europe,That is the British way .,Germanic,English
AnExplosiveMonkey,europe,Eurovision is a cruel mistress .,Germanic,English
AnExplosiveMonkey,europe,Do you think that will happen under May ?,Germanic,English
AnExplosiveMonkey,europe,Your username looks like a long depressed emotionless face .,Germanic,English
AnExplosiveMonkey,europe,None . In Ireland they would say \ '' tree\ '' .,Germanic,English
AnExplosiveMonkey,europe,"I\\ 've been so caught up in the election that I didn\\'t really realise until now how weird it is to have a surname that\\ 's two words . \\n\\nApparently it means \ '' the head\ '' , \ '' the chief\ '' , or \ '' the peninsula\ '' .",Germanic,English
AnExplosiveMonkey,europe,"Hey , hey , be fair . Even they were in on the agreement .",Germanic,English
AnExplosiveMonkey,europe,Just going to leave [ this ] ( http : //i.imgur.com/AKof4wY.jpg ) here ...,Germanic,English
AnExplosiveMonkey,europe,Climate tariffs would just make my day .,Germanic,English
AnExplosiveMonkey,europe,"FPTP - [ Where 37 % of the votes gets you 51 % of the seats , giving you 100 % of the power ] ( https : //www.youtube.com/watch ? v=r9rGX91rq5I )",Germanic,English
AnExplosiveMonkey,europe,"Actually the wiki page is pretty clear that a pile of rocks does *not* qualify as a building.\\n\\n & gt ; This article lists the oldest free-standing buildings constructed in the world , including on each of the continents and within each country . \ '' Building\ '' is defined as any human-made structure used or interface for supporting or sheltering any use or continuous occupancy . In order to qualify for list a structure must : \\nbe a recognisable building ; \\n\\n & gt ; incorporate features of building work from the claimed date to at least 1.5 metres ( 4.9 ft ) in height ; \\n\\n & gt ; be largely complete or include building work to this height for most of its perimeter.\\n\\n & gt ; contains an enclosed area with at least one entry point.\\n\\n & gt ; This consciously excludes ruins of limited height and statues . The list also excludes : \\n\\n & gt ; dolmens\u2014a type of single-chamber megalithic tomb , usually consisting of three or more upright stones supporting a large flat horizontal capstone\u2014unless they were originally covered over to form a barrow and used for collective burials . ( Neolithic dolmens are extremely numerous , with over 1,000 reported from Mecklenburg-Vorpommern in Germany alone . ) \\n\\n & gt ; cairns which are simply large piles of loose stones ( as opposed to chambered cairns . ) \\n\\n & gt ; Dates for many of the oldest structures have been arrived at by radiocarbon dating and should be considered approximate .",Germanic,English
AnExplosiveMonkey,europe,"Oooh , that would make more sense .",Germanic,English
AnExplosiveMonkey,europe,"Interesting . I get why Turkey would be against someone trying to start up an independent country claiming land from it , but what reasoning could Iraqi Kurdistan have to oppose PKK as well , or is that just to appease Turkey ?",Germanic,English
AnExplosiveMonkey,europe,Just curious is all . So what problems does Turkey have with Syrian Kurds but not Iraqi ones ?,Germanic,English
AnExplosiveMonkey,europe,"Oooooohhh I see . So purely phonetic , no symbolism or deeper meaning ?",Germanic,English
AnExplosiveMonkey,europe,"And of course *\ '' poronkusema\ '' * , meaning the distance a reindeer can travel before having to piss again , roughly 7-10km .",Germanic,English
AnExplosiveMonkey,europe,"Oh well , just time to sink back into the ocean , I guess . They had a good run at least .",Germanic,English
AnExplosiveMonkey,europe,And of course Penistone .,Germanic,English
AnExplosiveMonkey,europe,"From what I\\ 've heard , he just wasn\\'t as big a character as France\\ 's presidents of the past.\\n\\n & gt ; \ '' As a president I will be like the candidate that I am , a respectful candidate , a rallying candidate , a normal candidate for a normal presidency , at the service of the Republic.\ '' \\n\\n & gt ; -Francois Hollande\\n\\nIt\\ 's not so much that he did anything wrong , but that he wasn\\'t seen as doing enough right , which is when charisma matters most . Whatever you can say of Sarkozy and the like , they were definitely charismatic , and it might just be the case that France simply doesn\\'t want a \ '' normal\ '' president , they want a \ '' strong\ '' president , whatever that might be.\\n\\nEdit : a letter",Germanic,English
AnExplosiveMonkey,europe,& gt ; Iraqi Kurdistan\\n\\nWait what ? I thought Turkey was kind of attacking them ?,Germanic,English
AnExplosiveMonkey,europe,[ Attero Domiatus ] ( https : //www.youtube.com/watch ? v=9IwmYAdgU18 ),Germanic,English
AnExplosiveMonkey,europe,Any particular reason it happened then ?,Germanic,English
AnExplosiveMonkey,europe,I suppose the Corkonians are . ( I admit I had to look up that word ),Germanic,English
AnExplosiveMonkey,europe,"In name more than anything else.\\n\\nOne of them was previously a registered independent while the other had flipped back and forth between Democrat , Republican , and Independent too many times to count .",Germanic,English
AnExplosiveMonkey,europe,But it looks so saxy !,Germanic,English
AnExplosiveMonkey,europe,Link to blog ( even if not specific article ) ? \\n\\nSounds interesting .,Germanic,English
AnExplosiveMonkey,europe,Well that just goes without saying .,Germanic,English
AnExplosiveMonkey,europe,"True , but then there are also more costs as well , such as healthcare .",Germanic,English
AnExplosiveMonkey,europe,Why is there a picture of an empty white outline ?,Germanic,English
AnExplosiveMonkey,europe,And there have been many contenders for that .,Germanic,English
AnExplosiveMonkey,europe,"No different than Scotland or Wales AFAIK , having both local assemblies and contributions to the national parliament .",Germanic,English
AnExplosiveMonkey,europe,"[ That is just like churches , trying to trick people into going to hell ! ] ( http : //cdn1.relevantmediagroup.com/sites/default/files/styles/issue_preview_video/public/field/image/Pokechurch.jpg ? itok=Gcgp-u9X ) \\n\\n/s",Germanic,English
AnExplosiveMonkey,europe,A [ Turkish ] ( https : //www.youtube.com/watch ? v=l9qj9Zc8xd4 ) turtle,Germanic,English
AnExplosiveMonkey,europe,Does this have something to do with seasonal tourism jobs ?,Germanic,English
AnExplosiveMonkey,europe,[ It was meant to be ] ( https : //i.redditmedia.com/3lBuRSDMATQ8aH0SgL7lgwJsaX_iXRHg5aMR8fs183M.png ? w=765 & amp ; s=9c9662059fc820ab73519287c4e6f506 ) .,Germanic,English
AnExplosiveMonkey,europe,You started it ! /s,Germanic,English
AnExplosiveMonkey,europe,The subreddit /r/neoliberal has been popping up on the front page more and more often lately . [ This ] ( https : //www.reddit.com/r/neoliberal/comments/6ekb17/no_true_american_patriot_would_ever_downvote_a/ ) was around 2^nd place or so earlier .,Germanic,English
AnExplosiveMonkey,europe,From their above average height ...,Germanic,English
AnExplosiveMonkey,europe,"What makes it even worse is that for *ages* now , when it\\ 's come to agreements like these , America\\ 's standpoint has been something along the line of \ '' Well sure , *we* want to help combat climate change , but how do we now that if we reduce *our* emissions , all the other countries won\\'t just keep polluting and take advantage of our efforts ? \ '' \\n\\nAnd now EU , China , India , you name it , have all signed up , but that\\ 's no longer good enough . Ameica\\ 's doing the exact thing that they accused others of doing not so long ago .",Germanic,English
AnExplosiveMonkey,europe,I was referring to the idea of zero hour contracts supposedly being a good thing because \ '' they\\ 're better than nothing\ '' .,Germanic,English
AnExplosiveMonkey,europe,So eventually those 300 will die off ? What are the legal reasons for switching to a surname ?,Germanic,English
AnExplosiveMonkey,europe,"Ah , I knew something looked funny . This is what I get for trusting autocorrect.\\n\\nEdit : Although it did lead me to finding [ this ] ( http : //www.asandiford.com/wp-content/uploads/2012/04/2012-04-06-neologism-friday-the-viscous-circle.jpg )",Germanic,English
AnExplosiveMonkey,europe,Yeah ! That used to be *our* thing !,Germanic,English
AnExplosiveMonkey,europe,Reminded me of the [ Hawaii Five-0 intro ] ( https : //www.youtube.com/watch ? v=AepyGm9Me6w & amp ; t=17s ),Germanic,English
AnExplosiveMonkey,europe,"Is that a Greek phi , \u03c6 , being used as the symbol for France Insoumise , and if so , does anybody know why ?",Germanic,English
AnExplosiveMonkey,europe,Who knew equality cost so damn much ?,Germanic,English
AnExplosiveMonkey,europe,Aw ... damn !,Germanic,English
AnExplosiveMonkey,europe,Ehh ... [ not exactly ] ( https : //en.wikipedia.org/wiki/The_Pale ),Germanic,English
AnExplosiveMonkey,europe,"I suppose , though some of those at least are specific names , as in , the name of an actual town , and not just a geographical feature , so they never seemed as odd .",Germanic,English
AnExplosiveMonkey,europe,"No , you just don\\'t get it . When *other* people do it , they\\ 're dirty immigrants , but when *I* do it , it makes me an \ '' ex-pat\ '' .\\n\\n/s",Germanic,English
AnExplosiveMonkey,europe,The lack of eels is disappointing .,Germanic,English
AnExplosiveMonkey,europe,It complements their 2.3 popes per square km ( or 4.6 if you count old Benny ) .,Germanic,English
AnExplosiveMonkey,europe,"Ah , fixed .",Germanic,English
AnExplosiveMonkey,europe,[ The retired one . ] ( https : //en.wikipedia.org/wiki/Pope_Benedict_XVI ),Germanic,English
AnExplosiveMonkey,europe,[ Apparently so ] ( https : //en.wikipedia.org/wiki/Mater_Ecclesiae_Monastery_ ( Vatican_City\\\\ ) ),Germanic,English
AnExplosiveMonkey,europe,"& gt ; There **have** never been a president called Trump.\\n\\nGood God , that sounded plural for a second . The thought of it ... \\n",Germanic,English
AnExplosiveMonkey,europe,Very man,Germanic,English
AnExplosiveMonkey,europe,Now we just need the Greek patron saint to be Irish and the circle will be complete .,Germanic,English
AnExplosiveMonkey,europe,"Sure , rub it in .",Germanic,English
AnExplosiveMonkey,europe,It better be worth it .,Germanic,English
AnExplosiveMonkey,europe,Well if you insist .,Germanic,English
AnExplosiveMonkey,europe,"Politics is a spectrum , kinda . Perhaps many Fillon supporters , for example , would be torn between the final two , and this might be all it takes to nudge them over to Le Pen instead of Macron .",Germanic,English
AnExplosiveMonkey,europe,Fun fact : There was even a band called that in England before the BBC caught on and they had to shorten it to just \ '' The Pogues\ '' .,Germanic,English
AnExplosiveMonkey,europe,And it begins ...,Germanic,English
AnExplosiveMonkey,europe,Italian bottle .,Germanic,English
AnExplosiveMonkey,europe,\\\\*cough\\\\* looking at you Trudeau \\\\*cough*,Germanic,English
AnExplosiveMonkey,europe,I like the way the birds appear to be continuing on even past the edge .,Germanic,English
AnExplosiveMonkey,europe,What happened ?,Germanic,English
AnExplosiveMonkey,europe,"Um , kind of the opposite , almost . \\n\\nAnyone born in Northern Ireland anyway is automatically entitled to both an Irish and a British passport if they want them .",Germanic,English
AnExplosiveMonkey,europe,"He even says as much\\n\\n & gt ; \u201cWe have a house in Italy , \u201d he added , \u201cand I don\u2019t want to find myself queuing to get through Rome airport every time I go there.\u201d",Germanic,English
AnExplosiveMonkey,europe,Why would an economically liberal party want to add more restrictions/fees ? \\n\\nSomething to do with private universities ?,Germanic,English
AnExplosiveMonkey,europe,"They have a place where you can [ dive between the two slowly separating North American and Eurasian continental plates ] ( https : //www.dive.is/wp-content/uploads/2013/11/Silfra_cathedral_diver6-1024x680.jpg ) , and also due to their isolation , Icelandic horses are more susceptible to foreign diseases , and so any horse that leaves the island to compete elsewhere is [ banished from returning ] ( https : //www.youtube.com/watch ? v=TsXMe8H6iyc & amp ; t=2m32s ) , for fear of bringing diseases with it .",Germanic,English
AnExplosiveMonkey,europe,& gt ; the friendly flanders neighboor christian party\\n\\nAny examples you have off hand ?,Germanic,English
AnExplosiveMonkey,europe,Link and/or translation and/or TL : DR ?,Germanic,English
AnExplosiveMonkey,europe,"Huh , why does that appear bolded ?",Germanic,English
AnExplosiveMonkey,europe,& gt ; many people still remember the W\u00fcrselen debacle.\\n\\n ?,Germanic,English
AnExplosiveMonkey,europe,"& gt ; If you want to argue a technicality you can , but it just makes you look like you\\ 're missing the point.\\n\\nTechnically , you *are* right . This is not what falls under the legal definition of murder . But when someone says that the Church is responsible for murdering babies , they\\ 're not discussing the legal aspects , but the ethical ones . \ '' Murder\ '' is just used as shorthand for that.\\n\\nThe church killed babies through criminal negligence . Is that better ?",Germanic,English
AnExplosiveMonkey,europe,One way of putting it that I found funny was -\\n\\n\ '' UKIP have discovered that the problem with trying to dress xenophobia in a nice suit is that the Conservative Party always has nicer suits.\ '',Germanic,English
AnExplosiveMonkey,europe,"... So ? \\n\\n There\\ 's more to being progressive than saying \ '' Look ! I have a gay friend ! \ '' , and I say that as a gay guy .",Germanic,English
AnExplosiveMonkey,europe,"& gt ; \ '' People are idiots\ '' , that\\ 's a really nuanced argument though.\\n\\n\\\\*cough\\\\* \u00a3350 million \\\\*cough\\\\*",Germanic,English
AnExplosiveMonkey,europe,"Just a heads up , to fix your link you need to put a backslash , \\\\ , before any extra \\ ' ) \\ 's in the website\\ 's name.\\n\\ni.e . to get this\\n\\n [ sausages from potatoes ] ( http : //www.garmazeria.com.pl/images/wyroby/kiszka % 20ziemniaczana % 20herman % 20 ( 1\\\\ ) .JPG ) \\n\\nyou need to type this\\n\\n [ sausages from potatoes ] ( http : //www.garmazeria.com.pl/images/wyroby/kiszka % 20ziemniaczana % 20herman % 20 ( 1\\\\ ) .JPG ) \\n\\nNotice how \ '' 20 ( 1 ) .JPG ) \ '' goes to \ '' 20 ( 1**\\\\** ) .JPG ) \ ''",Germanic,English
AnExplosiveMonkey,europe,& gt ; And how will Marion \ '' do away with the Republic\ '' when his ya know president of the republic of France it\\ 's almost like you suggesting he\\ 's going to become a dictator\\n\\nMarion \u2260 Macron,Germanic,English
AnExplosiveMonkey,europe,Everyone knows [ slow internet is worse than no internet ] ( https : //img.ifcdn.com/images/2c4710e468a064365ee66efad964b49dd18296c33415b45a87b82cd50c40137d_1.jpg ),Germanic,English
AnExplosiveMonkey,europe,[ For those unaware ] ( https : //www.reddit.com/r/AskReddit/comments/dxosj/what_word_or_phrase_did_you_totally_misunderstand/c13pbyc/ ),Germanic,English
AnExplosiveMonkey,europe,Lol at that little dot of red for Vatican City . For some reason I doubt they even have schools .,Germanic,English
AnExplosiveMonkey,europe,"\ '' You\\ 're taking them literally , not seriously.\ ''",Germanic,English
AnExplosiveMonkey,europe,[ Bike it off ! ] ( https : //satwcomic.com/art/bike-it-off.png ),Germanic,English
AnExplosiveMonkey,europe,[ PRIMO VICTORIA ! ] ( https : //www.youtube.com/watch ? v=IrJAwCBbnuc ),Germanic,English
AnExplosiveMonkey,europe,& gt ; tow the line.\\n\\n* [ toe ] ( https : //en.wikipedia.org/wiki/Toe_the_line ),Germanic,English
AnExplosiveMonkey,europe,\\n\u201cThe best time to plant a tree was 20 years ago . The second best time is now.\u201d \u2013 Chinese Proverb,Germanic,English
AnExplosiveMonkey,europe,Can I ask what changed ?,Germanic,English
AnExplosiveMonkey,europe,( ( ( Jar Jar Binks ) ) ),Germanic,English
AnExplosiveMonkey,europe,"Huh , then from your perspective have you found what the fuss was about ?",Germanic,English
AnExplosiveMonkey,europe,Why not both ?,Germanic,English
AnExplosiveMonkey,europe,[ There is a battle between two wolves inside us all ] ( http : //cdn.zenpencils.com/wp-content/uploads/2012-11-27-twowolvesnew.jpg ),Germanic,English
AnExplosiveMonkey,europe,How are things like \ '' America First ! \ '' and \ '' Reclaiming our sovereignty ! ( Brexit ) \ '' not inherently nationalistic ?,Germanic,English
AnExplosiveMonkey,europe,For [ you ] ( https : //www.youtube.com/watch ? v=gSq8ZBdSxNU & amp ; t=46s ),Germanic,English
AnExplosiveMonkey,europe,What do you think it would take for PvdA to eventually recover from this ? Is there really any chance of them being involved in another coalition with VVD after the amount of criticism they got for enabling them last time ?,Germanic,English
AnExplosiveMonkey,europe,"The short answer is \ '' Why *not* let gay people get married . Sure , you could make the argument that no kids will actually come from it , but the same could be said of elderly or infertile couples , and you don\\'t see anyone saying \ '' *Well* , do they really *need* the right to vote ? \ '' .",Germanic,English
