user,subreddit,post,family,lang
2ntle,AskEurope,"As HirAmarth said , Split ( Croatia ) is a rare European city with a nice beach practically in the city center , plus it covers the rest ( shopping , museums , restaurants , etc . ) .",Balto-Slavic,Croatian
2ntle,europe,Plus all that sweet sweet seaside real estate for our new brothers with superior buying power to take over : D,Balto-Slavic,Croatian
2ntle,europe,& gt ; Split and Dalmatia have turned into Herzegovina 2.0 and is a horribly narrow-minded area overall . Plenty of Serb tourists come to Istria and Kvarner and suffer no problems.\\n\\nPlenty of Serb tourists in Split . No problems so far ( knock on wood ) .,Balto-Slavic,Croatian
2ntle,europe,"The comment on the end of the article drives the right point home that was not covered by the author : \\n\\n & gt ; From my personal experience and studies ( currently writing my thesis in Balkan history ) , this almost makes it out that those Serbs in Vukovar are totally innocent bystanders in the war and the current issue surrounding Cyrillic script . Eastern Slavonia was peacefully re-integrated into Croatia in 1997 , two years after the war officially ended . Whilst in Serb hands , the Latin Script was banned . Non-Serbs were ethnically cleansed and thousands were murdered by Serbs attempting to take Vukovar and surrounding areas . These were not just Yugoslav Army conscripts or Serbs from faraway places . These were mainly local Serbs who committed such crimes . Under international pressure , Croatia was forced to accept terms of amnesty to all Serbs who committed crimes of rape , murder , torture , theft etc in order to have Eastern Slavonia re-integrated . Fast forward to 2013 and those people who committed those crimes walk freely amongst the victims . This is one of the biggest factors stopping the Serbs from integrating fully into society , thus we have a culture of separation ( cafes , shops , schools etc ) . Added to this are serious suspicions that the 2011 census is not accurate in the number of Serbs in the County . For example , at one address it was found that there were around 30 people were registered there . So clearly there are people being registered as living in the area that do not . There are groups that have reported several such instances and others who believe that this is a deliberate attempt to artificially increase the number of Serbs living there for political reasons .",Balto-Slavic,Croatian
2ntle,europe,"Well , when you have a pretty strong mafia ( or any other form of organized crime ) , their crimes often go unreported , especially the non-violent ones .",Balto-Slavic,Croatian
305-1468,europe,https : //www.youtube.com/v/qfElkGLXbH8\\n\\nno sign in link,Balto-Slavic,Croatian
305-1468,europe,"I think the circle is just represents 850 miles from Ljubljana , because OP is from there.\\n [ \\nYou have a different circle . ] ( http : //iss.astroviewer.net/observation.php ? lon=24.10518639999998 & amp ; lat=56.9496487 & amp ; name=R % C4 % ABga )",Balto-Slavic,Croatian
305-1468,europe,"yep , correct",Balto-Slavic,Croatian
305-1468,europe,"True , but almost everybody just says \ '' at\ '' ...",Balto-Slavic,Croatian
305-1468,europe,"Your map shows exclusive economic zones which are , for the most part , in international waters.\\n\\nTerritorial waters are much smaller , the darker area on the map I linked .",Balto-Slavic,Croatian
305-1468,europe,They were not infringing on Portuguese airspace . Only Estonian IIRC .,Balto-Slavic,Croatian
305-1468,europe,"~~Germany~~ Rheinmetall Helped Prep Russia for War , U.S. Sources Say\\n\\nWhat a sensationalist headline ... \\n\\n",Balto-Slavic,Croatian
305-1468,europe,"Serbia got a bit bigger , and Croatia a bit smaller due to recent floods according to [ that map ] ( http : //news.bbcimg.co.uk/media/images/74934000/jpg/_74934346_serbia_flooding_624.jpg ) ...",Balto-Slavic,Croatian
305-1468,europe,http : //en.wikipedia.org/wiki/WW2_casualties # Human_losses_by_country\\n\\nSort by last column,Balto-Slavic,Croatian
305-1468,europe,"http : //likeatme.com/wp-content/uploads/2014/04/winter-idylle-by-amila-omerika-500px-1397933717gk8n4.jpg\\n\\nalso , /r/europics/",Balto-Slavic,Croatian
305-1468,europe,"[ It\\ 's actually \ '' Vila\ '' in Croatian too ] ( https : //hr.wikipedia.org/wiki/Vila_\\\\ ( mitologija\\\\ ) ) . They can be good or bad , but always beautiful young girls , sometimes with wings or other fantastic elements .",Balto-Slavic,Croatian
305-1468,europe,[ It looks like Napoleon pacified Europe ] ( http : //images.classwell.com/mcd_xhtml_ebooks/2005_world_history/images/mcd_awh2005_0618376798_p648_f2.jpg ),Balto-Slavic,Croatian
3ch0cro,europe,Pretty much the same shit whether you like it or not .,Balto-Slavic,Croatian
3ch0cro,europe,"It is known , even in Belgium .",Balto-Slavic,Croatian
401vs401,europe,Something Janukovi\u0107 in something ? Looks something .,Balto-Slavic,Croatian
401vs401,europe,\ '' Pledge your grievance to the flag\ '',Balto-Slavic,Croatian
401vs401,europe,"To be fair , I tried the same with the US a couple weeks back . I gave up halfway through.\\n\\nhttp : //i.imgur.com/ECHdVsf.png",Balto-Slavic,Croatian
401vs401,europe,I was sure Montana was on the other side of the map . I have no idea why .,Balto-Slavic,Croatian
401vs401,europe,"Oh sorry , thought you were saying it was . Agreed , great PR while also providing spectacle and training hours for the pilots .",Balto-Slavic,Croatian
401vs401,europe,[ I love this picture of Tallinn ] ( https : //drscdn.500px.org/photo/48627520/m % 3D2048/4a838456bf9ba9512995601f2ee74f94 ) .,Balto-Slavic,Croatian
401vs401,europe,[ KLM should go with the same design as the Dutch F16 ] ( http : //www.abload.de/img/d20100712ev1839_tcm46-qm9k.jpg ) . Would probably look horrendous sized up to a 777 though ...,Balto-Slavic,Croatian
401vs401,europe,Completed . Double citizenship should be an option btw .,Balto-Slavic,Croatian
401vs401,europe,[ How about this ? ] ( http : //en.wikipedia.org/wiki/Millau_Viaduct ),Balto-Slavic,Croatian
401vs401,europe,Cazaquist\u00e3o sounds like a south American beach or a cocktail or something ...,Balto-Slavic,Croatian
401vs401,europe,My cyrillic is rusty . Would that be : SUDBJA PLANETE - TVOJA SUDBJA ?,Balto-Slavic,Croatian
401vs401,europe,"\u0160vedska and \u0160vicarska , yo !",Balto-Slavic,Croatian
401vs401,europe,Doesn\\'t Sziget literally mean \ '' island\ '' in Hungarian ?,Balto-Slavic,Croatian
401vs401,europe,"It sure clashes with the freedom of movement principle , as in it creates an obstacle ( both financial and bureaucratic ) that some other countries in the Union might not have ( i.e . switching from Italy to the UK might be simpler than switching from Italy to Croatia , since the UK could have different rules as regards nostrification of European titles ) , which is itself a form of discrimination between citizens that should be treated the same.\\n\\nOh well , I managed to get my employer to agree to wait a little bit , until I get things straight .",Balto-Slavic,Croatian
401vs401,europe,"Not man-made like the rest , but Plitvice and the other national parks should be on this list.\\n\\n ... and picigin . Picigin is fun .",Balto-Slavic,Croatian
401vs401,europe,"& gt ; Italians always ask you if you speak English\\n\\nNot in Istria . They start right away in Italian , whether you speak it or not . No effort whatsoever .",Balto-Slavic,Croatian
401vs401,europe,"I\\ 'm interested whether we\\ 'll slowly see a \ '' European citizenship\ '' for all or if we\\ 'll be forced to choose one particular citizenship over another , without the possibility of keeping both.\\n\\nHow many have this same \ '' problem\ '' on here ?",Balto-Slavic,Croatian
401vs401,europe,Could you elaborate ?,Balto-Slavic,Croatian
401vs401,europe,Pool mattresses . Pool mattresses everywhere .,Balto-Slavic,Croatian
420666911,europe,We all will feel the fruition of the seed of suffering that is planted alongside socialism.\\n,Balto-Slavic,Croatian
420666911,europe,"Hmm ... It seems like most of the devastating economic policies of communists are not protectionist in the same way that most protectionist policies are . Protectionism is extremely wasteful and eats away at a country slowly , and my comment was only intended to say that if we must deal with politics , it would be less bad to have a protectionist in power than a communist . The lies these types of politicians sell are designed to appeal to the same desire , but one brand of lies , when implemented , is less dangerous .",Balto-Slavic,Croatian
420666911,europe,"It is a victory for socialism and some poor European countries perhaps , but a tremendous loss for France and for actual western civilization .",Balto-Slavic,Croatian
420666911,europe,This is how you lose your country .,Balto-Slavic,Croatian
420666911,europe,"Oh whoops , looks like you forgot to read my comment , in which I never mentioned fascism .",Balto-Slavic,Croatian
420666911,europe,"Keep justifying their actions so communists can murder another hundred million people , bravo .",Balto-Slavic,Croatian
99hero99,europe,"& gt ; Franjo Tudjman , independent Croatia\u2019s first prime minister in 1991\\n\\nHe was the first president",Balto-Slavic,Croatian
99hero99,europe,https : //en.wikipedia.org/wiki/Flag_of_Split\\n\\nIm afraid it is,Balto-Slavic,Croatian
99hero99,AskEurope,While other people will be dying from the apocalypse you will die as every Czech dies in Croatia - on a mountain in flip flops,Balto-Slavic,Croatian
99hero99,AskEurope,They would still have wood,Balto-Slavic,Croatian
99hero99,AskEurope,"There was a MTV show about vampires , zombies and wharewolf attacking Los Angeles I think.\\n\\nIt was a comedy",Balto-Slavic,Croatian
99hero99,europe,There is only one dominant culture in the USA,Balto-Slavic,Croatian
99hero99,AskEurope,"France- Western Europe\\n\\nGermany , Switzerland- Central Europe \\n\\nItaly- Southern Europe",Balto-Slavic,Croatian
99hero99,AskEurope,"1 . Not allowing immigrants =/= holocaust\\n\\n2 . Why would EU take American minorities , there is nothing happening to them",Balto-Slavic,Croatian
99hero99,AskEurope,Losing money or dying,Balto-Slavic,Croatian
99hero99,AskEurope,Hope [ this ] ( https : //www.quora.com/Why-didnt-the-Allies-push-north-from-Italy-towards-Germany-instead-of-invading-Normandy-on-D-day ) helps,Balto-Slavic,Croatian
99hero99,AskEurope,"1 . As you said Americans love to travel to Europe on vacation , European tourisam would take a hit\\n\\n2 . You are acting like the ban is permenant , it will only last 90-120 days\\n\\n3 . Majority of muslim countries are not banned\\n\\n4 . Obama did the same thing to Iraq in 2011 . ( it lasted 6 months )",Balto-Slavic,Croatian
99hero99,AskEurope,"& gt ; Meanwhile , there are plenty of muslim countries that fit the criteria.\\n\\nI wonder why",Balto-Slavic,Croatian
99hero99,AskEurope,Why people keep shitposting here ?,Balto-Slavic,Croatian
99hero99,AskEurope,CK2 and The Witcher 3,Balto-Slavic,Croatian
99hero99,AskEurope,& gt ; it goes so wrong after just a short gameplay\\n\\nYou are doing something wrong,Balto-Slavic,Croatian
99hero99,europe,The similar situation happened last year,Balto-Slavic,Croatian
99hero99,AskEurope,"You forgot Serbian , Bosnian and Montenegrian",Balto-Slavic,Croatian
99hero99,europe,"No , the red one was ( SDP )",Balto-Slavic,Croatian
99hero99,AskEurope,I drink beer,Balto-Slavic,Croatian
99hero99,AskEurope,Name fits,Balto-Slavic,Croatian
99hero99,AskEurope,"Greeks \\n\\nMost trustworthy , least arrogant and most compassionate\\n\\nAccording to Greeks",Balto-Slavic,Croatian
99hero99,AskEurope,"So you think Sweden , Norway , Denmark , UK ... are fascist countries ?",Balto-Slavic,Croatian
99hero99,europe,& gt ; Welcome to BiH\\n\\nWelcome to Ex-Yu,Balto-Slavic,Croatian
99hero99,europe,"For Spain , I think his son replaced him as king\\n\\nAs for Andorra , President of France and one Spanish Bishop are princes of Andorra",Balto-Slavic,Croatian
99hero99,AskEurope,[ Sve\u010denikova djeca/Priests children ] ( http : //www.imdb.com/title/tt2395421/ ) \\n\\nA young priest gets an idea to pierce condoms before they are sold in order to increase the birth rate of his island .,Balto-Slavic,Croatian
99hero99,europe,"In Europe ? \\n\\nSpain , Andorra , UK , Belgium , Netherlands , Luxembourg , Monaco , Vatican , Lichtenstein , Norway , Sweden , Denmark , Vatican ,",Balto-Slavic,Croatian
99hero99,AskEurope,"Are you sure that you , and the half of your country are not overreacting ?",Balto-Slavic,Croatian
99hero99,AskEurope,"& gt ; If you do not live in a swing state , your vote for the president ( and a majority of other offices ) has literally no affect/impact.\\n\\nThis kind of thinking is one of the reasons Trump won",Balto-Slavic,Croatian
99hero99,AskEurope,No one seems smart when speaking in Slovenian,Balto-Slavic,Croatian
99hero99,europe,Most of them,Balto-Slavic,Croatian
99hero99,AskEurope,Pretty sure all of the European countries accept refugees,Balto-Slavic,Croatian
99hero99,AskEurope,& gt ; Among other things they estimate that there was more Native Americans in the Americas than Europe at the time ... \\n\\nYou mean North America had more people then Europe right ? \\n\\nBecause the way you presented it it sounds like NA had more native Americans then Europe,Balto-Slavic,Croatian
99hero99,europe,Its the Holy Crown of Hungary,Balto-Slavic,Croatian
99hero99,AskEurope,That explains a lot,Balto-Slavic,Croatian
99hero99,europe,You missed out,Balto-Slavic,Croatian
99hero99,AskEurope,Bikini in the winter ? \\n\\n,Balto-Slavic,Croatian
99hero99,AskEurope,"& gt ; An unrepresentative government , police brutality , nonexistent healthcare and safety net , etc at home and a horrifically violent foreign policy abroad.\\n\\nAll of this has been going on for decades , why start now ?",Balto-Slavic,Croatian
99hero99,AskEurope,Srb is also a surname in Croatia,Balto-Slavic,Croatian
99hero99,AskEurope,so Turkey ? \\n,Balto-Slavic,Croatian
99hero99,europe,Same thing happened in Split,Balto-Slavic,Croatian
99hero99,AskEurope,Dicks out for freedom,Balto-Slavic,Croatian
99hero99,AskEurope,That was syphilis,Balto-Slavic,Croatian
99hero99,AskEurope,"He was a \ '' communist\ '' dictator\\n\\nSome people love him , some people hate him , some people are indifferent",Balto-Slavic,Croatian
99hero99,AskEurope,We eat them smoked and dry in Croatia,Balto-Slavic,Croatian
99hero99,AskEurope,"We have border disputes with most of our neighbors , so yes",Balto-Slavic,Croatian
99hero99,europe,"Canadian prime minister is an epic troll , and so are you",Balto-Slavic,Croatian
99hero99,AskEurope,"My parents used to go to Italy or Bosnia to buy stuff , but that was 15 years ago",Balto-Slavic,Croatian
99hero99,AskEurope,There are no breaks on troll train,Balto-Slavic,Croatian
99hero99,AskEurope,"& gt ; Sve su pite pite , samo je burek pitac\\n\\nIt gets me every time",Balto-Slavic,Croatian
9Gaming,europe,"Point out : Citizents did not accept , government did . If you ask Citizens in Croatia , 90 % will reject immigrants . \\nAnd reason why government accepted , it\\ 's because they know Croatia is not rich enough for \ '' immigrants\ '' to stay in.. They will go anyway in Germany , Sweden ...",Balto-Slavic,Croatian
9Gaming,europe,Real problem is : \\nMoney that they will get from Croatian government : 0 \\nMoney that they will get from German/Sweden government : A lot .,Balto-Slavic,Croatian
9Gaming,europe,Croatia : CroCop,Balto-Slavic,Croatian
ANGRY_TURTLE_ARRGH,europe,"Nice try , Slovenia tourism minister .",Balto-Slavic,Croatian
ANGRY_TURTLE_ARRGH,europe,What a stupid article .,Balto-Slavic,Croatian
ANGRY_TURTLE_ARRGH,europe,They are \ '' praying\ '' there for years . I remember drunkenly trolling them with friends during the glorious college days .,Balto-Slavic,Croatian
ANGRY_TURTLE_ARRGH,europe,No . You have the option \ '' yes\ '' or \ '' leave\ '' . It\\ 's up to you .,Balto-Slavic,Croatian
AbusiveCornflake,europe,"Well , Aristotle and Plato acctually existed unlike Jesus",Balto-Slavic,Croatian
AbusiveCornflake,europe,& gt ; The Sun\\n\\n & gt ; Frame-up\\n\\n\\nNo way !,Balto-Slavic,Croatian
AbusiveCornflake,europe,"RIP Ferdinand , never forget : ( (",Balto-Slavic,Croatian
AbusiveCornflake,europe,Pretty sure this one was made after independance,Balto-Slavic,Croatian
AbusiveCornflake,europe,"Most of the countries above you are Slavic , you stood no real chance .",Balto-Slavic,Croatian
AbusiveCornflake,europe,Will a teamspeak or discord of some sorts be provided or will we just coordinate over steam ?,Balto-Slavic,Croatian
AbusiveCornflake,europe,Tbh I only learned to read cyrillic so I can read comments from youtube accounts with names and pictures of war criminals,Balto-Slavic,Croatian
AbusiveCornflake,europe,"If any foreigners want to learn more on this topic , please ignore everything said on reddit by these backwards nationalists ( looking at you KontaktniCentar ) and read a proper article on it.\\n\\n",Balto-Slavic,Croatian
AbusiveCornflake,europe,Implying anyone in the general area of the Ex-Yu cares about the stupid media and political shit our goverments keep throwing at us .,Balto-Slavic,Croatian
AbusiveCornflake,europe,I heard Syria is warm this time of year .,Balto-Slavic,Croatian
AbusiveCornflake,europe,"Yeah , how on Earth will we live without our Serbian friends",Balto-Slavic,Croatian
AbusiveCornflake,europe,"No , he was Serbian . \\n\\nJust like everyone else on this planet .",Balto-Slavic,Croatian
AbusiveCornflake,europe,"The Balkan countries that are worse than Turkey are coincidentally all the ones where Turkish influence and Islam still exist today , while the ones who resisted Turkish rule do much better . Coincidence ? I think not .",Balto-Slavic,Croatian
AbusiveCornflake,europe,Same as any other communist dictator . Work camps .,Balto-Slavic,Croatian
AbusiveCornflake,europe,"As the host said , noone would mind it really . Reserve whatever you want man , as long as noone already did .",Balto-Slavic,Croatian
AbusiveCornflake,europe,And if they happen in Split then people tend to complaim by throwing stones at it,Balto-Slavic,Croatian
AbusiveCornflake,europe,"Indians are Hindu Serbs , Turks are Muslim Serbs , Izraelites are Jew Serbs . Adam and Eve were both Serb . Everyone is a Serb . God is a Serb . Serbia .",Balto-Slavic,Croatian
AbusiveCornflake,europe,& gt ; And thats not a good thing\\n\\nAgree to disagree .,Balto-Slavic,Croatian
AbusiveCornflake,europe,"Oh hey , lets put Turkey in this graph but not several countries that are acctually in Europe .",Balto-Slavic,Croatian
AbusiveCornflake,europe,"Well no , not really . Tiny parts of it were Italian for meaningless amounts of time ( the major towns were mostly Roman tho , so the architecture is the same ) .",Balto-Slavic,Croatian
AbusiveCornflake,europe,Lets put the nationalism and discrimination that Yugoslavia was full off aside .,Balto-Slavic,Croatian
AbusiveCornflake,europe,& gt ; italian\\n\\nSay no more .,Balto-Slavic,Croatian
AbusiveCornflake,europe,"Young people in Europe tend to enjoy life in/after high education . \\n\\nThey usually travel through Europe and visit various places , as opposed in the US where you need to get a job as soon as you finish school in order to pay that 80k $ student loan off .",Balto-Slavic,Croatian
AbusiveCornflake,europe,One does not mention that name to a citizen of Ex-Yu without recieving a rant about how he was either the greatest leader of all time or a war criminal and a dictator . \\n\\nTl : dr Tito is basically Voldemort,Balto-Slavic,Croatian
AbusiveCornflake,europe,Mr.Tito took care of that .,Balto-Slavic,Croatian
AbusiveCornflake,europe,Not even mad .,Balto-Slavic,Croatian
AbusiveCornflake,europe,\ '' Hurr durr give Piranski zaljev\ '',Balto-Slavic,Croatian
AbusiveCornflake,europe,You have your own politicians to blame for that,Balto-Slavic,Croatian
AbusiveCornflake,europe,"Yes and out of those 8 million probably less than a million were Romans.\\n\\nMost were slaves imported from all over the Empire and a small percentage were the other Native people of the peninsula ( Etruscans , Greeks , etc . ) \\n\\n",Balto-Slavic,Croatian
AbusiveCornflake,europe,**Croatia**\\n\\n**25 years since Vukovar and \u0160kabrnja genocide**\\nAll around the country there were ceremonies held for the victims of the \u0160kabrnja genocide and the sacrifice of 1600 Vukovar defenders.\\n\\n**Salmonela found in Konzum**\\nTraces of Salmonela have been found in meat from the \ '' Konzum\ '' supermarkets . A few weeks ago a young child died from Salmonela in eggs . \\n\\n\\n\\n,Balto-Slavic,Croatian
AbusiveCornflake,europe,This should be interesting .,Balto-Slavic,Croatian
AbusiveCornflake,europe,Constantinople looks nice this time of year .,Balto-Slavic,Croatian
AbusiveCornflake,europe,"Protip : Bosnian stuff is cheap af , but they will ussually have huge exchange rates ( from my experience ) . So , if you can , exchange your currency for KM in your own country .",Balto-Slavic,Croatian
AbusiveCornflake,europe,And with the Bosniaks we have the food eating contests covered aswell.\\n\\nFlawless .,Balto-Slavic,Croatian
AbusiveCornflake,europe,Visit Croatia . Basically cheaper Italy with islands .,Balto-Slavic,Croatian
AbusiveCornflake,europe,"I guess the mandatory balkan shitfest is happening under this comment . Just here to reserve my spot , carry on .",Balto-Slavic,Croatian
AbusiveCornflake,europe,But..but.. a bearded man created Earth in 7 days !,Balto-Slavic,Croatian
AbusiveCornflake,europe,What ? Never heard of any Malaysians in Croatia during the war .,Balto-Slavic,Croatian
AbusiveCornflake,europe,Probably has something to do with that incident at Vienna a few hundred years back .,Balto-Slavic,Croatian
AbusiveCornflake,europe,We do .,Balto-Slavic,Croatian
AbusiveCornflake,europe,"Some Croatian ones , many were left out : :\\n\\n**Ludbreg** \u2013 Translation : \u2018Crazyhill\u2019 \u2013 It is a city in Vara\u017edin county known as the centre of the world . The folk of Ludbreg claim that if you were to spread a map of the world flat , then it is their town which is bang smack in the middle.\\n\\n**\u0160pi\u010dkovina** \u2013 Translation : Let\u2019s just say it contains a derogatory word for female genitalia plus a few extra letters \u2013 It is located in Krapina in the Zagorje County.\\n\\n\\n**Veliko Svinji\u010dko** \u2013 Translation : Roughly meaning \u2018big piggy\u2019 \u2013 It is a place in the Sisak \u2013 Moslavina County.\\n\\n**Gornje and Donje Cjepidlake** \u2013 Translation : Gornje and Donje mean \u2018Upper\u2019 and \u2018Lower\u2019 whilst Cjepidlake means \u2018splitting hairs\u2019 or slang for someone super pedantic \u2013 They are places in the Bjelovar \u2013 Bilogora County.\\n\\n**Pivnica Slavonska** \u2013 Translation : \u2018Slavonian Alehouse\u2019 \u2013 The place called a beer hall is located near Cjepidlake.\\n\\n\\n\\n**Grudnjak** \u2013 Translation : \u2018Bra\u2019 \u2013 It is located in the Virovitica \u2013 Podravina County.\\n\\n**Ga\u010dice** \u2013 Translation : \u2018Panties\u2019 \u2013 Which is in Vara\u017edin county.\\n\\n\\n**Babina Guzica** \u2013 Translation \u2013 Grandma\u2019s Ass \u2013 It is an island which is part of Kornati National Park.\\n\\n**Babina Greda** \u2013 Translation : \u2018Grandma\u2019s Balk\u2019 \u2013 A village in Vukovar \u2013 Srijem County.\\n\\n**Svinjarevci** \u2013 Translation : Basically means \u2018Pigs\u2019 \u2013 Another village in Vukovar \u2013 Srijem County.\\n\\n**\u0160takorovec** \u2013 Translation : \u2018Rats\u2019 \u2013 It is located in Zagreb County.\\n\\n**Grdoselo** \u2013 Translation : \u2018ugly village\u2019 \u2013 Located near Pazin in Istria.\\n\\n**\u017denodraga** \u2013 Translation : \u2018Dear wife\u2019 \u2013 Which is found near Vi\u0161njan also in Istria.\\n\\n**Prdu\u0161a vela** \u2013 Translation : Basically means \u2018big fart\u2019 \u2013 It is one of the islands near the Kornati National park.\\n\\n\\n**Ga\u0107elezi** \u2013 Translation : It is a combination of 2 words \u2013 \u2018panties\u2019 and \u2018lie down\u2019 \u2013 It is located in \u0160ibenik \u2013 Knin County.\\n\\n\\n**Donja batina** \u2013 Translation : Donja means \u2018lower\u2019 whilst Batina is a stick or baton or a word to describe a bludgeoning \u2013 It is in Krapina \u2013 Zagorje County , near Zlatar.\\n\\n**Zadrkovci** - Translation : Something to do with mssturbation",Balto-Slavic,Croatian
AbusiveCornflake,europe,"Yes , if you vote leave that means no more midget porn for you",Balto-Slavic,Croatian
AbusiveCornflake,europe,"Really ? Taken from Wikipedia on Homosexuality penalties in Saudi Arabia : \\n\\n*Fines , floggings , prison time up to life , torture , chemical castrations , [ 1 ] whipping torture , and/or death penalty on first offense . *\\n\\n\\nTell me more on how Islam is more tollerant than Christianity .",Balto-Slavic,Croatian
AbusiveCornflake,europe,Zagreb.\\n\\nBasically discount Prague/Vienna without the swarm of tourists .,Balto-Slavic,Croatian
AmyLaze,europe,"Just drinking a cup now : ) but I prefer to make a big cup of turkish coffee , the only thing that wakes me up in the morning",Balto-Slavic,Croatian
AmyLaze,europe,how do you even ... . and I thought Croatian looked hard,Balto-Slavic,Croatian
AmyLaze,europe,Born in croatia ; ),Balto-Slavic,Croatian
Annalanna,europe,& gt ; Luxembourg\\n\\nProbably lakes such as Upper-S\u00fbre Lake and the Lakes of Remerschen .,Balto-Slavic,Croatian
Annalanna,europe,"The picture for Croatia is wrong . The peak depicted there is actually in Bosnia and Herzegovina as it is Troglav . The highest peak inside Croatia is actually another peak of the same mountain , [ Dinara \\\\ ( Sinjal\\\\ ) ] ( http : //i.imgur.com/pD0habH.jpg ) .",Balto-Slavic,Croatian
