user,subreddit,post,family,lang
BeautifulTaeng,europe,Istanbul is most definitely in Europe tho,Balto-Slavic,Croatian
BeautifulTaeng,europe,No because all of them have more or less the same goal : dissolution of EU and a divided Europe,Balto-Slavic,Croatian
BeautifulTaeng,europe,something something never forget 700k something something croats biggest monsters world has ever met,Balto-Slavic,Croatian
BeautifulTaeng,europe,"Why ? There is no military and economical force in the world strong enough to face NATO , seems to me like scaremongering to buy american equipment",Balto-Slavic,Croatian
BeautifulTaeng,europe,yes,Balto-Slavic,Croatian
BeautifulTaeng,europe,neck yourself,Balto-Slavic,Croatian
BeautifulTaeng,europe,LOOK ME MO I SAID JUST BALKAN THIGNS LOOK HOW FUCKING HIALRIOUS AND ORIGINAL I AM AHAH XDDDDCX XD D XD X X XD \\n\\nHow many votes did AdF get ? Neo nazism on the rise ? Fourth Reich soon ? Just german things,Balto-Slavic,Croatian
BeautifulTaeng,europe,kek,Balto-Slavic,Croatian
BeautifulTaeng,europe,Why not just annex EU ? Rule Britannia !,Balto-Slavic,Croatian
BeautifulTaeng,europe,"Sundays yeah but most people still work Saturdays here , albeit not whole 8 hours",Balto-Slavic,Croatian
BeautifulTaeng,europe,Saruman gathers his army in Isengard,Balto-Slavic,Croatian
BeautifulTaeng,europe,"I guess it depends from which part of Croatia you are , northerns will probably feel more familiar with Slovenes , easterns with Serbs and Dalmatians/Istrians with Italians although to me it seems that Dalmatians are the most serb-like Croats , even though they are the ones who hate them the most , huh",Balto-Slavic,Croatian
BeautifulTaeng,europe,"Except Macedonian is much closer to Bulgarian than Serbian , the fuck are you on , have you ever heard spoken macedonian , or even read it ? \\n\\n",Balto-Slavic,Croatian
BeautifulTaeng,europe,Wheres spurdo,Balto-Slavic,Croatian
BeautifulTaeng,europe,Proud Irania.. oh wait fuck id rather be a slav,Balto-Slavic,Croatian
BeautifulTaeng,europe,"Hijacking this for a bit.\\n\\n\\nTheoretically , if a person is stripped away from any citizenship , what would become of them ?",Balto-Slavic,Croatian
BeautifulTaeng,europe,Thank you for your input !,Balto-Slavic,Croatian
BeautifulTaeng,europe,"Mostly yeah , however our industry sector is seeing massive recovery , so some of it has to do with that .",Balto-Slavic,Croatian
BeautifulTaeng,europe,"\ '' Croatia , Full of life ! \ '' has to be the most ridiculed slogan I\\ 've seen in my life . From \ '' full of jad\ '' ( jad = misery ) to \ '' fulao sam lajf\ '' ( fulao = missed ; I missed my life ) , public sure took a piss on it . The thing that rustled the most jimmies was that they hired 3 ( THREE ) teams for this shitty cliche three word \ '' \ '' \ '' \ '' \ '' \ '' slogan\ '' \ '' \ '' \ '' \ '' \ '' \ '' \ ''",Balto-Slavic,Croatian
BeautifulTaeng,europe,Someones meme page got postblocked,Balto-Slavic,Croatian
BeautifulTaeng,europe,"& gt ; od morza do morza , \\n\\n [ mfw ] ( https : //www.youtube.com/watch ? v=AIK-n-f4jSM )",Balto-Slavic,Croatian
BeautifulTaeng,europe,BRAVO ESTONIA \\n,Balto-Slavic,Croatian
BeautifulTaeng,europe,\ '' PREE- german JA- TE ( like in TEnnis ) - LL ( english \ '' million\ '' but soft ) \ '',Balto-Slavic,Croatian
BeautifulTaeng,europe,we love everyone,Balto-Slavic,Croatian
BeautifulTaeng,europe,"Ha , nothing to pollute your air when you have no industry ! ..",Balto-Slavic,Croatian
BeautifulTaeng,europe,"That\\ 's true , we\\ 're all neo-nazis here , or should I say the *true* nazis , the heirs of NDH.\\n\\nThe hate towards Jews and Serbs is encouraged by our Church and politicians , after all our prime minister is a declared Ustasha . \\n\\nAnd to top it all off 99 % of Croats are in fact huge Thompson fans ( the rest one 1 % are the goddamn Serbs ) , I myself have his name tattooed on my left arm and I regularly visit neo-nazi meetings where I get drunk , sing Cavoglave and shout \ '' ubi srbina\ ''",Balto-Slavic,Croatian
BeautifulTaeng,europe,haha just work harder lol,Balto-Slavic,Croatian
BeautifulTaeng,europe,what else are u supposed to do with a cake\\n,Balto-Slavic,Croatian
BeautifulTaeng,europe,"New Diablo3 season , I guess",Balto-Slavic,Croatian
BeautifulTaeng,europe,"Meh , the location is superb but it kinda looks like a concrete jungle",Balto-Slavic,Croatian
BeautifulTaeng,europe,http : //www.healthpowerhouse.com/files/EHCI_2015/EHCI_2015_press_release.pdf \\n\\nno,Balto-Slavic,Croatian
BeautifulTaeng,europe,Mafia culture\\n\\nhttps : //www.youtube.com/watch ? v=2AaMP1m9Xmg,Balto-Slavic,Croatian
BeautifulTaeng,europe,A single death is a tragedy ; a million deaths is a statistic .,Balto-Slavic,Croatian
BeautifulTaeng,europe,Yep and servia is a stinking shithole with no chance of joining EU in the next 50 years XDDDDD,Balto-Slavic,Croatian
BeautifulTaeng,europe,"& gt ; millions\\n\\nnay , billions",Balto-Slavic,Croatian
BeautifulTaeng,europe,"& gt ; Ako li ne zna\u0161 \u010dto \u010diniti , gl\u0119daj pomo\u0107.\\n\\nLegitimately though this was in Croatian for a second . It seems like a lot of it is based on old church Slavonic , which in turn is fairly similar to south Slavic languages .",Balto-Slavic,Croatian
BeautifulTaeng,europe,B A S E D,Balto-Slavic,Croatian
BeautifulTaeng,europe,All I hear is : \ '' davaj blyed\ '',Balto-Slavic,Croatian
BeautifulTaeng,europe,"& gt ; Honestly , Eastern Europe is as big a problem for Europe as the mass Islamic immigration is\\n\\nt . Pakistani \\n\\n",Balto-Slavic,Croatian
BeautifulTaeng,europe,Why don\\'t Moldava and Romania just unite ? They\\ 're romanians after all . This way easy EU and easy NATO for \ '' moldavians\ '' .,Balto-Slavic,Croatian
BeautifulTaeng,europe,Public health is pretty important tbh,Balto-Slavic,Croatian
BeautifulTaeng,europe,"Hey come on now , Erdogan called us a tolerant nation !",Balto-Slavic,Croatian
BeautifulTaeng,europe,Small price to pay,Balto-Slavic,Croatian
BeautifulTaeng,europe,as yung lean would say \ '' stock town ghost town\ '' \\n\\noh wait,Balto-Slavic,Croatian
BeautifulTaeng,europe,Animal milk is bad for health ?,Balto-Slavic,Croatian
BeautifulTaeng,europe,"Somebody already mentioned it but there are bears , mines and well.. just the clusterfuck that bosnia is , also a very long part of our border with bosnia consists of river Sava and mountains .",Balto-Slavic,Croatian
BeautifulTaeng,europe,that shade of blue is too *blue*,Balto-Slavic,Croatian
BeautifulTaeng,europe,Create a new european union.. within EU !,Balto-Slavic,Croatian
BeautifulTaeng,europe,Also massive panic caused by possible immigrant swarms,Balto-Slavic,Croatian
BeautifulTaeng,europe,"Translation : Same option is mentioned in Serbia as well . According to news paper \ '' Vecernje novosti\ '' , which are in close relationship with government of Aleksandar Vucic , problem will continue if Croatia moves on to the next option , the so called \ '' plan D\ '' , which would imply raising a wall facing Serbia",Balto-Slavic,Croatian
BeautifulTaeng,europe,Love-hate relationship,Balto-Slavic,Croatian
BeautifulTaeng,europe,"yeah while I was on a school trip to Prague 2 years ago getting weed was super easy , I guess other stuff would be quite easy to get as well",Balto-Slavic,Croatian
BeautifulTaeng,europe,Rusija do Tokija,Balto-Slavic,Croatian
BeautifulTaeng,europe,for you,Balto-Slavic,Croatian
BeautifulTaeng,europe,Na plo\u010di imposter ko\u0159tra po toj prega\u010di \u017e\u00e1tla Adidas . \\n\\nmaybe like this \\n,Balto-Slavic,Croatian
BeautifulTaeng,europe,"Alright , but first you explain to me why is energy in portugal more expensive than in Sweden",Balto-Slavic,Croatian
BeautifulTaeng,europe,"Fake map , I [ fixed ] ( http : //imgur.com/d08bT2V ) it for you : ) ) )",Balto-Slavic,Croatian
BeautifulTaeng,europe,cunt : flag\\n\\nfavorite : magyar ciganys/ sLOVEnia \\n\\nleast favorite : bosnians ( especially Herzegovnas ),Balto-Slavic,Croatian
BeautifulTaeng,europe,"Few hundred people were shouting , are you trying to label the entire nation ? \\n",Balto-Slavic,Croatian
BeautifulTaeng,europe,"zzzzzz balkans gon na balkan who the fuck even cares what he says , why is this getting any attention ?",Balto-Slavic,Croatian
BeautifulTaeng,europe,"[ this ] ( http : //www.njuskalo.hr/nekretnine/kuca-pitomaca-visoka-prizemnica-310-m2-oglas-15435171 ) was the most expensive thing I could fine , tho it is outside the main city and is located near ( or rather in ) the satellite city",Balto-Slavic,Croatian
BeautifulTaeng,europe,That looks so coozy and you have a lovely cat,Balto-Slavic,Croatian
BeautifulTaeng,europe,his ass,Balto-Slavic,Croatian
BeautifulTaeng,europe,kmeee,Balto-Slavic,Croatian
BeautifulTaeng,europe,"EU needs Turkey as it\\ 's ally , we need it to be a \ '' shield\ '' facing the Middle- East . Tell me , what would happen if Turkey suddenly decided to let millions of refugees it currently houses towards Europe ? EU can\\'t just \ '' kick\ '' Turkey , they are very much needed in the current times . But don\\'t be fooled , Turkey will never be allowed to enter the EU , it is just too big and ( relatively ) poor , a least the east of it .",Balto-Slavic,Croatian
BeautifulTaeng,europe,"Modern day Macedonians are slavs , not greeks . \\n",Balto-Slavic,Croatian
BeautifulTaeng,europe,"Mate spain had huge unemployment numbers for years , pull your head out of sand",Balto-Slavic,Croatian
BeautifulTaeng,europe,1667 best day of my life,Balto-Slavic,Croatian
BeautifulTaeng,europe,"Nuclear power is crazy efficient and very safe . For instance , Slovenia and Croatia share 1 ( ONE ) power plant and we get about 30 % of our electrical energy from it .",Balto-Slavic,Croatian
BeautifulTaeng,europe,truly a work of art kek,Balto-Slavic,Croatian
BeautifulTaeng,europe,"Suka is the correct romanization , no ?",Balto-Slavic,Croatian
BeautifulTaeng,europe,& gt ; North Korea is communist \\n\\nlmao,Balto-Slavic,Croatian
BeautifulTaeng,europe,"\ '' r\ '' acts as a vowel in Serbo-Croatian , for example : vrt , tvrd , kr\u010dma , cvr\u010dak . \\n\\nThat makes it a bit easier to pronounce the words and also makes the language softer , we don\\'t really hate vowels : P",Balto-Slavic,Croatian
BeautifulTaeng,europe,most based language in the world,Balto-Slavic,Croatian
BeautifulTaeng,europe,Norilsk is how hell looks \\n\\n,Balto-Slavic,Croatian
BeautifulTaeng,europe,"[ Dubrovnik ] ( http : //makstravel.hr/wp-content/uploads/2015/09/Slider-Dubrovnik-2_1600x828.jpg ) , [ Rovinj ] ( http : //makstravel.hr/wp-content/uploads/2015/09/croatia-istra-rovinj-old-town-aerial.jpg ) , [ Vara\u017edin ] ( http : //blog.uniline.hr/wp-content/uploads/2014/01/varazdin-panorama.jpg )",Balto-Slavic,Croatian
BeautifulTaeng,europe,Krajina was never Serbian,Balto-Slavic,Croatian
Beckneard,europe,"Oh sorry I thought they meant Eurozone , I mixed them up .",Balto-Slavic,Croatian
Beckneard,europe,Expecting people to be informed and educated is literally nazism .,Balto-Slavic,Croatian
Beckneard,europe,"They\\ 're trying to paint ISIS supporters and fighters as \ '' misguided youth\ '' . They\\ 're fucking psychopaths and should be kept away from the rest of society or killed , I don\\'t believe in \\'rehabilitating\\ ' these fuckwads .",Balto-Slavic,Croatian
Beckneard,europe,"Yes , the red menace is everywhere , we must be vigilant . ^^^/s",Balto-Slavic,Croatian
Beckneard,europe,& gt ; so changing the name of the currency doesn\\'t lose us anything for real.\\n\\nYeah but it would be a gamble . What if another crisis comes by ? Then we\\ 'd have no \ '' breathing room\ '' as you put it . Do you really trust our economy that much ?,Balto-Slavic,Croatian
Beckneard,europe,"The only way you can \ '' modernise\ '' old religions is really by outright ignoring certain aspects of it.\\n\\nSince misogyny is deeply rooted in Islam it would be really hard to yank it out without rejecting the core dogmas.\\n\\nChristianity did it by basically ignoring the entire Old Testament , it would be pretty hard for most muslims to ignore a big chunk of the Quran.\\n\\nNeedless to say trying to do it by way of gender segregation is moronic .",Balto-Slavic,Croatian
Beckneard,europe,It\\ 's funny how these crypto-fascist parties always have \ '' Freedom\ '' or \ '' Democracy\ '' in their name . It\\ 's like they\\ 're desperately saying \ '' We SUPER PROMISE we\\ 're not the bad guys ! \ '',Balto-Slavic,Croatian
Beckneard,europe,"\ '' ... We demand your compassion ... \ '' \\n\\nIt doesn\\'t work like that . Compassion is given , not demanded.\\n\\nFucking parasites , the sad thing is there actually are a lot of people who would benefit from asylum seeking and would actually contribute to European society but they are trampled over by these opportunists who paid their way across the Mediterranean .",Balto-Slavic,Croatian
Beckneard,europe,"& gt ; \\n & gt ; \\n & gt ; \\n & gt ; \\n & gt ; Had everyone condemned these sexual assaults from the start and made it clear that all people will be held to the same standards and laws , all of this nonsense could have been avoided.\\n\\nThey did , but in a very roundabout , ultra-pc and insulting way.\\n\\n\ '' Yeah but white men do it too ! \ '' is not a good response to all of this .",Balto-Slavic,Croatian
Beckneard,europe,I thought that both were valid scriptures and equally \ '' true\ '' ?,Balto-Slavic,Croatian
Beckneard,europe,& gt ; Less inheritance because otherwise the assets are moved out of the family.\\n\\n ... Because the man is considered the \ '' head of the house\ '' or whatever and continues the family name . How is this not sexism ? \\n\\n & gt ; Both genders are advised to have humility and modesty.\\n\\nSo why don\\'t men have to cover themselves up as much ?,Balto-Slavic,Croatian
Beckneard,europe,"There was a whole shitload of inaccuracies , some of it was true but you might as well disregard the whole thing .",Balto-Slavic,Croatian
Beckneard,europe,"So many inaccuracies in this , are you even Croatian OP ?",Balto-Slavic,Croatian
Beckneard,europe,& gt ; My best guess is that they\\ 're pure accelarationists who want to see the system go down.\\n\\nBasically something like this.\\n\\nI know some leftists that would do so . It\\ 's basically about sending a \ '' fuck the establishment\ '' message by any means necessary . It\\ 's kinda like the how some of the \ '' Bernie or Bust\ '' people voted for Trump out of sheer spite . Also they claim that by doing so they will force the mainstream left to reinvent itself somehow.\\n\\nIt\\ 's ridiculous I know but there we go .,Balto-Slavic,Croatian
Beckneard,europe,Yeah I\\ 'm pretty sure the only way to possibly get a positive result in Eastern Europe is to ask something along the lines of \ '' do you think LGBT people might be actual people ? \ '',Balto-Slavic,Croatian
Beckneard,europe,Of course not . But some people need to have their perspective shifted a bit . Is it really that big of a deal that you have to sue your own parents ?,Balto-Slavic,Croatian
Beckneard,europe,"Try the islands , some of them are pretty remote and sparsly populated .",Balto-Slavic,Croatian
Beckneard,europe,"& gt ; European populations must embrace diversity to undermine homogeneity until all differences between them disappear.\\n\\nHow about you fuck right off . I do not accept some cultures as equal to my own , I don\\'t want the \ '' differences to disappear\ '' . They can either accept our culture or go the fuck away.\\n",Balto-Slavic,Croatian
Beckneard,europe,What are the chances of Turkey getting kicked out of NATO ?,Balto-Slavic,Croatian
Beckneard,europe,"& gt ; or that culture has nothing to do with downfalls of the society or individual then ? \\n\\nIt has most to do with the standard of living in that country.\\n\\n & gt ; Last I recall Buddhism did not compel followers to maim and slay unbelievers.\\n\\nAnd yet they did just that.\\n\\nhttps : //en.wikipedia.org/wiki/Buddhism_and_violence\\n\\n & gt ; I personally think people who justify wrong and evil by cultural relativism are vile and disgusting beings.\\n\\nAnd I think you should grow the fuck up , the world is not as black and white as you would like it to be . Goodbye .",Balto-Slavic,Croatian
Beckneard,europe,I guess it varies depending on your definition of \ '' far right\ '' but that law would definitely be considered far right in most western european countries.\\n\\nTo me personally \ '' not far right\ '' and \ '' heavily influenced by the church\ '' are completely contradictory .,Balto-Slavic,Croatian
Beckneard,europe,Flip-flop Le Pen .,Balto-Slavic,Croatian
Beckneard,europe,Kinda but not really . Just because it\\ 's a relatively new ethnic identity doesn\\'t mean it\\ 's \ '' fake\ '' .,Balto-Slavic,Croatian
Beckneard,europe,& gt ; main capital\\n\\nAs opposed to secondary capital ?,Balto-Slavic,Croatian
Beckneard,europe,"& gt ; \\n & gt ; Are you seriously buying the story that we are stealing your property ? \\n\\nNot really , but I think it\\ 's fair to leave an arbitration that was proven to be corrupt , even if they \ '' fixed\ '' it later .",Balto-Slavic,Croatian
Beckneard,europe,Oh if only they knew it was THAT easy ! Quick contact their governments ! Mr. Internet geo-political expert has saved Europe !,Balto-Slavic,Croatian
Beckneard,europe,Both of us are dicks . Countries in general are dicks when it comes to claiming territory .,Balto-Slavic,Croatian
Beckneard,europe,A third MiG long forgotten is haphazardly scrambled . It manages to cross the border before crashing into a barn in the Hungarian countryside.\\n\\nCroatian government claims total victory over the Hungarian forces .,Balto-Slavic,Croatian
Beckneard,europe,"I disagree . I believe implementing certain ideals brings overall more happiness to those that practice them . It is not an accident ideals of democracy and freedom spread that much across Europe and are slowly spreading around the world . Traditionalist cultures are dying off everywhere , somewhere more slowly than elsewhere , but they are .",Balto-Slavic,Croatian
Beckneard,europe,Seriously I thought it was common knowledge that there were atheist ancient Greek philosophers . What a shitty article .,Balto-Slavic,Croatian
Beckneard,europe,Far right : \ '' Lol fucking oversensitive and crazy SJWs/cultural marxists/liberals . Feels before reals lelele Islam is evil.\ '' \\n\\nNormal people : \ '' Fuck off idiots.\ '' \\n\\nFar right : \ '' Now now let\\ 's keep it civil.\ '',Balto-Slavic,Croatian
Beckneard,europe,"You could argue that the racism and xenophobia is largely due to \ '' economic anxiety\ '' , but yeah let\\ 's not pretend these people voted Trump/Le Pen because they wholeheartedly agree with their economic policy .",Balto-Slavic,Croatian
Beckneard,europe,I think their point is that you could have been equals to the US and Europe .,Balto-Slavic,Croatian
Beckneard,europe,"So probably younger than 18 , got it .",Balto-Slavic,Croatian
Beckneard,europe,Why would this be a bad thing really ?,Balto-Slavic,Croatian
Beckneard,europe,What a bunch of dickheads . Props to the police for putting up with that bullshit .,Balto-Slavic,Croatian
Beckneard,europe,& gt ; Where are you getting this from ? \\n\\nAre you serious ? Just about every attempt at criticizing certain aspects of arabic and/or middle eastern culture in general ( criticism that feminists have rightfully made about western culture 30 years ago ) is met with cries of racism or at best is outright ignored . I have never ever ever seen a mainstream left-wing politician comment about these issues other than just crying racism .,Balto-Slavic,Croatian
Beckneard,europe,"https : //en.wikipedia.org/wiki/Race_ % 28human_classification % 29\\n\\n & gt ; Race , as a social construct , is a group of people who share similar and distinct physical characteristics . [ 1 ] [ 2 ] [ 3 ] [ 4 ] [ 5 ] First used to refer to speakers of a common language and then to denote national affiliations , by the 17th century race began to refer to physical ( i.e . phenotypical ) traits . Starting from the 19th century , the term was often used in a taxonomic sense to denote genetically differentiated human populations defined by phenotype . [ 6 ] [ 7 ] [ 8 ] \\n\\nThere\\ 's nothing abstract about human physical characteristics . Sure it may not be always exactly defined but I wouldn\\'t call it \ '' non existant\ '' , that\\ 's ridiculous .",Balto-Slavic,Croatian
Beckneard,europe,"& gt ; Racism is thinking there is a hierarchy in race , you think their is one in culture ( so civilisation ) . By , definition , you are racist.\\n\\nWouldn\\'t I be \ '' culturist\ '' then ? Race and culture are not the same thing . If you believe they are then you might be the racist one .",Balto-Slavic,Croatian
Beckneard,europe,We handled it about as equally incompetently as other EU countries . This shitshow really needs to be handled properly already .,Balto-Slavic,Croatian
Beckneard,europe,& gt ; I\\ 'm not saying they don\\'t claim racism when under criticism.\\n & gt ; \\n & gt ; Where are people getting the idea that feminists support refugees because they are afraid of being called racist ? \\n\\nWhat exactly is the difference ? They\\ 're being apologetic for their shitty behavior because otherwise they\\ 'd be \ '' racist\ '' .,Balto-Slavic,Croatian
Beckneard,europe,Not nearly on the same scale as the US .,Balto-Slavic,Croatian
Beckneard,europe,& gt ; Countries seeking to join NATO can not have any outstanding territorial disputes.\\n\\nThen how did Croatia and Slovenia enter NATO ? Or is that a different kind of territorial dispute ?,Balto-Slavic,Croatian
Beckneard,europe,"& gt ; tell us what violates democratic rules ? \\n\\nRushed , hurried , behind-the-scenes last minute \ '' negotiations\ '' and choosing a random business guy as PM literally the last day before the deadline.\\n\\n*Technically* they didn\\'t violate anything but the whole thing is fishy as fuck and honestly in a sane system would be illegal .",Balto-Slavic,Croatian
Beckneard,europe,"The full croatian name for it is \ '' Cudnovati Kljunas\ '' , which means literally \ '' weird beak-animal\ ''",Balto-Slavic,Croatian
Beckneard,europe,"I figured as much , but why is Turkey really THAT important to NATO ?",Balto-Slavic,Croatian
Beckneard,europe,Rose tinted glasses.\\n\\nShe was at least as useless as him since everybody in her party was preoccupied with stabbing her in the back and getting ready for the criminal part of the party to reassume command .,Balto-Slavic,Croatian
Beckneard,europe,\ '' May god fuck the sky on you\ '' \\n\\nGenius .,Balto-Slavic,Croatian
Beckneard,europe,"& gt ; that it is our duty to figure out how to integrate them more successfully\\n\\nThat is both our and their duty , why do they always put all the blame on the native population ?",Balto-Slavic,Croatian
Beckneard,europe,"Well yeah that\\ 's probably a bit too extreme but things like that would work , eventually.\\n\\nEast Germany is basically almost completely atheist/agnostic because of communist repression.\\n\\nNot that I\\ 'm saying we should be beating Muhammad out of them but some form of saying \ '' we don\\'t like your religion\ '' would probably move things in the right direction .",Balto-Slavic,Croatian
Beckneard,europe,"It is on us to accept them . It is possible to just be xenophobic for the sake of being xenophobic you know.\\n\\nIf they behave by our rules it is on us to accept them that way , that\\ 's not \ '' PC madness\ '' .",Balto-Slavic,Croatian
Beckneard,europe,I\\ 'm anti immigration ( in the context of the current refugee crisis at least ) and I definitely don\\'t consider myself right-wing . It\\ 's a bit more complicated than \ '' left or right\ '' .,Balto-Slavic,Croatian
Beckneard,europe,"Oh god why I only just recently forgot about that.\\n\\nThe shame , it hurts .",Balto-Slavic,Croatian
Beckneard,europe,"Not in the Croatian war of Independance , no . How about you actually read an article before trying to appear smart on the Internet ?",Balto-Slavic,Croatian
Beckneard,europe,"Apparently for a significant of percentage of them , yes .",Balto-Slavic,Croatian
Beckneard,europe,Anybody that brings any kind of politics ( left or right wing ) to sports is a complete fucking moron .,Balto-Slavic,Croatian
Beckneard,europe,"The part when she said \ '' release yourself from the shackles of freedom and democracy\ '' gave me chills . These peoples\\ ' brains are completely broken , I don\\'t think any dialogue can be started with them , they should just be kept locked away far from sane people.\\n\\nHoly shit .",Balto-Slavic,Croatian
Beckneard,europe,"I mostly agree with you but honestly I\\ 'm kind of sick of the false dichotomy of \ '' oh those Ess Jay Doblyoo Libruls are just as bad as the ultra right wing\ '' .\\n\\nNo , they\\ 're fucking not . They have their fair share of nutjobs but most left-leaning/liberal people I\\ 've met are at least willing to enter a rational discussion .",Balto-Slavic,Croatian
Beckneard,europe,"& gt ; Patriarchal culture at its worst.\\n\\nNo no you misunderstand , only white western cultures are patriarchal and oppress women , this is diversity .",Balto-Slavic,Croatian
Beckneard,europe,All cultures are equally valuable and no one can say one is morally superior to the other ! We should respect our differences ! Right ?,Balto-Slavic,Croatian
Beckneard,europe,Why is that exactly ? Are the elected some kind of radicals ?,Balto-Slavic,Croatian
Beckneard,europe,"Yeah , give it a few years .",Balto-Slavic,Croatian
Beckneard,europe,"You were literally raped by a shampoo bottle . You poor thing , is taking a shower triggering for you now ?",Balto-Slavic,Croatian
Beckneard,europe,They will all be named Muhammad .,Balto-Slavic,Croatian
Beckneard,europe,"Nationalism doesn\\'t mean just being proud of your heritage and whatnot , it means having an \ '' us versus them\ '' mentality and feelings of superiority .",Balto-Slavic,Croatian
