user,subreddit,post,family,lang
Ballander,europe,"I actually went ahead and [ checked ] ( https : //en.wikipedia.org/wiki/Montenegro # /media/File : Montenegro_territory_expanded_ % 281830-1944 % 29.png ) , because I remember there was mention of Montenegro when France annexed Dubrovnik Republic , but it seems we never [ bordered you ] ( https : //upload.wikimedia.org/wikipedia/commons/a/a4/Dubrovacka_republika.png ) . Not until we anschlussed back Venice at least !",Balto-Slavic,Croatian
Ballander,europe,"& gt ; Well , I replied to a comment in regards to why Bosnia and Croatia are two different countries while Slavonia and Dalmacia aren\\'t.\\n\\nBecause of historical reasons . When you look at the maps of former empires , you\\ 'll notice that borders between Bosnia and Croatia were almost the same , they were borders of Austrian and Ottoman Empires.\\n\\n & gt ; So why religion ? Well , let\\ 's be honest.. A lot of seemingly insane views of other people have been caused by religion . So I guess I\\ 'm just trying to figure out if that\\ 's where it comes from down there . I mean , religion caused the killings of \ '' witches\ '' , gays , women ( doing anything wrong . ) , other religious groups etc . so \\n\\nReligion is not the point here . While religion had some part in formation of some nations ( primarily Serbs and Bosniaks/Muslims , to some extent Croatians ) , the problems were more of cultural/national/historical rather than religious . \\nCroatians were never very exclusive religion-wise , as you also had protestant , orthodox , etc . Croats . Heck , one of the orthodox was a famous writer during the national spring.\\n\\nFurthermore , even Croatian nazis considered Muslims to be Croats and they didn\\'t persecute them per se . For example , they turned one of the galleries in Zagreb in a [ mosque ] ( http : //media.news.harvard.edu/gazette/wp-content/uploads/2009/07/11-zagreb2-450.jpg ) . Those nazis also organised Croatian Orthodox Church.\\n\\nLooking at the religion as a source of all problems is a lazy and ignorant view , but the simplest of them - which is why so many people are prone to it.\\n\\n\\n & gt ; I suppose it might explain some of the tensions down there if everyone was like 110 % serious about their religions and believed every word of their holy books.. \\n\\nWhat year is it ? \\n\\n\\n & gt ; To me it simply doesn\\'t make sense to think that someone living 10 miles away ( Across a border ) is so different\\n\\nI left out the second part because it\\ 's a stereotypical nonsense.\\n\\nThe thing is because of cultural influence . Bosnia and Herzovina/Serbia were dominated by Ottomans and it shows , whereas the Croatians coast was always under the Italian influence . Northern Croatia ( Northwest particulary ) was under heavy Austrian influence . So , this is from where a lot of cultural ( and linguistical if you\\ 'd be looking into the dialects ) differences emerge.\\n\\nTo be perfectly honest , a northern Croatian is more likely to get beat in southern Croatia than a Serbian or some other nationality . Just a few days ago there were some news of players getting beaten . So , all these rambles about Serbians/whateverelses fearing for their lives because they\\ 're so special is nonsense , since Croatians may get the very same treatment . Why ? Because assholes . You got plently of them as well.\\n\\n\\n\\n & gt ; Why do Croatians care if someone\\ 's wearing a Serbian tourist t-shirt in Croatia for example ? \\n\\nThey rather don\\'t , they got other things on their mind to worry about rather than who\\ 's wearing what.\\n\\n & gt ; We don\\'t beat up people wearing German , English , Swedish or whatever football jerseys here for example..\\n\\nWe don\\'t do it either , other than hooligans , but they are more of an international problem ( see Dutch hooligans destroying Italian works of art , etc . ) and it\\ 's no worse than in other European countries . And these hooligans won\\'t beat just the foreigners , but anyone else who\\ 's not of their liking . Your viewpoint is very distorted .",Balto-Slavic,Croatian
Ballander,europe,"Lol , this just shows how freely \ '' Nazi\ '' is being thrown around these days . You can call Kajin a lot of things , but Nazi is not one of them.\\n\\nThough he preached about \ '' muh multiculturalism\ '' for a long time , so you could call him a hypocrite considering his statement.\\n",Balto-Slavic,Croatian
Ballander,europe,"& gt ; My view isn\\'t distorted . I don\\'t have a view.\\n\\nSome of the things you said sounded like straight out of polandball , you\\ 're gon na have to forgive me , but there\\ 's more than enough people forming their opinion of Croatia based on some scarce stereotypes and having to go through them is rather annoying , which is why I may have sounded hostile.\\n\\n\\n & gt ; The year of people wanting Sharia law in Europe , the year of ISIS , the year of Boko Haram , the year of people hanging gay people , the year of people preventing stem cell research , the year of people banning gay marriage because God says it\\ 's \ '' Ew ! \ '' etc.\\n\\nNone of which ( aside from maybe banning gay marriage ) is happening \ '' down there\ '' .\\n\\n & gt ; So the recent topic about a tourist getting attacked because he worse a ( non-Serbian ) eagle on his shirt is nonsense ? Or the fact that the police said it was his own fault for wearing it.. ? \\n\\nCould you link me this ? There\\ 's a difference between incidents ( and their frequency ) and general feeling . For example , one could say a lot about Norway if we\\ 're gon na only look at Breivik , but that would be utter bullshit , don\\'t you agree ? \\n\\n\\n & gt ; I\\ 'm not just blaming Croatia though.\\n\\nI wasn\\'t under impression that you were blaming Croatia . I\\ 'm discussing my homecountry , not Serbia . There\\ 's a certain difference between Croatia and Serbia , as far as tolerance is considered , for example : gays ( not that it\\ 's perfect in Croatia ) . \\n\\n & gt ; That\\ 's the part I\\ 'm trying to figure out where comes from . It does not exist everywhere at all . Not even fucking close.\\n\\nYou\\ 're denying there are hooligans ? You left that part out.\\nI\\ 'm going to mention \\n\\n & gt ; I can\\'t imagine how you can hate civilians of any country to such a degree which is why I\\ 'm trying to understand where the crazies get it from.\\n\\nI think history gave us bunch of examples like that.\\nWar can be a great excuse for a saddist/psychopath.\\n\\n\\n & gt ; Why is it such a big deal when a Serbian boy and a Croatian girl are kissing ? Oh , and why was the Croatian girl asked by an old woman how she dared walking next to a Serbian boy ? \\n\\nI guess you\\ 're thinking of [ this ] ( http : //www.reddit.com/r/pics/comments/19wsy5/when_an_old_lady_asked_croatian_girl_how_she/ ) .\\nFirst , please , take notice this isn\\'t Croatia you\\ 're talking about , but Bosnia , where it can be rather tense because you have 3 nations crammed into mini-Yugoslavia , and we know how both of Yugoslavias ended.\\n\\nSecond , it\\ 's just a picture , there are no news.\\n\\nThird , why is it upvoted ? Because of circlejerking . Most of foreigners think there\\ 's an unimaginable hatred between Croats and Serbs ( for example , Bob Dylan compared Croats and Serbs to Nazis and Jews , which is just horrible , especially since he\\ 's a public person ) .\\nWhen they see it , they\\ 're probably thinking it\\ 's a first , wow such progress , etc . and it makes for a nice clickbait.\\n\\n\\n & gt ; I\\ 'm trying to figure out where the crazies are coming from.. Where that hatred comes from.\\nWhy are you focusing on crazies ? This hatred among them is a lot like you can find between many other countries and races . \\n\\n\\n & gt ; Why doesn\\'t anyone even care about my brother dating a Swedish girl ? \\n\\n\\nThere\\ 's plently of Serbian-Croatian couples that don\\'t make the news ( or they do if they\\ 're celebrities , which is kinda expected ) , you\\ 're just using a circlejerk picture as an evidence that such things are so rare and frowned-upon in Croatia ( while the picture wasn\\'t even taken in Croatia ) .\\nHeck , one of the first civil unions in Croatia was that between a Croatian and a Serbian , but I didn\\'t see that making waves . Why ? Because it\\ 's not that important.\\nWhich again brings me to ... \\n\\n & gt ; I don\\'t have a view.\\n\\nC\\'mon , you have some view . You obviously formed some opinions of Croatia based on a picture from reddit and few news stories covering incidents because it gets them clicks .",Balto-Slavic,Croatian
Ballander,europe,"Venice is kebab ? : O\\nYou bordered Dubrovnik Republic afaik , when you were not Turkey .",Balto-Slavic,Croatian
Ballander,europe,"Nah , Croats are the real Serbs , Serbs today are just Turks in denial : )",Balto-Slavic,Croatian
Ballander,europe,"& gt ; I\\ 'm not saying I expect everyone in Croatia ( Or in Split ) to do things like that , but clearly some people really have some issues when it comes to anything ( Perceived as ) Serbian , which is what I don\\'t understand . I simply can not fathom how anyone can see a Serbian ( Which it wasn\\'t , but let\\ 's pretend it was.. ) shirt as something provocative in any way . \\n\\nSplit is a bit rough around the edges , and like I said , you can be a Croatian from Zagreb in order to get a beating there , if you run into hooligans . \\nWhy can they perceive it as provocative ? Because they were probably drunk/drugged , which lowers their ability of rational thinking even lower.\\n\\n\\n & gt ; Hooligans in the football sense ? No , they exist . But your part of the world is pretty darn infamous for ultras taking things to extremes we don\\'t tend to see in most other countries . Of course there are football rivalries here and sometimes a bunch of F.C . Copenhagen fans will get into a fight with Br\u00f8ndby IF fans or whatever . \\nLook up videos of Danish fans from Poland-Ukraine Euro etc . if you want to see what our fans are usually like . They\\ 're drinking , singing , partying and making a fool of themselves . There\\ 's a reason they\\ 're called \\'Roligans\\ ' and not hooligans . \\'Rolig\\ ' means calm in Danish . Not calm in the \ '' We\\ 're quiet\ '' sense , but in the peaceful sense . \\n\\n\ '' My part of the world\ '' ... You\\ 're free to try any extremist thing you think you can get away with in Croatia , I assure you you won\\'t have a nice time.\\n\\n\\n & gt ; they\\ 'll get banned from the stadiums , fined , potentially jailed and \ '' everyone\ '' will distance themselves from it . The club , the fanclub , the \ '' FA\ '' etc . It\\ 's not an accepted thing at all . Even if both sides essentially agree to fight.\\n\\nYou think it\\ 's accepted in Croatia ? Wow , I wonder what kool-aid they feed you with in Denmark.\\nReading between the lines , your perception of Croatia was as it\\ 's a religous , wildwest-like warzone . Wtf ? \\n\\n\\n & gt ; But your part of the world is pretty darn infamous for ultras taking things to extremes we don\\'t tend to see in most other countries.\\n\\nWe don\\'t ? \\nWhat about the Dutch trashing Italian works of art ? \\nBooks have been written about the UK.\\nThis is just generalizing and sweeping your problems under the rug . The grass is not greener than in Croatia.\\n\\n\\n & gt ; It\\ 's not just the picture though . It\\ 's news , it\\ 's travel warnings , horrific pictures of someone of one nationality who\\ 's been beatedn ( or worse ) by people of another nationality , it\\ 's traveler stories , it\\ 's comment sections on various sites \\n\\nI don\\'t know where you\\ 're getting all this stuff from . Especially since most of it can be forged/faked ( you\\ 'd be surprised how often I can come across mental gymnastics ) .\\nTourists who come here usually thoroughly enjoy it and crime rates are rather low , Croatia is a very safe country.\\nLay off the youtube and site comments , in general . \\n\\n\\n & gt ; Well yeah , but that\\ 's not where I saw it.\\nhttp : //www.huffingtonpost.com/2013/03/10/croatian-girl-kisses-serb_n_2839945.html\\n\\nLol , wow , I must admit I thought a tiny bit higher of Huffington Post , but this is just tabloid material at absolute worst . They base their story around a picture and reddit user , without any further looking into it and trying to have some credible sources . It\\ 's basically like you saw it on reddit.\\n\\n\\nThis is worrying because who knows what crap they could run on their site if they\\ 're going to only go by the words of reddit users . \\nIn this case , nothing bad happened other than bolstering of some stereotypes between foreigners.\\n\\n\\nI find english articles about Croatia generally of poor quality , and often scarce and misleading.\\n\\nFor example , when there was the referendum about gay marriage ban , which was fairly covered , a lot of these sites were saying that 65 % of Croatians voted for banning of gay marriage.\\n\\nHowever , 65 % of those who went to vote voted for banning , and only 38 % of voter base went voting . But of course this gets no mention.\\nThis can be called propaganda since it wrongfully asserts that 65 % of Croatians are against gays/gay marriages , while in reality the referendum wouldn\\'t even pass if it weren\\'t for the stupid goverment meddling with the referendum law before the EU referendum.\\n\\nI also remember reading an Economist article on Croatian elections , where they used derogatory nicknames for the candidates ( which were used by common people in Croatia ) , which is just a huge low for a media.\\n\\nAlso , a lot of the articles can be very biased and filled with personal agenda rather than dealing with facts.\\n\\nCroatia doesn\\'t get reported on often , and when they do such crap job when they finally do report on it , I don\\'t know what to say.\\n\\n\\n & gt ; No , I may have some media created assumptions , but how am I to get rid of them if not by asking the people who actually live there ? If anyone can destroy the false assumptions and stereotypes surely it has to be the people in the region ? \\n\\nDrop the \\'region\\ ' and replace with \\'Croatia\\ ' and I\\ 'll agree , but otherwise no . I always hated this collectivism regarding ex-Yugoslavia , since it simply can not be under the same denominator . There\\ 's a reason it didn\\'t work , the differences are there . Why should anyone from Serbia or Macedonia speak in my name or represent me in any way ? Unfortunately , it happens too many times.\\n\\n\\nSomething you may not be aware of , and that contributed to the dissolution of Yugoslavia a lot was the economic factor . Slovenia and Croatia had to give substantial money to the underdeveloped parts of Yugoslavia ( the rest of it ) during the times of both Yugoslavias and this is what annoyed most people.\\n\\n\\n & gt ; While I find the crazies.. Well , crazy.. It doesn\\'t mean understanding where they\\ 're coming from can\\'t be interesting.\\n\\n\\nThey can be coming from their personal problems and frustrations.\\n\\n\\n & gt ; Even if it\\ 's in Bosnia it doesn\\'t really change anything though\\n\\nIt does , since I don\\'t want to deal with stereotypes about Bosnia . The ones about Croatia are enough for me , thanks.\\n\\n\\n\\n\\n",Balto-Slavic,Croatian
Ballander,europe,"& gt ; A good internet connection , easily available boardgames , having no problems with international shipping ... and people actually respecting red lights.\\n\\nNever had a problem with what you listed . Where do you live ? \\n\\nInternet is \ '' just fine\ '' at worst in Zagreb , perhaps you should check with your Internet provider and look into the available options , and what infrastructure your building supports . \\n\\nMost international sites ship normally , I didn\\'t have too many problems.\\n\\nAs for red lights , apart from some senile geezers ( they really stand out ) and assholes , they are pretty much respected . Granted , if there\\ 's no traffic , people will cross it regardless.\\n\\n\\nAs for board games , I don\\'t know if you\\ 've heard of [ Carta Magica ] ( http : //www.cartamagica.hr/ ) . They\\ 're relatively close to the centre . You can get various board games in toy shops , but I figure this is what you\\ 're looking for . They also have Magic tournaments , game nights and else what you\\ 'd expect from a local game shop . You should pay it a visit if that\\ 's what you\\ 're into .",Balto-Slavic,Croatian
Ballander,europe,Nothing to worry about .,Balto-Slavic,Croatian
Ballander,europe,I imagine 2 or 3 am more as a night walk than 22/23 h .,Balto-Slavic,Croatian
Ballander,europe,I love the smell of Hamburger in the morning !,Balto-Slavic,Croatian
Ballander,europe,Is there any chance of doing a new survey ? r/europe grew quite a bit,Balto-Slavic,Croatian
Ballander,europe,"ethnicity ! = nationality was what you were looking for , which he emphasized .",Balto-Slavic,Croatian
Ballander,europe,"/u/andrijas provided a good answer , but this is the most important point / difference : \\n\\n & gt ; Finally Croatia , Slovenia , Bosnia , etc ... were recognized as independent countries ( after they declared independence ) , so it could not have been a civil war as any military force on their soil was actually an invasion army.\\n\\n\\nThere was no federal system when the war started . Countries were recognized and admitted to UN.\\n",Balto-Slavic,Croatian
Ballander,europe,"& gt ; Yes , there were countries that were more developed than Yugoslavia , that is precisely why I said \ '' one of\ '' and not \ '' the most\ '' . Please don\\'t twist my words.\\n\\nI didn\\'t twist your words . You yourself put Yugoslavia in the group of the most developed European countries , and then I mentioned a few just to show it how nonsensical it is . \\n\\n\\nYugoslavia was somewhere [ in between the rest of the Eastern Europe ] ( https : //en.wikipedia.org/wiki/Economy_of_the_Socialist_Federal_Republic_of_Yugoslavia # /media/File : Eastern_bloc_economies_GDP_1990.jpg ) \\nThroughout its existence it was constantly outperfomed by Czechoslovakia and Hungary , and also by Poland and Bulgaria for the most part.\\n\\n\\nAnd then you say Yugoslavia was one of the most developed countries in Europe after WWII ? Seriously ? \\n\\n\\nMost of your posts are nostalgic , they don\\'t really have a leg to stand on in reality.\\n\\n\\n\\nBut , the Non-Alligned Movement was a good idea in its time , so that\\ 's something at least .",Balto-Slavic,Croatian
Ballander,europe,"& gt ; Yugoslavia was one of the safest and most developed countries in Europe after WWII.\\n\\nOh shit . The post itself is quite delusional , but this just tops everything else by a large margin .",Balto-Slavic,Croatian
Ballander,europe,White Croats from around Krakow in the beginning of the 20th century is quite interesting .,Balto-Slavic,Croatian
Ballander,europe,"Ah , I was unsure , so I went with better safe than sorry .",Balto-Slavic,Croatian
Ballander,europe,"No , the other 140 millions of Russians are thrilled that the slave/capita is so low .",Balto-Slavic,Croatian
Ballander,europe,It was in Croatia .,Balto-Slavic,Croatian
Ballander,europe,We were in a personal union with Hungarians for almost a millenium .,Balto-Slavic,Croatian
Ballander,europe,He was also yelling : \ '' I\\ 'll kill you all\ '' .,Balto-Slavic,Croatian
Ballander,europe,Did you expect the Court that was caught red-handed to say something else ?,Balto-Slavic,Croatian
Ballander,europe,"This is incorrect.\\nKajkavian most definitely was not a *peasent* dialect.\\n\\nIt was spoken by everyone , and there were many noblemen ( Zrinski for example , they even had *Ozaljski knji\u017eevni krug* , which was on kajkavian ) .\\nLjudevit Gaj first published his works on kajkavian , but then switched to shtokavian due to pan-slavism.\\n\\nPeople in Zagreb also spoke kajkavian , choosing Herzegovinian shtokavian had more to do with pan-slavism .",Balto-Slavic,Croatian
Ballander,europe,2/10 not dank enough,Balto-Slavic,Croatian
Ballander,europe,"Oh , wow . I wonder whether even more complaints in more cities will surface now that so many had already come out.\\nSomeone will have to do a recap on all this .",Balto-Slavic,Croatian
Ballander,AskEurope,\u0160panska ves - Spanish village ( Something foreign and not understandable ),Balto-Slavic,Croatian
Ballander,europe,People do profit off of that .,Balto-Slavic,Croatian
Ballander,europe,Only in Spain.\\nAnywhere else English trumps everything except for the mother tonque of the nation . Then comes German .,Balto-Slavic,Croatian
Ballander,europe,"& gt ; that german would serve me better in hungary than english\\n\\nAs someone who had experience with English in Hungary , I concur .",Balto-Slavic,Croatian
Ballander,AskEurope,"Yeah , those damned tourists ! Damned be !",Balto-Slavic,Croatian
Ballander,europe,& gt ; Ante Kotromanic said earlier in the day that his country \ '' has no hostile intentions toward Serbia\ '' \\n\\n.\\n\\n & gt ; warmongering\\n\\nClickbait at very best .,Balto-Slavic,Croatian
Ballander,europe,& gt ; He said four Pandur armoured personnel carriers had been sent to the Tyrol region and 750 troops were on standby.\\n\\nIs Pandur name of the vehicle ? Because in Croatia pandur would mean a cop .,Balto-Slavic,Croatian
Ballander,europe,"And here am I sitting here , still wondering why this thread was removed without any notice in the first place.\\n\\nAnd why [ this thread ] ( https : //www.reddit.com/r/europe/comments/3gq2dg/meta_why_was_the_thread_about_tomislav_salopek/ ) was removed as well ( no notice either , but normal comments , no insults or anything , were removed ) .\\nIs it against the rules to ask ? Seems so .",Balto-Slavic,Croatian
Ballander,europe,"The cops , of course !",Balto-Slavic,Croatian
Ballander,europe,"At least we have some company , hehe .",Balto-Slavic,Croatian
Ballander,europe,"Ah , classic propaganda spinning , from a fascist to a defector.\\n\\nThere you go , a few pre-1943 quotes of his : \\n\\n\\n & gt ; All men and all races are children of God ; all without distinction . Those who are Gypsies , Black , European , or Aryan all have the same rights ( ... ) for this reason , the Catholic Church had always condemned , and continues to condemn , all injustice and all violence committed in the name of theories of class , race , or nationality . It is not permissible to persecute Gypsies or Jews because they are thought to be an inferior race\\n\\n.\\n\\n\\n & gt ; We affirm then that all peoples and races descend from God . In fact , there exists but one race ... The members of this race can be white or black , they can be separated by oceans or live on the opposing poles , [ but ] they remain first and foremost the race created by God , according to the precepts of natural law and positive Divine law as it is written in the hearts and minds of humans or revealed by Jesus Christ , the son of God , the sovereign of all peoples . [ 47 ] \\n\\n\\nFrom the linked article.\\n\\nYour assertion about 1943 holds no ground in facts .",Balto-Slavic,Croatian
Ballander,europe,Be careful what you wish for .,Balto-Slavic,Croatian
Ballander,europe,"Just look at all the border controls that were reintroduced inside Schengen , even Netherlands is considering it .",Balto-Slavic,Croatian
Ballander,europe,"Hm , I think \u0161trukli and fritule are something else.\\nWe do have [ \u0161trudle ] ( http : //i708.photobucket.com/albums/ww87/flavija/DSC02538_resize.jpg ) ( they can be with cheese , cherries , etc . ) , but they are generally sweet ( the cherry one is kinda sour-sweet ) .\\n\\n",Balto-Slavic,Croatian
Ballander,europe,"2500 is not going to work unless we implement very strict border controls.\\n\\nAnd at that point , we might as well build a fence , else it would be hard securing the borders when people are coming in droves .",Balto-Slavic,Croatian
Ballander,AskEurope,"That\\ 's because it is . It goes with assumption that European media is calling Middle-Easterners \\'Asian\\ ' . Whether you say \ '' Yes\ '' or \ '' No\ '' , you confirm his assumption anyways , and thus European media is calling Middle-Easterners \\'Asian\\'.\\n\\n\\nMore famous and obvious example is \\'Have you stopped beating your wife ? \\ ' . If you try to be laconic , you\\ 'll confirm that you were at very least beating your wife at some point in time .",Balto-Slavic,Croatian
Ballander,AskEurope,"OP , do you have a feet fetish ?",Balto-Slavic,Croatian
Ballander,europe,I am still waiting on yours .,Balto-Slavic,Croatian
Ballander,europe,"Interestingly , \ '' Grozni\ '' translates to \ '' Awful\ '' in Croatian . Don\\'t know if that\\ 's the case with Russian .",Balto-Slavic,Croatian
Ballander,AskEurope,Purger denotes a Zagrebian whose family was Zagreb-born for a few generations ( usually 3 ) i.e . no one moved to Zagreb from somewhere else.\\n\\nIt comes from German \ '' Burger\ '' which means citizen .,Balto-Slavic,Croatian
Ballander,europe,"He was joking though.\\n\\nEDIT : You may have been joking as well . If you did , it flew over my head .",Balto-Slavic,Croatian
Ballander,europe,Figured so since he was a politician.\\nDid it pay off for them in Czech Republic ?,Balto-Slavic,Croatian
Ballander,europe,"In the end , someone will have to claim it , be it Serbia or Croatia after the border dispute is resolved.\\n\\n\ '' Have\ '' , I mean whatever country that will get this might leave them be , but I don\\'t know how probable that is .",Balto-Slavic,Croatian
Ballander,europe,"& gt ; It\\ 's svetlo in Kajkavian.\\n\\nKhm , khm , \ '' Liht\ '' reporting for duty.\\n\\nBut the map is about standards I presume , so it\\ 's even weirder that the original maker couldn\\'t be assed to look it up ( it\\ 's not like he had to look up all the dialects , just standard ) .",Balto-Slavic,Croatian
