user,subreddit,post,family,lang
Azure_Dawn,europe,"& gt ; First , there is the growing number of economically underperforming Muslim youths in Europe . This is traditionally a pool from which extremist groups recruit , and Hegghammer writes that this population looks set to continue to grow dramatically thanks to immigration and higher birth rates . Entrenched economic disadvantages will likely stop many young Muslims from gaining the full benefits of modern European societies.\\n\\n & gt ; The second , more important trend is the growing number of \u201cjihadi entrepreneurs\u201d \u2014 returned foreign fighters and other activists \u2014 who could inspire and recruit a new generation of European extremists . Hegghammer conservatively estimates there are now at least 2,000 radical Islamists in Europe with foreign fighter experience , time in prison , or both . While some may turn away from jihadism in the future , a small proportion will not.\\n\\n & gt ; The third and fourth factors relate not just to Europe , but to the broader world . Hegghammer suggests that persistent conflicts in the Middle East , North Africa and South Asia look \u201cset to supply European jihadis with both rallying causes and training opportunities for the foreseeable future , as it has in the past.\u201d Many experts believe that the conflict in Syria may still have a long way to go and that groups like the Islamic State will be very hard to fully defeat . The group could be training and blooding potential European attackers for years to come.\\n\\n & gt ; Compounding this problem is the final factor : the Internet . The Internet has considerable benefits for extremist groups , Hegghammer suggests , serving as a tool for \u201cpropaganda distribution , recruitment , fundraising , reconnaissance , and operational coordination.\u201d The rise of encrypted communications and social media have made it harder for authorities to keep up .",Balto-Slavic,Croatian
Azure_Dawn,europe,Do not show Europeans our secret super weapon ! Bura must remain a secret until the stars are right and Croats awaken to conquer Europa ! \\n,Balto-Slavic,Croatian
Azure_Dawn,europe,"Douglas Murray is in my humble opinion one of the best debaters one can find in the political arena . His views are very reasonable and systematically backed by facts . He is a conservative , but in a sense that he seeks to protect liberal order of Western societies , not to see them transform into something that has no connection to the West .",Balto-Slavic,Croatian
Azure_Dawn,europe,Good decision . I never understood people who claimed beating their kids will make kids better . How about I beat the living shit out of you ?,Balto-Slavic,Croatian
Azure_Dawn,europe,"We would never be able to create federalism along the lines of US . The reason is fundamentally very simple . Europe is a collection of various nations , various cultures and languages . There is no such thing in America . But what truly defines a nation or group of people in my humble opinion is whether they shall share common fate . \\n\\nAt the end of day , French people will not share the same fate of the \\nFinnish people . German people will not share the same fate of the Greek people . Polish people will not share the same fate of the Spanish people.\\n\\nContrast this with America . Americans will share their fate , whether good or bad , the very geopolitics of American continent will make it so . \\n\\n",Balto-Slavic,Croatian
Azure_Dawn,europe,"Realistically looking , Islamic State will be dealt with in Syria and Iraq . That much is inevitable . But its members are not really welcomed anywhere in the Islamic world . Saudi Arabia , Qatar , UAE are scared of Islamic State members coming to their turf and removing monarchy . So they only have one place to go , Europe . These people will then move to even further radicalize various Muslims already living across Europe . What a peaceful century awaits us .",Balto-Slavic,Croatian
Azure_Dawn,europe,"Glorious Poles , Ukrainians and Croats making a last stand against the january hordes !",Balto-Slavic,Croatian
Azure_Dawn,europe,"Correct , \ '' European values\ '' are a myth , nothing more . We have seen this over and over again .",Balto-Slavic,Croatian
Azure_Dawn,europe,"& gt ; Poland\u2019s history can easily be summed up as a continuous struggle against invasions and divisions . The country\u2019s geopolitical significance stems from its location between Russia and Germany . We have written about the challenges that both Russia and Germany will face in 2017 ; these challenges also pose unique problems for Poland , which is economically and militarily vulnerable . Recent developments have also helped Poland lay the groundwork for its eventual emergence as a regional power , as stated in our 2040 forecast.\\n\\n & gt ; Considering Poland\u2019s relatively small economy , which gives it more room to maneuver , the decline in German exports could become an opportunity for Poland to maintain and increase its export competitiveness . Technology transfers have accompanied Western investment in the country , and with continued support for national research and innovation and its relatively well educated and cheap workforce , Poland could remain competitive on the global market . One major challenge Poland faces in the medium to long term is its demographic situation , which limits its potential because the country has the second fastest aging population in Europe . But the success of socio-economic policies that drive competitiveness is dependent on political stability.\\n\\n & gt ; With Western Europe disinclined to prioritize any potential Russian threats , Poland is slowly acting as a small regional leader by working with countries to establish and support common initiatives such as defense against Russia . Within the EU , Poland will continue to be the leading voice of Eastern Europe , distancing itself from the EU\u2019s Western European members . Warsaw has been the main challenger of the Nord Stream 2 pipeline project proposed by Russia , effectively blocking it when the country\u2019s anti-monopoly agency stopped the formation of the project\u2019s consortium . Seeing that Belarus wanted to improve relations with the EU to access European markets , and considering Belarus\u2019 dependence on Russia\u2019s slowing economy , Warsaw has worked to improve ties with Minsk . Polish Deputy Prime Minister Mateusz Morawiecki met with Belarusian President Alexander Lukashenko in October and said a new chapter in Polish-Belarusian relations had been opened . The two countries have economic incentives to develop closer ties , and Poland will likely take advantage.\\n\\n & gt ; Trapped between Russia and Germany , Poland is aware of Russia\u2019s increasing assertiveness and NATO\u2019s challenges , including its members\u2019 differing security interests . In the short term , Poland will likely feel the impact of Germany\u2019s economic slowdown . Adaptation to the new reality of a declining Western Europe will not be easy or fast . The current administration will continue to seek the right balance between extending control over the economy and political institutions , and making sure its public approval ratings remain high . Considering the country\u2019s defense imperatives , Warsaw will keep building strong ties with the U.S. and develop its regional leadership posture by working with Eastern Europeans on different levels.\\n\\n & gt ; Poland usually only makes mainstream news in the West when it has conflict with the EU over specific policies or when massive government protests erupt . The much more subtle and important thing to be aware of is how Poland is beginning to behave like a small regional leader . Warsaw will see increased tensions with Western Europe , and Germany in particular , partly due to economic problems , but mostly because of diverging views on security priorities . Increased Russian assertiveness will force Poland to invest in and make the most of regional alliances .",Balto-Slavic,Croatian
Azure_Dawn,europe,Multipolar world order is in the long run inevitable . That does not mean that America will become weak but that it will share world policeman role with others .,Balto-Slavic,Croatian
Azure_Dawn,europe,"Well , I played Fallout , Stalker and Metro.\\nSo yeah , I am prepared for nuclear shitstorm .",Balto-Slavic,Croatian
Azure_Dawn,europe,What is the Balkan if not a primordial soup of chaos ?,Balto-Slavic,Croatian
Azure_Dawn,europe,"Pretty much this . Police will never be able to prevent every single attack . Attacks shall continue and with each new attack , Israelification of Europe shall continue .",Balto-Slavic,Croatian
Azure_Dawn,europe,As is tradition .,Balto-Slavic,Croatian
Azure_Dawn,europe,"It is a amazing sub , one of the best on the entire Reddit in my humble opinion . A myriad of different worldviews and biases , but very eye opening .",Balto-Slavic,Croatian
Azure_Dawn,europe,"Interesting video and point of view . Of course the Western media is propaganda , no matter where they fall on political spectrum . But to be honest , media of every country in the world is also propaganda , for media is simply another tool of the elite . Probably the most effective tool to be frank . Take a look at Chinese media , what is that if not one enormous propaganda machine ? What are Russian or American media if not enormous propaganda machines for the elites of their countries ? That is simply the way of the world . Turkey is no different . \\n\\nHe is correct in many points though . From usage of minority movements that are funded by foreign interests which could not care less about the minority in question but are using them for various geopolitical goals . There is nothing new under the sun .",Balto-Slavic,Croatian
Azure_Dawn,europe,"& gt ; \ '' The book mentions the details of the nuptial night . It mentions \u2018the right of sexual exploitation\u2019 , obedience to the husband , and it says that \u2018the good woman is one who is obedient\u2019 , that a woman can not go out without the knowledge of her husband , and that she must wear flirtatious dresses and try to please her husband when he beats her.\\n\\nHonestly , this is beyond disgusting . Can anyone from Turkey comment on this ?",Balto-Slavic,Croatian
Azure_Dawn,europe,That was amazing !,Balto-Slavic,Croatian
Azure_Dawn,europe,"Most people only see some quote of his or have heard from someone that Nietzsche was a nihilist . In my experience most people are not capable to give name of any book of his . It is like that with pretty much all philosophers . Everybody loves to talk about them , very few actually read anything by them . \\n\\nAlso , where is Schopenhauer ? His aesthetics are interesting .",Balto-Slavic,Croatian
Azure_Dawn,europe,"My thanks for your effort . \\n\\nI am really interested about this \ '' Ambivalent Ukraine\ '' though . I suppose that is a potential powder keg in the future . Honestly , not to get into political debate with anyone , I will just say that I am truly sad to say that the future of Ukraine looks very bleak to me . Which is a sorrow because the region has so much potential but various geopolitical powers and internal corruption will destroy any hope for the brighter future of Ukraine .",Balto-Slavic,Croatian
Azure_Dawn,europe,"& gt ; The truth is that Eastern Europe belongs less to the geography recorded in road atlases than to psychogeography . It isn\u2019t really a place , but a state of mind.\\n\\n & gt ; Eastern Europe doesn\u2019t just hide at the end of rural lanes like Faulkner\u2019s Yoknapatawpha County . It appears and disappears like Doctor Who\u2019s telephone booth . The best way to enter it is through its literature.\\n\\n & gt ; Eastern European fiction , by and large , has been about the capriciousness of fate , the inescapability of history , and the general absurdity of life . It has been shaped by a history of sudden reversals , thwarted ambitions , and unhappy surprises . In fact , the Eastern European legacy of domination , repression , and unexpected terror is so deep , and has affected its authors so profoundly , that it has bled into their very idea of consciousness and sense of narrative form.\\n\\nHonestly , I always felt a strong sense of melancholy hiding beneath rough exterior was a defining characteristic of all Eastern Europeans .",Balto-Slavic,Croatian
Azure_Dawn,europe,"& gt ; \u201cThat\u2019s why we don\u2019t have the right to ask why the West is so ahead of us , \u201d \\n\\nFinally , some leader in Islamic world has the guts to say the truth.\\n\\n",Balto-Slavic,Croatian
Azure_Dawn,europe,"While the leadership of Belarus has shown anger towards Moscow since the whole Ukraine thing began , I honestly doubt this is anything but attempt to get more Russian funding into Belarus . Why attempt to realign now ? Trump is in office , his focus will be China and Iran , not Russia . European Union is not exactly at prime point either , with elections coming in various important countries soon , I truly doubt anyone will jump to help Belarus .",Balto-Slavic,Croatian
Ballander,europe,"Could work , but I think there would be success with less drastic measures , if only they went for them .",Balto-Slavic,Croatian
Ballander,europe,& gt ; for reasons **even** children would understand ? \\n\\nFixed .,Balto-Slavic,Croatian
Ballander,europe,"We could have simply closed the borders , and then cherrypicked the refugees ( in numbers we can deal with ) .",Balto-Slavic,Croatian
Ballander,europe,"[ Some source ] ( http : //balkans.aljazeera.net/vijesti/vucic-za-dogovor-s-hrvatskom-30-sati-vlada-spremila-mjere ) \\n\\n & gt ; Hrvatska prijelaz Bajakovo otvorila samo za kamione s kvarljivom robom , nakon \u010dega su voza\u010di blokirali prijelaz.\\n\\nTranslation : Croatia opened the Bajakovo checkpoint to allow the lorries carrying short shelf-life goods to pass , after which the drivers blocked the very same checkpoint .",Balto-Slavic,Croatian
Ballander,europe,"I don\\'t think they should be translating the name of the \ '' party\ '' MOST to Bridge . In such case , it\\ 's best to stick with original , especially since it doesn\\'t sound too bad in English .",Balto-Slavic,Croatian
Ballander,europe,& gt ; ( he achieves more than ~70 % of the croatian population ) \\n\\nCitation needed .,Balto-Slavic,Croatian
Ballander,europe,"You use that as a compliment , not an insult .",Balto-Slavic,Croatian
Ballander,europe,"Their wishes might not comply with reality.\\nBesides , they all still need to be taken care of before they get passed on .",Balto-Slavic,Croatian
Ballander,europe,"Slovenia decided no and insisted on this arbitration , blocking Croatian negotions for the EU until Croatia agreed on this.\\nCroatia wanted to go to the international court in Hamburg .",Balto-Slavic,Croatian
Ballander,europe,"Polan , y u do dis ? \\nMacedonia and Bulgaria are screwing it up too .",Balto-Slavic,Croatian
Ballander,europe,Our arms industry is good too .,Balto-Slavic,Croatian
Ballander,europe,& gt ; There is no legal way to unilaterally withdraw from this arbitration.\\n\\nYou can via Vienna Convention since Slovenia breached the agreement about arbitration ( article 6 ) . \\n,Balto-Slavic,Croatian
Ballander,europe,Because it is . \\n\\nKAJKAVIAN MASTER RACE,Balto-Slavic,Croatian
Ballander,europe,They are truly in a rough spot ; (,Balto-Slavic,Croatian
Ballander,europe,& gt ; and most of Croatia was Austro-Hungarian.\\n\\nAll of Croatia was in Austro-Hungary from the beginning of it .,Balto-Slavic,Croatian
Ballander,europe,"No , not really . From the same article : \\n\\n & gt ; Hrvatske grani\u010dne vlasti su od pono\u0107i izme\u0111u nedjelje i ponedjeljka zatvorile za teretni saobra\u0107aj prijelaz Bajakovo , jedini koji je na granici sa Srbijom ostao otvoren od po\u010detka izbjegli\u010dke krize.\\n\\nIt was closed on 20/21 ( midnight ) September 2015 . The article is from 22 September 2015 . So around a day.\\n\\nThe point is they let them pass .",Balto-Slavic,Croatian
Ballander,europe,"No , no and no.\\nGibanica is a specific \ '' dish\ '' , which has some variations , but it\\ 's definitely not generic.\\n\\nThe one on the picture is \ '' prekmurska\ '' which differs a bit from ours .",Balto-Slavic,Croatian
Ballander,europe,5 more seats when ?,Balto-Slavic,Croatian
Ballander,europe,"Yeah , Slovenian language is hilarious .",Balto-Slavic,Croatian
Ballander,europe,& gt ; his mother tounge is English and he struggles a bit with Croatian\\n\\n [ At least Milanovi\u0107 is pleased ] ( https : //scontent-vie1-1.xx.fbcdn.net/hphotos-xpf1/v/t1.0-9/12392013_488975081274766_8803966849149522765_n.jpg ? oh=898a3a4f5e19bec0e3be5353f15b0699 & amp ; oe=57117DB4 ),Balto-Slavic,Croatian
Ballander,europe,It seems the military parade should stroll along a bit to the south.\\n\\n\\nTerrible news though .,Balto-Slavic,Croatian
Ballander,europe,I meant sealing and securing the borders and picking the refugees who are in dire need . The rest can stay in Serbia .,Balto-Slavic,Croatian
Ballander,europe,"Dunno , but they criticised Milanovi\u0107 for his actions .",Balto-Slavic,Croatian
Ballander,europe,"& gt ; Streets are empty past 6 p.m . There are no coffee shops . Even bars don\u2019t operate except on the weekends , \u201d he said . \u201cSimply , this is the land of boredom and misery.\\n\\nPoor Swedes .",Balto-Slavic,Croatian
Ballander,europe,"The summer months are considered as tourist season , spring is pre-season .",Balto-Slavic,Croatian
Ballander,europe,2016 never sleeps .,Balto-Slavic,Croatian
Ballander,europe,I doubt he\\ 'll reach the levels of Mr \ '' We\\ 'll kill 100 Muslims for every Serb\ '' .,Balto-Slavic,Croatian
Ballander,europe,"& gt ; This due to the tourist season.\\n\\nIt states the data is for May 2015 in the article , how did you draw this conclusion ?",Balto-Slavic,Croatian
Ballander,europe,Corrupting the court is generally not perceived as a legitimate way of solving the problem .,Balto-Slavic,Croatian
Ballander,europe,"& gt ; Considering , freedom of press rankings for Croatia were poor , it could be certain entities don\\'t want Croats to know about this option . Ensuring the press keep quite.\\n\\nHah , that\\ 's debatable and it\\ 's debated in Croatia , /r/conspiracy style.\\n\\n\\nNot about this thing particulary , but the general interest of medias.\\nThe media is very centered around ex-Yugo ( not so much around Slovenia ) - but languages are similar so it\\ 's understandable to some point . There\\ 's almost nothing about Hungary , eventhough we share a long border with them and had 800 years of interwined history.\\n\\nPeople in general don\\'t care much , so they consume what they are given through medias . As a result , most people won\\'t care too much about anything , some will about ex-Yu , but almost none will know about V4 for example.\\n\\nI wouldn\\'t attribute this disinterest to entities per se , it\\ 's probably just due to lazyness and narrow-mindness of academics and other elites . It was just not discussed , nor was it taken note of . A lot of people are mentally stuck in some other times , we\\ 're still having \ '' Ustashas vs Partisans\ '' nonsense in 2015 . Some people still have prejudices towards other eastern Europeans ( we were more developed than them back then , now it\\ 's a bit different if we compare with CE ( former EE : P ) countries . \\n\\n\\n & gt ; You think HDZ is mainly the culprit for keeping Croatia out or is SDP the same nonsense ? \\n\\nI wouldn\\'t point fingers , I think every government for the past 20 years shares some of the blame.\\nBut in this particular government , the MVEP is so occupied with ex-yugo ( not counting Slovenia ) , that it seems like nothing else exists . Vesna Pusi\u0107 , the minister in charge of foreign relations , mentions \ '' regija\ '' non-stop , it\\ 's tiresome really . Add to this that she\\ 's fairly incompetent ( she had huge gaffes as well ) and you can\\'t really expect much to happen in any way . Croatia in the EU is basically non-existant.\\n\\nThough elections are coming soon , so I wonder if anyone will mention V4 , but I doubt it.\\n\\n\\nP.S . Damnit , it\\ 's a wall of text again . : ( It\\ 's less cohesive , but whatever . [ I just wanted to add a barometer of general public ] ( http : //barometar.pilar.hr/rezultati-2015/2015-07-01-12-32-50/regionalne-preferencije.html ) ( n=1000 ) . If you check what neighbour regions should Croatia cooperate the most , almost 55 % opted out for Central Europe , which is kinda surprising given its lack of exposure in media . But the 20 % who don\\'t know are also a force to be aware of .",Balto-Slavic,Croatian
Ballander,europe,"So , you would only have articles concerning multiple European countries ?",Balto-Slavic,Croatian
Ballander,europe,You do realise those percentages come from a low turnout ?,Balto-Slavic,Croatian
Ballander,europe,"Hehe , I didn\\'t see it until now , but at least you got an answer . : ) \\nSo , is there no difference between \ '' y\ '' and \ '' i\ '' in Slovak ? \\n\\nThat\\ 's how I feel about \u010d/\u0107 , ije/je and d\u017e/\u0111 in Croatian .",Balto-Slavic,Croatian
Ballander,europe,"Can confirm , it\\ 's \ '' Dansko pecivo\ '' in Croatian .",Balto-Slavic,Croatian
Ballander,europe,"They need to get into Slovenia first , and get into Croatia before . The chances of getting caught are huge .",Balto-Slavic,Croatian
Ballander,europe,"& gt ; \u0161ta dela\u0161 ? \\n\\n [ u wot ? ] ( http : //res.cloudinary.com/urbandictionary/image/upload/a_exif , c_fit , h_200 , w_200/v1396227695/zjxrie5ljfnmbvznhdqh.jpg )",Balto-Slavic,Croatian
Ballander,europe,"You could just try moving somewhere else , not living \ '' here\ '' might be preferable to not living at all .",Balto-Slavic,Croatian
Ballander,europe,"Oh my , you indeed have your knickers in a twist . No one denied that Romania cooperates with V4 , lots of countries cooperate with them through that framework ( Croatia too ) .\\n\\nWhat I linked just had more relevance to the topic at hand since those are the words from the same person that prompted this whole post and discussion , and it explicitly mentioned an union inside an union.\\n\\nBesides , Romania has that [ Craiova group ] ( https : //en.wikipedia.org/wiki/Craiova_Group ) going on for it.\\n\\n\\n & gt ; But hey , maybe that dodgy boomerang you call Croatia is really special . I wonder how did we survive before you joined EU to tell us what we can.\\n\\nPray tell , I wonder myself as well - how did you ?",Balto-Slavic,Croatian
Ballander,europe,"& gt ; maybe it\\ 's a good idea to cut short this cockiness.. because Romania is arguably of higher strategic importance for V4 ( existing gas pipes , transport corridors , seaport ... ) and therefore probably has a higher chance of ever \ '' joining V4\ '' than Croatia.\\n\\nI know you were just *butthurt* by his comments , but I still feel like I need to correct you on this one , because Croatia was historically pretty important to Austria/Hungary/whateverthenamewasatthetime as the southern end of Central Europe with quite a nice access to Adriatic Sea . Pula was the main port for the navy and Rijeka was a port of utmost importance to Hungary ( which is why we had some not so nice things like \\'Rije\u010dka krpica\\ ' ) . Today , it\\ 's not that important due to negligence , Trieste and Koper stole a good chunk of its transport , but with proper care and investing it could be brought up to speed again to everyone\\ 's benefit.\\n\\nAlso , as far as energy supply goes , Croatia has a better position to provide for Central Europe , since to the north we can cover most of Central Europe with very little pipe mileage and even easily connect it to the Baltic LNG terminals . There were already talks and plans for Krk LNG terminal which would do this , and were encouraged by Americans ( especially during the Ukraine crisis ) in order to diversify European energy suppliers.\\n\\n\\nAlso , if you look up the historical inspiration of Visegrad Group , you\\ 'll notice that Charles I of Hungary has also had the title of King of Croatia , so we were there in the beginning .",Balto-Slavic,Croatian
Ballander,europe,At least they tryhard at doing commercials for Super Bowl .,Balto-Slavic,Croatian
Ballander,europe,"\ '' Pravo\ '' also means \ '' right\ '' ( as in rights - prava , but it can also be as if you\\ 're in the right - Ja sam u pravu ) .\\nIt can also mean \ '' real\ '' .",Balto-Slavic,Croatian
Ballander,europe,Our president [ managed to sneak into Top 50 ] ( http : //www.forbes.com/profile/kolinda-grabar-kitarovi263/ ? list=power-women ) as well .,Balto-Slavic,Croatian
Ballander,europe,Thank you for the answer .,Balto-Slavic,Croatian
Ballander,europe,"It is interchangeable in Croatia , it\\ 's just that \ '' Ugarska\ '' could be considered an arhaism and isn\\'t in use anymore.\\nBut when talking about history ( history lessons ) , people will freely use Ugarska and Ma\u0111arska as synonims .",Balto-Slavic,Croatian
Ballander,europe,Do you prefer \ '' Ugarska\ '' ( Hungary ) or \ '' Ma\u0111arska\ '' ( Magyaria ? ) ? \\nWhat\\ 's the difference between the two ? \\n\\n,Balto-Slavic,Croatian
Ballander,europe,Lufti\u0107 is diminutive and shorthand for luftmadrac .,Balto-Slavic,Croatian
Ballander,europe,"No , the red square was in power when we joined the EU and we also applied for membership during their governance ( in 2003 ) . However , the negotiations were handled and brought to an end in 2011 by the blue square . Both parties had joining EU as their goal .",Balto-Slavic,Croatian
Ballander,europe,Guess what [ this song ] ( https : //www.youtube.com/watch ? v=KyHWEU-QAsg ) is about . ; ),Balto-Slavic,Croatian
