2stepsfromglory,oddworld,"These trees are like a highrise ( 50-60 m ) . In truth , the ones from the paramonian temple are fossilized and infinitely bigger than the others , so it 's difficult to know how old this forest is . The concept art for Paramonia is more creepy and looks more like a dark forest full of fossilized trees . I believe that initially they wanted to do some sort of a prehistoric forest .",Romance,Spanish
2stepsfromglory,Pendulum,"Maybe a new version of old tracks like what they did with Different , having other two different version for the Lives ( Electro mix from Glastonbury and the Dubstep one for Wembley Arena ) but I do n't believe they are going to play something new , unless maybe the supposed remix . Someone said that it could be the one they asked to Mutemath but I believe that this is going to be a Knife Party rmx . IMO it 's , from more possibilities to less : Voodoo People , I 'm Not Alone , Master Of Puppets or Immigrant Song .",Romance,Spanish
2stepsfromglory,trance,this one is better imo https : //soundcloud.com/bennicky/free-download-martin-garrix,Romance,Spanish
2stepsfromglory,Pendulum,"I think they needed him for Miami . More when we are talking about the first live they are going to do in more than 5 years . I believe it 's gon na be insane anyway , but is not going to be the same without him .",Romance,Spanish
2stepsfromglory,OnePiece,"Vista was one of the most loyal commanders of WB and obviously he hates BB , just go see his reaction during the fight between WB and BB . So I do n't believe he betrayed Marco . The thing is , **the WB pirates really died with WB and Ace** . Not all the pirates that were in the Marineford war were part of his crew , loads of them were just allies . After WB died , surely a lot of his allies changed sides for convenience or necessity . The sun pirates passed to be underlings of Big Mom btw , and maybe some WB pirates moved to Shanks territories or formed their own separated crews . Without WB , loads of these allies were unprotected . Big Mom , Kaido , the supernovas and the Marine surely killed a lot of the little pirate crews that were allies of WB or that protected his islands . I believe that the war was just between the WB most important members and maybe some loyal allies , and we need to see that BB crew is not just a group of criminals . BB can rekt all the DF users of the WB crew now . This without counting his crew members .",Romance,Spanish
2stepsfromglory,OnePiece,"Capone Bege : Although he is an ally of Big Mom , I think it all boils down that the theme of Big Mom are mafias , assassins and the underworld in general , something she has in common with Bege . I think that although he may not be considered an ally ( and indeed is a declared enemy ) , is a character who probably is only allied with Big Mom for interest . Its aim is surely control the underworld and therefore I think the most likely be an enemy in the arc with Big Mom . At the same time , I hope we can see some kind of confrontation between him and Crocodile , since both characters have the same theme of the mafias and it would be interesting to see a fight between two characters that are so cold and calculating like these two . Or even that they became allies . X Drake : Given that he has changed sides between the Marine and pirates and that seems like a pretty honorable character , I think it 's the only one who does not intend to betray the Yonko who he 's working with , I even hope he is one of the two other calamities . He just wants to fuck the world government as much as possible , so it is understandable that joins the most destructive Yonko . I predict that when Kaido is defeated , perhaps he will join the revolutionaries . Jewelry Bonney : I never understood his true motivations but I see quite possible that she will have a recurring role in the arc with Big Mom . Not only because I think it 's his daughter , but because it 's the only woman of the supernovas . In addition , I see many parallels between these two : Both have an insatiable appetite , the same colour of hair , similar lips and a cake-shaped ship . However , I think it will be an ally , especially because we saw her crying when Whitebeard died . Kid : I think it 's the supernova that we should really pay more attention , considering that arises as the main enemy of Luffy of the worst generation . After all , he intended to dethrone the only Yonko that Luffy admires , and even if I 'm honest , I 'd like to see it happening . Would be too absurd that Luffy and his allies defeated a Yonko and the other characters were not able to . I think the alliance with Hawkins and Apoo is now allied with Kaido , or at least Kaido decided to ignore them considering that they intend to deal with Shanks , who ultimately is his enemy . Killer : The Kid 's Zoro is perhaps too mysterious from my point of view . He is intelligent and calm but at the same time , a fierce murderer . I think it has something to do with the Vinsmoke and I would like to see more of him besides him being part of Kid 's crew , maybe in the arc of Big Mom . After all , both Kid and Killer have contacts in the underworld . Basil Hawkins : I do not understand very well the need of allying with Kid and Apoo , especially considering that he conquered Foodvalten . But after all , I think it 's a very interesting character who will show his full streght in a possible arc with Shanks . Scratchmen Apoo : I must say that is the supernova that interested me the less , but I think it will act as a mix between Usopp and Brook in this alliance between the three bands . I guess that will be the enemy of Brook if the two alliances fight each other . Urouge : I think its function is completely neutral and that perhaps was introduced to face some character from heaven . Given that their wings are similar to that of the Birkans and his band is called `` pirates of the fallen monk '' I think it has something to do with the destruction of Birka . Does this mean that we may see Enel again or something that has to do with him ? I hope so . Otherwise , I do not see Urouge will intervene in the events of the new world in a great way . maybe even we are going to learn what is the other way to arrive to the sky islands .",Romance,Spanish
2stepsfromglory,OnePiece,I think that Apoo is very similar to Brook so that 's why I think that they will fight or at least we will see some interaction between them .,Romance,Spanish
2stepsfromglory,Pendulum,"Nah , simply that deadmau5 is a HUGE fan of Pendulum and he is not going to miss their performance . https : //twitter.com/deadmau5/status/336345894670716929",Romance,Spanish
2stepsfromglory,trance,Holy fuck Ben Gold is going nuts . Such a good set .,Romance,Spanish
2stepsfromglory,Pendulum,"`` It 's the rule of Pendulum that all technology must fuck up before a show , them run perfectly during the show '' I hope it will be true : ' (",Romance,Spanish
2stepsfromglory,trance,"prydz will do the same as always , for mau5 I expect some IDs , material from his last album , then Careless Suggestions and maybe one last `` troll '' track ( death metal as he has said ) . I hope I 'm wrong and he plays a trance set full of platipus classics and some of his Halcyon441 old songs , but I 'm 99 % sure that is not going to happen .",Romance,Spanish
2stepsfromglory,OnePiece,"I like Shanks as a character , but I believe that he will be defeated by Kid and later , Kurohige will kill him . It would be the more understandable , I would like to see Kid occupying the position of Shanks as a Yonko , which would allow Luffy to effectively face with the 4 yonkos ( I do n't know about you guys but at this point I see very difficult that Luffy faces Shanks being both friends ) . Btw , I do n't believe that Kid it 's enough strong to kill Shanks , so Kurohige is my option to be his murderer .",Romance,Spanish
2stepsfromglory,trance,I did n't said it 's a bad thing tho,Romance,Spanish
2stepsfromglory,OnePiece,"Yeah , but he killed him because he was not going to reveal information .",Romance,Spanish
2stepsfromglory,OnePiece,"Sort of , sure that they have a mafia too .",Romance,Spanish
2stepsfromglory,OnePiece,"I believe that Shanks is like Lugia to Moltres , Zapdos and Articuno . It is like the man who keeps calm among the other Yonkos .",Romance,Spanish
2stepsfromglory,Barcelona,that 's more for the Raval version .,Romance,Spanish
2stepsfromglory,deadmau5,"He said that the spanish scene is awful and that the events here are really shitty . That 's why he has played in Spain like 3 or 4 times ( Sónar Barcelona , Creamfields Andalucia and a couple of gigs in Ibiza and Mallorca )",Romance,Spanish
2stepsfromglory,Pendulum,"For me each of the three albums is special in some way but Immersion is Pendulum at its finest . In Silico was a test and as they often say , they suffered something of an identity crisis . Immersion is a mixture of what they learned on In Silico and Hold Your Colour with new sounds and influences . I agree that the album tells a story about love , depression and death . But I do n't think all the songs follow the same line or have to be connected together . Watercolour : For me it was always a song about a person who is suffering from depression and people around him notice it , he need help . Crush : Perhaps the song with a greater number of interpretations . For some it 's about a jealous or possessive man who killed his girlfriend , for others he is a man in love with a woman who ignores him ... Based on the lyrics and the video , I think it 's either the first option or a man who did much damage to a girl , she committed suicide and he tried to justify erroneously that she flirts with other men when in truth she was just kind with everyone . Under The Waves : Someone who ends surpassed by the bad events of his life despite fighting all the time . The Island : for me this song is about two people who just met and they feel some attraction between them . However , this does not go beyond something casual and although one of them start to feel something for the other , everything ends in nothing . Witchcraft : It 's about domestic violence . Self vs Self : The struggle between good and evil in a person after having lost everything . The Fountain : Someone who feels that nothing is enough for him , nothing satisfies him and lives in a state in which he feels extremely lonely despite being loved or with lots of people in his life . In other words , he does not feel himself complete . Encoder : Rob said that this one was about dealing about the loss of a friend , but for me it 's about the last moments of a relationship in which one part begins to realize that the other does not feel the same and although at first tries to fix it , later discovers that instead of suffering it 's better to let go . The title of the album I think that refers to being `` immersed '' in bad feelings ( loneliness , sadness , depression ... ) . When you 're passing from one of those feelings , it 's like you 're drowning . Indeed at the end of Encoder , you can hear some waves and someone walking between them , as if he has managed to stay afloat , it 's like all the bad feelings are gone .",Romance,Spanish
2stepsfromglory,Pendulum,"Well , it depends . In my case , I liked KP from 2011 - 2013 . Then it started to be a generic EDM act that I did n't liked at all . I think that there are artists that can work with different alias well , like Jon Gooch . I like Spor , Feed Me and Seventh Stitch because he puts a lot of effort in every song . KP it 's different , it was planned to be a non serious project , at least this is what they have been saying recently . And I do n't like when a talented producer goes to the easy path , doing generic music like their last EP or some songs of their album . If it turns back to the originality of the Rage Valley EP times , then I will enjoy it again . This is why I believe that this project needs a long break in production terms .",Romance,Spanish
2stepsfromglory,trance,"The mainstream Djs always follow trends . That 's how they still relevant . Armin was mainstream in Mirage times but that was when only the good electronic music was mainstream . Then Guetta & amp ; SHM arrived and all started to be shit . Trance was not that big then , so loads of Djs changed his style to a something more successful for their pockets and fame . Some went full mainstream ( Tiësto , Sander van Doorn , W & amp ; W , Ummet Ozcan , etc ) , others went to the cheesy path ( Dash Berlin , Tritonal ) and others moved to new sounds with trance and EDM elements ( A & amp ; B ) . In Armin 's case is different . He really likes Trance , and at the same time he knows that he ca n't switch bc is what makes him big . I mean , the day that Armin leaves the Trance scene , his career will be literally dead . IMO , Trance is what makes Armin big , not vice versa ( at least since Intense ) . At the same time , he is a really important figure in the Trance scene because he helps a lot of producers of different subgenres , from progressive to uplifting and from trouse to tech trance . Thanks to him a lot of `` non trancers '' starts to look at the genre . As a DJ/Producer , he goes to Big Room and crappy pop house bc he needs to draw the attention of mainstream audiences . In current times , trying to separate yourself from the rest in most cases does not end well . Most of the public are like sheeps , music interests them very little , they go for what they think it 's the new trend . That 's why Armin mixes shit in festivals . And for Off the Hook , for me was just a marketing thing for his latest album that , in truth , was made for the radios .",Romance,Spanish
2stepsfromglory,oddworld,"Idk , they do n't say anything about it .",Romance,Spanish
2stepsfromglory,Pendulum,"I do n't think that `` that was the point '' back in 2011 - 2013 . The troll aspect really born after the Chainsmokers thing , when Rob said that he was bored of EDM and then he did that troll track called 'Internet ' . Before that I 'm sure that they did tracks that they enjoyed .",Romance,Spanish
2stepsfromglory,OnePiece,"For everyone asking , daimyos are more like nobles who have the control of a certain territory : FE , Shimazu Yoshihiro was the daimyo of the Satsuma province . They rule a certain territory , but they are under the Shogun government . There 's a shogun , there is a closed door policy with the rest of the world ( this country is not even part of the world government ) . This gave me the idea that there will be English pirates from Wano , something like the wako pirates ( maybe this will be the way to the SH to enter in Wano ) . I believe that we are going to see a mixture of Sengoku Jidai / Tokugawa Bakufu period and the Meiji ishin , with the Kozuki clan taking down the Shogun like the emperor Meiji did ( Meiji Ishin ) with a huge war between clans ( Sengoku Jidai ) . In this context , I see Kaido pirates like the Mongol Empire , being Kaido some sort of Genghis Khan . He looks kinda like the old drawings depicting the Mongols and the Hun tribes as Oriental demons or `` beasts '' . Btw , Jack was introduced with a very similar quote of what people said about Atila in the last days of the Roman empire . The beast pirates are absolutely bloody and destructive , something related to all the nomadic tribes of central Asia . they are attached to Wano country now , and this is really interesting bc in 1281 , the Mongol empire tried to conquer Japan and then there was a huge typhoon called Kamikaze ( divine wind ) that destroyed the mongol fleet .",Romance,Spanish
2stepsfromglory,OnePiece,Scopper Gyaban,Romance,Spanish
2stepsfromglory,OnePiece,"That would be very cool , and could be the only way that we can see Enel again .",Romance,Spanish
2stepsfromglory,deadmau5,Maceo Plex - Solar Detroit rn,Romance,Spanish
2stepsfromglory,OnePiece,"I think not , but we know about him since the very beginning , like Rayleigh .",Romance,Spanish
2stepsfromglory,OnePiece,Luffy : Fighting - Normal Zoro : Steel - Fighting Nami : Water - Flying Usopp : Bug - Grass Sanji : Fighting - Fire Chopper : Fairy Robin : Psychic Franky : Steel Brook : Ghost Mihawk : Steel - Flying Kuma : Steel - Normal Hancock : Psychic - Fairy Crocodile : Ground Jinbe : Water - Fighting Teach : Dark - Ground Moria : Ghost Doflamingo : Normal - Flying,Romance,Spanish
2stepsfromglory,trance,"Surely they are going to do more OceanLab , at least after their new acoustic tour . But anyway , do we really want OceanLab back ? Another Chance was a very bland track , I do expected way more from them , so if I need to be clear I believe that OceanLab was a good project in his time , but not now . I have the feeling that if they release more OL material it will sound more like the actual A & amp ; B with Justine on vocals , but just that .",Romance,Spanish
2stepsfromglory,OnePiece,"How an admiral could be the leader of a country that is not part of the world government ? I do n't see any sense in this . I think that Ryokugyu will be seen in a revolutionary arc , and we 've not seen his face because Oda always try to hype his characters . Remember the first time that the yonkos were mentioned ? that was YEARS ago , and Big Mom face has never been seen entirely ...",Romance,Spanish
2stepsfromglory,trance,I am the only one that likes more Tranquility Base than OceanLab ?,Romance,Spanish
2stepsfromglory,trance,Do you want bangin ' stuff or something more soft and melodic ?,Romance,Spanish
2stepsfromglory,trance,There is like 15 unreleased tracks that he has been playing since 2012 . The day that this guy will release and album it will be epic .,Romance,Spanish
2stepsfromglory,trance,And the thing they do with their hands is like what W & amp ; W does in every gig .,Romance,Spanish
2stepsfromglory,OnePiece,"Francisco Pizarro was not really a corrupt . Avalo is a variation of the spanish word `` avaro '' , that means avaricious . A widespread topic among the Spanish conquistadors is that they coveted gold and silver above all .",Romance,Spanish
2stepsfromglory,Barcelona,"In truth is more like `` agua , servesa , beeeeeer ? ''",Romance,Spanish
2stepsfromglory,OnePiece,What if X Drake is one of the 2 calamities now ? I think it would be great in the way that he has the same type of zoan DF that Jack has .,Romance,Spanish
2stepsfromglory,trance,he was a trance producer long ago .,Romance,Spanish
2stepsfromglory,Pendulum,I 'm shaking . Word .,Romance,Spanish
2stepsfromglory,Pendulum,"It 's a good setlist for Ultra knowing that it 's a mainstream festival , they played their more known songs . It has been glorious , and it really looks like the first move for them to return with 'Begin Again ' being their last song I think it means something ...",Romance,Spanish
2stepsfromglory,marvelstudios,I 'm not . Is just that the film does not make any justice to some characters and it looked really anticlimactic in the second half .,Romance,Spanish
2stepsfromglory,trance,"maaan , you need to check some of his songs , he has a very distinctive style . Some of my faves : A Cry To The Moon , A Million Sounds A Thousand Smiles , Orbion ( Eco Remix ) , Planes Overhead , Volare , Slow M ( Ocean ) , Over Paper Skies ...",Romance,Spanish
2stepsfromglory,OnePiece,I really liked Monet and it could have fit perfectly in the crew . I do n't understand how Oda can write such an interesting character and kill it in the same arc while Caribou ( such a pathetic character ) is still doing shit in the new world .,Romance,Spanish
2stepsfromglory,feedme,Maybe the Feed Me ep ends being an album and this is why he will release this ep before .,Romance,Spanish
2stepsfromglory,DnB,"Caligo is a good album . It has a good pace between songs and is very versatile in styles but having at the same time the classic Spor sound we all know . I prefer it before having 10 hard hitting songs that as a singles are great but as an album together are just a headache ( Phace , I 'm talking about you ) . In truth the only release of Spor I did n't enjoyed was his remix for the prodigy , wich was absolutely generic .",Romance,Spanish
2stepsfromglory,OnePiece,"I 'm not saying anything against Kaido or the people who are impatient about the war against him , at all . I 'm part of this hype train as well . This is just my 2 cents about why we need to expect huge things about a BM arc .",Romance,Spanish
2stepsfromglory,OnePiece,"Nah man I was n't saying that this will happens now with the rescue team . When I said BM arc I was talking about an arc with her being the central enemy . rn like the things are going , Kaido looks like the real deal . I suspect that we will have some hints of BM now and then , we will know some things about her and her crew but I hope that she wil have an arc after Kaido bc it will look kind of disappointing if she 's defeated before him . I forgot about Lucci and being part of the CP0 , he fits perfectly there .",Romance,Spanish
2stepsfromglory,trance,Paul Oakenfold - Bla Bla Bla and Ikorus - Nine Lives .,Romance,Spanish
2stepsfromglory,OnePiece,"I 'm not sure about the cook , but what about Scopper Gyaban ? In truth , I 'm praying for it to happen . He was the third on Roger 's crew ( like Sanji is in the SH crew ) . Edit : Oh wait wait . WHAT IF SCOPPER GYABAN WAS THE COOK OF ROGER 'S CREW ?",Romance,Spanish
2stepsfromglory,marvelstudios,"Just because a lot of people liked it does not mean that the film was that great . Loads of them did n't knew how the characters where before the film came out , and tho I liked some things and the production design was really amazing the climax has , indeed , one of the biggest and forced deus ex machina I 've seen in a film . It did n't feel like GOTG for me .",Romance,Spanish
2stepsfromglory,Pendulum,He 's talking about Dreambeach I suppose .,Romance,Spanish
2stepsfromglory,marvelstudios,this is why I asked about Venom . Would it be something similar ? Because I do n't see any reason to do a solo film about him if it 's not going to be involved in any Spidey sequel later .,Romance,Spanish
2stepsfromglory,marvelstudios,"Mmm I do like Flash Thompson but I think that the best that we could have if they do a `` canon MCU '' Venom movie is Mac Garman . Eddie Brock does n't work without Spidey , Flash Thompson was not a villain and Venom needs to be a villain if they do a film about him bc this is why Marvel needs : Interesting villains . Garman is what we need . Btw , he was Scorpion too so we could have two characters for the price of one .",Romance,Spanish
2stepsfromglory,marvelstudios,Chris Evans i 'm looking at you .,Romance,Spanish
2stepsfromglory,marvelstudios,I read that info about the Venom movie a couple of months ago . Are you sure that they scrapped it ? I believe that if it 's not scrapped there will be one of these two possibilities : 1 - It 's a film kind of what Fox does with the Fantastic Four . Just for not to lose the rights on the character . 2 - It 's canon with the rest of the MCU movies even if it 's a Sony film in a similar way that the Tom Holland Spidey will be under the MCU but with Sony involved .,Romance,Spanish
2stepsfromglory,trance,Fluoro is such an interesting label for the more Acid sounds . Bla Bla Bla is my TOTY rn .,Romance,Spanish
2stepsfromglory,trance,"Yep , I understand now why Perfecto joined BHR . They are going to put more old school acid songs .",Romance,Spanish
2stepsfromglory,trance,"I 'm not really into Anjunabeats anymore tho I have practically all what has been released between 2001-2013 . For WAO I need to say that I do n't understand why a lot of Uplifting / Techlifting fans do hate it . I mean , this label has released great tracks like Brush Strokes , Riders Of Rohan , WAO138 ? ! ( Photographer Rmx ) , Aurora , Drop , Empire Of Hearts ( Johann Stone Rmx ) , L'Absente , Night Lights , Shine , Siren 's Song , # Energy , Hyper , Reach Out ... It 's a good label and at least for me it 's better than other labels like Subculture , at least if we are talking about the recent releases .",Romance,Spanish
2stepsfromglory,trance,"You are like me then . Outburst for example has been pushing newcomers like Stephen Kirkwood , Ikorus or Jamie Walker while at the same time , all of them have some type of old school tech trance vibe in their productions .",Romance,Spanish
2stepsfromglory,OnePiece,And he will come back from the moon with his army of robots !,Romance,Spanish
2stepsfromglory,marvelstudios,I think that for starters she could have been a better Jane that Portman .,Romance,Spanish
2stepsfromglory,deadmau5,"Joel playing at Tomorrowland or the ASOT stage in Ultra , besides some events in Spain.. ? . that 's really weird , looks like he need $ $ , bc it looks really weird that someone that has being bashing the Mainstream festivals and more especially these two , the spanish events and the ASOT thing would now play in all of these . It feels kinda hypocrite now ...",Romance,Spanish
2stepsfromglory,marvelstudios,And here comes the downvotes . Seriously I want to understand why there is so much hate over the people who did n't enjoyed the film .,Romance,Spanish
