3G6A5W338E,linux,"& gt ; Making it clear that you were not going to talk about any of the points I raised Why bother . But if you 're right , then it 's not a strawman . & gt ; Here 's one example from HP - there are plenty more . All of them using proprietary drivers . While I 've only worked with Linux and BSDs ... I 've never worked on supporting users at their workstations . I do n't think I want to , either . I lack the patience . & gt ; Another strawman , this time in the form of a rhetorical question . It 's not a strawman ( read the definition again ... ) , and it 's not rhetorical , it 's just you 're weaseling from answering it . & gt ; there was a link to an system breaking fglrx crash from 2011 which is STILL unfixed in 2015 - that AMD driver team is doing grear work /smarmcasm . Because NVidia has never been slow on fixing issues , particularly blatant , widely known security issues , on their blob /s . & gt ; On an AMD GPU ? I doubt it . Very few games , particularly modern games run well on Linux when using an AMD GPU and fglrx . My experience with fglrx on the HD4850 lasted a few weeks ; I switched to the free drivers when they got xv working . Most of the games I actually do play are n't beefy FPSs , but humble indie fare . There 's L4D2 and DOTA2 , however , which my old AMD with free drivers does handle ( 60fps on high settings ) but sadly the GPU I 'm using on my current Intel CPU does not ( 40fps low ) . I 'll probably be getting a Fury Nano at some point but that 'll only be _after_ it 's confirmed to work at all on Linux . & gt ; Booting a downloaded Live CD does not count as `` using Linux '' . Live CDs were anything but common in 1998 . & gt ; You 're full of shit . Facedesk .",Romance,Spanish
3G6A5W338E,linux,I do n't think `distributed filesystem` means what you seem to think it means .,Romance,Spanish
3G6A5W338E,linux,"& gt ; The Linux Desktop Workstation market is where Desktop Linux has been relevant commercially . That 's where binary blobs relate to profitability . I ask again , how do closed source drivers relate to profitability ? & gt ; AMD have been historically delivering poor Linux drivers for over a decade and you think your tiny sliver of experience negates all of that ? No way , Josephina . Again , I use the open drivers . & gt ; vx support will not help any of these games . And the vast majority of indie titles are built in engines which use 3D surfaces even for 2D playfields . You lost me somewhere . We 're not talking Amiga computers here , what 's with playfields ? Random fact : Mark of the Ninja was nice and smooth when I played it on the HD4850 with free drivers , but my Intel 's GPU ca n't handle it . 2D games these days rely on OpenGL/D3D heavily . & gt ; Something is awry in your system . The HD 4600 can pretty much max out DOTA2 and should n't struggle at all on L4D2 . I know that performance is better on Windows ( for DOTA2 ) ; the issue is likely with mesa Intel support . Ultimately , I 'm holding on playing DOTA ; even if I booted Windows to play it , it 's just not the same with low settings . It 's even worse with L4D2 , as low framerates do give me headaches on first person games . For clarification , on my home workstation I have two Linux roots , Gentoo ~amd64 ( which I use ) and Arch ( which I boot sometimes or otherwise chroot to when convenient and to keep up to date ; I have bind/rbind mounts preset ) . Both are relatively up to date . & gt ; And just for shits and giggles ... Great job quoting Wikipedia . What I said is that they were not common . And guess what , they were not common . I personally only ever tried a LiveCD by Knoppix era , and that was years after I started using Linux day to day . & gt ; Dude , I 'm over 40 , When I was in uni in '92 you could get Yggdrasil Linux on a Live CD . By '98 there were at least a half dozen easily grabbed Live CDs in circulation just after the release of Demolinux . I 'm over 30 . My background was with Amiga , not PC+Windows . I started using Linux around when I got my first `` PC '' ( had been thrown out as garbage ) , late nineties , a few years before I started uni . Back then , Internet access from my area ( Spain ) was expensive ( pay per call time ) and slow on 33k , later V90 modem . With IRC , I managed to meet some of the few other users from Spain ... of course , I likely was the only Linux user in my town . The situation quickly improved the years after . I 'm somewhat envious you went to uni earlier and so you got decent internet access earlier ... but thinking about it , I still prefer being younger . : D",Romance,Spanish
3G6A5W338E,linux,"& gt ; That 's a really stupid question . You understand how trade secrets and corporate contracts work , I hope . I 'm really not interested in discussing the blatantly obvious . I am stupid . Please explain ? & gt ; I also think you 're lying and pretending not to have used them . There 's no way you played most of the games on the open source driver . Believe it or not , mesa/gallium3d actually works . Performance might vary , but it 's not an issue for most games I play . I 'm less capable now with Intel 's GPU , but even then I can play *almost* everything I want to . What I really , really want to play and can not is PS2 games ( pcsx2 sucks hardcore with Intel , both performance and rendering issues , I 'm told some are in Intel 's GPU hardware ) and Elite : Dangerous ( which is very GPU hungry ) . & gt ; Ugh . A playfield is a playfield is a playfield . Convenient weaseling & gt ; Yes , yes , we 're all impressed that you played with an Amiga 500 as a toddler . As a toddler , there were n't computers at home . Then there was the C64 , and only around 1990 the Amiga 500 , which is the first computer I really used and the only computer I had until the late 90s . & gt ; Namedropping . Excuse me for bringing Amiga up on its 30th anniversary . & gt ; Which is sad , because back in the previous generations prior to Haswell , iGPU was substantially faster in Linux with the open source driver . Intel started taking gaming seriously and here we are . And then I went and got a Haswell ... ouch . The good news is the plan was never to use it for long ... new AMD cards were due and I wanted a chance to try Intel 's GPU . I suspect they 'll come around and adopt Gallium3d like AMD did at some point . I even recall some Intel Linux gpu driver developer that had serious doubts about Gallium3d left Intel , then implemented an ARM SoC GPU driver ( was it for the rpi ? or something else , I do n't remember ) using it as an experiment , and changed his opinion , now favoring Gallium3d . & gt ; They were common . They were on the cover of computer magazines . They were available at trade shows , they came on business cards . Hell , if you did n't live somewhere stuck in dialup hell , they were even mirrored locally by most decent ISPs . Stuck in dialup hell . Bad enough I would n't dare use `` Locally '' and `` ISP '' sparingly like that , in the same sentence . & gt ; I 'm in Australia and they were easily accessible to me from multiple avenues in '98 . Nice . I only learned that Linux existed by reading about it in Amiga magazines imported from the UK . & gt ; Ah , the folly of youth . I bet I look younger than you do though . : P Doubt it ... I recently got asked for id when buying alcohol ... beat that !",Romance,Spanish
3G6A5W338E,linux,"& gt ; I do n't see why Wayland is more standard than Mir or this more `` Linux '' than Ubuntu Phone . KDE is a not-for-profit . Ubuntu is ultimately ruled by Canonical , a company . Mir is something Canonical developed in stealth mode and released treacherously after they had promised to cooperate/use Wayland , and they released it together with a document full of baseless ( wrong claims ) attacks against Wayland .",Romance,Spanish
3G6A5W338E,linux,"& gt ; only geeks like us will be using this . And that 's good . I have no need for `apps` , I just want a system I control and I am comfortable with . Freedom .",Romance,Spanish
3G6A5W338E,linux,"& gt ; KDE developers are you willing to let go of philosophy that you have to implement every single feature in an app ? If you want a minimalist environment with only the essential features and options , there 's plenty of options out there . If KDE became like that , there 'd be no options left ( short of , ahem , starting to work on something like that ) for those like me who do n't like that sort of environment . & gt ; KDE also allows a lot of things to be integrated into core , making it as one of a recent review articles said death by a thousand cuts . KDE 's always been like that , and has survived this far .",Romance,Spanish
3G6A5W338E,linux,"This is very good news . Opus does now rules the audio front , and with h264 effectively free and VP9 available , and considering ? nobody ? is using h265 , now I doubt h265 will ever see adoption of any significance . With the existing codecs we can hold out until Daala .",Romance,Spanish
3G6A5W338E,linux,"& gt ; But my take is that the people this group is going after , aka the content providers and owners , are just going to stick a little bit more to AVC ( H.264 ) and the likes . Or adopt VP9 + OPUS for an improvement . But paying 0.5 % of their gross revenue ? No way .",Romance,Spanish
3G6A5W338E,linux,"& gt ; I really want the VP9 encoder implementation to improve , but there has n't been a release since May . Aware , it really is slow . A shame x265 even exists , but ultimately , unpaid developers do work on whatever they want ...",Romance,Spanish
3G6A5W338E,linux,They 'll sure get a lot of 0.5 % out of that ...,Romance,Spanish
3G6A5W338E,linux,"Honest question here : Why not put effort into making the DE easy to package , so that it can be installed in any distribution , like everybody else is doing ? ( `Elementary` and `Unity` being the two notable exceptions )",Romance,Spanish
3G6A5W338E,linux,dd is a tool to dump block devices or files into block devices or files . It does n't know about files inside block devices .,Romance,Spanish
3G6A5W338E,linux,"& gt ; AMD still wo n't open source the userspace part of the driver ( which is arguably the most important ) AMD has both NDA-free documentation of their hardware and a team of developers working on the open driver . & gt ; Because there is no alterEnglish . After a few years with an AMD GPU , I thankfully do n't think NVidia is the only option anymore . & gt ; you probably have n't noticed how crappy the AMD drivers are because you 're not doing anything GPU intensive , Of course I 'm not shilling NVidia because I 'm not a *true gamer* . This fallacy is called *no true scotsman* , by the way .",Romance,Spanish
3G6A5W338E,linux,"What I do consider current gen AMD is not the rebrands , but the HBM cards .",Romance,Spanish
3G6A5W338E,linux,"& gt ; where you are stuck will lowest common denominator which is not sign saying `` it 's ready '' , at best `` it works '' . Most gamers do n't actually buy the shiniest , beafiest GPUs , but reasonable / cost ones .",Romance,Spanish
3G6A5W338E,linux,"RSS just told me LWN ( $ only , but will be free in a week ) is covering this . https : //lwn.net/Articles/651700/",Romance,Spanish
3G6A5W338E,linux,"Just keep in mind many people who 's interested in BSD systems do n't necessarily prefer the BSD license . e.g . : I 'm personally pro-copyleft and I still track/use BSDs , in addition to Linux .",Romance,Spanish
3G6A5W338E,linux,"& gt ; but now is all mac , and it 's BSDs fault . No , it 's the users fault . For picking non-free software over the fine free alterEnglishs .",Romance,Spanish
3G6A5W338E,linux,"Yeah , I know . Meant to keep readers aware , not to confront you . I see the `BSD user = favors BSD license` mistake made way too often .",Romance,Spanish
3G6A5W338E,linux,"Now , that did n't go so well .",Romance,Spanish
3G6A5W338E,linux,"Just remember that while the Nouveau team does awesome stuff relying on reverse engineering , [ NVidia is still an hostile company ] ( https : //www.reddit.com/r/linux/comments/3c92mr/one_million_new_lines_of_code_hit_linux_kernel/cstp9jk ) . Think whether it 's right to give them money .",Romance,Spanish
3G6A5W338E,linux,"& gt ; I wish people would stop being broken records . The link I gave is a comment written by *myself* , two weeks ago . Nothing written in it has stopped being true as of today .",Romance,Spanish
3G6A5W338E,linux,"`nethack` , if any .",Romance,Spanish
3G6A5W338E,linux,& gt ; it 's hard to tell that to people who argue that the proprietary gives more power though These people are ok with having a cancerous tumor driver running in supervisor mode . They might as well run the NT kernel in supervisor mode .,Romance,Spanish
3G6A5W338E,linux,"& gt ; Linus was hilariously stupid Yeah , Linus has no idea what he 's talking about /s . & gt ; Whereas the truth really is that it 's Nvidia 's continued strong support of Linux through their **binary blobs** Indeed , that 's how to support Linux properly . Oh wait . & gt ; Every one of those boxes were delivered solely with Nvidia GPUs because **the AMD fglrx was not stable enough to deliver a decent gaming experience . ** Highlight here is for unsourced FUD . & gt ; And that is still largely true today . Even more FUD . P.D : I 'm ashamed that I used to believe all this bullshit until I finally gave AMD a chance .",Romance,Spanish
3G6A5W338E,linux,"& gt ; If you link to one comment from Linus I 'm not referencing Linus 's argumentation , I wrote my own . My comment does only link to Linus 's video for Linus 's gesture , and on just the words `` fuck you '' . I have no idea why you 're obsessing over that video . Do you mind pretending I do n't link at it at all thereon ? That 'll be for the better .",Romance,Spanish
3G6A5W338E,linux,"& gt ; As soon as AMD hits quality for gaming , I 'll gladly switch . That 's a dubious statement . Implies that AMD does n't `` hit quality for gaming '' , whatever that means . Also implies NVidia somehow does , whatever that means . I 'm afraid your definition of `quality for gaming` is simply Nvidia and you 'll never accept anything that 's missing the NVidia logo . & gt ; Until then , all my servers are Intel 3/12 , desktops AMD 8/12 and gaming NVidia 1/12 Mind decoding what 3/12 , 8/12 , 1/12 mean here ? I 'm confuzzled . & gt ; AMD on desktop with OSS drivers is pure pleasure , for gaming not so much While I ca n't speak for the newest FPS as I do n't play those ( although I do play `Source Engine` games ) , I have some 300 steam Linux games which I play using the open drivers .",Romance,Spanish
3G6A5W338E,linux,"That 's not so bad actually , when considering it 's comparing prior gen AMD with current gen NVidia ( plus some random older cards for contrast ) . And the cost of all these cards is n't even considered .",Romance,Spanish
3G6A5W338E,linux,"& gt ; Nouveau is actually rewriting those calls from scratch . Good luck doing that anymore , as NVidia has already warned their GPUs will soon only load NVidia-encrypted-and-signed firmware . They 're also pretty infamous for *deliberately* breaking VGA-passthrough situations ( with Xen or KVM ) . Worst case scenario , an AMD GPU 's IO can be contained via IOMMU to only talk to the Free Software driver ... with NVidia , not only that 's not possible , but reversing the firmware wo n't be anymore either . There 's no stopping those cards from doing DMA all over the place at their leisure . Fuck that shit .",Romance,Spanish
3G6A5W338E,linux,"& gt ; But , I simply ca n't afford to cut my development based on missing features Ok , that 's very understandable . Development of future games and playing current games is n't the same thing . Current , released games simply do work on generations of existing hardware and drivers .",Romance,Spanish
3G6A5W338E,linux,"& gt ; you ca n't expect all companies to open source their drivers But it makes no sense to support a company that is hostile like that ( and worse , as explained on my prior comment which I linked above ) when actual alterEnglishs are available . It 's sad there 's so much NVidia fanboyism and repeating of the `AMD drivers suck` mantra that people actually believe there 's no fucking alterEnglish . Hell , I 'm glad I actually gave AMD a try . Turns out , against my low expectations , my ( comparatively short , just a few years ) experience with AMD has actually been better than my ( decade ) experience with NVidia .",Romance,Spanish
3G6A5W338E,linux,"& gt ; Now , if they only pushed on reclocking support ... Goodbye blob . I 'd gladly buy better NVidia card for same perf as my 750Ti and open drivers Or , god forbid , one of those AMD cards . These cards that come with NDA free HW documentation and open drivers written by/with the help of AMD employees .",Romance,Spanish
3G6A5W338E,linuxmasterrace,Disgusting filthy stickers come preattached and disturb cooling .,Romance,Spanish
3G6A5W338E,linux,& gt ; paid $ 3800 for a 386 with 2 MB RAM . wish I 'd bought microsoft stock instead . Or an `Amiga` .,Romance,Spanish
3G6A5W338E,linuxmasterrace,"& gt ; Mach , L3 and L4 are waaaaaay older than Linux . L3 was started in the 80s but did n't get there till mid nineties . Similarly , Mach 3.0 ( the microkernel one ) is 1994-ish , while the relevant release of L4 ( the 107 % one ) is late 90s . The pure µkernel architecture has moved slowly , sure . Minix3 is a current event , not anywhere near usable just a few years ago .",Romance,Spanish
3G6A5W338E,anime,"I must be evil , as I want to see her suffer more . I enjoy seeing people suffer .",Romance,Spanish
3G6A5W338E,anime,I smiled and licked my lips there .,Romance,Spanish
3G6A5W338E,anime,But I run `OpenBSD` : X .,Romance,Spanish
3G6A5W338E,linux,"& gt ; Does it actually have self-healing ? http : //lists.dragonflybsd.org/pipermail/users/2015-March/207578.html & gt ; Really ? From what I 've gleaned from previous BSDNow podcasts , FreeBSD people generally conceded that Dillon had the right idea , and fixed SMP accordingly . Dillon 's approach is to go `multiserver` ( like XNU , Minix , BeOS , AmigaOS and so on ) . FreeBSD 's approach is to go `lock labyrinth` ( like Linux ) . My main concern with Linux is that once the CPU enters the kernel , there 's no telling when it 'll finish , or if it even will even return to userspace at all ; kernel stalls are n't uncommon . BSDs seem to do better somehow , as kernel 's generally structured and order is enforced ; they would n't take layering violations like the one with `ext4 and dm-raid` interactions somehow causing a data loss ( what a pile of hacks ... ) . They also somehow manage to feel more responsive than Linux when using them on a workstation . But they still have the same issue . A multiserver approach forces modularity , which in turn makes the relationships between components become defined , and the nonsense avoided . I cringe when I run latencytop on any random Linux system , leave it a minute or two and typically see latencies over 15ms ( typically filesystem related ... `Tux3` , please hurry it to the kernel somehow ! ) . It 's a shame Matt did n't implement it on top of some generalized message IPC like `Minix3` , but it 's still a major step in the right direction . Dragonfly is making BSD suck less progressively by transitioning from monolithic to hybrid architecture , whereas Minix3 took a more radical approach of rebuilding itself from scratch and with pure µkernel architecture ; They stripped `Minix2` and moved everything to userspace while adapting the system as necessary , so technically it 's not from scratch , but almost .",Romance,Spanish
3G6A5W338E,linux,"I glanced , saw PowerVR garbage , closed the tab .",Romance,Spanish
3G6A5W338E,linux,Tsundere much ?,Romance,Spanish
3G6A5W338E,linux,"& gt ; JFS ? EXT2 ? EXT3 ? None of these see much use . Other than that , JFS performs poorly and is generally overshadowed by XFS , whereas EXT2/3 lack `extents` .",Romance,Spanish
3G6A5W338E,anime,"Loved seeing yukinon cry . 8man was n't so bad either . Yui was nice too , but she 's a crybaby , so it 's not as impacting .",Romance,Spanish
3G6A5W338E,arduino,"Which has been available for as long as I remember . I have no idea why OP sent this , or what the point is on making a duplicate tutorial .",Romance,Spanish
3G6A5W338E,unixporn,"`pearl 8x8` ( from some old unix machine ; the kernel has it ) and `topaz` ( from AmigaOS , there 's two very different looking versions , the one used before WB2.0 and the one used after ) are notably missing .",Romance,Spanish
3G6A5W338E,LinuxCirclejerk,`No manual entry for joke in section 3` .,Romance,Spanish
3G6A5W338E,linuxquestions,"Why do you care about the MBR ? Your Linux system will work regardless of partitioning scheme . Of course , you 'll have to install the bootloader and set up /etc/fstab accordingly , but that 's about it . You can restore your backups on a different HD or HDs , with a different layout , even using different filesystems .",Romance,Spanish
3G6A5W338E,unixporn,"For topaz : http : //www.amiga.org/forums/showthread.php ? t=51009 For pearl 8x8 , sadly , while it 's part of the linux kernel , I have n't found it in X-friendly format . Perhaps it 's easy to convert , but I have no idea ( have n't looked into it ) . Would be nice . Randomly found : http : //www.dreamcodex.com/fonts.php",Romance,Spanish
3G6A5W338E,linux,The cautionary notes are scary ( re : dataloss ) : https : //wiki.archlinux.org/index.php/JFS_Filesystem # Cautionary_notes And the comment `` It has been noted that JFS slows down when working with many files '' .,Romance,Spanish
3G6A5W338E,KotakuInAction,objectified = new LordRaa ( ) ;,Romance,Spanish
3G6A5W338E,anime,They taste like ashtrays . Why would anyone want to kiss them ?,Romance,Spanish
3G6A5W338E,linux,"I knew something was off . I thought it was the number of l characters but it still felt off . I even compared with another source , but my brain apparently was n't working . Thanks for letting me know .",Romance,Spanish
3G6A5W338E,anime,"Damn it , what 's with the extremely enticing and satisfying to press red button .",Romance,Spanish
3G6A5W338E,linux,"& gt ; I would like to point out UFS had a corruption issue just the other week with relationshion to soft updates . ( see FreeBSD 's security mailing list ) Where ? Either I 'm blind , or there 's nothing of the sort for `May` , `April` or even `March` ( overreaching here , as you said it was *just the other week* ) : https : //lists.freebsd.org/pipermail/freebsd-security/ Not that I support `FreeBSD` ... not ever since they kicked `Matt Dillon` . I do side with `Dragonfly` in that conflict . Matt was right back then and continues to be today . Dragonfly is a much better design than FreeBSD is . & gt ; UFS is usually very stable It 's very stable indeed . & gt ; but UFS has had a few problems now and again Seldom . I personally do n't remember any . But with ext4 , btrfs and what not it seems like every other week .",Romance,Spanish
3G6A5W338E,linux,More on this : https : //www.mail-archive.com/linux-kernel @ vger.kernel.org/msg886512.html,Romance,Spanish
3G6A5W338E,linux,I just use `rsync` .,Romance,Spanish
3G6A5W338E,linuxquestions,"Just note that `makemkv` does only copy the streams and mux them into the mkv . It does n't transcode or the like . The mkv is very friendly to players and other software , unlike the DRM-riddled BDs .",Romance,Spanish
3G6A5W338E,linuxquestions,`NetBSD` is also pretty good at driving ancient hardware .,Romance,Spanish
3G6A5W338E,linuxquestions,"If you 're on windows , I recommend `Rufus` .",Romance,Spanish
3G6A5W338E,ireland,"Is n't there an official website , with realtime maps and results ? I 'm having trouble finding it , and I 'm starting to think maybe there 's no such thing at all ?",Romance,Spanish
3G6A5W338E,ireland,Probably done by a more tech-savvy aide .,Romance,Spanish
3G6A5W338E,linux,"& gt ; This week ’ s BSDNow episode talks with Jed Reynolds about ZFS on Linux and FreeBSD , and includes other news bits including about DragonFly ’ s swap encryption , OpenBSD defaulting to having openntpd on by default , and plenty more . ( source : Dragonfly Digest )",Romance,Spanish
3G6A5W338E,ireland,They 're at ... zero ? What the ...,Romance,Spanish
3G6A5W338E,ireland,"This poll is n't `first-past-the-post` , is it ?",Romance,Spanish
3G6A5W338E,ireland,"So with non-official results being all over twitter and people already celebrating the Yes victory , the official results remain at 0 % . This is backwards and makes the whole referendum deal look very non-serious , which as a `Yes` supporter I do n't like .",Romance,Spanish
3G6A5W338E,linux,"Kudos to Arch for reacting this fast . Then again , few distributions are using kernels recent enough to be affected .",Romance,Spanish
3G6A5W338E,LinuxCirclejerk,"My [ OpenBSD ] ( https : //en.wikipedia.org/wiki/OpenBSD ) remains unaffected with its [ UFS2 ] ( https : //en.wikipedia.org/wiki/Unix_File_System ) , featuring [ soft updates ] ( https : //en.wikipedia.org/wiki/Soft_updates ) .",Romance,Spanish
3G6A5W338E,linux,"From the FAQ : & gt ; With a subscriber base of over 150,000 , /r/linux is a generalist subreddit suited to news , guides , questions concerning the GNU/Linux operating system and to a lesser degree , free/open-source in general . BSDs qualify as `Free Software` . Ignoring that , they specifically cover Linux stuff from time to time , like status of ZoL in this instance . Downvoted to hell , but it 's more relevant and interesting than most of the crap that is posted on /r/linux these days .",Romance,Spanish
