29255DaysToGo,politics,"Well , there is some truth there though . Scandals are `` reported '' by the press , and if they do n't run the story , it 's not that public and it wo n't be scandal because people shrug it off as `` not true '' If Trumps `` Grab them by the pussy '' was revealed , but no media outlet picked it up , many would definetly go `` why are they not talking about it , it is a scandal ! `` , but there are also the portion that would go `` if the media do n't report on it and pick it up , it ca n't be that serious or even a scandal ''",Germanic,Norwegian
29255DaysToGo,politics,"& gt ; Sure the DNC made lots of dick moves . Not a Republican or even American here , but putting down arming rebel groups with weapons and funding them as `` dick move '' , is horribly wrong . It 's not a dick move . It 's a fucking horrible mistake that can become a disaster ...",Germanic,Norwegian
29255DaysToGo,politics,"I obviously did n't listen on that , but he did n't mean it in a `` people are stupid and do n't know what is what , until they read the big headline in red text `` SCANDAL '' , and that 's their que to know it 's a scandal '' , did he ? Because that 's what it kinda seems like these days ...",Germanic,Norwegian
29255DaysToGo,youtubehaiku,"What 's more likely , me having a stroke or English not being my English language ?",Germanic,Norwegian
29255DaysToGo,youtubehaiku,It 's a real thing . And I do it each time I burn my tongue and it works every time .,Germanic,Norwegian
29255DaysToGo,soccer,"From their wiki : & gt ; For three years and three months ( June 1986 – September 1989 ) , Steaua counted a number of 104 unbeaten matches in the league , establishing , at that moment , a world record and a European one still standing . & gt ; unbeaten matches in the league So they might have lost a cup game/international match in that time period , but not in the league . OP makes it very clear that his numbers are over all competitions ( which is a lot more difficult )",Germanic,Norwegian
29255DaysToGo,soccer,"I understand the importance of Messi , but people undermine the quality of the rest of your players .",Germanic,Norwegian
29255DaysToGo,bodybuilding,"He was pretty focused and determined with bigger by the day too ? Edited and pumped out those videos . I was n't watching them but they were here every day . And the reason that stopped was because of his health , or else it would be going for even longer . He had a project and worked on it with all his energy , bringing those out . That 's pretty respectable .",Germanic,Norwegian
29255DaysToGo,soccer,"It 's quite interesting to think about . Like , I 'm a guy , so I 've never had some stranger walk up to me and asked me if I would flash my boobs for some quick cash . However , if I did , I do n't know how low my price would be . It 's easy to sit here and say `` hell yea I 'd flash my tits for 20 pounds '' , but then you think about it . Could n't I do better ? If this guy is willing to pay 20 pounds , he surely would do it for 25 too ? And it 's actually quite nice boobs , I wo n't be cheap about it . 30 pounds ? It 's one of the questions one can wonder and never really give oneself an answer , because it 's so distant . But I 'd definetly flash my boobs for 20 pounds .",Germanic,Norwegian
29255DaysToGo,soccer,"My comment was alluding to me being a female , and as a male it 's easy to say `` I would flash my tits all the time for money if I was a female '' , but one need to think about it and when put in the position , might not go for it .",Germanic,Norwegian
29255DaysToGo,DotA2,My chrome is fucked so I ca n't install extensions . And Im too lazy to reinstall it .,Germanic,Norwegian
29255DaysToGo,TabooFX,"I especially loved the scene when he go to Atticus this episode . The little chat they had , showed a different side of his character that we really do n't have touched much on , and Hardy played it perfectly .",Germanic,Norwegian
29255DaysToGo,TabooFX,`` Every single scene '' '' Also what a finale [ scene ] '',Germanic,Norwegian
29255DaysToGo,movies,"I rewatched the theatrical release recently , and there is no doubt in my mind , the theatrical releases are the better movies , and if someone is to watch LOTR for the first time , go with them . However , if you love them , rewatch them in EE , because they are so fucking great if you already loved the original version . But yea , the theatrical releases that dominated the Oscars are the superior version as far as `` quality film '' go , the EE are a bit clunky and weird .",Germanic,Norwegian
29255DaysToGo,soccer,"& gt ; Let 's not forget they were favourites to win the league this year Ehm ... what ? We were thought to be part of the top , but not favorites to win the league ... No body with a brain would put us as main favorites for the league .",Germanic,Norwegian
29255DaysToGo,soccer,Those cup wins sure did help us climb the table ...,Germanic,Norwegian
29255DaysToGo,worldnews,"Well , in 2015 ISIS was on rise , Russia and the US seemed to enter a new cold war , now it seems like they could share bedrooms , and while the EU might be a bit weaker , it 's not fallen apart yet .",Germanic,Norwegian
29255DaysToGo,starcraft,"Whaaat ? TvT is the best ! Late game TvT is , in my opinion , some of the best SC has to offer . Sure , it get stale when the tank lines are established , but when the push comes , or dropships come into play , or the wraith switch happens ... damn it 's just so gooooood . It 's the best mirror match up and just such an interesting match up to look at . The defender is always at an advantage , so the attacker need to win their push with in overly convincing fashion , or else they will get pushed back . I can understand the lack of interest of it , but do yourself a favor and turn into Sea vs . Flash in the finale , it 's worth it even if one do n't favor the match up . I guess you have watched your fair share of Starcraft 1 ? ? ? Not one that came in with SC2 .",Germanic,Norwegian
29255DaysToGo,starcraft,Tastostis too : ),Germanic,Norwegian
29255DaysToGo,starcraft,"Wait , why you say that ? Is it because of it being TvT ?",Germanic,Norwegian
29255DaysToGo,starcraft,"& gt ; You can barely play it , there are no western tournaments that I can think of ( to watch or play ) Huh , I 've had no problems with it . & gt ; horrible graphics WTF are you talking about ? It 's a beautiful looking game , no matter if it has aged . Still prefer it 's look to most RTS coming out . & gt ; playing with friends who have shit rigs that ca n't run any newer rts ... What RTS would that be ? WC3 is pretty good , and maybe SC2 can compare , but if you do n't like either of them , you are stuck with either BW or Age Of empire 2 , both pre-2000 . Few RTS can compare with their quality . & gt ; Stop it . Why stop it ? If it helps BW grow , go for it . SC2 died on it 's own accord . It did n't stay relevant or interesting enough . BW is turning 20 soon , and it 's still being played and discussed and watched . If shitting on SC2 helps BW become mainstream again , go for it I say .",Germanic,Norwegian
29255DaysToGo,soccer,What ? Herrera been like that forever ...,Germanic,Norwegian
29255DaysToGo,soccer,`` One of the sweetest connections '' does n't mean Benteke 's ca n't be better ...,Germanic,Norwegian
29255DaysToGo,starcraft,"Definetly played that out badly . It was n't so much the carriers , as it was the recall . With stasis + those units , the carrier push are so much stronger , because those deal with goliaths so well . However , when he lost that and Sea scouted the carriers , while still having his big tank army , he justs pumped out goliaths like it was no tomorrow . Best also choked on handling those carriers . Usually 6 carriers are too many to even get stopped with goliaths so early , but when he leave them hanging out in the open , it 's just horrible play . The balls on Sea tho to barrack rush in the 5th game . He might have figured he got lucky in game 4 and Best late game would beat him if he even tried ( or maybe he do n't favor late game on Eye of the storm ) , so rushing was the only way he felt he could take the series . Great execution also , Best build pretty much counters it , but it was just the right amount of marines and way of doing it .",Germanic,Norwegian
29255DaysToGo,soccer,"I 'd definetly take a draw here . 1 point and not losing 3 on the rest of the top is huge . I would be , as you mentioned , disappointed if we were right up there in the title race , but as long as the ball is rolling and points keep coming , 1 point is important from someone in the top 4 . It 's really important to show our unbeaten streak is n't only due to poor competition , but the team finding itself . A win however , that 's scary , because then you 'll start thinking `` hey , we can be top 2 this year '' , and it 's true , we would be just 2-3 points behind the rest of the top ( bar Chelsea ) , and that 's quickly develop the mentally that backfires , and the teams form suddenly fall quickly . Even so , I would be incredible happy beating Liverpool and being just 2 points behind them . The real winner however would be Chelsea . They still have a 7 point gap on 2nd , Liverpool win today would mean only 5 ...",Germanic,Norwegian
29255DaysToGo,starcraft,"TvT or TvZ match up in the final . As a big fan of TvT , it 's a win/win , because TvZ is already `` the '' match up , but I have a deep love for TvT . Already very hyped for Flash vs. Jaedong now , today was a great day .",Germanic,Norwegian
29255DaysToGo,starcraft,"Crazy numbers , wonder if Flash vs. Jaedong will bring out more numbers , or if all the people that will be watching that , watched today anyway .",Germanic,Norwegian
29255DaysToGo,starcraft,"After game 2 I was convinced Best was going to take it , he just looked so strong . In game 4 , it was never a thought in my mind that Sea could take it . It seemed however like Best haulted his unit production and spend all his resources on pumping carriers from the 3 stargates he had . It also helped for Sea that he lost ca . none tanks up until that point , so when he scouted the carriers , he just massed goliath production , while already having a big tank army . Best definetly could have taken that if he had played it better , but well done by Sea from holding on and keeping his head cool after seeing that hidden expansion .",Germanic,Norwegian
29255DaysToGo,soccer,"What football has always been about is the honours and the big trophies . People care for the players , but the main thing is winning the trophies in the big leagues and the big cups . People do n't care how much the players make , even less when it 's over in China . And winning the chinese league will never become close to the honour of the winning the established leagues and cups in Europe . & gt ; CL sucks , I 'm tired of the same old Barca vs. PSG , Arsenal vs. Bayern etc every single season . Maybe it do , but most people watch football on a casual level , and for them , PSG/Barca or Arsenal/Bayern is something that happens every 12 month and they do n't care .",Germanic,Norwegian
29255DaysToGo,soccer,"Breaking : 10 Barcelona supporters have reportedly been sent home for taking a break in chanting `` Messi Messi Messi '' throughout the game . The supporter-club is shocked about the behaviour , saying `` We have a proud 100-year tradition in chanting Messi 's name throughout the game to show our support to the club , and it 's shocking how some of our so-called `` supporters '' have disrespected the club '' More at 11 .",Germanic,Norwegian
29255DaysToGo,soccer,"I 've had gold before , I was not impressed . 2/10 , would not flash for .",Germanic,Norwegian
29255DaysToGo,soccer,"I actually have a related story on that , which happened just a few days ago . So I 've saw this chick over at a nsfw sub , which had a decent body . In the comments her official snap was posted , so I tought `` I 'll have a go , see if something of use is on it '' This was a couple of months ago . Surely it was , and it was actually a very funny snap to follow too . Turns out the girl is like an escort and had some sugar daddy ( or daddies ? ) somewhere , and traveled around the world , she being in Asia at the time . She talked about doing sexual favors for thousands of bucks and so , so she was like , living a comfortable and rather fun life , as she traveled around and smoked weed etc . most of her days , as well as having a decent following on snap where she posted casually her being naked in bath or in her bed or in her room and so on . Nothing sexual acts . Last week ( and I think this ? ) she is at one of her `` sugar daddies '' place , and it 's incredible beautiful , and her and one more girl is staying in this great place , having time of their life , eating comfortable , helicopter ride etc . I have only seen the mans hands , and it turned out he would be 60-70 years probably . But hey , she was having a blast it seemed . You might be wondering , `` Why is this nutsack going on about this , what has it to do with the comment he is replying too '' Well , hear now . Couple of days ago I would say , I check her snap story . She 's talking about everything being fucked . Turns out , some mother of a young teenage boy had seen her story , as the boy followed her snap . And this bitch contacted the girls mother . Mother ( and seemingly family ) was clueless to her lifestyle . And she was taking it rough , as her parents found out , saying it was fucked , but `` sorry mom , but I dont want to work at a starbucks making shit all '' So she got hit with reality , and as you said , `` paid the social cost '' , but checking her snap afterwards , she seems like she 's taking it alright . Still , ca n't believe someone ( the mother telling ) felt like she could contact this girls parents over what she was doing , because her little shit of a son was following her snap ... And it was n't that bad either , she was just casually naked mostly . It was n't porn . More like , an advert for her , as she most likely had met some of these `` sugar daddies '' through snap .",Germanic,Norwegian
29255DaysToGo,soccer,"PC because it 's multipurpous PS for the PS exclusive , Xbox for the Xbox exclusive . That being said , I 've never owned a consoll , nor a gaming PC in my life , so idk .",Germanic,Norwegian
29255DaysToGo,bodybuilding,"I would imagine being a short person and then have a big , big size would be a pain in the ass . Imaging finding a nice shirt , and you having to have small or extra small to fit it in lenght , but then your arms/lats are way too big . I 'm not that big but my height require me to use medium , but medium cloths are just a tad bit small for my size ... OP must be living a clothing nightmare .",Germanic,Norwegian
29255DaysToGo,starcraft,"Return of Starleague would be amazing . I remember watching the Jangbi vs. Fantasy finals live , the only one I got to because I was young at the time and did n't know what livestreams even was . But if we could get a new one this year , I would be so happy .",Germanic,Norwegian
29255DaysToGo,starcraft,"Sc1 holding sc1 back ? You have any idea how big it was ? How it created esport ? Is it a game that has gone well and beyond , its Sc1 . You kid yourself if you view SC2 as a game released in 2015 ... Sc1 was still going strong in korea and only stopped because sc2 was out and people thought it was time to switch . Sc1 never became so big outside of korea because things like streaming wasnt a big thing , and there was not any foreigners at the level of the koreans . Sc1 was never holding itself back , it grew and grew to the biggest thing in gaming , and it was stopped with the release of its sucessor , which lived on the starcraft name and was a great game . You can watch and cherrish sc2 as much as you want . The problem is that fewer and fewer want to play and watch it . If you had ever put as much time into sc1 as ive and so many others have , you would understand why we want it to come back . Ive played a lot of sc2 too . I was a lot better at it than ive ever been at sc1 . I would still prefer sc1 any day of the week . Trust us that had poured time into both . We dont try to be superior or kill sc2 . We just want the big return of the greatest game ever . Lol and dota can work at the same time because they have so big player bases . But there is still a competition in catching the viewers and attention in the players . I played both , poured almlst 2k hours into dota 2 and ca . 500 into lol . If it wasnt for my friends , i would be dota exclusivly . Because switching between both and being good at both doesnt work . Moba is just lucky enough to have enough people interested . And they compete for being the biggest . Why do you think valve threw 1.6 million dollars as the prize pool for its very first tournament ? ? ? Overwatch and CS dont compete anymore than FIFA and COD would . They are way way different , and if you dont think so , you havent played both .",Germanic,Norwegian
29255DaysToGo,starcraft,I 'm loving every single one of the new viewers getting into this . I 've been watching Brood war half my life . It getting a revival makes me so happy .,Germanic,Norwegian
29255DaysToGo,starcraft,"Brood war is one of the greatest games ever , if not `` the '' It 's incredible fun to watch and see people play . When one has played brood war oneself , its just makes it all so much more impressing . It 's such a mechanical difficult game compared to new RTS . They were n't kind to people 20 years back . Such a fucking hard game .",Germanic,Norwegian
29255DaysToGo,politics,"... that 's what I 'm saying . He 's not getting pissed off from the `` small hands '' , he gets pissed off by being parodied . But he gets even more mad when the press or people say something that he has not addressed to his supporters . He has addressed his `` small hands '' to his supporters , so he believes they do n't care what `` the liberals '' say about them . But if someone take up something he has not said his thoughts about , that 's when his twittering and ranting starts . See with this case . Trump had to get a person to come out and address to everyone that many many people met up . Because he think his supporters need to hear it to stand by him .",Germanic,Norwegian
29255DaysToGo,starcraft,"Both ASLs have been great . And now we have some of the greatest esports players ever playing Brood war and participating in the tournaments , streaming daily . Brood war still got a place in this world , and everyone should join in !",Germanic,Norwegian
29255DaysToGo,starcraft,"Sea played insanely good , and took his first game off Flash ever . Well deserved 2nd place , beating Best and Bisu in the knockouts . Both players gave us a great finale ! Ca n't wait for S3 !",Germanic,Norwegian
29255DaysToGo,starcraft,"MODS , FLASH FLAIR WHEN ?",Germanic,Norwegian
29255DaysToGo,starcraft,FLASH FANS GATHER ! THE BONJWA RETURNS !,Germanic,Norwegian
29255DaysToGo,starcraft,FLASH BONJWA !,Germanic,Norwegian
29255DaysToGo,starcraft,notgayDragon with the perfect call of the match ? ? ? ?,Germanic,Norwegian
29255DaysToGo,starcraft,Flash scouting the starport ... holy shit .,Germanic,Norwegian
29255DaysToGo,starcraft,"Easy there , fellow . It 's been an incredible series . But far from best of all time ... Game 1 and 3 was n't good enough to make it one , and those game were still great ! But best BW series of all time ? Too many to choose from .",Germanic,Norwegian
29255DaysToGo,starcraft,TvT with mass dropships is the most crazy thing possible on a players stamina . So many units will be lost and it wont be a big matter ...,Germanic,Norwegian
29255DaysToGo,politics,"What they need it is to come up with something Trump has n't convinced his based is false . When people first started saying `` Trump has small hands '' , he came out and told his supporters it 's a lie . They believe its a lie too now . So Trump stops caring . Attack him with something he have n't convinced his main followers being a lie , and then you will see the true outrage and stupid defense . Saying he has small hands several months later than the first does n't work anymore , Trump is convinced anyone that matters believe its a lie .",Germanic,Norwegian
29255DaysToGo,starcraft,A battlecruiser TvT is always a great game !,Germanic,Norwegian
29255DaysToGo,starcraft,Omg flash is doing it ? ? ? ? ? That smile from Sea tho as Flash won the fight ...,Germanic,Norwegian
29255DaysToGo,starcraft,Battlecruiser operational !,Germanic,Norwegian
29255DaysToGo,starcraft,"Sea has the sickest mine-laying skills , just so damn good . And that I mean ! Laying mines with vultures in BW is such a pain , and microing 6 vultures to do so around units is amazing .",Germanic,Norwegian
29255DaysToGo,starcraft,"Kami sama ? He 's Korean , not japanese lol I think they had a Korean sign for Flash God , but cant remember where to find it .",Germanic,Norwegian
29255DaysToGo,starcraft,"What 's more sad ? Me commenting multiple comments and having fun , or you taking using time commenting on it ? e : Oh , and the english streams listed at TL has 42k viewers ... I guess more people care about Brood war these days than SC2 ... Especially if you add the korean numbers .",Germanic,Norwegian
29255DaysToGo,starcraft,42k watchers on english twitch and afreeca stream . Definetly having the hype !,Germanic,Norwegian
29255DaysToGo,starcraft,"Funny thing , Flash was streaming friday , and he took a break from playing . What he did was watching other peoples stream . I think it was Best 's stream he joined in , and was watching Best , watching a female afreeca streamer . It was hilarious to watch ! Seemed like flash and best are good friends .",Germanic,Norwegian
29255DaysToGo,starcraft,"It 's really hard to pick up , however , it 's really fun too . Getting good at it is incredible fun to try , but I think the most important is trying to have some fun rather than trying to become incredible good . But it 's overall one of the hardest and biggest skill cap between players that have played for a short time and a long time . Install and play the campaign , it 's worth the fun it brings .",Germanic,Norwegian
user,subreddit,post,family,lang
0x424242,Cricket,"They do n't have to scout overseas . Plenty of cricket is happening in ( universities around ) Texas , I 'm sure they can form several teams just by contracting Indian ( Subcontinental ? ) Students out of Universities .",Germanic,Swedish
0x424242,india,"Well , in TN Higher Secondary Boards , there are a select set of schools , the usual suspects ( S.V Mandhir , SRV , SKV , DAV ) that get State Ranks . I studied at S.V Mandhir , almost a Decade back , and trust me I know how these schools work . They start teaching 12th right from your 11th grade . School hours are 7:00 to 20:00 ; If you 're in hostel then your hours are 4:00 to 22:00 . So , yeah . I could say with confidence that you ca n't buy your way out to get state ranks . If your goal is only to pass , then you do n't need to do shit . Just make sure you answer all the questions with ( BS ) answers . You 're good to go .",Germanic,Swedish
0x424242,india,Why does it have to be fishy ? Perhaps it might come off as a surprise to people who are n't from TN . But there are a bunch of schools in TN where everyone scores really well . Check this [ one ] ( https : //results.reportbee.com/2016/tn/12/school/34KGI425 ) out . Consistent 90 % + school average for the last 7 years . It is very common to see 20-30 students from this school every year in each of the state 's top 5 Engineering colleges .,Germanic,Swedish
0x424242,india,"90 percent average is on their total score , which includes language papers . Engineering Cut-Off for the state 's best college ( College of Engineering , Guindy ) are CS - 199/200 , ECE - 199.25/200 , EEE - 198.75/200 , Medical Cutoff for Government Colleges in TN is 198.25/200 , which as you see are all above SRCC 's 99 . Appreciate the sarcasm . Perhaps I was n't clear enough . I do n't think them of as genius either . They just know how to score marks in their higher secondary boards without cheating . They spend 18 hours a day for over 2 years reading the same books . They get slut shamed if their cut-off in the billion mock exams which happens throughout a year is less than 190 . So , yeah , more than 50 in a school scoring 99 % ( 198 ) cutoff is not a huge surprise . It has been happening for years . So , you claiming it to be 'fishy ' based on your 'instincts ' is too 'Donald Trump-esque ' and not fair to the students , though they had spent 2 years doing meaningless shit .",Germanic,Swedish
0x424242,india,"I totally agree that TN board is rather shitty with the syllabus . And I agree it is unfair for students from other boards or CBSE . I appreciate if SRCC , or even TN Engineering colleges start conducting entrance examiniations , so that it can be a fair game . What I do n't agree with is you citing the school average/cutoff to indicate that the school as a whole is cheating to achieve the results , as in Bihar .",Germanic,Swedish
0x424242,india,"26 , I write code for a large fridge sized device that carries all your 2/3/4G Mobile Data .",Germanic,Swedish
0x424242,india,"Swedish - I 'm better at Reading , average at listening , and below average at speaking . I did n't put much of an effort to learn the language actually . It just came through automatically , since I 've lived here for a while now .",Germanic,Swedish
0x424242,india,"Umm . Are you implying that the majority that commented in this thread are using torrents to download linux distros , rather than pirate movies ? I do n't think so .",Germanic,Swedish
