1980sumthing,freedomearth,"I hope to build a roadlegal beach buggy driven by solar panels one day . Ive even looked at parts . I work from home . My issue is practically the only business I could start at the moment is about computers so many of the projects I intend to do will require many computers turned on 24/7 and Im not so sure about the effects on the world and environment , and karma for that matter . Thats why I ask so many people what they think about electronics and computers and having computers running 24/7 to provide for the service . Unfulfilled expectations and deliberate distancing from other expectations of me put me in my todays position , and the stubburnness of doing things my own way and fixing up the place I live in . And I have the stubburnness of trying to come up with a money making scheme before I allow myself to any vacation . You are welcome to go for a ride in my 4runner if I ever get one , but the catch is you have to probably take a flight half way around the world first : )",Turkic,Turkish
1980sumthing,Turkey,cleopatra beach side,Turkic,Turkish
1980sumthing,mildlyinteresting,That would be quantum physics,Turkic,Turkish
1980sumthing,Turkey,iyi ufo videoları https : //www.youtube.com/watch ? v=mG-OuYOlXPM https : //www.youtube.com/watch ? v=uZxrHgPdx3o https : //www.youtube.com/watch ? v=qYKXV-lA5tY,Turkic,Turkish
1980sumthing,Psychonaut,wow,Turkic,Turkish
1980sumthing,answers,remind me in 5 days .,Turkic,Turkish
1980sumthing,freedomearth,"I want to drive around in a car , I want to spend hours on a jetski on the open sea I do n't have a car or a jetski .",Turkic,Turkish
1980sumthing,uncensorednews,democracy involves protests you wankers,Turkic,Turkish
1980sumthing,freedomearth,how about this https : //www.youtube.com/watch ? v=SIaFtAKnqBU,Turkic,Turkish
1980sumthing,Showerthoughts,"all of your major websites have built in flaws that deliberately removes your access to all information . many of them have filter bubbles , facebook does not sort groups , you can not search in your or your friends newsfeed , you can not even browse it without clicking next page all the time",Turkic,Turkish
1980sumthing,woahdude,"I wan na fill a canyon with plastic balls and jump into it , it may take a few days to get out though..",Turkic,Turkish
1980sumthing,answers,put the hose so it can deposit the water directly outside and forget about it then post here again after one month .,Turkic,Turkish
1980sumthing,CosmicDisclosure,you can find his torrent on concen.org,Turkic,Turkish
1980sumthing,answers,do you know any names of people who did it ?,Turkic,Turkish
1980sumthing,answers,It would imply that there could be color film from before the color film era . And the synchronisation would only be needed to be done during the color film era . Im wondering if anyone had foresight and shot any publicly available film before even rgb film was invented .,Turkic,Turkish
1980sumthing,answers,you would have three reels of black and white film that you can put together many years later . Does it make sense now ?,Turkic,Turkish
1980sumthing,answers,"someone who has foresight , and it is much simpler using computers today to do it for example .",Turkic,Turkish
1980sumthing,woahdude,1. all the balls 2. by scooters 3 . 5000,Turkic,Turkish
1980sumthing,alcohol,45 % vol,Turkic,Turkish
1980sumthing,Gnostic,"What do you mean , the same story is mentioned in two places , in one of them the being is omitted .",Turkic,Turkish
1980sumthing,Gnostic,"Halls version has many other details that are not in the other book , why would you think that I would think I have done enough digging into Hermes ?",Turkic,Turkish
1980sumthing,Psychonaut,"could the meaning of life simply be to experience , I have read and heard and thought it so much that it has flown over my head , could it be ?",Turkic,Turkish
1980sumthing,answers,10 feet higher wall,Turkic,Turkish
1980sumthing,videos,add to /r/upliftingnews : ),Turkic,Turkish
1980sumthing,Turkey,"ironically neither is erdogan a turk , nor are the others secular , nor is it the secular people of tsk at the helm of the coup .",Turkic,Turkish
1980sumthing,DIY,Im designing a car this size in my head but Im thinking of even removing shocks in front because it would make the design so much simpler..,Turkic,Turkish
1980sumthing,gifs,40 feet in the yt comments .,Turkic,Turkish
1980sumthing,perfectloops,Ow trying to read that hurt my brai CRC Error .,Turkic,Turkish
1980sumthing,techsupportgore,Your old headset is tarded .,Turkic,Turkish
1980sumthing,freedomearth,"I rarely get any of this , just one clicked .",Turkic,Turkish
1980sumthing,mildlyinteresting,"almost exactly 30 % discount 9,5-6,66 = 2.84 2.84/9,5 = 0.2989 .70 * 9.5 = 6.65",Turkic,Turkish
1980sumthing,EDM,square wave groove also check out : r/bandnames,Turkic,Turkish
1980sumthing,movies,My netflix has all 3 matrix movies .,Turkic,Turkish
1980sumthing,translation,"What do you mean ? He seems to be saying he talks with representatives from other planets , is this a metaphor ?",Turkic,Turkish
1980sumthing,Dreams,"some foods have mono amino oxidase inhibitors , preventing breakdown of dmt precursor materials in the stomach that normally is broken down by some food , it increases the dmt output of the brain when sleeping.. or something .",Turkic,Turkish
1980sumthing,answers,Run SupaHotSackboy ! Run !,Turkic,Turkish
1980sumthing,uncensorednews,In other news : they were suspected informants .,Turkic,Turkish
1980sumthing,answers,Are you one of the regular downvoters ?,Turkic,Turkish
1980sumthing,answers,"4 downvoters removing the interest shown by 4 upvoters on the last post does not help . Downvoting does not contribute , I am here to get an answer .",Turkic,Turkish
1980sumthing,freedomearth,"Does the season 1-3 torrents work for you ? No download for me , could you pm me the magnet links ?",Turkic,Turkish
1980sumthing,freedomearth,Where are the links you say ?,Turkic,Turkish
1980sumthing,gifs,Reminds me of Dune.. With water instead of sand..,Turkic,Turkish
1980sumthing,GetMotivated,Nootropics gingko omega3,Turkic,Turkish
1980sumthing,Futurology,"Where can I find numbers on a vertical farm ? area , profitability , cost etc .",Turkic,Turkish
1980sumthing,Turkey,"Well , I think Turks should be able to chitchat here .",Turkic,Turkish
1980sumthing,CosmicDisclosure,for real ? ?,Turkic,Turkish
1980sumthing,answers,Do you know this for sure ? Lower density does normally not mean large surface area .,Turkic,Turkish
1980sumthing,answers,thanx,Turkic,Turkish
1980sumthing,answers,Im hoping to find a site that groups articles under a specific current topic/ headline .,Turkic,Turkish
1980sumthing,Turkey,Where do you recommend that Turks post things ? edit : **IN TURKISH** ?,Turkic,Turkish
1980sumthing,freedomearth,14 episodes are available as torrents on the website I shared here the other day .,Turkic,Turkish
1980sumthing,freedomearth,"Aha ok , but are the cosmic disclosure and secret space program videos the same ? There are these 14 secret space program videos with Corey G .",Turkic,Turkish
1980sumthing,Turkey,have you any knowledge about how other countries ' subs work ? for example /r/Sweden ?,Turkic,Turkish
1980sumthing,translation,Which may be incorrect .,Turkic,Turkish
1980sumthing,Turkey,"Similarly /r/Turkey is for the Turkish audience , and whoever is Turkish may post whatever he or she wants in */r/Turkey , while following the rules . The previous guy saying only news and *discussions about Turkey ~~politics~~ are allowed is totally oblivious .",Turkic,Turkish
1980sumthing,translation,He actually says he has spoken with representatives from other planets ?,Turkic,Turkish
1980sumthing,Turkey,I meant Turkey . the person starting this thread claimed /r/Turkey was supposed to be all about news and politics .,Turkic,Turkish
1980sumthing,translation,very interesting thanks .,Turkic,Turkish
1980sumthing,Turkey,"my bad , news and discussions about Turkey But in turkish it says Bu subreddit Türkiye ile ilgili haber ve sohbet ortamıdır . and OP was doing sohbet .",Turkic,Turkish
1980sumthing,Turkey,"It is my primary language , it can be interpreted in two ways , chitchat about Turkey or just chitchat . Where else would Turks go to chitchat ? which is quite normal in many countries ' subs . Disregard the previous errors Im drinking .",Turkic,Turkish
1980sumthing,Turkey,There should just be another flair 'chitchat ' for it . It is quite a normal thing to have chitchat on the sub .,Turkic,Turkish
1980sumthing,Turkey,"many dislike turks , it makes no difference if its erdogan or others , erdogan is used as a reason for bashing turks .",Turkic,Turkish
1980sumthing,Turkey,And then they want visafree entry . The Europeans possibly already knew about this move .,Turkic,Turkish
1980sumthing,Psychonaut,"The new world order is your amenities in your house , your AC , your dishwasher , your method of transportation , your soap and deodorant , your sewage system , your packaged food , your bank cards , your laundry detergents , your access to information , your lawmaking processes , your media and much more you think are the norm . Without them humans would possibly not be what it is today . And these material things is what keeps you here . Without them you may find liberation , and with them you live the human experience . Without them you enter chaos . That is my take on things . This view has gone through many eras of evolution .",Turkic,Turkish
1980sumthing,alcohol,Once after 6 jaegermeisters I had headache for 2 days . Drink water .,Turkic,Turkish
1980sumthing,Turkey,"they watch turkish tv , mostly no internet , no foreign press , there are very few public libraries , very few are reading books or newspapers or mags .",Turkic,Turkish
1980sumthing,Turkey,instead of this we should have expulsion from citizenship and remove free travel between cities for some .,Turkic,Turkish
1980sumthing,Turkey,show me the law .,Turkic,Turkish
1980sumthing,Showerthoughts,because energy storage,Turkic,Turkish
1980sumthing,interestingasfuck,The building on the right is something that is very impressive never seen such a design beyond concept renderings .,Turkic,Turkish
1980sumthing,solipsism,Your taste in music can improve with MY songs,Turkic,Turkish
1980sumthing,outrun,how is life there ?,Turkic,Turkish
1980sumthing,Turkey,Turkish techno .,Turkic,Turkish
1980sumthing,Turkey,"RTE is not a Turk , we should ally ourselves with our relatives the Turkic people of the vast steppes of central asia . And with whomever calls themselves Turk . And also clean our Turkey from unneccessary people of various origins , ( not everyone but those unfit for society ) put them in the northeastern or southeastern corner of the land .",Turkic,Turkish
1980sumthing,Turkey,"with whom should Turkey cooperate ? no 'Turkish states ' option , this is either on purpose or the people arranging this have no clue of Turkish mindset .",Turkic,Turkish
1980sumthing,DIY,could you provide details of front suspension / steering mechanism ?,Turkic,Turkish
1980sumthing,AskReddit,What was the plan ?,Turkic,Turkish
1980sumthing,AskEngineers,"From below yes , if the object is also 2 tonnes and not attached to the ground , if it is attached to the ground with something stronger than 2 tonnes , it would be trying to lift more than 2 tonnes , If it doesnt break then yes 2 tonnes .",Turkic,Turkish
1980sumthing,Turkey,"well thank you , I guess .",Turkic,Turkish
1980sumthing,Turkey,"The 20-30 explosions from airplanes on friday were no bombs , they were sonic booms from the airplanes themselves , why ? The 'bomb ' that hit the parking lot of the presidential palace did not cause any visible damage to the ground . I believe ankara has many anti air installations they were not used . Everytime someone brings up some real arguments against the current government , the next day some shit happens . Previous time , it was kilicdaroglu asking questions about işid , the next day airport attacks so many topics are waiting to be answered the last time this happened http : //www.sozcu.com.tr/2016/gundem/emine-erdoganin-alisveris-tutari-147-bin-tl-degilmis-1312952/ Although the dialogues between the police and one officer said just you are the dogs of ... . Another result of the attacks is the comment mechanism of some newspaper sites have been removed . Some of which connect the dots of the above two things .",Turkic,Turkish
1980sumthing,electricvehicles,Im fuckin tired of EV concepts . Sell me a kit and Ill build my own fuckin car .,Turkic,Turkish
1980sumthing,Turkey,"Nevermind that , but we should ask for a military base .",Turkic,Turkish
1980sumthing,Turkey,Airplane presumably . What kind of bomb leaves the ground unscratched ?,Turkic,Turkish
1980sumthing,answers,"actually , a site that would follow ordinary sites even those without rss feeds .",Turkic,Turkish
1980sumthing,todayilearned,Someone should get you up to date about what Jesus said about being God in the bible .,Turkic,Turkish
1980sumthing,todayilearned,"Those are metaphors , there are also other specific verses negating people claiming Jesus is God .",Turkic,Turkish
1980sumthing,Dreams,"God says you need to see over your business practices in real life , you need to be promoted and fix the company .",Turkic,Turkish
1980sumthing,AskReddit,"Create a country somewhere and let peaceful muslims who want a simple lifestly live there without weapons and without influence from the dictators of the current era who try to balance their own modern luxurious lifestyles with fatwas and ideas of proper islamic living . They create in this process the chaotic ( unislamic ) dirty ( unislamic ) countries without democracy ( unislamic ) where police and political leaders ( unislamic ) and a controlled clergy ( unislamic ) tries to impose ideas and ways ( unislamic ) on the masses through mass media . Let the original islam flourish somewhere in the world without violence and weapons under the observation of whoever wants to *observe it . The problem is neither western countries nor the administrations of current islamic countries would want this . The former because of whatever reasons , the latter because they will loose control . And that control has been given and is supported by the western countries . The amish can have a country that is a neighbor to them , Im sure they will get a long well . I think that for a long time , the world has not seen a proper islamic country with the intended moderate lifestyle . ( though 1-2 countries may be exceptions )",Turkic,Turkish
1980sumthing,Turkey,"The islam provided by dictators is not islam , islam provided by secular dictators is not islam either . Islam is for the thinking people , it has no clergy , no countries , no ruling class and no kingship . Real islamic countries are few in the world , the rest are dictatorships mostly of whom live in luxury provided by western money and security provided by western weapons . An islamic country would be an ideal country if it wasnt for mindless masses who do and obey what dictators and clergy tell them , and they are too powerless to complain about their situation , they all try to balance modern living and amenities in dictatorships with the ideas of islam of which most muslims deem unimportant , while they are the most important parts of the religion . Atatürk secularism could very well be the foundation of an ideal muslim country , if people could see what it and islam really is . When the individual disregards the commanments , 'believe and do good ' they falter . No matter who they are . It could very well be that these military trying to make a coup did it with pure purposes , because a large part of the muslim population are not given the means and opportunity to think for themselves , many are blind and grownups with the minds of children . Downvote away , I dont give a fuck . On the other hand you cant control a country with 400 men without other support . Most of the explosions in Ankara were sonic booms , and if they had real bombs why did they leave the presidential palace untouched ? The president does not like democracy that is why he has said 'democracy is the means not the goal ' and that is why he and his party supports the focus on his persona . Because one man power structure is easier to control , and he himself , not being a Turk is being guided by others . And he himself probably thinks kings and khalifas of other countries are rightful heirs to the religion , while there is no such thing . The khalifas of the world are the believers . There is no kingship or dictatorships in islam .",Turkic,Turkish
1980sumthing,AskReddit,portable apps ? geany,Turkic,Turkish
1980sumthing,Turkey,What would be the # 1 target if a small group of soldiers started a REAL coup ? I 'm just saying.. ( the palace ),Turkic,Turkish
1980sumthing,Psychonaut,Did it fix the ocd ?,Turkic,Turkish
1980sumthing,funny,"this one is 2 mins longer and has the answers from the girl , which the other does n't .",Turkic,Turkish
1980sumthing,FringeTheory,this site = broken,Turkic,Turkish
1980sumthing,FringeTheory,broken link,Turkic,Turkish
1980sumthing,india,shiit they are still after a 'business model ' and do n't publish the design plans ? !,Turkic,Turkish
1980sumthing,Turkey,"Here is the bombing of the parking lot of the presidential palace , 5 killed , is there any damage to the road that I ca n't see ? http : //www.sozcu.com.tr/2016/gundem/utanc-gecesinden-kan-donduran-goruntuler-1320624/",Turkic,Turkish
1980sumthing,science,Why is the phenomenon that observers change the quantum.. thing ( the famous experiment ) not investigated further ? does this not mean that our mind affects the outcome of events ? And perhaps that something goes out of our eyes rather than only in ?,Turkic,Turkish
1980sumthing,Turkey,"It is written in the news that the fighter planes dropped the bomb . No other information is available to the public at the moment . Additionally , the 15-20 explosions the people in Ankara heard on friday night were not bombs , but sonic booms from the airplanes themselves .",Turkic,Turkish
1980sumthing,Turkey,custom made from kırtasiye,Turkic,Turkish
1980sumthing,alcohol,with a coke or orange juice or redbull sometimes with a sparkling mineral water next to it,Turkic,Turkish
1980sumthing,vandwellers,"human architects are just humans , it doesnt mean they have much better imagination or creativity . Ive seen much better van designs by others . The title is clickbait for normal people I think .",Turkic,Turkish
1980sumthing,AskReddit,obligatory LSD festivals in futuristic environments .,Turkic,Turkish
1980sumthing,answers,"There are websites that generate information based on input , just one script can have infinite response pages based on clicks on each page , these are considered to be each unique normal web pages with normal links to another iteration . They may not provide any new usable information for search engines , but they exist , the solution for such websites is to ignore any new pages . I am pretty sure the websites indexed are occasionally limited to a number , for practical purposes . Another option is that websites are not registered on any search engine , and no links are provided to it from other websites . Any website that wants to be found would register itself on a search engine .",Turkic,Turkish
1980sumthing,HistoryPorn,"No , the people dressed better in the past in my opinion .",Turkic,Turkish
1980sumthing,EDM,You did n't add Blümchen or Dune .,Turkic,Turkish
1980sumthing,EDM,Am I a minority to think these are not Dance music songs ? Also I think these are not 'happy ' but many of them are melancholic . Here is happy dance music : Blümchen - Blaue Augen https : //www.youtube.com/watch ? v=mE4PZcUfiwE Blümchen - Heute ist mein tag https : //www.youtube.com/watch ? v=QXay1pdfQpI Scooter - The logical song https : //www.youtube.com/watch ? v=4YxTa1AUqps Dune - Rainbow to the stars https : //www.youtube.com/watch ? v=dsd5F_YEzJQ Dune - Ca n't stop raving remix https : //www.youtube.com/watch ? v=5KJ__06kyxs Sash - Ecuador https : //www.youtube.com/watch ? v=44t3xc_XDes ATB - Rush ( not on yt ) N-Trance - Set you free https : //www.youtube.com/watch ? v=18W9WYw9HaA,Turkic,Turkish
1980sumthing,worldnews,Foreigners seem to know more about Turkey than Turkish people living there ...,Turkic,Turkish
1980sumthing,worldnews,Why `` Turkified Greeks '' if there was many nations before that ? and not `` Turkified Hittites '' ?,Turkic,Turkish
1980sumthing,EDM,Also Moby - Feeling so real https : //www.youtube.com/watch ? v=iAFTLaNo7Ag,Turkic,Turkish
1980sumthing,freedomearth,uploaded : october 2009 ... . change is coming ! !,Turkic,Turkish
1980sumthing,AskEngineers,"I had calculated that if all humans were vegans , meaning they would require 600 m2 for food production , ( vegetarians and meat eaters required 1400 m2 and 2000+ something m2 if I recall correctly ) we would all fit in Australia , every human having a plot of land the size of 1000 m2 for vegans and so on . The problem with big cities is that transportation of necessities and such become increasingly wasteful the bigger the city gets , because the transportation of food from outside the city becomes a large burden , including the energy required for refrigeration of food products . A large concrete area , in worst case scenario also creates increasingly large distances from oxygen producing vegetation . Increasingly large centralized production of food water and electricity creates an incremental increase for the need for maintenance.of the facilities . My idea of an ideal symmetric and low waste structure of the living spaces of humans is that small city-villages are created , each village houses 100-1000 people and produces it 's own electricity , water from wells and food , each village has a large amount of land around it 's central village that is used to primarily support the needs of the people in the village . Each village has a simple solar powered transportation system connecting it to other villages .",Turkic,Turkish
1980sumthing,matrix,If the entire bottom part is a letter : change Thought - & gt ; Though .,Turkic,Turkish
1980sumthing,funny,"If high enough speed the front wheels may have had only a really hard slam and then continued . If the front crashed into the hole , I do n't see how it would continue over the front wheels .",Turkic,Turkish
1980sumthing,everymanshouldknow,or just goggles.. and a chewing gum,Turkic,Turkish
1980sumthing,Gnostic,"It is also important where , how and with whom you do it .",Turkic,Turkish
1980sumthing,ifyoulikeblank,"Yes very nice music , try this https : //www.youtube.com/watch ? v=I9XkdAB2FA4",Turkic,Turkish
1980sumthing,Turkey,Not being able to handle demand does not make you go bankrupt unless you do something wrong .,Turkic,Turkish
1980sumthing,ifyoulikeblank,ATB has some very nice slow songs try this https : //www.youtube.com/watch ? v=gc5FIGh2_RU https : //www.youtube.com/watch ? v=0T8-k_g18b8,Turkic,Turkish
1980sumthing,answers,"Yes , this seem plausible , thanks . Although my internet connection is not that underpowered , it is a standard home adsl 8/1 connection .",Turkic,Turkish
1980sumthing,AskEngineers,Could I connect a propeller directly to the axle without additional gears you think ? ( and make it fly ),Turkic,Turkish
1980sumthing,Turkey,"first seasons , before they started dubbing Abdulhey with a annoying voice , slowly after time the episodes started becoming more and more boring .",Turkic,Turkish
1980sumthing,Turkey,"first first 2 seasons were best , I have n't watched the latest seasons much .",Turkic,Turkish
1980sumthing,Turkey,"That we are either for or against someone . We are individual free thinkers . It is when you are forced to think in duality that you take definitive sides , which is not needed or expected by free thinkers .",Turkic,Turkish
1980sumthing,answers,I 'm expecting something beyond a chemical explanation .,Turkic,Turkish
1980sumthing,AskEngineers,I was thinking of in terms of torque and such aspects .,Turkic,Turkish
1980sumthing,answers,"energetically , radiation . ~~and sheeet~~",Turkic,Turkish
1980sumthing,answers,"Hi YMK1234 I was thinking there should be something different between the two energicallly , beyond chemical . Inside the water .",Turkic,Turkish
1980sumthing,worldnews,ok got it,Turkic,Turkish
1980sumthing,worldnews,ok got it,Turkic,Turkish
1980sumthing,answers,"YMK1234 you occasionally give the impression that you are decent human . You need to expand the borders of your mind , this is n't esoteric , I am asking for some advanced scientific answer .",Turkic,Turkish
1980sumthing,answers,"I know temperature would rise , I 'm thinking background radiation or similar .",Turkic,Turkish
1980sumthing,answers,Because energy is provided to and interacts with one of the glasses . It is ok to say `` Not that I know of '' .,Turkic,Turkish
1980sumthing,answers,"When the max cap speed of utorrent is above the max speed of my connection , the throughput fluctuates a lot , When I reduce the max speed , utorrent starts receiving at a higher sustained throughput than without a max speed set . That 's what I 'm asking .",Turkic,Turkish
1980sumthing,Turkey,"Have you access to the universities or are you speculating ? Bosphorus university is pretty hard to get into , It 's not a technical university but CS basics is pretty standard anyway . I do n't know about this new found land .",Turkic,Turkish
