15MinutesOfReign,Terraria,"Fishing is still fairly new , so it 's not surprising that the wiki is n't 100 % correct .",Germanic,Norwegian
15MinutesOfReign,AskReddit,"[ Valhalla Rising ] ( http : //www.imdb.com/title/tt0862467/ ) It 's not the worst movie ever made , but I was expecting a action filled movie from the trailers , not an 90 minutes long boat trip .",Germanic,Norwegian
15MinutesOfReign,casualiama,What 's the best and worst things about living where you do ?,Germanic,Norwegian
15MinutesOfReign,AskReddit,It 's fun for about 15 minutes,Germanic,Norwegian
15MinutesOfReign,casualiama,The ones I 'm wearing in the picture was a birthday gift from my younger sister .,Germanic,Norwegian
15MinutesOfReign,casualiama,Maybe five on a scale from one to ten,Germanic,Norwegian
15MinutesOfReign,casualiama,"Not going for any record ( however it is my personal record , and I 'm never going to beat it )",Germanic,Norwegian
15MinutesOfReign,casualiama,"Falukorv is the best thing about Sweden imo ! Anything you miss from England , except tea ? And how did your family react when you told them you were moving to Sweden ?",Germanic,Norwegian
15MinutesOfReign,findareddit,We have sliced bread in Scandinavia ( Norway ) ? TIL,Germanic,Norwegian
15MinutesOfReign,AskReddit,I remember downloading that movie because I thought it was a porno .,Germanic,Norwegian
15MinutesOfReign,beatles,"Okay , thanks , I 'll check it out !",Germanic,Norwegian
15MinutesOfReign,AskMen,"Why did it take so long ? When I removed my wisdom tooth ( upper right ) it took about 10 minutes from when I sat down , till I left .",Germanic,Norwegian
15MinutesOfReign,casualiama,yupp,Germanic,Norwegian
15MinutesOfReign,AskMen,That sound really painful,Germanic,Norwegian
15MinutesOfReign,AskReddit,Why ? Why did someone make this video ?,Germanic,Norwegian
15MinutesOfReign,AskMen,What ! ? ! The cold side is the best side !,Germanic,Norwegian
15MinutesOfReign,HeroSiege,PM me your steam name and I 'll buy it to you : ),Germanic,Norwegian
15MinutesOfReign,mildlyinteresting,"Im not that good in English , what 's the joke and how did it get ruined ?",Germanic,Norwegian
15MinutesOfReign,casualiama,Do you enjoy listening to Bob Marley 's `` I shot the sheriff '' ?,Germanic,Norwegian
15MinutesOfReign,Tinder,"I 'm also from Europe , and I do n't understand why that is relevant .",Germanic,Norwegian
15MinutesOfReign,NorwayPics,Do you know where the photo is taken ?,Germanic,Norwegian
15MinutesOfReign,beatles,"Haha , I actually had n't seen your comment ! A friend of mine sent me the gif on Facebook , so he might have gotten it from your comment",Germanic,Norwegian
15MinutesOfReign,beatles,"Is it him singing ? It 's amazing , got any more by him ?",Germanic,Norwegian
15MinutesOfReign,shittyaskscience,Is that why dogs smells other dogs butt ? because they ca n't reach their own ?,Germanic,Norwegian
15MinutesOfReign,TheBeatles,"I do n't speak french , but I 've always wondered , do Paul pronounce the french part correctly ?",Germanic,Norwegian
15MinutesOfReign,2007scape,"There 's a clue where you need to jig ( or something ) while wearing a rune plate , so the 'scammer ' ask peoople if he can loan one . And since he is a high level in expensive gear , people do it , and expect hil to give it back . Something he does n't .",Germanic,Norwegian
15MinutesOfReign,oslo,"They does n't join as often as my drinking friends , but yes , they sometimes come along with us .",Germanic,Norwegian
15MinutesOfReign,oslo,"It is possible , several of my friends does n't drink , and none of them feel left outside as far as I know .",Germanic,Norwegian
15MinutesOfReign,beatles,Do you have any examples on other band subreddits who have made cover albums ? Just curious on how it 's done .,Germanic,Norwegian
15MinutesOfReign,casualiama,"haha , no !",Germanic,Norwegian
15MinutesOfReign,findareddit,/r/goforgold you offer at least one month of gold fir any request . /r/tipofmytongue if you need help finding the name of a movie/book/song etc . Those are the two I can think of : ),Germanic,Norwegian
15MinutesOfReign,minecraftsuggestions,"The village islands should n't be connected to the main island in my opinion , so it becomes a small challenge to find and travel to the villages .",Germanic,Norwegian
15MinutesOfReign,3amjokes,"V is pronounced as f in german , so Walter is more correct in my opinion .",Germanic,Norwegian
15MinutesOfReign,AskReddit,You can mail fresh poop to your `` friends '' . http : //www.poopsenders.com/,Germanic,Norwegian
15MinutesOfReign,AskReddit,Put him in a box [ . ] ( http : //en.wikipedia.org/wiki/Schr % C3 % B6dinger % 27s_cat ),Germanic,Norwegian
15MinutesOfReign,AskReddit,"I piss on my feet in the shower every morning . I tell myself it makes my feet softer , but deep inside I know its just laziness .",Germanic,Norwegian
15MinutesOfReign,AskReddit,"Sorry , English is n't my first language .",Germanic,Norwegian
15MinutesOfReign,AskReddit,"Called in sick , saw my boss .",Germanic,Norwegian
15MinutesOfReign,AskReddit,I do n't usuLLY HIT KEYS BY ACCIDENT .,Germanic,Norwegian
15MinutesOfReign,AskReddit,Furiously pressing the A button while trying to catch a Pokemon .,Germanic,Norwegian
15MinutesOfReign,Nordiccountries,"Whats the name of the instrument/tablet-thingy that is used in the video , and how does it work ? Also great mashup !",Germanic,Norwegian
15MinutesOfReign,AskReddit,"Trust me guys , I know what I 'm doing .",Germanic,Norwegian
15MinutesOfReign,Showerthoughts,Do you still have that ant in your monitor ?,Germanic,Norwegian
15MinutesOfReign,mindcrack,"[ Here you go ] ( https : //www.youtube.com/watch ? v=Yyh9KJXK-NQ ) I do n't remember exactly when in the video he says it , ill update my comment when i find it : ) Edit : [ at the 8th minute mark ] ( http : //youtu.be/Yyh9KJXK-NQ ? t=8m )",Germanic,Norwegian
15MinutesOfReign,mindcrack,"Its a really new game , so he wants to get it out as fast as possible . When people are searching for e.g *Pokemon Y gym battle 7 walk through * his video will show up , and he 'll get new people to his channel . If he had uploaded say 1 video a day , he would n't have gotten to gym 7 yet . Hope that made any sense .",Germanic,Norwegian
15MinutesOfReign,mindcrack,He also know how to please himself,Germanic,Norwegian
15MinutesOfReign,mindcrack,I just googled photo editor and clicked the first link . Edit : [ This one ] ( http : //pixlr.com/express/ ),Germanic,Norwegian
15MinutesOfReign,AskMen,"I was 3 years old , my younger sister was 1 , and was sleeping in a [ crib ] ( http : //cwsarchitecture.com/wp-content/uploads/2011/02/crib-oblique.jpg ) . I was climbing it because I wanted to watch her , and I fell down and broke my arm . Only bone I 've ever broken",Germanic,Norwegian
15MinutesOfReign,AskReddit,"My friends and I were really into pretending we lived in *the stone age* when we were around ten years old . And one day when we was playing in the woods we decided to play tribal wars . So we made a few wooden javelins , and started to throw them at each other , the first javelin who hit , hit my friend right in the face , a few centimeters higher and it would have hit his eye .",Germanic,Norwegian
15MinutesOfReign,Norway,"Probably yes . My last German teacher ( upper secondary school ) did n't have a German degree , as far as I know , but he was born and raised in Germany , which qualified him .",Germanic,Norwegian
15MinutesOfReign,Norway,"Not on steam , but Minecraft is translated to Norwegian Bokmål and Nynorsk",Germanic,Norwegian
15MinutesOfReign,chess,"He meant to spell whole Whole Norway = everyone in Norway Hole = something you try to get the ball into in golf , or something you get in socks . Can be used to describe a bad/ugly place .",Germanic,Norwegian
15MinutesOfReign,history,"I do n't know about Sweden and Denmark , but prostitution is illegal in Norway Edit : it 's illegal in Sweden too , so I would n't call Scandinavia the sex capital",Germanic,Norwegian
15MinutesOfReign,GiftofGames,"Sorry , did n't knew that I had two , I guess I got them without noticing . So obviously I wo n't need any from you , thanks anyway though !",Germanic,Norwegian
15MinutesOfReign,GiftofGames,"I would really like one of the coupons , if the offer is still up ! My Steam profile is http : //steamcommunity.com/profiles/76561198018791268/",Germanic,Norwegian
15MinutesOfReign,bindingofisaac,I 'm guessing he means ? ? ? In the chest Edit : might be called blue baby,Germanic,Norwegian
15MinutesOfReign,dataisbeautiful,"Maybe a stupid question , but how do you download your Facebook information ? Edit : never mind , I figured it out with the power of Google . If anyone else is wondering , [ this ] ( http : //in.answers.yahoo.com/question/index ? qid=20130516062842AAGiotM ) is how you do it .",Germanic,Norwegian
15MinutesOfReign,BestofMindcrack2013,"`` The key to getting good at mario kart , is to take a dump and bringing your ds woh you '' - Pyro ( quote can be a little wrong , on my phone so it 's phrased after how i remember it . )",Germanic,Norwegian
15MinutesOfReign,movies,Could someone please explain for me what meta means ?,Germanic,Norwegian
15MinutesOfReign,AskReddit,Commenting to see later,Germanic,Norwegian
15MinutesOfReign,tipofmytongue,"Sorry , but I think the ads are kind of personalized and based upon which country you are in , so most people wo n't get the same ad as you .",Germanic,Norwegian
15MinutesOfReign,Minecraft,"I guess thats the reason why I never seen one , I never bother with exploring oceans : p",Germanic,Norwegian
15MinutesOfReign,Minecraft,"How and where should i search for mushroom biomes ? I 've played for a while but never seen one , any tips ?",Germanic,Norwegian
15MinutesOfReign,dadjokes,"I do n't get it , can someone explain ?",Germanic,Norwegian
15MinutesOfReign,AskReddit,"It probably does n't exist , but a boy can dream .",Germanic,Norwegian
15MinutesOfReign,AskReddit,"Gloves that does n't make my hands sweaty . Because I do n't like cold hands nor sweaty hands . I know it 's boring , but that really all I want .",Germanic,Norwegian
15MinutesOfReign,AskReddit,I guess thats why I 've never heard of it .,Germanic,Norwegian
15MinutesOfReign,AskReddit,"One of my friend 's sister is in a wheelchair , and she got one of them motorized wheelchair . And one time when she was n't home , I was trying it , and when I was done I was going to park it , but I accidentally backed it into one of those things that hold a balcony up ( I think its called a post ? ) And it broke , so they could n't use their balcony for like a week , while they were waiting for a new post .",Germanic,Norwegian
15MinutesOfReign,AskReddit,What ? I did n't even know they were based on a book !,Germanic,Norwegian
15MinutesOfReign,casualiama,"I 'm a senior in upper secondary school , and in Norway we have this tradition where the seniors ( called Russ ) wears a pair of red pants during the celebration . You 're not allowed to wash them during this period , and you are supposed to wear them to school everyday .",Germanic,Norwegian
15MinutesOfReign,Jokes,Whst is the context of the original gif ?,Germanic,Norwegian
15MinutesOfReign,mindcrack,"my guess is the same reason as before , he wants new people to his channel . Say if you needed help with the 7th gym , would you watch a video called *7th gym walkthrough* lasting for 20 min or *6th and 7th gym walk through* lasting for one and a half hour ?",Germanic,Norwegian
15MinutesOfReign,nynorsk,"I can translate it , do you only want it word for word , or do you want me to translate it to make sense ?",Germanic,Norwegian
15MinutesOfReign,MapPorn,Can you give any examples ? I 'm Norwegian and ca n't exactly recall seeing any Scandinavian influenced traditions .,Germanic,Norwegian
15MinutesOfReign,blackpeoplegifs,What 's up with all the Hamilton references popping up on reddit now ? I did n't see any just two weeks ago,Germanic,Norwegian
15MinutesOfReign,WTF,It 's just really far west .,Germanic,Norwegian
15MinutesOfReign,Military,"Yea , I understood that , that 's why I liked it .",Germanic,Norwegian
15MinutesOfReign,Military,"Hahah , kulspruta is my new favorite word in swedish ! ( I 'm Norwegian )",Germanic,Norwegian
15MinutesOfReign,ifyoulikeblank,You can look at the right side of [ this chart ] ( http : //i.imgur.com/cKf0sFe.png ) for albums like Human after all by Daft Punk . There is a more detail chart in the comment section of [ this ] ( https : //www.reddit.com/r/ifyoulikeblank/comments/1z1r73/iyl_daft_punk_yml_what_this_chart_suggests/ ) thread . [ Deltron 3030 ] ( https : //www.youtube.com/watch ? v=eDuQWL4Qbzs ) is a trio consisting of three early members of Gorillaz . I suggest to give a listen to his album called Deltron 3030,Germanic,Norwegian
15MinutesOfReign,ifyoulikeblank,"New Order : I listened to 'Bizarre Love Triangle ' and 'Blue Monday '88 ' I liked them even though they was n't the kind of music I am looking for now . She Wants Revenge : Listened to 'I do n't want to fall in love ' and it reminded me of the band Datarock , which I really like . I also listened to 'Red Flags And Long Nights ' I liked the song , but the intro was to long for me , and it got repetitive . 'Up In flames ' was the third song I tried from She Wants Revenge , and it was really good . I didnæt have time to listen to the rest of the songs since I 'm going to bed , but I will try to check them out tomorrow . Thanks for all the suggestions !",Germanic,Norwegian
15MinutesOfReign,MapPorn,Ahh cool ! Thanks,Germanic,Norwegian
15MinutesOfReign,ifyoulikeblank,"Thanks for all the great suggestions , and sorry for the following wall of text , but I wanted to give a little comment on all the songs I listened to . Happy House : I liked the song , but I 'm not that fan of female vocal . In Dulce Decorum : A good song and the kind of rock I like . The Chameleons : I have already heard a lot from this band before . A good suggestion , thanks . First Chapter : I heard the songs 'Tomorrow Never Knows ' , 'Garden of Delight ' and '1969 ' . My first impression was that it was a little slow-paced , but I liked it and will probably listen to the whole album another day . I liked 1969 the most . Sisters of Mercy : I started by listening to 'Marian ' and it was one of the better songs I 've heard today , even though I 'm not the biggest fan of songs that last over five minutes . There was something I liked about 'Alice ' but the melody was n't that good in my opinion , but as you said their earlier EPs are better . The two last songs I listened to was 'Walk Away ' and 'Train ' . I really liked both song , especially 'train ' and its different kind of sound . Nick Cave and the bad seeds : I liked the way the vocal talks instead of singing in 'Rings of Saturn ' , really unique . I also listened to 'Into My Arms ' which was totally different . I also liked this song , however it was more of a time-to-relax kind of music , and not what I looked for now . Nick Cave and Warren Ellis : After I had listened to the first two songs I realized that maybe I was listening to the wrong Nick Cave , so I checked out another Nick Cave I found on Spotify . I guess this was the Nick Cave you meant , since this was a more punk like band . I listened to 'All the gold in California ' and 'I 'm you 're man ' and they both was the kind of music I was looking for , even though they were a little slow paced . Thanks again for all the suggestions !",Germanic,Norwegian
15MinutesOfReign,ifyoulikeblank,"Two great suggestions , thanks ! I had heard some of the yardbirds before , but never 'Happenings Ten Years Time Ago ' I liked it , but I liked the other song better .",Germanic,Norwegian
15MinutesOfReign,ifyoulikeblank,"Transmission was great and exactly what I was looking for , thanks !",Germanic,Norwegian
15MinutesOfReign,ifyoulikeblank,"I liked the gloomy melody , but the pace was a little bit to slow in my opinion . However the song is definitely going into my playlist , Thanks !",Germanic,Norwegian
15MinutesOfReign,ifyoulikeblank,"Thanks for all the suggestions ! 'Something I learned today ' was pretty close to what I wanted ! I also liked 'I heard her call my name ' , 'You 're gon na miss me ' ! and especially 'last stop this town ' !",Germanic,Norwegian
15MinutesOfReign,ifyoulikeblank,Thanks for all the suggestions ! I will check them out when i get home,Germanic,Norwegian
15MinutesOfReign,Hammers,/r/soccerstreams got most of european soccer covered,Germanic,Norwegian
15MinutesOfReign,soccer,Really lucky if they manage to sign the main singer from the glorious band [ Sheep boys ] ( https : //youtu.be/cwohMPPt_8A=3m48s ),Germanic,Norwegian
15MinutesOfReign,ifyoulikeblank,"I liked the song but I only found a slower remix on Spotify , which I did n't like as much unfortunately . However I checked out some of his other work and I enjoyed 'Silver ' and 'Our Love ' even though they were n't the kind of music I was looking for now . Thanks for suggesting the artist !",Germanic,Norwegian
15MinutesOfReign,Hammers,Does n't help us when he leaves in January .,Germanic,Norwegian
15MinutesOfReign,Hammers,"I think the hardest hit for us will be the moral of the team . it always suck to lose one who is looked on as the team 's superstar . How much we get is n't really that important in my opinion , as long as we can get a replacement that clicks with the team .",Germanic,Norwegian
15MinutesOfReign,Hammers,Two 1-0 because of penalties is n't something to be proud of,Germanic,Norwegian
15MinutesOfReign,victoria2,"Im playing as two sicilies and had already taken Tunisia and parts of Morroco , leaving me at around 11 infamy . Then I tried to take Algeria ( managed to get an undetected CB ) , but France started to invade me without declaring a war first . We had over 150 in relation when it happened , and we were both allied to the papal states ( not with each other ) . How could he attack me without declaring war first ? And why did he do it ?",Germanic,Norwegian
15MinutesOfReign,mindcrack,Cool : ) I got one last question ; can vi expect another Nuzlocke challenge in the nearest future ?,Germanic,Norwegian
15MinutesOfReign,ifyoulikeblank,I do n't care what genre it is or which artist made it . Edit : Thanks for all the great suggestions !,Germanic,Norwegian
15MinutesOfReign,PrisonBreak,"Does no one watch the news ? The tv-reporters in the shows keep announcing that the most wanted men in America is still at large , and yet the cons interact with people who have no idea that they 're talking with wanted men . It just seems so unrealistic that almost no one recognise them .",Germanic,Norwegian
15MinutesOfReign,tipofmytongue,"I think it is an english song . The music video starts with a girl wathing a Soviet rocket launch , and it ends with the launch failing , and then the girl puts on a space helmet and swims out in a lake to drown herself . The songs name is a russian name if i remember correctly .",Germanic,Norwegian
15MinutesOfReign,couchsurfing,"Hi , I 'm a 19 year old boy from Norway , who is currently planing my first couchsurfing trip through Europe . But I 'm wondering what to bring except the obvious things like spare clothes , hygiene products , cellphone charger , passport and so on . So what do you bring when you couch surf ? Thanks for all answers and comments : )",Germanic,Norwegian
15MinutesOfReign,casualiama,Title says it all,Germanic,Norwegian
15MinutesOfReign,changemyview,"I believe that a membership would bring more cons than pros for Norway . Since it would open for other countries to fish in our areas , which may lead to over-fishing . Other cons i see include the fact that we would have to follow even more rules , without having the opportunity to affect and bring stuff to the agenda , since we are such a small country ( population : 5 millions ) . Also , Norway is a really rich country , and I thinks that it would be better for us to stay out , so we can use our money on our own health care/schools/roads etc. , and a membership would only be a money drain to other countries , and the massive bureaucracy : European Union . Just wanted to say that my English is n't perfect , so I can try to explain better if something is unclear . Thanks for taking your time to read my view , and good luck on changing it .",Germanic,Norwegian
15MinutesOfReign,whatisthisthing,"http : //i.imgur.com/Y9dxBYq.jpg I thought that it was a Serpent star ( Ophiura Ophiura ) I had caught ( caught April 16th , picture from about a day later ) , but it does n't seem to match any other picture of a Ophiura Ophiura , and I 'm thinking that it may be a Ophiura Starsii I got . Additional information : Caught at soft bottom shore , in mud . Depth around 75 Meters /246 feet Saline water ( [ Drøbaksundet in the Oslofjord ] ( http : //en.wikipedia.org/wiki/Oslofjord ) ) who leads to the baltic sea .",Germanic,Norwegian
15MinutesOfReign,askscience,"If a person who weights 70 kg , on earth , stands on the moon and then jump , how high would he have to jump to not get pulled back ? Also how high would the same person have to jump on earth , to not get pulled back , if we ignored the atmosphere , and the fact that it may be impossible to put that much muscle in a 70kg body .",Germanic,Norwegian
15MinutesOfReign,penpals,"The title says it all . Looking for a pen pal from anywhere in the world , you can write to me in English , but its awesome if you write German ( I will however respond in English ; ) Just send me a PM !",Germanic,Norwegian
15MinutesOfReign,AskReddit,"I just recently made an account , and I 've subscribed to subreddits for major games etc . But what are some lesser known subreddits , who still got high quality stuff ?",Germanic,Norwegian
15MinutesOfReign,victoria2,Thanks ! Is it possible to make a great power unfriend a country when im only a second power myself ?,Germanic,Norwegian
15MinutesOfReign,victoria2,Forgot to mention that Algeria was not allied with anyone,Germanic,Norwegian
15MinutesOfReign,spelunky,"yea , I still have n't visited the city of gold or hell . I had the eye-thing this round , but did n't have any bombs to get into the black marked .",Germanic,Norwegian
15MinutesOfReign,2007scape,`` focused around his own beliefs '' You mean basic human rights ?,Germanic,Norwegian
15MinutesOfReign,ivernmains,"Cho gath . I 'm gold4 , and have had great results with him .",Germanic,Norwegian
15MinutesOfReign,PrisonBreak,You would probably have known if the 8 most wanted broke out of a max security prison last week,Germanic,Norwegian
15MinutesOfReign,Hammers,Why is n't Samuelsen on the bench ? Seems like a loan is likely now,Germanic,Norwegian
15MinutesOfReign,PrisonBreak,They did n't know he was involved in designing the prison though . The company that designed the prison used the company Michael work for off-records . He mentions it in one of the first episodes,Germanic,Norwegian
15MinutesOfReign,PrisonBreak,My point was that it is unrealistic many that doesnt recognize them . Take Pam Mahone for example . She did n't recognize michael just because he had a cap and some basic glasses on .,Germanic,Norwegian
15MinutesOfReign,tipofmytongue,Edit : found it [ Wolf parade - Yulia ] ( https : //youtu.be/LLGs2H3gDJw ),Germanic,Norwegian
15MinutesOfReign,2007scape,Dog in a tub,Germanic,Norwegian
15MinutesOfReign,2007scape,Dog in a tub,Germanic,Norwegian
15MinutesOfReign,2007scape,"Dont you keep your bonds when you die , no matter what ?",Germanic,Norwegian
15MinutesOfReign,2007scape,"Kill cows and collect cow hides , or telegrab wine of Zamorak ( requires 33 magic and some starting cash for law runes )",Germanic,Norwegian
15MinutesOfReign,2007scape,"How do you barbarian fish most efficiently ? I tried barbarian fishing at level 60 , but i got higher exp rates in shilo village . I 'm currently 71 fishing , should I give it a new try ? Also , what do you alch in bulk as an ironman ?",Germanic,Norwegian
15MinutesOfReign,2007scape,"It is only member to obtain the trimmed rune armour from clue scrolls , not to buy or wield it .",Germanic,Norwegian
15MinutesOfReign,2007scape,"You have to be a member to get and solve clue scrolls , but you can buy and wear some of the rewards such as trimmed rune armour",Germanic,Norwegian
15MinutesOfReign,2007scape,You make the cost of law runes back by getting marks faster .,Germanic,Norwegian
15MinutesOfReign,minecraftsuggestions,"It 's a good idea , but I think it only should only apply in adventure mode . It would be kind of wrong to change it for survival now , since the nether has been out for so long .",Germanic,Norwegian
15MinutesOfReign,mindcrack,Nebris is 1338 - one step ahead,Germanic,Norwegian
15MinutesOfReign,mindcrack,I really like [ This ] ( http : //youtu.be/8PjrMeYHeUM ? t=4m57s ) derp moment,Germanic,Norwegian
15MinutesOfReign,mindcrack,"He was enchanting a bunch of stuff with levels he got from the ender grinder , and when he was done he was going to throw away his ender pearls , and accidentally threw away his diamond sword . Then he tried to save it .",Germanic,Norwegian
15MinutesOfReign,mindcrack,"When you edit a comment it gets a * , so no , I did n't edit it . However , it sometimes get messed up so it starts from start and not from the time you want it to , so Electroclipse may not have noticed that I also posted with time stamp .",Germanic,Norwegian
15MinutesOfReign,mindcrack,[ Even funnier with sound ! ] ( https : //www.youtube.com/watch ? v=FWc0lfQDE58 & amp ; list=SPE549F32D1EEDF9D4 # t=1m43s ),Germanic,Norwegian
