29255DaysToGo,AskReddit,"Season 10 was actually pretty good , revived the series a bit , season 11 is fairly good too . S6-9 are really `` meh '' tho with occasionally good episodes , but not too interesting or worth seeing . I think the show suffer because it 's 24 episodes in a season , it should be less . Max 20 , maybe no more than 15 . I 've mostly stayed away from the fan base tho . A bit because I was 9 seasons behind when I started watching , but also because I was a guy in my early 20 's and did n't feel like participating in it ...",Germanic,Norwegian
29255DaysToGo,starcraft,"Damn , I loved watching games on Monty Hall . Always weird games because it 's a difficult map . Totally unbalanced though .",Germanic,Norwegian
29255DaysToGo,movies,"For some reason I thought Galadriel was Eowyn , right up to reading your comment ( Probably because Eowyn is a `` princess '' ) I always felt LOTR had pretty good female presentation , or atleast influence in the story . Aragorn 's story is heavely influenced by Arwen , Galadriel is a big influence on Frodo and Eowyn wants to fight in battles , not take `` a woman 's place '' and defeats the witch king .",Germanic,Norwegian
29255DaysToGo,starcraft,"Holy fuck , I actually watched that series live ... That hydra bust , and when Zero dropped Hydras behind the cannons and morphed the egg , daaaamn . Sick play . And then Jangbi fights back . Damn , amazing game .",Germanic,Norwegian
29255DaysToGo,ShingekiNoKyojin,"And if it 's true titan shifters die after x years , we might not end up with any of our main characters , other than Mikasa : ( Even though I think it will be some loophole , cure or that it 's not true ( I expect kinda having all 9 titan powers in the end is the cure/solution , so either Eren or Armin sacrifice themselves ( or someone eats Armin : / )",Germanic,Norwegian
29255DaysToGo,ShingekiNoKyojin,"I just want to make clear , I do n't think it to be so , that someone is telling it all . I just tried to make it clear it could work as a re-telling , but it gets , as you said , weird how the `` retelling '' works , when you see persons outside the titan powers being on their own .",Germanic,Norwegian
29255DaysToGo,ShingekiNoKyojin,"It 's very heavy on it . Eldians are treated bad by Marleys because history say that Eldians got the titan powers and held Marleys as slaves basically . It was first when technology advanced they managed to turn it around . Grisha believes its fake history , and Eldians were good , because Marley treat Eldians bad noe . The eldians that fight for Marley ( Reiner/Bertholt ) know their attack was a horrible thing to do , but thet view it as a necessesary thing to do , so the marley change their view on the eldians in the Marley nation . Also , the marleys need to titan powers to fight back other nations . And other nations are probably scared of the Marley because of they hold the titan power . And the Paradise Island inhabitants now view Marley as the enemy , because of the attack . But isnt Marley 's action reasonable consider what history say ? A people all capable to become huge titans should not hold much power and control others . But what if that history is fake ? I think we will end SNK without having a `` good '' outcome , and many lives were lost for no good reason , just like real life . History is written by the victor after all . Hopefully we dont have to view back and think that it would all be better if Eren lived his whole life inside the walls and ignorant to the world . But consider Eren did n't focus on the ocean and more on `` the enemy beyond the ocean '' , this might get dark soon ... I didnt think the manga showed it well , but I think the anime will really show it , how everyone else is laughing and smiling while in the ocean . And Eren just stands there with a blank stare across the ocean .",Germanic,Norwegian
29255DaysToGo,ShingekiNoKyojin,Even though that would be pretty bad ass . Fighting the literal devil to break the Eldian curse .,Germanic,Norwegian
29255DaysToGo,ShingekiNoKyojin,"I was thinking `` the devil '' would be some sort of corporation or person , giving the weapon to some country/people , but it would come with a cost . Obviously most being mindless titans would be that cost . But the latest chapters , especially introducing the paths , have made me think it can be a more magical element , even though I do n't think the devil will be involved .",Germanic,Norwegian
29255DaysToGo,starcraft,"I guess you refer to SC1 ? It will come with patch 1.18 , which has been pushed back because the PTR version ( test version ) showed a lot of bugs and problems .",Germanic,Norwegian
29255DaysToGo,ShingekiNoKyojin,"I 've always thought that `` SnK '' was about the question `` is it better to live inside a wall , away from fear and harm , ignorant about the outside world , or to have those walls brought down , despite how bad it is on the outside '' Eren , Mikasa , Armin , all inside the walls could live comfortable lives until the end of their days . But , it would be a `` fake '' life . Is it better that they know about the outside world now , than what life they could have ? And I think `` the devil '' will be something like that , that when we get to know the full story , the reason behind titan powers and so on , would it be better if we thought it was the literal devil , rather than know the truth ? It 's clear that most characters in the story live by some form of ignorance or propaganda . And maybe that is better for everyone , than knowing the truth . Atleast then they can pretend they are right about everything .",Germanic,Norwegian
29255DaysToGo,ShingekiNoKyojin,"It might just be a storytelling device with `` parallells '' , but Isyama has given us hint of something like that through the series . Definetly looking forward to the end of the series just so I get all the answers .",Germanic,Norwegian
29255DaysToGo,ShingekiNoKyojin,"Annie , Bertholt and Reiner is there though . And it 's why we can see what we see through Falco too . The story being told might be someone who inherit all 9 titans .",Germanic,Norwegian
29255DaysToGo,ShingekiNoKyojin,"I 've always seen `` the devil '' in the as a methapor , like we use `` made a deal with the devil '' as a metaphor in our own world , and `` the devil '' will be revealed to be someone or something that will be `` the big bad evil '' in the end , or something like that .",Germanic,Norwegian
29255DaysToGo,starcraft,"That 2011 Jin Air OSL has a special place in my heart . I was a kid when SC1 came out , 3 years old . I did n't play my first game probably before 2005 . When youtube become big , I discovered that Koreans played this game and made money of it ! It was amazing discovery for a 11-12 year old kid . I watched so damn much BW ( Pringles MSL is the one I remember watching , because of the `` chip eating '' sound they played before games started ) But I was still a kid , and did not know anything about streaming etc . But when I got a bit older I discovered outlets that linked to the stream of professional games . By that time I had kinda moved on from BW , to MW2 then back to SC2 . So when I found the streams showing Proleague and Jin Air OSL I was catching pro-games again . That Jin Air OSL finale , plus Proleague finale during the same period , were amazing . And now , many years later , I 'm able to catch every pro-game played . Truly amazing having BW come back during a time period where streaming is so accessable and I 'm older and not just a kid sitting on youtube listening and watching koreans play video game ( I discovered the english casters later , like 2010 time , and continued watching people like Sayle after the korean scene disappeared ) BW have been such big part of me growing up , despite I 've never been good at it , and I do n't know anyone else that play it . But it 's just so damn good .",Germanic,Norwegian
29255DaysToGo,soccer,Arsenal 's problems go deeper than just Wenger .,Germanic,Norwegian
29255DaysToGo,starcraft,"Damn , that still looks amazing .",Germanic,Norwegian
29255DaysToGo,soccer,Suarez and Neymar have both been pretty good for some periods the last couple of years .,Germanic,Norwegian
29255DaysToGo,starcraft,"I rather see Blizzard 's next RTS being a completly new setting and universe . I love the Warcraft series , but feel it 's story is just too , well , it 's gone too MMORPG , what we need now is a new universe with completly new characters and legacy .",Germanic,Norwegian
29255DaysToGo,starcraft,"You do n't give people enough credit , when the game is so good that people learn to play with horrible pathing and difficult controls . With the hotkeys becoming changable , people just need to focus on getting faster to control units groups and macro/micro . People will enjoy playing a great RTS again .",Germanic,Norwegian
29255DaysToGo,starcraft,"It 's not , he updated something else . Europe servers is , as you said , buggy with that . He can solve it with just trying over and over , then it will fix itself .",Germanic,Norwegian
29255DaysToGo,starcraft,"No , it 's not , you updated something else . Checked with my own version .",Germanic,Norwegian
29255DaysToGo,starcraft,He won WCG 2007 . I think he is one of the guys that is excited .,Germanic,Norwegian
29255DaysToGo,starcraft,"& gt ; Bw was great , but this whole thing is just a big nostalgia train that will lose steam fast once that reality sets in . Lol , no it 's not . Playing it now still feels great , just like it did back then . The game is still incredible .",Germanic,Norwegian
29255DaysToGo,starcraft,"Crazy to think that in 2005 , the game was already 7 years old .",Germanic,Norwegian
29255DaysToGo,sports,"I ca n't understand how the artist made his eyes so close together , [ when they are n't like it at all . ] ( https : //pbs.twimg.com/media/C8Folj4WsAA8CvV.jpg ) Bizzare .",Germanic,Norwegian
29255DaysToGo,soccer,International break .,Germanic,Norwegian
29255DaysToGo,movies,"Would be cool if the Cloverfield-monster was a machine or creature bred by Aliens , send in as vanguard and as a first-assault . Just a monster that does a lot more ( the parasites etc ) that they can take care of themselves later , just throw it into a heavly populated area and let it do it 's thing .",Germanic,Norwegian
29255DaysToGo,soccer,"& gt ; But , physical harm should be punished to higher degree than verbal abuse . But it is . Verbual `` harm '' to the refree will get you banned for 4 games , physical harm will get you a life-ban . Verbal harm towards other players get you nothing , elbowing them gives you 3 or so . If elbowing a player is 3 matches banned , then dangerous tackles should be atleast 3 too . That 's my whole point . You cant compare the situations and justify that the dangerous tackles should have bigger bans . Because Messi did nothing to another player . He was disrepecting over the match officials , and that stuff is taken seriously by every FA in the world . Which is why OP 's title is just stupid . Taylor did a dangerous tackle on another player and it 's not anything like Messi being disrespectful to the ref .",Germanic,Norwegian
29255DaysToGo,soccer,"& gt ; Breaking somebodies leg is not part of the game . Tackles are , and sometimes players get unlucky and a leg break . Excessive force are not part of the game , and it 's enforced . & gt ; A horrible tackle gone wrong ? ? What is a horrible tackle gone right ? One where a guys legs dont break . And the player gets a red card . & gt ; It 's a horrible tackle and Taylor disregarded the safety of Coleman when made that tackle . At no point did I defend Taylor , and I think that is a tackle that is way beyond what should be allowed in the game . My main point is that you ca n't compare a ban given for something one did to a refree , and something that a player did to another player . Refree-punishments will always be harsher . No matter what . And saying that FIFA should ban Taylor for 10 games because Messi got 4 does n't really work , but you can say Taylor should have 10 games ban if Zlatan got 3 ( deservedly ) for elbowing a player .",Germanic,Norwegian
29255DaysToGo,movies,"Pirates of the Planet of the Apes would be a fucking rad movie tbh . The human race are all , the few that are left , pirates that go around and bringing terror to the Apes . A special team of Apes are created to stop them . A team called , the Apengers .",Germanic,Norwegian
29255DaysToGo,soccer,"Something to take into consideration is who it 's directed at . Messi verbally cursed out the refree , which is a person not part of the game , he is there to officiate the game , agreed between the two sides . Being disrespecting to the refree is not the same as verbally cursing another player , which is why it 's not enforced . Not saying physical harassment should n't be serious too , if someone sucker punch another player it should definetly be a big ban , but a horrible tackle gone wrong on another player is n't the same as , say , attacking a refree . Ca n't compare the two situation to each other , verbally cursing the refree is more serious than verbally cursing a player , just like intentonally elbowing a player is more serious than breaking another players leg unintentionally ( because of an unlucky tackle )",Germanic,Norwegian
29255DaysToGo,soccer,Doing something with the ref always get harder punishment than doing something with a player .,Germanic,Norwegian
29255DaysToGo,starcraft,"What ? AOE2 remaster was great ! Anyway , the remaster of BW will not be that big , it will basically just update the grapichs . Nothing more , no patch changes or anything , it 's the same game from 2001 ( the last patch ) , just with updated grapichs .",Germanic,Norwegian
29255DaysToGo,starcraft,"Non-Blizzard game , Battlefield 2142 . Loved that game , but servers and all shut down . Definetly one that I wanted to play again .",Germanic,Norwegian
29255DaysToGo,starcraft,"https : //www.youtube.com/watch ? v=7ov9Xj9qGI0 I remember this being played , I was so stoked that we would see them play eachother . Insane that it 's been 5 years , definetly time for a revive in the rivalry .",Germanic,Norwegian
29255DaysToGo,starcraft,"The `` classic games '' have a pretty fairly sized team , 20 people . https : //www.youtube.com/watch ? v=qBLv0qrDQcA Good interview where he talks about what they plan of doing with remaster . They are going to get anti-hack into the game properly , and still be on it with the community , listening to the feed back and just stay in touch with the game , while working on new projects too .",Germanic,Norwegian
29255DaysToGo,starcraft,"Did n't know , I 've had no problem with it on Windows 7 . But they are still running patches on it , maybe their plan with WC3 is just give enough patches for it to run smoothly on Windows 10 .",Germanic,Norwegian
29255DaysToGo,starcraft,"Terran has the easiest way teching up , as you need just barrack - & gt ; factory - & gt ; starport and you have pretty much teched up as far you need ( need add-ons tho , and if you are getting vessels , science facility ) They have a pretty alright build and not difficult to build up an army , however , they need a big force and that tech to be able to go out on the map , without just having vultures running around . Toss and Zerg pretty much overrun them early without their tech . Protoss you got many options . Teching to dragoon is just one mineral-only building , and then you can just pump zealots and dragoons . They also do n't need that much tech , however , you need to kinda choose if you want to get reavers , or get templars . So you got kinda a choice there , before late-late game when you will have pretty much everything . Fast arbiter tech has been popular lately , which mean you get templars . The most important thing for protoss really is just expand , atleast vs. Terran , and just get that income to create lots of dragoons and zealots as you will most often not do favourable trades . Zerg got it the hardest . You kinda need everything . It 's popular to either get just hydras/lurkers or just mutas , but you also kinda want a zergling/lurker/muta tech . And late game tech you also need everything , like ultras , defilers , lurkers , zerglings . Mutas are too expensive to keep building tho , but they are really good to have mid game . Need to expand far away from your main base is your key , as it will take longer time for the other races to attack you , and you can just out-swarm them . As far as the play styles go , Terran is a lot turtling , Zerg is very swarming and Protoss is a middle-thing , can do alright on 2 bases , but unfavourable trades on 2-bases loses them the game . It 's really hard to compare them at all . Only thing you can really keep in mind is how units a relativly the same strenght , as in how much hp one zealot have or a zergling or a marine . That 's basically only thing that carry over , the rest as far as how to play them are different .",Germanic,Norwegian
29255DaysToGo,starcraft,"I do n't think they will make WC3 HD , and the writers are a bit confused . WC3 is n't running as smoothly on newer Windows , so they have let out some patches with fixes and increased map sizes and so on . That 's the work they 've done on WC3 and I do n't think they plan a HD release of it .",Germanic,Norwegian
29255DaysToGo,starcraft,"& gt ; Why they decided to remaster their old game is beyond me . Because as of now , SC2 made Blizzard lose a huge of their RTS fanbase , who moved on to other games . Remaster the old classic to get people back and hyped for RTS again , then release a brand new RTS game .",Germanic,Norwegian
29255DaysToGo,starcraft,"Decrease of the SC2 viewer/player base and increase of MOBAs . Lost fanbase is a bit putting it wrong , but decreased interest in the RTS scene .",Germanic,Norwegian
29255DaysToGo,starcraft,"You really think that BW is n't as good , and it 's down to nostalgia ? ? ? ? Seriously ? The game is fucking amazing .",Germanic,Norwegian
29255DaysToGo,starcraft,"But the concept is still the same , you need dark swarm as a zerg to engage a terran army . He has to get defilers and be able to throw out dark swarms , or else he will never win . I agree trying to copy 1:1 the pro 's wo n't work , but you still need to see what units and spells are used and do that .",Germanic,Norwegian
29255DaysToGo,starcraft,"Just remember , the best Zergs in the world do this stuff all the time to , as in not perfect iniations . I 've seen tons of BW through the years , and as longer the game go , the more mistakes are made , and it 's not seldom a pro-zerg will have fights where his army just gets wrecked . It 's kinda a skill you can get very good at , but no one will be perfect .",Germanic,Norwegian
29255DaysToGo,anime,"Definetly so for me . Just as Zanba said in the finale , it 's not about being the strongest or have the most skill . It 's about being exciting to watch . All out ! was like that for me . I felt excited watching it .",Germanic,Norwegian
29255DaysToGo,soccer,"& gt ; No that was not your point , your point was that verbally abusing a referee deserves a greater punishment than breaking somebodies leg . Lol fuck off",Germanic,Norwegian
29255DaysToGo,movies,"& gt ; less insecure youtubers Because if there is something saying `` insecure youtubers '' , it 's a channel that got popular from Star wars , making fun of star wars reaction and excitment in their `` TFA trailer reaction '' video . Masturbating using a droid as penis in a darth vader mask screams insecure youtubers .",Germanic,Norwegian
29255DaysToGo,movies,"It 's a joke , do n't take it seriously ...",Germanic,Norwegian
29255DaysToGo,movies,"RLM are actually pretty good at changing up their jokes and gags , and if they repeat something they point it out themselves a joke . `` Oh , we are doing that again ? '' is a line from one of their HitB episodes .",Germanic,Norwegian
29255DaysToGo,starcraft,"http : //wiki.teamliquid.net/starcraft/WCG_USA_2007 If you see on the `` Wcg 2007 '' site , the two top bars read `` World Cyber Games Events '' and the one under `` World Cyber Games 2007 '' Far right , it says `` show '' that will show up regional qualifiers , or WCG based on years .",Germanic,Norwegian
29255DaysToGo,soccer,"Not sure how many headers to pull out a draw , but winners : Vs. Betis this season , scored in 81 minute . ( Match ended 2:1 ) Vs. Deportivo this season , scored in 90+2 minute . ( Match ended 3:2 Vs. Barcelona in 12/13 , scored in 82 minute ( Match ended 2:1 ) Vs. Getafe in 11/12 , scored in the 19 minute ( Match ended 1:0 ) Vs. Valencia in 06/07 , scored in the 73 minute ( Match ended 2:1 ) Vs. Malaga in 05/06 , scored in the 89 minute ( Match ended 2:1 ) ( scored the first goal earlier in the season vs. Malaga with header , match ended 2:0 ) Tried doing draws : Vs. Barcelona this season , scored in the 90 minute ( match ended 1:1 ) Vs. Villareal this season , scored in the 48 minute ( match ended 1:1 ) Vs. Sevilla this season , scored in the 90+3 minute ( match ended 2:2 and went to extra time , RM won 3:2 ( UEFA super cup ) Vs. Atletico in 13/14 , scored in 90+3 minute ( match ended 1:1 and went to extra time , RM won 4:1 ) All goals listed are headers . Ramos has 41 goals from headings . RM record in games Ramos has scored a header : 29 wins , 5 draws , 5 losses . Source : transfermarkt.co.uk",Germanic,Norwegian
29255DaysToGo,starcraft,"Should have specified , WCG USA 2007 . My bad .",Germanic,Norwegian
29255DaysToGo,soccer,"Yea , true , was just thinking that while Ronaldo/Messi have been incredible for the past years , it 's still been short periods recently where both Suarez and Neymar have outdone them .",Germanic,Norwegian
29255DaysToGo,soccer,He would never put himself through a surgery that would mean he couldnt play football .,Germanic,Norwegian
29255DaysToGo,starcraft,"Not what I mean . I mean , Warcraft is an established franchise . Starcraft , Diablo too . Overwatch was completly new . I want their next RTS to be completly new story too . Forget gameplay , it can be the same . & gt ; The same would likely happen in a WC4 vs WC3 scenario . Would still be `` Warcraft '' and people might be sick of it by now , between the former games and WOW . I just think people want a fresh , new franchise from Blizzard . I know people want WC4 , I want it too , but I think Blizzard should go for something new , like they did with Overwatch . Establish a new universe for their RTS . So , nothing about the gameplay or the characters or the changes it would be from Warcraft 3 to WC4 . It 's still warcraft . And I think Blizzard is at the point with their games that saying `` a non-WC/SC/Diablo game '' has more pulling power . People would be more interested in that .",Germanic,Norwegian
29255DaysToGo,starcraft,"True , but it 's more that `` oh , Blizzard is doing a sequel just like they last game '' , just does n't have the pull I think , as `` Brand new RTS from Blizzard ''",Germanic,Norwegian
29255DaysToGo,DotA2,"Very true , interesting to see how maps has been handled in BW vs. SC2 .",Germanic,Norwegian
29255DaysToGo,starcraft,"Would n't you say that Protoss and Terran got it a bit easier for newer players , as far as timing , strategies and how to play with correct teching etc . ?",Germanic,Norwegian
29255DaysToGo,starcraft,"I see you point . Still feel Zerg have it more messy because of 1 tech-building per unit . Protoss got it a bit too , but when they tech to templars they get zealot speed at the same time , or Dragoon range from cybernetic . Factory builds vultures and tanks with an add-on , so it 's pretty easy . Spawning pool , hydra den , spire , ultralisk tavern and defiler mount , + queens nest . It 's a big amount of buildings really .",Germanic,Norwegian
29255DaysToGo,starcraft,"& gt ; We need innovation and iteration . Unlimited unit select and great pathing you have in SC2 . BW is older generation and people love how it is , that it 's old . Lets keep it like that other than the grapichs .",Germanic,Norwegian
29255DaysToGo,starcraft,"Arbiters vs. Zerg are seldom , and reavers are like a big option vs. both terran and zerg ( very useful late game zvp tho ) It 's pretty much gateway & gt ; cybernetics core & gt ; stargate , then maybe reavers , or else just templars . Not too crazy of a build . What I meant with `` all tech buildings '' is that as terran , you can hold stop when you get factory for a while . Armory you wan na get later for upgrades and vessels because they are crazy good , but you do n't need much more . Zerg build induvidual buildings just for the tech , still create from hatcheries . So it 's like , a terran can just build to factory and stop for a while , protoss can skip stargate tech for a while , but zerg , you just really wan na get to that late game tech because it 's useful . Obviously there are many different builds and so on . But I do n't think it 's too out of the way to say that terrans = less tech buildings , than zerg tech .",Germanic,Norwegian
29255DaysToGo,starcraft,"& gt ; but you 're not going to be producing mutas and lurkers together . Yea , that was kinda my point tho in the first post . Zergs often get mutas , but do n't stay on it unless they plan a lurker/muta/zergling combo against a terran , but this can be a meta from like , 10 years ago , that is just stuck in my head . But I agree , yea , either they skip mutas or create 11 mutas then stick to lurker . But my point still stand : Zerg get most tech buildings .",Germanic,Norwegian
29255DaysToGo,starcraft,"Well , maybe they have to . Only big pulls I can think of is `` WC4 '' or `` Blizzard is making an entire new RTS ! '' We 'll see soon enough .",Germanic,Norwegian
