22vin,iphone,He probably sent/received a lot of images and never erased them .,Romance,Romanian
22vin,Watches,Aaand it 's gone again .,Romance,Romanian
22vin,Roadcam,"Somebody downvoted you but you 're right . This car had crappy suspension and thin tyres . Even if it had ESP , the system would not be very efficient in this case . ESP works best with a nice , ferm and responsive suspension and good quality tyres .",Romance,Romanian
22vin,AppHookup,I just installed it here in Romania ( iPad version ) .,Romance,Romanian
22vin,apple,A developer account is not free .,Romance,Romanian
22vin,Watches,"I know that a watch collector is in no way interested in these watches but what I wanted to know was if it 's any good , meaning if it will work as it should or a couple of years or will it stop after half an year . For now I 'm just interested in a rather cheap watch with a white dial and blue indicators which I can wear on some occasions ; I 'm a student so my budget wo n't allow me to buy a 500eur or more watch which I do n't want to use as a daily driver . Thanks for your opinion : )",Romance,Romanian
22vin,WTF,"I do n't know how many people still own communist era cars in Slovakia . There are not too many left in Romania , for example . You would have to go in a much poorer country to see those . As a Romanian I do n't even want to see those piece-of-crap cars . My parents owned a 1990 Dacia when I was a kid , my grandfather a 1981 one and since the majority of romanians owned one , I can share some of their main `` features '' : - your Dacia 's key could open other random Dacias - there was gasoline smell inside especially after you refuelled - during the winter , some blew hot air inside some did n't . Some actually blew hot air inside during the summer and cold air during the winter - the muffler always broke - the carburettor always got clogged - most of the engines overheated during summer - the reverse gear required good force ( some required two hands ) and shifting gears required some good guessing . Dacia - I changed everything and it 's still not running .",Romance,Romanian
22vin,WTF,"Niko Bellic is Serbian and even though we are neighbours , our languages are different ( theirs is slavonic , ours is latin with slavonic influences ) . But I guess Niko Bellic 's voice works better in this context",Romance,Romanian
22vin,Romania,No wonder Google Translate ca n't help you . This is full of typos and bad grammar .,Romance,Romanian
22vin,photocritique,"The one-day trip to Sicily from Malta ? If that 's it , I went in the exact trip four years ago . From what I remember , the first stop in Sicily was in Vittoria . A photo from there would also be nice : )",Romance,Romanian
22vin,Roadcam,The license plate is Ukrainean .,Romance,Romanian
22vin,AdviceAnimals,"There 's no reason to be skeptical . Bucharest is safer than most of the European capitals , nobody will give a crap if you 're black or asian . Honestly , I never thought somebody would hesitate to come here because of their skin colour . In Bucharest , if you do n't go looking for trouble you wo n't find it .",Romance,Romanian
22vin,apple,Kinda looks like a floating Apple Store,Romance,Romanian
22vin,AlienBlue,This showed when I was trying to view a sub 1000X1000 image .,Romance,Romanian
22vin,Roadcam,"Kind of late but since some were confused , let 's clarify : that 's not a tramstation , that 's a pedestrian refuge , used for crossing the road ( crossing several lanes and two tram lines at once is n't wise so it 's done in steps ) . [ This is a tramstation ] ( https : //www.google.com/maps/preview # ! data= ! 1m8 ! 1m3 ! 1d3 ! 2d26.120992 ! 3d44.398293 ! 2m2 ! 1f321.11 ! 2f68.45 ! 4f75 ! 2m4 ! 1e1 ! 2m2 ! 1sJmFUZXtUbgV93XwgbwoZwQ ! 2e0 & amp ; fid=5 ) .",Romance,Romanian
22vin,iphone,"[ Car tyre : ) ] ( http : //i.imgur.com/moGEkpe.jpg ) I rarely use it , I mostly keep my phone as it is . ( it 's dirty because I 've just returned from the seaside , sorry )",Romance,Romanian
22vin,Android,"Same in Romania . Available at Vodafone , 229€ on a 29€/month plan or 459€ off contract . But you can buy it for ~350€ unlocked and off contract from other trusted stores , so why would I buy it from Vodafone .",Romance,Romanian
22vin,funny,Along Came Polly,Romance,Romanian
22vin,classicrage,"Well you would need more than 2 or 3 people pushing it to make it jump out of gear . Of course , assuming the car is in good shape .",Romance,Romanian
22vin,ipad,I use a soft pouch in which The iPad fits with the Cover attached . This is for when I carry it in a bag along with other stuff that might damage it .,Romance,Romanian
22vin,Roadcam,"& gt ; However , on a straight stretch of road , it seems less likely to happen . Come visit Romania and I 'll show you parts of the right lane on freeways where this happens . In fact , here 's a [ streetview example ] ( http : //goo.gl/maps/1JSX9 ) . & gt ; Not to mention that the middle of the road is not where truck tires would usually go . That 's what I was trying to say ; you can see dar marks in the middle of the road . Tires do n't go on the middle of the road so those are not tire marks . Like I said ( and you have an example above ) : I 've seen this type of damage to the road often so I 'm very familiar with how it looks .",Romance,Romanian
22vin,gentlemanboners,You said `` I 'm also romanians '',Romance,Romanian
22vin,Roadcam,"I think they did . But even if they did not , I for example do n't rely on those lights , I always look left and right at a railroad crossing . Hell , I always slow down a bit and look left and right when I 'm entering any intersection on a green light , better to be safe than sorry .",Romance,Romanian
22vin,whatisthisthing,It 's a VW Tiguan 5N2 . Small SUV built on the Golf/Octavia/A3 platform . Quite common here in Europe .,Romance,Romanian
22vin,battlestations,So how 's the FX 8350 ?,Romance,Romanian
22vin,ipad,Which country and city are you visiting ?,Romance,Romanian
22vin,Roadcam,I think that 's just a sticker .,Romance,Romanian
22vin,Roadcam,"The driver said he got distracted for a few seconds , looking for his pack of cigarettes . When he saw the cow it was too late ; he tried to avoid both the cow and the car in front of him but he ended up hitting the cow . Some may wonder why he chose to hit the cow - as he said , pulling left into oncoming traffic or right into the ditch would be much worse choices ( especially the first one ) .",Romance,Romanian
22vin,Roadcam,"I 'm sorry , I wanted to link to t=30s but somehow I failed : )",Romance,Romanian
22vin,Roadcam,"The driver said he got distracted for a few seconds , looking for his pack of cigarettes . When he saw the cow it was too late ; he tried to avoid both the cow and the car in front of him but he ended up hitting the cow . Some may wonder why he chose to hit the cow - as he said , pulling left into oncoming traffic or right into the ditch would be much worse choices ( especially the first one ) .",Romance,Romanian
22vin,Roadcam,It was n't ; the pedestrian is n't on a crosswalk and there are witnesses that can declare the driver could n't do anything to avoid the accident so the driver has no fault . Insurance scams are usually done on crosswalks but those are not very common around here . The author said that the guy was rushing to get to a soccer game and he did n't pay attention .,Romance,Romanian
22vin,Roadcam,"Forgot to say about that : the cow was fine , got back on its feet and minded its own business like nothing happened . The police arrived but they could n't find the man reponsible for the cow .",Romance,Romanian
22vin,Roadcam,"Of course this is what everybody should do but you have to admit , things like a few moments of distraction happen even to the best of us and sadly , sometimes it ends with a crash .",Romance,Romanian
22vin,pics,I 'm paying 20eur/month for the same services : ) 94mbps on speedtest.net edit : [ speedtest results ] ( http : //www.speedtest.net/result/2705540108.png ),Romance,Romanian
22vin,Roadcam,"In some countries , filming on the street is permitted only for vacation/memories purposes . In Austria , for example , filming with a dashcam is not legal ( you will see that there 's no streetview in Austria ) so maybe because they ca n't sell cars with camcorders in some countries they do n't bother mounting them at all . This is something I know from people who live there so I may be wrong . If somebody knows better , please correct .",Romance,Romanian
22vin,technology,"It 's made by a 19yo kid . How many 19yo students do you see designing self driving cars ? Yes , Google 's car is better but Google is a multi billion dollar company woth a lot of employeesand he 's a 19yo student . So I would say this is a big deal .",Romance,Romanian
22vin,ipad,"I use a Pioneer MVH-1400UB . It charges my iPad 4 and it 's very cheap since it does n't have a CD mechanism ( who needs CDs when you have an USB port ) . Plus , it has some subwoofer control options , it works great with my subwoofer .",Romance,Romanian
22vin,AbandonedPorn,Where exactly is this ? ( I live in Arges ),Romance,Romanian
22vin,Android,"It may seem a bit much at first but after you think about it , it 's actually a great idea . Whenever I go on a trip , I carry with me both my laptop and my tablet . The tablet for the battery life and the ease of use and the laptop if I need to do something that requires more processing power or specific windows programs or if I simply want to play some games . With this I can have both and carry almost half the weight in my backpack . Why not have both a good ultrabook and a good tablet in one device ? Compared to the Surface Pro , this one offers much more battery life ( since it uses separate batteries and the android tablet is less power hungry ) , you have much better apps for the tablet mode than you do on Windows Marketplace and I 'd rather use a nice aluminum dock than that cover .",Romance,Romanian
22vin,videos,"Yes she did . For example , she banned birth control and abortions which led to a lot of orphans . Also , since abortions were illegal , women provoked them at home and this led to a lot of deaths ( they even provoked abortions by poisoning themselves with oleander ) .",Romance,Romanian
22vin,AppHookup,"Claimed , thanks !",Romance,Romanian
22vin,iphone,"You do n't need to `` delve into the deeps of settings '' , you just have to change a wallpaper .",Romance,Romanian
22vin,Roadcam,"It 's actually sad that few people know how dangerous and fast carbon monoxide poisoning is and the fact that by the time you realise something 's wrong , it 's already too late . This is a very stupid and sad way to die .",Romance,Romanian
22vin,Roadcam,"What a bunch of complete assholes . It 's obvious that the old man is insane and he 's not aware of what he 's doing but no , the tram drivers gets out of his tram and punches the old man in the face , knocking him down like that 's the best way to deal with an old and insane man . And the car drivers just sit there and watch . They could have tried to pull the old man off the rails earlier or at least stop and check if he 's hurt . But no , they just watch the show like some fucking morons . So , in these people 's opinion , if you 're old and insane you do n't deserve to be treated like a human being . Well , I wish they suffer the same fate .",Romance,Romanian
22vin,Roadcam,Just look at the road . See the trenches made by trucks ? Those can easily cause skidding if you 're not very careful with the steering wheel when changing lanes .,Romance,Romanian
22vin,Roadcam,"You can see that [ there are three dark marks and they are in the middle of the lanes and on the middle of the road ] ( http : //i.imgur.com/qyx13Fs.png ) . If they were tire marks you would have seen four , two of them centered on each lane . This is just how the asphalt looks when there are trenches made by trucks . I know this because I 've seen it a lot .",Romance,Romanian
22vin,ipad,I never used a screen protector and My screen is n't scratched at all . I recommend buying a Smart Cover ; it will protect the screen when you carry the device in your bag and it is also very useful .,Romance,Romanian
22vin,classicrage,"Normally , yes , the engine would just turn over . But I 've seen some cars which were not in a normal state jumping out of gear .",Romance,Romanian
22vin,popping,You need to go see a surgeon . It 's discolored and swollen and I bet it 's pretty warm . These are signs of an infection you do n't want to deal with at home . I 'm just a med student so I can only advice you to go see a doctor and do it now .,Romance,Romanian
22vin,IWantOut,"Yeah , the EU would be the logical option , I know that my diploma is recognised here . But if I choose to stick to the EU , I would prefer Belgium , since I already have family friends there ( Wallonia region ) , who are also doctors . Since I attended French classes for 8 years in middle achool and high school , re-learning it should n't be difficult . I 'd also like to know : would it be best to take my residency exam and choose a specialty here rather than only having an M.D . diploma ? Thanks for your answer : )",Romance,Romanian
22vin,Watches,"You can take a look at Q & amp ; Q watches , they 're really cheap . From what I know , Q & amp ; Q is a subsidiary of Citizen but they 're made in China , they have Miyota movements and I do n't know how well they hold up over time . I strongly recommend you increase your budget . I do n't think you 'll find a new , decent watch in this budget .",Romance,Romanian
22vin,ipad,"The refurbished devices look exactly like brand new ones . They have new casing , new battery and they 're thoroughly tested . I received a replacement iPhone when my home button started acting up and there 's no way of telling if it 's new or refurbished . It looks brand new and you ca n't tell if it 's new or not from the s/n .",Romance,Romanian
22vin,funny,And because you live in a country where Apple Maps probably knows all the streets . My hometwon looks like a slightly bigger village in Apple Maps .,Romance,Romanian
22vin,technology,"You know the 4 finger swipe-up gesture to open multitasking on an iPad ? It does n't make sense now . Also , displaying a full screen folder with 9 icons at a time on a 10 '' display does n't make any sense either . iOS7 might look nice and slick on an iPhone but on an iPad it feels rather unfinished and not tablet optimised .",Romance,Romanian
22vin,technology,Apple made their office apps free for their new devices . If you do n't own a 5c or 5s you still have to pay for them .,Romance,Romanian
22vin,ipad,Catch,Romance,Romanian
22vin,Android,I also love the battery life on my iPad 4th gen. At the moment I have 11hrs and 2mins of usage and 28 % battery left ( I rarely play games and it 's a wifi only model ) .,Romance,Romanian
22vin,Roadcam,Some people install an [ LPG tank in the spare wheel compartment ] ( http : //www.ecokraftbest.ro/images/modules/noutati/images/20090921210153.JPG ) . But this one is a taxi driver so I 'm surprised he could n't find a colleague who could lend him a spare wheel .,Romance,Romanian
22vin,samsung,Open the messaging app - & gt ; menu button - & gt ; settings - & gt ; message alert repetition,Romance,Romanian
22vin,Android,"When the Nexus 4 launched in Romania , the price off contract was 450eur so the Nexus 5 will probably cost around 500eur . If you compare our wages with yours you 'll see that the N5 is much more less affordable for Romanians than it is for Norwegians . So keep in mind , if you think prices suck for you guys , some of us have it worse .",Romance,Romanian
22vin,WTF,I think they 're condyloma caused by an HPV infection .,Romance,Romanian
22vin,techsupportmacgyver,"Wan na see [ something classier ] ( http : //imgur.com/a/mU6DA ) ? Location : Timisoara , Romania",Romance,Romanian
22vin,ipad,"Apple used to pay great attention to details . I ca n't understand how this is a good idea . I also dislike the full screen notifications pull-down . They 're not even using the whole space to show notifications , I feel like the 10 '' display on my tablet is only used to display bigger stuff , not more information .",Romance,Romanian
22vin,samsung,"If the phone shows absolutely no sign of life , I 'm pretty sure it 's motherboard failure . I hope your phone is covered by warranty .",Romance,Romanian
22vin,FiftyFifty,In my country the forensics open all three cavities ( starting with the skull ) in suspicious death cases . All the autopsies I attended this week looked exactly like this photo .,Romance,Romanian
22vin,FiftyFifty,"Psoriasis lesions can be located on various parts of your body ( head , back , hands , knees ) . Usually the best treatment is UV exposure .",Romance,Romanian
22vin,ipad,"For $ 100 you 're getting a device that 's thinner , lighter , has narrower bezels , has a much better display and much more processing power . Basically it 's a no brainer . Corporations , schools and other organizations prefer the 2 because the $ 100 difference counts when you place big orders . But if you 're getting one for yourself , the extra $ 100 are definitely worth it .",Romance,Romanian
22vin,ipad,"It 's not just about some mm and grams less , it 's about the retina display and A7 chip . The display is excellent plus iOS7 does n't look too good on 132ppi",Romance,Romanian
22vin,Roadcam,If he had n't landed with his foot on the brakes he would have probably escaped the situation . But if he knew what he was doing he would n't overtake like that in the first place .,Romance,Romanian
22vin,Roadcam,There 's actually a [ new Logan ] ( http : //autocarindo.com/wp-content/uploads/2013/07/Dacia-Logan-2013-images-02.jpg ) now . The first model ( the one in your picture ) did n't come with ABS in the 5500eur version .,Romance,Romanian
22vin,awesome,"Yes , look at the vegetation and the houses",Romance,Romanian
22vin,funny,"You do n't use a blanket . You use a longer plastic foil ; put it on the windshield , leave the ends in the car and close the doors on them . The end result is [ something like this ] ( http : //s2.zoot.ro/deco/catalog/product/cache/1/image/336x/5e06319eda06f020e43594a9c230972d/3/6/folie-cu-magneti-pentru-protejarea-parbrizului-1633.jpg ) . It 's easy , quick and it pays off .",Romance,Romanian
22vin,AlienBlue,"A lot of crashes on both my iPhone 4 and Ipad 4 . Honestly , I feel like this app is getting more buggy and crashes more often with each update .",Romance,Romanian
22vin,Android,"That 's exaclty what I did , I took it out immediately and now it 's sitting somewhere it ca n't ignite anything if something happens . It 's currently 1AM where I 'm living so I 'll have to wait until tomorrow to take it to a Samsung service .",Romance,Romanian
22vin,videos,"Romania : the delivery guy calls me before coming to my house to see if I 'm home or not . If I 'm home , he 's at my doorstep in a few minutes ; if not , he asks when will I return and if I 'm not able to come home early enough he either takes the package back to his company 's local agency in order for me to pick it up or asks when can he return . You have to sign for the package . You can also meet the driver somewhere along his route .",Romance,Romanian
22vin,AdviceAnimals,"Did n't you see his skin turning a shade of yellow ? Or at least his sclera , that 's the easiest to spot .",Romance,Romanian
22vin,Roadcam,Depends on the type of traction . If it 's a FWD you can correct the sliding with gentle acceleration ( in this case turning the weel slightly to the right and a bit of gas would have gotten her out of that situation ) . She panicked and overcompensated .,Romance,Romanian
22vin,Romania,ALL HAIL MOISE GURAN ! ! !,Romance,Romanian
22vin,Roadcam,I think you were told you can cross on a fresh yellow if you ca n't stop the car safely . If the light turns yellow 10-15m in front of you it 's not recommended to slam on the brakes .,Romance,Romanian
22vin,Roadcam,Buses have air suspension and air brakes so that might be pressurized air coming out .,Romance,Romanian
22vin,IWantOut,"I knew right from the beggining , before going to medical school , that as a junior doctor you do a crapton of work and receive a small salary . Working long hours does n't scare me since it 's my education we 're talking about and the salary may be small but not smaller than the Romanian one . It 's true that non-EU countries tend to prefer already trained doctors but maybe there 's a way , even though it 's more complicated . Thanks for your answer : )",Romance,Romanian
22vin,Watches,Sure but this was a 30-40 min bath in an inflatable pool . Since it 's 4-5 meters in diameter and 70-80cm deep you ca n't even swim in it .,Romance,Romanian
22vin,Justrolledintotheshop,An Infiniti salesman once asked me to powerslide the FX 30d we were in so I can see it does n't act like a regular diesel SUV . Another Honda salesman asked me to only change gears when the rev limiter hits because it was a vtec and I should see how sporty it is at high rpm ( it was a 1.8 140cp Civic so there was nothing sporty about it ) .,Romance,Romanian
22vin,IWantOut,"I understand From what I heard Canada accepts the Romanian degree ( the US does n't equivalate it and you need to take some exams ) ; they 're also present at medical job fairs , but , as you said , they 're looking for already trained doctors .",Romance,Romanian
22vin,IWantOut,Pitesti is my hometown and I 'm studying in Bucharest Ne cunoastem ? : ),Romance,Romanian
22vin,IWantOut,"Yeah , it seems like training in the EU and looking for a job on another continent afterwards is a much better choice ( probably the only choice ) . I 'll look more into it after my vacation ends . Thanks : )",Romance,Romanian
22vin,IWantOut,"Do n't get me wrong , I 'm not 100 % certain , it 's just stuff I heard from various people .",Romance,Romanian
22vin,ipad,"You can easily get over 10 hours of usage depending how much you decrease the backlight . It depends how you use the tablet . If I play Real Racing 3 at 100 % brightness the battery would probably drain completely in less than 5 hours . But if I just browse the web with the brightness set to 5-10 % at night ( when I mostly use it ) and 60 % during the day , I get about 14 hours of usage . So tell us , what does active usage mean to you ? Is it a 4G or a Wi-Fi only model ?",Romance,Romanian
22vin,Roadcam,"You 're wrong . A lane in a roundabout is just like any lane . You can go around a roundabout as long as you want to , it 's just like driving on a priority road but instead of driving straight , you 're going in a circle . That 's why you have to yield when you enter a roundabout . Think of a motorway strip : two lanes and exits and entrances on the right . If you want to exit you have to be on the first lane but if you are on the first lane you 're not forced to exit , you can just continue on your way , straight ahead . Now take that strip and turn it in a circle . That 's a roundabout . I hope I made myself clear ; if not , I 'll try to be more explict .",Romance,Romanian
22vin,Roadcam,"Stai putin , ca nu inteleg . Regula circulatiei in giratoiu la noi e exact cum am spus mai sus . Poti sa te convingi si aici : http : //youtu.be/rJJpAHwYUrE ? t=45s . O spune ca e din eu de est , si noi suntem si la noi nu este cum zice el . The video is in Romanian , so video translation : often , the intersection has two or three lanes and the problem is at the exit , when you exit on a single lane . Then , the guy who is driving on the second or third lane in the intersection and wants to leave the intersection has two options : either he stops and yields to those who are on the inferior lanes because , technically , the roundabout is nothing else than a one way road where the participants have to yield to the right ( so if you 're on the second lane , the car driving on the first lane is on your right and you have to yield )",Romance,Romanian
22vin,Roadcam,"There 's something I do n't understand in your comment . You 're saying that the roundabout is considered as any other street with right of way on the right . When you 're travelling on the inside lane , the car on the outside lane is on your right . So you have to yield to that car . The traffic rules in a roundabout in Romania are just like I explained in [ my comment below ] ( http : //www.reddit.com/r/Roadcam/comments/1kfbqg/roundabouts_youre_doing_it_wrong/cbojh9h ) . You 'll see that in the video I posted as a reply ( sorry non-romanian guys because the video is in romanian ) the driving instructor is saying just that .",Romance,Romanian
22vin,Roadcam,"[ Here ] ( http : //www.gds.ro/Subiectul % 20Zilei/2012-09-10/Totul+despre+giratorii ) is a newspaper article that cites the Police in your city . This is what I 'm interested in : '' Pentru a înţelege circulaţia în giratorii , poliţiştii spun că ar trebui ca şoferii să le compare cu un drum în curbă cu mai multe benzi . Ca şi pe un astfel de drum , şi în sensurile giratorii funcţionează regulile schimbării benzilor de circulaţie sau a direcţiei de mers . '' Translation : to better understand driving in a roundabout , the police officers say that the drivers should consider the roundabouts as a multi-laned curved road . The lane-changing or direction-changing rules apply the same . So , it 's like you 're on a motorway and you 're driving on the right lane . There is a car driving 1m in front of you , on the left lane . An exit comes up and the car driving on the left lane cuts you off to take the exit . There 's no need to tell who 's guilty in this situation and it 's exactly the same in a roundabout . I 'm sorry , but that police officer was wrong about your father 's case .",Romance,Romanian
