user,subreddit,post,family,lang
12341,conspiracy,A Christian writer admits : We Americans live in the shadow of an apartheid regime,Romance,Native
12341,ukpolitics,"It 's not rocket science , we should know the ins ( births , migrants ) and outs ( deaths , migrants ) , the budget should determine policy changes , then see how many dwellings are available , if we are low , we should also look at how many properties an individual / company can own to free them up for new people , once all is addressed , there 's no other option but to build on green belt .",Romance,Native
12341,unitedkingdom,"If only it was so simple , we 'd have a new leader every week .",Romance,Native
12341,unitedkingdom,"Removing a politician does n't rule out cronyism putting in a new `` poisonous politician '' , cabinet ministers should be chosen by the public to prevent nepotism and swiftly removed through E-democracy .",Romance,Native
12341,unitedkingdom,"No , but it should be made easier and given a longer time . Should be able to vote online and by app , during a period of 1 month of no campaign , where you 'll be able to cast and change your vote . If I had my way , I 'd replace choosing a party to filling in a questioner , where your answers are matched to the views of participating parties .",Romance,Native
12341,ukpolitics,Been very effective at spreading terrorism .,Romance,Native
12341,ukpolitics,"No shame , just intellect .",Romance,Native
12341,ukpolitics,Great way to start a civil war .,Romance,Native
12341,ukpolitics,"That 's quite low for Soros , it 's going to need another scandal .",Romance,Native
12341,ukpolitics,Maybe he is unhappy [ about tax avoidance ] ( http : //www.bbc.co.uk/news/business-32601658 ) .,Romance,Native
12341,ukpolitics,Panama Papers show nothing as they have n't been released .,Romance,Native
12341,conspiracy,Transparency International has backing from Soros and attended Bilderberg 2015 .,Romance,Native
12341,conspiracy,"Going by the statistics in Syria , it will take over 14,285 years to extinguish the Hindu population of India , not factoring in assimilation , apostasy , asteroids , population growth .",Romance,Native
12341,conspiracy,Correct title : Israel prevents terrorists from gaining weapons,Romance,Native
12341,conspiracy,"ISIS has to get past al-Nusra , FSA , Syrian army and any air strikes from various participants to get to Israel .",Romance,Native
12341,conspiracy,UK ranks 34 in the world press freedom index .,Romance,Native
12341,conspiracy,"C.I.A . Said to Aid in Steering Arms to Syrian Opposition JUNE 21 , 2012 WASHINGTON — A small number of C.I.A . officers are operating secretly in southern Turkey , helping allies decide which Syrian opposition fighters across the border will receive arms to fight the Syrian government , according to American officials and Arab intelligence officers . http : //www.nytimes.com/2012/06/21/world/middleeast/cia-said-to-aid-in-steering-arms-to-syrian-rebels.html",Romance,Native
12341,PropagandaPosters,I class that tweet as a threat .,Romance,Native
12341,unitedkingdom,A unique code and name should be secure enough .,Romance,Native
12341,unitedkingdom,"Israel withdrew from Gaza in 2005 , Hamas serves no purpose .",Romance,Native
12341,unitedkingdom,And what 's the plan for the 17m people that voted against the EU ?,Romance,Native
12341,unitedkingdom,"Just checked a price comparison site , British Gas is £60-100 dearer .",Romance,Native
12341,unitedkingdom,Oil deals in Libya .,Romance,Native
12341,unitedkingdom,It 's just censored . https : //airwars.org/civcas-2016/,Romance,Native
12341,ukpolitics,"& gt ; With cargo traffic forecast to grow at 4.2 % a year , Boeing forecast a need for 930 new freighters and 1,440 converted freighters over the next 20 years . Forecasting 118 jobs a year , excluding redundancy by robots . Article does n't explain why we need the planes , are we off to war ?",Romance,Native
12341,ukpolitics,Sounds like [ Peter Sutherland ] ( http : //www.bbc.co.uk/news/uk-politics-18519395 ) .,Romance,Native
12341,unitedkingdom,Stalking cameraman snaps dick,Romance,Native
12341,ukpolitics,General election tomorrow .,Romance,Native
12341,unitedkingdom,"Arms sales , jobs , disposal of plebs , terrorism , fear , partial patriotism , deals on natural resources .",Romance,Native
12341,unitedkingdom,[ This looks urban . ] ( https : //www.youtube.com/watch ? v=GQUsMB8uTDU ),Romance,Native
12341,unitedkingdom,Artificial populism .,Romance,Native
12341,ukpolitics,They 'll make 50 million when the pound returns to pre-Brexit days .,Romance,Native
12341,unitedkingdom,"Nationalism blinds people , politicians exploit it .",Romance,Native
12341,ukpolitics,Said Tony Blair .,Romance,Native
12341,ukpolitics,So what do you expect from Russia when nations are playing war games near its borders ?,Romance,Native
12341,ukpolitics,Hacked Emails Reveal NATO General Plotting Against Obama on Russia Policy https : //theintercept.com/2016/07/01/nato-general-emails/,Romance,Native
12341,ukpolitics,"Still , no evidence that they plan on annexing Europe .",Romance,Native
12341,ukpolitics,Over 60 % of Crimeans identify themselves as ethnically Russian .,Romance,Native
12341,ukpolitics,[ Could not resist . ] ( http : //i.imgur.com/bAmF733.jpg ),Romance,Native
12341,unitedkingdom,Assisted dying would of prevented this .,Romance,Native
12341,unitedkingdom,It was n't murder,Romance,Native
12341,unitedkingdom,"manslaughter ˈmanslɔːtə/ noun : manslaughter ; plural noun : manslaughters the crime of killing a human being without malice aforethought , or in circumstances not amounting to murder .",Romance,Native
12341,conspiracy,"Misleading title , nowhere in the Haaretz article says that Russia would bomb Israel .",Romance,Native
12341,conspiracy,Artificial intelligence fail .,Romance,Native
12341,conspiracy,Nothing to do with NATO nations rotavating the Middle East and northern Africa ...,Romance,Native
12341,ukpolitics,All nuclear weapons should be destroyed .,Romance,Native
12341,gifs,You forgot the bit where France gives the ball to Saudi Arabia .,Romance,Native
12341,LabourUK,"It is n't Corbyn that has armed and funded irregular opposition groups . Cameron , Hollande , Obama and our allies that surround conflicted borders have .",Romance,Native
12341,ukpolitics,"It is n't Corbyn that has armed and funded irregular opposition groups . Cameron , Hollande , Obama and our allies that surround conflicted borders have .",Romance,Native
12341,unitedkingdom,"It is n't Corbyn that has armed and funded irregular opposition groups . Cameron , Hollande , Obama and our allies that surround conflicted borders have .",Romance,Native
12341,unitedkingdom,"Syria is surrounded by allies , how does ISIS get weapons without allies participation ?",Romance,Native
12341,ukpolitics,"Migration creates disapproval , which leads to people voting for Brexit .",Romance,Native
12341,ukpolitics,[ Depends on your perspective . ] ( http : //www.bbc.co.uk/news/uk-politics-18519395 ),Romance,Native
12341,ukpolitics,"Banks sat on both sides , waiting for the pickings .",Romance,Native
12341,ukpolitics,On the outcome of the investigation .,Romance,Native
12341,ukpolitics,"A quick look at Twitter , everyone 's instantly blaming Corbynistas , some people do n't think at all .",Romance,Native
12341,ukpolitics,A lot of people benefit from a negative story about a party .,Romance,Native
12341,ukpolitics,"No , there 's too many benefits from social disorder .",Romance,Native
12341,unitedkingdom,"Sounds like support and an arms deal to me . & gt ; “ We work hand in hand to stop the security threat , posed by those extremists , to the security and stability of the Kingdom of Saudi Arabia and the world , which hit the families of the innocent victims with deep sorrow and pain , ” he added .",Romance,Native
12341,unitedkingdom,"Impossible to regulate , unless they have a contract with GCHQ .",Romance,Native
12341,unitedkingdom,Is this the same Campbell that destroyed Iraq ?,Romance,Native
12341,ukpolitics,Evidence that Russia wants to swallow Europe ?,Romance,Native
12341,unitedkingdom,"Days after the Chilcot report , we are grinding the axes .",Romance,Native
12341,unitedkingdom,"Would rather just having a symbolic head of state and cabinet ministers that actually know what they are doing , but this is too democratic for Brits to understand .",Romance,Native
12341,ukpolitics,according to similarweb.com : 1. labour 2. green party 3. lib dems 4. ukip 5. conservatives,Romance,Native
12341,unitedkingdom,Backup streams : https : //www.youtube.com/watch ? v=DoJi5OLVFxg https : //www.youtube.com/watch ? v=mm9IYa0w-f8,Romance,Native
12341,unitedkingdom,"They were just reporting on some sports , as their live stream is international , they put up a logo to avoid copyright problems , same applies to advertising .",Romance,Native
12341,unitedkingdom,"[ Pablo Iglesias ] ( https : //en.wikipedia.org/wiki/Pablo_Iglesias_Turri % C3 % B3n ) in Spain tried to do that with [ Podemos ] ( https : //en.wikipedia.org/wiki/Unidos_Podemos ) , so far has [ failed ] ( https : //en.wikipedia.org/wiki/Spanish_general_election , _2016 # Congress_of_Deputies ) .",Romance,Native
12341,ukpolitics,You would need 11 Tories to vote for a general election and every member from the other parties .,Romance,Native
12341,ukpolitics,Sir John Chilcot could choose to investigate the Libyan war .,Romance,Native
12341,ukpolitics,"No bankers , please .",Romance,Native
12341,unitedkingdom,Nobody in the history of mankind has ever referred to an Islamic nation as `` self-styled '' . It has mainly been used to refer to ISIS by [ various ] ( http : //www.voanews.com/content/the-isis-isil-debate-whats-in-a-name/2472132.html ) media [ organisations ] ( http : //www.bbc.co.uk/news/world-middle-east-27994277 ) .,Romance,Native
12341,unitedkingdom,"Verbal communication and understanding between all workers is vital , especially in the NHS .",Romance,Native
12341,unitedkingdom,"So at the end of his term he would of cost £1 million , a flight to Somalia costs £564 , a saving of £999,436 .",Romance,Native
12341,unitedkingdom,"The main driver of TTIP has been the UK , expect a similar deal done [ without opposition ] ( https : //www.theguardian.com/business/2016/may/03/doubts-rise-over-ttip-as-france-threatens-to-block-eu-us-deal ) .",Romance,Native
12341,ukpolitics,[ He 's just doing as told . ] ( http : //www.telegraph.co.uk/news/uknews/terrorism-in-the-uk/8070277/Home-Secretary-warns-public-to-remain-vigilant-in-the-face-of-a-highly-likely-terrorist-attack.html ),Romance,Native
12341,unitedkingdom,Take no notice from Mr Arms Dealer,Romance,Native
12341,ukpolitics,How did they calculate that 64.1 million fell silent .,Romance,Native
12341,unitedkingdom,There 's other problems related to the UK that affected the vote against the EU .,Romance,Native
12341,unitedkingdom,Mostly quotes what Michael Fallon stated to Sky News .,Romance,Native
12341,ukpolitics,Sounds like Sarah Palin .,Romance,Native
12341,ukpolitics,Do n't they all .,Romance,Native
12341,unitedkingdom,The sign shown in that article is from an ANTIFA event on 24 June .,Romance,Native
12341,ukpolitics,NATO must be demolished,Romance,Native
12341,unitedkingdom,"Would rather it be off by default , but then we are living in an idiocratic era , parents would be too lazy to turn it on .",Romance,Native
12341,unitedkingdom,"If we 're worried about dictators , lets invade resourceless Zimbabwe .",Romance,Native
12341,ukpolitics,Hillary Clinton : We created Al-Qaeda https : //www.youtube.com/watch ? v=Dqn0bm4E9yw,Romance,Native
12341,ukpolitics,"With millions to hide away and bodyguards , it is certainly safer for him .",Romance,Native
12341,ukpolitics,"Same happened in Libya and Syria , we create opportunity , by supplying cash and arms to belligerent forces to get rid of a governing power , once the area is in chaos it gives us an excuse to take over with military and get good deals on natural resources .",Romance,Native
12341,ukpolitics,Cameron done the same as Tony in Libya .,Romance,Native
12341,unitedkingdom,Just as Libya and Syria .,Romance,Native
12341,ukpolitics,aka Murdoch .,Romance,Native
12341,ukpolitics,... `` I 've got more than enough to be doing representing my constituents . '' ... Voting record in parliament : 25.2 % since May 2015 .,Romance,Native
12341,ukpolitics,"If wages and costs of living were all equal across Europe , the concept of freedom of movement would be beneficial .",Romance,Native
12341,unitedkingdom,"All commercial radio stations source their news from IRN which has a contract with Sky News . ITV , Channel 4 and Channel 5 source all their news from ITN . BBC tv and radio is too militaristic , pro monarchy , pro establishment . As for newspapers , just look up their owners , barons to former KGB spies , they all come with agendas . You either live in a matrix of information or do n't listen to anyone .",Romance,Native
12341,unitedkingdom,"Working in the industry , it has been a sluggish month , merchants have also upped their offers and advertising to recoup losses .",Romance,Native
12341,ukpolitics,"This event was started in Iran , where they burn effigies of leaders , portray Jews as donkeys . There is nothing positive to take out of it , other than hatred .",Romance,Native
12341,ukpolitics,"Israel had a real casus belli , UK did not .",Romance,Native
12341,unitedkingdom,"Instead of having lowlifes debating on TV , we should of had academics .",Romance,Native
12341,unitedkingdom,"USA is a corporatocracy , it is not independent .",Romance,Native
12341,unitedkingdom,Libya and Syria is also about oil .,Romance,Native
12341,unitedkingdom,FBI is domestic .,Romance,Native
12341,unitedkingdom,I would like to know what the public are supposed to do with this snippet .,Romance,Native
12341,unitedkingdom,They are just testing their censorship software . Keep yourself free with VPN and different DNS .,Romance,Native
12341,IAmA,I would n't call intentionally firing rockets at cities resistance .,Romance,Native
12341,IAmA,How much does Iran pay you to go on PressTV news channel ?,Romance,Native
12341,IAmA,How much does Putin pay you to go on Russia Today news channel ?,Romance,Native
12341,IAmA,What do you like about Israel ?,Romance,Native
12341,IAmA,Do you also think Obama is a maniac ?,Romance,Native
12341,unitedkingdom,"Our corporate MP 's do n't represent us , nor will the new lot represent us after the election . Your vote is part of a fairytale .",Romance,Native
12341,NeutralPolitics,"RT , Al-Jazeera will find stories left out of American , British media . American , British media will find stories left out of Russian and Arab media . Just take everything with a pinch of salt . If you have a translator you could try some Scandinavian media which gets top ratings in press freedom .",Romance,Native
12341,IAmA,Takes one maniac to know one .,Romance,Native
12341,ukpolitics,Parties over a 100 years old are part of the establishment .,Romance,Native
12341,POLITIC,How would you feel with 8 armies attacking you ?,Romance,Native
12341,MapPorn,I would consider someone who has no cash after rent and food a slave .,Romance,Native
12341,POLITIC,"Looks like pallywood , different shirts , trainers , chrome gun ?",Romance,Native
12341,ShittyEarthPorn,I can imagine someone being tickled while registering the name at the same time .,Romance,Native
12341,IAmA,Would you stop exporting arms ?,Romance,Native
12341,Israel,Makes you wonder what else they are omitting from the states viewpoint .,Romance,Native
12341,worldnews,[ http : //www.aljazeera.com/news/middleeast/2014/11/jerusalem-synagogue-attacked-gunmen-201411185401123578.html ] ( http : //www.aljazeera.com/news/middleeast/2014/11/jerusalem-synagogue-attacked-gunmen-201411185401123578.html ) Al-Jazeera Arabic website features Jews as [ crocodiles ] ( http : //www.aljazeera.net/news/caricature/2014/11/11/ % D9 % 83 % D8 % A7 % D8 % B1 % D9 % 8A % D9 % 83 % D8 % A7 % D8 % AA % D9 % 8A % D8 % B1- % D8 % A7 % D9 % 84 % D8 % AE % D8 % B7 % D8 % B1 ) and [ snakes ] ( http : //www.aljazeera.net/news/caricature/2014/11/12/ % D9 % 83 % D8 % A7 % D8 % B1 % D9 % 8A % D9 % 83 % D8 % A7 % D8 % AA % D9 % 8A % D8 % B1- % D8 % B5 % D9 % 88 % D8 % AA- % D8 % A7 % D9 % 84 % D9 % 82 % D8 % AF % D8 % B3 ) .,Romance,Native
12341,technology,I 've also heard that terrorists use Larynxes .,Romance,Native
12341,IAmA,Do you think Americans should boycott American products ?,Romance,Native
12341,trashy,The pattern made me think of Vincent van Gogh 's [ The Starry Night ] ( http : //en.wikipedia.org/wiki/The_Starry_Night ) painting .,Romance,Native
12341,worldnews,But they provide street kids with jobs .,Romance,Native
12341,Israel,"One would hope if they get told off by enough international groups , that they would stop . But as the Non-Aligned Movement , Organisation of Islamic Cooperation & amp ; Arab League , a group of over 120 nations , are able to abuse the United Nations , prevention does n't exist . Just look at Saudi Arabia 's and Arab League reaction to Norway criticising their human rights as a different example .",Romance,Native
12341,Health,ISIS declined to comment .,Romance,Native
12341,Israel,"Shame Amnesty International was n't condemning rocket fire from Gaza in the days leading up to 8th of July , might of prevented war .",Romance,Native
12341,youdontsurf,[ You forgot about the girl ] ( http : //i.imgur.com/VVghoNo.jpg ),Romance,Native
12341,Health,[ Shareholders are n't happy ] ( http : //finance.yahoo.com/echarts ? s=MON+Interactive # { % 22range % 22 % 3A % 225d % 22 % 2C % 22scale % 22 % 3A % 22linear % 22 } ),Romance,Native
12341,conspiracy,The Queen,Romance,Native
12341,conspiracy,"During the entire video , one unidentifiable male wearing glasses threw a stone at nothing .",Romance,Native
12341,worldnews,Hope they built a new prison before launching the investigation .,Romance,Native
12341,worldnews,"[ Non-Aligned Movement ] ( http : //en.wikipedia.org/wiki/Non-Aligned_Movement ) , [ Organisation of Islamic Cooperation ] ( http : //en.wikipedia.org/wiki/Organisation_of_Islamic_Cooperation ) & amp ; [ Arab League ] ( http : //en.wikipedia.org/wiki/Arab_League ) like to bully Israel at the United Nations .",Romance,Native
12341,worldnews,Pope becomes atheist .,Romance,Native
12341,conspiracy,/r/conspiracy should be called /r/farsnewsagency,Romance,Native
12341,conspiracy,Just look up Ahmadinejad 's speeches at al-Quds Day .,Romance,Native
12341,unitedkingdom,"Do n't think even Fatah or Hamas recognize the State of Palestine , their [ flags ] ( http : //en.wikipedia.org/wiki/Fatah # /media/File : Fatah_Flag.svg ) do n't [ match ] ( http : //en.wikipedia.org/wiki/Hamas # /media/File : Small_hamas_logo.gif ) .",Romance,Native
12341,conspiracy,"Ahmadinejad called for Israel 's destruction all the time during his control , invited KKK David Duke to a Holocaust conference in Tehran , and allowed newspapers to portray Jews as monsters seeking to take over the world . Iran also supports Hamas and Hezbollah which hate Jews even more and promote blood libels on their Al-Aqsa and Al-Manar television channels .",Romance,Native
12341,conspiracy,"It 's not that easy to say that they are aiding al-Qaeda or specifically al-Nusra , when there 's so many different [ armed groups ] ( http : //en.wikipedia.org/wiki/List_of_armed_groups_in_the_Syrian_Civil_War # Overall_conflict_.282011.E2.80.93present.29 ) fighting from different religions , cultures for different causes and changing allegiances like the wind .",Romance,Native
12341,trashy,Wonder what Sigmund Freud 's theory is for this .,Romance,Native
12341,worldnews,Lockheed Martin Corporation likes this news .,Romance,Native
12341,conspiratard,"This hoax was started in July from Iran 's state-run Fars News Agency , which claimed Edward Snowden leaked the details , but no such documents exist .",Romance,Native
12341,AskReddit,I 'd fly to the Amazon and eat monkeys for a year .,Romance,Native
12341,PropagandaPosters,It 's cheaper to live in Ukraine .,Romance,Native
12341,unitedkingdom,Israel nearly shot Blair out of the sky in 2008 .,Romance,Native
12341,conspiracy,I would like to see a documentary about Galloways dealings with Ismail Haniyeh and Mahmoud Ahmadinejad .,Romance,Native
12341,unitedkingdom,I doubt conventional cows roam green fields . Fixed the advert : http : //i.imgur.com/5OwlWE9.jpg,Romance,Native
12341,Israel,That 's called self-defence .,Romance,Native
12341,Israel,The Guardian lacks reporting of Afghanistan incidents : http : //www.khaama.com/category/afghanistan http : //www.theguardian.com/world/afghanistan,Romance,Native
12341,pics,"The correct registration is 9M-MRO , not 9M-MRQ .",Romance,Native
12341,worldnews,Iran 's Press TV is a bit hypocritical labelling Al-Qaeda terrorists while calling Hamas and Hezbollah resistance movements .,Romance,Native
12341,Health,How would this affect satiety ?,Romance,Native
12341,ukpolitics,Love how the article leaves out mentioning Russia .,Romance,Native
12341,worldnews,"Israel gets kicked around a lot at the United Nations by members of the Non-Aligned Movement , Organisation of Islamic Cooperation and League of Arab States .",Romance,Native
12341,unitedkingdom,The entire defence budget should be put into the health budget .,Romance,Native
12341,britishproblems,You should tune into Birdsong on DAB radio .,Romance,Native
12341,britishproblems,I have a picture of Richard and Judy in my wallet .,Romance,Native
12341,britishproblems,"From October to April , Britain gets coated in sugar .",Romance,Native
12341,worldnews,"That 's all the MP 's in jail then , promising us things if they get re-elected .",Romance,Native
12341,unitedkingdom,Party leaders should all start an IAmA on reddit .,Romance,Native
12341,Libertarian,Might reduce the amount of breeding and chavs with Pit bulls .,Romance,Native
12341,britishproblems,Cadbury are so Krafty .,Romance,Native
12341,ukpolitics,"Blacklisting bloggers , interfering with independent news sites like Lenta.ru , misleading international readers on sites like RT.com .",Romance,Native
12341,ukpolitics,"The usual voting papers would be issued , but this time with a unique code used to verify the voter in the app .",Romance,Native
12341,conspiracy,"He looks quite biased towards condemning and boycotting Israel which would make Jews think of anti-Semitism , if he wanted to look more decent , he would condemn rockets indiscriminately being fired at Israeli towns , boycott plenty other nations including his own , UK , which I would say are a lot more active around the world .",Romance,Native
12341,unitedkingdom,"Why on earth do we vote for such roles , why on earth are they affiliated to political parties , why on earth did they vote for someone with no background in the role they are going to play . Why on earth we are not allowed to vote for government cabinet ministers positions I do n't know .",Romance,Native
12341,Health,"They want to put toys in healthier meals as a reward , unless you want your representatives to be bought out by pharmaceutical companies .",Romance,Native
12341,Israel,"They view every Israeli as a settler , which are seen as military targets . 24/08/2014 : Al-Qassam Brigades bombed Ashdod , sourcing Hamas ' own website : http : //www.alqassam.ps/arabic/ # ! /البيانات/5186/",Romance,Native
12341,propaganda,"I 've been watching teleSUR 's Twitter , and its pretty bias towards Israel , even publishing photos alongside stories about Israel-Gaza that are not related or photoshopped .",Romance,Native
12341,photoshopbattles,[ Follow the money ] ( http : //imgur.com/e72kKJj ),Romance,Native
12341,dataisbeautiful,"Israel is very good at protecting their population , death counts do n't count for unsuccessful attempts to kill . Hamas has no interest in protecting Arab or Israeli civilians .",Romance,Native
12341,Israel,Every breath you take Every move you make Every bond you break Every step you take I 'll be watching you .,Romance,Native
12341,unitedkingdom,"Their actions , image , abuse tell us they are miles away from a normal human .",Romance,Native
12341,unitedkingdom,Because the royal family does n't represent the values of the citizens of the country they supposedly represent .,Romance,Native
12341,britishproblems,Their CO2 emissions must be high .,Romance,Native
12341,ukpolitics,"Two corrupt governments ( Indonesia , United Kingdom ) , one corrupt company ( Nike ) , one corrupt organisation ( FIFA )",Romance,Native
12341,unitedkingdom,"Most of these incidents are accidents , except for the pollution which needs better technology , drinking alcohol till you pass out or abusing drugs are intentional .",Romance,Native
12341,unitedkingdom,"Introduce a beverage & amp ; substance card , which allows limits to be set by medical professionals . Default limits set to the amount your body can take without damage , only to be reduced for abuse and medical conditions .",Romance,Native
12341,unitedkingdom,What did you expect from a PR expert with no medical knowledge running the NHS .,Romance,Native
12341,worldnews,An honest representative should n't be worried about public impression if they feel that what they are doing is truly correct .,Romance,Native
12341,worldnews,"Would n't it be quicker and cheaper to use Skype , or Google Hangouts for transparency .",Romance,Native
12341,propaganda,They also prevent people committing crime by using technology that does n't exist yet .,Romance,Native
12341,unitedkingdom,Jet identified itself . http : //www.foxnews.com/story/2008/05/23/tony-blair-jet-comes-within-minutes-being-shot-down-by-israeli-fighter-planes/,Romance,Native
12341,worldnews,We can always rely on Hamas to provide [ accurate data ] ( http : //www.memri.org/report/en/0/0/0/0/0/0/8076.htm ) to the UN .,Romance,Native
