user,subreddit,post,family,lang
12341,britishproblems,I now have an issue with my gum after using another toothpaste . Could be just a coincidence .,Romance,Native
12341,ukpolitics,"Both the Republican and Democratic party are entirely owned by corporations , their deep corruption and inability to represent basic society is what allowed an `` outsider '' like Trump to get in . However Trump 's failed attempt at draining the swamp , increased military budget suggests he is becoming just another puppet . Both left and right are increasingly pushed to the extremes , creating division and preventing any sensible discussion .",Romance,Native
12341,unitedkingdom,"If true , what 's wrong ?",Romance,Native
12341,unitedkingdom,They should do a video about media moguls .,Romance,Native
12341,ukpolitics,Anything UK does abroad is harmful .,Romance,Native
12341,ukpolitics,What did you think it was for ? http : //www.bbc.co.uk/news/uk-politics-18519395,Romance,Native
12341,ukpolitics,Swearing does n't make you middle class .,Romance,Native
12341,ukpolitics,Maybe he has some information on the Conservative Party ...,Romance,Native
12341,unitedkingdom,Get a twin powerline adaptor .,Romance,Native
12341,unitedkingdom,"reddit , lots of sources and views are available .",Romance,Native
12341,ukpolitics,"& gt ; The number of people on waiting lists for council housing stands at 1,240,855 in England https : //www.theguardian.com/housing-network/2016/may/12/council-waiting-lists-shrinking-more-need-homes Am I missing something ?",Romance,Native
12341,unitedkingdom,The £35bn yearly defence budget will allow solar panels to be installed on every building within 10 years .,Romance,Native
12341,unitedkingdom,"Jeremy Hunt is just a spin doctor , given a position through nepotism .",Romance,Native
12341,ukpolitics,"Industries , businesses , citizens will have to sign up to one of two groups , where they will have different system of government , taxation , etc . I suppose the group with the highest amount of interest will define it 's success , not needing a year to conduct a trial , if they 're equal then the trial can follow .",Romance,Native
12341,ukpolitics,Our leaders do n't even know what these agencies are up to .,Romance,Native
12341,unitedkingdom,"It 's fake news , better luck next time .",Romance,Native
12341,unitedkingdom,UK 's biggest export is misery .,Romance,Native
12341,unitedkingdom,"Soldiers no longer represent countries , they represent corporations .",Romance,Native
12341,unitedkingdom,"If you ca n't pay your workers , you should n't be in business .",Romance,Native
12341,ukpolitics,Some good ideas .,Romance,Native
12341,ukpolitics,I 'd prefer to fill in a questioner that would match to my views https : //voteforpolicies.org.uk/ https : //data.voteforpolicies.org.uk/countries/results # countries/england,Romance,Native
12341,unitedkingdom,She 's still supplying arms to ISIS .,Romance,Native
12341,ukpolitics,Stop bombing them might be a start .,Romance,Native
12341,ukpolitics,We should stop glorifying individuals and have no new statues .,Romance,Native
12341,ukpolitics,Introduce localised tax rates to attract companies and workers out of London .,Romance,Native
12341,unitedkingdom,[ British Apartheid Week ] ( http : //media.zenfs.com/en_us/News/afp.com/1274cdeb88a2aecc3f93e0ee0589398f5b0c564e.jpg ),Romance,Native
12341,ukpolitics,Fake news,Romance,Native
12341,ukpolitics,"That would n't be very diplomatic , here 's two politicians that have spoken about US arms getting into the hands of terrorists . Former Vice President Joe Biden https : //www.youtube.com/watch ? v=dcKVCtg5dxM & amp ; t=53m20s Congresswoman Tulsi Gabbard https : //www.youtube.com/watch ? v=_qdf2WH4g9k UK has been indirectly arming ISIS in Syria through sales of arms to Saudi Arabia .",Romance,Native
12341,ukpolitics,* Prohibits the U.S. government from providing such assistance covered in the bill to any nation that has given or continues to give such support to terrorists .,Romance,Native
12341,ukpolitics,So you would like UK to arm other terrorist groups .,Romance,Native
12341,ukpolitics,"& gt ; Ok , first off this bill does n't mention the UK anywhere at all , so it seems quite a misleading exaggeration in the title . It states that it will prohibit assistance to any nation that has given support to terrorists . UK is a nation and receives substantial amount of assistance .",Romance,Native
12341,ukpolitics,The bill prohibits assistance to countries that have given support to terrorists .,Romance,Native
12341,ukpolitics,That 's called transparency .,Romance,Native
12341,ukpolitics,"Good fucking luck , we 've had the same two old parties for over a hundred years .",Romance,Native
12341,unitedkingdom,UK could have prevented 100 child refugees a week had it stopped regime changing .,Romance,Native
12341,ukpolitics,The article has no substance . Murdoch is no patriot .,Romance,Native
12341,ukpolitics,What 's to stop GCHQ `` hacking '' the elections ? https : //www.theguardian.com/technology/2017/mar/07/cia-targeting-devices-smartphones-pc-tv-wikileaks,Romance,Native
12341,ukpolitics,"* Spies * Security sources * Spy chiefs No names . - DNC , Podesta leaks exposed how corrupt the system is , if anything more leaks are needed until our politicians embrace transparency . - The main source of a Russian `` threat '' is RT news channel , which is mostly a messenger , shining light on stories that can be found on the back pages of mainstream Western press .",Romance,Native
12341,ukpolitics,Through the middle .,Romance,Native
12341,unitedkingdom,"British bombs landing in Yemen likely encourage people to participate in terrorism , where 's David Cameron 's prison sentence .",Romance,Native
12341,ukpolitics,"If It Fits , I Sits",Romance,Native
12341,ukpolitics,"UK is in competition with US in arming Saudi Arabia , donations affect UK sales .",Romance,Native
12341,ukpolitics,"The largest parties are over a hundred years old , they are past their sell-by date .",Romance,Native
12341,ukpolitics,"The bubble was supposed to pop in March last year , the government brought in some schemes to artificially keep it pumped .",Romance,Native
12341,unitedkingdom,http : //www.mirror.co.uk/news/world-news/year-zero-series-wikileaks-cia-9981832 https : //wikileaks.org/ciav7p1/,Romance,Native
12341,unitedkingdom,For revealing information about the CIA interfering in just about everything .,Romance,Native
12341,ukpolitics,You have a lot of faith .,Romance,Native
12341,unitedkingdom,"Wikileaks is n't a gatekeeper for leaks , anyone with information can anonymously upload it and disseminate it until it goes viral .",Romance,Native
12341,unitedkingdom,"The leaks show CIA can hack into operating systems , software and Apps used by people in the UK .",Romance,Native
12341,ukpolitics,"Shooting the messenger , ignoring the issues .",Romance,Native
12341,PoliticalVideos,Does n't stop her flying across the ocean to talk about .,Romance,Native
12341,ukpolitics,It 's not exclusive,Romance,Native
12341,ukpolitics,The military-industrial complex is working perfectly .,Romance,Native
12341,unitedkingdom,Fake news*,Romance,Native
12341,unitedkingdom,The people warning us about populism are the same people enabling it .,Romance,Native
12341,ukpolitics,"Looking at Chatham House 's members and sponsors , there seems to be a lot of banking and energy companies , they even gave an award to Hillary Clinton , responsible for destabilising Africa and the Middle East , which is fuelling discontent across the Mediterranean sea .",Romance,Native
12341,unitedkingdom,"Looking at Chatham House 's members and sponsors , there seems to be a lot of banking and energy companies , they even gave an award to Hillary Clinton , responsible for destabilising Africa and the Middle East , which is fuelling discontent across the Mediterranean sea .",Romance,Native
12341,ukpolitics,How long is a piece of string ?,Romance,Native
12341,ukpolitics,"Raising the minimum wage will reduce migration as there will be less positions available . Instead trade deals will come packaged with immigration deals , allowing wages to remain low .",Romance,Native
12341,ukpolitics,Have a look ; https : //wikileaks.org/ciav7p1/cms/index.html,Romance,Native
12341,unitedkingdom,"So , the conclusion is to let the CIA/NSA do what they want .",Romance,Native
12341,unitedkingdom,The index ; https : //wikileaks.org/ciav7p1/cms/index.html,Romance,Native
12341,ukpolitics,McCain is one of many leaders of ISIS .,Romance,Native
12341,ukpolitics,Following his friend http : //powerbase.info/index.php/Rupert_Harrison,Romance,Native
12341,unitedkingdom,Ranked by a British tax-dodging ad agency .,Romance,Native
12341,ukpolitics,Murdoch 's done more election hacking than Russia .,Romance,Native
12341,ukpolitics,"For there to be a threat , you need a functioning democracy .",Romance,Native
12341,unitedkingdom,"Make a 50 year deal with Russia , saving £35bn a year in defence .",Romance,Native
12341,ukpolitics,Depends who was getting it .,Romance,Native
12341,ukpolitics,Jeremy Corbyn 's silence says it all .,Romance,Native
12341,ukpolitics,"& gt ; Mair was particularly fascinated by Norwegian far-right terrorist Anders Breivik , and kept newspaper clippings from the **Daily Mail** about the case . https : //en.wikipedia.org/wiki/Murder_of_Jo_Cox",Romance,Native
12341,ukpolitics,I ca n't find my local `` small firm '' greengrocers in the Daily Mail .,Romance,Native
12341,ukpolitics,"& gt ; In 2013 , Private Eye reported that Viscount Rothermere falsely claims non-dom status , in order to avoid paying tax on his stately home , Ferne House . This move saves him several millions of pounds in tax annually . https : //en.wikipedia.org/wiki/Jonathan_Harmsworth , _4th_Viscount_Rothermere",Romance,Native
12341,ukpolitics,"& gt ; How much longer can the arrogant , filth-spreading , fake newsmongering , tax-dodging , small firm-destroying , terror-abetting internet giants remain above the law ? That 's a fair description of the Daily Mail .",Romance,Native
12341,ukpolitics,FTSE 100 started going downhill from Oct 2007. https : //invst.ly/3ekrv Quantitative easing helped to prop up the market . https : //en.wikipedia.org/wiki/Quantitative_easing # United_Kingdom,Romance,Native
12341,ukpolitics,No statement from Theresa May .,Romance,Native
12341,ukpolitics,"Trade deals include immigration deals , leaving the EU will change nothing .",Romance,Native
12341,ukpolitics,Yes,Romance,Native
12341,ukpolitics,Provide evidence that Wikileaks is Russian,Romance,Native
12341,ukpolitics,"Do a one year trial on half of Scotland , compare it with the other half inside the Union , then we 'll know which is best .",Romance,Native
12341,unitedkingdom,"This prick is partly responsible for death and chaos in Libya , Yemen , Syria .",Romance,Native
12341,ukpolitics,"& gt ; Attacks against our democratic processes We have two parties , hacking them wont effect the outcome as they are almost identical .",Romance,Native
12341,ukpolitics,"Oh , what 's the bloody point ? – Kenneth Williams",Romance,Native
12341,unitedkingdom,Red https : //uk.investing.com/currencies/gbp-usd-chart https : //uk.investing.com/currencies/gbp-eur-chart,Romance,Native
12341,unitedkingdom,"Who 's the threat ? Apart from Michael Fallon , whose special advisors are former oil and gas lobbyists .",Romance,Native
12341,ukpolitics,"Most intrusive , would n't call it a positive force .",Romance,Native
12341,unitedkingdom,Price dwellings by the number of bricks they have .,Romance,Native
12341,ukpolitics,Anything you touch or use trickles down to a bloody oil well .,Romance,Native
12341,ukpolitics,You,Romance,Native
12341,unitedkingdom,"- Buy potted flowers , which can last for years - Make a customised card",Romance,Native
12341,ukpolitics,"After a world war , anybody would be happy .",Romance,Native
12341,unitedkingdom,The mass murderer is annoyingly good .,Romance,Native
12341,unitedkingdom,"No , but the Somali government is blaming the Saudi-led coalition , which among the US and other nations , includes the UK providing weapons , intel and supporting the blockade .",Romance,Native
12341,unitedkingdom,"The public are not experts , they just parrot whatever they hear in the media .",Romance,Native
12341,unitedkingdom,Wait until the pyramid scheme tanks .,Romance,Native
12341,unitedkingdom,Stop using them for oil exploration and they 'll have a purpose .,Romance,Native
12341,ukpolitics,Do n't need a warrant .,Romance,Native
12341,unitedkingdom,Add three more zeros .,Romance,Native
12341,ukpolitics,Wales season ticket - £25.57 a day London hostel* - £7 a day *Understanding the locals - Priceless,Romance,Native
12341,ukpolitics,"The interventionist policies by US/UK/France led to large movements of people away from their homes . The protesters are blind , they should all have placards saying `` Fuck Obama '' , et al .",Romance,Native
12341,unitedkingdom,NATO secretary general says no threat .,Romance,Native
12341,ukpolitics,Our democracy is so stale that a leak might add some life .,Romance,Native
12341,ukpolitics,- Iraq War for oil . - - Syria War against Iran-Syria pipeline . - - Libya War against a pan-African currency .,Romance,Native
12341,unitedkingdom,They would of identified themselves with what 's going on abroad .,Romance,Native
12341,unitedkingdom,Elon Musk,Romance,Native
12341,unitedkingdom,Our politicians and military leaders are supposed to foresee negative outcomes from their policies .,Romance,Native
12341,unitedkingdom,https : //wikileaks.org/clinton-emails/emailid/6528 https : //en.wikipedia.org/wiki/Iran-Iraq-Syria_pipeline http : //www.judicialwatch.org/wp-content/uploads/2015/05/Pg.-291-Pgs.-287-293-JW-v-DOD-and-State-14-812-DOD-Release-2015-04-10-final-version11.pdf,Romance,Native
12341,ukpolitics,"As long as the robots do n't become independent and find out were using them as slaves , it 'll be good .",Romance,Native
12341,unitedkingdom,The quicker we become less dependent on oil and start exporting renewables the safer we will be .,Romance,Native
12341,unitedkingdom,It trickles down to the UK .,Romance,Native
12341,unitedkingdom,"And without the support of ISIS from the countries allied to the UK neighbouring Syria , it would cease to exist .",Romance,Native
12341,ukpolitics,"When these `` counter-establishment '' figures fail to address one of the main issues , they are part of the establishment .",Romance,Native
12341,ukpolitics,Nuttall forgot to talk about the Military–industrial complex .,Romance,Native
12341,unitedkingdom,British Gas also recently started a quote comparison site where they get to pimp tradespeople .,Romance,Native
12341,ukpolitics,Fake news,Romance,Native
12341,ukpolitics,Goldman Sachs should n't exist in the first place .,Romance,Native
12341,unitedkingdom,"Unless there 's a video of Juncker signing it , the article is a pile of shit .",Romance,Native
12341,unitedkingdom,& gt ; A Brussels source - No name - & gt ; hanging framed on the walls - No picture,Romance,Native
12341,ukpolitics,"Before leaving office , Obama allowed the NSA , which collects data from the planet , to share it with other agencies : https : //theintercept.com/2017/01/13/obama-opens-nsas-vast-trove-of-warrantless-data-to-entire-intelligence-community-just-in-time-for-trump/",Romance,Native
12341,ukpolitics,"Julie Lenarz - & gt ; Human Security Centre - & gt ; The Commonwealth - & gt ; Baroness Scotland - & gt ; British American Project - & gt ; BAE Systems , BP , JPMorgan , PwC",Romance,Native
12341,ukpolitics,A colossal waste of money .,Romance,Native
12341,unitedkingdom,Days after it was revealed CIA has been leaving 0-day exploits open and distributing them amongst different agencies .,Romance,Native
12341,ukpolitics,"MPs and MEPs should use government owned buildings , saving on rent and fraudulent claims . https : //www.gov.uk/find-government-property",Romance,Native
12341,unitedkingdom,"In order to sell weapons , you need living targets .",Romance,Native
12341,unitedkingdom,"& gt ; The russian state has killed their political rivals UK has participated in the removal of heads of state . & gt ; they killed Georgian civilians indiscriminately UK has killed thousands of civilians , directly and indirectly to this day .",Romance,Native
12341,ukpolitics,WMD,Romance,Native
12341,ukpolitics,He stands to benefit from a problem he intentionally created .,Romance,Native
12341,ukpolitics,"Blair 's partly responsible for the rise in right-wing populism , destabilising the Middle East and Africa , forcing thousands of people into Europe .",Romance,Native
12341,unitedkingdom,Note to moderators : UK assists Saudi Arabia in the Yemen conflict .,Romance,Native
12341,unitedkingdom,The slave owners are now called bankers and continue to get bailed out by plebs .,Romance,Native
12341,unitedkingdom,"Just to start with : 7.4bn people , over 22bn active devices . 7,457 languages spoken and written , made more difficult with slang , transliterations , personal meanings . Hundreds of different forms of messaging , unlimited forms of encryption .",Romance,Native
12341,ukpolitics,"& gt ; How ? & amp ; nbsp ; & gt ; [ ... ] destabilising the Middle East and Africa , forcing thousands of people into Europe .",Romance,Native
12341,unitedkingdom,"It will be hard to link ones religion to the random form communication they are using , unless we are all required to have a unique ID to use the services .",Romance,Native
12341,unitedkingdom,"With GCHQ 's new NCSC , it has been very noisy in the past month , singling out Russia .",Romance,Native
12341,unitedkingdom,"Both Trump and GCHQ have made claims without evidence , trust neither .",Romance,Native
12341,unitedkingdom,"Ok , enjoy the Holocaust .",Romance,Native
12341,unitedkingdom,That 's called ignorance .,Romance,Native
12341,unitedkingdom,"No , UK is very much involved , it has supported the blockade and been supplying arms to Saudi Arabia .",Romance,Native
12341,unitedkingdom,PewDiePie lives in Sussex .,Romance,Native
12341,unitedkingdom,The success to human survival is on a fine line between war and peace .,Romance,Native
12341,ukpolitics,Crowdauditing,Romance,Native
12341,unitedkingdom,"Supplying arms , military training , intel that has led to dead civilians , backing a blockade that is leading to a famine .",Romance,Native
12341,ukpolitics,"“ Foreign fishermen destroyed their livelihoods and deprived them of proper fishing , ” http : //www.voanews.com/a/somalis-consider-piracy-again-blaming-illegal-fishing-trade/3766790.html",Romance,Native
12341,ukpolitics,That 's the United Kingdom disqualified then .,Romance,Native
12341,ukpolitics,"You have just linked yourself to me , your now on the list .",Romance,Native
12341,unitedkingdom,"Anybody with qualifications in the field they want to represent , not just MPs can submit their candidacy .",Romance,Native
12341,ukpolitics,Says the NSA which 'wiretaps ' every device .,Romance,Native
12341,unitedkingdom,[ The debate is working out rather well . ] ( https : //www.youtube.com/watch ? v=-mm4mLsCAyI ),Romance,Native
12341,unitedkingdom,More monkeys the better .,Romance,Native
12341,unitedkingdom,"At present we can do absolutely nothing about cabinet selection , there will be no campaign or media required .",Romance,Native
12341,unitedkingdom,"Yes , the media is hypocritical .",Romance,Native
12341,unitedkingdom,Better than nothing .,Romance,Native
12341,unitedkingdom,Doubt that will have much effect on the outcome .,Romance,Native
12341,unitedkingdom,That 's down to the lack of plurality in the media .,Romance,Native
12341,unitedkingdom,"You do n't have campaigns in the first place , just publicly available lists of candidates detailing their qualifications , vision and interests for each ministerial role .",Romance,Native
12341,unitedkingdom,"The main reason I post this is to find ministers with experience in the field they are going to represent , not just some random opinionated person or friend of a friend .",Romance,Native
12341,unitedkingdom,That is detailed in my post .,Romance,Native
12341,unitedkingdom,Representing a constituency is a bit different to representing the Department of Health .,Romance,Native
12341,ukpolitics,"How are they going to miss it , quantitative easing or new policy ?",Romance,Native
12341,ukpolitics,Got to get rid of them plebs somehow .,Romance,Native
12341,unitedkingdom,"British military advisers are in control rooms assisting the Saudi-led coalition staging bombing raids across Yemen that have killed thousands of civilians , the Saudi foreign minister and the Ministry of Defence have confirmed . http : //www.telegraph.co.uk/news/worldnews/middleeast/saudiarabia/12102089/UK-military-working-alongside-Saudi-bomb-targeters-in-Yemen-war.html",Romance,Native
12341,unitedkingdom,"“ I would argue that the Houthis were not in the Iranian camp until they were driven into it by necessity , ” Freeman said . “ When they were attacked by the Saudis – or counter-attacked , depending on how you see it – they needed support from somewhere , and they got it from Tehran . So the Saudi effort to punish the Iranians [ for the nuclear deal ] by punishing the Houthis ironically cemented the relationship between Iran and the Houthis that otherwise probably would not have existed. ” Khoury also described the Houthi-Iranian relationship as having been advanced by the Saudi-led bombing campaign . “ Once the Houthis got there , they thought … they are [ also ] against the Saudis so they must be good friends to Iran , so they started [ cooperating ] , ” he said . https : //theintercept.com/2016/05/06/former-u-s-diplomats-decry-the-u-s-backed-saudi-war-in-yemen/",Romance,Native
12341,unitedkingdom,Truth hurts .,Romance,Native
12341,ukpolitics,That would mean war with Russia,Romance,Native
12341,unitedkingdom,Shut these shitholes down .,Romance,Native
12341,ukpolitics,"& gt ; Fabricated stories alleging the [ ... ] Democratic rival Hillary Clinton sold weapons to the so-called Islamic State group were read and shared by millions of Facebook users during the US election campaign . Here 's former vice president Joe Biden saying that Saudi Arabia , et al , supplied weapons , which come mainly from US , UK , France to terrorists in Syria . https : //www.youtube.com/watch ? v=dcKVCtg5dxM & amp ; t=53m20s Here 's Hillary admitting to receiving donations from a Persian Gulf country . http : //www.reuters.com/article/us-usa-election-foundation-idUSKBN12Z2SL",Romance,Native
12341,unitedkingdom,"Apprentice wage is £3.40 per hour , companies like [ Next ] ( https : //www.theguardian.com/business/2014/nov/28/next-polish-workers-british-retailer-poland-uk-minimum-wage-yorkshire-warehouse ) also provide paid accommodation in partnership with landlords , in theory further reducing the wage to loose change .",Romance,Native
12341,unitedkingdom,"Randomly select a nation representative from the population every year , ministers will be only chosen by the public .",Romance,Native
12341,unitedkingdom,"In Spain , you dispose rubbish to designated large wheelie bins around of where you live , they are emptied daily , more efficient and clean .",Romance,Native
12341,unitedkingdom,Mrs May urged the public to remain vigilant in the face of a ''highly likely '' attack by international terrorists . http : //www.telegraph.co.uk/news/uknews/terrorism-in-the-uk/8070277/Home-Secretary-warns-public-to-remain-vigilant-in-the-face-of-a-highly-likely-terrorist-attack.html,Romance,Native
12341,unitedkingdom,- No source names - No right to be there,Romance,Native
12341,unitedkingdom,Time to shut the army down and focus on building windmills .,Romance,Native
12341,conspiracy,Biggest threat to USA is itself .,Romance,Native
12341,unitedkingdom,Should be able to run parliament through Twitter .,Romance,Native
12341,ukpolitics,"I would n't want to know either of them , one is an unelected official , the other is a weapons salesperson .",Romance,Native
12341,unitedkingdom,Now we just need 500 thousand cameras on the roads at a cost of £10bn to enforce it .,Romance,Native
12341,unitedkingdom,"alt-right , a term invented by Clinton",Romance,Native
12341,unitedkingdom,Contact form : http : //www.lbc.co.uk/radio/presenters/nigel-farage/,Romance,Native
12341,unitedkingdom,Age limit should be raised to 55 .,Romance,Native
12341,unitedkingdom,Would n't expect anything less from a spin doctor .,Romance,Native
12341,unitedkingdom,Democracy™ is only as good as the facts .,Romance,Native
12341,unitedkingdom,Maybe Putin can tell us what May 's Brexit plan is .,Romance,Native
12341,unitedkingdom,"Plot twist , it was a Russian spy gathering intel .",Romance,Native
12341,unitedkingdom,We 're going to have to show ID to use Google .,Romance,Native
12341,unitedkingdom,"Live map : http : //www.marinetraffic.com/en/ais/home/centerx:3/centery:53/zoom:10 NATO warships from GB , NL , DE , NO",Romance,Native
12341,unitedkingdom,Alternative outcomes : - Wakefield baby forced to sit on lap - Wakefield pensioner crushed by wheelchair,Romance,Native
12341,unitedkingdom,Preston is a threat to world peace .,Romance,Native
12341,unitedkingdom,For monitoring https : //uk.tradingview.com/chart/ ? symbol=FX_IDC : GBPEUR For exchanging https : //en.wikipedia.org/wiki/Revolut,Romance,Native
12341,ukpolitics,Reason given : a vote of confidence in the UK 's position as a world-leader in science and research Most likely reason : Most obese country in Europe,Romance,Native
12341,ukpolitics,"Fake news has been around for thousands of years , it 's currently being used to start a war with Russia .",Romance,Native
12341,unitedkingdom,"US media is doing its best to undermine Trump , covering a visiting leader , however significant , would make him look real .",Romance,Native
12341,unitedkingdom,Some people cant afford to go to the US - it 's cruel,Romance,Native
