user,subreddit,post,family,lang
12341,ukpolitics,Special advisors to Michael Fallon happen to be former lobbyists . https : //uk.linkedin.com/in/ben-mascall-530286a https : //uk.linkedin.com/in/james-wild-391495b,Romance,Native
12341,ukpolitics,"But our friends are arming ISIS . Qatar and Saudi Arabia , which are providing clandestine financial and logistic support to ISIL and other radical Sunni groups in the region . https : //wikileaks.org/podesta-emails/emailid/3774",Romance,Native
12341,POLITIC,She might stop funding and arming it .,Romance,Native
12341,unitedkingdom,"We did , right at the beginning . https : //wikileaks.org/plusd/cables/06DAMASCUS5399_a.html",Romance,Native
12341,conspiracy,"The economy for the few , the wealthy , that will remain beneficial to the few , while the economy of the majority get tweaks to their taxation , wages , hours , with the same end result .",Romance,Native
12341,conspiracy,"Yes , eating something and bringing it back up , looks different but its the same product .",Romance,Native
12341,unitedkingdom,"Qatar and Saudi Arabia , which are providing clandestine financial and logistic support to ISIL and other radical Sunni groups in the region . https : //wikileaks.org/podesta-emails/emailid/3774 BAE Systems has disclosed it is in talks over a multi-billion-pound arms contract with Saudi Arabia . http : //www.bbc.co.uk/news/business-37575599 12 civilians were killed , including a number of women and children , and several people injured following an alleged Coalition strike , according to local reports . Raqqa is Being Silently Slaughtered reported that “ the family of Mohammad Abdallah al Borsan ” was “ martyred in its entirety ” A one year old girl named as Borsan Naser Al Ahmad Al Borsan ( pictured ) was among the dead . RBSS added that “ several members of Shawakha al Satam ’ s family “ were also killed “ following coalition plane raids. ” https : //airwars.org/civcas2016a/",Romance,Native
12341,ukpolitics,"Training requires weapons , if I was stuck in a refugee camp in Jordan , I 'd sell the weapons to buy a trip to Europe .",Romance,Native
12341,ukpolitics,Cameron is a war criminal .,Romance,Native
12341,ukpolitics,Peter Sutherland is the problem .,Romance,Native
12341,unitedkingdom,"Billionaires Rupert Murdoch , Viscount Rothermere , Richard Desmond complaining about millionaires .",Romance,Native
12341,unitedkingdom,BAE Systems does n't make money from Russian air strikes ?,Romance,Native
12341,unitedkingdom,"With Britain ranking 38 in the World Press Freedom Index , I 'd say its doing a horrible job .",Romance,Native
12341,POLITIC,"Hillary Clinton , first female commander-in-chief of the Islamic State of Iraq and the Levant .",Romance,Native
12341,ukpolitics,"Shows 31,553,728 confused voters .",Romance,Native
12341,ukpolitics,I prefer [ this chart ] ( https : //np.reddit.com/r/ukpolitics/comments/5b8xd0/how_the_uk_voted_in_the_eu_referendum/ ) .,Romance,Native
12341,ukpolitics,Nudge nudge wiki nudge nudge leaks,Romance,Native
12341,unitedkingdom,George Soros will make a killing .,Romance,Native
12341,ukpolitics,Boris would wank to that .,Romance,Native
12341,unitedkingdom,"One night stand , $ £€500 iPhone .",Romance,Native
12341,conspiracy,Go on holiday outside US jurisdiction .,Romance,Native
12341,unitedkingdom,"She does n't need saving , she is a multi-billionaire .",Romance,Native
12341,ukpolitics,The Experts™ are back .,Romance,Native
12341,unitedkingdom,"Apprentice wage 3.40 per hour , 30.60 for 9 hours a day , employer offers their own accommodation at 125 per week , 918 earnings a month , minus accommodation , 418 , actual wage is now 1.55 per hour .",Romance,Native
12341,unitedkingdom,Foreign company employing foreign slaves to house millionaires .,Romance,Native
12341,ukpolitics,"Blocking of torrent search engines has failed miserably , so will the multi-billion pound porn filter scheme .",Romance,Native
12341,unitedkingdom,"Most of Britain 's woes come from the Parliament , not the EU .",Romance,Native
12341,ukpolitics,These miserable humans are by-products of consecutive crappy governance .,Romance,Native
12341,Libertarian,"With so much CIA interference around the world , I ca n't tell what a revolution is any more .",Romance,Native
12341,unitedkingdom,We kill their parents and use them as slaves .,Romance,Native
12341,ukpolitics,"Betrayal , like those pledges made by the Leave campaign which have been swept under the carpet .",Romance,Native
12341,conspiracy,"Our leaders do , how else would they create artificial patriotism and ignorance .",Romance,Native
12341,unitedkingdom,Men have more things to talk about than football .,Romance,Native
12341,unitedkingdom,Men have more things to talk about than vehicles .,Romance,Native
12341,unitedkingdom,But they do n't know that you visited a certain website last night .,Romance,Native
12341,unitedkingdom,"Anything , why so negative ?",Romance,Native
12341,unitedkingdom,Diversity,Romance,Native
12341,unitedkingdom,Government policies do more harm than porn .,Romance,Native
12341,conspiracy,Keeping her mouth shut and watching Trump embarrass himself is the best option .,Romance,Native
12341,conspiracy,"Without scapegoats , politicians would be without job .",Romance,Native
12341,ukpolitics,"Thought it might of been about UK/US role in destabilising Syria , I was wrong .",Romance,Native
12341,unitedkingdom,Our leaders have tarnished anything to be proud of .,Romance,Native
12341,unitedkingdom,Same amount BBC is owned by the British government .,Romance,Native
12341,unitedkingdom,RT 's Max Keiser talked about RBS 's `` smash and grab unit '' a few days ago https : //www.youtube.com/watch ? v=axJRaUkJWtY,Romance,Native
12341,ukpolitics,RT 's Max Keiser talked about RBS 's `` smash and grab unit '' a few days ago https : //www.youtube.com/watch ? v=axJRaUkJWtY,Romance,Native
12341,unitedkingdom,Collusion,Romance,Native
12341,unitedkingdom,"http : //www.etymonline.com/index.php ? term=propaganda Modern political sense dates from World War I , not originally pejorative . Meaning `` material or information propagated to advance a cause , etc . '' is from 1929 . Podesta leak highlights relationship between Clinton campaign , State Dept . and journalists http : //www.washingtontimes.com/news/2016/oct/15/podesta-leak-highlights-relationship-between-clint/",Romance,Native
12341,conspiracy,No,Romance,Native
12341,unitedkingdom,It only took BBC eight hours to report it .,Romance,Native
12341,unitedkingdom,"RT has been very quick to publish Wikileaks information , while Western media has been beautifying it .",Romance,Native
12341,ukpolitics,A video of everything but the attack .,Romance,Native
12341,ukpolitics,"Near fifty-fifty outcome , both sides lied too , all for the sake of a bet by George Soros .",Romance,Native
12341,ukpolitics,All `` newspapers '' should be required by law to print the owners name and net worth on the front page of each publication .,Romance,Native
12341,ukpolitics,"When the EU bans members selling weapons to Saudi Arabia , I 'd believe that its serious about terrorism .",Romance,Native
12341,unitedkingdom,"By cutting his internet , they are interfering in the US election .",Romance,Native
12341,conspiracy,"It 's a PR agency using an Israeli narrative , that if Israel is destroyed , Islam will move onto Al-Andalus , etc . But one serious flaw is that Western leaders are funding and arming terrorists for their own gain .",Romance,Native
12341,conspiracy,"The top powers are ransacking Africa and the Middle East through coups , stealing natural resources such as food . Mediterranean countries have huge debts , bringing in dependents from across the sea will ensure the debt remains high , northern countries which have loaned the south money will continue in business . The wage depression will make people turn to right wing political parties , which will cause social unrest and a war with Russia .",Romance,Native
12341,ukpolitics,"Arron , go fuck yourself .",Romance,Native
12341,ukpolitics,"We may know that , others might not , it wo n't feature on Sky News ' ticker any time soon .",Romance,Native
12341,conspiracy,"I used to use topsy.com for searching Twitter and whatsthere.co to display Instagram pictures from any location on a map , API changes have made them useless , the search features offered by Twitter and Instagram are basic . It seems the Internet is getting smaller .",Romance,Native
12341,conspiracy,Seems to be intermittent .,Romance,Native
12341,ukpolitics,"They have been revealing information that should of already been public , our leaders should be transparent and accountable .",Romance,Native
12341,conspiracy,Outrage ? Most Brits do n't know about it .,Romance,Native
12341,conspiracy,Someone needs to bug CNN 's newsroom too see what they are up to .,Romance,Native
12341,ukpolitics,"All systems have flaws , including the current one , if the policy is not implementable , we have opposing parties to point that out .",Romance,Native
12341,unitedkingdom,"Too many peoples bets are at stake , the show must go on until she changes her mind .",Romance,Native
12341,ukpolitics,"Their SSL certificate has expired , nothing to worry about , press ADVANCED , then Proceed .",Romance,Native
12341,ukpolitics,If we voted for policies instead of personalities : 1 . Labour 2 . Green Party 3 . Liberal Democrats 4 . UKIP 5 . Conservatives https : //data.voteforpolicies.org.uk/countries/results # countries/england,Romance,Native
12341,conspiracy,"A society where everyone benefits from each other , where you work for free , but receive all basic needs such as a dwelling , food and healthcare for free .",Romance,Native
12341,LabourUK,I hope that van was full and she 's not wearing a North Face jacket .,Romance,Native
30503,GlobalOffensive,11/13 only got prodigy and Aztec wrong .,Romance,Native
30503,unitedkingdom,I agree especially considering I live nearby in Twickenham .,Romance,Native
30503,GlobalOffensive,Also remove or tone down the rain on the map .,Romance,Native
30503,GlobalOffensive,"It 's an international event but when looking at the arena , the overwhelming majority of people speak Russian better than English , so it makes complete sense for them to have priority there , only thing that can be done is to sort out the crowd sound pick-up system .",Romance,Native
30503,todayilearned,For execution 1 innocent person is too much .,Romance,Native
30503,GlobalOffensive,"I love counter strike , however I would n't consider it to be a sport the same way I would n't consider snooker or darts to be sports . Also the oxford dictionary agrees with me on this . http : //www.oxforddictionaries.com/definition/english/sport",Romance,Native
30503,todayilearned,"If it is similar to the UK 's ban on broadcasting 3 o'clock proper football games on a saturday , then it is quite effective at encouraging people to go to watch their local team live rather than stay at home and watch the big teams on telly . I 'm sure the circumstances are quite different though as the US is quite a bit larger making it harder to go see your local team at times .",Romance,Native
30503,todayilearned,And also some less intelligent people might be influenced or forced into admitting a crime they did n't do .,Romance,Native
30503,GlobalOffensive,"Fair enough , not really much to add to the discussion anyway .",Romance,Native
30503,GlobalOffensive,"Snooker I can possible see why , darts definitely not though .",Romance,Native
30503,Steam,"Yes I did , I 'll try that then , cheers .",Romance,Native
30503,soccer,"Also the fact that Wenger was starting to build the team around Fabragas until he pissed off by forcing his way out , then thinking he can come back and get a second chance , and then going to major rivals .",Romance,Native
30503,soccer,As one of those angry fans at the stadium . It is because it is a derby game that we have n't one in ages and recent games have had events that make it worse . Personally I hate Chelsea more than Spurs which helps make it worse as it is the match I look forward to the most when seeing the fixture list at the start of the season .,Romance,Native
30503,soccer,"Similar to last year for arsenal fans . Spurs and Chelsea were in the final , I ended up wanting Chelsea to win because a win for Spurs in the league cup would 've meant more to them .",Romance,Native
30503,soccer,I actually do n't mind the result .,Romance,Native
30503,london,"Although it was announced about a week ago , I 'm wondering what people think of it here . Personally I 'm not happy at all because I live very close to Kneller Hall ( I can see part of it from my bedroom ) . That along with the rugby stadia , makes the area much more interesting imo , so I 'm livid that they want to sell off the grade 2 listed building .",Romance,Native
30503,london,"Whilst that probably is the case , I just think it makes the area better and more interesting , e.g . just appreciating it whenever I walk past it . However I 'm not fully clued up on how much of a grade 2 listed building can be changed . So if the exterior is n't to be changed at all with little changes to the surrounding areas , then I guess it would be a decent compromise .",Romance,Native
30503,GlobalOffensive,"I 'm like 90 % sure JW was in the Epsilon team as he was one of the most controversial figures when WRTT beat ESC , I think flusha might of been apart of that team as well but I 'm not as sure .",Romance,Native
30503,london,It 's not easy on some lines plus the lines will still need to be maintained .,Romance,Native
30503,GlobalOffensive,"No one knows what KQLY was cheating in iirc , if you find evidence to prove otherwise please link it to me . Personally I have always said that vac banned players should be able to play after 2/3 years .",Romance,Native
30503,GlobalOffensive,"I 'm not disagreeing with what you just said , however the person I replied to claimed that he cheated in leagues , which we have no evidence for , unless I 'm missing something then please link me to it .",Romance,Native
30503,Gunners,No cause it 's a 3 o'clock kick off .,Romance,Native
30503,Gunners,"I agree with what everyone else is saying here , but I also want to say why the fuck are games being played at noon .",Romance,Native
30503,GlobalOffensive,He did mention in the world though . Although I know what you mean as it will be on US telly .,Romance,Native
30503,GlobalOffensive,"Well you would n't be able to do anything that round then cause you 're tabbed out . And you can still be killed , just not as easily .",Romance,Native
30503,GlobalOffensive,"And it is for that reason why I do n't think vac bans should be permanent , but rather last 2/3 years . This is because I think a ban should be long enough to ruin someone 's career but give them a second chance .",Romance,Native
30503,todayilearned,That does seem a bit shit .,Romance,Native
30503,GlobalOffensive,"If you play the game properly , e.g . not trolling , holding angles correctly , decent aim , playing around your team ( e.g . not over stacking a site ) . You can have someone that communicates , but also plays like an idiot , which personally annoys me a lot more . If someone who does n't communicate , but knows there place on the team because of it ( e.g . following strats instead of creating their own without telling anyone ) they can still be very helpful . Also if you ca n't communicate with your team mates it does n't mean you ca n't listen to what they say , although that does n't remove the language barrier .",Romance,Native
30503,GlobalOffensive,"Your second point seems a bit arbitrary . Anyway I have 1.5k hrs on the game , most of them with mates . However I have played a few albeit not many games by myself with little communication ( I usually give up communicating after a few rounds if no one else is ) , which we have won because we all played smart and knew what we were doing . I have also won games where I was in a group of 3/4 and the randoms did n't communicate , yet we won partly because he knew what he was doing , did n't interrupt us and held his own . Do you know that matchmaking ( which is what we are talking about right now ) is n't the highest level of cs and that not everyone needs to act like they are a professional playing the game in optimal conditions . What is hard to grasp around that .",Romance,Native
30503,GlobalOffensive,"Bloody hell , we are talking about matchmaking not bloody professional games . Do pro players search for a game with randoms and that is their team for the tournament , no you mong . Matchmaking is a completely different level , where you can play your best and not communicate . Do you expect 5 randoms on matchmaking to have pre set strats and anti strats like pros do , of course you bloody do n't . Your delusional if you believe you can use professional teams as an example for how matchmaking should be set out .",Romance,Native
30503,GlobalOffensive,"I usually play with mates , however on the off chance I do n't , I always use my microphone , unless as stated no one else does in like 4/5 rounds then I give up . My view is that not its not as black and white as everyone seems to think . And I can understand why some might not be able to/not want to talk in game .",Romance,Native
30503,unitedkingdom,"Part of the reason why commercial TV in the UK is n't as bad as the US is because the BBC holds the other providers to a higher standard . ITV and other commercial TV providers have to compete with BBC , so if the BBC were to go the standard will be lowered drastically .",Romance,Native
30503,unitedkingdom,"BBC definitely provides more than netflix , if you include things like their news service , education , radio and more .",Romance,Native
30503,unitedkingdom,"Fair enough , it was a pretty big assumption . Maybe I was over exaggerating , however I believe were the BBC to go the quality of other channels would decrease , but not as much as originally stated ( i.e . not to US levels , maybe somewhere inbetween ) . Also whilst I would like the BBC to continue , even as a media tax or something , for some reason I do n't see it happening , especially not in its current form . I do n't think it will disappear completely , however I can see certain parts of the BBC being cut , if the licence were to go . I know my comment seems a bit like a ramble , I did just quickly write it up as I have to leave soon , so somethings I wrote might contradict slightly or not make much sense .",Romance,Native
30503,Gunners,"It all depends how video replays is introduced . It 's not to do with the refs salary , but rather to do with how it would affect the game .",Romance,Native
30503,GlobalOffensive,"Well you need to be rank 3 to be able to play , which seems like it takes a lot of time , playing tedious , boring game modes .",Romance,Native
30503,GlobalOffensive,But sticker money is n't prize money . Also do you have a source for the sticker money being that much ?,Romance,Native
30503,GlobalOffensive,"TBF many English speaking 4mans wo n't call for the 5th , even if your the last one left . It is just that they use teamspeak instead . It 's annoying but it is annoying to ask 4 people to speak a non native language which they might not feel comfortable speaking . As I said it is annoying but sort of understandable imo .",Romance,Native
30503,GlobalOffensive,"I do n't give a shit about ranks including my own . However it seems a lot of people do and often times it is used to judge other peoples opinions , or even worse the whole topic of a thread changes because someone forgot to change their flair . Like who actually gives a shite , just remove them as they do n't add anything , except for bragging rights .",Romance,Native
30503,GlobalOffensive,"No need to overhaul it then , just add a new gamemode , casual competitive or something .",Romance,Native
30503,GlobalOffensive,Like they do in usual rounds right ? Do n't see why it would be any different in a knife round .,Romance,Native
30503,Gunners,"Well the chant came about before the premier league , the George Graham era I believe . I hate statistics that only apply to the premier league era , as football was created before 1992 .",Romance,Native
30503,Gunners,Not really considering that we were known for that mainly before the premier league era . Statistics that only apply to the premier league era are quite annoying imo .,Romance,Native
30503,GlobalOffensive,"It used to be a lot worse . Like it used to be incredibly hard to see anyone in graveyard because of the fence . It currently is my favourite map , but I can see why some people want some clutter to be removed , I still think banana is shite on the csgo version . However I like the fact that the map is quite small , with corridors and small pathways . For reference I do n't like cbble for many of the opposite reasons . However it is good that there is variety in the map pool , which allows different players and play styles to shine .",Romance,Native
30503,GlobalOffensive,I could be wrong but I 'm pretty sure it goes back to normal as soon as you tab back in .,Romance,Native
30503,GlobalOffensive,"This really pisses me off , because for some reason my second account does n't work anymore . The game just crashes as soon as I get into a server . This means I ca n't play with a few of my mates , unless I derank my main ( which I 'm not against doing ) .",Romance,Native
30503,GlobalOffensive,"I wish they gave more time to operation phoenix , I was like a couple of days of playing away from getting gold .",Romance,Native
30503,GlobalOffensive,I was just about to ask what footballer it was ...,Romance,Native
30503,Gunners,Well there is nothing interesting about this fixture . Makes complete sense to not put it on TV .,Romance,Native
30503,GlobalOffensive,Was n't it also Epsilon that picked up the team that is now Fnatic . The team that everyone thought was cheating against ESC ( I 'm not going to say if I think they did or not ) .,Romance,Native
30503,GlobalOffensive,"Well the fact that he has only played 5 hours should be irrelevant . You should read the comment and form an opinion on that , and chances are , what he said is bollocks but you do n't need to know his rank and hours played to form that opinion .",Romance,Native
30503,unitedkingdom,"As you said it is a personal thing , however I would n't say that the news has been replaced by other sites online , as BBC news is the go to website for news for many . As you mentioned it is a personal thing but I do listen to quite a bit of radio 4 and 6 and the only podcast I listen to is the football weekly by the guardian .",Romance,Native
30503,london,"Although the new ones are objectively better , I will miss the older trains , as I prefer them for some reason .",Romance,Native
30503,Music,"Yes , that 's how the ticket at the London Olympics were sold , iirc . It 's more fair than having tickets being sold for triple the price of second hand websites . I believe the artists/organisers should set the price they want people to pay , not the second hand sellers above that value and not an auction ( albeit that is n't as bad of an idea for second hand sellers )",Romance,Native
30503,unrealtournament,"As someone that has never played arena shooters before , I only recently found out about it from r/games . It has n't really been marketed yet as it is still in early development .",Romance,Native
30503,RandomActsOfGaming,Victoria II : 1437 FTL : Faster Than Light : 2964,Romance,Native
30503,SuggestALaptop,Do you know where the best place would be do look for a used laptop then ?,Romance,Native
30503,GlobalOffensive,"But in this case the event is only in one state , so it should n't matter right ?",Romance,Native
30503,Gunners,The classic youtube scouts .,Romance,Native
30503,soccer,Apart from the occasional minor delays I rarely have when using South-West trains there are hardly any issues I come across . I can usually find an alternative route if there is an issue with one line and there are never any cancellations I have not heard about before I started travelling .,Romance,Native
30503,soccer,Yh except for being up to 5 min late half the time I rarely have issue with them .,Romance,Native
30503,footballmanagergames,"Seems like no one choose sweeper as their main position , I would 've but I was too late .",Romance,Native
30503,unitedkingdom,"The issue is that they still get most of their money from paper copies , as online it is n't as profitable .",Romance,Native
30503,unitedkingdom,Well analogue clocks and watches are very prevalent .,Romance,Native
30503,london,"Especially that the Kingston route which he was on , usually uses the much older trains .",Romance,Native
30503,Music,"That song got me into listening to a lot of other blur songs , however I 'm still disappointed they have never released something similar to song 2 .",Romance,Native
30503,london,"The question is how are they expected to get money without a pay wall , if adverts are n't accepted and paper copies are decreasing .",Romance,Native
30503,london,You saying the numerous charity shops and betting agencies do n't interest you ?,Romance,Native
30503,Gunners,"Away fans ? Why would they like him , when he is dominating their team ?",Romance,Native
30503,todayilearned,A lot of languages use long scale which and there is a map on the wikipedia page .,Romance,Native
30503,Muse,"Cheers , I 'll try get to one of those corners then .",Romance,Native
30503,Muse,"Good to know , hopefully it will be similar for the o2 gig tomorrow .",Romance,Native
30503,soccer,What about before sky invented football ?,Romance,Native
30503,Muse,"As I 'm going today , I 'm gon na put my hopes down . Stockholm syndrome , hysteria , the small print , dead star and defector .",Romance,Native
30503,GlobalOffensive,Fun fact : You can be a good team mate without communicating .,Romance,Native
