user,subreddit,post,family,lang
30503,london,"I still think it would be better just to have the barriers open rather than have a system like that . If I had to wait ten minutes just to get some help because my ticket was n't working or I forgot to top up my oyster or if I missed my stop , I would just jump the barriers ( an option not available to many , leaving many more frustrating passengers I would imagine ) . Just keep it as it is , if the station is n't busy enough to have barrier do n't but have inspectors going through the train now and then or have inspectors waiting at a station exit now and then , which should be able to catch most repeat offenders . Or just have the barriers open during the day/ at peak times .",Romance,Native
30503,hearthstone,"Because his results mattered to his progression , so there was no incentive for him to purposely lose . However in some of the HGG games teams have been bringing shit decks when they have already been eliminated from the tournament , and other teams are relying on the results from those teams , so the matches still matter . Its like when in football , when a team finishes mid table and has nothing to play for at the end of the season , they do usually play worse , as there is no incentive for them to play well . However the manager ca n't go and put their full reserve or u18s team out , they still have to be perceived to be trying their best , especially if their result matters for the other team .",Romance,Native
30503,hearthstone,"I can check tomorrow if you need . However I believe there has been cases in football of teams getting in trouble for not fielding a full strength team , 1 or 2 reserve players will probably be okay , but a full team of reserves wont be .",Romance,Native
30503,hearthstone,"Each format has its issues , and if a team clearly does n't play to their best due to the match not mattering to them it does undermine the integrity of the competition .",Romance,Native
30503,reflex,"This is a fairly recent post from a dev on the forum fairly recently . http : //forums.reflexarena.com/index.php ? /topic/4390-we-need-to-talk-about-the-state-of-the-game/ & amp ; page=5 # comment-36030 I agree with what he said on the fact that I spent a fiver on a game with many hours put into it , so I should n't complain much , however I am still excited for any future updates .",Romance,Native
30503,hearthstone,"The thing is though the time before an expansion is the most boring , so if they hype it up with these festivals and ignore the month or so when the expansion is released then I think that is fine . Basically I hope they do become a trend even if it is only for the month leading up to an expansion .",Romance,Native
30503,hearthstone,"Well that explains why i went over the epic pity tracker for my old gods packs , and possibly why i am supposedly 3 packs away from the guaranteed legendary . Thought i made a mistake somewhere , but hopefully we 'll be compensated somehow .",Romance,Native
30503,hearthstone,Late response but I got an e-mail a couple hours ago basically saying I 'm going to get 2000 free dust . Which is nice although I would 've rather received a legendary earlier on from my old gods packs to then start saving gold for the new expansion ( my plan was to get 1 legendary then start saving ) . However now I get a legendary of my choice so I ca n't really complain .,Romance,Native
30503,hearthstone,"Thrall was the one I wanted the least , yet it 's the one I got .",Romance,Native
30503,hearthstone,"That 's basically me and getting golden Jaraxxus a few months back , ca n't bare to get rid of it yet , unlike when I got golden cenarius .",Romance,Native
30503,strafe,"Bit late but hopefully there are still some codes left . Anyway my favourite thing about 1996 was that the godfather of grime , Wiley started his music career in 1996 ( according to Wikipedia anyway , I was n't alive at the time to verify ) .",Romance,Native
30503,strafe,"Got it , cheers .",Romance,Native
30503,grime,"I was there as well and I personally liked the mosh pits . Always have liked them for some reason , although I do n't go to many grime gigs . But yeah I agree do n't push those on the outside into the pit .",Romance,Native
30503,ukpolitics,What about the older people that voted remain ? Less of them but why should they suffer because other people their age voted differently to them ?,Romance,Native
30503,london,"If they were to do that , I 'm sure all the fans will respectfully and calm fully disperse when they find out the match has been cancelled .",Romance,Native
30503,explainlikeimfive,"However some passengers do like having a guard on the train , and I do n't think southern were planning to reduce fares after getting rid of the guards . They are useful for helping people , using the ramps for disabled passengers , makes passenger feel safer , and are there for when it all goes tits up . A lot more needs to be done for them to go on long distance and many suburban roots . It works on the tube because of how frequent the trains are as well as how simple the routes are . For example when I worked at a train platform for a month there were times when disruption was occurring and the information boards were't accurate , the only person who could help us was the guard on the train .",Romance,Native
30503,buildapc,"# # # Build Ready : **What is your intended use for this build ? ** Gaming , I hope to play most modern games at around 100 fps on low-mid setting preferably at 1080p . More importantly I need to be able to play csgo at 200+ settings 1080p but at low settings . I might also try some basic streaming on less demanding games . **If gaming , what kind of performance are you looking for ? ( Screen resolution , FPS , game settings ) ** 100+ fps on modern games , 1080p , low-mid settings . **What is your budget ? ** Around £500 **In what country are you purchasing your parts ? ** UK **Post a draft of your potential build here ( specific parts please ) . ** [ PCPartPicker part list ] ( http : //uk.pcpartpicker.com/p/MwCct6 ) / [ Price breakdown by merchant ] ( http : //uk.pcpartpicker.com/p/MwCct6/by_merchant/ ) Type|Item|Price : -- -- | : -- -- | : -- -- **CPU** | [ AMD FX-6300 3.5GHz 6-Core Processor ] ( http : //uk.pcpartpicker.com/part/amd-cpu-fd6300wmhkbox ) | £79.19 @ Aria PC **Motherboard** | [ Gigabyte GA-970A-UD3P ATX AM3+ Motherboard ] ( http : //uk.pcpartpicker.com/part/gigabyte-motherboard-ga970aud3p ) | £65.89 @ Amazon UK **Memory** | [ Kingston Fury Black Series 8GB ( 1 x 8GB ) DDR3-1866 Memory ] ( http : //uk.pcpartpicker.com/part/kingston-memory-hx318c10fb8 ) | £39.76 @ More Computers **Storage** | [ Crucial BX100 250GB 2.5 '' Solid State Drive ] ( http : //uk.pcpartpicker.com/part/crucial-internal-hard-drive-ct250bx100ssd1 ) | £66.99 @ Amazon UK **Storage** | [ Seagate Barracuda 1TB 3.5 '' 7200RPM Internal Hard Drive ] ( http : //uk.pcpartpicker.com/part/seagate-internal-hard-drive-st1000dm003 ) | £37.44 @ Aria PC **Video Card** | [ Sapphire Radeon R9 280 3GB Dual-X Video Card ] ( http : //uk.pcpartpicker.com/part/sapphire-video-card-100373l ) |- **Case** | [ BitFenix Comrade ATX Mid Tower Case ] ( http : //uk.pcpartpicker.com/part/bitfenix-case-bfccom100wwxs1rp ) | £28.30 @ CCL Computers **Power Supply** | [ XFX 650W 80+ Bronze Certified Semi-Modular ATX Power Supply ] ( http : //uk.pcpartpicker.com/part/xfx-power-supply-p1650xxxb9 ) | £61.73 @ More Computers | *Prices include shipping , taxes , rebates , and discounts* | | **Total** | **£379.30** | Generated by [ PCPartPicker ] ( http : //pcpartpicker.com ) 2015-06-21 17:50 BST+0100 | **Additional details I need to know . ** 1 ) Are all the parts compatible . On pc part picker it says the following 'Some AMD 970 chipset motherboards may need a BIOS update prior to using Vishera CPUs . ' However I do n't know what any of that means and if it will affect me . 2 ) Am I missing any components . For example will I need extra cooling , thermal paste ( I keep reading about thermal paste , yet I am not 100 % sure what it is used for and if I will need it ) etc . 3 ) Will it meet my requirements I stated earlier and will it be able to play most new games for the next 2-3 years ( I do n't want to have to upgrade within 2 years ) . 4 ) Is it good value for money , or can I do a lot better for the money ? Thanks in advance for helping out someone with little knowledge on pc hardware .",Romance,Native
30503,buildapc,"Thanks to this subreddit I have recently built the following pc . http : //uk.pcpartpicker.com/p/MwCct6 Whilst I am very pleased with how it went in general , I am occasionally getting headaches from how loud the stock cpu cooler is . I was under the assumption that if I was n't going to overclock ( which I am not ) I would n't need to upgrade the cpu cooler . According to the cpu temperature this is correct however I can not stand the noise it makes . After looking around for after market cpu coolers I of course came across the cm 212 evo . And whilst it seems very good for the price it seems like I would have to take my motherboard out to install it . So I am looking for a cheap ( under £25 ) cpu cooler for my fx 6300 that has the same instillation method as the stock cooler and is a lot quieter than it .",Romance,Native
30503,buildapc,I built my PC last summer and have had no issues at all . However earlier on today I tried switching it on and nothing happens e.g . no fans no beep . I have already tried changing the fuse and the wire that plugs into the mains however I 'm not sure what to do now . PC components : Motherboard : gigabyte 970A-UD3P CPU : AMD fx 6300 GPU : AMD sapphire r8 280 PSU : XFX XXX edition semi modular 650w,Romance,Native
30503,buildapc,"I would like getting a second monitor as well as a laptop to be able to do college work away from my desk . So if it is possible I would like to be able kill two birds with one stone , otherwise getting a second monitor will have to wait for some time . I have done some research and I have concluded that I can use the mouse without borders programme , which would help for some uses . However I ca n't use that programme to put things like teamspeak , onto the laptop screen or move google chrome over to the laptop screen . So my question is there a laptop which you can easily use as a second monitor ( with the right cable connexions ) , or are there any programmes that allows you to simulate a laptop as a second monitor on a lan connexion or something . Sorry if this is the wrong sub , I 'm not sure where else to post it .",Romance,Native
30503,SuggestALaptop,"* **Total budget and country of purchase : ** From the UK with a £200-£300 budget . * **Do you prefer a 2 in 1 form factor , good battery life or best specifications to your requirements for the money ? Pick or include any that apply . ** Best specifications then battery life ( what is 2 in 1 form factor ? ) * **How important is weight to you ? ** Not that important as it will rarely leave the house , I will only need to take it up and down the stairs . * **Which OS do you require ? Windows , Linux , Mac . ** Windows 10 * **Do you have a preferred screen size ? If indifferent , put N/A . ** N/A * **Are you doing any CAD/video editing/photo editing/gaming ? List which programs/games you desire to run . If you have no requirements , put N/A . ** The most I plan to use it for is basic gaming such as football manager whilst , having microsoft word and chrome open , or football streams . * **If you 're gaming ( leave blank if you put N/A above ... ) , do you have certain games you want to play ? At what settings and FPS do you want ? ** As already mentioned I only really plan to play basic games such as football manager , maybe civilisation 5 or the binding of Isaac occasionally . For football manager I do n't require the 3d match engine and I would prefer to have quicker loading times . For the other two games 30 fps would be fine , but football manager is the priority . * **Any specific requirements such as good keyboard , reliable business grade build quality , touch-screen , finger-print reader , optical drive or good input devices ( keyboard/touchpad ) ? ** A decent keyboard is fairly important , does n't have to be anything special just decent . * **Leave any finishing thoughts here that you may feel are necessary and beneficial to the discussion . ** Cheers for the help .",Romance,Native
30503,LogitechG,"I created a support case for my faulty g400s , on the 3rd November , and sent a reminder email on the 12th November . However I am still yet to get a response . My mouse is constantly disconnecting so it is bloody frustrating , having to wait this long . P.S . What mouse is most like the g400 , as I am disappointed they do n't make them anymore .",Romance,Native
30503,Gunners,How it it cringeworthy ?,Romance,Native
30503,london,"For a barrier to be in operation there has to be someone at the barriers in case any issues occur ( e.g . ticket not being read ) . Most stations do n't have the barriers open all the time because of this ( at least for South West Trains ) , and I am not sure what a roving team is .",Romance,Native
30503,Games,Sounds proper fair to me . I just hope it is released on steam .,Romance,Native
30503,london,"You still need people at the station if there are barriers there . The money lost from the free riding is probably less than the cost to have barriers in operation at those stations , although I imagine they recoup a fair amount of money from ticket inspections .",Romance,Native
30503,unitedkingdom,"To add onto your point I actually read the article thinking it was a follow up to another shop where someone used the same name in Aylesbury . However this is a different case of someone using the name Singh ( s ) bury 's , so whilst not a chain it is relevant to what you where saying . Here is a link to the other article about the shop in Aylesbury . http : //www.bbc.co.uk/news/uk-england-beds-bucks-herts-38529780",Romance,Native
30503,soccer,Nah I want Bradford to win so I get another London away match . Northern / distant away days are fun but there will be loads of them next season .,Romance,Native
30503,unitedkingdom,"I 'm currently 18 and I would 've voted in the eu referendum and in the 2015 general election given the chance . However both times I understood and accepted that their needs to be a cut off line somewhere , and see no reason to lower it from 18 . Although if the voting age was lowered I would n't care that much to be honest , I just think 18 is good as is .",Romance,Native
30503,rs2vietnam,"I get a higher frame rate on rs2 than ro2/rs1 , and I 've got an amd 6300 cpu and an amd r8 280 gpu .",Romance,Native
30503,CasualUK,Seems like something that could affect someones confidence though . Like if they start doubting whether they can even remember the basic stuff properly . That is something that would likely affect me as I would trust the exam board more than my own memory and revision .,Romance,Native
30503,hearthstone,It 's moments like this which are a big reason why I still play the game . If I did n't pack Edwin or if I dusted him when I did pack him ( I was new to the game at the time and never saw the card before ) I am not sure I would still be playing . Combo decks are just well fun to play and are n't easy most of the time which is why I usually do n't get annoyed playing against them .,Romance,Native
30503,unitedkingdom,Yeah the only benefit to FPTP is that it makes up my mind on who to vote for . Where I live only the tories and lib dems can win so I do n't have to decide between labour or the lib dems . I still hate FPTP and electoral reform is one of the things I want most in politics .,Romance,Native
30503,AskReddit,"I think BBC radio 4 still plays God save the queen before the station switches off and changes to the BBC world service at around 1am . So it 's not a completely unseen thing in the UK anyway , and i can imagine TV stations did the same when they were n't on for 24hrs a day .",Romance,Native
30503,ukpolitics,"What about the younger people who do have jobs and pay taxes , or what about the older people who have never bought a house , not sure how travelling around the country is relevant either .",Romance,Native
30503,ukpolitics,"Legally they could be doing an apprenticeship . However some people at mine dropped out and just started working , no repercussions as far as I know .",Romance,Native
30503,ukpolitics,"18 mainly because there has to be a cut off line somewhere and I see no reason for it to be changed , and it lines up well with legal adult age being 18 . Also I would say there are many under 18s who are more well travelled than some who are over 25 .",Romance,Native
30503,unitedkingdom,Depends where you live though . The only benefit to FPTP is that it made my mind up on who to vote for as I live in a tory - lib dem marginal . Electoral reform is still something I desperately want however .,Romance,Native
30503,ukpolitics,Would this not lead to a by election though ? I 'm basing this off Winchester in 1997 where the lib dems won by two votes and they had a by election later in the year .,Romance,Native
30503,ukpolitics,"Personally I think AMS , the system used in London , Wales and Scotland already is better than STV . Good mixture of local candidates and PR imo .",Romance,Native
30503,RandomActsOfGaming,"SUPERHOT Black Mesa Gods Will Be Watching Stellaris Duck Game In that order , numbers are 1156 and 58439",Romance,Native
30503,london,"The Lib dems stepped down in 2 places , not exactly several .",Romance,Native
30503,RandomActsOfGaming,Nuclear Throne with Tower of Guns being the backup./ 583 http : //steamcommunity.com/profiles/76561198054841622/,Romance,Native
30503,AskReddit,I assume he is referring to what this video which I remember watching a long time ago is about . https : //www.youtube.com/watch ? v=2TtnD4jmCDQ & amp ; index=15 & amp ; list=PL96C35uN7xGLDEnHuhD7CTZES3KXFnwm0,Romance,Native
30503,unitedkingdom,"I 'm curious as to why , what information can they get from you listening to the radio , that you 're not comfortable about them getting ?",Romance,Native
30503,worldnews,One of the only websites where I disable my adblocker is for my local newspaper 's website . I ca n't imagine they 've got loads of cash to spare .,Romance,Native
30503,unitedkingdom,"Fair , I personally do n't mind the changes as I can see why they are doing it , although I do also understand the arguement that to listen to the radio does n't require a TV licence .",Romance,Native
30503,worldnews,"https : //en.wikipedia.org/wiki/List_of_newspapers_published_by_Newsquest That is the company that owns my local paper . Whilst they do n't own any of the major papers I understand they are still a big company . However if a paper is n't making them any money it would probably be one of the first to go if cuts were needed , and I would like to in general support my local newspaper because it is the only source for local news . Also if everyone used ad blockers then they are more likely to set up paywalls . Edit : looking a little bit futher the following paper owned by the same company stopped printing last year due to cuts , not something I wish to happen to my local paper . https : //en.wikipedia.org/wiki/Kingston_Guardian",Romance,Native
30503,ArenaFPS,"I am also on around 130 hours on reflex and I think one of the reasons I like it so much is that the movement is so good . The skill ceiling for the movement is so high so it is another important skill to learn , and it is usually fun to learn because of how fluent the movement is .",Romance,Native
30503,soccer,If Le Tissier won it then why ca n't Totti if he spends a couple of seasons elsewhere ? Le Tissier spent two seasons at Eastleigh after leaving Southampton .,Romance,Native
30503,hearthstone,"Nah these insults are well good . Way to funny to beat someone in a game and to make them start having a proper go at you . I proper hate games that try and limit communication and I would even like a chat feature in hs ( provided there is an option to disable it in the menu ) . Also with your last point , I personally believe there are much more important issue to solve in the game than this .",Romance,Native
30503,ArenaFPS,"A lot of people only play race , and a lot of people are n't interested in it at all . Especially with the the mappers and speed runners . Also server browsers help develop groups and communities , with people going back to the same servers . Because people go back to the same servers and get to know other people who also frequent those servers , which is very hard to do with matchmaking only . This is more prevalent with game modes such as race . Although reflex is probably quite far off that stage and I am not sure if it is a relevant point at all tbh . I just think it might help with recurring players for certain game modes helping player numbers .",Romance,Native
30503,ArenaFPS,"I see your point , but most game modes are n't for everyone , and duel needs less people for it to work , although duel probably appeals to a lot less people compared to team modes . But yeah it is a tough one , as it is hard trying to get other people to learn the ins and outs of 1v1 , but 1v1 is what defines arena shooters to many .",Romance,Native
30503,ArenaFPS,The server browser is needed for other gamemodes such as race .,Romance,Native
30503,buildapc,I really want them to make a new version of the g400 . I 'm absolutely buggered for when mine breaks .,Romance,Native
30503,Steam,"Got most of the games I want to play , except for EU4 .",Romance,Native
30503,worldnews,"We do have postal voting , however the flooding was at its worst on the polling day , so if you could n't make it the only other way to vote would be an emergency proxy vote . However I doubt it would 've affected the result too much .",Romance,Native
30503,london,I was thinking the same about Vauxhall .,Romance,Native
30503,footballmanagergames,What are the dates after 2020 ?,Romance,Native
30503,RandomActsOfGaming,Cheers for the giveaway .,Romance,Native
30503,Gunners,"As someone who often goes to AFC Wimbledon matches when I ca n't go to Arsenal ones , and someone who cares a lot about the lower leagues , I absolutely hate the change to the competition . It is blatant attack on lower league teams to benefit those in the premiership , so I respect the board members of Arsenal a lot more for rejecting the invite even if it is for differing reasons to mine .",Romance,Native
30503,FIFA,How has Buffon got the one club man ... Great player but has played for 2 clubs and its not like he transferred when he was a youth player either .,Romance,Native
30503,GlobalOffensive,"Where is the best place to download a pre-orange box version of source ? Edit : I was wondering if anyone had a specific link , but I 'll look for it on pirate bay or kat myself .",Romance,Native
30503,AdviceAnimals,"Whilst this did n't actually happen I can easily see a deaf person not caring or checking the volume metre in this situation , cause I imagine it is not something they check often .",Romance,Native
30503,unitedkingdom,"I going to need to find some more sports to watch after today , especially those that are on at 2 in the morning .",Romance,Native
30503,AskUK,I would say Richmond Hill however there are probably many other views I simply do n't know of .,Romance,Native
30503,readingfestival,What is the best way of finding out who could be performing in that slot beforehand ?,Romance,Native
30503,readingfestival,"Cheers , I guess if any solid info does occur it will be posted on this subreddit as well .",Romance,Native
30503,videos,"I do n't watch much telly , except for when the football is on . And the adverts around football matches are nearly always gambling ones , especially ones that mention the odds on the match about to be played . There 's also lottery adverts that are on quite often .",Romance,Native
30503,readingfestival,I 'm annoyed I did n't hear about their secret set until I got back . What was the crowd like . I wish I could 've heard their cover of shutdown as I was disappointed they did n't play it on the main stage .,Romance,Native
30503,readingfestival,"I do n't really rate Imagine Dragons and I was only there to get a good spot for RHCP , but I was really surprised and enjoyed the cover of song 2 they did .",Romance,Native
30503,todayilearned,Also part of the Basque region is in France iirc .,Romance,Native
30503,soccer,"I do like that Morecambe have a fairly new stadium with standing terraces . Although what was the reasoning for the move , according to wikipedia the grounds have the same capacity . I hope AFC Wimbledon 's new stadium can have at least one standing terrace , although that seems unlikely , according to current plans .",Romance,Native
30503,GlobalOffensive,The mousesports lineup that brought NIP to 14 rounds twice at Dreamhack winter 2012 had 2 Norwegians in the team iirc .,Romance,Native
30503,GlobalOffensive,Nah those two definitely did n't have steel in .,Romance,Native
30503,AskReddit,The amount of times I have clicked on a link without knowing it was an amazon link on reddit is quite high .,Romance,Native
30503,soccer,I thought Celtic were planning to increase the number of people that could stand there in the future e.g . 1.3 people per seat . I could be wrong do as my quick 5 minute research has n't found anything . Also does anyone know if you 're given a specific place to stand or if you can choose anywhere like in traditional standing terraces ?,Romance,Native
30503,Games,I live in the UK and I probably would assume it is a sky product without further context .,Romance,Native
30503,london,Well halloween is well close to guy fawkes night .,Romance,Native
